example_id,source_split,source_row_id,dialect,original_text,normalized_text,masked_text,mask_spans_json,mask_count,annotation_status,annotator_model,notes
mt_dial_egy_093e4b95,train,16795,DIAL_EGY,يارب مايكونش أول سلالة يأجوج,يارب مايكونش اول سلاله ياجوج,يارب مايكونش أول سلالة يأجوج,[],0,approved,,
mt_dial_glf_bbafc36b,train,7840,DIAL_GLF,وصراحة ماكرهت لاعب هلالي - وكلهم حبايبنا - مثل كرهي,وصراحه ماكرهت لاعب هلالي وكلهم حبايبنا مثل كرهي,وصراحة ماكرهت لاعب هلالي - وكلهم حبايبنا - مثل كرهي,[],0,approved,,
mt_dial_lev_49f8cd8d,train,54846,DIAL_LEV,الله بيصبر اهلة ولا حول ولا قوة الا,الله بيصبر اهله ولا حول ولا قوه الا,الله بيصبر اهلة ولا حول ولا قوة الا,[],0,approved,,
mt_msa_04b99f2b,train,48950,MSA,يشكر الامير بندر على شجاعته وصراحته وجهوده الكبيرة في مكافحة الفساد وان كنت اجد ان مكافحة الفساد تبدا بعلاج اسبابه فهل يمكن ان نشاهد يوما وزارة اسمها وزارة معالجة الفساد,يشكر الامير بندر علي شجاعته وصراحته وجهوده الكبيره في مكافحه الفساد وان كنت اجد ان مكافحه الفساد تبدا بعلاج اسبابه فهل يمكن ان نشاهد يوما وزاره اسمها وزاره معالجه الفساد,يشكر الامير [PERSON_1] على شجاعته وصراحته وجهوده الكبيرة في مكافحة الفساد وان كنت اجد ان مكافحة الفساد تبدا بعلاج اسبابه فهل يمكن ان نشاهد يوما وزارة اسمها وزارة معالجة الفساد,"[{""start"": 12, ""end"": 16, ""placeholder"": ""[PERSON_1]"", ""surface_form"": ""بندر"", ""mask_type"": ""PERSON""}]",1,approved,,
mt_dial_egy_731a6a5d,train,9455,DIAL_EGY,ياريت يكون واحد مدنى دارس علوم سياسيه وإستيراتيجيه وله رؤيه حتى يلم بالأخطار التى تواجه الأمن القومى المصرى والعربى,ياريت يكون واحد مدني دارس علوم سياسيه واستيراتيجيه وله رويه حتي يلم بالاخطار التي تواجه الامن القومي المصري والعربي,ياريت يكون واحد مدنى دارس علوم سياسيه وإستيراتيجيه وله رؤيه حتى يلم بالأخطار التى تواجه الأمن القومى المصرى والعربى,[],0,approved,,
mt_dial_glf_b91fce02,train,55737,DIAL_GLF,مثله بذلك مثل جيزواى اهلى مع كثرة مشاهدتهم تكتشف انهم مو لاعبين,مثله بذلك مثل جيزواي اهلي مع كثره مشاهدتهم تكتشف انهم مو لاعبين,مثله بذلك مثل جيزواى اهلى مع كثرة مشاهدتهم تكتشف انهم مو لاعبين,[],0,approved,,
mt_dial_lev_06d59eda,train,65963,DIAL_LEV,في وطني الحبيب الموظف الذي يتقاضى & # 1633 ; & # 1632 ; & # 1632 ; & # 1632 ; دينار شهرياً يدوب يروح يتفسح في العقبة,في وطني الحبيب الموظف الذي يتقاضي 1633 1632 1632 1632 دينار شهريا يدوب يروح يتفسح في العقبه,في وطني الحبيب الموظف الذي يتقاضى & # 1633 ; & # 1632 ; & # 1632 ; & # 1632 ; دينار شهرياً يدوب يروح يتفسح في [LOC_1],"[{""start"": 110, ""end"": 116, ""placeholder"": ""[LOC_1]"", ""surface_form"": ""العقبة"", ""mask_type"": ""LOC""}]",1,approved,,
mt_msa_62d2c843,train,62922,MSA,اللهم احفظه واحفظ أحبابه وأطل بعمره على الخير ،,اللهم احفظه واحفظ احبابه واطل بعمره علي الخير,اللهم احفظه واحفظ أحبابه وأطل بعمره على الخير ،,[],0,approved,,
mt_dial_egy_a286428a,train,2718,DIAL_EGY,وبلاش الحقد الدفين على النيابه,وبلاش الحقد الدفين علي النيابه,وبلاش الحقد الدفين على النيابه,[],0,approved,,
mt_dial_glf_a89705f5,train,35806,DIAL_GLF,تسلم السواعد السعودية اللي ما كلت ولا ملت من مساعدة اخوانها,تسلم السواعد السعوديه اللي ما كلت ولا ملت من مساعده اخوانها,تسلم السواعد السعودية اللي ما كلت ولا ملت من مساعدة اخوانها,[],0,approved,,
mt_dial_lev_f905e634,train,74611,DIAL_LEV,ضرائب - رسوم - ضريبة على الضريبة - غرامات - جمارك - فرض ضريبة كمان على البنزين يعني بدل ما ينخفض البنزين يرتفع سعره احنا بنستاهل اكتر من هيك كمان الاضراب,ضرايب رسوم ضريبه علي الضريبه غرامات جمارك فرض ضريبه كمان علي البنزين يعني بدل ما ينخفض البنزين يرتفع سعره احنا بنستاهل اكتر من هيك كمان الاضراب,ضرائب - رسوم - ضريبة على الضريبة - غرامات - جمارك - فرض ضريبة كمان على البنزين يعني بدل ما ينخفض البنزين يرتفع سعره احنا بنستاهل اكتر من هيك كمان الاضراب,[],0,approved,,
mt_msa_f1e5c2df,train,70506,MSA,وقع حادث تصادم في الساعات الأولى من صباح الجمعة بين قطار الركاب رقم 518 والقادم من الإسكندرية في طريقه إلى المنصورة وأحد القطارات الحربية بالقرب من مدينة دمنهور,وقع حادث تصادم في الساعات الاولي من صباح الجمعه بين قطار الركاب رقم 518 والقادم من الاسكندريه في طريقه الي المنصوره واحد القطارات الحربيه بالقرب من مدينه دمنهور,وقع حادث تصادم في [TIME_1] من [DATE_1] بين قطار الركاب رقم [ID_1] والقادم من [LOC_1] في طريقه إلى [LOC_2] وأحد القطارات الحربية بالقرب من مدينة [LOC_3],"[{""start"": 18, ""end"": 32, ""placeholder"": ""[TIME_1]"", ""surface_form"": ""الساعات الأولى"", ""mask_type"": ""TIME""}, {""start"": 36, ""end"": 47, ""placeholder"": ""[DATE_1]"", ""surface_form"": ""صباح الجمعة"", ""mask_type"": ""DATE""}, {""start"": 68, ""end"": 71, ""placeholder"": ""[ID_1]"", ""surface_form"": ""518"", ""mask_type"": ""ID""}, {""start"": 83, ""end"": 93, ""placeholder"": ""[LOC_1]"", ""surface_form"": ""الإسكندرية"", ""mask_type"": ""LOC""}, {""start"": 107, ""end"": 115, ""placeholder"": ""[LOC_2]"", ""surface_form"": ""المنصورة"", ""mask_type"": ""LOC""}, {""start"": 154, ""end"": 160, ""placeholder"": ""[LOC_3]"", ""surface_form"": ""دمنهور"", ""mask_type"": ""LOC""}]",6,approved,,
mt_dial_egy_4a8a8b8a,train,53092,DIAL_EGY,هل واحد مثل هذا الشخص كان يمكن له أن يجد لهو دور في النادي الأهلي ( نادي القرن ) ولذلك أحمد الله تعالي على أن نادي القرن لم يتذكره فى المئوية هذا الشخص عار على النادي الأهلي وبلسم على ناس تانيه هو ده اسلوبهم . . . وعجبي . .,هل واحد مثل هذا الشخص كان يمكن له ان يجد لهو دور في النادي الاهلي نادي القرن ولذلك احمد الله تعالي علي ان نادي القرن لم يتذكره في الميويه هذا الشخص عار علي النادي الاهلي وبلسم علي ناس تانيه هو ده اسلوبهم وعجبي,هل واحد مثل هذا الشخص كان يمكن له أن يجد لهو دور في [ORG_1] ( نادي القرن ) ولذلك أحمد الله تعالي على أن نادي القرن لم يتذكره فى المئوية هذا الشخص عار على [ORG_1] وبلسم على ناس تانيه هو ده اسلوبهم . . . وعجبي . .,"[{""start"": 52, ""end"": 65, ""placeholder"": ""[ORG_1]"", ""surface_form"": ""النادي الأهلي"", ""mask_type"": ""ORG""}, {""start"": 160, ""end"": 173, ""placeholder"": ""[ORG_1]"", ""surface_form"": ""النادي الأهلي"", ""mask_type"": ""ORG""}]",2,approved,,
mt_dial_glf_101a8860,train,78614,DIAL_GLF,اتق الله في نفسك يارجل كل هذا عشان حاول يوصل لمكتب الأحصاء الغير معترف فيه من فيفا !,اتق الله في نفسك يارجل كل هذا عشان حاول يوصل لمكتب الاحصاء الغير معترف فيه من فيفا,اتق الله في نفسك يارجل كل هذا عشان حاول يوصل لمكتب الأحصاء الغير معترف فيه من [ORG_1] !,"[{""start"": 78, ""end"": 82, ""placeholder"": ""[ORG_1]"", ""surface_form"": ""فيفا"", ""mask_type"": ""ORG""}]",1,approved,,
mt_dial_lev_06c2e6ab,train,8414,DIAL_LEV,بعد ان قرات مقتطفات من معظم التعليقات المنشورة على موقع الغد الغراء . . ارى ان معظمها للاخوة الوحداتيين . . يعني ماشاءالله الوحداتيين كلهم ادباء ومؤلفون . . اما الفيصلاويين فتجدهم نادرا ما يكتبون الا عندما يستدعي الامر ان نعلق عليه . . وليس على الطالعة,بعد ان قرات مقتطفات من معظم التعليقات المنشوره علي موقع الغد الغراء اري ان معظمها للاخوه الوحداتيين يعني ماشاءالله الوحداتيين كلهم ادباء ومولفون اما الفيصلاويين فتجدهم نادرا ما يكتبون الا عندما يستدعي الامر ان نعلق عليه وليس علي الطالعه,بعد ان قرات مقتطفات من معظم التعليقات المنشورة على موقع [ORG_1] الغراء . . ارى ان معظمها للاخوة الوحداتيين . . يعني ماشاءالله الوحداتيين كلهم ادباء ومؤلفون . . اما الفيصلاويين فتجدهم نادرا ما يكتبون الا عندما يستدعي الامر ان نعلق عليه . . وليس على الطالعة,"[{""start"": 56, ""end"": 60, ""placeholder"": ""[ORG_1]"", ""surface_form"": ""الغد"", ""mask_type"": ""ORG""}]",1,approved,,
mt_msa_1b77aa99,train,5257,MSA,الإنفعالات الغير مبررة هي التي تاتي بالبطاقة الحمراء والأصل أن يتحكم اللاعب بأعصابه ويهتم بما جاء من اجله وهو تمثيل ناديه ومنتخب بلاده . . . فلسنا في معركة ضرب وركل ولكن نريد أخلاق وتحمل وخدمة,الانفعالات الغير مبرره هي التي تاتي بالبطاقه الحمراء والاصل ان يتحكم اللاعب باعصابه ويهتم بما جاء من اجله وهو تمثيل ناديه ومنتخب بلاده فلسنا في معركه ضرب وركل ولكن نريد اخلاق وتحمل وخدمه,الإنفعالات الغير مبررة هي التي تاتي بالبطاقة الحمراء والأصل أن يتحكم اللاعب بأعصابه ويهتم بما جاء من اجله وهو تمثيل ناديه ومنتخب بلاده . . . فلسنا في معركة ضرب وركل ولكن نريد أخلاق وتحمل وخدمة,[],0,approved,,
mt_dial_egy_1c6cc2f9,train,83596,DIAL_EGY,يا رب نستفيد منة بس قبل ما نموت او على الاقل قبل ما الناس الى تعبوا وسهروا ووصلوا لهذا الاكتشاف المفيد,يا رب نستفيد منه بس قبل ما نموت او علي الاقل قبل ما الناس الي تعبوا وسهروا ووصلوا لهذا الاكتشاف المفيد,يا رب نستفيد منة بس قبل ما نموت او على الاقل قبل ما الناس الى تعبوا وسهروا ووصلوا لهذا الاكتشاف المفيد,[],0,approved,,
mt_dial_glf_80312551,train,17094,DIAL_GLF,تكفى لاتلعب رادوي خله للنهائي ان شاء,تكفي لاتلعب رادوي خله للنهايي ان شاء,تكفى لاتلعب [PERSON_1] خله للنهائي ان شاء,"[{""start"": 12, ""end"": 17, ""placeholder"": ""[PERSON_1]"", ""surface_form"": ""رادوي"", ""mask_type"": ""PERSON""}]",1,approved,,
mt_msa_3cf5788d,train,29202,MSA,العالم الاسلامي ينظر للمملكة العربية السعودية بلاد الحرمين ومنبع الرسالة الاسلامية على انها تسير على هدي ومنهج الرسول محمد صلى الله عليه,العالم الاسلامي ينظر للمملكه العربيه السعوديه بلاد الحرمين ومنبع الرساله الاسلاميه علي انها تسير علي هدي ومنهج الرسول محمد صلي الله عليه,العالم الاسلامي ينظر ل[LOC_1] بلاد الحرمين ومنبع الرسالة الاسلامية على انها تسير على هدي ومنهج الرسول [PERSON_1] صلى الله عليه,"[{""start"": 22, ""end"": 45, ""placeholder"": ""[LOC_1]"", ""surface_form"": ""لمملكة العربية السعودية"", ""mask_type"": ""LOC""}, {""start"": 118, ""end"": 122, ""placeholder"": ""[PERSON_1]"", ""surface_form"": ""محمد"", ""mask_type"": ""PERSON""}]",2,approved,,
mt_dial_egy_e44ff1f3,train,58715,DIAL_EGY,وده هيكون احسن طريقة للدعاية للتغيير عشان الناس هتقارن بينها وبين حكومة الجزب الوطني و الناس اكيد مع الوقت هيحسوا بالفرق و هيتفاعلوا,وده هيكون احسن طريقه للدعايه للتغيير عشان الناس هتقارن بينها وبين حكومه الجزب الوطني و الناس اكيد مع الوقت هيحسوا بالفرق و هيتفاعلوا,وده هيكون احسن طريقة للدعاية للتغيير عشان الناس هتقارن بينها وبين حكومة الجزب الوطني و الناس اكيد مع الوقت هيحسوا بالفرق و هيتفاعلوا,[],0,approved,,
mt_dial_glf_d69f561a,train,38301,DIAL_GLF,احسن واحد يشغل مخه ويشوف لنفسه مشروع بدل هاليون اللي تكسر,احسن واحد يشغل مخه ويشوف لنفسه مشروع بدل هاليون اللي تكسر,احسن واحد يشغل مخه ويشوف لنفسه مشروع بدل هاليون اللي تكسر,[],0,approved,,
mt_dial_lev_9a204bfe,train,20055,DIAL_LEV,كل التقدير و الإحترام لنجوم المنتخب الوطني و الله يوفقكو لترفعوا علم الأردن زي ما رفعتوه كثير,كل التقدير و الاحترام لنجوم المنتخب الوطني و الله يوفقكو لترفعوا علم الاردن زي ما رفعتوه كثير,كل التقدير و الإحترام لنجوم المنتخب الوطني و الله يوفقكو لترفعوا علم [LOC_1] زي ما رفعتوه كثير,"[{""start"": 69, ""end"": 75, ""placeholder"": ""[LOC_1]"", ""surface_form"": ""الأردن"", ""mask_type"": ""LOC""}]",1,approved,,
mt_msa_07c4ec09,train,53352,MSA,اقر الله بك اعين والديك ايتها الفتاة,اقر الله بك اعين والديك ايتها الفتاه,اقر الله بك اعين والديك ايتها الفتاة,[],0,approved,,
mt_dial_egy_80c3ec46,train,13096,DIAL_EGY,اولا ما يحدث فى خميس العهد هو شىء رمزى الكاهن بيبل قطعة قماش صغيرة بالماء ويرشم الصليب على مشط الرجل من تحت مكان الحذاء وللرجالة بس الستات فى الايد والجبهة دة كل,اولا ما يحدث في خميس العهد هو شيء رمزي الكاهن بيبل قطعه قماش صغيره بالماء ويرشم الصليب علي مشط الرجل من تحت مكان الحذاء وللرجاله بس الستات في الايد والجبهه ده كل,اولا ما يحدث فى [DATE_1] هو شىء رمزى الكاهن بيبل قطعة قماش صغيرة بالماء ويرشم الصليب على مشط الرجل من تحت مكان الحذاء وللرجالة بس الستات فى الايد والجبهة دة كل,"[{""start"": 16, ""end"": 26, ""placeholder"": ""[DATE_1]"", ""surface_form"": ""خميس العهد"", ""mask_type"": ""DATE""}]",1,approved,,
mt_dial_glf_97006930,train,54252,DIAL_GLF,اللي اعرفة ان نادي النصر موجود فقط لآنتظار مباراتة مع الكبير فريق,اللي اعرفه ان نادي النصر موجود فقط لانتظار مباراته مع الكبير فريق,اللي اعرفة ان نادي [ORG_1] موجود فقط لآنتظار مباراتة مع الكبير فريق,"[{""start"": 19, ""end"": 24, ""placeholder"": ""[ORG_1]"", ""surface_form"": ""النصر"", ""mask_type"": ""ORG""}]",1,approved,,
mt_msa_ab9bf16b,train,59939,MSA,يا اخي انت تحدثت عن مدرسة الفيصلي و كلمة مدرسة يجب ان تكون دقيقة و عن اي مدرسة,يا اخي انت تحدثت عن مدرسه الفيصلي و كلمه مدرسه يجب ان تكون دقيقه و عن اي مدرسه,يا اخي انت تحدثت عن مدرسة [ORG_1] و كلمة مدرسة يجب ان تكون دقيقة و عن اي مدرسة,"[{""start"": 26, ""end"": 33, ""placeholder"": ""[ORG_1]"", ""surface_form"": ""الفيصلي"", ""mask_type"": ""ORG""}]",1,approved,,
mt_dial_egy_3b283738,train,17692,DIAL_EGY,اه حجاب ونص كمان انتي شايفاه ايه,اه حجاب ونص كمان انتي شايفاه ايه,اه حجاب ونص كمان انتي شايفاه ايه,[],0,approved,,
mt_dial_glf_5489e9fd,train,79816,DIAL_GLF,الصراحة قمة كروية بمعنى الكلمة قوة هجوم التحمت مع قوة دفاع عن المنطقة . . . تركيز اللاعبين في المبارة كان شي مو طبيعي . . . والدليل ما فيه اي خطأ ارتكب من برشلونة ولا من,الصراحه قمه كرويه بمعني الكلمه قوه هجوم التحمت مع قوه دفاع عن المنطقه تركيز اللاعبين في المباره كان شي مو طبيعي والدليل ما فيه اي خطا ارتكب من برشلونه ولا من,الصراحة قمة كروية بمعنى الكلمة قوة هجوم التحمت مع قوة دفاع عن المنطقة . . . تركيز اللاعبين في المبارة كان شي مو طبيعي . . . والدليل ما فيه اي خطأ ارتكب من [ORG_1] ولا من,"[{""start"": 155, ""end"": 162, ""placeholder"": ""[ORG_1]"", ""surface_form"": ""برشلونة"", ""mask_type"": ""ORG""}]",1,approved,,
mt_dial_lev_8b7170da,train,57797,DIAL_LEV,خليك محلك احسن الك و النا مش,خليك محلك احسن الك و النا مش,خليك محلك احسن الك و النا مش,[],0,approved,,
mt_msa_8b150669,train,42424,MSA,السيد زياد عويس غني عن التعريف في مجال الاتصالات في,السيد زياد عويس غني عن التعريف في مجال الاتصالات في,السيد [PERSON_1] غني عن التعريف في مجال الاتصالات في,"[{""start"": 6, ""end"": 15, ""placeholder"": ""[PERSON_1]"", ""surface_form"": ""زياد عويس"", ""mask_type"": ""PERSON""}]",1,approved,,
mt_dial_egy_3e5ee073,train,34581,DIAL_EGY,احب اسال اين رئيس الجمهورية يشوف الشعب المصرى مضلوم من الحكومة والله حرام هنلقيها من المياة ةلا الكهربة ولا الحمة ولا المسؤلين منداة الى رئيس الجمهورية تدخل وارحم الغلابة الله,احب اسال اين رييس الجمهوريه يشوف الشعب المصري مضلوم من الحكومه والله حرام هنلقيها من المياه هلا الكهربه ولا الحمه ولا المسولين منداه الي رييس الجمهوريه تدخل وارحم الغلابه الله,احب اسال اين رئيس الجمهورية يشوف الشعب المصرى مضلوم من الحكومة والله حرام هنلقيها من المياة ةلا الكهربة ولا الحمة ولا المسؤلين منداة الى رئيس الجمهورية تدخل وارحم الغلابة الله,[],0,approved,,
mt_dial_glf_3bcc0a29,train,16490,DIAL_GLF,لو نتعلم منهم كيف نعاقب الارهابيين كان ماشفنا ارهابي واحد ببلدنا,لو نتعلم منهم كيف نعاقب الارهابيين كان ماشفنا ارهابي واحد ببلدنا,لو نتعلم منهم كيف نعاقب الارهابيين كان ماشفنا ارهابي واحد ببلدنا,[],0,approved,,
mt_dial_lev_87102791,train,80319,DIAL_LEV,اقسم بالله العظيم اني كنت اخد 10 دنانير مصروف اسبوعي ويشمل ذهاب واياب من عمان الى اربد . بصراحه ربنا يسرها واتخرجنا . علعموم هلحكي سنه,اقسم بالله العظيم اني كنت اخد 10 دنانير مصروف اسبوعي ويشمل ذهاب واياب من عمان الي اربد بصراحه ربنا يسرها واتخرجنا علعموم هلحكي سنه,اقسم بالله العظيم اني كنت اخد [NUM_1] دنانير مصروف اسبوعي ويشمل ذهاب واياب من [LOC_1] الى [LOC_2] . بصراحه ربنا يسرها واتخرجنا . علعموم هلحكي سنه,"[{""start"": 30, ""end"": 32, ""placeholder"": ""[NUM_1]"", ""surface_form"": ""10"", ""mask_type"": ""NUM""}, {""start"": 73, ""end"": 77, ""placeholder"": ""[LOC_1]"", ""surface_form"": ""عمان"", ""mask_type"": ""LOC""}, {""start"": 82, ""end"": 86, ""placeholder"": ""[LOC_2]"", ""surface_form"": ""اربد"", ""mask_type"": ""LOC""}]",3,approved,,
mt_msa_11489bb0,train,18368,MSA,خشية من نشوب نار الفتنة بين دبابتها لأن الفتان فتانا ولو في سيبيريا,خشيه من نشوب نار الفتنه بين دبابتها لان الفتان فتانا ولو في سيبيريا,خشية من نشوب نار الفتنة بين دبابتها لأن الفتان فتانا ولو في [LOC_1],"[{""start"": 60, ""end"": 67, ""placeholder"": ""[LOC_1]"", ""surface_form"": ""سيبيريا"", ""mask_type"": ""LOC""}]",1,approved,,
mt_dial_glf_a7e408a7,train,38128,DIAL_GLF,الحمدلله على العقل الله لا يبلانا,الحمدلله علي العقل الله لا يبلانا,الحمدلله على العقل الله لا يبلانا,[],0,approved,,
mt_dial_lev_bb6b88d9,train,30586,DIAL_LEV,على كل برغم فوزنا بس فيه اشيا لازم,علي كل برغم فوزنا بس فيه اشيا لازم,على كل برغم فوزنا بس فيه اشيا لازم,[],0,approved,,
mt_msa_82510da8,train,35222,MSA,وجبالها ولم اجد فبها هذه الشلالا,وجبالها ولم اجد فبها هذه الشلالا,وجبالها ولم اجد فبها هذه الشلالا,[],0,approved,,
mt_dial_egy_1a87a536,train,34966,DIAL_EGY,كمان فية مشكلة عندنا ان وسائل الاعلام عندنا بتخرج موضوعات محددة ومن جانب,كمان فيه مشكله عندنا ان وسايل الاعلام عندنا بتخرج موضوعات محدده ومن جانب,كمان فية مشكلة عندنا ان وسائل الاعلام عندنا بتخرج موضوعات محددة ومن جانب,[],0,approved,,
mt_dial_glf_b1abf5d5,train,28385,DIAL_GLF,والله لو يصير ازمة سكن في لبنان والا احدى الدول,والله لو يصير ازمه سكن في لبنان والا احدي الدول,والله لو يصير ازمة سكن في [LOC_1] والا احدى الدول,"[{""start"": 26, ""end"": 31, ""placeholder"": ""[LOC_1]"", ""surface_form"": ""لبنان"", ""mask_type"": ""LOC""}]",1,approved,,
