example_id,source_split,source_row_id,dialect,original_text,normalized_text,masked_text,mask_spans_json,mask_count,annotation_status,annotator_model,notes
mt_dial_lev_a24b8d0a,train,60193,DIAL_LEV,اه يا فيصلي اه كيف اخذت الدوري بجداره عنجد انك زعيم وانا كلي اسف لانه الوحدات رايح يروح من الحسين اربد الله يوفقك يا احمد مرعي وتسجل قولين زي ما عملو شباب الاردن اسود غمدان يا,اه يا فيصلي اه كيف اخذت الدوري بجداره عنجد انك زعيم وانا كلي اسف لانه الوحدات رايح يروح من الحسين اربد الله يوفقك يا احمد مرعي وتسجل قولين زي ما عملو شباب الاردن اسود غمدان يا,اه يا [ORG_1] اه كيف اخذت الدوري بجداره عنجد انك زعيم وانا كلي اسف لانه [ORG_2] رايح يروح من [ORG_3] الله يوفقك يا [PERSON_1] وتسجل قولين زي ما عملو [ORG_4] اسود غمدان يا,"[{""start"": 6, ""end"": 11, ""placeholder"": ""[ORG_1]"", ""surface_form"": ""فيصلي"", ""mask_type"": ""ORG""}, {""start"": 70, ""end"": 77, ""placeholder"": ""[ORG_2]"", ""surface_form"": ""الوحدات"", ""mask_type"": ""ORG""}, {""start"": 91, ""end"": 102, ""placeholder"": ""[ORG_3]"", ""surface_form"": ""الحسين اربد"", ""mask_type"": ""ORG""}, {""start"": 117, ""end"": 126, ""placeholder"": ""[PERSON_1]"", ""surface_form"": ""احمد مرعي"", ""mask_type"": ""PERSON""}, {""start"": 150, ""end"": 161, ""placeholder"": ""[ORG_4]"", ""surface_form"": ""شباب الاردن"", ""mask_type"": ""ORG""}]",5,approved,,
mt_msa_91a79d4f,train,79362,MSA,. . هل هذا مبرر للإستهتار بحرمات الله وأعراض الناس . .,هل هذا مبرر للاستهتار بحرمات الله واعراض الناس,. . هل هذا مبرر للإستهتار بحرمات الله وأعراض الناس . .,[],0,approved,,
mt_dial_egy_e11be5a9,train,39508,DIAL_EGY,أوعي حد يقول انه ده تحرش ده منتهي,اوعي حد يقول انه ده تحرش ده منتهي,أوعي حد يقول انه ده تحرش ده منتهي,[],0,approved,,
mt_dial_glf_6bf937e3,train,85099,DIAL_GLF,هذه مصيبه ياجماعه لازم ينضر في,هذه مصيبه ياجماعه لازم ينضر في,هذه مصيبه ياجماعه لازم ينضر في,[],0,approved,,
mt_dial_lev_9c935888,train,28795,DIAL_LEV,يعني من ايمتا لما ترسم المعلمه على ايدين الولاد صار وشم . . ول . . و بعدين يعني ما تحكمو عالمخلوقه الا لما تسمعو القصه من جهتها برضو انا متأكد انو القصه تافهه و المعلمه طالعه منها . . بس الله,يعني من ايمتا لما ترسم المعلمه علي ايدين الولاد صار وشم ول و بعدين يعني ما تحكمو عالمخلوقه الا لما تسمعو القصه من جهتها برضو انا متاكد انو القصه تافهه و المعلمه طالعه منها بس الله,يعني من ايمتا لما ترسم المعلمه على ايدين الولاد صار وشم . . ول . . و بعدين يعني ما تحكمو عالمخلوقه الا لما تسمعو القصه من جهتها برضو انا متأكد انو القصه تافهه و المعلمه طالعه منها . . بس الله,[],0,approved,,
mt_msa_5ab86f04,train,17091,MSA,الحمد لله والصلاة والسلام على رسول,الحمد لله والصلاه والسلام علي رسول,الحمد لله والصلاة والسلام على رسول,[],0,approved,,
mt_dial_egy_7d220730,train,2038,DIAL_EGY,ايمنامصلحة الفريق فوق اي كلام الاهلي فريق بطولات ومش عاوزين المنافسين يشمتوولاحتي نعطيهم,ايمنامصلحه الفريق فوق اي كلام الاهلي فريق بطولات ومش عاوزين المنافسين يشمتوولاحتي نعطيهم,ايمنامصلحة الفريق فوق اي كلام [ORG_1] فريق بطولات ومش عاوزين المنافسين يشمتوولاحتي نعطيهم,"[{""start"": 30, ""end"": 36, ""placeholder"": ""[ORG_1]"", ""surface_form"": ""الاهلي"", ""mask_type"": ""ORG""}]",1,approved,,
mt_dial_glf_e73d9974,train,68986,DIAL_GLF,أنا أهلاوي وأعشق الهلال لأنه فعلا فريق يشرف في أي بطوله يشارك بهاوبمشيئةالله نحتفل بالبطوله رقم ( 52 ) بعدما يحقق كأس الأبطال,انا اهلاوي واعشق الهلال لانه فعلا فريق يشرف في اي بطوله يشارك بهاوبمشييهالله نحتفل بالبطوله رقم 52 بعدما يحقق كاس الابطال,أنا أهلاوي وأعشق [ORG_1] لأنه فعلا فريق يشرف في أي بطوله يشارك بهاوبمشيئةالله نحتفل بالبطوله رقم ( [NUM_1] ) بعدما يحقق كأس الأبطال,"[{""start"": 17, ""end"": 23, ""placeholder"": ""[ORG_1]"", ""surface_form"": ""الهلال"", ""mask_type"": ""ORG""}, {""start"": 98, ""end"": 100, ""placeholder"": ""[NUM_1]"", ""surface_form"": ""52"", ""mask_type"": ""NUM""}]",2,approved,,
