example_id,source_split,source_row_id,dialect,original_text,normalized_text,masked_text,mask_spans_json,mask_count,annotation_status,annotator_model,notes
mt_msa_2853c217,train,36003,MSA,حقيقة وزارة الداخلية هي أكثر جهة تعمل على مكافحة المخدرات ليس لأنه من واجبها فقط فادئ الواجب يمكن أن يتم القيام به ولكن بدون إخلاص ويمكن أن يتم بدون إبداع ، وزارة الداخلية أمنت بكارثة وأزمة المخدرات والمشكلة إنها تعمل وحيدة وهي قادرة إن شاء الله على صد المخربين والمهربين والمروجين ولكن نحتاج من الجهات الاخرى التوعية نحتاج خلق جيل واعي فعلاً بأضرار المخدرات ، أتمنى لو مستشفى الأمل يكون عدة فرق طبية تشمل طبيب واخصائي اجتماعي واخصائي نفسي لتجوب المملكة وتنزل لتواجد الشباب وتعرفهم بأعراض,حقيقه وزاره الداخليه هي اكثر جهه تعمل علي مكافحه المخدرات ليس لانه من واجبها فقط فادي الواجب يمكن ان يتم القيام به ولكن بدون اخلاص ويمكن ان يتم بدون ابداع وزاره الداخليه امنت بكارثه وازمه المخدرات والمشكله انها تعمل وحيده وهي قادره ان شاء الله علي صد المخربين والمهربين والمروجين ولكن نحتاج من الجهات الاخري التوعيه نحتاج خلق جيل واعي فعلا باضرار المخدرات اتمني لو مستشفي الامل يكون عده فرق طبيه تشمل طبيب واخصايي اجتماعي واخصايي نفسي لتجوب المملكه وتنزل لتواجد الشباب وتعرفهم باعراض,حقيقة [ORG_1] هي أكثر جهة تعمل على مكافحة المخدرات ليس لأنه من واجبها فقط فادئ الواجب يمكن أن يتم القيام به ولكن بدون إخلاص ويمكن أن يتم بدون إبداع ، [ORG_1] أمنت بكارثة وأزمة المخدرات والمشكلة إنها تعمل وحيدة وهي قادرة إن شاء الله على صد المخربين والمهربين والمروجين ولكن نحتاج من الجهات الاخرى التوعية نحتاج خلق جيل واعي فعلاً بأضرار المخدرات ، أتمنى لو [ORG_2] يكون عدة فرق طبية تشمل طبيب واخصائي اجتماعي واخصائي نفسي لتجوب [LOC_1] وتنزل لتواجد الشباب وتعرفهم بأعراض,"[{""start"": 6, ""end"": 20, ""placeholder"": ""[ORG_1]"", ""surface_form"": ""وزارة الداخلية"", ""mask_type"": ""ORG""}, {""start"": 157, ""end"": 171, ""placeholder"": ""[ORG_1]"", ""surface_form"": ""وزارة الداخلية"", ""mask_type"": ""ORG""}, {""start"": 370, ""end"": 382, ""placeholder"": ""[ORG_2]"", ""surface_form"": ""مستشفى الأمل"", ""mask_type"": ""ORG""}, {""start"": 446, ""end"": 453, ""placeholder"": ""[LOC_1]"", ""surface_form"": ""المملكة"", ""mask_type"": ""LOC""}]",4,approved,,
mt_dial_egy_70f834ad,train,10022,DIAL_EGY,اللى مايعلموش الايام والليالى يعلموة ولاد ال 0000000 والتؤم ولاد 00 يستاهلو انك تكمل معاهم وكله خارج من سيفون الاهلى مجارىويلا خلوها 00000000 يازبالك ه,اللي مايعلموش الايام والليالي يعلموه ولاد ال 0000000 والتوم ولاد 00 يستاهلو انك تكمل معاهم وكله خارج من سيفون الاهلي مجاريويلا خلوها 00000000 يازبالك ه,اللى مايعلموش الايام والليالى يعلموة ولاد ال 0000000 والتؤم ولاد 00 يستاهلو انك تكمل معاهم وكله خارج من سيفون [ORG_1] مجارىويلا خلوها 00000000 يازبالك ه,"[{""start"": 110, ""end"": 116, ""placeholder"": ""[ORG_1]"", ""surface_form"": ""الاهلى"", ""mask_type"": ""ORG""}]",1,approved,,
mt_dial_glf_bfd6f05b,train,17635,DIAL_GLF,حاولو تصالحون عيب عليكم اكيد الواصل هو سبب المشاكل ويمكن الحل بيده ؟ ؟,حاولو تصالحون عيب عليكم اكيد الواصل هو سبب المشاكل ويمكن الحل بيده,حاولو تصالحون عيب عليكم اكيد الواصل هو سبب المشاكل ويمكن الحل بيده ؟ ؟,[],0,approved,,
mt_dial_lev_92fc205a,train,76489,DIAL_LEV,اللهم عافينا واعفو عنا يا رب العالمين . . . هاد قليل عليه الانتحار لازم تقطيع لحم جسمه والله هيك وقليل,اللهم عافينا واعفو عنا يا رب العالمين هاد قليل عليه الانتحار لازم تقطيع لحم جسمه والله هيك وقليل,اللهم عافينا واعفو عنا يا رب العالمين . . . هاد قليل عليه الانتحار لازم تقطيع لحم جسمه والله هيك وقليل,[],0,approved,,
mt_msa_55c8d1f4,train,82948,MSA,اماقولها دعك من الحديث عن الديمقراطية و ركز علي الهموم اليومية فهي فلسفة فارغة ايضا فمصر قد تعدت هذا الكلام الساذج منذ زمن فالحل الان هو ربط الاجتماعي بالسياسي و ترسيخ ثقافة ان تعديل الدستور لا ينفصل عن لقمة العيش و ان الديمقراطية جزء اصيل من الحق في حياة كريمة,اماقولها دعك من الحديث عن الديمقراطيه و ركز علي الهموم اليوميه فهي فلسفه فارغه ايضا فمصر قد تعدت هذا الكلام الساذج منذ زمن فالحل الان هو ربط الاجتماعي بالسياسي و ترسيخ ثقافه ان تعديل الدستور لا ينفصل عن لقمه العيش و ان الديمقراطيه جزء اصيل من الحق في حياه كريمه,اماقولها دعك من الحديث عن الديمقراطية و ركز علي الهموم اليومية فهي فلسفة فارغة ايضا ف[LOC_1] قد تعدت هذا الكلام الساذج منذ زمن فالحل الان هو ربط الاجتماعي بالسياسي و ترسيخ ثقافة ان تعديل الدستور لا ينفصل عن لقمة العيش و ان الديمقراطية جزء اصيل من الحق في حياة كريمة,"[{""start"": 85, ""end"": 88, ""placeholder"": ""[LOC_1]"", ""surface_form"": ""مصر"", ""mask_type"": ""LOC""}]",1,approved,,
mt_dial_glf_e81496bd,train,71686,DIAL_GLF,يستاهل وان شاء الله تكون هذه الترقيه في محلها وتعينه على ادا عمله والى لامام ان شاء,يستاهل وان شاء الله تكون هذه الترقيه في محلها وتعينه علي ادا عمله والي لامام ان شاء,يستاهل وان شاء الله تكون هذه الترقيه في محلها وتعينه على ادا عمله والى لامام ان شاء,[],0,approved,,
mt_dial_lev_ab71ca3e,train,82913,DIAL_LEV,للي بحكي انو حكي فاضي بحب احكيلوا انوا اي اشي لو بسيط يعبر عما بداخلنا يكون له اثر كبير فينا نحن القاعدين اللي ما بنعمل اشي وشاطرين بس,للي بحكي انو حكي فاضي بحب احكيلوا انوا اي اشي لو بسيط يعبر عما بداخلنا يكون له اثر كبير فينا نحن القاعدين اللي ما بنعمل اشي وشاطرين بس,للي بحكي انو حكي فاضي بحب احكيلوا انوا اي اشي لو بسيط يعبر عما بداخلنا يكون له اثر كبير فينا نحن القاعدين اللي ما بنعمل اشي وشاطرين بس,[],0,approved,,
mt_msa_f0f781bc,train,53958,MSA,اعتقد اننا بصدد تثبيت المسمار الاخير في نعش امريكا .,اعتقد اننا بصدد تثبيت المسمار الاخير في نعش امريكا,اعتقد اننا بصدد تثبيت المسمار الاخير في نعش [LOC_1] .,"[{""start"": 44, ""end"": 50, ""placeholder"": ""[LOC_1]"", ""surface_form"": ""امريكا"", ""mask_type"": ""LOC""}]",1,approved,,
mt_dial_glf_05ddfd4f,train,35648,DIAL_GLF,والاجانب متسدحه في قسم كبار,والاجانب متسدحه في قسم كبار,والاجانب متسدحه في قسم كبار,[],0,approved,,
