example_id,source_split,source_row_id,dialect,original_text,normalized_text,masked_text,mask_spans_json,mask_count,annotation_status,annotator_model,notes
mt_dial_egy_848f01de,train,27635,DIAL_EGY,ربنا ابتلانا بيكوا و لكن ظنى ان فرجه,ربنا ابتلانا بيكوا و لكن ظني ان فرجه,ربنا ابتلانا بيكوا و لكن ظنى ان فرجه,[],0,approved,,
mt_dial_glf_226c0940,train,71295,DIAL_GLF,قدها يا رجال الليث ولا صعب ولا مستحيل ان شاء,قدها يا رجال الليث ولا صعب ولا مستحيل ان شاء,قدها يا رجال الليث ولا صعب ولا مستحيل ان شاء,[],0,approved,,
mt_dial_lev_63335412,train,52786,DIAL_LEV,الف ترليون مبروك للاهلنا بجنين افتتاح الملعب البلدي الجديد وكلنا,الف ترليون مبروك للاهلنا بجنين افتتاح الملعب البلدي الجديد وكلنا,الف ترليون مبروك للاهلنا ب[LOC_1] افتتاح الملعب البلدي الجديد وكلنا,"[{""start"": 26, ""end"": 30, ""placeholder"": ""[LOC_1]"", ""surface_form"": ""جنين"", ""mask_type"": ""LOC""}]",1,approved,,
mt_msa_cd53bc50,train,79728,MSA,ويضيف : «أعتقد أن لمفهوم العلمانية دورا لا غنى عنه في إضاءة مفهوم الدولة الحديثة نفسه وتعيين مهماتها وآليات عملها وتمييزها عن مهمات السلطة الدينية ومسؤولياتها . ومن دون ذلك لا يستقيم معنى السياسة الحديثة ولا نصابها . كما أن لمفهوم العلمانية في نظري دورا مهما أيضا في التمييز بين المعرفة العلمية وكل أنواع العقائد والإيديولوجيات والمحاكمات المعيارية .,ويضيف اعتقد ان لمفهوم العلمانيه دورا لا غني عنه في اضاءه مفهوم الدوله الحديثه نفسه وتعيين مهماتها واليات عملها وتمييزها عن مهمات السلطه الدينيه ومسوولياتها ومن دون ذلك لا يستقيم معني السياسه الحديثه ولا نصابها كما ان لمفهوم العلمانيه في نظري دورا مهما ايضا في التمييز بين المعرفه العلميه وكل انواع العقايد والايديولوجيات والمحاكمات المعياريه,ويضيف : «أعتقد أن لمفهوم العلمانية دورا لا غنى عنه في إضاءة مفهوم الدولة الحديثة نفسه وتعيين مهماتها وآليات عملها وتمييزها عن مهمات السلطة الدينية ومسؤولياتها . ومن دون ذلك لا يستقيم معنى السياسة الحديثة ولا نصابها . كما أن لمفهوم العلمانية في نظري دورا مهما أيضا في التمييز بين المعرفة العلمية وكل أنواع العقائد والإيديولوجيات والمحاكمات المعيارية .,[],0,approved,,
mt_dial_egy_630f75be,train,31844,DIAL_EGY,حاجه تكسف بجد واحنا قاعدين هنا,حاجه تكسف بجد واحنا قاعدين هنا,حاجه تكسف بجد واحنا قاعدين هنا,[],0,approved,,
mt_dial_glf_f2c44347,train,13782,DIAL_GLF,لو يجي واحد يدافع عننا كأفراد بأخذ حقوقنا من التجار الذين لا رادع لهم مثل غلاء اسعار المواد الغذائية,لو يجي واحد يدافع عننا كافراد باخذ حقوقنا من التجار الذين لا رادع لهم مثل غلاء اسعار المواد الغذاييه,لو يجي واحد يدافع عننا كأفراد بأخذ حقوقنا من التجار الذين لا رادع لهم مثل غلاء اسعار المواد الغذائية,[],0,approved,,
mt_dial_lev_502546f9,train,17571,DIAL_LEV,ما بايدي احكي الا الله يكون بعونك ويبعتلك ولاد الحلال,ما بايدي احكي الا الله يكون بعونك ويبعتلك ولاد الحلال,ما بايدي احكي الا الله يكون بعونك ويبعتلك ولاد الحلال,[],0,approved,,
mt_msa_1179f96c,train,6707,MSA,، . ، حضرتك كلنا نعيش في ملك الرحمن ، . ، اخلينا الجنوب اللبناني ، . ، اشترينا من الناس و سددنا بما يرضي,حضرتك كلنا نعيش في ملك الرحمن اخلينا الجنوب اللبناني اشترينا من الناس و سددنا بما يرضي,، . ، حضرتك كلنا نعيش في ملك الرحمن ، . ، اخلينا [LOC_1] ، . ، اشترينا من الناس و سددنا بما يرضي,"[{""start"": 49, ""end"": 64, ""placeholder"": ""[LOC_1]"", ""surface_form"": ""الجنوب اللبناني"", ""mask_type"": ""LOC""}]",1,approved,,
mt_dial_egy_3e167451,train,41216,DIAL_EGY,عمرو زكي ييشتم بدون صوت,عمرو زكي ييشتم بدون صوت,[PERSON_1] ييشتم بدون صوت,"[{""start"": 0, ""end"": 8, ""placeholder"": ""[PERSON_1]"", ""surface_form"": ""عمرو زكي"", ""mask_type"": ""PERSON""}]",1,approved,,
mt_dial_glf_675e2d44,train,31644,DIAL_GLF,والله ساهر ما جا ال من بلاوي السعوديين السرعة قطع الاشارة تعدي خط المشاه وغيرها ولو انتظمنا لما احتجانا لمثل هذا النظام بس جا كم العلاج حتى تجديد الاستمارة ما يمكن الا بقرض من كثر المخالفات او الارخصة كذلك كذا التأديب ولا بلاش التأديب في,والله ساهر ما جا ال من بلاوي السعوديين السرعه قطع الاشاره تعدي خط المشاه وغيرها ولو انتظمنا لما احتجانا لمثل هذا النظام بس جا كم العلاج حتي تجديد الاستماره ما يمكن الا بقرض من كثر المخالفات او الارخصه كذلك كذا التاديب ولا بلاش التاديب في,والله [ORG_1] ما جا ال من بلاوي [LOC_1] السرعة قطع الاشارة تعدي خط المشاه وغيرها ولو انتظمنا لما احتجانا لمثل هذا النظام بس جا كم العلاج حتى تجديد الاستمارة ما يمكن الا بقرض من كثر المخالفات او الارخصة كذلك كذا التأديب ولا بلاش التأديب في,"[{""start"": 6, ""end"": 10, ""placeholder"": ""[ORG_1]"", ""surface_form"": ""ساهر"", ""mask_type"": ""ORG""}, {""start"": 29, ""end"": 38, ""placeholder"": ""[LOC_1]"", ""surface_form"": ""السعوديين"", ""mask_type"": ""LOC""}]",2,approved,,
mt_msa_3b2688d6,train,29656,MSA,مصنع ب 1 . 5 مليار وشركة سامسونج,مصنع ب 1 5 مليار وشركه سامسونج,مصنع ب [NUM_1] . [NUM_2] مليار وشركة [ORG_1],"[{""start"": 7, ""end"": 8, ""placeholder"": ""[NUM_1]"", ""surface_form"": ""1"", ""mask_type"": ""NUM""}, {""start"": 11, ""end"": 12, ""placeholder"": ""[NUM_2]"", ""surface_form"": ""5"", ""mask_type"": ""NUM""}, {""start"": 25, ""end"": 32, ""placeholder"": ""[ORG_1]"", ""surface_form"": ""سامسونج"", ""mask_type"": ""ORG""}]",3,approved,,
mt_dial_egy_eedde75e,train,67867,DIAL_EGY,انتي تهاجمين حمدي قنديل كأنه هو من باع اراضي مصر لهشام طلعت مصطفي وكأنما هو من عقد مع العدو الصهيوني اتفاقي الكويز ام حضرتك لا تعتبريه عدو ؟ وصديق ؟ وبيننا وبينهم سلام,انتي تهاجمين حمدي قنديل كانه هو من باع اراضي مصر لهشام طلعت مصطفي وكانما هو من عقد مع العدو الصهيوني اتفاقي الكويز ام حضرتك لا تعتبريه عدو وصديق وبيننا وبينهم سلام,انتي تهاجمين [PERSON_1] كأنه هو من باع اراضي [LOC_1] ل[PERSON_2] وكأنما هو من عقد مع العدو الصهيوني اتفاقي الكويز ام حضرتك لا تعتبريه عدو ؟ وصديق ؟ وبيننا وبينهم سلام,"[{""start"": 13, ""end"": 23, ""placeholder"": ""[PERSON_1]"", ""surface_form"": ""حمدي قنديل"", ""mask_type"": ""PERSON""}, {""start"": 45, ""end"": 48, ""placeholder"": ""[LOC_1]"", ""surface_form"": ""مصر"", ""mask_type"": ""LOC""}, {""start"": 50, ""end"": 65, ""placeholder"": ""[PERSON_2]"", ""surface_form"": ""هشام طلعت مصطفي"", ""mask_type"": ""PERSON""}]",3,approved,,
mt_dial_glf_5809a069,train,4500,DIAL_GLF,كويس انو الواحد يكون في عنده فعاليات مثل,كويس انو الواحد يكون في عنده فعاليات مثل,كويس انو الواحد يكون في عنده فعاليات مثل,[],0,approved,,
