example_id,source_split,source_row_id,dialect,original_text,normalized_text,masked_text,mask_spans_json,mask_count,annotation_status,annotator_model,notes
mt_dial_lev_d1d702e4,train,46917,DIAL_LEV,الف تحية وتحية تقدير واحترام لوحداتي من فلسطين وانشاء الله الكاس سيكتسح اللون الاخضر للموسم الثاني على,الف تحيه وتحيه تقدير واحترام لوحداتي من فلسطين وانشاء الله الكاس سيكتسح اللون الاخضر للموسم الثاني علي,الف تحية وتحية تقدير واحترام لوحداتي من [LOC_1] وانشاء الله الكاس سيكتسح اللون الاخضر للموسم الثاني على,"[{""start"": 40, ""end"": 46, ""placeholder"": ""[LOC_1]"", ""surface_form"": ""فلسطين"", ""mask_type"": ""LOC""}]",1,approved,,
mt_msa_1deadfb9,train,86158,MSA,يشكر مستشفى الملك خالد التخصصي للعيون وبالذات قسم الخدمة الاجتماعية وعلى رأسهم أ / فريال كردي مديرة,يشكر مستشفي الملك خالد التخصصي للعيون وبالذات قسم الخدمه الاجتماعيه وعلي راسهم ا فريال كردي مديره,يشكر [ORG_1] وبالذات قسم الخدمة الاجتماعية وعلى رأسهم أ / [PERSON_1] مديرة,"[{""start"": 5, ""end"": 37, ""placeholder"": ""[ORG_1]"", ""surface_form"": ""مستشفى الملك خالد التخصصي للعيون"", ""mask_type"": ""ORG""}, {""start"": 83, ""end"": 93, ""placeholder"": ""[PERSON_1]"", ""surface_form"": ""فريال كردي"", ""mask_type"": ""PERSON""}]",2,approved,,
mt_dial_egy_9f6944d9,train,68673,DIAL_EGY,طبعا امنية الاهلاوية شطب هيما لانة مولع فيهم النار وعارف خبياهم ونسيوا ان بطولات الاهلي نصفها اللي جايبهم ابراهيم وحسام ولسه علي ايديهم الزمالك اصبح مرعب علي فكرة النصف الثاني من البطولات يرجع الفضل فيه لعائلة عثمان محمود وسمير ومحمد حسام واحرقهم ياهيما,طبعا امنيه الاهلاويه شطب هيما لانه مولع فيهم النار وعارف خبياهم ونسيوا ان بطولات الاهلي نصفها اللي جايبهم ابراهيم وحسام ولسه علي ايديهم الزمالك اصبح مرعب علي فكره النصف الثاني من البطولات يرجع الفضل فيه لعايله عثمان محمود وسمير ومحمد حسام واحرقهم ياهيما,طبعا امنية الاهلاوية شطب [PERSON_1] لانة مولع فيهم النار وعارف خبياهم ونسيوا ان بطولات [ORG_1] نصفها اللي جايبهم [PERSON_2] و[PERSON_3] ولسه علي ايديهم [ORG_2] اصبح مرعب علي فكرة النصف الثاني من البطولات يرجع الفضل فيه لعائلة [PERSON_4] [PERSON_5] و[PERSON_6] و[PERSON_7] واحرقهم ياهيما,"[{""start"": 25, ""end"": 29, ""placeholder"": ""[PERSON_1]"", ""surface_form"": ""هيما"", ""mask_type"": ""PERSON""}, {""start"": 81, ""end"": 87, ""placeholder"": ""[ORG_1]"", ""surface_form"": ""الاهلي"", ""mask_type"": ""ORG""}, {""start"": 106, ""end"": 113, ""placeholder"": ""[PERSON_2]"", ""surface_form"": ""ابراهيم"", ""mask_type"": ""PERSON""}, {""start"": 115, ""end"": 119, ""placeholder"": ""[PERSON_3]"", ""surface_form"": ""حسام"", ""mask_type"": ""PERSON""}, {""start"": 136, ""end"": 143, ""placeholder"": ""[ORG_2]"", ""surface_form"": ""الزمالك"", ""mask_type"": ""ORG""}, {""start"": 210, ""end"": 215, ""placeholder"": ""[PERSON_4]"", ""surface_form"": ""عثمان"", ""mask_type"": ""PERSON""}, {""start"": 216, ""end"": 221, ""placeholder"": ""[PERSON_5]"", ""surface_form"": ""محمود"", ""mask_type"": ""PERSON""}, {""start"": 223, ""end"": 227, ""placeholder"": ""[PERSON_6]"", ""surface_form"": ""سمير"", ""mask_type"": ""PERSON""}, {""start"": 229, ""end"": 238, ""placeholder"": ""[PERSON_7]"", ""surface_form"": ""محمد حسام"", ""mask_type"": ""PERSON""}]",9,approved,,
mt_dial_glf_c6c557f6,train,64430,DIAL_GLF,وياليت كل رؤاسى الانديه مثل بن,وياليت كل رواسي الانديه مثل بن,وياليت كل رؤاسى الانديه مثل بن,[],0,approved,,
mt_dial_lev_a1bf7c34,train,154,DIAL_LEV,والله انو خبر على هالصباحية . . وعلى راي اخواننا السوريين ( بحط الاعل بالكف,والله انو خبر علي هالصباحيه وعلي راي اخواننا السوريين بحط الاعل بالكف,والله انو خبر على هالصباحية . . وعلى راي اخواننا السوريين ( بحط الاعل بالكف,[],0,approved,,
mt_msa_3059c1a7,train,69544,MSA,لحوم العلماء غير مسمومه من,لحوم العلماء غير مسمومه من,لحوم العلماء غير مسمومه من,[],0,approved,,
mt_dial_egy_54c5d6cd,train,81424,DIAL_EGY,يا أخي أختشي على دمك ذا أنت المعاقب و الموقوف 5 سنوات لسوء أخلاقك . ما أنت تربية حواري بلطجي بتاع سكاكين بلاش قلة أدب بقاء,يا اخي اختشي علي دمك ذا انت المعاقب و الموقوف 5 سنوات لسوء اخلاقك ما انت تربيه حواري بلطجي بتاع سكاكين بلاش قله ادب بقاء,يا أخي أختشي على دمك ذا أنت المعاقب و الموقوف [NUM_1] سنوات لسوء أخلاقك . ما أنت تربية حواري بلطجي بتاع سكاكين بلاش قلة أدب بقاء,"[{""start"": 46, ""end"": 47, ""placeholder"": ""[NUM_1]"", ""surface_form"": ""5"", ""mask_type"": ""NUM""}]",1,approved,,
mt_dial_glf_4563d57d,train,63468,DIAL_GLF,الفتاة اللي تطلع من غير محرم وش تبي الشباب يعملون لها يفرشون ورد وزهور . . . بالعكس محرمها مهملها . . تجد من يهتم فيها . . لا وبعدين لباس فاتن أكثر من شكلها لو كشفت غطاء وجهها . .,الفتاه اللي تطلع من غير محرم وش تبي الشباب يعملون لها يفرشون ورد وزهور بالعكس محرمها مهملها تجد من يهتم فيها لا وبعدين لباس فاتن اكثر من شكلها لو كشفت غطاء وجهها,الفتاة اللي تطلع من غير محرم وش تبي الشباب يعملون لها يفرشون ورد وزهور . . . بالعكس محرمها مهملها . . تجد من يهتم فيها . . لا وبعدين لباس فاتن أكثر من شكلها لو كشفت غطاء وجهها . .,[],0,approved,,
mt_dial_lev_bd89bcbb,train,69292,DIAL_LEV,يعني هسه تغيرت القضية وصارت كيدية . . وكأنه الموضوع صار بين طرفين ذو سوابق .,يعني هسه تغيرت القضيه وصارت كيديه وكانه الموضوع صار بين طرفين ذو سوابق,يعني هسه تغيرت القضية وصارت كيدية . . وكأنه الموضوع صار بين طرفين ذو سوابق .,[],0,approved,,
mt_msa_0d1c66c1,train,69714,MSA,وقع الأردن باصعب مجموعة تليها المجموعة الرابعة ، فاليابان والسعودية من اكثر الفرق خبرةً بالبطولة ومن اكثرهم فوزاً بها ، حتى الفريق السوري الحالي مستواه مرتفع جداً ومتطور,وقع الاردن باصعب مجموعه تليها المجموعه الرابعه فاليابان والسعوديه من اكثر الفرق خبره بالبطوله ومن اكثرهم فوزا بها حتي الفريق السوري الحالي مستواه مرتفع جدا ومتطور,وقع [LOC_1] باصعب مجموعة تليها المجموعة الرابعة ، ف[LOC_2] و[LOC_3] من اكثر الفرق خبرةً بالبطولة ومن اكثرهم فوزاً بها ، حتى الفريق السوري الحالي مستواه مرتفع جداً ومتطور,"[{""start"": 4, ""end"": 10, ""placeholder"": ""[LOC_1]"", ""surface_form"": ""الأردن"", ""mask_type"": ""LOC""}, {""start"": 50, ""end"": 57, ""placeholder"": ""[LOC_2]"", ""surface_form"": ""اليابان"", ""mask_type"": ""LOC""}, {""start"": 59, ""end"": 67, ""placeholder"": ""[LOC_3]"", ""surface_form"": ""السعودية"", ""mask_type"": ""LOC""}]",3,approved,,
mt_dial_egy_5ba74c6b,train,35519,DIAL_EGY,لا كل من لعب كورة,لا كل من لعب كوره,لا كل من لعب كورة,[],0,approved,,
mt_dial_glf_fcfa992e,train,46588,DIAL_GLF,والأجنبي اللي جا في عام 2008 ما بعد أمداه,والاجنبي اللي جا في عام 2008 ما بعد امداه,والأجنبي اللي جا في عام [DATE_1] ما بعد أمداه,"[{""start"": 24, ""end"": 28, ""placeholder"": ""[DATE_1]"", ""surface_form"": ""2008"", ""mask_type"": ""DATE""}]",1,approved,,
mt_dial_lev_9473dea6,train,79758,DIAL_LEV,طبعا نحن نعيش في فترة الفساد و الإختلاسات و النصب ، يعني ما بقدر أفهم شي أنو بعض الناس عنا في البلد بتركب سيارات بقيمة 100000 و مش قادرة تتبرع بخمسة دنانير لكل عائلة فقيرة ما إالهم إلا الله ! ! كل وزير بيجي بحط ب جيبتو مليون دبنار و ببني بيته على حساب المواطنين ! ! ! و الحكومة ساكتة ! ! ! نص الشعب الأردني مديونين للبنوك و مش ملحقين مصاريف ! ! ! لا يوجد عنا تأمين صحي أو تعليم مجانا ! ! 1 و بنفس الوقت بندفع ضريبة 16 % على المشتريات وكل هالمصاري اللي رايحة من الشعب وين بتروح ؟ ؟ وين دعم المواطن ؟ ؟ ليش إحنا حطينا شعار الأردن أولا ؟ ؟ ؟ ! !,طبعا نحن نعيش في فتره الفساد و الاختلاسات و النصب يعني ما بقدر افهم شي انو بعض الناس عنا في البلد بتركب سيارات بقيمه 100000 و مش قادره تتبرع بخمسه دنانير لكل عايله فقيره ما االهم الا الله كل وزير بيجي بحط ب جيبتو مليون دبنار و ببني بيته علي حساب المواطنين و الحكومه ساكته نص الشعب الاردني مديونين للبنوك و مش ملحقين مصاريف لا يوجد عنا تامين صحي او تعليم مجانا 1 و بنفس الوقت بندفع ضريبه 16 علي المشتريات وكل هالمصاري اللي رايحه من الشعب وين بتروح وين دعم المواطن ليش احنا حطينا شعار الاردن اولا,طبعا نحن نعيش في فترة الفساد و الإختلاسات و النصب ، يعني ما بقدر أفهم شي أنو بعض الناس عنا في البلد بتركب سيارات بقيمة [NUM_1] و مش قادرة تتبرع ب[NUM_2] دنانير لكل عائلة فقيرة ما إالهم إلا الله ! ! كل وزير بيجي بحط ب جيبتو [NUM_3] دبنار و ببني بيته على حساب المواطنين ! ! ! و الحكومة ساكتة ! ! ! نص الشعب الأردني مديونين للبنوك و مش ملحقين مصاريف ! ! ! لا يوجد عنا تأمين صحي أو تعليم مجانا ! ! [NUM_4] و بنفس الوقت بندفع ضريبة [NUM_5]% على المشتريات وكل هالمصاري اللي رايحة من الشعب وين بتروح ؟ ؟ وين دعم المواطن ؟ ؟ ليش إحنا حطينا شعار [LOC_1] أولا ؟ ؟ ؟ ! !,"[{""start"": 119, ""end"": 125, ""placeholder"": ""[NUM_1]"", ""surface_form"": ""100000"", ""mask_type"": ""NUM""}, {""start"": 144, ""end"": 148, ""placeholder"": ""[NUM_2]"", ""surface_form"": ""خمسة"", ""mask_type"": ""NUM""}, {""start"": 219, ""end"": 224, ""placeholder"": ""[NUM_3]"", ""surface_form"": ""مليون"", ""mask_type"": ""NUM""}, {""start"": 388, ""end"": 389, ""placeholder"": ""[NUM_4]"", ""surface_form"": ""1"", ""mask_type"": ""NUM""}, {""start"": 415, ""end"": 418, ""placeholder"": ""[NUM_5]"", ""surface_form"": ""16 "", ""mask_type"": ""NUM""}, {""start"": 521, ""end"": 527, ""placeholder"": ""[LOC_1]"", ""surface_form"": ""الأردن"", ""mask_type"": ""LOC""}]",6,approved,,
mt_msa_654440a9,train,53155,MSA,إنا سنمضي عنك لن نبقى هنا,انا سنمضي عنك لن نبقي هنا,إنا سنمضي عنك لن نبقى هنا,[],0,approved,,
mt_dial_egy_a446a4c5,train,82872,DIAL_EGY,انا ممكن اقوم الدنيا واقعدها لو حد قال كلمة حسنى بطريقة مش,انا ممكن اقوم الدنيا واقعدها لو حد قال كلمه حسني بطريقه مش,انا ممكن اقوم الدنيا واقعدها لو حد قال كلمة [PERSON_1] بطريقة مش,"[{""start"": 44, ""end"": 48, ""placeholder"": ""[PERSON_1]"", ""surface_form"": ""حسنى"", ""mask_type"": ""PERSON""}]",1,approved,,
mt_dial_glf_e9d1a100,train,78305,DIAL_GLF,اللجنه لاترى الا الهلال . ولو ان رادوي هو الي ضرب,اللجنه لاتري الا الهلال ولو ان رادوي هو الي ضرب,اللجنه لاترى الا [ORG_1] . ولو ان [PERSON_1] هو الي ضرب,"[{""start"": 17, ""end"": 23, ""placeholder"": ""[ORG_1]"", ""surface_form"": ""الهلال"", ""mask_type"": ""ORG""}, {""start"": 33, ""end"": 38, ""placeholder"": ""[PERSON_1]"", ""surface_form"": ""رادوي"", ""mask_type"": ""PERSON""}]",2,approved,,
mt_dial_lev_03bf666e,train,12721,DIAL_LEV,الله يوفقك يا فصيل عنجد كنت مكسب كبير للوحدات اطلب منك انك,الله يوفقك يا فصيل عنجد كنت مكسب كبير للوحدات اطلب منك انك,الله يوفقك يا [PERSON_1] عنجد كنت مكسب كبير ل[ORG_1] اطلب منك انك,"[{""start"": 14, ""end"": 18, ""placeholder"": ""[PERSON_1]"", ""surface_form"": ""فصيل"", ""mask_type"": ""PERSON""}, {""start"": 39, ""end"": 45, ""placeholder"": ""[ORG_1]"", ""surface_form"": ""لوحدات"", ""mask_type"": ""ORG""}]",2,approved,,
mt_msa_bc399336,train,57662,MSA,والله العظيم حرام نحن في المملكة العربية السعودية نعاني من سوء المستشفيات,والله العظيم حرام نحن في المملكه العربيه السعوديه نعاني من سوء المستشفيات,والله العظيم حرام نحن في [LOC_1] نعاني من سوء المستشفيات,"[{""start"": 25, ""end"": 49, ""placeholder"": ""[LOC_1]"", ""surface_form"": ""المملكة العربية السعودية"", ""mask_type"": ""LOC""}]",1,approved,,
mt_dial_egy_d3527c76,train,46118,DIAL_EGY,لكن اخوة بجد لة كل الاحترام فى تملك اعصابة فى ماتش زى دة وقع فية ظلم كبير وانتو عرفينة كويس,لكن اخوه بجد له كل الاحترام في تملك اعصابه في ماتش زي ده وقع فيه ظلم كبير وانتو عرفينه كويس,لكن اخوة بجد لة كل الاحترام فى تملك اعصابة فى ماتش زى دة وقع فية ظلم كبير وانتو عرفينة كويس,[],0,approved,,
mt_dial_glf_db6aedde,train,75762,DIAL_GLF,بس احلى شي مورينهو انه تهاوش مع فيكتور,بس احلي شي مورينهو انه تهاوش مع فيكتور,بس احلى شي [PERSON_1] انه تهاوش مع [PERSON_2],"[{""start"": 11, ""end"": 18, ""placeholder"": ""[PERSON_1]"", ""surface_form"": ""مورينهو"", ""mask_type"": ""PERSON""}, {""start"": 32, ""end"": 38, ""placeholder"": ""[PERSON_2]"", ""surface_form"": ""فيكتور"", ""mask_type"": ""PERSON""}]",2,approved,,
mt_dial_lev_49a21053,train,74716,DIAL_LEV,مشان الله ، مشان الله ارفعوا سعر اسطوانة,مشان الله مشان الله ارفعوا سعر اسطوانه,مشان الله ، مشان الله ارفعوا سعر اسطوانة,[],0,approved,,
mt_msa_bde1d45e,train,14981,MSA,والله من جد انتشر التدخين عند,والله من جد انتشر التدخين عند,والله من جد انتشر التدخين عند,[],0,approved,,
mt_dial_egy_6d637bd3,train,33600,DIAL_EGY,اللى بيقولوا انهم عرب يتكلمو عن نفسه و بلاش كلمه كلنا لان فيه كتير من السكان الاصليين لمصر اسلمو و اهلا بالباقيين و الجايين من اى مكان لانهم بيحبو,اللي بيقولوا انهم عرب يتكلمو عن نفسه و بلاش كلمه كلنا لان فيه كتير من السكان الاصليين لمصر اسلمو و اهلا بالباقيين و الجايين من اي مكان لانهم بيحبو,اللى بيقولوا انهم عرب يتكلمو عن نفسه و بلاش كلمه كلنا لان فيه كتير من السكان الاصليين ل[LOC_1] اسلمو و اهلا بالباقيين و الجايين من اى مكان لانهم بيحبو,"[{""start"": 87, ""end"": 90, ""placeholder"": ""[LOC_1]"", ""surface_form"": ""مصر"", ""mask_type"": ""LOC""}]",1,approved,,
mt_dial_glf_523074f7,train,85618,DIAL_GLF,كفو يالسلهام الله يزيدك من فضله أما النصر فأقول عينوا من الله خير عندكم مباراة مصيرية وتستضيفون,كفو يالسلهام الله يزيدك من فضله اما النصر فاقول عينوا من الله خير عندكم مباراه مصيريه وتستضيفون,كفو يالسلهام الله يزيدك من فضله أما [ORG_1] فأقول عينوا من الله خير عندكم مباراة مصيرية وتستضيفون,"[{""start"": 36, ""end"": 41, ""placeholder"": ""[ORG_1]"", ""surface_form"": ""النصر"", ""mask_type"": ""ORG""}]",1,approved,,
mt_msa_0a5f28f1,train,83296,MSA,سلمان وجنه الفردوس في الدائري الجنوبي ، ولا,سلمان وجنه الفردوس في الدايري الجنوبي ولا,سلمان وجنه الفردوس في الدائري الجنوبي ، ولا,[],0,approved,,
mt_dial_egy_0c926c26,train,12308,DIAL_EGY,معلش بدل يا يقعوا فى الحرام يا,معلش بدل يا يقعوا في الحرام يا,معلش بدل يا يقعوا فى الحرام يا,[],0,approved,,
mt_dial_glf_9072b97c,train,76572,DIAL_GLF,التي لا تصدر من لاعب محترف . وبسببها يأخذ الكروت الحمراء ويحرم,التي لا تصدر من لاعب محترف وبسببها ياخذ الكروت الحمراء ويحرم,التي لا تصدر من لاعب محترف . وبسببها يأخذ الكروت الحمراء ويحرم,[],0,approved,,
mt_dial_lev_d47c715a,train,1179,DIAL_LEV,وزارة التنميه الاجتماعيه بكافة موظفيها يدخنون بالوزاره نهارا جهارا وما حدا معبر حدا ولا معبر قانون وين التطبيق يا,وزاره التنميه الاجتماعيه بكافه موظفيها يدخنون بالوزاره نهارا جهارا وما حدا معبر حدا ولا معبر قانون وين التطبيق يا,[ORG_1] بكافة موظفيها يدخنون بالوزاره نهارا جهارا وما حدا معبر حدا ولا معبر قانون وين التطبيق يا,"[{""start"": 0, ""end"": 24, ""placeholder"": ""[ORG_1]"", ""surface_form"": ""وزارة التنميه الاجتماعيه"", ""mask_type"": ""ORG""}]",1,approved,,
mt_msa_439f13c1,train,43115,MSA,من رضى بما قسم له استراح قلبه,من رضي بما قسم له استراح قلبه,من رضى بما قسم له استراح قلبه,[],0,approved,,
mt_dial_egy_5d1cf1a8,train,85242,DIAL_EGY,الست المصرية زى الفراخ الفلاحى البلدى مش زى الصينية دول فراخ بيضة لكن البلدى بلدى واحنا اولى ببنات بلدى ولازم نشجع السلعة المصرية هشام ابو,الست المصريه زي الفراخ الفلاحي البلدي مش زي الصينيه دول فراخ بيضه لكن البلدي بلدي واحنا اولي ببنات بلدي ولازم نشجع السلعه المصريه هشام ابو,الست المصرية زى الفراخ الفلاحى البلدى مش زى الصينية دول فراخ بيضة لكن البلدى بلدى واحنا اولى ببنات بلدى ولازم نشجع السلعة المصرية [PERSON_1] ابو,"[{""start"": 130, ""end"": 134, ""placeholder"": ""[PERSON_1]"", ""surface_form"": ""هشام"", ""mask_type"": ""PERSON""}]",1,approved,,
mt_dial_glf_321d028f,train,21366,DIAL_GLF,"@ يا جماعة الربع اقسم بالله العظيم لو أني نصراوي , كان استحي اني اتكلم عن الكورة . . واخلي سوالفي كلها عن الكيرم والبلوت . . اصلاً لا قدر الله وصرت نصراوي بيكون ساعتها مالي وجه اتكلم عن حاجة ماني فالح فيها :",يا جماعه الربع اقسم بالله العظيم لو اني نصراوي كان استحي اني اتكلم عن الكوره واخلي سوالفي كلها عن الكيرم والبلوت اصلا لا قدر الله وصرت نصراوي بيكون ساعتها مالي وجه اتكلم عن حاجه ماني فالح فيها,"@ يا جماعة الربع اقسم بالله العظيم لو أني نصراوي , كان استحي اني اتكلم عن الكورة . . واخلي سوالفي كلها عن الكيرم والبلوت . . اصلاً لا قدر الله وصرت نصراوي بيكون ساعتها مالي وجه اتكلم عن حاجة ماني فالح فيها :",[],0,approved,,
mt_dial_lev_7f583af7,train,78188,DIAL_LEV,الاخ سيف بيتمنى فوز الحسين و ذلك لخوف الفيصلي من مواجهة الوحدات و تلقيه الخسارة التالتة على التوالي هذا الموسم,الاخ سيف بيتمني فوز الحسين و ذلك لخوف الفيصلي من مواجهه الوحدات و تلقيه الخساره التالته علي التوالي هذا الموسم,الاخ [PERSON_1] بيتمنى فوز [ORG_1] و ذلك لخوف [ORG_2] من مواجهة [ORG_3] و تلقيه الخسارة التالتة على التوالي هذا الموسم,"[{""start"": 5, ""end"": 8, ""placeholder"": ""[PERSON_1]"", ""surface_form"": ""سيف"", ""mask_type"": ""PERSON""}, {""start"": 20, ""end"": 26, ""placeholder"": ""[ORG_1]"", ""surface_form"": ""الحسين"", ""mask_type"": ""ORG""}, {""start"": 38, ""end"": 45, ""placeholder"": ""[ORG_2]"", ""surface_form"": ""الفيصلي"", ""mask_type"": ""ORG""}, {""start"": 56, ""end"": 63, ""placeholder"": ""[ORG_3]"", ""surface_form"": ""الوحدات"", ""mask_type"": ""ORG""}]",4,approved,,
mt_msa_fa21adee,train,44055,MSA,الزعابيل لا يعرفون أن الفيفا في موقعه الرسمي استشهد مرات عديدة باحصائيات من الاتحاد الدولي للاحصاء . . انه الجهل والتعصب يا صديقي :,الزعابيل لا يعرفون ان الفيفا في موقعه الرسمي استشهد مرات عديده باحصاييات من الاتحاد الدولي للاحصاء انه الجهل والتعصب يا صديقي,الزعابيل لا يعرفون أن [ORG_1] في موقعه الرسمي استشهد مرات عديدة باحصائيات من [ORG_2] . . انه الجهل والتعصب يا صديقي :,"[{""start"": 22, ""end"": 28, ""placeholder"": ""[ORG_1]"", ""surface_form"": ""الفيفا"", ""mask_type"": ""ORG""}, {""start"": 76, ""end"": 98, ""placeholder"": ""[ORG_2]"", ""surface_form"": ""الاتحاد الدولي للاحصاء"", ""mask_type"": ""ORG""}]",2,approved,,
mt_dial_egy_6538e71f,train,35458,DIAL_EGY,ومش هايفرق الدعوة من طلاب الاخوان او من طلاب 6 ابريل او حتى من طلاب الحزب الوطني المهم انه يوم,ومش هايفرق الدعوه من طلاب الاخوان او من طلاب 6 ابريل او حتي من طلاب الحزب الوطني المهم انه يوم,ومش هايفرق الدعوة من طلاب [ORG_1] او من طلاب [ORG_2] او حتى من طلاب [ORG_3] المهم انه يوم,"[{""start"": 26, ""end"": 33, ""placeholder"": ""[ORG_1]"", ""surface_form"": ""الاخوان"", ""mask_type"": ""ORG""}, {""start"": 45, ""end"": 52, ""placeholder"": ""[ORG_2]"", ""surface_form"": ""6 ابريل"", ""mask_type"": ""ORG""}, {""start"": 68, ""end"": 80, ""placeholder"": ""[ORG_3]"", ""surface_form"": ""الحزب الوطني"", ""mask_type"": ""ORG""}]",3,approved,,
mt_dial_glf_6bfd0db5,train,68915,DIAL_GLF,الحقيقة ان الطفران لازم يدلع نفسة تدري لية,الحقيقه ان الطفران لازم يدلع نفسه تدري ليه,الحقيقة ان الطفران لازم يدلع نفسة تدري لية,[],0,approved,,
