example_id,source_split,source_row_id,dialect,original_text,normalized_text,masked_text,mask_spans_json,mask_count,annotation_status,annotator_model,notes
mt_dial_lev_189c634f,train,32961,DIAL_LEV,فمعظم العائلات الاردنية تشتري حاجاتها اليومية اولا باول وما يسد رمقهافي ذلك اليوم فقط او لعدة ايام قادمة باحسن الاحوال اما اليوم الذي بعده فربك برزق ويبدو انك لا تعرف ان هناك مناطق في عمان الشرقية وفي البادية ومناطق الجنوب يعانون شظف العيش والفقر المدقع بسبب سياسات الحكومة برفع الاسعار,فمعظم العايلات الاردنيه تشتري حاجاتها اليوميه اولا باول وما يسد رمقهافي ذلك اليوم فقط او لعده ايام قادمه باحسن الاحوال اما اليوم الذي بعده فربك برزق ويبدو انك لا تعرف ان هناك مناطق في عمان الشرقيه وفي الباديه ومناطق الجنوب يعانون شظف العيش والفقر المدقع بسبب سياسات الحكومه برفع الاسعار,فمعظم العائلات [LOC_1] تشتري حاجاتها اليومية اولا باول وما يسد رمقهافي ذلك اليوم فقط او لعدة ايام قادمة باحسن الاحوال اما اليوم الذي بعده فربك برزق ويبدو انك لا تعرف ان هناك مناطق في [LOC_2] وفي البادية ومناطق الجنوب يعانون شظف العيش والفقر المدقع بسبب سياسات الحكومة برفع الاسعار,"[{""start"": 15, ""end"": 23, ""placeholder"": ""[LOC_1]"", ""surface_form"": ""الاردنية"", ""mask_type"": ""LOC""}, {""start"": 184, ""end"": 196, ""placeholder"": ""[LOC_2]"", ""surface_form"": ""عمان الشرقية"", ""mask_type"": ""LOC""}]",2,approved,,
mt_msa_12df8759,train,83837,MSA,هذه ياأستاذ هي المرونه والإنفتاح وبعد النظر وأخذ ماهو مفيد من هنا وهناك بغض النظر عن مصدره ودون التعصب لنظام معين بل مايفيدني هو ماأريد,هذه يااستاذ هي المرونه والانفتاح وبعد النظر واخذ ماهو مفيد من هنا وهناك بغض النظر عن مصدره ودون التعصب لنظام معين بل مايفيدني هو مااريد,هذه ياأستاذ هي المرونه والإنفتاح وبعد النظر وأخذ ماهو مفيد من هنا وهناك بغض النظر عن مصدره ودون التعصب لنظام معين بل مايفيدني هو ماأريد,[],0,approved,,
mt_dial_egy_611668a0,train,51363,DIAL_EGY,ماقلنا المباراه اتلغت لدواعى عدة . . رئيس الاتحاد الفلسطينى واجع دماغنا من ساعت مارفضنا آقامة المباراه . . خلاص يآسيد هى مش عافية . . ومتحاولش تخلط الامور ببعهضا . . !,ماقلنا المباراه اتلغت لدواعي عده رييس الاتحاد الفلسطيني واجع دماغنا من ساعت مارفضنا اقامه المباراه خلاص ياسيد هي مش عافيه ومتحاولش تخلط الامور ببعهضا,ماقلنا المباراه اتلغت لدواعى عدة . . رئيس [ORG_1] واجع دماغنا من ساعت مارفضنا آقامة المباراه . . خلاص يآسيد هى مش عافية . . ومتحاولش تخلط الامور ببعهضا . . !,"[{""start"": 42, ""end"": 59, ""placeholder"": ""[ORG_1]"", ""surface_form"": ""الاتحاد الفلسطينى"", ""mask_type"": ""ORG""}]",1,approved,,
mt_dial_glf_20f9eb69,train,28793,DIAL_GLF,واصبح التدخين منتشر بشكل مخيف حتى اصبح اللي مايدخن هو الشاذ خاصة اذا ماكان,واصبح التدخين منتشر بشكل مخيف حتي اصبح اللي مايدخن هو الشاذ خاصه اذا ماكان,واصبح التدخين منتشر بشكل مخيف حتى اصبح اللي مايدخن هو الشاذ خاصة اذا ماكان,[],0,approved,,
mt_dial_lev_854d1127,train,7044,DIAL_LEV,راح يطلع 1250 ويرجع تحت 1100,راح يطلع 1250 ويرجع تحت 1100,راح يطلع [NUM_1] ويرجع تحت [NUM_2],"[{""start"": 9, ""end"": 13, ""placeholder"": ""[NUM_1]"", ""surface_form"": ""1250"", ""mask_type"": ""NUM""}, {""start"": 24, ""end"": 28, ""placeholder"": ""[NUM_2]"", ""surface_form"": ""1100"", ""mask_type"": ""NUM""}]",2,approved,,
mt_msa_eb64d552,train,37744,MSA,مرة اخرى أتوجه الى حكومتنا الموقرة واسألها متى كانت اخر مرة طبقتم فيها حكم الاعدام ؟ ! وأين ؟ ! أنا اذكر في الزمانات انه الاعدام كان يتم امام ساحة المسجد الحسيني واذكر مرة زمان أني رأيت احدى الصحف نشرت صورة شخص بعد إعدامه وهو لا يزال معلقاً بالحبل !,مره اخري اتوجه الي حكومتنا الموقره واسالها متي كانت اخر مره طبقتم فيها حكم الاعدام واين انا اذكر في الزمانات انه الاعدام كان يتم امام ساحه المسجد الحسيني واذكر مره زمان اني رايت احدي الصحف نشرت صوره شخص بعد اعدامه وهو لا يزال معلقا بالحبل,مرة اخرى أتوجه الى حكومتنا الموقرة واسألها متى كانت اخر مرة طبقتم فيها حكم الاعدام ؟ ! وأين ؟ ! أنا اذكر في الزمانات انه الاعدام كان يتم امام ساحة [LOC_1] واذكر مرة زمان أني رأيت احدى الصحف نشرت صورة شخص بعد إعدامه وهو لا يزال معلقاً بالحبل !,"[{""start"": 147, ""end"": 161, ""placeholder"": ""[LOC_1]"", ""surface_form"": ""المسجد الحسيني"", ""mask_type"": ""LOC""}]",1,approved,,
mt_dial_egy_589f13b1,train,62946,DIAL_EGY,بعيدا عن تعليق الاخوان عن ان شم النسيم بدعه او مش بدعه و المفروض اننا منحتفلش بيه لكن الكاتب بيكلم عن نقطه تانيه خالص وهيا النضافه او سلوك سئ ف الشعب المصري عامة وهوا عدم الاهتمام بنضافه الاماكن العامه و فعلا دي ظاهره سيئه جدا بس كان نفسي باشمهندس احمد يدينا شويه اقتراحات لحل المشكله دي,بعيدا عن تعليق الاخوان عن ان شم النسيم بدعه او مش بدعه و المفروض اننا منحتفلش بيه لكن الكاتب بيكلم عن نقطه تانيه خالص وهيا النضافه او سلوك سي ف الشعب المصري عامه وهوا عدم الاهتمام بنضافه الاماكن العامه و فعلا دي ظاهره سييه جدا بس كان نفسي باشمهندس احمد يدينا شويه اقتراحات لحل المشكله دي,بعيدا عن تعليق الاخوان عن ان شم النسيم بدعه او مش بدعه و المفروض اننا منحتفلش بيه لكن الكاتب بيكلم عن نقطه تانيه خالص وهيا النضافه او سلوك سئ ف الشعب [LOC_1] عامة وهوا عدم الاهتمام بنضافه الاماكن العامه و فعلا دي ظاهره سيئه جدا بس كان نفسي باشمهندس [PERSON_1] يدينا شويه اقتراحات لحل المشكله دي,"[{""start"": 150, ""end"": 156, ""placeholder"": ""[LOC_1]"", ""surface_form"": ""المصري"", ""mask_type"": ""LOC""}, {""start"": 248, ""end"": 252, ""placeholder"": ""[PERSON_1]"", ""surface_form"": ""احمد"", ""mask_type"": ""PERSON""}]",2,approved,,
mt_dial_glf_595f0761,train,54676,DIAL_GLF,هل هذا عدل وش فرقهم عن بعض,هل هذا عدل وش فرقهم عن بعض,هل هذا عدل وش فرقهم عن بعض,[],0,approved,,
mt_dial_lev_df4143a2,train,37970,DIAL_LEV,و في مباراة الاياب راح نباركلكم اذا,و في مباراه الاياب راح نباركلكم اذا,و في مباراة الاياب راح نباركلكم اذا,[],0,approved,,
mt_msa_3a499d3b,train,29306,MSA,أما مسألة يحق فهو سيحق ولكن هل يحقق ؟ ؟ !,اما مساله يحق فهو سيحق ولكن هل يحقق,أما مسألة يحق فهو سيحق ولكن هل يحقق ؟ ؟ !,[],0,approved,,
