example_id,source_split,source_row_id,dialect,original_text,normalized_text,masked_text,mask_spans_json,mask_count,annotation_status,annotator_model,notes
mt_dial_lev_77969b63,train,62892,DIAL_LEV,يا ريت اصلن يصير كل التكاسي مميز يا زلمه التكسي الاصفر اول اشي بدلل عليك و اذا شاف بنت بطنشك عطول و اذا بتفقد اشي بالسياره سلامتك غنيله,يا ريت اصلن يصير كل التكاسي مميز يا زلمه التكسي الاصفر اول اشي بدلل عليك و اذا شاف بنت بطنشك عطول و اذا بتفقد اشي بالسياره سلامتك غنيله,يا ريت اصلن يصير كل التكاسي مميز يا زلمه التكسي الاصفر اول اشي بدلل عليك و اذا شاف بنت بطنشك عطول و اذا بتفقد اشي بالسياره سلامتك غنيله,[],0,approved,,
mt_msa_dee1ea02,train,54022,MSA,مافيه لوحات بكامل الشارع ممكن في اخر الطريق او,مافيه لوحات بكامل الشارع ممكن في اخر الطريق او,مافيه لوحات بكامل الشارع ممكن في اخر الطريق او,[],0,approved,,
mt_dial_lev_e65864de,train,80553,DIAL_LEV,بالتوفيق لابو علي ودراغان وكبير يا شلباية على راسي يا,بالتوفيق لابو علي ودراغان وكبير يا شلبايه علي راسي يا,بالتوفيق لابو [PERSON_1] و[PERSON_2] وكبير يا [PERSON_3] على راسي يا,"[{""start"": 14, ""end"": 17, ""placeholder"": ""[PERSON_1]"", ""surface_form"": ""علي"", ""mask_type"": ""PERSON""}, {""start"": 19, ""end"": 25, ""placeholder"": ""[PERSON_2]"", ""surface_form"": ""دراغان"", ""mask_type"": ""PERSON""}, {""start"": 35, ""end"": 41, ""placeholder"": ""[PERSON_3]"", ""surface_form"": ""شلباية"", ""mask_type"": ""PERSON""}]",3,approved,,
mt_msa_218b5013,train,40782,MSA,الشيء الوحيد الصحيح بالخرافة هي انقلاب قطبي الارض و عندها تشرق الشمس من مغربها كما حدثنا الرسول علية الصلى و السلام قال تعالى : { وما ينطق عن الهوى . إن هو إلاَّ وحي يوحى,الشيء الوحيد الصحيح بالخرافه هي انقلاب قطبي الارض و عندها تشرق الشمس من مغربها كما حدثنا الرسول عليه الصلي و السلام قال تعالي وما ينطق عن الهوي ان هو الا وحي يوحي,الشيء الوحيد الصحيح بالخرافة هي انقلاب قطبي الارض و عندها تشرق الشمس من مغربها كما حدثنا الرسول علية الصلى و السلام قال تعالى : { وما ينطق عن الهوى . إن هو إلاَّ وحي يوحى,[],0,approved,,
mt_dial_egy_f6863eac,train,69748,DIAL_EGY,هات لي غلطة حكم يوم ماتش انبي مقصودة من قبل محمد عباس .,هات لي غلطه حكم يوم ماتش انبي مقصوده من قبل محمد عباس,هات لي غلطة حكم يوم ماتش [ORG_1] مقصودة من قبل [PERSON_1] .,"[{""start"": 25, ""end"": 29, ""placeholder"": ""[ORG_1]"", ""surface_form"": ""انبي"", ""mask_type"": ""ORG""}, {""start"": 44, ""end"": 53, ""placeholder"": ""[PERSON_1]"", ""surface_form"": ""محمد عباس"", ""mask_type"": ""PERSON""}]",2,approved,,
mt_dial_glf_59becb9a,train,35064,DIAL_GLF,شوفولكم حل وخافو الله في الي يشفونكم ويضيعون وقتهم وهم,شوفولكم حل وخافو الله في الي يشفونكم ويضيعون وقتهم وهم,شوفولكم حل وخافو الله في الي يشفونكم ويضيعون وقتهم وهم,[],0,approved,,
mt_dial_lev_68607eee,train,52845,DIAL_LEV,اشي البسة واشي خضار وفواكه واشي مواد زراعية واسمدة . . يعني الموضوع من اولو لآخرو مش مستاهل كل هالزعل والتحقيقات اللي رايحة,اشي البسه واشي خضار وفواكه واشي مواد زراعيه واسمده يعني الموضوع من اولو لاخرو مش مستاهل كل هالزعل والتحقيقات اللي رايحه,اشي البسة واشي خضار وفواكه واشي مواد زراعية واسمدة . . يعني الموضوع من اولو لآخرو مش مستاهل كل هالزعل والتحقيقات اللي رايحة,[],0,approved,,
mt_msa_16ff23c3,train,78441,MSA,آمل مراجعه جميع مباريات الدوري في القارة الاوربية لمعرفه مصير الاعب الذي يعتدي على,امل مراجعه جميع مباريات الدوري في القاره الاوربيه لمعرفه مصير الاعب الذي يعتدي علي,آمل مراجعه جميع مباريات الدوري في القارة الاوربية لمعرفه مصير الاعب الذي يعتدي على,[],0,approved,,
mt_dial_glf_04a5d43c,train,55099,DIAL_GLF,ترى انا هلالي و استغرب من اللي يقوله حسام الحين وقفوا معك في تهمة المنشطات وفي الآخير تهدد انك ما تلعب والله ما توقعتها مفروض ترد لهم الجميل وما ياخذ عقلك للدراهم صدق ناس عجب والله لوه انا في مكان كحيلان كان طردت حسام على,تري انا هلالي و استغرب من اللي يقوله حسام الحين وقفوا معك في تهمه المنشطات وفي الاخير تهدد انك ما تلعب والله ما توقعتها مفروض ترد لهم الجميل وما ياخذ عقلك للدراهم صدق ناس عجب والله لوه انا في مكان كحيلان كان طردت حسام علي,ترى انا [ORG_1] و استغرب من اللي يقوله [PERSON_1] الحين وقفوا معك في تهمة المنشطات وفي الآخير تهدد انك ما تلعب والله ما توقعتها مفروض ترد لهم الجميل وما ياخذ عقلك للدراهم صدق ناس عجب والله لوه انا في مكان [PERSON_2] كان طردت [PERSON_1] على,"[{""start"": 8, ""end"": 13, ""placeholder"": ""[ORG_1]"", ""surface_form"": ""هلالي"", ""mask_type"": ""ORG""}, {""start"": 37, ""end"": 41, ""placeholder"": ""[PERSON_1]"", ""surface_form"": ""حسام"", ""mask_type"": ""PERSON""}, {""start"": 197, ""end"": 203, ""placeholder"": ""[PERSON_2]"", ""surface_form"": ""كحيلان"", ""mask_type"": ""PERSON""}, {""start"": 213, ""end"": 217, ""placeholder"": ""[PERSON_1]"", ""surface_form"": ""حسام"", ""mask_type"": ""PERSON""}]",4,approved,,
mt_dial_lev_7375e30f,train,85979,DIAL_LEV,اليوم راح نكون ضيوف عند غزلان الشمال وما اروع ضيافتهم والله اني اعشق الرمثا وجماهير الرمثا بعد الوحدات فكل الاحترام والتوفيق لهم في مبارتهم اليوم لانهم والله بيستحقوا الاحترام والمحبة والكأس,اليوم راح نكون ضيوف عند غزلان الشمال وما اروع ضيافتهم والله اني اعشق الرمثا وجماهير الرمثا بعد الوحدات فكل الاحترام والتوفيق لهم في مبارتهم اليوم لانهم والله بيستحقوا الاحترام والمحبه والكاس,اليوم راح نكون ضيوف عند غزلان الشمال وما اروع ضيافتهم والله اني اعشق [ORG_1] وجماهير [ORG_1] بعد [ORG_2] فكل الاحترام والتوفيق لهم في مبارتهم اليوم لانهم والله بيستحقوا الاحترام والمحبة والكأس,"[{""start"": 69, ""end"": 75, ""placeholder"": ""[ORG_1]"", ""surface_form"": ""الرمثا"", ""mask_type"": ""ORG""}, {""start"": 84, ""end"": 90, ""placeholder"": ""[ORG_1]"", ""surface_form"": ""الرمثا"", ""mask_type"": ""ORG""}, {""start"": 95, ""end"": 102, ""placeholder"": ""[ORG_2]"", ""surface_form"": ""الوحدات"", ""mask_type"": ""ORG""}]",3,approved,,
mt_dial_egy_8797b445,train,67479,DIAL_EGY,خلاص خلص الكلام مش لاقى حاجة تقولها انا ماستفدتش حاجة م اللى حضرتك كتبته ولا ليه أى معنى خسارة ضيعت وقتك,خلاص خلص الكلام مش لاقي حاجه تقولها انا ماستفدتش حاجه م اللي حضرتك كتبته ولا ليه اي معني خساره ضيعت وقتك,خلاص خلص الكلام مش لاقى حاجة تقولها انا ماستفدتش حاجة م اللى حضرتك كتبته ولا ليه أى معنى خسارة ضيعت وقتك,[],0,approved,,
mt_dial_glf_f14011d8,train,25093,DIAL_GLF,شفتوا فايدة الهلال على الاندية,شفتوا فايده الهلال علي الانديه,شفتوا فايدة [ORG_1] على الاندية,"[{""start"": 12, ""end"": 18, ""placeholder"": ""[ORG_1]"", ""surface_form"": ""الهلال"", ""mask_type"": ""ORG""}]",1,approved,,
mt_dial_lev_806b1d54,train,76200,DIAL_LEV,رجاء لا خلص بكفي اللي صار عندكم من ازعاج الفوفوزيلا والتنظيم الباهت ومحاولة سرقة الكاس في المباراة النهائيه وسرقة الصحافيين والبرد القارص و . . .,رجاء لا خلص بكفي اللي صار عندكم من ازعاج الفوفوزيلا والتنظيم الباهت ومحاوله سرقه الكاس في المباراه النهاييه وسرقه الصحافيين والبرد القارص و,رجاء لا خلص بكفي اللي صار عندكم من ازعاج الفوفوزيلا والتنظيم الباهت ومحاولة سرقة الكاس في المباراة النهائيه وسرقة الصحافيين والبرد القارص و . . .,[],0,approved,,
mt_msa_867d10d8,train,73964,MSA,التونسيين والسائحين وخاصة اصحاب السيارات والكرفنات وهى اضافة كبير لمصر والباقى مفهوم . . . . . وشكرا سيادة,التونسيين والسايحين وخاصه اصحاب السيارات والكرفنات وهي اضافه كبير لمصر والباقي مفهوم وشكرا سياده,التونسيين والسائحين وخاصة اصحاب السيارات والكرفنات وهى اضافة كبير ل[LOC_1] والباقى مفهوم . . . . . وشكرا سيادة,"[{""start"": 67, ""end"": 70, ""placeholder"": ""[LOC_1]"", ""surface_form"": ""مصر"", ""mask_type"": ""LOC""}]",1,approved,,
mt_dial_egy_135504b8,train,17859,DIAL_EGY,كده خلصنا من شوبير و صادق . . . فاضل شلبي و الغندور و,كده خلصنا من شوبير و صادق فاضل شلبي و الغندور و,كده خلصنا من [PERSON_1] و [PERSON_2] . . . فاضل [PERSON_3] و [PERSON_4] و,"[{""start"": 13, ""end"": 18, ""placeholder"": ""[PERSON_1]"", ""surface_form"": ""شوبير"", ""mask_type"": ""PERSON""}, {""start"": 21, ""end"": 25, ""placeholder"": ""[PERSON_2]"", ""surface_form"": ""صادق"", ""mask_type"": ""PERSON""}, {""start"": 37, ""end"": 41, ""placeholder"": ""[PERSON_3]"", ""surface_form"": ""شلبي"", ""mask_type"": ""PERSON""}, {""start"": 44, ""end"": 51, ""placeholder"": ""[PERSON_4]"", ""surface_form"": ""الغندور"", ""mask_type"": ""PERSON""}]",4,approved,,
mt_dial_glf_b545bd57,train,21301,DIAL_GLF,فصل المقدم افضل من موت الجندي ممكن انه يقدم مره اخري علي قتل واحد اخر واتمنا لا تستهينو با ارواح الناس يعني يزعل يرميك وبعدها تخش الواسطه والطلبات الافضل فصله تجنب لامور قد تحدث من نفس الشخص وبعدين ما بنفع تنازل,فصل المقدم افضل من موت الجندي ممكن انه يقدم مره اخري علي قتل واحد اخر واتمنا لا تستهينو با ارواح الناس يعني يزعل يرميك وبعدها تخش الواسطه والطلبات الافضل فصله تجنب لامور قد تحدث من نفس الشخص وبعدين ما بنفع تنازل,فصل المقدم افضل من موت الجندي ممكن انه يقدم مره اخري علي قتل واحد اخر واتمنا لا تستهينو با ارواح الناس يعني يزعل يرميك وبعدها تخش الواسطه والطلبات الافضل فصله تجنب لامور قد تحدث من نفس الشخص وبعدين ما بنفع تنازل,[],0,approved,,
mt_dial_lev_c3783406,train,20694,DIAL_LEV,الأردنين الأصليين ليس لديهم كشرة !,الاردنين الاصليين ليس لديهم كشره,الأردنين الأصليين ليس لديهم كشرة !,[],0,approved,,
mt_msa_a551d4ef,train,66323,MSA,لك كل التقدير أجر ما سقيت لنا جميعا .,لك كل التقدير اجر ما سقيت لنا جميعا,لك كل التقدير أجر ما سقيت لنا جميعا .,[],0,approved,,
mt_dial_glf_5a66e7fa,train,291,DIAL_GLF,ألف ألف مبروك يا أبا خالد وتستاهل كل خير مع تمنياتي لكم بالتوفيق لخيري الدنيا,الف الف مبروك يا ابا خالد وتستاهل كل خير مع تمنياتي لكم بالتوفيق لخيري الدنيا,ألف ألف مبروك يا أبا [PERSON_1] وتستاهل كل خير مع تمنياتي لكم بالتوفيق لخيري الدنيا,"[{""start"": 21, ""end"": 25, ""placeholder"": ""[PERSON_1]"", ""surface_form"": ""خالد"", ""mask_type"": ""PERSON""}]",1,approved,,
mt_dial_lev_66b5dad5,train,86481,DIAL_LEV,الفيس بوك كان كويس اول ما بدى الناس تتعامل معو باحترام لكن الان اصبح اي واحد ممكن يعمل ( جروب ) يهين الاديان و ينشر صور للاديان غير لائقة كليا من دون اخذ الاجراءات اللازمة مع صانع هذا الجروب . . . و شكرا للجريدة على اهتمامها بهذه الامور . . . جريدة بحبها كتير و بحترمها لانها,الفيس بوك كان كويس اول ما بدي الناس تتعامل معو باحترام لكن الان اصبح اي واحد ممكن يعمل جروب يهين الاديان و ينشر صور للاديان غير لايقه كليا من دون اخذ الاجراءات اللازمه مع صانع هذا الجروب و شكرا للجريده علي اهتمامها بهذه الامور جريده بحبها كتير و بحترمها لانها,الفيس بوك كان كويس اول ما بدى الناس تتعامل معو باحترام لكن الان اصبح اي واحد ممكن يعمل ( جروب ) يهين الاديان و ينشر صور للاديان غير لائقة كليا من دون اخذ الاجراءات اللازمة مع صانع هذا الجروب . . . و شكرا للجريدة على اهتمامها بهذه الامور . . . جريدة بحبها كتير و بحترمها لانها,[],0,approved,,
mt_msa_bb881356,train,79964,MSA,أما من يدعي أن ساهر سارق فأنت السارق لنظام وأزهاق المواطنين,اما من يدعي ان ساهر سارق فانت السارق لنظام وازهاق المواطنين,أما من يدعي أن [ORG_1] سارق فأنت السارق لنظام وأزهاق المواطنين,"[{""start"": 15, ""end"": 19, ""placeholder"": ""[ORG_1]"", ""surface_form"": ""ساهر"", ""mask_type"": ""ORG""}]",1,approved,,
mt_dial_egy_ed20a369,train,50180,DIAL_EGY,اتمنى انى اشوف مسلسل يستحق المشاهدة,اتمني اني اشوف مسلسل يستحق المشاهده,اتمنى انى اشوف مسلسل يستحق المشاهدة,[],0,approved,,
mt_dial_glf_c37da2dd,train,84846,DIAL_GLF,كل اللي بقنوات التلفزيون السعودي اردنيات ومصريات,كل اللي بقنوات التلفزيون السعودي اردنيات ومصريات,كل اللي بقنوات التلفزيون [LOC_1] اردنيات ومصريات,"[{""start"": 25, ""end"": 32, ""placeholder"": ""[LOC_1]"", ""surface_form"": ""السعودي"", ""mask_type"": ""LOC""}]",1,approved,,
mt_dial_lev_92b0c3c7,train,12036,DIAL_LEV,الوحدات كمان مش دايما بخسر و اله نتائج خارجية مشرفة و كاد ان يصل نهائي دوري ابطال العرب و لكن بظلم تحكيمي خرج و انت ذكرت لا يعيب الفريق الخسارة,الوحدات كمان مش دايما بخسر و اله نتايج خارجيه مشرفه و كاد ان يصل نهايي دوري ابطال العرب و لكن بظلم تحكيمي خرج و انت ذكرت لا يعيب الفريق الخساره,الوحدات كمان مش دايما بخسر و اله نتائج خارجية مشرفة و كاد ان يصل نهائي دوري ابطال العرب و لكن بظلم تحكيمي خرج و انت ذكرت لا يعيب الفريق الخسارة,[],0,approved,,
mt_msa_07a2639a,train,20522,MSA,مقالاتك بها من التحدث عن مكارم الأخلاق والفضائل الكثير و لكن ألا تلاحظ ياسيدى,مقالاتك بها من التحدث عن مكارم الاخلاق والفضايل الكثير و لكن الا تلاحظ ياسيدي,مقالاتك بها من التحدث عن مكارم الأخلاق والفضائل الكثير و لكن ألا تلاحظ ياسيدى,[],0,approved,,
mt_dial_egy_802cb249,train,85378,DIAL_EGY,شعب تافه وشعب غلبان مافى وجوه الجزائريين اي حياء عيد قومى ايه الي بتتكلموا عليه عبط بلا نهايه وتخلف من,شعب تافه وشعب غلبان مافي وجوه الجزايريين اي حياء عيد قومي ايه الي بتتكلموا عليه عبط بلا نهايه وتخلف من,شعب تافه وشعب غلبان مافى وجوه [LOC_1] اي حياء عيد قومى ايه الي بتتكلموا عليه عبط بلا نهايه وتخلف من,"[{""start"": 30, ""end"": 40, ""placeholder"": ""[LOC_1]"", ""surface_form"": ""الجزائريين"", ""mask_type"": ""LOC""}]",1,approved,,
mt_dial_glf_9a0a8878,train,11663,DIAL_GLF,ياخي هالنظام بالعكس بيضرنا ماهو نافعنا مثل,ياخي هالنظام بالعكس بيضرنا ماهو نافعنا مثل,ياخي هالنظام بالعكس بيضرنا ماهو نافعنا مثل,[],0,approved,,
mt_dial_lev_31a25912,train,26115,DIAL_LEV,كلامكم صح بس يا عمي والله انهم بيتعبو رغم انو اخوي عندو محطة . . اذا هذا الشي قانوني ايش المانع . ؟ ؟ العمالة الوافدة,كلامكم صح بس يا عمي والله انهم بيتعبو رغم انو اخوي عندو محطه اذا هذا الشي قانوني ايش المانع العماله الوافده,كلامكم صح بس يا عمي والله انهم بيتعبو رغم انو اخوي عندو محطة . . اذا هذا الشي قانوني ايش المانع . ؟ ؟ العمالة الوافدة,[],0,approved,,
mt_msa_b1512394,train,49510,MSA,ولكن نريده أن يكون أكثر التزاما في اصداراته ولا يقلد,ولكن نريده ان يكون اكثر التزاما في اصداراته ولا يقلد,ولكن نريده أن يكون أكثر التزاما في اصداراته ولا يقلد,[],0,approved,,
mt_dial_egy_ee088b67,train,31853,DIAL_EGY,غير الراجل كلامة و قال مجاش تهديد قبل,غير الراجل كلامه و قال مجاش تهديد قبل,غير الراجل كلامة و قال مجاش تهديد قبل,[],0,approved,,
mt_dial_glf_5cb54821,train,46642,DIAL_GLF,للأسف بآقي للحين نآس ب هالعقليآت المتخلفه ! طيب البنت اللي مآعندهآ عيآل عم او خوآل او يكونو متزوجين ، وش مصيرهآ ؟ ! شي يقهر اي شاب لمآ يروح يخطب ويرفضونه بسبب آنه من قبيله غير قبيلتهم أو آنه مو قبيلي ، وشي يقهر ويظلم البنت لمآ يتقدم لها شآب اي بنت تتمناه ، ويرفضونه آهلها بحكم انه مو من قبيلتهم,للاسف باقي للحين ناس ب هالعقليات المتخلفه طيب البنت اللي ماعندها عيال عم او خوال او يكونو متزوجين وش مصيرها شي يقهر اي شاب لما يروح يخطب ويرفضونه بسبب انه من قبيله غير قبيلتهم او انه مو قبيلي وشي يقهر ويظلم البنت لما يتقدم لها شاب اي بنت تتمناه ويرفضونه اهلها بحكم انه مو من قبيلتهم,للأسف بآقي للحين نآس ب هالعقليآت المتخلفه ! طيب البنت اللي مآعندهآ عيآل عم او خوآل او يكونو متزوجين ، وش مصيرهآ ؟ ! شي يقهر اي شاب لمآ يروح يخطب ويرفضونه بسبب آنه من قبيله غير قبيلتهم أو آنه مو قبيلي ، وشي يقهر ويظلم البنت لمآ يتقدم لها شآب اي بنت تتمناه ، ويرفضونه آهلها بحكم انه مو من قبيلتهم,[],0,approved,,
mt_dial_lev_53b5e445,train,33578,DIAL_LEV,انا بحكي ما تستغربوا من اي شي بتسمعوه ولسه ياما حتشوفوا,انا بحكي ما تستغربوا من اي شي بتسمعوه ولسه ياما حتشوفوا,انا بحكي ما تستغربوا من اي شي بتسمعوه ولسه ياما حتشوفوا,[],0,approved,,
mt_msa_5959185b,train,38359,MSA,دعنا لا نتحارب عل الصوت . . انني لا ارى الكيان,دعنا لا نتحارب عل الصوت انني لا اري الكيان,دعنا لا نتحارب عل الصوت . . انني لا ارى الكيان,[],0,approved,,
mt_dial_egy_7924c6e9,train,75394,DIAL_EGY,وإيه رأيكم دام عزكم إن الرئيس جمال مبارك هو إللى ياخد الناس دى ويعينها وخلاص يبقى ضرب عدة عصافير,وايه رايكم دام عزكم ان الرييس جمال مبارك هو اللي ياخد الناس دي ويعينها وخلاص يبقي ضرب عده عصافير,وإيه رأيكم دام عزكم إن الرئيس [PERSON_1] هو إللى ياخد الناس دى ويعينها وخلاص يبقى ضرب عدة عصافير,"[{""start"": 30, ""end"": 40, ""placeholder"": ""[PERSON_1]"", ""surface_form"": ""جمال مبارك"", ""mask_type"": ""PERSON""}]",1,approved,,
mt_dial_glf_f65eccd8,train,84545,DIAL_GLF,الله يهديك ياشيخ والمشكلة انت رئيس هيئة عى العموم ياشيخ لدي سؤال هل تسمح لي بان اختلط بابنتك او اختك اقصد اجلس بجوارها مقعدي يلاصق مقعدها - - هذا هو الاختلاط اذا انت ترضى ذلك فا الله يرحم علمائنا الاجلاء,الله يهديك ياشيخ والمشكله انت رييس هييه عي العموم ياشيخ لدي سوال هل تسمح لي بان اختلط بابنتك او اختك اقصد اجلس بجوارها مقعدي يلاصق مقعدها هذا هو الاختلاط اذا انت ترضي ذلك فا الله يرحم علماينا الاجلاء,الله يهديك ياشيخ والمشكلة انت رئيس هيئة عى العموم ياشيخ لدي سؤال هل تسمح لي بان اختلط بابنتك او اختك اقصد اجلس بجوارها مقعدي يلاصق مقعدها - - هذا هو الاختلاط اذا انت ترضى ذلك فا الله يرحم علمائنا الاجلاء,[],0,approved,,
