example_id,source_split,source_row_id,dialect,original_text,normalized_text,masked_text,mask_spans_json,mask_count,annotation_status,annotator_model,notes
mt_dial_lev_ab6e5695,train,61907,DIAL_LEV,مفكر حالو بفلم وهو البطل يعني بيوم واحد بيقتل 6 لا اله الا الله انا مش عارفة ليش جارته ما حكت لزوجها انه في حد بيدايقها وعمل فيها هيك وهي بتعرفه يعني ليش ما حكت للشرطه المصيبه هون بالنسوان اللي ما الهم تم يحكي عشان هيك الزلام صارت بتعمل هيك كلوا منك يا,مفكر حالو بفلم وهو البطل يعني بيوم واحد بيقتل 6 لا اله الا الله انا مش عارفه ليش جارته ما حكت لزوجها انه في حد بيدايقها وعمل فيها هيك وهي بتعرفه يعني ليش ما حكت للشرطه المصيبه هون بالنسوان اللي ما الهم تم يحكي عشان هيك الزلام صارت بتعمل هيك كلوا منك يا,مفكر حالو بفلم وهو البطل يعني بيوم واحد بيقتل [NUM_1] لا اله الا الله انا مش عارفة ليش جارته ما حكت لزوجها انه في حد بيدايقها وعمل فيها هيك وهي بتعرفه يعني ليش ما حكت للشرطه المصيبه هون بالنسوان اللي ما الهم تم يحكي عشان هيك الزلام صارت بتعمل هيك كلوا منك يا,"[{""start"": 46, ""end"": 47, ""placeholder"": ""[NUM_1]"", ""surface_form"": ""6"", ""mask_type"": ""NUM""}]",1,approved,,
mt_msa_a77a663d,train,34835,MSA,لم أرَ مجتمعاً يسيء موازنة الأمور ولايعرف للتسديد والمقاربة طريقاً كمجتمعنا,لم ار مجتمعا يسيء موازنه الامور ولايعرف للتسديد والمقاربه طريقا كمجتمعنا,لم أرَ مجتمعاً يسيء موازنة الأمور ولايعرف للتسديد والمقاربة طريقاً كمجتمعنا,[],0,approved,,
mt_dial_egy_d69b7864,train,56456,DIAL_EGY,ياريت يطبق عاليها هذا القرار شطبه من سجلات اتحاد الكرة نهائيا لانه كثير الشغب والكوارث ما رحش فى اى مكان الا وأتى بالشغب والكوارث هاتوا تاريخ ابراهيم حسن وشوفوا وانتوا تعرفوا وأيضا هو السبب فى اشتعال الفتنة فى الفترة الاخيرة ده تصريحات عنجهيه عن المنشطات وعن سوء التحكيم وعن اتفاق مع لاعبين الفرق قبل اى مبارة للزمالك ده انسان ليس انسان ده حقود وغيور ويتمنى ان يفعل اى شىء ليكيد الاهلى للاسف هو الرباه وعلمة الحمد الله ان الاهلى نبذه,ياريت يطبق عاليها هذا القرار شطبه من سجلات اتحاد الكره نهاييا لانه كثير الشغب والكوارث ما رحش في اي مكان الا واتي بالشغب والكوارث هاتوا تاريخ ابراهيم حسن وشوفوا وانتوا تعرفوا وايضا هو السبب في اشتعال الفتنه في الفتره الاخيره ده تصريحات عنجهيه عن المنشطات وعن سوء التحكيم وعن اتفاق مع لاعبين الفرق قبل اي مباره للزمالك ده انسان ليس انسان ده حقود وغيور ويتمني ان يفعل اي شيء ليكيد الاهلي للاسف هو الرباه وعلمه الحمد الله ان الاهلي نبذه,ياريت يطبق عاليها هذا القرار شطبه من سجلات اتحاد الكرة نهائيا لانه كثير الشغب والكوارث ما رحش فى اى مكان الا وأتى بالشغب والكوارث هاتوا تاريخ [PERSON_1] وشوفوا وانتوا تعرفوا وأيضا هو السبب فى اشتعال الفتنة فى الفترة الاخيرة ده تصريحات عنجهيه عن المنشطات وعن سوء التحكيم وعن اتفاق مع لاعبين الفرق قبل اى مبارة ل[ORG_1] ده انسان ليس انسان ده حقود وغيور ويتمنى ان يفعل اى شىء ليكيد [ORG_2] للاسف هو الرباه وعلمة الحمد الله ان [ORG_2] نبذه,"[{""start"": 142, ""end"": 153, ""placeholder"": ""[PERSON_1]"", ""surface_form"": ""ابراهيم حسن"", ""mask_type"": ""PERSON""}, {""start"": 311, ""end"": 317, ""placeholder"": ""[ORG_1]"", ""surface_form"": ""لزمالك"", ""mask_type"": ""ORG""}, {""start"": 379, ""end"": 385, ""placeholder"": ""[ORG_2]"", ""surface_form"": ""الاهلى"", ""mask_type"": ""ORG""}, {""start"": 422, ""end"": 428, ""placeholder"": ""[ORG_2]"", ""surface_form"": ""الاهلى"", ""mask_type"": ""ORG""}]",4,approved,,
mt_dial_glf_053fb7a0,train,5360,DIAL_GLF,خليكم في التجارة والمشاريع وبس الله,خليكم في التجاره والمشاريع وبس الله,خليكم في التجارة والمشاريع وبس الله,[],0,approved,,
mt_dial_lev_e8dd83ec,train,3928,DIAL_LEV,سر الى الامام يا اخضر و الاخضر كبير بمن حضر ولا يهمنا احتراف اكثرمنلاعب فالكبير كبير و هده من صفات,سر الي الامام يا اخضر و الاخضر كبير بمن حضر ولا يهمنا احتراف اكثرمنلاعب فالكبير كبير و هده من صفات,سر الى الامام يا اخضر و الاخضر كبير بمن حضر ولا يهمنا احتراف اكثرمنلاعب فالكبير كبير و هده من صفات,[],0,approved,,
mt_msa_49ddcc03,train,33415,MSA,متطلبات البنات في هذة الايام لها بداية ولكن ليس لها نهايةاصبحنا نسمي الانحلال انفتاحاوالحرية العشوائية حقا لهاالى اين سنتجة بهذا السلوك الخاطئ البعيد عن القيم,متطلبات البنات في هذه الايام لها بدايه ولكن ليس لها نهايهاصبحنا نسمي الانحلال انفتاحاوالحريه العشواييه حقا لهاالي اين سنتجه بهذا السلوك الخاطي البعيد عن القيم,متطلبات البنات في هذة الايام لها بداية ولكن ليس لها نهايةاصبحنا نسمي الانحلال انفتاحاوالحرية العشوائية حقا لهاالى اين سنتجة بهذا السلوك الخاطئ البعيد عن القيم,[],0,approved,,
mt_dial_egy_9a051fe7,train,5546,DIAL_EGY,ليل اسكندرية ورأس الدمياطية والشال والمشربية بلدى,ليل اسكندريه وراس الدمياطيه والشال والمشربيه بلدي,ليل [LOC_1] ورأس الدمياطية والشال والمشربية بلدى,"[{""start"": 4, ""end"": 12, ""placeholder"": ""[LOC_1]"", ""surface_form"": ""اسكندرية"", ""mask_type"": ""LOC""}]",1,approved,,
mt_dial_glf_0b10609b,train,73595,DIAL_GLF,اهم شى الهلال والشباب لانهم من الرياض وحبايب ولدليل مباراة الشباب,اهم شي الهلال والشباب لانهم من الرياض وحبايب ولدليل مباراه الشباب,اهم شى [ORG_1] و[ORG_2] لانهم من [LOC_1] وحبايب ولدليل مباراة [ORG_2],"[{""start"": 7, ""end"": 13, ""placeholder"": ""[ORG_1]"", ""surface_form"": ""الهلال"", ""mask_type"": ""ORG""}, {""start"": 15, ""end"": 21, ""placeholder"": ""[ORG_2]"", ""surface_form"": ""الشباب"", ""mask_type"": ""ORG""}, {""start"": 31, ""end"": 37, ""placeholder"": ""[LOC_1]"", ""surface_form"": ""الرياض"", ""mask_type"": ""LOC""}, {""start"": 59, ""end"": 65, ""placeholder"": ""[ORG_2]"", ""surface_form"": ""الشباب"", ""mask_type"": ""ORG""}]",4,approved,,
mt_dial_lev_3b98022b,train,44486,DIAL_LEV,انا اخدت في الجامعة الفصل الماضي مادة تاريخ الاردن وفلسطين وحسيت كام في روح الاخوة بيناتنا من,انا اخدت في الجامعه الفصل الماضي ماده تاريخ الاردن وفلسطين وحسيت كام في روح الاخوه بيناتنا من,انا اخدت في الجامعة الفصل الماضي مادة تاريخ [LOC_1] و[LOC_2] وحسيت كام في روح الاخوة بيناتنا من,"[{""start"": 44, ""end"": 50, ""placeholder"": ""[LOC_1]"", ""surface_form"": ""الاردن"", ""mask_type"": ""LOC""}, {""start"": 52, ""end"": 58, ""placeholder"": ""[LOC_2]"", ""surface_form"": ""فلسطين"", ""mask_type"": ""LOC""}]",2,approved,,
mt_msa_9b6e66c4,train,22203,MSA,الحل الثالث تظاف المخالفات لشركات,الحل الثالث تظاف المخالفات لشركات,الحل الثالث تظاف المخالفات لشركات,[],0,approved,,
mt_dial_egy_b448bbab,train,2750,DIAL_EGY,هما يحبوا بعض هما يبوسوا,هما يحبوا بعض هما يبوسوا,هما يحبوا بعض هما يبوسوا,[],0,approved,,
mt_dial_glf_8d9ecf07,train,18894,DIAL_GLF,و بعدين مع وحوش الاطفال هذول ! !,و بعدين مع وحوش الاطفال هذول,و بعدين مع وحوش الاطفال هذول ! !,[],0,approved,,
mt_msa_a3175e24,train,21554,MSA,هو السبب الأول والأهم والأخطر,هو السبب الاول والاهم والاخطر,هو السبب الأول والأهم والأخطر,[],0,approved,,
mt_dial_egy_018b1e52,train,43482,DIAL_EGY,زى القرع نمد لبرره وياريت بره كان يستاهل بلا,زي القرع نمد لبرره وياريت بره كان يستاهل بلا,زى القرع نمد لبرره وياريت بره كان يستاهل بلا,[],0,approved,,
mt_dial_glf_d8d12efe,train,4948,DIAL_GLF,و الله زين يوم سموها غزلان مو,و الله زين يوم سموها غزلان مو,و الله زين يوم سموها غزلان مو,[],0,approved,,
mt_dial_lev_acb32228,train,14931,DIAL_LEV,بس النتيجة فقدان ثقة الناس بالبلد !,بس النتيجه فقدان ثقه الناس بالبلد,بس النتيجة فقدان ثقة الناس بالبلد !,[],0,approved,,
mt_msa_e2311b6b,train,4981,MSA,"تقديرى الفائز الأول فى هذه الإنتخابات هو الشعب السودانى الذى اثبتت هذه التجربه انه شعب استفاد من التجارب السابقة وانه قاد على يحدد اختياره نتيجة النقلة الكبيرة التى احدثتها ثورة الانقاذ , , , نسال الله الإعانة للمجاهد عمر",تقديري الفايز الاول في هذه الانتخابات هو الشعب السوداني الذي اثبتت هذه التجربه انه شعب استفاد من التجارب السابقه وانه قاد علي يحدد اختياره نتيجه النقله الكبيره التي احدثتها ثوره الانقاذ نسال الله الاعانه للمجاهد عمر,"تقديرى الفائز الأول فى هذه الإنتخابات هو الشعب السودانى الذى اثبتت هذه التجربه انه شعب استفاد من التجارب السابقة وانه قاد على يحدد اختياره نتيجة النقلة الكبيرة التى احدثتها ثورة الانقاذ , , , نسال الله الإعانة للمجاهد [PERSON_1]","[{""start"": 218, ""end"": 221, ""placeholder"": ""[PERSON_1]"", ""surface_form"": ""عمر"", ""mask_type"": ""PERSON""}]",1,approved,,
mt_dial_egy_7bc6f727,train,19554,DIAL_EGY,يبقى يستحق يدخل موسوعة جينيس بصراحة :,يبقي يستحق يدخل موسوعه جينيس بصراحه,يبقى يستحق يدخل موسوعة جينيس بصراحة :,[],0,approved,,
mt_dial_glf_f9bd047c,train,3128,DIAL_GLF,اولا . . . مستحيل احد يرفض يزوج بنتة اذا كان الرجل من جماعتة ومعروف الاصل والنسب . . . اما انة يرفض يزوج بنتة الا من,اولا مستحيل احد يرفض يزوج بنته اذا كان الرجل من جماعته ومعروف الاصل والنسب اما انه يرفض يزوج بنته الا من,اولا . . . مستحيل احد يرفض يزوج بنتة اذا كان الرجل من جماعتة ومعروف الاصل والنسب . . . اما انة يرفض يزوج بنتة الا من,[],0,approved,,
mt_dial_lev_ef4a63c8,train,3811,DIAL_LEV,1 - اتروح وترجع في السلامه يا استاذ طارق خوري وياريت يرجع حسن مع المونديال وثانين احمد كشكش اهم لعب يوقعغ مع الوحدات لا عماني ولا اسباني وثانين وسيم لبزور كويس وخير انشاء الله شو مالو الحوت عامر شفيع وعمان عبدالله ذيب لعب ممتاز كتير واخران الف صحه وعافيه على الكيكهيا رافت ويا عامر ومحمد جمال وبتوفيق الوحدات في الموسم الوقبل ونحن ورائك يا الزعيم الاخضر يا المارد يا المبارطور سلام سلا مات كل الرنتيسيه بحبو,1 اتروح وترجع في السلامه يا استاذ طارق خوري وياريت يرجع حسن مع المونديال وثانين احمد كشكش اهم لعب يوقعغ مع الوحدات لا عماني ولا اسباني وثانين وسيم لبزور كويس وخير انشاء الله شو مالو الحوت عامر شفيع وعمان عبدالله ذيب لعب ممتاز كتير واخران الف صحه وعافيه علي الكيكهيا رافت ويا عامر ومحمد جمال وبتوفيق الوحدات في الموسم الوقبل ونحن ورايك يا الزعيم الاخضر يا المارد يا المبارطور سلام سلا مات كل الرنتيسيه بحبو,[NUM_1] - اتروح وترجع في السلامه يا استاذ [PERSON_1] [PERSON_2] وياريت يرجع [PERSON_3] مع المونديال وثانين [PERSON_4] [PERSON_5] اهم لعب يوقعغ مع [ORG_1] لا عماني ولا اسباني وثانين [PERSON_6] [PERSON_7] كويس وخير انشاء الله شو مالو الحوت [PERSON_8] [PERSON_9] وعمان [PERSON_10] [PERSON_11] لعب ممتاز كتير واخران الف صحه وعافيه على الكيكهيا [PERSON_12] ويا [PERSON_8] و[PERSON_13] [PERSON_14] وبتوفيق [ORG_1] في الموسم الوقبل ونحن ورائك يا الزعيم الاخضر يا المارد يا المبارطور سلام سلا مات كل الرنتيسيه بحبو,"[{""start"": 0, ""end"": 1, ""placeholder"": ""[NUM_1]"", ""surface_form"": ""1"", ""mask_type"": ""NUM""}, {""start"": 36, ""end"": 40, ""placeholder"": ""[PERSON_1]"", ""surface_form"": ""طارق"", ""mask_type"": ""PERSON""}, {""start"": 41, ""end"": 45, ""placeholder"": ""[PERSON_2]"", ""surface_form"": ""خوري"", ""mask_type"": ""PERSON""}, {""start"": 58, ""end"": 61, ""placeholder"": ""[PERSON_3]"", ""surface_form"": ""حسن"", ""mask_type"": ""PERSON""}, {""start"": 82, ""end"": 86, ""placeholder"": ""[PERSON_4]"", ""surface_form"": ""احمد"", ""mask_type"": ""PERSON""}, {""start"": 87, ""end"": 91, ""placeholder"": ""[PERSON_5]"", ""surface_form"": ""كشكش"", ""mask_type"": ""PERSON""}, {""start"": 109, ""end"": 116, ""placeholder"": ""[ORG_1]"", ""surface_form"": ""الوحدات"", ""mask_type"": ""ORG""}, {""start"": 144, ""end"": 148, ""placeholder"": ""[PERSON_6]"", ""surface_form"": ""وسيم"", ""mask_type"": ""PERSON""}, {""start"": 149, ""end"": 154, ""placeholder"": ""[PERSON_7]"", ""surface_form"": ""لبزور"", ""mask_type"": ""PERSON""}, {""start"": 190, ""end"": 194, ""placeholder"": ""[PERSON_8]"", ""surface_form"": ""عامر"", ""mask_type"": ""PERSON""}, {""start"": 195, ""end"": 199, ""placeholder"": ""[PERSON_9]"", ""surface_form"": ""شفيع"", ""mask_type"": ""PERSON""}, {""start"": 206, ""end"": 213, ""placeholder"": ""[PERSON_10]"", ""surface_form"": ""عبدالله"", ""mask_type"": ""PERSON""}, {""start"": 214, ""end"": 217, ""placeholder"": ""[PERSON_11]"", ""surface_form"": ""ذيب"", ""mask_type"": ""PERSON""}, {""start"": 268, ""end"": 272, ""placeholder"": ""[PERSON_12]"", ""surface_form"": ""رافت"", ""mask_type"": ""PERSON""}, {""start"": 277, ""end"": 281, ""placeholder"": ""[PERSON_8]"", ""surface_form"": ""عامر"", ""mask_type"": ""PERSON""}, {""start"": 283, ""end"": 287, ""placeholder"": ""[PERSON_13]"", ""surface_form"": ""محمد"", ""mask_type"": ""PERSON""}, {""start"": 288, ""end"": 292, ""placeholder"": ""[PERSON_14]"", ""surface_form"": ""جمال"", ""mask_type"": ""PERSON""}, {""start"": 301, ""end"": 308, ""placeholder"": ""[ORG_1]"", ""surface_form"": ""الوحدات"", ""mask_type"": ""ORG""}]",18,approved,,
mt_msa_1b2ffe10,train,72667,MSA,هو نصيحة سيدنا يوسف : تزرعون سبع سنين دابا فما حصدتم فذروه فى سنبله الا قليلا مما تاكلون,هو نصيحه سيدنا يوسف تزرعون سبع سنين دابا فما حصدتم فذروه في سنبله الا قليلا مما تاكلون,هو نصيحة سيدنا [PERSON_1] : تزرعون سبع سنين دابا فما حصدتم فذروه فى سنبله الا قليلا مما تاكلون,"[{""start"": 15, ""end"": 19, ""placeholder"": ""[PERSON_1]"", ""surface_form"": ""يوسف"", ""mask_type"": ""PERSON""}]",1,approved,,
mt_dial_egy_e254ea3b,train,66622,DIAL_EGY,يا ريت ماكنت قابلتو . . . كملوا انتو بقا انا,يا ريت ماكنت قابلتو كملوا انتو بقا انا,يا ريت ماكنت قابلتو . . . كملوا انتو بقا انا,[],0,approved,,
mt_dial_glf_63dd6d9a,train,13378,DIAL_GLF,والمواطن ياغافل لك الله مايدري وش الصح اهم شي يفك,والمواطن ياغافل لك الله مايدري وش الصح اهم شي يفك,والمواطن ياغافل لك الله مايدري وش الصح اهم شي يفك,[],0,approved,,
mt_dial_lev_48dbf379,train,72978,DIAL_LEV,القاتل يقتل ولا عم نستنى بالغرب يطبقو القصاص عشان,القاتل يقتل ولا عم نستني بالغرب يطبقو القصاص عشان,القاتل يقتل ولا عم نستنى بالغرب يطبقو القصاص عشان,[],0,approved,,
mt_msa_3a399c57,train,5092,MSA,هل يعتقد المتقدمون بقضية ضد مصلحة السجون وفي المحاكم الاسرائيلية أنهم منتصرون لدم الشهيد ؟ ربما روحه تعدها جريمةأخرى وإهانة لما نذرت له إن كان لها أن تقول,هل يعتقد المتقدمون بقضيه ضد مصلحه السجون وفي المحاكم الاسراييليه انهم منتصرون لدم الشهيد ربما روحه تعدها جريمهاخري واهانه لما نذرت له ان كان لها ان تقول,هل يعتقد المتقدمون بقضية ضد [ORG_1] وفي المحاكم الاسرائيلية أنهم منتصرون لدم الشهيد ؟ ربما روحه تعدها جريمةأخرى وإهانة لما نذرت له إن كان لها أن تقول,"[{""start"": 28, ""end"": 40, ""placeholder"": ""[ORG_1]"", ""surface_form"": ""مصلحة السجون"", ""mask_type"": ""ORG""}]",1,approved,,
mt_dial_egy_9c61fb3f,train,79914,DIAL_EGY,اتمنة فوز برشلونة علي ريا ل مدريد يوم السبت سبعة صفر ومسي يسجل سوبر هترك في شبلك,اتمنه فوز برشلونه علي ريا ل مدريد يوم السبت سبعه صفر ومسي يسجل سوبر هترك في شبلك,اتمنة فوز [ORG_1] علي ريا ل [ORG_2] يوم السبت [NUM_1] صفر و[PERSON_1] يسجل سوبر هترك في شبلك,"[{""start"": 10, ""end"": 17, ""placeholder"": ""[ORG_1]"", ""surface_form"": ""برشلونة"", ""mask_type"": ""ORG""}, {""start"": 28, ""end"": 33, ""placeholder"": ""[ORG_2]"", ""surface_form"": ""مدريد"", ""mask_type"": ""ORG""}, {""start"": 44, ""end"": 48, ""placeholder"": ""[NUM_1]"", ""surface_form"": ""سبعة"", ""mask_type"": ""NUM""}, {""start"": 54, ""end"": 57, ""placeholder"": ""[PERSON_1]"", ""surface_form"": ""مسي"", ""mask_type"": ""PERSON""}]",4,approved,,
mt_dial_lev_8731cb30,train,38507,DIAL_LEV,مع احترامي للكل بس هي للأسف الحقيقة المرة,مع احترامي للكل بس هي للاسف الحقيقه المره,مع احترامي للكل بس هي للأسف الحقيقة المرة,[],0,approved,,
mt_msa_9bee7406,train,17998,MSA,نريد نظام مع المراقبه واعطاء رجال المرور,نريد نظام مع المراقبه واعطاء رجال المرور,نريد نظام مع المراقبه واعطاء رجال المرور,[],0,approved,,
mt_dial_egy_f3a587c1,train,45599,DIAL_EGY,النظام دة هش جدا يا اخواننا ضارب لخمة وخايف رغم انه اقوي م البرادعي 20000,النظام ده هش جدا يا اخواننا ضارب لخمه وخايف رغم انه اقوي م البرادعي 20000,النظام دة هش جدا يا اخواننا ضارب لخمة وخايف رغم انه اقوي م [PERSON_1] [NUM_1],"[{""start"": 59, ""end"": 67, ""placeholder"": ""[PERSON_1]"", ""surface_form"": ""البرادعي"", ""mask_type"": ""PERSON""}, {""start"": 68, ""end"": 73, ""placeholder"": ""[NUM_1]"", ""surface_form"": ""20000"", ""mask_type"": ""NUM""}]",2,approved,,
mt_dial_glf_bdead6c2,train,601,DIAL_GLF,اتذكر زمانك عبر حيا الله ذاك,اتذكر زمانك عبر حيا الله ذاك,اتذكر زمانك عبر حيا الله ذاك,[],0,approved,,
mt_dial_lev_b63a0661,train,61962,DIAL_LEV,مستوى كرة القدم في الاردن زي مستوى,مستوي كره القدم في الاردن زي مستوي,مستوى كرة القدم في [LOC_1] زي مستوى,"[{""start"": 19, ""end"": 25, ""placeholder"": ""[LOC_1]"", ""surface_form"": ""الاردن"", ""mask_type"": ""LOC""}]",1,approved,,
mt_msa_67c09821,train,9232,MSA,* اجواء المباره : - نار لهب حريقه بركان زلزال وخاصه في الشوط,اجواء المباره نار لهب حريقه بركان زلزال وخاصه في الشوط,* اجواء المباره : - نار لهب حريقه بركان زلزال وخاصه في الشوط,[],0,approved,,
mt_dial_egy_e4189029,train,33158,DIAL_EGY,الناس اللى بتضحك النهاردة بكرة,الناس اللي بتضحك النهارده بكره,الناس اللى بتضحك النهاردة بكرة,[],0,approved,,
mt_dial_glf_237d65c3,train,23277,DIAL_GLF,والله غزلان رايحه وطي شوفوا عيونها,والله غزلان رايحه وطي شوفوا عيونها,والله غزلان رايحه وطي شوفوا عيونها,[],0,approved,,
mt_dial_lev_82ac2d16,train,24988,DIAL_LEV,مين كان يتوقع انه هذا الثمر البسيط اله الفوائد الكبيره هاي اذا لازم نكثر من شرب عصير التمر هندي البيتي مش المصنع عند اصحاب المحلات لانه بيوضعوا فيه مواد تقوي,مين كان يتوقع انه هذا الثمر البسيط اله الفوايد الكبيره هاي اذا لازم نكثر من شرب عصير التمر هندي البيتي مش المصنع عند اصحاب المحلات لانه بيوضعوا فيه مواد تقوي,مين كان يتوقع انه هذا الثمر البسيط اله الفوائد الكبيره هاي اذا لازم نكثر من شرب عصير التمر هندي البيتي مش المصنع عند اصحاب المحلات لانه بيوضعوا فيه مواد تقوي,[],0,approved,,
mt_msa_30edc65f,train,81499,MSA,ولكن نتأمل في ابن همام كل خير فهو رجل قيادي وقوي,ولكن نتامل في ابن همام كل خير فهو رجل قيادي وقوي,ولكن نتأمل في [PERSON_1] كل خير فهو رجل قيادي وقوي,"[{""start"": 14, ""end"": 22, ""placeholder"": ""[PERSON_1]"", ""surface_form"": ""ابن همام"", ""mask_type"": ""PERSON""}]",1,approved,,
mt_dial_egy_3ba4df3b,train,21618,DIAL_EGY,أنا واللهى لا بحب شوبير ولا مرتضى بس كل الى عايز أقوله شكلك بقى وحش أوى,انا واللهي لا بحب شوبير ولا مرتضي بس كل الي عايز اقوله شكلك بقي وحش اوي,أنا واللهى لا بحب [PERSON_1] ولا [PERSON_2] بس كل الى عايز أقوله شكلك بقى وحش أوى,"[{""start"": 18, ""end"": 23, ""placeholder"": ""[PERSON_1]"", ""surface_form"": ""شوبير"", ""mask_type"": ""PERSON""}, {""start"": 28, ""end"": 33, ""placeholder"": ""[PERSON_2]"", ""surface_form"": ""مرتضى"", ""mask_type"": ""PERSON""}]",2,approved,,
