example_id,source_split,source_row_id,dialect,original_text,normalized_text,masked_text,mask_spans_json,mask_count,annotation_status,annotator_model,notes
mt_msa_4bed1ba6,train,25273,MSA,أتمنى الفوز لزعي الهلال م القارة الصفراء . .,اتمني الفوز لزعي الهلال م القاره الصفراء,أتمنى الفوز لزعي [ORG_1] م القارة الصفراء . .,"[{""start"": 17, ""end"": 23, ""placeholder"": ""[ORG_1]"", ""surface_form"": ""الهلال"", ""mask_type"": ""ORG""}]",1,approved,,
mt_dial_egy_451d84d5,train,50016,DIAL_EGY,أيوة الجزائر أحق حتي لو كان المنتخب المصري أفضل ، لأن كاس العالم كان ليها تصفيات من ست مباريات وسابعة فاصلة ، وماكناش,ايوه الجزاير احق حتي لو كان المنتخب المصري افضل لان كاس العالم كان ليها تصفيات من ست مباريات وسابعه فاصله وماكناش,أيوة [LOC_1] أحق حتي لو كان المنتخب المصري أفضل ، لأن كاس العالم كان ليها تصفيات من ست مباريات وسابعة فاصلة ، وماكناش,"[{""start"": 5, ""end"": 12, ""placeholder"": ""[LOC_1]"", ""surface_form"": ""الجزائر"", ""mask_type"": ""LOC""}]",1,approved,,
mt_dial_glf_2e825a5b,train,51815,DIAL_GLF,الحين الي كسر سيارة الهيئة مبسوط مسوي نفسه ماأحد قده وهو مايدري بأنه ماهي رجاله بالعكس نذاله وإن دل دل بأنه حقير يخس عليك لو أنك رجال تراجع المركز وتعتذر,الحين الي كسر سياره الهييه مبسوط مسوي نفسه مااحد قده وهو مايدري بانه ماهي رجاله بالعكس نذاله وان دل دل بانه حقير يخس عليك لو انك رجال تراجع المركز وتعتذر,الحين الي كسر سيارة الهيئة مبسوط مسوي نفسه ماأحد قده وهو مايدري بأنه ماهي رجاله بالعكس نذاله وإن دل دل بأنه حقير يخس عليك لو أنك رجال تراجع المركز وتعتذر,[],0,approved,,
mt_dial_lev_302cb06b,train,26792,DIAL_LEV,ويا ريت البنات يردوا عليك ويهتموا شوي بأنوثتهم وجمالهم . . . يعني البنت الي بتخليلي حواجبها 88 ما بتفرج على حالها قبل ما تطلع ؟ ؟,ويا ريت البنات يردوا عليك ويهتموا شوي بانوثتهم وجمالهم يعني البنت الي بتخليلي حواجبها 88 ما بتفرج علي حالها قبل ما تطلع,ويا ريت البنات يردوا عليك ويهتموا شوي بأنوثتهم وجمالهم . . . يعني البنت الي بتخليلي حواجبها [NUM_1] ما بتفرج على حالها قبل ما تطلع ؟ ؟,"[{""start"": 92, ""end"": 94, ""placeholder"": ""[NUM_1]"", ""surface_form"": ""88"", ""mask_type"": ""NUM""}]",1,approved,,
mt_msa_7c28865c,train,38477,MSA,فعلا موقع وجريدة محترمة وتنشر ما تريده من,فعلا موقع وجريده محترمه وتنشر ما تريده من,فعلا موقع وجريدة محترمة وتنشر ما تريده من,[],0,approved,,
mt_dial_egy_6ad13a63,train,46793,DIAL_EGY,أستاذ ابرهيم ربيع مقارنه جميله ولكن ماردونا احرف بكتير ولكنى معجب,استاذ ابرهيم ربيع مقارنه جميله ولكن ماردونا احرف بكتير ولكني معجب,أستاذ [PERSON_1] [PERSON_2] مقارنه جميله ولكن [PERSON_3] احرف بكتير ولكنى معجب,"[{""start"": 6, ""end"": 12, ""placeholder"": ""[PERSON_1]"", ""surface_form"": ""ابرهيم"", ""mask_type"": ""PERSON""}, {""start"": 13, ""end"": 17, ""placeholder"": ""[PERSON_2]"", ""surface_form"": ""ربيع"", ""mask_type"": ""PERSON""}, {""start"": 36, ""end"": 43, ""placeholder"": ""[PERSON_3]"", ""surface_form"": ""ماردونا"", ""mask_type"": ""PERSON""}]",3,approved,,
mt_dial_glf_06e76cd8,train,22281,DIAL_GLF,مافيه امل يجون بس كل يمني النفس واللي مايعرف يتكلم يلزمنا بسكوته,مافيه امل يجون بس كل يمني النفس واللي مايعرف يتكلم يلزمنا بسكوته,مافيه امل يجون بس كل يمني النفس واللي مايعرف يتكلم يلزمنا بسكوته,[],0,approved,,
mt_dial_lev_b6cba4c6,train,18636,DIAL_LEV,"على هيك لما أتزوج اذا طلعت مرتي فيها رحمين بيطلعلي أتجوز بس تنتين غيرها بس يا حبيبي رحنا فيها , ولا سيبنا من هالحكي صارلي بشتغل سنتين مهندس ومش محوش قرش بفضل . . . يلا مو مشكلة بنشوفلنا وحدة تصرف علينا وعالبيت وينها الله يجبر بخاطرها",علي هيك لما اتزوج اذا طلعت مرتي فيها رحمين بيطلعلي اتجوز بس تنتين غيرها بس يا حبيبي رحنا فيها ولا سيبنا من هالحكي صارلي بشتغل سنتين مهندس ومش محوش قرش بفضل يلا مو مشكله بنشوفلنا وحده تصرف علينا وعالبيت وينها الله يجبر بخاطرها,"على هيك لما أتزوج اذا طلعت مرتي فيها رحمين بيطلعلي أتجوز بس تنتين غيرها بس يا حبيبي رحنا فيها , ولا سيبنا من هالحكي صارلي بشتغل [NUM_1] مهندس ومش محوش قرش بفضل . . . يلا مو مشكلة بنشوفلنا وحدة تصرف علينا وعالبيت وينها الله يجبر بخاطرها","[{""start"": 128, ""end"": 133, ""placeholder"": ""[NUM_1]"", ""surface_form"": ""سنتين"", ""mask_type"": ""NUM""}]",1,approved,,
mt_msa_89e4bd6d,train,78952,MSA,مع اني لا اثق بمصادقيه الخبر ولكن . .,مع اني لا اثق بمصادقيه الخبر ولكن,مع اني لا اثق بمصادقيه الخبر ولكن . .,[],0,approved,,
mt_dial_egy_bb4378ce,train,10442,DIAL_EGY,الله على الكرة في مصر والله انتم شعب همجي والفيفا كانت على حق عندما عاقبة ابراهيم حسن لمدة خمسة سنوات وهذه نقطة سوداء في الكرة المصرية لكي تظاف الى اللملف المعفن بتاعكم في الفيفا إنشالله إسلط عليكم عقوبة متلعبوش الكرة مدة 10,الله علي الكره في مصر والله انتم شعب همجي والفيفا كانت علي حق عندما عاقبه ابراهيم حسن لمده خمسه سنوات وهذه نقطه سوداء في الكره المصريه لكي تظاف الي اللملف المعفن بتاعكم في الفيفا انشالله اسلط عليكم عقوبه متلعبوش الكره مده 10,الله على الكرة في [LOC_1] والله انتم شعب همجي و[ORG_1] كانت على حق عندما عاقبة [PERSON_1] لمدة [NUM_1] سنوات وهذه نقطة سوداء في الكرة المصرية لكي تظاف الى اللملف المعفن بتاعكم في [ORG_1] إنشالله إسلط عليكم عقوبة متلعبوش الكرة مدة [NUM_2],"[{""start"": 18, ""end"": 21, ""placeholder"": ""[LOC_1]"", ""surface_form"": ""مصر"", ""mask_type"": ""LOC""}, {""start"": 43, ""end"": 49, ""placeholder"": ""[ORG_1]"", ""surface_form"": ""الفيفا"", ""mask_type"": ""ORG""}, {""start"": 74, ""end"": 85, ""placeholder"": ""[PERSON_1]"", ""surface_form"": ""ابراهيم حسن"", ""mask_type"": ""PERSON""}, {""start"": 91, ""end"": 95, ""placeholder"": ""[NUM_1]"", ""surface_form"": ""خمسة"", ""mask_type"": ""NUM""}, {""start"": 172, ""end"": 178, ""placeholder"": ""[ORG_1]"", ""surface_form"": ""الفيفا"", ""mask_type"": ""ORG""}, {""start"": 222, ""end"": 224, ""placeholder"": ""[NUM_2]"", ""surface_form"": ""10"", ""mask_type"": ""NUM""}]",6,approved,,
mt_dial_glf_d7b30bb5,train,17128,DIAL_GLF,عجبتني كلمت مدير اول شي وشلون مدير عام ومقيم وين التوضيف ياوزارة وابناء البلد مافيهم احد يسد يكون مدير بعدين صباح الخير يامقيم بدل ماتبوس يدك وش وقفا معيشينك ياوطي وماكل من خير البلد وعمرك 49 سنة والله زي هذا المفروض كل يوم يقطعون من رقبته شوي ويكملونه اليوم الثاني علشان يكون عبرة,عجبتني كلمت مدير اول شي وشلون مدير عام ومقيم وين التوضيف ياوزاره وابناء البلد مافيهم احد يسد يكون مدير بعدين صباح الخير يامقيم بدل ماتبوس يدك وش وقفا معيشينك ياوطي وماكل من خير البلد وعمرك 49 سنه والله زي هذا المفروض كل يوم يقطعون من رقبته شوي ويكملونه اليوم الثاني علشان يكون عبره,عجبتني كلمت مدير اول شي وشلون مدير عام ومقيم وين التوضيف ياوزارة وابناء البلد مافيهم احد يسد يكون مدير بعدين صباح الخير يامقيم بدل ماتبوس يدك وش وقفا معيشينك ياوطي وماكل من خير البلد وعمرك [NUM_1] سنة والله زي هذا المفروض كل يوم يقطعون من رقبته شوي ويكملونه اليوم الثاني علشان يكون عبرة,"[{""start"": 189, ""end"": 191, ""placeholder"": ""[NUM_1]"", ""surface_form"": ""49"", ""mask_type"": ""NUM""}]",1,approved,,
mt_dial_lev_f17d4868,train,64863,DIAL_LEV,"بصراحة انا عشت التجربة وفعلا انو الرجل اكثر مضره وخصوصا اذا كانت الزوجة غير مبالية بدون اي مسئولية , بس الي مهون علي وجود الاولاد",بصراحه انا عشت التجربه وفعلا انو الرجل اكثر مضره وخصوصا اذا كانت الزوجه غير مباليه بدون اي مسيوليه بس الي مهون علي وجود الاولاد,"بصراحة انا عشت التجربة وفعلا انو الرجل اكثر مضره وخصوصا اذا كانت الزوجة غير مبالية بدون اي مسئولية , بس الي مهون علي وجود الاولاد",[],0,approved,,
mt_msa_de0e7c38,train,17500,MSA,انت لاعب كبير وفى نادى محترم لا تلتفت الى الاصوات العاليه التى لا يسمعها احد وبالتوفيق ان شاء الله فى الملعب وخارج الملعب,انت لاعب كبير وفي نادي محترم لا تلتفت الي الاصوات العاليه التي لا يسمعها احد وبالتوفيق ان شاء الله في الملعب وخارج الملعب,انت لاعب كبير وفى نادى محترم لا تلتفت الى الاصوات العاليه التى لا يسمعها احد وبالتوفيق ان شاء الله فى الملعب وخارج الملعب,[],0,approved,,
mt_dial_egy_349e5df9,train,31968,DIAL_EGY,ياعم امبومة مين زى بتستوتا لعب,ياعم امبومه مين زي بتستوتا لعب,ياعم [PERSON_1] مين زى بتستوتا لعب,"[{""start"": 5, ""end"": 11, ""placeholder"": ""[PERSON_1]"", ""surface_form"": ""امبومة"", ""mask_type"": ""PERSON""}]",1,approved,,
mt_dial_glf_4aa463d9,train,17858,DIAL_GLF,لا كشرت في وقتك ايامك السود .,لا كشرت في وقتك ايامك السود,لا كشرت في وقتك ايامك السود .,[],0,approved,,
mt_dial_lev_2e99c0b0,train,55842,DIAL_LEV,الحمدلله عنا مخ لانه في ناس بايعينه من زمان وقرأين عليه الفاتحة . .,الحمدلله عنا مخ لانه في ناس بايعينه من زمان وقراين عليه الفاتحه,الحمدلله عنا مخ لانه في ناس بايعينه من زمان وقرأين عليه الفاتحة . .,[],0,approved,,
mt_msa_d0063f47,train,3919,MSA,هذا دليل على الانسجاام بين الزوجين .,هذا دليل علي الانسجاام بين الزوجين,هذا دليل على الانسجاام بين الزوجين .,[],0,approved,,
mt_dial_egy_94ab6700,train,19372,DIAL_EGY,مش عارف ليه الصحفيين مش مهتمين غير برشوة المرسيدس ؟ ولم يجرؤ واحد منهم أن يسأل أين تذهب فلوس قناة السويس التى يكفى دخلها وحدها ليعيش كل شعب مصر كأغنى شعب ؟ أو أين تذهب فلوس البترول ؟ أو من المسئول عن تصدير الغاز لإسرائيل بملاليم ؟ وما كمية ونوعية الرشوة التى حصل عليها ؟ إن هذا كله سببه غياب الديمقراطية وغياب المحاسبه . عرفتم ليه الحكومة بتحارب قانون محاكمة الوزراء ولن تسمح بالموافقة عليه,مش عارف ليه الصحفيين مش مهتمين غير برشوه المرسيدس ولم يجرو واحد منهم ان يسال اين تذهب فلوس قناه السويس التي يكفي دخلها وحدها ليعيش كل شعب مصر كاغني شعب او اين تذهب فلوس البترول او من المسيول عن تصدير الغاز لاسراييل بملاليم وما كميه ونوعيه الرشوه التي حصل عليها ان هذا كله سببه غياب الديمقراطيه وغياب المحاسبه عرفتم ليه الحكومه بتحارب قانون محاكمه الوزراء ولن تسمح بالموافقه عليه,مش عارف ليه الصحفيين مش مهتمين غير برشوة المرسيدس ؟ ولم يجرؤ واحد منهم أن يسأل أين تذهب فلوس قناة السويس التى يكفى دخلها وحدها ليعيش كل شعب [LOC_1] كأغنى شعب ؟ أو أين تذهب فلوس البترول ؟ أو من المسئول عن تصدير الغاز ل[LOC_2] بملاليم ؟ وما كمية ونوعية الرشوة التى حصل عليها ؟ إن هذا كله سببه غياب الديمقراطية وغياب المحاسبه . عرفتم ليه الحكومة بتحارب قانون محاكمة الوزراء ولن تسمح بالموافقة عليه,"[{""start"": 140, ""end"": 143, ""placeholder"": ""[LOC_1]"", ""surface_form"": ""مصر"", ""mask_type"": ""LOC""}, {""start"": 213, ""end"": 220, ""placeholder"": ""[LOC_2]"", ""surface_form"": ""إسرائيل"", ""mask_type"": ""LOC""}]",2,approved,,
mt_dial_glf_12aa7e9e,train,73455,DIAL_GLF,بس الزعيم باذن الله الى,بس الزعيم باذن الله الي,بس الزعيم باذن الله الى,[],0,approved,,
mt_dial_lev_98ea1a92,train,6747,DIAL_LEV,معلش خليها تاخد قسط من الراحه خلص بكفيها ما,معلش خليها تاخد قسط من الراحه خلص بكفيها ما,معلش خليها تاخد قسط من الراحه خلص بكفيها ما,[],0,approved,,
mt_msa_048b292c,train,81827,MSA,ما اجمل تونس في فصل,ما اجمل تونس في فصل,ما اجمل [LOC_1] في فصل,"[{""start"": 8, ""end"": 12, ""placeholder"": ""[LOC_1]"", ""surface_form"": ""تونس"", ""mask_type"": ""LOC""}]",1,approved,,
mt_dial_egy_188f064e,train,19161,DIAL_EGY,هما الى مدوا إديهم على الأمن,هما الي مدوا اديهم علي الامن,هما الى مدوا إديهم على الأمن,[],0,approved,,
mt_dial_glf_ae5d547d,train,64253,DIAL_GLF,الله يعنكم ياهل الشمال ومو عندكم بس كمان,الله يعنكم ياهل الشمال ومو عندكم بس كمان,الله يعنكم ياهل الشمال ومو عندكم بس كمان,[],0,approved,,
mt_dial_lev_791a4dbc,train,74832,DIAL_LEV,على هيك الصوت اللي رح تصوته زوجتي رح يدفعني 3 دنانير للاحوال ودينار رايح لتجديد الهوية ودينار راجع للبيت ودينار رايح للتصويت ودينار راجع للبيت يعني بتكلفني العملية كلها 7,علي هيك الصوت اللي رح تصوته زوجتي رح يدفعني 3 دنانير للاحوال ودينار رايح لتجديد الهويه ودينار راجع للبيت ودينار رايح للتصويت ودينار راجع للبيت يعني بتكلفني العمليه كلها 7,على هيك الصوت اللي رح تصوته زوجتي رح يدفعني [NUM_1] دنانير للاحوال ودينار رايح لتجديد الهوية ودينار راجع للبيت ودينار رايح للتصويت ودينار راجع للبيت يعني بتكلفني العملية كلها [NUM_2],"[{""start"": 44, ""end"": 45, ""placeholder"": ""[NUM_1]"", ""surface_form"": ""3"", ""mask_type"": ""NUM""}, {""start"": 169, ""end"": 170, ""placeholder"": ""[NUM_2]"", ""surface_form"": ""7"", ""mask_type"": ""NUM""}]",2,approved,,
mt_msa_b46638c9,train,45325,MSA,في الحديث أحب أن أوجه سؤال الي أحمد حسن إذا تكلم ابراهيم حسن المنشطات لم يقصد أي لاعب ولا أي نادي وانت الوحيد من جميع الاعبين اللي تكلمت في هذا الموضوع اية السبب في ذلك وبلاش كلام كتير حول هذا الموضوع وفين إدارة النادي التي تسمح لك بكل هذه الاحاديث الكثيرة وإذا كنت قصدت حسام حسن أنه هو المثل الأعلي لكل اللاعبين فأنت لم توضح ذلك بل قلت مثال حسام حسن كان يلعب حتي سن 39 سنه ولم تقل انه مثل لكل اللاعبين ياريت تبطل كلام كتير تلعب كورة افضل إذا كنت بتلعب كورة مش من أجل المال ولديك أعمالك الخاصة اترك الملعب الآن وخليك في اعمالك وانت بعد ما تعتزل اللعب حتقعد في البيت ولا يمكن أن تكون مدرب ناجح,في الحديث احب ان اوجه سوال الي احمد حسن اذا تكلم ابراهيم حسن المنشطات لم يقصد اي لاعب ولا اي نادي وانت الوحيد من جميع الاعبين اللي تكلمت في هذا الموضوع ايه السبب في ذلك وبلاش كلام كتير حول هذا الموضوع وفين اداره النادي التي تسمح لك بكل هذه الاحاديث الكثيره واذا كنت قصدت حسام حسن انه هو المثل الاعلي لكل اللاعبين فانت لم توضح ذلك بل قلت مثال حسام حسن كان يلعب حتي سن 39 سنه ولم تقل انه مثل لكل اللاعبين ياريت تبطل كلام كتير تلعب كوره افضل اذا كنت بتلعب كوره مش من اجل المال ولديك اعمالك الخاصه اترك الملعب الان وخليك في اعمالك وانت بعد ما تعتزل اللعب حتقعد في البيت ولا يمكن ان تكون مدرب ناجح,في الحديث أحب أن أوجه سؤال الي [PERSON_1] إذا تكلم [PERSON_2] المنشطات لم يقصد أي لاعب ولا أي نادي وانت الوحيد من جميع الاعبين اللي تكلمت في هذا الموضوع اية السبب في ذلك وبلاش كلام كتير حول هذا الموضوع وفين إدارة النادي التي تسمح لك بكل هذه الاحاديث الكثيرة وإذا كنت قصدت [PERSON_3] أنه هو المثل الأعلي لكل اللاعبين فأنت لم توضح ذلك بل قلت مثال [PERSON_3] كان يلعب حتي سن [NUM_1] سنه ولم تقل انه مثل لكل اللاعبين ياريت تبطل كلام كتير تلعب كورة افضل إذا كنت بتلعب كورة مش من أجل المال ولديك أعمالك الخاصة اترك الملعب الآن وخليك في اعمالك وانت بعد ما تعتزل اللعب حتقعد في البيت ولا يمكن أن تكون مدرب ناجح,"[{""start"": 31, ""end"": 39, ""placeholder"": ""[PERSON_1]"", ""surface_form"": ""أحمد حسن"", ""mask_type"": ""PERSON""}, {""start"": 49, ""end"": 60, ""placeholder"": ""[PERSON_2]"", ""surface_form"": ""ابراهيم حسن"", ""mask_type"": ""PERSON""}, {""start"": 271, ""end"": 279, ""placeholder"": ""[PERSON_3]"", ""surface_form"": ""حسام حسن"", ""mask_type"": ""PERSON""}, {""start"": 342, ""end"": 350, ""placeholder"": ""[PERSON_3]"", ""surface_form"": ""حسام حسن"", ""mask_type"": ""PERSON""}, {""start"": 367, ""end"": 369, ""placeholder"": ""[NUM_1]"", ""surface_form"": ""39"", ""mask_type"": ""NUM""}]",5,approved,,
mt_dial_egy_92b8217a,train,49028,DIAL_EGY,كده عداهم العيب والله طلاب,كده عداهم العيب والله طلاب,كده عداهم العيب والله طلاب,[],0,approved,,
mt_dial_glf_f0bec5cc,train,50114,DIAL_GLF,الحين عندنا اللي زعلان من شي على طول يفكر في,الحين عندنا اللي زعلان من شي علي طول يفكر في,الحين عندنا اللي زعلان من شي على طول يفكر في,[],0,approved,,
