example_id,source_split,source_row_id,dialect,original_text,normalized_text,masked_text,mask_spans_json,mask_count,annotation_status,annotator_model,notes
mt_dial_glf_34255e9e,train,16153,DIAL_GLF,اتمنى انك تهتموا بالشباب العاطلين وتتركوا توظيف البنات سنتين عشان الشباب وراهم مسؤلييات البنات ماورهم الا الاسواق,اتمني انك تهتموا بالشباب العاطلين وتتركوا توظيف البنات سنتين عشان الشباب وراهم مسولييات البنات ماورهم الا الاسواق,اتمنى انك تهتموا بالشباب العاطلين وتتركوا توظيف البنات سنتين عشان الشباب وراهم مسؤلييات البنات ماورهم الا الاسواق,[],0,approved,,
mt_dial_lev_25029cb1,train,82523,DIAL_LEV,اهم شي ان المانيا خارج,اهم شي ان المانيا خارج,اهم شي ان [LOC_1] خارج,"[{""start"": 10, ""end"": 17, ""placeholder"": ""[LOC_1]"", ""surface_form"": ""المانيا"", ""mask_type"": ""LOC""}]",1,approved,,
mt_msa_9bcb7ef9,train,58824,MSA,يجب الغاء اتفاقية وادي عربه اولا ودعوا الشعب ان يقرر اذا ادعيتم الديمقراطيه و عودة التجنيدالاجباري ثانيالتهذيب الاجبال المايعه الا ترون تفشي الجرائم والاقتتال,يجب الغاء اتفاقيه وادي عربه اولا ودعوا الشعب ان يقرر اذا ادعيتم الديمقراطيه و عوده التجنيدالاجباري ثانيالتهذيب الاجبال المايعه الا ترون تفشي الجرايم والاقتتال,يجب الغاء اتفاقية [LOC_1] اولا ودعوا الشعب ان يقرر اذا ادعيتم الديمقراطيه و عودة التجنيدالاجباري ثانيالتهذيب الاجبال المايعه الا ترون تفشي الجرائم والاقتتال,"[{""start"": 18, ""end"": 27, ""placeholder"": ""[LOC_1]"", ""surface_form"": ""وادي عربه"", ""mask_type"": ""LOC""}]",1,approved,,
mt_dial_egy_a77728dd,train,24263,DIAL_EGY,بصرحه انتو مسبتوليش حاجه اقولها عين العقل حماقي حببنا وحيفضل كده على,بصرحه انتو مسبتوليش حاجه اقولها عين العقل حماقي حببنا وحيفضل كده علي,بصرحه انتو مسبتوليش حاجه اقولها عين العقل [PERSON_1] حببنا وحيفضل كده على,"[{""start"": 42, ""end"": 47, ""placeholder"": ""[PERSON_1]"", ""surface_form"": ""حماقي"", ""mask_type"": ""PERSON""}]",1,approved,,
mt_dial_glf_37e72857,train,27882,DIAL_GLF,اي رعب ياعمي هذا وهو فايز عليكم بالخمسه مانقول الاحسبي الله على لجنة,اي رعب ياعمي هذا وهو فايز عليكم بالخمسه مانقول الاحسبي الله علي لجنه,اي رعب ياعمي هذا وهو فايز عليكم بالخمسه مانقول الاحسبي الله على لجنة,[],0,approved,,
mt_msa_a46c49c2,train,77165,MSA,القاسم هو اجادة التصفيق والنفاق,القاسم هو اجاده التصفيق والنفاق,القاسم هو اجادة التصفيق والنفاق,[],0,approved,,
mt_dial_egy_bf2bc825,train,29422,DIAL_EGY,"أصحوا بقى وكلمونا على الإيجابيات وإزاى نقدر نطور من نفسنا وإزاى ننهض ,",اصحوا بقي وكلمونا علي الايجابيات وازاي نقدر نطور من نفسنا وازاي ننهض,"أصحوا بقى وكلمونا على الإيجابيات وإزاى نقدر نطور من نفسنا وإزاى ننهض ,",[],0,approved,,
mt_dial_glf_663a1551,train,20118,DIAL_GLF,واثر البيض عندهم بعد خابر ورعانا يتخاذفون بالبيض,واثر البيض عندهم بعد خابر ورعانا يتخاذفون بالبيض,واثر البيض عندهم بعد خابر ورعانا يتخاذفون بالبيض,[],0,approved,,
mt_dial_lev_3aead030,train,68165,DIAL_LEV,لما يكون المديونية 12 مليار يعني كل مواطن مديون الفين دينار وكل طفل هلا ينولد نفس شي مديون بالفين دينار,لما يكون المديونيه 12 مليار يعني كل مواطن مديون الفين دينار وكل طفل هلا ينولد نفس شي مديون بالفين دينار,لما يكون المديونية [NUM_1] مليار يعني كل مواطن مديون الفين دينار وكل طفل هلا ينولد نفس شي مديون بالفين دينار,"[{""start"": 19, ""end"": 21, ""placeholder"": ""[NUM_1]"", ""surface_form"": ""12"", ""mask_type"": ""NUM""}]",1,approved,,
mt_msa_e23f7678,train,71824,MSA,""" ولا تحسبن الله غافلا عما يعمل الظالمون انما يؤخرهم ليوم تشخص فيه الابصار مهطعين مقنعي رؤؤسهم لا يرتد اليهم طرفهم وافئدتهم هواء",ولا تحسبن الله غافلا عما يعمل الظالمون انما يوخرهم ليوم تشخص فيه الابصار مهطعين مقنعي رووسهم لا يرتد اليهم طرفهم وافيدتهم هواء,""" ولا تحسبن الله غافلا عما يعمل الظالمون انما يؤخرهم ليوم تشخص فيه الابصار مهطعين مقنعي رؤؤسهم لا يرتد اليهم طرفهم وافئدتهم هواء",[],0,approved,,
