example_id,source_split,source_row_id,dialect,original_text,normalized_text,masked_text,mask_spans_json,mask_count,annotation_status,annotator_model,notes
mt_dial_egy_d3145b03,train,2103,DIAL_EGY,وللمصريين ماتهتموش كتير بالشتايم اللي بيقولها بعض الجزائريين ، الجزائريين أخوتكم ، أخوك ممكن يشتمك وهو غضبان بس مش,وللمصريين ماتهتموش كتير بالشتايم اللي بيقولها بعض الجزايريين الجزايريين اخوتكم اخوك ممكن يشتمك وهو غضبان بس مش,وللمصريين ماتهتموش كتير بالشتايم اللي بيقولها بعض [LOC_1] ، [LOC_1] أخوتكم ، أخوك ممكن يشتمك وهو غضبان بس مش,"[{""start"": 50, ""end"": 60, ""placeholder"": ""[LOC_1]"", ""surface_form"": ""الجزائريين"", ""mask_type"": ""LOC""}, {""start"": 63, ""end"": 73, ""placeholder"": ""[LOC_1]"", ""surface_form"": ""الجزائريين"", ""mask_type"": ""LOC""}]",2,approved,,
mt_dial_glf_6fbc7699,train,11470,DIAL_GLF,أهم شي لاتروحون كازابلانكا خ خ خ و الله الظاهر من الحين فاقد بو الشباب ^__^ . . مشكوور أبو,اهم شي لاتروحون كازابلانكا خ خ خ و الله الظاهر من الحين فاقد بو الشباب __ مشكوور ابو,أهم شي لاتروحون [LOC_1] خ خ خ و الله الظاهر من الحين فاقد بو الشباب ^__^ . . مشكوور أبو,"[{""start"": 16, ""end"": 26, ""placeholder"": ""[LOC_1]"", ""surface_form"": ""كازابلانكا"", ""mask_type"": ""LOC""}]",1,approved,,
mt_dial_lev_afb81f42,train,86101,DIAL_LEV,وعلى قولة ابو عواد : آه يا زمن الشقلبة . .,وعلي قوله ابو عواد اه يا زمن الشقلبه,وعلى قولة ابو [PERSON_1] : آه يا زمن الشقلبة . .,"[{""start"": 14, ""end"": 18, ""placeholder"": ""[PERSON_1]"", ""surface_form"": ""عواد"", ""mask_type"": ""PERSON""}]",1,approved,,
mt_msa_c79962d3,train,29887,MSA,طيب اذاحذفنا الزرنيخ السام المسرطن للجلد منالكبسوله هل الاعشاب الباقيه جيذه ولها مفعول,طيب اذاحذفنا الزرنيخ السام المسرطن للجلد منالكبسوله هل الاعشاب الباقيه جيذه ولها مفعول,طيب اذاحذفنا الزرنيخ السام المسرطن للجلد منالكبسوله هل الاعشاب الباقيه جيذه ولها مفعول,[],0,approved,,
mt_dial_egy_4c9a8f17,train,44940,DIAL_EGY,ولا هما مبيقدروش الا على,ولا هما مبيقدروش الا علي,ولا هما مبيقدروش الا على,[],0,approved,,
mt_dial_glf_d83acf50,train,37889,DIAL_GLF,مشكلة التجار وأصحاب العقار مافي أحد يردعهم يقلدون بعض ويغارون من بعض وش معنى فلان رفع سعره وزادت ثروته وأنا لا ؟ ! صراحه مالومهم لو إني منهم ألعب مثلهم حتى الحكومه ماتقدر تسويلي شي . . أنظمه عجيبه,مشكله التجار واصحاب العقار مافي احد يردعهم يقلدون بعض ويغارون من بعض وش معني فلان رفع سعره وزادت ثروته وانا لا صراحه مالومهم لو اني منهم العب مثلهم حتي الحكومه ماتقدر تسويلي شي انظمه عجيبه,مشكلة التجار وأصحاب العقار مافي أحد يردعهم يقلدون بعض ويغارون من بعض وش معنى فلان رفع سعره وزادت ثروته وأنا لا ؟ ! صراحه مالومهم لو إني منهم ألعب مثلهم حتى الحكومه ماتقدر تسويلي شي . . أنظمه عجيبه,[],0,approved,,
mt_dial_lev_b8dfcb47,train,54267,DIAL_LEV,"استقيظت بغرض الذهاب للحمام فإذا بضوء الحمام مضاء قلت لعلي نسيت و تركته مضاء و لما اقتربت من الحمام انطفأ الضوء ثم اضاء مرة أخرى فإذا أنا بصديقي يقف قرب مرأة الحمام كانه يتفحص ذقنه ثم نظر إلي و ابتسم و لكني كنت مذهولا مرعوبا عاجزا عن الكلام فكيف يكون صديقي في الحمام و انا أراه في نفس الوقت نائما في السرير حاولت النداء "" يا فؤاد يا فؤاد إصحى "" و كأن أحدهم وضع ناقوسا زجاجيا على رأسي ليمنع صوتي من الخروج قرأت المعوذتين فانطفات الأضواء بعد ان تحول فؤاد إلى شكل بشع يهم بالإنصراف أردت ان أدير ظهري و إذا انا بشبيه زوجتي تضع يديها الباردتين على يدي و تحاول سحبي إلى الحمام بأي وسيلة انا أصرخ ثم قرأت المعوذتين فحررت نفسي منها ثم هربت إلى الغرفة التي فيها فؤاد فإذا أنا بفؤاد و زوجتي و معهم شخص ثالث و فؤاد الأصلي نائم في السرير ثم نظروا إلي و ضحكوا ثم التفوا حول السرير و حملوه و طافوا به وهنا استيقظ فؤاد و هو يصرخ فقاموا برمي السرير على الأرض ثم اختفوا قمنا بالخروج هاربين من المنزل في عتمة الليل و الأصوات المرعبة تطاردنا في كل انحاء العمارة الظلمة أضواء تطفأ و تضاء و و حرائق تنطفيء ثم تشتعل حتى وصلنا إلى باب العمارة ، قلت لصديقي لا يمكن ان اترك البيت فيه كل تعبي و شقاي في السنين الماضية قال لي يا إبني صحتك و زوجتك بالدنيا قلت فقط سنعود لنحزم ملابسنا لا أريد الأثاث عدنا بعد الفجر و دخلت البيت وجدت كل الأثاث معلقا في الهواء يطفو كأنه يطير اكواب و ملاعق صحون كراسي فرشات طاولات . . . إلخ كل شىء انغلق الباب بعد دخولنا بشكل مفزع دخلت الغرفة على عجل لأجد ملابسي و ملا بس زوجتي معلقة في الهواء و يوجد شنطة مفتوحة على الأرض ألتقطت ما استطيع التقاطه و وضعته في الشنطة ثم هممت مسرعا إلى الباب و إذا بالهاتف يرن و صوتي يتكرر عبره بكلام يقول لي "" ممكن تفتح الباب "" صرعت لما سمعت ، هربت موليا و معي صديقي و لما أصبحنا في الشارع رأيت الأثاث كله يقع محترقا من الطابق الذي كنا نسكنه لا شىء فيه سليم",استقيظت بغرض الذهاب للحمام فاذا بضوء الحمام مضاء قلت لعلي نسيت و تركته مضاء و لما اقتربت من الحمام انطفا الضوء ثم اضاء مره اخري فاذا انا بصديقي يقف قرب مراه الحمام كانه يتفحص ذقنه ثم نظر الي و ابتسم و لكني كنت مذهولا مرعوبا عاجزا عن الكلام فكيف يكون صديقي في الحمام و انا اراه في نفس الوقت نايما في السرير حاولت النداء يا فواد يا فواد اصحي و كان احدهم وضع ناقوسا زجاجيا علي راسي ليمنع صوتي من الخروج قرات المعوذتين فانطفات الاضواء بعد ان تحول فواد الي شكل بشع يهم بالانصراف اردت ان ادير ظهري و اذا انا بشبيه زوجتي تضع يديها الباردتين علي يدي و تحاول سحبي الي الحمام باي وسيله انا اصرخ ثم قرات المعوذتين فحررت نفسي منها ثم هربت الي الغرفه التي فيها فواد فاذا انا بفواد و زوجتي و معهم شخص ثالث و فواد الاصلي نايم في السرير ثم نظروا الي و ضحكوا ثم التفوا حول السرير و حملوه و طافوا به وهنا استيقظ فواد و هو يصرخ فقاموا برمي السرير علي الارض ثم اختفوا قمنا بالخروج هاربين من المنزل في عتمه الليل و الاصوات المرعبه تطاردنا في كل انحاء العماره الظلمه اضواء تطفا و تضاء و و حرايق تنطفيء ثم تشتعل حتي وصلنا الي باب العماره قلت لصديقي لا يمكن ان اترك البيت فيه كل تعبي و شقاي في السنين الماضيه قال لي يا ابني صحتك و زوجتك بالدنيا قلت فقط سنعود لنحزم ملابسنا لا اريد الاثاث عدنا بعد الفجر و دخلت البيت وجدت كل الاثاث معلقا في الهواء يطفو كانه يطير اكواب و ملاعق صحون كراسي فرشات طاولات الخ كل شيء انغلق الباب بعد دخولنا بشكل مفزع دخلت الغرفه علي عجل لاجد ملابسي و ملا بس زوجتي معلقه في الهواء و يوجد شنطه مفتوحه علي الارض التقطت ما استطيع التقاطه و وضعته في الشنطه ثم هممت مسرعا الي الباب و اذا بالهاتف يرن و صوتي يتكرر عبره بكلام يقول لي ممكن تفتح الباب صرعت لما سمعت هربت موليا و معي صديقي و لما اصبحنا في الشارع رايت الاثاث كله يقع محترقا من الطابق الذي كنا نسكنه لا شيء فيه سليم,"استقيظت بغرض الذهاب للحمام فإذا بضوء الحمام مضاء قلت لعلي نسيت و تركته مضاء و لما اقتربت من الحمام انطفأ الضوء ثم اضاء مرة أخرى فإذا أنا بصديقي يقف قرب مرأة الحمام كانه يتفحص ذقنه ثم نظر إلي و ابتسم و لكني كنت مذهولا مرعوبا عاجزا عن الكلام فكيف يكون صديقي في الحمام و انا أراه في نفس الوقت نائما في السرير حاولت النداء "" يا [PERSON_1] يا [PERSON_1] إصحى "" و كأن أحدهم وضع ناقوسا زجاجيا على رأسي ليمنع صوتي من الخروج قرأت المعوذتين فانطفات الأضواء بعد ان تحول [PERSON_1] إلى شكل بشع يهم بالإنصراف أردت ان أدير ظهري و إذا انا بشبيه زوجتي تضع يديها الباردتين على يدي و تحاول سحبي إلى الحمام بأي وسيلة انا أصرخ ثم قرأت المعوذتين فحررت نفسي منها ثم هربت إلى الغرفة التي فيها [PERSON_1] فإذا أنا ب[PERSON_1] و زوجتي و معهم شخص ثالث و [PERSON_1] الأصلي نائم في السرير ثم نظروا إلي و ضحكوا ثم التفوا حول السرير و حملوه و طافوا به وهنا استيقظ [PERSON_1] و هو يصرخ فقاموا برمي السرير على الأرض ثم اختفوا قمنا بالخروج هاربين من المنزل في عتمة الليل و الأصوات المرعبة تطاردنا في كل انحاء العمارة الظلمة أضواء تطفأ و تضاء و و حرائق تنطفيء ثم تشتعل حتى وصلنا إلى باب العمارة ، قلت لصديقي لا يمكن ان اترك البيت فيه كل تعبي و شقاي في السنين الماضية قال لي يا إبني صحتك و زوجتك بالدنيا قلت فقط سنعود لنحزم ملابسنا لا أريد الأثاث عدنا بعد الفجر و دخلت البيت وجدت كل الأثاث معلقا في الهواء يطفو كأنه يطير اكواب و ملاعق صحون كراسي فرشات طاولات . . . إلخ كل شىء انغلق الباب بعد دخولنا بشكل مفزع دخلت الغرفة على عجل لأجد ملابسي و ملا بس زوجتي معلقة في الهواء و يوجد شنطة مفتوحة على الأرض ألتقطت ما استطيع التقاطه و وضعته في الشنطة ثم هممت مسرعا إلى الباب و إذا بالهاتف يرن و صوتي يتكرر عبره بكلام يقول لي "" ممكن تفتح الباب "" صرعت لما سمعت ، هربت موليا و معي صديقي و لما أصبحنا في الشارع رأيت الأثاث كله يقع محترقا من الطابق الذي كنا نسكنه لا شىء فيه سليم","[{""start"": 324, ""end"": 328, ""placeholder"": ""[PERSON_1]"", ""surface_form"": ""فؤاد"", ""mask_type"": ""PERSON""}, {""start"": 332, ""end"": 336, ""placeholder"": ""[PERSON_1]"", ""surface_form"": ""فؤاد"", ""mask_type"": ""PERSON""}, {""start"": 447, ""end"": 451, ""placeholder"": ""[PERSON_1]"", ""surface_form"": ""فؤاد"", ""mask_type"": ""PERSON""}, {""start"": 652, ""end"": 656, ""placeholder"": ""[PERSON_1]"", ""surface_form"": ""فؤاد"", ""mask_type"": ""PERSON""}, {""start"": 667, ""end"": 671, ""placeholder"": ""[PERSON_1]"", ""surface_form"": ""فؤاد"", ""mask_type"": ""PERSON""}, {""start"": 698, ""end"": 702, ""placeholder"": ""[PERSON_1]"", ""surface_form"": ""فؤاد"", ""mask_type"": ""PERSON""}, {""start"": 798, ""end"": 802, ""placeholder"": ""[PERSON_1]"", ""surface_form"": ""فؤاد"", ""mask_type"": ""PERSON""}]",7,approved,,
mt_msa_2fc25cf0,train,56228,MSA,حتى وان قال ما قال من جميل المقال يظل الرجل,حتي وان قال ما قال من جميل المقال يظل الرجل,حتى وان قال ما قال من جميل المقال يظل الرجل,[],0,approved,,
mt_dial_egy_98341fec,train,7167,DIAL_EGY,دي لا تصلح لاي شيء لانها جات للوزاره بحكم قربها من سيده مصر الاولي ! ! ! وكمان معاها اعداديه ده اعجب شيء ممكن تشوفه في حياتك وعلي العموم ادينا صابرين يمكن ربنا يعوضنا خير وحسبي الله ونعم,دي لا تصلح لاي شيء لانها جات للوزاره بحكم قربها من سيده مصر الاولي وكمان معاها اعداديه ده اعجب شيء ممكن تشوفه في حياتك وعلي العموم ادينا صابرين يمكن ربنا يعوضنا خير وحسبي الله ونعم,دي لا تصلح لاي شيء لانها جات للوزاره بحكم قربها من سيده [LOC_1] الاولي ! ! ! وكمان معاها اعداديه ده اعجب شيء ممكن تشوفه في حياتك وعلي العموم ادينا صابرين يمكن ربنا يعوضنا خير وحسبي الله ونعم,"[{""start"": 56, ""end"": 59, ""placeholder"": ""[LOC_1]"", ""surface_form"": ""مصر"", ""mask_type"": ""LOC""}]",1,approved,,
mt_dial_lev_851295b5,train,7363,DIAL_LEV,حمد ذهب الى تصفيات خطر وجاءنا بالسعوديه واليابان وسوريا اقوى الفرق ومنها ينشر الخبر بان منتخبنا في قطر اصبح في,حمد ذهب الي تصفيات خطر وجاءنا بالسعوديه واليابان وسوريا اقوي الفرق ومنها ينشر الخبر بان منتخبنا في قطر اصبح في,[PERSON_1] ذهب الى تصفيات خطر وجاءنا ب[LOC_1] و[LOC_2] و[LOC_3] اقوى الفرق ومنها ينشر الخبر بان منتخبنا في [LOC_4] اصبح في,"[{""start"": 0, ""end"": 3, ""placeholder"": ""[PERSON_1]"", ""surface_form"": ""حمد"", ""mask_type"": ""PERSON""}, {""start"": 31, ""end"": 39, ""placeholder"": ""[LOC_1]"", ""surface_form"": ""السعوديه"", ""mask_type"": ""LOC""}, {""start"": 41, ""end"": 48, ""placeholder"": ""[LOC_2]"", ""surface_form"": ""اليابان"", ""mask_type"": ""LOC""}, {""start"": 50, ""end"": 55, ""placeholder"": ""[LOC_3]"", ""surface_form"": ""سوريا"", ""mask_type"": ""LOC""}, {""start"": 99, ""end"": 102, ""placeholder"": ""[LOC_4]"", ""surface_form"": ""قطر"", ""mask_type"": ""LOC""}]",5,approved,,
mt_msa_00c744e4,train,23686,MSA,وعد صريح من رب العالمين بعصمة وهدايه من جاهد نفسه عن الحرام ونفس الكلام ايضا يوجه,وعد صريح من رب العالمين بعصمه وهدايه من جاهد نفسه عن الحرام ونفس الكلام ايضا يوجه,وعد صريح من رب العالمين بعصمة وهدايه من جاهد نفسه عن الحرام ونفس الكلام ايضا يوجه,[],0,approved,,
