example_id,source_split,source_row_id,dialect,original_text,normalized_text,masked_text,mask_spans_json,mask_count,annotation_status,annotator_model,notes
mt_dial_egy_f2951d56,train,12159,DIAL_EGY,لو عرفتوا تخدوا الدورى انتوا كمان بالجكام ابقوا خدوه ومحدش يقولى مبادئ,لو عرفتوا تخدوا الدوري انتوا كمان بالجكام ابقوا خدوه ومحدش يقولي مبادي,لو عرفتوا تخدوا الدورى انتوا كمان بالجكام ابقوا خدوه ومحدش يقولى مبادئ,[],0,approved,,
mt_dial_glf_54957603,train,36812,DIAL_GLF,بالتوفيق لليوث وجميع الجماهير مطلوب منها المساندة مو بس النصر,بالتوفيق لليوث وجميع الجماهير مطلوب منها المسانده مو بس النصر,بالتوفيق لليوث وجميع الجماهير مطلوب منها المساندة مو بس [ORG_1],"[{""start"": 56, ""end"": 61, ""placeholder"": ""[ORG_1]"", ""surface_form"": ""النصر"", ""mask_type"": ""ORG""}]",1,approved,,
mt_dial_lev_ee7ed50d,train,17870,DIAL_LEV,اهم شي الماء موجودة في برك السباحة ! ! ! وعمر ما احد,اهم شي الماء موجوده في برك السباحه وعمر ما احد,اهم شي الماء موجودة في برك السباحة ! ! ! وعمر ما احد,[],0,approved,,
mt_msa_d9b8b6cf,train,10546,MSA,*يوجد في قانون الإيمان أن المسيح بعد موته على خشبة الصليب دفن في القبر ثلاث أيام وثلاث ليال . فهل يوجد دليل من الإنجيل بذلك,يوجد في قانون الايمان ان المسيح بعد موته علي خشبه الصليب دفن في القبر ثلاث ايام وثلاث ليال فهل يوجد دليل من الانجيل بذلك,*يوجد في قانون الإيمان أن المسيح بعد موته على خشبة الصليب دفن في القبر ثلاث أيام وثلاث ليال . فهل يوجد دليل من الإنجيل بذلك,[],0,approved,,
mt_dial_egy_1361d864,train,32627,DIAL_EGY,قلبي معاكم يا معاقين عقبال الي في بالي لما يصبح,قلبي معاكم يا معاقين عقبال الي في بالي لما يصبح,قلبي معاكم يا معاقين عقبال الي في بالي لما يصبح,[],0,approved,,
mt_dial_glf_74e5a57a,train,72824,DIAL_GLF,اجل احمدوا ربكم ان الوصل ما راح يلعب في,اجل احمدوا ربكم ان الوصل ما راح يلعب في,اجل احمدوا ربكم ان [ORG_1] ما راح يلعب في,"[{""start"": 19, ""end"": 24, ""placeholder"": ""[ORG_1]"", ""surface_form"": ""الوصل"", ""mask_type"": ""ORG""}]",1,approved,,
mt_dial_lev_75ab3c1e,train,84998,DIAL_LEV,"اشي مقرف جدا , شو هاي البلاوي اللي بيعملوها ما في خوف من رب العالمين ؟ ؟",اشي مقرف جدا شو هاي البلاوي اللي بيعملوها ما في خوف من رب العالمين,"اشي مقرف جدا , شو هاي البلاوي اللي بيعملوها ما في خوف من رب العالمين ؟ ؟",[],0,approved,,
mt_msa_45d8d7d6,train,24873,MSA,وهناك عنوسة في غير القبيليين,وهناك عنوسه في غير القبيليين,وهناك عنوسة في غير القبيليين,[],0,approved,,
mt_dial_egy_5972ad8b,train,73611,DIAL_EGY,ثم لماذا يحصلوا فلوس من المنازل المغلقة حرام,ثم لماذا يحصلوا فلوس من المنازل المغلقه حرام,ثم لماذا يحصلوا فلوس من المنازل المغلقة حرام,[],0,approved,,
mt_dial_glf_4067f5be,train,31517,DIAL_GLF,اشكرك اختي على هذا التوضيح وانا ممن تعرض لهذه المشكله لا والاكبرمن ذالك يغصبونها على شايب بالتسعينات عشان ماله والا مناصحته حسبي الله ونعم الوكيل ربي شرع لنا شريعه واسن لنا سنه فلماذا هذا الجهل اختي اذا فيه احد من اللي ذكرتيهم يبي الزواج ابلغينا ونرسل لكم ناس علما ماني خطابه ولكن مساعده,اشكرك اختي علي هذا التوضيح وانا ممن تعرض لهذه المشكله لا والاكبرمن ذالك يغصبونها علي شايب بالتسعينات عشان ماله والا مناصحته حسبي الله ونعم الوكيل ربي شرع لنا شريعه واسن لنا سنه فلماذا هذا الجهل اختي اذا فيه احد من اللي ذكرتيهم يبي الزواج ابلغينا ونرسل لكم ناس علما ماني خطابه ولكن مساعده,اشكرك اختي على هذا التوضيح وانا ممن تعرض لهذه المشكله لا والاكبرمن ذالك يغصبونها على شايب بالتسعينات عشان ماله والا مناصحته حسبي الله ونعم الوكيل ربي شرع لنا شريعه واسن لنا سنه فلماذا هذا الجهل اختي اذا فيه احد من اللي ذكرتيهم يبي الزواج ابلغينا ونرسل لكم ناس علما ماني خطابه ولكن مساعده,[],0,approved,,
mt_dial_lev_b294b7b3,train,40943,DIAL_LEV,شكرا الجزيره لكن صدقوني مش بمزاجكم رح تبثو اصلا من قوانين الفيفا ان الافتتاح والنهائي ودور الاربعه ييث على المفتوح اضافه لبعض المباريات يحددها الفيفا او,شكرا الجزيره لكن صدقوني مش بمزاجكم رح تبثو اصلا من قوانين الفيفا ان الافتتاح والنهايي ودور الاربعه ييث علي المفتوح اضافه لبعض المباريات يحددها الفيفا او,شكرا [ORG_1] لكن صدقوني مش بمزاجكم رح تبثو اصلا من قوانين [ORG_2] ان الافتتاح والنهائي ودور الاربعه ييث على المفتوح اضافه لبعض المباريات يحددها [ORG_2] او,"[{""start"": 5, ""end"": 12, ""placeholder"": ""[ORG_1]"", ""surface_form"": ""الجزيره"", ""mask_type"": ""ORG""}, {""start"": 58, ""end"": 64, ""placeholder"": ""[ORG_2]"", ""surface_form"": ""الفيفا"", ""mask_type"": ""ORG""}, {""start"": 143, ""end"": 149, ""placeholder"": ""[ORG_2]"", ""surface_form"": ""الفيفا"", ""mask_type"": ""ORG""}]",3,approved,,
mt_msa_9fdf9459,train,14175,MSA,لجنة الانضباط والله انكم تستحقون الاحترام لعدم خنوعكم لهذا الفريق المحلي مثل غيركم من,لجنه الانضباط والله انكم تستحقون الاحترام لعدم خنوعكم لهذا الفريق المحلي مثل غيركم من,لجنة الانضباط والله انكم تستحقون الاحترام لعدم خنوعكم لهذا الفريق المحلي مثل غيركم من,[],0,approved,,
mt_dial_egy_9d6950bf,train,16070,DIAL_EGY,وبعض المراكب ح تغرق كمان وأزمة مساكن وأزمة أمان وعالم بياكل فى عالم,وبعض المراكب ح تغرق كمان وازمه مساكن وازمه امان وعالم بياكل في عالم,وبعض المراكب ح تغرق كمان وأزمة مساكن وأزمة أمان وعالم بياكل فى عالم,[],0,approved,,
mt_dial_glf_f369c48a,train,32822,DIAL_GLF,اكثروا من الاستغفار ماتدروو ايش اللي قاعد,اكثروا من الاستغفار ماتدروو ايش اللي قاعد,اكثروا من الاستغفار ماتدروو ايش اللي قاعد,[],0,approved,,
mt_dial_lev_6a8179eb,train,41433,DIAL_LEV,امين . . الله يوفقهم ويرجعهم لاهاليهم بخير . نشامى الوطن,امين الله يوفقهم ويرجعهم لاهاليهم بخير نشامي الوطن,امين . . الله يوفقهم ويرجعهم لاهاليهم بخير . نشامى الوطن,[],0,approved,,
mt_dial_egy_c80f4d9b,train,60254,DIAL_EGY,ليه لا لجمال مبارك انى ارى انه احسن بكثير من غيره و بعبارة اخرى هو احسن الوحشين الموجودين على الساحة الان وربنا يستر على ولايانا,ليه لا لجمال مبارك اني اري انه احسن بكثير من غيره و بعباره اخري هو احسن الوحشين الموجودين علي الساحه الان وربنا يستر علي ولايانا,ليه لا ل[PERSON_1] انى ارى انه احسن بكثير من غيره و بعبارة اخرى هو احسن الوحشين الموجودين على الساحة الان وربنا يستر على ولايانا,"[{""start"": 8, ""end"": 18, ""placeholder"": ""[PERSON_1]"", ""surface_form"": ""جمال مبارك"", ""mask_type"": ""PERSON""}]",1,approved,,
mt_dial_glf_24c444eb,train,41135,DIAL_GLF,ليش غضيتوا البصر يارؤساء نادي الهلال عن ضرب ياسر لاحمد مبارك بدون كره . . . ؟,ليش غضيتوا البصر ياروساء نادي الهلال عن ضرب ياسر لاحمد مبارك بدون كره,ليش غضيتوا البصر يارؤساء نادي [ORG_1] عن ضرب [PERSON_1] ل[PERSON_2] بدون كره . . . ؟,"[{""start"": 30, ""end"": 36, ""placeholder"": ""[ORG_1]"", ""surface_form"": ""الهلال"", ""mask_type"": ""ORG""}, {""start"": 44, ""end"": 48, ""placeholder"": ""[PERSON_1]"", ""surface_form"": ""ياسر"", ""mask_type"": ""PERSON""}, {""start"": 50, ""end"": 60, ""placeholder"": ""[PERSON_2]"", ""surface_form"": ""احمد مبارك"", ""mask_type"": ""PERSON""}]",3,approved,,
mt_dial_lev_61717fa7,train,65530,DIAL_LEV,"شكله يوم 19 / 6 يوم لزواج بعد سنوات الحب , حبيبي وائل كل عيد زواج و احنا بألف خير و العمر كله و احنا سوا يارب",شكله يوم 19 6 يوم لزواج بعد سنوات الحب حبيبي وايل كل عيد زواج و احنا بالف خير و العمر كله و احنا سوا يارب,"شكله يوم [DATE_1] يوم لزواج بعد سنوات الحب , حبيبي [PERSON_1] كل عيد زواج و احنا بألف خير و العمر كله و احنا سوا يارب","[{""start"": 9, ""end"": 15, ""placeholder"": ""[DATE_1]"", ""surface_form"": ""19 / 6"", ""mask_type"": ""DATE""}, {""start"": 49, ""end"": 53, ""placeholder"": ""[PERSON_1]"", ""surface_form"": ""وائل"", ""mask_type"": ""PERSON""}]",2,approved,,
mt_dial_egy_d072bdb6,train,50794,DIAL_EGY,شئ يبشر بخير بس يارب كل دا يجيب ناتيجه مصر,شي يبشر بخير بس يارب كل دا يجيب ناتيجه مصر,شئ يبشر بخير بس يارب كل دا يجيب ناتيجه [LOC_1],"[{""start"": 39, ""end"": 42, ""placeholder"": ""[LOC_1]"", ""surface_form"": ""مصر"", ""mask_type"": ""LOC""}]",1,approved,,
mt_dial_glf_c24d6510,train,32919,DIAL_GLF,الجواب : بالصيدليات والسوبر ماركت ياليت سموكم يطلع بنفسه على الأدويه المحظوره والمواد الغذائيه المسرطنه والفاسده بكميات مهوله .,الجواب بالصيدليات والسوبر ماركت ياليت سموكم يطلع بنفسه علي الادويه المحظوره والمواد الغذاييه المسرطنه والفاسده بكميات مهوله,الجواب : بالصيدليات والسوبر ماركت ياليت سموكم يطلع بنفسه على الأدويه المحظوره والمواد الغذائيه المسرطنه والفاسده بكميات مهوله .,[],0,approved,,
mt_dial_lev_06620254,train,1978,DIAL_LEV,ما شاء الله يا هيك التخفيف يا بلا,ما شاء الله يا هيك التخفيف يا بلا,ما شاء الله يا هيك التخفيف يا بلا,[],0,approved,,
mt_msa_b8495830,train,37330,MSA,كلام قيم فعلا أنا إذا شفت الواحد مشخص والدنيا تلمع عرفت أنه فاقد يا مال أو عقل وتجتمع أحيانا . طرق إستهلكنا لا تجعلنا نفكر أننا سوف نندم في,كلام قيم فعلا انا اذا شفت الواحد مشخص والدنيا تلمع عرفت انه فاقد يا مال او عقل وتجتمع احيانا طرق استهلكنا لا تجعلنا نفكر اننا سوف نندم في,كلام قيم فعلا أنا إذا شفت الواحد مشخص والدنيا تلمع عرفت أنه فاقد يا مال أو عقل وتجتمع أحيانا . طرق إستهلكنا لا تجعلنا نفكر أننا سوف نندم في,[],0,approved,,
mt_dial_egy_03f2f672,train,70756,DIAL_EGY,وانت مادخلك اضن ان تعليقي ينطبق عليك وضميرك يأنبك يمكنك مراجعة نفسك والاتكال على نفسك بدل ( . . . / . . . ),وانت مادخلك اضن ان تعليقي ينطبق عليك وضميرك يانبك يمكنك مراجعه نفسك والاتكال علي نفسك بدل,وانت مادخلك اضن ان تعليقي ينطبق عليك وضميرك يأنبك يمكنك مراجعة نفسك والاتكال على نفسك بدل ( . . . / . . . ),[],0,approved,,
mt_dial_glf_642374fc,train,60690,DIAL_GLF,شغلوا السيف تكفون ترا الوضع الان,شغلوا السيف تكفون ترا الوضع الان,شغلوا السيف تكفون ترا الوضع الان,[],0,approved,,
mt_dial_lev_3aa899d6,train,7620,DIAL_LEV,"امريكا تفكر العالم مافهم الطفل الصغير والرجل الكبير يعرف جيد اسرائيل لاتتصرف الابموافقه الماما امريكا واعطائها الضو الاخضر امريكا الان شافت المجازر وهي نفسها ام الدمار والقتل والمجازر اشد من اسرائيل هي واخواتها لكم يوم اغبر من الله وبشر الظالمين بعذاب من الله وغضب ولعنة منه وهم في النار خالدين فيها أبدا , . . . اتمنى من كافه دول العالم ان يحركو كل سفنهم الي غزة ويكون عليها دروع بشريه ولايقل مليون",امريكا تفكر العالم مافهم الطفل الصغير والرجل الكبير يعرف جيد اسراييل لاتتصرف الابموافقه الماما امريكا واعطايها الضو الاخضر امريكا الان شافت المجازر وهي نفسها ام الدمار والقتل والمجازر اشد من اسراييل هي واخواتها لكم يوم اغبر من الله وبشر الظالمين بعذاب من الله وغضب ولعنه منه وهم في النار خالدين فيها ابدا اتمني من كافه دول العالم ان يحركو كل سفنهم الي غزه ويكون عليها دروع بشريه ولايقل مليون,"[LOC_1] تفكر العالم مافهم الطفل الصغير والرجل الكبير يعرف جيد [LOC_2] لاتتصرف الابموافقه الماما [LOC_1] واعطائها الضو الاخضر [LOC_1] الان شافت المجازر وهي نفسها ام الدمار والقتل والمجازر اشد من [LOC_2] هي واخواتها لكم يوم اغبر من الله وبشر الظالمين بعذاب من الله وغضب ولعنة منه وهم في النار خالدين فيها أبدا , . . . اتمنى من كافه دول العالم ان يحركو كل سفنهم الي [LOC_3] ويكون عليها دروع بشريه ولايقل [NUM_1]","[{""start"": 0, ""end"": 6, ""placeholder"": ""[LOC_1]"", ""surface_form"": ""امريكا"", ""mask_type"": ""LOC""}, {""start"": 61, ""end"": 68, ""placeholder"": ""[LOC_2]"", ""surface_form"": ""اسرائيل"", ""mask_type"": ""LOC""}, {""start"": 95, ""end"": 101, ""placeholder"": ""[LOC_1]"", ""surface_form"": ""امريكا"", ""mask_type"": ""LOC""}, {""start"": 123, ""end"": 129, ""placeholder"": ""[LOC_1]"", ""surface_form"": ""امريكا"", ""mask_type"": ""LOC""}, {""start"": 191, ""end"": 198, ""placeholder"": ""[LOC_2]"", ""surface_form"": ""اسرائيل"", ""mask_type"": ""LOC""}, {""start"": 360, ""end"": 363, ""placeholder"": ""[LOC_3]"", ""surface_form"": ""غزة"", ""mask_type"": ""LOC""}, {""start"": 394, ""end"": 399, ""placeholder"": ""[NUM_1]"", ""surface_form"": ""مليون"", ""mask_type"": ""NUM""}]",7,approved,,
mt_msa_3f096b79,train,28175,MSA,تنقل من الصحف والمواقع المنافسة دون أدنى تعليق,تنقل من الصحف والمواقع المنافسه دون ادني تعليق,تنقل من الصحف والمواقع المنافسة دون أدنى تعليق,[],0,approved,,
mt_dial_egy_f37d14bd,train,5625,DIAL_EGY,صاحب التعليق رقم 2 بيقول,صاحب التعليق رقم 2 بيقول,صاحب التعليق رقم [NUM_1] بيقول,"[{""start"": 17, ""end"": 18, ""placeholder"": ""[NUM_1]"", ""surface_form"": ""2"", ""mask_type"": ""NUM""}]",1,approved,,
mt_dial_glf_837c1b83,train,21172,DIAL_GLF,ياحبيلك ربي يسعد هالضحكة اتمنى اشوفك عالطبيعة !,ياحبيلك ربي يسعد هالضحكه اتمني اشوفك عالطبيعه,ياحبيلك ربي يسعد هالضحكة اتمنى اشوفك عالطبيعة !,[],0,approved,,
mt_dial_lev_bb15e792,train,16919,DIAL_LEV,والله الفيصلي فريق كبير وبيضلو فريق كبير ومش بس الفيصلي عانا مناالازمه الماليه كل الانديه كمان عانت بس الفيصلي رجع وقف على من جديدوما بدنا محترفين عنا لعيبه جدعان وزلام . . . وبتمنى العربي يفوز على الوحدات ان شاء,والله الفيصلي فريق كبير وبيضلو فريق كبير ومش بس الفيصلي عانا مناالازمه الماليه كل الانديه كمان عانت بس الفيصلي رجع وقف علي من جديدوما بدنا محترفين عنا لعيبه جدعان وزلام وبتمني العربي يفوز علي الوحدات ان شاء,والله [ORG_1] فريق كبير وبيضلو فريق كبير ومش بس [ORG_1] عانا مناالازمه الماليه كل الانديه كمان عانت بس [ORG_1] رجع وقف على من جديدوما بدنا محترفين عنا لعيبه جدعان وزلام . . . وبتمنى [ORG_2] يفوز على [ORG_3] ان شاء,"[{""start"": 6, ""end"": 13, ""placeholder"": ""[ORG_1]"", ""surface_form"": ""الفيصلي"", ""mask_type"": ""ORG""}, {""start"": 48, ""end"": 55, ""placeholder"": ""[ORG_1]"", ""surface_form"": ""الفيصلي"", ""mask_type"": ""ORG""}, {""start"": 103, ""end"": 110, ""placeholder"": ""[ORG_1]"", ""surface_form"": ""الفيصلي"", ""mask_type"": ""ORG""}, {""start"": 182, ""end"": 188, ""placeholder"": ""[ORG_2]"", ""surface_form"": ""العربي"", ""mask_type"": ""ORG""}, {""start"": 198, ""end"": 205, ""placeholder"": ""[ORG_3]"", ""surface_form"": ""الوحدات"", ""mask_type"": ""ORG""}]",5,approved,,
mt_msa_1090af66,train,16122,MSA,ستخفض الى ان يكثر الطلب ثم ترفع الأسعار كيفما,ستخفض الي ان يكثر الطلب ثم ترفع الاسعار كيفما,ستخفض الى ان يكثر الطلب ثم ترفع الأسعار كيفما,[],0,approved,,
mt_dial_egy_d9bb8032,train,59194,DIAL_EGY,انا اهلاوي ومبسوط جدا من مستوى الزمال الممتاز في الدور,انا اهلاوي ومبسوط جدا من مستوي الزمال الممتاز في الدور,انا اهلاوي ومبسوط جدا من مستوى الزمال الممتاز في الدور,[],0,approved,,
mt_dial_glf_dd0c36e4,train,67542,DIAL_GLF,الاخ سعود الفهد تعليق رقم 5 الله يخليلك خواتك لكن الا تتفق معي ان التعلق بالملبس وانه هو الساتر امر خرافي وغير منطقي . كثير يلبسن فوق الراس وكفوفو وتعاكس ! !,الاخ سعود الفهد تعليق رقم 5 الله يخليلك خواتك لكن الا تتفق معي ان التعلق بالملبس وانه هو الساتر امر خرافي وغير منطقي كثير يلبسن فوق الراس وكفوفو وتعاكس,الاخ [PERSON_1] تعليق رقم [NUM_1] الله يخليلك خواتك لكن الا تتفق معي ان التعلق بالملبس وانه هو الساتر امر خرافي وغير منطقي . كثير يلبسن فوق الراس وكفوفو وتعاكس ! !,"[{""start"": 5, ""end"": 15, ""placeholder"": ""[PERSON_1]"", ""surface_form"": ""سعود الفهد"", ""mask_type"": ""PERSON""}, {""start"": 26, ""end"": 27, ""placeholder"": ""[NUM_1]"", ""surface_form"": ""5"", ""mask_type"": ""NUM""}]",2,approved,,
mt_dial_lev_65080cef,train,44614,DIAL_LEV,"تحية من جمهور الوحدات في السعودية بشكل عام و الخبر بشكل خاص الى نادينا المحبوب . . . الوحدات . . . والكاس وحداتي ان شاء الله , بدنا نشد همتنا كجمهور لدعم المارد الاخضر , و على كل حال احنا و الرمثاوية بنضل اخوان شو ما كانت النتيجة",تحيه من جمهور الوحدات في السعوديه بشكل عام و الخبر بشكل خاص الي نادينا المحبوب الوحدات والكاس وحداتي ان شاء الله بدنا نشد همتنا كجمهور لدعم المارد الاخضر و علي كل حال احنا و الرمثاويه بنضل اخوان شو ما كانت النتيجه,"تحية من جمهور [ORG_1] في [LOC_1] بشكل عام و [LOC_2] بشكل خاص الى نادينا المحبوب . . . [ORG_1] . . . والكاس وحداتي ان شاء الله , بدنا نشد همتنا كجمهور لدعم المارد الاخضر , و على كل حال احنا و الرمثاوية بنضل اخوان شو ما كانت النتيجة","[{""start"": 14, ""end"": 21, ""placeholder"": ""[ORG_1]"", ""surface_form"": ""الوحدات"", ""mask_type"": ""ORG""}, {""start"": 25, ""end"": 33, ""placeholder"": ""[LOC_1]"", ""surface_form"": ""السعودية"", ""mask_type"": ""LOC""}, {""start"": 45, ""end"": 50, ""placeholder"": ""[LOC_2]"", ""surface_form"": ""الخبر"", ""mask_type"": ""LOC""}, {""start"": 85, ""end"": 92, ""placeholder"": ""[ORG_1]"", ""surface_form"": ""الوحدات"", ""mask_type"": ""ORG""}]",4,approved,,
mt_msa_e4665f89,train,7765,MSA,يقولون في السنه تزوج ( 4,يقولون في السنه تزوج 4,يقولون في السنه تزوج ( [NUM_1],"[{""start"": 23, ""end"": 24, ""placeholder"": ""[NUM_1]"", ""surface_form"": ""4"", ""mask_type"": ""NUM""}]",1,approved,,
mt_dial_egy_92c00183,train,36739,DIAL_EGY,بلدنا امانة وانتوا ضيعتوها وبعدين امانة ايه في امانة بتتاخد,بلدنا امانه وانتوا ضيعتوها وبعدين امانه ايه في امانه بتتاخد,بلدنا امانة وانتوا ضيعتوها وبعدين امانة ايه في امانة بتتاخد,[],0,approved,,
mt_dial_glf_c6ba8bc0,train,30738,DIAL_GLF,لعب دنيلسون ولا مالعب الزعيم طول عمره زعيم الهلال,لعب دنيلسون ولا مالعب الزعيم طول عمره زعيم الهلال,لعب [PERSON_1] ولا مالعب الزعيم طول عمره زعيم [ORG_1],"[{""start"": 4, ""end"": 11, ""placeholder"": ""[PERSON_1]"", ""surface_form"": ""دنيلسون"", ""mask_type"": ""PERSON""}, {""start"": 43, ""end"": 49, ""placeholder"": ""[ORG_1]"", ""surface_form"": ""الهلال"", ""mask_type"": ""ORG""}]",2,approved,,
mt_dial_lev_0ebc15c6,train,83858,DIAL_LEV,حرام كيف هالقسوه هاي طفل عمره سنتين لا يعرف لا يفقه شي شو هالظلم شو قسوة,حرام كيف هالقسوه هاي طفل عمره سنتين لا يعرف لا يفقه شي شو هالظلم شو قسوه,حرام كيف هالقسوه هاي طفل عمره سنتين لا يعرف لا يفقه شي شو هالظلم شو قسوة,[],0,approved,,
