example_id,source_split,source_row_id,dialect,original_text,normalized_text,masked_text,mask_spans_json,mask_count,annotation_status,annotator_model,notes
mt_dial_lev_c18ff7ac,train,6231,DIAL_LEV,يا الله ما اشنع هالجريمه يا الله . . . والله جسمي قشعر شو اللي بيصير في البلد يا جماعه فهموني عشان الله وانا اطالب الحكومه اذا كان لايزال هناك قانون تحكمه الشريعه ان يتم اعدام الاب والام علنا وفي ساحه عامه امام الناس حتى يكونوا عبرة لمن لايعتبر وخاصة الام كيف سكتت على هذا الجرم لعنة الله عليها . . . يا رب تستر علينا وعلى بنات المسلمين يا الله,يا الله ما اشنع هالجريمه يا الله والله جسمي قشعر شو اللي بيصير في البلد يا جماعه فهموني عشان الله وانا اطالب الحكومه اذا كان لايزال هناك قانون تحكمه الشريعه ان يتم اعدام الاب والام علنا وفي ساحه عامه امام الناس حتي يكونوا عبره لمن لايعتبر وخاصه الام كيف سكتت علي هذا الجرم لعنه الله عليها يا رب تستر علينا وعلي بنات المسلمين يا الله,يا الله ما اشنع هالجريمه يا الله . . . والله جسمي قشعر شو اللي بيصير في البلد يا جماعه فهموني عشان الله وانا اطالب الحكومه اذا كان لايزال هناك قانون تحكمه الشريعه ان يتم اعدام الاب والام علنا وفي ساحه عامه امام الناس حتى يكونوا عبرة لمن لايعتبر وخاصة الام كيف سكتت على هذا الجرم لعنة الله عليها . . . يا رب تستر علينا وعلى بنات المسلمين يا الله,[],0,approved,,
mt_msa_1f838bda,train,28754,MSA,الله يصبر اهله وللاسف خاتمه,الله يصبر اهله وللاسف خاتمه,الله يصبر اهله وللاسف خاتمه,[],0,approved,,
mt_dial_egy_7b994f49,train,72884,DIAL_EGY,هم عرفوا ازى انى هو,هم عرفوا ازي اني هو,هم عرفوا ازى انى هو,[],0,approved,,
mt_dial_glf_115722ec,train,54936,DIAL_GLF,يستاهل عمر البشير . . رجل شهم الله يخليه,يستاهل عمر البشير رجل شهم الله يخليه,يستاهل [PERSON_1] . . رجل شهم الله يخليه,"[{""start"": 7, ""end"": 17, ""placeholder"": ""[PERSON_1]"", ""surface_form"": ""عمر البشير"", ""mask_type"": ""PERSON""}]",1,approved,,
mt_dial_lev_06d2855e,train,55988,DIAL_LEV,اذا لغيت عقوبة الحبس عن الشيكات كيف ما بده يتنامى العنف المجتمعي بتمنى لو تنشروا اسماء اللجنه اللي سميتوها متخصصه من قضاه ومحامين و اكاديميين ومين اعطاهم الحق بالتنازل عن عقوبة الحبس ؟ ؟,اذا لغيت عقوبه الحبس عن الشيكات كيف ما بده يتنامي العنف المجتمعي بتمني لو تنشروا اسماء اللجنه اللي سميتوها متخصصه من قضاه ومحامين و اكاديميين ومين اعطاهم الحق بالتنازل عن عقوبه الحبس,اذا لغيت عقوبة الحبس عن الشيكات كيف ما بده يتنامى العنف المجتمعي بتمنى لو تنشروا اسماء اللجنه اللي سميتوها متخصصه من قضاه ومحامين و اكاديميين ومين اعطاهم الحق بالتنازل عن عقوبة الحبس ؟ ؟,[],0,approved,,
mt_msa_5105ab6b,train,22234,MSA,قليل جدا قليل تجد شخصا,قليل جدا قليل تجد شخصا,قليل جدا قليل تجد شخصا,[],0,approved,,
mt_dial_egy_3c99b7b9,train,9152,DIAL_EGY,حلو قوي خطاب التنحي ، العب,حلو قوي خطاب التنحي العب,حلو قوي خطاب التنحي ، العب,[],0,approved,,
mt_dial_glf_2423ecaf,train,56248,DIAL_GLF,صح بشرتها حلوه وفيها نضاره بس وين أجمل جميلات العالم معه . . أنا أجمل منها : ) ه .,صح بشرتها حلوه وفيها نضاره بس وين اجمل جميلات العالم معه انا اجمل منها ه,صح بشرتها حلوه وفيها نضاره بس وين أجمل جميلات العالم معه . . أنا أجمل منها : ) ه .,[],0,approved,,
mt_dial_lev_ec076252,train,25386,DIAL_LEV,اتمنى ان يظهر الحق و ان يحاسب المهملون يا رب ، والله لو صايره بمكان تاني كان المدير و كل الدكاتره المهملين استقالوا و تركوا المهنه و لكن اين,اتمني ان يظهر الحق و ان يحاسب المهملون يا رب والله لو صايره بمكان تاني كان المدير و كل الدكاتره المهملين استقالوا و تركوا المهنه و لكن اين,اتمنى ان يظهر الحق و ان يحاسب المهملون يا رب ، والله لو صايره بمكان تاني كان المدير و كل الدكاتره المهملين استقالوا و تركوا المهنه و لكن اين,[],0,approved,,
mt_msa_abab323f,train,14551,MSA,الزعيم زعيم طال الزمن او,الزعيم زعيم طال الزمن او,الزعيم زعيم طال الزمن او,[],0,approved,,
mt_dial_egy_9cb593c8,train,73521,DIAL_EGY,حابب يكون في الكادر ، اتخدع المرةاللي فاتت وفكر ان الناس عايزاه ، ياعم الناس اختارتك من قرفها ، واحد كدب وفشل على مستوى اسرته اللي هيه اربع انفار ، بزمتكو يحل مشكلة 80 مليون ، ده يبيع الوطن بعلبة مارلبورو احمر امريكاني,حابب يكون في الكادر اتخدع المرهاللي فاتت وفكر ان الناس عايزاه ياعم الناس اختارتك من قرفها واحد كدب وفشل علي مستوي اسرته اللي هيه اربع انفار بزمتكو يحل مشكله 80 مليون ده يبيع الوطن بعلبه مارلبورو احمر امريكاني,حابب يكون في الكادر ، اتخدع المرةاللي فاتت وفكر ان الناس عايزاه ، ياعم الناس اختارتك من قرفها ، واحد كدب وفشل على مستوى اسرته اللي هيه اربع انفار ، بزمتكو يحل مشكلة [NUM_1] مليون ، ده يبيع الوطن بعلبة مارلبورو احمر امريكاني,"[{""start"": 165, ""end"": 167, ""placeholder"": ""[NUM_1]"", ""surface_form"": ""80"", ""mask_type"": ""NUM""}]",1,approved,,
mt_dial_glf_bcba95a4,train,34858,DIAL_GLF,صراحه هذي همجيه مافيه قانون ؟ ؟ مافيه حكومه ؟,صراحه هذي همجيه مافيه قانون مافيه حكومه,صراحه هذي همجيه مافيه قانون ؟ ؟ مافيه حكومه ؟,[],0,approved,,
mt_dial_lev_5d214fd7,train,44754,DIAL_LEV,"عظم الله اجركم يا كابتن فيصل و الله يجعلها خاتمة الاحزان , لا تحزن يا فيصل فهذا حال الدنيا . نتمنى ان تعود الى الملاعب مقاتل مغوارا كما عهدناك , الله يلهمك الصبر على مصابك و انا لله و انا اليه",عظم الله اجركم يا كابتن فيصل و الله يجعلها خاتمه الاحزان لا تحزن يا فيصل فهذا حال الدنيا نتمني ان تعود الي الملاعب مقاتل مغوارا كما عهدناك الله يلهمك الصبر علي مصابك و انا لله و انا اليه,"عظم الله اجركم يا كابتن [PERSON_1] و الله يجعلها خاتمة الاحزان , لا تحزن يا [PERSON_1] فهذا حال الدنيا . نتمنى ان تعود الى الملاعب مقاتل مغوارا كما عهدناك , الله يلهمك الصبر على مصابك و انا لله و انا اليه","[{""start"": 24, ""end"": 28, ""placeholder"": ""[PERSON_1]"", ""surface_form"": ""فيصل"", ""mask_type"": ""PERSON""}, {""start"": 70, ""end"": 74, ""placeholder"": ""[PERSON_1]"", ""surface_form"": ""فيصل"", ""mask_type"": ""PERSON""}]",2,approved,,
mt_msa_760d57f0,train,12351,MSA,الى متى هذه الفوضى ولمصلحة من,الي متي هذه الفوضي ولمصلحه من,الى متى هذه الفوضى ولمصلحة من,[],0,approved,,
