example_id,source_split,source_row_id,dialect,original_text,normalized_text,masked_text,mask_spans_json,mask_count,annotation_status,annotator_model,notes
mt_dial_egy_4830699f,train,9441,DIAL_EGY,بصراحة سيادة الوزير بجد انا معجبة بيك جدا ونفسي تزورنا في بورسعيد واحنا لاننا بنشتغل بجد مش نتضايق من وجود سيادتك بالعكس نحب تشجيع حضرتك واوعدك انا لسة مدرسة صغيرة لو مسكت منصب قيادى في المستقبل هتكون حضرتك,بصراحه سياده الوزير بجد انا معجبه بيك جدا ونفسي تزورنا في بورسعيد واحنا لاننا بنشتغل بجد مش نتضايق من وجود سيادتك بالعكس نحب تشجيع حضرتك واوعدك انا لسه مدرسه صغيره لو مسكت منصب قيادي في المستقبل هتكون حضرتك,بصراحة سيادة الوزير بجد انا معجبة بيك جدا ونفسي تزورنا في [LOC_1] واحنا لاننا بنشتغل بجد مش نتضايق من وجود سيادتك بالعكس نحب تشجيع حضرتك واوعدك انا لسة مدرسة صغيرة لو مسكت منصب قيادى في المستقبل هتكون حضرتك,"[{""start"": 58, ""end"": 65, ""placeholder"": ""[LOC_1]"", ""surface_form"": ""بورسعيد"", ""mask_type"": ""LOC""}]",1,approved,,
mt_dial_glf_e46ca743,train,31540,DIAL_GLF,الله يخلي لنا خادم الحرمين,الله يخلي لنا خادم الحرمين,الله يخلي لنا خادم الحرمين,[],0,approved,,
mt_dial_lev_d65a6648,train,75765,DIAL_LEV,لانه دايما مباريات المارد الاخضر التذاكر بتنباع بالسوق,لانه دايما مباريات المارد الاخضر التذاكر بتنباع بالسوق,لانه دايما مباريات المارد الاخضر التذاكر بتنباع بالسوق,[],0,approved,,
mt_msa_10b830bd,train,42933,MSA,ما أسعدني في هذا الخبر سلامة الأم وطفلها,ما اسعدني في هذا الخبر سلامه الام وطفلها,ما أسعدني في هذا الخبر سلامة الأم وطفلها,[],0,approved,,
mt_dial_egy_e5d2112e,train,53103,DIAL_EGY,عرفنة ان انت تبع الحزب الحاكم وانك كره البرادعي بس احنا كلنا وراه ولو جمال مسك هيبقى مشبرضانا او بالتزوير واوعدك انه مشهيستمر فى الحكم كتير لان الناس هتنقلب عليه وعرفي تاريخ مصر كويس ان المصريين بيسكتوا بيسكتوا بس فى الاخر بيحرروا بلدهم هما دول,عرفنه ان انت تبع الحزب الحاكم وانك كره البرادعي بس احنا كلنا وراه ولو جمال مسك هيبقي مشبرضانا او بالتزوير واوعدك انه مشهيستمر في الحكم كتير لان الناس هتنقلب عليه وعرفي تاريخ مصر كويس ان المصريين بيسكتوا بيسكتوا بس في الاخر بيحرروا بلدهم هما دول,عرفنة ان انت تبع الحزب الحاكم وانك كره [PERSON_1] بس احنا كلنا وراه ولو [PERSON_2] مسك هيبقى مشبرضانا او بالتزوير واوعدك انه مشهيستمر فى الحكم كتير لان الناس هتنقلب عليه وعرفي تاريخ [LOC_1] كويس ان المصريين بيسكتوا بيسكتوا بس فى الاخر بيحرروا بلدهم هما دول,"[{""start"": 39, ""end"": 47, ""placeholder"": ""[PERSON_1]"", ""surface_form"": ""البرادعي"", ""mask_type"": ""PERSON""}, {""start"": 70, ""end"": 74, ""placeholder"": ""[PERSON_2]"", ""surface_form"": ""جمال"", ""mask_type"": ""PERSON""}, {""start"": 174, ""end"": 177, ""placeholder"": ""[LOC_1]"", ""surface_form"": ""مصر"", ""mask_type"": ""LOC""}]",3,approved,,
mt_dial_glf_1924cce1,train,85084,DIAL_GLF,اشوف راعين المحلي مالهم اثر,اشوف راعين المحلي مالهم اثر,اشوف راعين المحلي مالهم اثر,[],0,approved,,
mt_dial_lev_73837aeb,train,46511,DIAL_LEV,عادي جدا لا جمهور المارد الاخضر ولا جمهور الفيصلي يستغرب لانه هذا مستوى الفيصلي الحقيقي حتى الدوري جاءهم هديه على طبق من ذهب بعد مسلسل خدني جيتك الحلقه الاولى . ولكن جمهور الفيصلي يأبى الا ان يكابر حتى بعد خسارتهم سوف يكابرون .,عادي جدا لا جمهور المارد الاخضر ولا جمهور الفيصلي يستغرب لانه هذا مستوي الفيصلي الحقيقي حتي الدوري جاءهم هديه علي طبق من ذهب بعد مسلسل خدني جيتك الحلقه الاولي ولكن جمهور الفيصلي يابي الا ان يكابر حتي بعد خسارتهم سوف يكابرون,عادي جدا لا جمهور المارد الاخضر ولا جمهور [ORG_1] يستغرب لانه هذا مستوى [ORG_1] الحقيقي حتى الدوري جاءهم هديه على طبق من ذهب بعد مسلسل خدني جيتك الحلقه [NUM_1] . ولكن جمهور [ORG_1] يأبى الا ان يكابر حتى بعد خسارتهم سوف يكابرون .,"[{""start"": 42, ""end"": 49, ""placeholder"": ""[ORG_1]"", ""surface_form"": ""الفيصلي"", ""mask_type"": ""ORG""}, {""start"": 72, ""end"": 79, ""placeholder"": ""[ORG_1]"", ""surface_form"": ""الفيصلي"", ""mask_type"": ""ORG""}, {""start"": 152, ""end"": 158, ""placeholder"": ""[NUM_1]"", ""surface_form"": ""الاولى"", ""mask_type"": ""NUM""}, {""start"": 172, ""end"": 179, ""placeholder"": ""[ORG_1]"", ""surface_form"": ""الفيصلي"", ""mask_type"": ""ORG""}]",4,approved,,
mt_msa_291d8b71,train,13437,MSA,با التوفيق للزعيم وليس له سواء الفوز بأذن الله واتوقعها 2 للزعيم للاشي,با التوفيق للزعيم وليس له سواء الفوز باذن الله واتوقعها 2 للزعيم للاشي,با التوفيق للزعيم وليس له سواء الفوز بأذن الله واتوقعها [NUM_1] للزعيم للاشي,"[{""start"": 56, ""end"": 57, ""placeholder"": ""[NUM_1]"", ""surface_form"": ""2"", ""mask_type"": ""NUM""}]",1,approved,,
mt_dial_egy_9b2da24f,train,31969,DIAL_EGY,معاكم للآخر و إن شاء الله مش هايخيب ظني,معاكم للاخر و ان شاء الله مش هايخيب ظني,معاكم للآخر و إن شاء الله مش هايخيب ظني,[],0,approved,,
mt_dial_glf_0ce38b0a,train,74188,DIAL_GLF,لو كلنا وقفنا مع كل فريق سعودي زي كذا كان كل فريق سعودي شفت مستواه,لو كلنا وقفنا مع كل فريق سعودي زي كذا كان كل فريق سعودي شفت مستواه,لو كلنا وقفنا مع كل فريق [LOC_1] زي كذا كان كل فريق [LOC_1] شفت مستواه,"[{""start"": 25, ""end"": 30, ""placeholder"": ""[LOC_1]"", ""surface_form"": ""سعودي"", ""mask_type"": ""LOC""}, {""start"": 50, ""end"": 55, ""placeholder"": ""[LOC_1]"", ""surface_form"": ""سعودي"", ""mask_type"": ""LOC""}]",2,approved,,
mt_dial_lev_50893fa3,train,84003,DIAL_LEV,بس ما عرفنا متى رح يطبق هذا القانون ؟ ! !,بس ما عرفنا متي رح يطبق هذا القانون,بس ما عرفنا متى رح يطبق هذا القانون ؟ ! !,[],0,approved,,
mt_msa_9025e189,train,7443,MSA,انا اجهل ميكانيك السيارات ولا اعرف سوى ان اشغل وامشي . ولكن من الافضل ان تكون عندي الخبرة الكافية لصيانة سيارتي . وحقا الذكور افضل من هذه الناحية . واتمنى ان اسوق سيارتي كأي رجل وبجرأتهم واتمنى ان اصبح جيدة بالرفيرس . واكثر الشباب نشامى لا يقصرون ابدا عند الحاجة لهم . نشكر جهود الجميع وشكرا للغد على هذا الموضوع لانه مهم جداوارجو اعطاء النساء المالكات للسيارات دورات بالصيانه ( الميكانيك ),انا اجهل ميكانيك السيارات ولا اعرف سوي ان اشغل وامشي ولكن من الافضل ان تكون عندي الخبره الكافيه لصيانه سيارتي وحقا الذكور افضل من هذه الناحيه واتمني ان اسوق سيارتي كاي رجل وبجراتهم واتمني ان اصبح جيده بالرفيرس واكثر الشباب نشامي لا يقصرون ابدا عند الحاجه لهم نشكر جهود الجميع وشكرا للغد علي هذا الموضوع لانه مهم جداوارجو اعطاء النساء المالكات للسيارات دورات بالصيانه الميكانيك,انا اجهل ميكانيك السيارات ولا اعرف سوى ان اشغل وامشي . ولكن من الافضل ان تكون عندي الخبرة الكافية لصيانة سيارتي . وحقا الذكور افضل من هذه الناحية . واتمنى ان اسوق سيارتي كأي رجل وبجرأتهم واتمنى ان اصبح جيدة بالرفيرس . واكثر الشباب نشامى لا يقصرون ابدا عند الحاجة لهم . نشكر جهود الجميع وشكرا ل[ORG_1] على هذا الموضوع لانه مهم جداوارجو اعطاء النساء المالكات للسيارات دورات بالصيانه ( الميكانيك ),"[{""start"": 293, ""end"": 296, ""placeholder"": ""[ORG_1]"", ""surface_form"": ""لغد"", ""mask_type"": ""ORG""}]",1,approved,,
mt_dial_egy_7d5a7e03,train,61739,DIAL_EGY,بجد الواحد مش هيقول غير حسبي الله ونعم,بجد الواحد مش هيقول غير حسبي الله ونعم,بجد الواحد مش هيقول غير حسبي الله ونعم,[],0,approved,,
mt_dial_glf_f0904ae5,train,17795,DIAL_GLF,ليش تسوون تعداد انا اعلمكم 2 مليون غني 2 مليون متنفذ واصحاب مشاريع 3 مليون متجنس اربعه مليون فقير خمسه مليون عاطل سبعه مليون اجنبي يعملون بنظام,ليش تسوون تعداد انا اعلمكم 2 مليون غني 2 مليون متنفذ واصحاب مشاريع 3 مليون متجنس اربعه مليون فقير خمسه مليون عاطل سبعه مليون اجنبي يعملون بنظام,ليش تسوون تعداد انا اعلمكم [NUM_1] مليون غني [NUM_1] مليون متنفذ واصحاب مشاريع [NUM_2] مليون متجنس اربعه مليون فقير خمسه مليون عاطل سبعه مليون اجنبي يعملون بنظام,"[{""start"": 27, ""end"": 28, ""placeholder"": ""[NUM_1]"", ""surface_form"": ""2"", ""mask_type"": ""NUM""}, {""start"": 39, ""end"": 40, ""placeholder"": ""[NUM_1]"", ""surface_form"": ""2"", ""mask_type"": ""NUM""}, {""start"": 67, ""end"": 68, ""placeholder"": ""[NUM_2]"", ""surface_form"": ""3"", ""mask_type"": ""NUM""}]",3,approved,,
mt_dial_lev_03810e85,train,19755,DIAL_LEV,وبدعوا اهل الخير يساعدوها ويساعدوا,وبدعوا اهل الخير يساعدوها ويساعدوا,وبدعوا اهل الخير يساعدوها ويساعدوا,[],0,approved,,
mt_dial_egy_ea9c13bc,train,208,DIAL_EGY,مش جديد عليهم يزورو ويعملو اى شىء ضد الانسانية علشان يجبرو الناس على,مش جديد عليهم يزورو ويعملو اي شيء ضد الانسانيه علشان يجبرو الناس علي,مش جديد عليهم يزورو ويعملو اى شىء ضد الانسانية علشان يجبرو الناس على,[],0,approved,,
mt_dial_glf_69f51606,train,64570,DIAL_GLF,الخوف من المستقبل ماهو مرتبط بالوظيفة ولكن صحيح اللي عنده وظيفه تكون نفسيه مستقرة اكثر,الخوف من المستقبل ماهو مرتبط بالوظيفه ولكن صحيح اللي عنده وظيفه تكون نفسيه مستقره اكثر,الخوف من المستقبل ماهو مرتبط بالوظيفة ولكن صحيح اللي عنده وظيفه تكون نفسيه مستقرة اكثر,[],0,approved,,
mt_dial_lev_920f9d07,train,58265,DIAL_LEV,باذن الله الكاس وحداتي سلم سلم سلامات والكأس للوحدات ونتمنى التقدم و النجاح لنادي الفيصلي بعد الخروج من,باذن الله الكاس وحداتي سلم سلم سلامات والكاس للوحدات ونتمني التقدم و النجاح لنادي الفيصلي بعد الخروج من,باذن الله الكاس وحداتي سلم سلم سلامات والكأس ل[ORG_1] ونتمنى التقدم و النجاح لنادي [ORG_2] بعد الخروج من,"[{""start"": 46, ""end"": 52, ""placeholder"": ""[ORG_1]"", ""surface_form"": ""لوحدات"", ""mask_type"": ""ORG""}, {""start"": 82, ""end"": 89, ""placeholder"": ""[ORG_2]"", ""surface_form"": ""الفيصلي"", ""mask_type"": ""ORG""}]",2,approved,,
mt_msa_6b40f419,train,48981,MSA,الحزب الوطنى اكبر احزاب مصر على الاطلاق واكثرها تنظيما وواهم كل من لا يعلم ذلك واعضائة المنتخبون فى الوحدات الحزبيه القاعديةبالملايينوهو حزب عملاق يقوده زعيم عملاق لةشعبيه كاسحة فلا البرادعى او غيره هذا الذى عفا السيد الرئيس عنه بعد ان اتهمه القضاء المستقل بالتزوير يمكن ان يهز شعرة واحدة وصندوق الانتخابات هو الفيصل بيننا,الحزب الوطني اكبر احزاب مصر علي الاطلاق واكثرها تنظيما وواهم كل من لا يعلم ذلك واعضايه المنتخبون في الوحدات الحزبيه القاعديهبالملايينوهو حزب عملاق يقوده زعيم عملاق لهشعبيه كاسحه فلا البرادعي او غيره هذا الذي عفا السيد الرييس عنه بعد ان اتهمه القضاء المستقل بالتزوير يمكن ان يهز شعره واحده وصندوق الانتخابات هو الفيصل بيننا,الحزب الوطنى اكبر احزاب [LOC_1] على الاطلاق واكثرها تنظيما وواهم كل من لا يعلم ذلك واعضائة المنتخبون فى الوحدات الحزبيه القاعديةبالملايينوهو حزب عملاق يقوده زعيم عملاق لةشعبيه كاسحة فلا [PERSON_1] او غيره هذا الذى عفا السيد الرئيس عنه بعد ان اتهمه القضاء المستقل بالتزوير يمكن ان يهز شعرة واحدة وصندوق الانتخابات هو الفيصل بيننا,"[{""start"": 24, ""end"": 27, ""placeholder"": ""[LOC_1]"", ""surface_form"": ""مصر"", ""mask_type"": ""LOC""}, {""start"": 182, ""end"": 190, ""placeholder"": ""[PERSON_1]"", ""surface_form"": ""البرادعى"", ""mask_type"": ""PERSON""}]",2,approved,,
mt_dial_egy_efd91eab,train,1232,DIAL_EGY,يارب ارحمنا وخلينا نخلص من الكليه دى على خير امين,يارب ارحمنا وخلينا نخلص من الكليه دي علي خير امين,يارب ارحمنا وخلينا نخلص من الكليه دى على خير امين,[],0,approved,,
mt_dial_glf_37b6b235,train,78291,DIAL_GLF,الحين ما نخلص من هالمحاسب الي قاعد يتكلم في الدين . . . واذا تكلم غيره في الدين بأمر لا يوافقهم قالو كيف تعطون الموضوع لغير,الحين ما نخلص من هالمحاسب الي قاعد يتكلم في الدين واذا تكلم غيره في الدين بامر لا يوافقهم قالو كيف تعطون الموضوع لغير,الحين ما نخلص من هالمحاسب الي قاعد يتكلم في الدين . . . واذا تكلم غيره في الدين بأمر لا يوافقهم قالو كيف تعطون الموضوع لغير,[],0,approved,,
mt_dial_lev_157f208a,train,15743,DIAL_LEV,الرياضة حلوة ، لكن مش معقول انها تتحول لسبب خلاف بين الازواج ، يعني بالتفاهم يمكن الامور تننحل ، بعدين الزوجات بحتكروا التلفزيون طول الوقت بالعادة فمش معقول يستكثروا ع الزلام ها,الرياضه حلوه لكن مش معقول انها تتحول لسبب خلاف بين الازواج يعني بالتفاهم يمكن الامور تننحل بعدين الزوجات بحتكروا التلفزيون طول الوقت بالعاده فمش معقول يستكثروا ع الزلام ها,الرياضة حلوة ، لكن مش معقول انها تتحول لسبب خلاف بين الازواج ، يعني بالتفاهم يمكن الامور تننحل ، بعدين الزوجات بحتكروا التلفزيون طول الوقت بالعادة فمش معقول يستكثروا ع الزلام ها,[],0,approved,,
mt_dial_egy_f1997cca,train,61652,DIAL_EGY,كفانا هما بعد هم - كفانا حيره و حرقه دم - لو ده شئ مهم - فيه برضه الف حاجه,كفانا هما بعد هم كفانا حيره و حرقه دم لو ده شي مهم فيه برضه الف حاجه,كفانا هما بعد هم - كفانا حيره و حرقه دم - لو ده شئ مهم - فيه برضه الف حاجه,[],0,approved,,
mt_dial_glf_5da1b117,train,84801,DIAL_GLF,قبل لاحد يلوم الدعيع لوموا قلوب الدفاع خاصة الي فاتحين شوارع في الدفاع الهلالي ولوموا الظهيرين الي ساهموا في قصم ظهر البعير ( الدعيع,قبل لاحد يلوم الدعيع لوموا قلوب الدفاع خاصه الي فاتحين شوارع في الدفاع الهلالي ولوموا الظهيرين الي ساهموا في قصم ظهر البعير الدعيع,قبل لاحد يلوم [PERSON_1] لوموا قلوب الدفاع خاصة الي فاتحين شوارع في الدفاع الهلالي ولوموا الظهيرين الي ساهموا في قصم ظهر البعير ( [PERSON_1],"[{""start"": 14, ""end"": 20, ""placeholder"": ""[PERSON_1]"", ""surface_form"": ""الدعيع"", ""mask_type"": ""PERSON""}, {""start"": 126, ""end"": 132, ""placeholder"": ""[PERSON_1]"", ""surface_form"": ""الدعيع"", ""mask_type"": ""PERSON""}]",2,approved,,
mt_dial_lev_bda9e096,train,79309,DIAL_LEV,"ما أروع أجواء الشتاء و البرد , , حنشتاق كثيرا لتلك الأيام . الحمدلله على كل",ما اروع اجواء الشتاء و البرد حنشتاق كثيرا لتلك الايام الحمدلله علي كل,"ما أروع أجواء الشتاء و البرد , , حنشتاق كثيرا لتلك الأيام . الحمدلله على كل",[],0,approved,,
mt_msa_b421c3c5,train,23058,MSA,رهان النخبة على شباب صغير العمر لا يعرف فى السياسة,رهان النخبه علي شباب صغير العمر لا يعرف في السياسه,رهان النخبة على شباب صغير العمر لا يعرف فى السياسة,[],0,approved,,
mt_dial_egy_fff52886,train,16969,DIAL_EGY,بالمناسبة الجميلة ده ، هو فين د . نفين شكري مش ناوية تعلق على الموضوع ده زي ما بتعلق على موضوعات دكتور البرادعي ، ، ولا التعليق هنا خارج نطاق الاتفاق,بالمناسبه الجميله ده هو فين د نفين شكري مش ناويه تعلق علي الموضوع ده زي ما بتعلق علي موضوعات دكتور البرادعي ولا التعليق هنا خارج نطاق الاتفاق,بالمناسبة الجميلة ده ، هو فين د . [PERSON_1] مش ناوية تعلق على الموضوع ده زي ما بتعلق على موضوعات دكتور [PERSON_2] ، ، ولا التعليق هنا خارج نطاق الاتفاق,"[{""start"": 34, ""end"": 43, ""placeholder"": ""[PERSON_1]"", ""surface_form"": ""نفين شكري"", ""mask_type"": ""PERSON""}, {""start"": 103, ""end"": 111, ""placeholder"": ""[PERSON_2]"", ""surface_form"": ""البرادعي"", ""mask_type"": ""PERSON""}]",2,approved,,
mt_dial_glf_a1325487,train,35912,DIAL_GLF,يعني تظلم بنت الناس عشان امك وتقول ما ابي اغضب امي طيب وغضب رب العالمين ماتخاف,يعني تظلم بنت الناس عشان امك وتقول ما ابي اغضب امي طيب وغضب رب العالمين ماتخاف,يعني تظلم بنت الناس عشان امك وتقول ما ابي اغضب امي طيب وغضب رب العالمين ماتخاف,[],0,approved,,
mt_dial_lev_177c9702,train,44102,DIAL_LEV,هذا البرنامج جدا سخيف ومع الاحترام للمشاركين برضة . .,هذا البرنامج جدا سخيف ومع الاحترام للمشاركين برضه,هذا البرنامج جدا سخيف ومع الاحترام للمشاركين برضة . .,[],0,approved,,
mt_msa_4246385f,train,56789,MSA,قاعده اطلاق الالعاب الناريه جاهزه منذ اسبوع والسطح ملغوم بالكامل العاب ناريه من كل الانواع وكالمعتاد وقبل ان تنتهي المباره بثواني تجد جميع الجيران على اسطح منازلهم بانتظاري لاطلاق مواكب الفرح الوحداتي والكل يزغرد والكل,قاعده اطلاق الالعاب الناريه جاهزه منذ اسبوع والسطح ملغوم بالكامل العاب ناريه من كل الانواع وكالمعتاد وقبل ان تنتهي المباره بثواني تجد جميع الجيران علي اسطح منازلهم بانتظاري لاطلاق مواكب الفرح الوحداتي والكل يزغرد والكل,قاعده اطلاق الالعاب الناريه جاهزه منذ اسبوع والسطح ملغوم بالكامل العاب ناريه من كل الانواع وكالمعتاد وقبل ان تنتهي المباره بثواني تجد جميع الجيران على اسطح منازلهم بانتظاري لاطلاق مواكب الفرح الوحداتي والكل يزغرد والكل,[],0,approved,,
mt_dial_egy_d904c4b9,train,63914,DIAL_EGY,كل ده كان متوقع وكل ده معناه إن النظام أصبح عاجز . . ويخشى من الشعب . . الصور فيها عدد عساكر ضعف الناس الموجودة . . . بس الأحلى إن عدد الكاميرات كمان أكتر . . ومفيش حاجة من النهاردة هتستخبى . . . ودي بداية لنهاية مبارك,كل ده كان متوقع وكل ده معناه ان النظام اصبح عاجز ويخشي من الشعب الصور فيها عدد عساكر ضعف الناس الموجوده بس الاحلي ان عدد الكاميرات كمان اكتر ومفيش حاجه من النهارده هتستخبي ودي بدايه لنهايه مبارك,كل ده كان متوقع وكل ده معناه إن النظام أصبح عاجز . . ويخشى من الشعب . . الصور فيها عدد عساكر ضعف الناس الموجودة . . . بس الأحلى إن عدد الكاميرات كمان أكتر . . ومفيش حاجة من النهاردة هتستخبى . . . ودي بداية لنهاية [PERSON_1],"[{""start"": 213, ""end"": 218, ""placeholder"": ""[PERSON_1]"", ""surface_form"": ""مبارك"", ""mask_type"": ""PERSON""}]",1,approved,,
mt_dial_glf_e9352582,train,51058,DIAL_GLF,انت لواء يعني قضيت عمرك في المرور والى الان ما تعرف انكم سبب,انت لواء يعني قضيت عمرك في المرور والي الان ما تعرف انكم سبب,انت لواء يعني قضيت عمرك في المرور والى الان ما تعرف انكم سبب,[],0,approved,,
mt_msa_a1e8d2ae,train,3247,MSA,فاين اخلاقك ومبادئك عندما تتحيز للاهلى باسلوب اقرب للاستفزاز وتكون ضد كل ما هو ابيض بشكل انت تريد به اثارة غضب الزمالكاوية,فاين اخلاقك ومباديك عندما تتحيز للاهلي باسلوب اقرب للاستفزاز وتكون ضد كل ما هو ابيض بشكل انت تريد به اثاره غضب الزمالكاويه,فاين اخلاقك ومبادئك عندما تتحيز ل[ORG_1] باسلوب اقرب للاستفزاز وتكون ضد كل ما هو ابيض بشكل انت تريد به اثارة غضب الزمالكاوية,"[{""start"": 33, ""end"": 38, ""placeholder"": ""[ORG_1]"", ""surface_form"": ""لاهلى"", ""mask_type"": ""ORG""}]",1,approved,,
