example_id,source_split,source_row_id,dialect,original_text,normalized_text,masked_text,mask_spans_json,mask_count,annotation_status,annotator_model,notes
mt_dial_egy_c4818f23,train,46647,DIAL_EGY,والله انفضحتم كل يوم نسمع عن حضارتكم يا متحضرين جدا جدا جدا ه قال متحضرين قال من أين جاءتكم الحضارة يا بدو النيل من أين جاءتكم الحضارة ه همج والله همج وبلطجية وكمان ليس لكم أي شيئ في الكرة يا,والله انفضحتم كل يوم نسمع عن حضارتكم يا متحضرين جدا جدا جدا ه قال متحضرين قال من اين جاءتكم الحضاره يا بدو النيل من اين جاءتكم الحضاره ه همج والله همج وبلطجيه وكمان ليس لكم اي شيي في الكره يا,والله انفضحتم كل يوم نسمع عن حضارتكم يا متحضرين جدا جدا جدا ه قال متحضرين قال من أين جاءتكم الحضارة يا بدو النيل من أين جاءتكم الحضارة ه همج والله همج وبلطجية وكمان ليس لكم أي شيئ في الكرة يا,[],0,approved,,
mt_dial_glf_90e2e825,train,4,DIAL_GLF,الله يجبر كسرهم ويرجع و لدهم اليوم قبل بكرى ،,الله يجبر كسرهم ويرجع و لدهم اليوم قبل بكري,الله يجبر كسرهم ويرجع و لدهم اليوم قبل بكرى ،,[],0,approved,,
mt_dial_lev_ada2abff,train,84121,DIAL_LEV,هل ميزانية الجزيره فقط مرصوده لشراء لاعبين بأي سعر وبس,هل ميزانيه الجزيره فقط مرصوده لشراء لاعبين باي سعر وبس,هل ميزانية [ORG_1] فقط مرصوده لشراء لاعبين بأي سعر وبس,"[{""start"": 11, ""end"": 18, ""placeholder"": ""[ORG_1]"", ""surface_form"": ""الجزيره"", ""mask_type"": ""ORG""}]",1,approved,,
mt_msa_27081eb0,train,68163,MSA,والوحدات بطل كأس الكؤؤس وكأس الاردن,والوحدات بطل كاس الكووس وكاس الاردن,و[ORG_1] بطل كأس الكؤؤس وكأس [LOC_1],"[{""start"": 1, ""end"": 8, ""placeholder"": ""[ORG_1]"", ""surface_form"": ""الوحدات"", ""mask_type"": ""ORG""}, {""start"": 29, ""end"": 35, ""placeholder"": ""[LOC_1]"", ""surface_form"": ""الاردن"", ""mask_type"": ""LOC""}]",2,approved,,
mt_dial_egy_6525f57b,train,48106,DIAL_EGY,والله انتوا اشرتواا باشارلت ذيكوا بس المخرج طبعا كان مركز على الزمالك وبس وكل اللى فى الاستاد شاف الحركات دى وناس صورتها فيديو اخبطوا راسكوا فى الحيط وبرده مافزتوش وقدرنا نتعادل وضاع الفوز ونجح الحكم الاخمر فى احمرفى مهمته وتنفيذ,والله انتوا اشرتواا باشارلت ذيكوا بس المخرج طبعا كان مركز علي الزمالك وبس وكل اللي في الاستاد شاف الحركات دي وناس صورتها فيديو اخبطوا راسكوا في الحيط وبرده مافزتوش وقدرنا نتعادل وضاع الفوز ونجح الحكم الاخمر في احمرفي مهمته وتنفيذ,والله انتوا اشرتواا باشارلت ذيكوا بس المخرج طبعا كان مركز على [ORG_1] وبس وكل اللى فى الاستاد شاف الحركات دى وناس صورتها فيديو اخبطوا راسكوا فى الحيط وبرده مافزتوش وقدرنا نتعادل وضاع الفوز ونجح الحكم الاخمر فى احمرفى مهمته وتنفيذ,"[{""start"": 62, ""end"": 69, ""placeholder"": ""[ORG_1]"", ""surface_form"": ""الزمالك"", ""mask_type"": ""ORG""}]",1,approved,,
mt_dial_glf_c6d579ad,train,10665,DIAL_GLF,الدعيع الله يهديه وش هالمستوى .,الدعيع الله يهديه وش هالمستوي,[PERSON_1] الله يهديه وش هالمستوى .,"[{""start"": 0, ""end"": 6, ""placeholder"": ""[PERSON_1]"", ""surface_form"": ""الدعيع"", ""mask_type"": ""PERSON""}]",1,approved,,
mt_dial_lev_f5b261b6,train,389,DIAL_LEV,الله يخليهم يارب والبنات رزقه من الله والله يكون بعونك لانهم بدهم رعايه دير بالك,الله يخليهم يارب والبنات رزقه من الله والله يكون بعونك لانهم بدهم رعايه دير بالك,الله يخليهم يارب والبنات رزقه من الله والله يكون بعونك لانهم بدهم رعايه دير بالك,[],0,approved,,
mt_msa_f8bbb17c,train,55265,MSA,استاذ جهاد اشكر ذوقك واهتمامك بتواجدنا للتعليق الف,استاذ جهاد اشكر ذوقك واهتمامك بتواجدنا للتعليق الف,استاذ [PERSON_1] اشكر ذوقك واهتمامك بتواجدنا للتعليق الف,"[{""start"": 6, ""end"": 10, ""placeholder"": ""[PERSON_1]"", ""surface_form"": ""جهاد"", ""mask_type"": ""PERSON""}]",1,approved,,
mt_dial_egy_837d4487,train,16471,DIAL_EGY,كنت انتظر منك ياكابتن انك تطفى النار عشان خاطرنا وتنهى الموال ده,كنت انتظر منك ياكابتن انك تطفي النار عشان خاطرنا وتنهي الموال ده,كنت انتظر منك ياكابتن انك تطفى النار عشان خاطرنا وتنهى الموال ده,[],0,approved,,
mt_dial_glf_12812aa5,train,74623,DIAL_GLF,بصراح انا بيعجبني لعب الفن في الكورة الاجانب,بصراح انا بيعجبني لعب الفن في الكوره الاجانب,بصراح انا بيعجبني لعب الفن في الكورة الاجانب,[],0,approved,,
mt_msa_8c623ddc,train,45757,MSA,"الفنان الشاب هيثم محمد له تجربة ناجحة مع الفنان هاني رمزي في مسلسل "" مبروك جالك قلق "" حيت كان دور الفنان هيثم محمد في دور الشاب الرياضي لعاب كرة المضرب دور أكتر من رائع وأنا أتمنى تكرار هذة التجربة مره أخرى في مسلسل "" أمين ألانتقام "" وأنا متاكد أن وجود الفنان الشاب هيثم محمد في مسلسل "" أمين ألانتقام "" نجاح كبير لأن الفنان الشاب هيثم محمد أفضل ممثل صاعد",الفنان الشاب هيثم محمد له تجربه ناجحه مع الفنان هاني رمزي في مسلسل مبروك جالك قلق حيت كان دور الفنان هيثم محمد في دور الشاب الرياضي لعاب كره المضرب دور اكتر من رايع وانا اتمني تكرار هذه التجربه مره اخري في مسلسل امين الانتقام وانا متاكد ان وجود الفنان الشاب هيثم محمد في مسلسل امين الانتقام نجاح كبير لان الفنان الشاب هيثم محمد افضل ممثل صاعد,"الفنان الشاب [PERSON_1] له تجربة ناجحة مع الفنان [PERSON_2] في مسلسل "" مبروك جالك قلق "" حيت كان دور الفنان [PERSON_1] في دور الشاب الرياضي لعاب كرة المضرب دور أكتر من رائع وأنا أتمنى تكرار هذة التجربة مره أخرى في مسلسل "" أمين ألانتقام "" وأنا متاكد أن وجود الفنان الشاب [PERSON_1] في مسلسل "" أمين ألانتقام "" نجاح كبير لأن الفنان الشاب [PERSON_1] أفضل ممثل صاعد","[{""start"": 13, ""end"": 22, ""placeholder"": ""[PERSON_1]"", ""surface_form"": ""هيثم محمد"", ""mask_type"": ""PERSON""}, {""start"": 48, ""end"": 57, ""placeholder"": ""[PERSON_2]"", ""surface_form"": ""هاني رمزي"", ""mask_type"": ""PERSON""}, {""start"": 105, ""end"": 114, ""placeholder"": ""[PERSON_1]"", ""surface_form"": ""هيثم محمد"", ""mask_type"": ""PERSON""}, {""start"": 266, ""end"": 275, ""placeholder"": ""[PERSON_1]"", ""surface_form"": ""هيثم محمد"", ""mask_type"": ""PERSON""}, {""start"": 330, ""end"": 339, ""placeholder"": ""[PERSON_1]"", ""surface_form"": ""هيثم محمد"", ""mask_type"": ""PERSON""}]",5,approved,,
mt_dial_egy_97a4bf34,train,53893,DIAL_EGY,انا بااحترم كل المسيحين اللى على ارض مصر وياريت التعليقات اللى فيها سخرية من المسيحين ما تزعلهومش لان اكيد اللى كاتبها غرضة التعصب وفرقتنا اللى لو حصلت مصر,انا بااحترم كل المسيحين اللي علي ارض مصر وياريت التعليقات اللي فيها سخريه من المسيحين ما تزعلهومش لان اكيد اللي كاتبها غرضه التعصب وفرقتنا اللي لو حصلت مصر,انا بااحترم كل المسيحين اللى على ارض [LOC_1] وياريت التعليقات اللى فيها سخرية من المسيحين ما تزعلهومش لان اكيد اللى كاتبها غرضة التعصب وفرقتنا اللى لو حصلت [LOC_1],"[{""start"": 37, ""end"": 40, ""placeholder"": ""[LOC_1]"", ""surface_form"": ""مصر"", ""mask_type"": ""LOC""}, {""start"": 152, ""end"": 155, ""placeholder"": ""[LOC_1]"", ""surface_form"": ""مصر"", ""mask_type"": ""LOC""}]",2,approved,,
mt_dial_glf_e9e039f5,train,8087,DIAL_GLF,اولا . . احترم مجلس الشورى واقدرره . . لكن حرام عليكم توافقون وترفضون بدون اذن المواطن . . فيه ناس حالتهم على قدهم بس مايقدرون يجيبون خدامه او سوااق بهذي,اولا احترم مجلس الشوري واقدرره لكن حرام عليكم توافقون وترفضون بدون اذن المواطن فيه ناس حالتهم علي قدهم بس مايقدرون يجيبون خدامه او سوااق بهذي,اولا . . احترم [ORG_1] واقدرره . . لكن حرام عليكم توافقون وترفضون بدون اذن المواطن . . فيه ناس حالتهم على قدهم بس مايقدرون يجيبون خدامه او سوااق بهذي,"[{""start"": 15, ""end"": 26, ""placeholder"": ""[ORG_1]"", ""surface_form"": ""مجلس الشورى"", ""mask_type"": ""ORG""}]",1,approved,,
