example_id,source_split,source_row_id,dialect,original_text,normalized_text,masked_text,mask_spans_json,mask_count,annotation_status,annotator_model,notes
mt_dial_egy_3154b867,train,84969,DIAL_EGY,حضرتك بتطلبي منا نقفل عنينا ونكدببها يعني الناس اللى شافت المر بعنيها ومعلم في جسمها واأطفال اللى شافوا أهلهم بتتهان وتنداس كرامتها بالجزم من السادة أبطال الشرطة واللى ماشي في الشارع واتاخد من غير أي ذنب وكل ده والله شوفته بعنيا مطلوب منهم بقا يدعوا للشرطة بطول العمر والبركة والخير ؟ ؟,حضرتك بتطلبي منا نقفل عنينا ونكدببها يعني الناس اللي شافت المر بعنيها ومعلم في جسمها وااطفال اللي شافوا اهلهم بتتهان وتنداس كرامتها بالجزم من الساده ابطال الشرطه واللي ماشي في الشارع واتاخد من غير اي ذنب وكل ده والله شوفته بعنيا مطلوب منهم بقا يدعوا للشرطه بطول العمر والبركه والخير,حضرتك بتطلبي منا نقفل عنينا ونكدببها يعني الناس اللى شافت المر بعنيها ومعلم في جسمها واأطفال اللى شافوا أهلهم بتتهان وتنداس كرامتها بالجزم من السادة أبطال الشرطة واللى ماشي في الشارع واتاخد من غير أي ذنب وكل ده والله شوفته بعنيا مطلوب منهم بقا يدعوا للشرطة بطول العمر والبركة والخير ؟ ؟,[],0,approved,,
mt_dial_glf_32e3e5c7,train,70715,DIAL_GLF,وانتظر التصنيف بعد اسياء راح يكون حوالي ثمانين او اكثر . . .,وانتظر التصنيف بعد اسياء راح يكون حوالي ثمانين او اكثر,وانتظر التصنيف بعد اسياء راح يكون حوالي ثمانين او اكثر . . .,[],0,approved,,
mt_dial_lev_28020b3d,train,74,DIAL_LEV,هو مين الي اله القرار الاول والاخير بجيزة البنت غير الام وكمان بجيزة الشاب ؟,هو مين الي اله القرار الاول والاخير بجيزه البنت غير الام وكمان بجيزه الشاب,هو مين الي اله القرار الاول والاخير بجيزة البنت غير الام وكمان بجيزة الشاب ؟,[],0,approved,,
mt_msa_203c24a8,train,49990,MSA,السؤال الذي يطرح نفسه دائما و ابدا ، هل يا قطر لو كان هؤلاء الصيادين ايرانيين ستستمر ازمتهم حتى اليوم ؟ ؟,السوال الذي يطرح نفسه دايما و ابدا هل يا قطر لو كان هولاء الصيادين ايرانيين ستستمر ازمتهم حتي اليوم,السؤال الذي يطرح نفسه دائما و ابدا ، هل يا [LOC_1] لو كان هؤلاء الصيادين ايرانيين ستستمر ازمتهم حتى اليوم ؟ ؟,"[{""start"": 43, ""end"": 46, ""placeholder"": ""[LOC_1]"", ""surface_form"": ""قطر"", ""mask_type"": ""LOC""}]",1,approved,,
mt_dial_egy_9217d45e,train,39224,DIAL_EGY,قم يامصري مصر دايما بتناديك خد بنصري نصري دين واجب عليك,قم يامصري مصر دايما بتناديك خد بنصري نصري دين واجب عليك,قم يامصري [LOC_1] دايما بتناديك خد بنصري نصري دين واجب عليك,"[{""start"": 10, ""end"": 13, ""placeholder"": ""[LOC_1]"", ""surface_form"": ""مصر"", ""mask_type"": ""LOC""}]",1,approved,,
mt_dial_glf_a6d71fbe,train,31204,DIAL_GLF,عقبالنا يا رب . . . لأننا حنا السبب في نشر هالعادات و التقاليد للدول الإسلامية على أنها من الإسلام ! و هي لا,عقبالنا يا رب لاننا حنا السبب في نشر هالعادات و التقاليد للدول الاسلاميه علي انها من الاسلام و هي لا,عقبالنا يا رب . . . لأننا حنا السبب في نشر هالعادات و التقاليد للدول الإسلامية على أنها من الإسلام ! و هي لا,[],0,approved,,
mt_dial_lev_2c1175e0,train,72580,DIAL_LEV,يعني مش عارف شو قصة الشعب والامن العام . . . تقول يه . . .,يعني مش عارف شو قصه الشعب والامن العام تقول يه,يعني مش عارف شو قصة الشعب و[ORG_1] . . . تقول يه . . .,"[{""start"": 27, ""end"": 38, ""placeholder"": ""[ORG_1]"", ""surface_form"": ""الامن العام"", ""mask_type"": ""ORG""}]",1,approved,,
mt_msa_ee19ce76,train,57685,MSA,انا اعتقد ان محمد نجيب ليس السبب في خروجنا من كاس العالم وتدني مستويات انديتنا بالاضافة الى المهازل التي تحدث في الدوري السعودي وبدل من ايقاف قناة متميزة في نقل الدوري نحاسب المقصرين في الاندية واللاعبين الذين لم يقوموا بواجبهم على اكمل,انا اعتقد ان محمد نجيب ليس السبب في خروجنا من كاس العالم وتدني مستويات انديتنا بالاضافه الي المهازل التي تحدث في الدوري السعودي وبدل من ايقاف قناه متميزه في نقل الدوري نحاسب المقصرين في الانديه واللاعبين الذين لم يقوموا بواجبهم علي اكمل,انا اعتقد ان [PERSON_1] [PERSON_2] ليس السبب في خروجنا من كاس العالم وتدني مستويات انديتنا بالاضافة الى المهازل التي تحدث في الدوري السعودي وبدل من ايقاف قناة متميزة في نقل الدوري نحاسب المقصرين في الاندية واللاعبين الذين لم يقوموا بواجبهم على اكمل,"[{""start"": 13, ""end"": 17, ""placeholder"": ""[PERSON_1]"", ""surface_form"": ""محمد"", ""mask_type"": ""PERSON""}, {""start"": 18, ""end"": 22, ""placeholder"": ""[PERSON_2]"", ""surface_form"": ""نجيب"", ""mask_type"": ""PERSON""}]",2,approved,,
mt_dial_egy_1d69df85,train,80148,DIAL_EGY,انتي لسه معرفتوش سلوكيات ابراهيم ده اقل واجب لازم تعرفوها ده المفروض يعينوها في قسم الخلافات قسم قله الاداب ده مفيش حد عجبوا حتي احمد حسن وعلاء صادق ومحمد ابراهيم ورامي سعيد يعم كافيه عليك كده,انتي لسه معرفتوش سلوكيات ابراهيم ده اقل واجب لازم تعرفوها ده المفروض يعينوها في قسم الخلافات قسم قله الاداب ده مفيش حد عجبوا حتي احمد حسن وعلاء صادق ومحمد ابراهيم ورامي سعيد يعم كافيه عليك كده,انتي لسه معرفتوش سلوكيات [PERSON_1] ده اقل واجب لازم تعرفوها ده المفروض يعينوها في قسم الخلافات قسم قله الاداب ده مفيش حد عجبوا حتي [PERSON_2] [PERSON_3] و[PERSON_4] [PERSON_5] و[PERSON_6] [PERSON_1] و[PERSON_7] [PERSON_8] يعم كافيه عليك كده,"[{""start"": 25, ""end"": 32, ""placeholder"": ""[PERSON_1]"", ""surface_form"": ""ابراهيم"", ""mask_type"": ""PERSON""}, {""start"": 129, ""end"": 133, ""placeholder"": ""[PERSON_2]"", ""surface_form"": ""احمد"", ""mask_type"": ""PERSON""}, {""start"": 134, ""end"": 137, ""placeholder"": ""[PERSON_3]"", ""surface_form"": ""حسن"", ""mask_type"": ""PERSON""}, {""start"": 139, ""end"": 143, ""placeholder"": ""[PERSON_4]"", ""surface_form"": ""علاء"", ""mask_type"": ""PERSON""}, {""start"": 144, ""end"": 148, ""placeholder"": ""[PERSON_5]"", ""surface_form"": ""صادق"", ""mask_type"": ""PERSON""}, {""start"": 150, ""end"": 154, ""placeholder"": ""[PERSON_6]"", ""surface_form"": ""محمد"", ""mask_type"": ""PERSON""}, {""start"": 155, ""end"": 162, ""placeholder"": ""[PERSON_1]"", ""surface_form"": ""ابراهيم"", ""mask_type"": ""PERSON""}, {""start"": 164, ""end"": 168, ""placeholder"": ""[PERSON_7]"", ""surface_form"": ""رامي"", ""mask_type"": ""PERSON""}, {""start"": 169, ""end"": 173, ""placeholder"": ""[PERSON_8]"", ""surface_form"": ""سعيد"", ""mask_type"": ""PERSON""}]",9,approved,,
mt_dial_glf_a3a88448,train,64572,DIAL_GLF,فيه نآس بتقول ليه كل هالصسرفياات ومدري آيش . . ومجهود بشري ضخم حيث فيه 45 ألف وآحد بيحسبون لدولة عدد مجموع سٌكآنهآ يتجآوز 20 مليون بين موآطن ومقيم ؟,فيه ناس بتقول ليه كل هالصسرفياات ومدري ايش ومجهود بشري ضخم حيث فيه 45 الف واحد بيحسبون لدوله عدد مجموع سكانها يتجاوز 20 مليون بين مواطن ومقيم,فيه نآس بتقول ليه كل هالصسرفياات ومدري آيش . . ومجهود بشري ضخم حيث فيه [NUM_1] ألف وآحد بيحسبون لدولة عدد مجموع سٌكآنهآ يتجآوز [NUM_2] مليون بين موآطن ومقيم ؟,"[{""start"": 71, ""end"": 73, ""placeholder"": ""[NUM_1]"", ""surface_form"": ""45"", ""mask_type"": ""NUM""}, {""start"": 122, ""end"": 124, ""placeholder"": ""[NUM_2]"", ""surface_form"": ""20"", ""mask_type"": ""NUM""}]",2,approved,,
mt_dial_lev_76c175c0,train,19123,DIAL_LEV,ارتفع الذهب ولعت اسعاره طار عقل البشر وبعض المتزوجزن حطوا ايديهم على قلبوبهم ماذا سنفعل اقترب الزفاف والعروس تريد ( 6 ) اساور مبرومه وطقم جنزير وحلق اخر موديل واسواره خميله وليست رفيعه والعريس بلطم سعر اذهب ارتفع وبعض الحموات وابنتها تصر على الذهب والبعض العاقل اتفقوا على تمشيه ليله العرس بالذهب الروسي رخيص الثمن واللي بشوفه بقول عنه ذهب اصلي ولما تنزل الاسعار بنتشتري ذهب والبعض الاخر يستلف من هاي اساور ومن هاي حلق ومن هاي طقم للرقبه تمشيه حال مع ارتفاع,ارتفع الذهب ولعت اسعاره طار عقل البشر وبعض المتزوجزن حطوا ايديهم علي قلبوبهم ماذا سنفعل اقترب الزفاف والعروس تريد 6 اساور مبرومه وطقم جنزير وحلق اخر موديل واسواره خميله وليست رفيعه والعريس بلطم سعر اذهب ارتفع وبعض الحموات وابنتها تصر علي الذهب والبعض العاقل اتفقوا علي تمشيه ليله العرس بالذهب الروسي رخيص الثمن واللي بشوفه بقول عنه ذهب اصلي ولما تنزل الاسعار بنتشتري ذهب والبعض الاخر يستلف من هاي اساور ومن هاي حلق ومن هاي طقم للرقبه تمشيه حال مع ارتفاع,ارتفع الذهب ولعت اسعاره طار عقل البشر وبعض المتزوجزن حطوا ايديهم على قلبوبهم ماذا سنفعل اقترب الزفاف والعروس تريد ( [NUM_1] ) اساور مبرومه وطقم جنزير وحلق اخر موديل واسواره خميله وليست رفيعه والعريس بلطم سعر اذهب ارتفع وبعض الحموات وابنتها تصر على الذهب والبعض العاقل اتفقوا على تمشيه ليله العرس بالذهب الروسي رخيص الثمن واللي بشوفه بقول عنه ذهب اصلي ولما تنزل الاسعار بنتشتري ذهب والبعض الاخر يستلف من هاي اساور ومن هاي حلق ومن هاي طقم للرقبه تمشيه حال مع ارتفاع,"[{""start"": 116, ""end"": 117, ""placeholder"": ""[NUM_1]"", ""surface_form"": ""6"", ""mask_type"": ""NUM""}]",1,approved,,
mt_msa_53976146,train,66342,MSA,ياحسرة على الاسرى الفلسطينين يذوقون الذل والهوان على ايدى مصاصى الدماء اهل الغدر والخيانة سرقوا الارض وقتلوا الشيخ والعجوز والشباب والاطفال حرقوا وجرفوا الاخضر واليابس يتموا الاطفال ورملوا النساء ولازالوا مستمرين فى اجرامهم خرقوا القوانين والاعراف عجز العالم عن ردعهم ونجح الاوربيون فى التخلص منهم بتمكينهم احتلال الارض وعاونوهم فى القتل ارسلوا اليهم الاسلحة وقدموا اليهم المعونات بكل سخاء اغمضوا اعينهم عن جرائمهم اعماهم الله فى الدنيا والاخرة ويالحال المسلمين وياحسرة على العرب تفرقوا وتعادوا وشمتوا فى بعضهم حكامهم متفرقين متكبرين غنيهم تجاهل فقيرهم . وفقيرهم حقد على غناهم اموال اغنيائهم فى قبضة رعاة اسرائيل هم من احتلوا ارضهم ونهبوا اموالهم وهنكوا عرضهم اوقعوا بينهم العداوة والبغضاء اشاعوا بينهم فرق تسد ولاعبرة لمن لايعتبر فى الآخرة حسابهم وعند الله,ياحسره علي الاسري الفلسطينين يذوقون الذل والهوان علي ايدي مصاصي الدماء اهل الغدر والخيانه سرقوا الارض وقتلوا الشيخ والعجوز والشباب والاطفال حرقوا وجرفوا الاخضر واليابس يتموا الاطفال ورملوا النساء ولازالوا مستمرين في اجرامهم خرقوا القوانين والاعراف عجز العالم عن ردعهم ونجح الاوربيون في التخلص منهم بتمكينهم احتلال الارض وعاونوهم في القتل ارسلوا اليهم الاسلحه وقدموا اليهم المعونات بكل سخاء اغمضوا اعينهم عن جرايمهم اعماهم الله في الدنيا والاخره ويالحال المسلمين وياحسره علي العرب تفرقوا وتعادوا وشمتوا في بعضهم حكامهم متفرقين متكبرين غنيهم تجاهل فقيرهم وفقيرهم حقد علي غناهم اموال اغنيايهم في قبضه رعاه اسراييل هم من احتلوا ارضهم ونهبوا اموالهم وهنكوا عرضهم اوقعوا بينهم العداوه والبغضاء اشاعوا بينهم فرق تسد ولاعبره لمن لايعتبر في الاخره حسابهم وعند الله,ياحسرة على الاسرى الفلسطينين يذوقون الذل والهوان على ايدى مصاصى الدماء اهل الغدر والخيانة سرقوا الارض وقتلوا الشيخ والعجوز والشباب والاطفال حرقوا وجرفوا الاخضر واليابس يتموا الاطفال ورملوا النساء ولازالوا مستمرين فى اجرامهم خرقوا القوانين والاعراف عجز العالم عن ردعهم ونجح الاوربيون فى التخلص منهم بتمكينهم احتلال الارض وعاونوهم فى القتل ارسلوا اليهم الاسلحة وقدموا اليهم المعونات بكل سخاء اغمضوا اعينهم عن جرائمهم اعماهم الله فى الدنيا والاخرة ويالحال المسلمين وياحسرة على العرب تفرقوا وتعادوا وشمتوا فى بعضهم حكامهم متفرقين متكبرين غنيهم تجاهل فقيرهم . وفقيرهم حقد على غناهم اموال اغنيائهم فى قبضة رعاة [LOC_1] هم من احتلوا ارضهم ونهبوا اموالهم وهنكوا عرضهم اوقعوا بينهم العداوة والبغضاء اشاعوا بينهم فرق تسد ولاعبرة لمن لايعتبر فى الآخرة حسابهم وعند الله,"[{""start"": 605, ""end"": 612, ""placeholder"": ""[LOC_1]"", ""surface_form"": ""اسرائيل"", ""mask_type"": ""LOC""}]",1,approved,,
mt_dial_egy_8923c325,train,78679,DIAL_EGY,كفايه بقا . . . كفايه كدب و سيبونا نعيش عيشه محترمه بلا خوف او قهر . . .,كفايه بقا كفايه كدب و سيبونا نعيش عيشه محترمه بلا خوف او قهر,كفايه بقا . . . كفايه كدب و سيبونا نعيش عيشه محترمه بلا خوف او قهر . . .,[],0,approved,,
mt_dial_glf_b64983fa,train,60831,DIAL_GLF,بارك الله فيك صراحه طريقه سهله وان شاء الله,بارك الله فيك صراحه طريقه سهله وان شاء الله,بارك الله فيك صراحه طريقه سهله وان شاء الله,[],0,approved,,
mt_dial_lev_60ee30b0,train,19291,DIAL_LEV,منيح لانو بوفر المصاري الي رح تنصرف على الدعاية بس مش منيح لانو لما منع الدعاية قطع رزق الخطاطين ومحلات الحلو ومحلات,منيح لانو بوفر المصاري الي رح تنصرف علي الدعايه بس مش منيح لانو لما منع الدعايه قطع رزق الخطاطين ومحلات الحلو ومحلات,منيح لانو بوفر المصاري الي رح تنصرف على الدعاية بس مش منيح لانو لما منع الدعاية قطع رزق الخطاطين ومحلات الحلو ومحلات,[],0,approved,,
mt_msa_93a08f24,train,74784,MSA,لماذا نسمح ببيع الدخان ايضا ؟,لماذا نسمح ببيع الدخان ايضا,لماذا نسمح ببيع الدخان ايضا ؟,[],0,approved,,
