example_id,source_split,source_row_id,dialect,original_text,normalized_text,masked_text,mask_spans_json,mask_count,annotation_status,annotator_model,notes
mt_dial_lev_2a077428,train,65222,DIAL_LEV,موضوع مسلي بالنسبه الي انا لسا ما تزوجت و بعدني بدرس وان شاء الله ما اواجه هالمشاكل . . . عجبني تعليق الاخ مصطفى هي و امها و ستها الله يكون معك منيح الي خلصت,موضوع مسلي بالنسبه الي انا لسا ما تزوجت و بعدني بدرس وان شاء الله ما اواجه هالمشاكل عجبني تعليق الاخ مصطفي هي و امها و ستها الله يكون معك منيح الي خلصت,موضوع مسلي بالنسبه الي انا لسا ما تزوجت و بعدني بدرس وان شاء الله ما اواجه هالمشاكل . . . عجبني تعليق الاخ [PERSON_1] هي و امها و ستها الله يكون معك منيح الي خلصت,"[{""start"": 107, ""end"": 112, ""placeholder"": ""[PERSON_1]"", ""surface_form"": ""مصطفى"", ""mask_type"": ""PERSON""}]",1,approved,,
mt_msa_45c9ef97,train,54064,MSA,باع الكليه او انه ما باع وبكم ؟ ؟ هذا شئ ليس من شأننا,باع الكليه او انه ما باع وبكم هذا شي ليس من شاننا,باع الكليه او انه ما باع وبكم ؟ ؟ هذا شئ ليس من شأننا,[],0,approved,,
mt_dial_egy_3459f0ed,train,75068,DIAL_EGY,حتى ( هنلبس ايه ! ! ) وللاسف اغلب الناس ما بتهتم بالطقس وبعدين نلاقى ادوار,حتي هنلبس ايه وللاسف اغلب الناس ما بتهتم بالطقس وبعدين نلاقي ادوار,حتى ( هنلبس ايه ! ! ) وللاسف اغلب الناس ما بتهتم بالطقس وبعدين نلاقى ادوار,[],0,approved,,
mt_dial_glf_73679a8c,train,37424,DIAL_GLF,ارتقو بفكركم يا جماعه ، والي يبي الفساد يلقاه مارح يستناكم,ارتقو بفكركم يا جماعه والي يبي الفساد يلقاه مارح يستناكم,ارتقو بفكركم يا جماعه ، والي يبي الفساد يلقاه مارح يستناكم,[],0,approved,,
mt_dial_lev_2e0604e7,train,55035,DIAL_LEV,يا اخي الشعب مضغوط خليه,يا اخي الشعب مضغوط خليه,يا اخي الشعب مضغوط خليه,[],0,approved,,
mt_msa_c8a697c8,train,53896,MSA,ا طلعتى على نية الشيخ,ا طلعتي علي نيه الشيخ,ا طلعتى على نية الشيخ,[],0,approved,,
mt_dial_egy_6336fa5e,train,74165,DIAL_EGY,ربنا يعين مصر على الحشيش,ربنا يعين مصر علي الحشيش,ربنا يعين [LOC_1] على الحشيش,"[{""start"": 10, ""end"": 13, ""placeholder"": ""[LOC_1]"", ""surface_form"": ""مصر"", ""mask_type"": ""LOC""}]",1,approved,,
mt_dial_glf_98278dff,train,63579,DIAL_GLF,ابو اديب . . الله يسعدك وين ما كنت ان شاء الله :,ابو اديب الله يسعدك وين ما كنت ان شاء الله,ابو [PERSON_1] . . الله يسعدك وين ما كنت ان شاء الله :,"[{""start"": 4, ""end"": 8, ""placeholder"": ""[PERSON_1]"", ""surface_form"": ""اديب"", ""mask_type"": ""PERSON""}]",1,approved,,
mt_msa_d643632a,train,34799,MSA,5 - انتهاج اسس علميه في التعيينات والترقيات - سلم وظيفي - مثل اصغر دائرة حكوميه,5 انتهاج اسس علميه في التعيينات والترقيات سلم وظيفي مثل اصغر دايره حكوميه,[NUM_1] - انتهاج اسس علميه في التعيينات والترقيات - سلم وظيفي - مثل اصغر دائرة حكوميه,"[{""start"": 0, ""end"": 1, ""placeholder"": ""[NUM_1]"", ""surface_form"": ""5"", ""mask_type"": ""NUM""}]",1,approved,,
mt_dial_egy_f440bb6c,train,28066,DIAL_EGY,ماذا نفعل نحن المغلوبون علي أمرنا خاصه وحضرتك تحدثت عن أحوالنا نحن كمصريين نلهث خلف لقمه العبش لنطعم أولادنا اظنك حضرنك مثلنا لم تولد وفي فمك ملعقه من ذهب كما اكدت في مقال,ماذا نفعل نحن المغلوبون علي امرنا خاصه وحضرتك تحدثت عن احوالنا نحن كمصريين نلهث خلف لقمه العبش لنطعم اولادنا اظنك حضرنك مثلنا لم تولد وفي فمك ملعقه من ذهب كما اكدت في مقال,ماذا نفعل نحن المغلوبون علي أمرنا خاصه وحضرتك تحدثت عن أحوالنا نحن كمصريين نلهث خلف لقمه العبش لنطعم أولادنا اظنك حضرنك مثلنا لم تولد وفي فمك ملعقه من ذهب كما اكدت في مقال,[],0,approved,,
mt_dial_glf_b79e124b,train,39288,DIAL_GLF,الا غصب يلقون لهم معمل يمشي على رايهم ويطلع براءته .,الا غصب يلقون لهم معمل يمشي علي رايهم ويطلع براءته,الا غصب يلقون لهم معمل يمشي على رايهم ويطلع براءته .,[],0,approved,,
mt_dial_lev_e28eb2cb,train,78402,DIAL_LEV,يعني ارفعوا زي ما بدكم فأنا مجاز ! !,يعني ارفعوا زي ما بدكم فانا مجاز,يعني ارفعوا زي ما بدكم فأنا مجاز ! !,[],0,approved,,
mt_msa_0aa59c25,train,70812,MSA,فعلاً المعلمة تأخذ الارشاد وتطالب بتخفيض حصصها إلى خمس حصص في الاسبوع على حساب المعلمات الاخريات اللآتي ينالهن 22 - 24 حصة بالاسبوع غير حصص النشاط والانتظار ويليتها فاهمه الارشاد على أصوله كل ماحولن المعلمات طالبة لديها مشكلة لا تجد لها حل على قولة مثل أخونا المصريين جيتك يا عبد المعين تعني,فعلا المعلمه تاخذ الارشاد وتطالب بتخفيض حصصها الي خمس حصص في الاسبوع علي حساب المعلمات الاخريات اللاتي ينالهن 22 24 حصه بالاسبوع غير حصص النشاط والانتظار ويليتها فاهمه الارشاد علي اصوله كل ماحولن المعلمات طالبه لديها مشكله لا تجد لها حل علي قوله مثل اخونا المصريين جيتك يا عبد المعين تعني,فعلاً المعلمة تأخذ الارشاد وتطالب بتخفيض حصصها إلى خمس حصص في الاسبوع على حساب المعلمات الاخريات اللآتي ينالهن [NUM_1] - [NUM_2] حصة بالاسبوع غير حصص النشاط والانتظار ويليتها فاهمه الارشاد على أصوله كل ماحولن المعلمات طالبة لديها مشكلة لا تجد لها حل على قولة مثل أخونا المصريين جيتك يا [PERSON_1] تعني,"[{""start"": 111, ""end"": 113, ""placeholder"": ""[NUM_1]"", ""surface_form"": ""22"", ""mask_type"": ""NUM""}, {""start"": 116, ""end"": 118, ""placeholder"": ""[NUM_2]"", ""surface_form"": ""24"", ""mask_type"": ""NUM""}, {""start"": 276, ""end"": 286, ""placeholder"": ""[PERSON_1]"", ""surface_form"": ""عبد المعين"", ""mask_type"": ""PERSON""}]",3,approved,,
mt_dial_egy_ff6210ce,train,71870,DIAL_EGY,عيب واللهي علي اللي بيعملوه الزمالك فرحتوه فينا الجزائريين الي راحوه المونديال بالبلطجة وعلي فكره الجزائري المعفن ده مينساش أن المصريين عدوهم أربعة أهداف ولا نسيت وأتكشفتوه قدام,عيب واللهي علي اللي بيعملوه الزمالك فرحتوه فينا الجزايريين الي راحوه المونديال بالبلطجه وعلي فكره الجزايري المعفن ده مينساش ان المصريين عدوهم اربعه اهداف ولا نسيت واتكشفتوه قدام,عيب واللهي علي اللي بيعملوه [ORG_1] فرحتوه فينا الجزائريين الي راحوه المونديال بالبلطجة وعلي فكره الجزائري المعفن ده مينساش أن المصريين عدوهم أربعة أهداف ولا نسيت وأتكشفتوه قدام,"[{""start"": 28, ""end"": 35, ""placeholder"": ""[ORG_1]"", ""surface_form"": ""الزمالك"", ""mask_type"": ""ORG""}]",1,approved,,
