example_id,source_split,source_row_id,dialect,original_text,normalized_text,masked_text,mask_spans_json,mask_count,annotation_status,annotator_model,notes
mt_dial_lev_8d16a6c0,train,49037,DIAL_LEV,اللي ما يطول العنب . . . حامض عنه يقول هو مثل شعبي متداول ويقال لمن لا يستطيع الحصول على العنب من الداليه فيكابر على المه او قل فشله او قل احباطه فيتحجج انه لا يريد العنب بحجة انه حامض,اللي ما يطول العنب حامض عنه يقول هو مثل شعبي متداول ويقال لمن لا يستطيع الحصول علي العنب من الداليه فيكابر علي المه او قل فشله او قل احباطه فيتحجج انه لا يريد العنب بحجه انه حامض,اللي ما يطول العنب . . . حامض عنه يقول هو مثل شعبي متداول ويقال لمن لا يستطيع الحصول على العنب من الداليه فيكابر على المه او قل فشله او قل احباطه فيتحجج انه لا يريد العنب بحجة انه حامض,[],0,approved,,
mt_msa_0657593f,train,65113,MSA,أنتي طموحة ! ولكن لاتنطبق عليك الشروط,انتي طموحه ولكن لاتنطبق عليك الشروط,أنتي طموحة ! ولكن لاتنطبق عليك الشروط,[],0,approved,,
mt_dial_egy_0c5b85e0,train,62351,DIAL_EGY,عشان نكمل نصب على الشعب الغلبان ونضحك عليهم ويلا زيتنا فى,عشان نكمل نصب علي الشعب الغلبان ونضحك عليهم ويلا زيتنا في,عشان نكمل نصب على الشعب الغلبان ونضحك عليهم ويلا زيتنا فى,[],0,approved,,
mt_dial_glf_86161584,train,57747,DIAL_GLF,لكن حنا نستاهل مثل الغنم مالنا,لكن حنا نستاهل مثل الغنم مالنا,لكن حنا نستاهل مثل الغنم مالنا,[],0,approved,,
mt_dial_lev_b3c99c20,train,26095,DIAL_LEV,ما الفائدة التي نجنيها من تشجيع منتخب او فريق اوروبي يعني برأيكم حد منهم سائل عنا . . . ما,ما الفايده التي نجنيها من تشجيع منتخب او فريق اوروبي يعني برايكم حد منهم سايل عنا ما,ما الفائدة التي نجنيها من تشجيع منتخب او فريق اوروبي يعني برأيكم حد منهم سائل عنا . . . ما,[],0,approved,,
mt_msa_1a882782,train,62364,MSA,الدنيا تطورت والتكنولوجيا هيمنت على حياتنا اليومية .,الدنيا تطورت والتكنولوجيا هيمنت علي حياتنا اليوميه,الدنيا تطورت والتكنولوجيا هيمنت على حياتنا اليومية .,[],0,approved,,
mt_dial_glf_b6858281,train,29947,DIAL_GLF,طالما . مدربنا . بيسيرو . واحتياط . الهلال . بالمنتخب . والخطط .,طالما مدربنا بيسيرو واحتياط الهلال بالمنتخب والخطط,طالما . مدربنا . [PERSON_1] . واحتياط . [ORG_1] . بالمنتخب . والخطط .,"[{""start"": 17, ""end"": 23, ""placeholder"": ""[PERSON_1]"", ""surface_form"": ""بيسيرو"", ""mask_type"": ""PERSON""}, {""start"": 36, ""end"": 42, ""placeholder"": ""[ORG_1]"", ""surface_form"": ""الهلال"", ""mask_type"": ""ORG""}]",2,approved,,
mt_dial_lev_e5429270,train,60561,DIAL_LEV,من شان الله كلو الا رافت يا,من شان الله كلو الا رافت يا,من شان الله كلو الا [PERSON_1] يا,"[{""start"": 20, ""end"": 24, ""placeholder"": ""[PERSON_1]"", ""surface_form"": ""رافت"", ""mask_type"": ""PERSON""}]",1,approved,,
mt_msa_c92c3169,train,45289,MSA,والحمد لله على نجاح العمليةوسلامة,والحمد لله علي نجاح العمليهوسلامه,والحمد لله على نجاح العمليةوسلامة,[],0,approved,,
mt_dial_egy_2c6b5e42,train,24684,DIAL_EGY,الناس اللي بتقول لاز نسمح بالزواج,الناس اللي بتقول لاز نسمح بالزواج,الناس اللي بتقول لاز نسمح بالزواج,[],0,approved,,
mt_dial_glf_3a503e65,train,78557,DIAL_GLF,70 % من السعوديون بدون مسكن وأنا منهم لو وزع علينا هامليار سكنا كلنا والمساكن الخيريه للي ماله راتب بس تلقى له أولاد لهم رواتب بس الضعيف الموظف الفقير ماله راتب لان راتبه للإجار يعني ماله راتب ولاعنده أحد ماله ياخذ بسمه يعني خربانه خربانه . . .,70 من السعوديون بدون مسكن وانا منهم لو وزع علينا هامليار سكنا كلنا والمساكن الخيريه للي ماله راتب بس تلقي له اولاد لهم رواتب بس الضعيف الموظف الفقير ماله راتب لان راتبه للاجار يعني ماله راتب ولاعنده احد ماله ياخذ بسمه يعني خربانه خربانه,[NUM_1] من السعوديون بدون مسكن وأنا منهم لو وزع علينا هامليار سكنا كلنا والمساكن الخيريه للي ماله راتب بس تلقى له أولاد لهم رواتب بس الضعيف الموظف الفقير ماله راتب لان راتبه للإجار يعني ماله راتب ولاعنده أحد ماله ياخذ بسمه يعني خربانه خربانه . . .,"[{""start"": 0, ""end"": 4, ""placeholder"": ""[NUM_1]"", ""surface_form"": ""70 %"", ""mask_type"": ""NUM""}]",1,approved,,
mt_dial_lev_a9c1ec0e,train,68508,DIAL_LEV,يا شباب احنا اعطينا الموضوع اكبر من,يا شباب احنا اعطينا الموضوع اكبر من,يا شباب احنا اعطينا الموضوع اكبر من,[],0,approved,,
mt_msa_b9df86e7,train,653,MSA,رابعا انها الفتن وفرق تسد فلابد من التعامل معها بحكمة وعدم,رابعا انها الفتن وفرق تسد فلابد من التعامل معها بحكمه وعدم,رابعا انها الفتن وفرق تسد فلابد من التعامل معها بحكمة وعدم,[],0,approved,,
mt_dial_egy_c158f816,train,81352,DIAL_EGY,طالما شعرت يا شيخ خالد بسؤ النوايا من الأول ماكنتش ضيعت وقتك فى الكلام دة أنا بحترم الأستاذ مرتضى جدا دة جهبز قانون لا يستهان بية على الإطلاق و واثق من نفسة جدا أما عن كابتن شوبير أنا ماقدرش أجزم أنة هو أو غيرة بيكذب و لا لأة بس الملاحظ إن بتوع الكرة أفتروا شوية و ربنا يدي كل واحد حسب,طالما شعرت يا شيخ خالد بسو النوايا من الاول ماكنتش ضيعت وقتك في الكلام ده انا بحترم الاستاذ مرتضي جدا ده جهبز قانون لا يستهان بيه علي الاطلاق و واثق من نفسه جدا اما عن كابتن شوبير انا ماقدرش اجزم انه هو او غيره بيكذب و لا لاه بس الملاحظ ان بتوع الكره افتروا شويه و ربنا يدي كل واحد حسب,طالما شعرت يا شيخ [PERSON_1] بسؤ النوايا من الأول ماكنتش ضيعت وقتك فى الكلام دة أنا بحترم الأستاذ [PERSON_2] جدا دة جهبز قانون لا يستهان بية على الإطلاق و واثق من نفسة جدا أما عن كابتن [PERSON_3] أنا ماقدرش أجزم أنة هو أو غيرة بيكذب و لا لأة بس الملاحظ إن بتوع الكرة أفتروا شوية و ربنا يدي كل واحد حسب,"[{""start"": 18, ""end"": 22, ""placeholder"": ""[PERSON_1]"", ""surface_form"": ""خالد"", ""mask_type"": ""PERSON""}, {""start"": 92, ""end"": 97, ""placeholder"": ""[PERSON_2]"", ""surface_form"": ""مرتضى"", ""mask_type"": ""PERSON""}, {""start"": 174, ""end"": 179, ""placeholder"": ""[PERSON_3]"", ""surface_form"": ""شوبير"", ""mask_type"": ""PERSON""}]",3,approved,,
mt_dial_glf_b277614b,train,56971,DIAL_GLF,حنا راضين عن دينا ما ناقص نسمع,حنا راضين عن دينا ما ناقص نسمع,حنا راضين عن دينا ما ناقص نسمع,[],0,approved,,
mt_msa_6dd6feea,train,84410,MSA,نقطه تجميع تكون مغلقه او حتى محطه عندما تكون مغلقه لاتكون مصدر,نقطه تجميع تكون مغلقه او حتي محطه عندما تكون مغلقه لاتكون مصدر,نقطه تجميع تكون مغلقه او حتى محطه عندما تكون مغلقه لاتكون مصدر,[],0,approved,,
mt_dial_egy_20d71389,train,3478,DIAL_EGY,"وف أهرامنا , وف اخبارنا . منافق",وف اهرامنا وف اخبارنا منافق,"وف [ORG_1] , وف [ORG_2] . منافق","[{""start"": 3, ""end"": 10, ""placeholder"": ""[ORG_1]"", ""surface_form"": ""أهرامنا"", ""mask_type"": ""ORG""}, {""start"": 16, ""end"": 23, ""placeholder"": ""[ORG_2]"", ""surface_form"": ""اخبارنا"", ""mask_type"": ""ORG""}]",2,approved,,
mt_dial_glf_5cb7e124,train,4694,DIAL_GLF,العيب فينا اجدادنا سابقا كان الجار عندهم له قيمة كبيره ولايرضي الشخص ان يضر جاره حتى لوكان على حساب نفسة لكن الان الشخص يفكر بنفسة,العيب فينا اجدادنا سابقا كان الجار عندهم له قيمه كبيره ولايرضي الشخص ان يضر جاره حتي لوكان علي حساب نفسه لكن الان الشخص يفكر بنفسه,العيب فينا اجدادنا سابقا كان الجار عندهم له قيمة كبيره ولايرضي الشخص ان يضر جاره حتى لوكان على حساب نفسة لكن الان الشخص يفكر بنفسة,[],0,approved,,
mt_dial_lev_ef351505,train,50608,DIAL_LEV,الا تستحق النظر من قبل الضمان الاجتماعي . 40 دينار اطفال الطبقات الراقيه لاتكفيهم شبس وشوكلاته في الاسبوع . .,الا تستحق النظر من قبل الضمان الاجتماعي 40 دينار اطفال الطبقات الراقيه لاتكفيهم شبس وشوكلاته في الاسبوع,الا تستحق النظر من قبل [ORG_1] . [NUM_1] دينار اطفال الطبقات الراقيه لاتكفيهم شبس وشوكلاته في الاسبوع . .,"[{""start"": 23, ""end"": 39, ""placeholder"": ""[ORG_1]"", ""surface_form"": ""الضمان الاجتماعي"", ""mask_type"": ""ORG""}, {""start"": 42, ""end"": 44, ""placeholder"": ""[NUM_1]"", ""surface_form"": ""40"", ""mask_type"": ""NUM""}]",2,approved,,
mt_msa_a104a523,train,28185,MSA,"لكن هل يقبل التجار عندنا , , , ؟",لكن هل يقبل التجار عندنا,"لكن هل يقبل التجار عندنا , , , ؟",[],0,approved,,
mt_dial_egy_c6733c1e,train,36917,DIAL_EGY,استاذى الكبير الصحفى القدير فى فلسطين فى ناس عايشين وناس,استاذي الكبير الصحفي القدير في فلسطين في ناس عايشين وناس,استاذى الكبير الصحفى القدير فى [LOC_1] فى ناس عايشين وناس,"[{""start"": 31, ""end"": 37, ""placeholder"": ""[LOC_1]"", ""surface_form"": ""فلسطين"", ""mask_type"": ""LOC""}]",1,approved,,
mt_dial_glf_b88bfdd4,train,34928,DIAL_GLF,فيه ناس فاهم نظام ساهر غلط اليوم صر معي موقف صاحب سيارة واقف عند الاشار حمراء ومقفل المسار الأيمن اول مفتحت الاشار خضراء لف يمين مايدر انه بهذه الطريق اخذ,فيه ناس فاهم نظام ساهر غلط اليوم صر معي موقف صاحب سياره واقف عند الاشار حمراء ومقفل المسار الايمن اول مفتحت الاشار خضراء لف يمين مايدر انه بهذه الطريق اخذ,فيه ناس فاهم نظام [ORG_1] غلط اليوم صر معي موقف صاحب سيارة واقف عند الاشار حمراء ومقفل المسار الأيمن اول مفتحت الاشار خضراء لف يمين مايدر انه بهذه الطريق اخذ,"[{""start"": 18, ""end"": 22, ""placeholder"": ""[ORG_1]"", ""surface_form"": ""ساهر"", ""mask_type"": ""ORG""}]",1,approved,,
mt_dial_lev_8c41ae0f,train,34158,DIAL_LEV,من اليوم او غدا تبدأ افواج الطلبه المعطلين بالعطله الصيفيه بافتراش الحارات والشوارع والازقه من الصباح الباكر وحتى منتصف الليل ويعدون لهم برنامج ( اخو اخته ) والله لو انهم يشاركون في دوره مؤتمرات لنجحت واحرزت المركز,من اليوم او غدا تبدا افواج الطلبه المعطلين بالعطله الصيفيه بافتراش الحارات والشوارع والازقه من الصباح الباكر وحتي منتصف الليل ويعدون لهم برنامج اخو اخته والله لو انهم يشاركون في دوره موتمرات لنجحت واحرزت المركز,من اليوم او غدا تبدأ افواج الطلبه المعطلين بالعطله الصيفيه بافتراش الحارات والشوارع والازقه من الصباح الباكر وحتى منتصف الليل ويعدون لهم برنامج ( اخو اخته ) والله لو انهم يشاركون في دوره مؤتمرات لنجحت واحرزت المركز,[],0,approved,,
mt_msa_08cd7123,train,22083,MSA,على المرأه الضعيفه ويحرمها من كسب رزقها ويتجاهل امور معروفه . الشيخ معه احاديث صحيحه عن رسول الله صلى الله عليه وسلم ومن يعارضه لايملك الا ما ورثه من عادات,علي المراه الضعيفه ويحرمها من كسب رزقها ويتجاهل امور معروفه الشيخ معه احاديث صحيحه عن رسول الله صلي الله عليه وسلم ومن يعارضه لايملك الا ما ورثه من عادات,على المرأه الضعيفه ويحرمها من كسب رزقها ويتجاهل امور معروفه . الشيخ معه احاديث صحيحه عن رسول الله صلى الله عليه وسلم ومن يعارضه لايملك الا ما ورثه من عادات,[],0,approved,,
mt_dial_egy_892d189c,train,8661,DIAL_EGY,انا شايفه ناس اهلاويه بيتكلموا عن التحكيم ونزاهه التحكيم بالذمه ليكم عين تتكلموا بعد ماسمير عثمان ثيتها واكدها عليكم دنتوا لو عندكم ريحه الدم ماتدخلوش على اى خبر ولا اى تعليق على التحكيم وبلاش تصدقوا الاعلام السافر الى عاوز يخبى الفضيحه بضربه جزاء الزمالك فى ماتش المحله دى حاجه عاديه ممكن اى حكم يغلط فيها اما ان حكم يلغى هدفين صحيحيى ويعيد ضربه جزاء لانها مادخلتش ويتعمد عدم طرد لاعب اخطء خطء يستحق الطرد ده غير ان هدف الاهلى اصلا ضربه مرمى وكل ده يحصل فى مباراه واحده يانهار اسود ولسه حد اهلاوى بيجيب سيره التحكيم بطلوا نفاق وبلاش تضحكوا على انفسكم انتم نادى مسنود مهما حاولتم اثبات عكس ذلك خلاص الى ماكانش متاكد اتاكد بعد فضيحه مباراه انبى وخلاص مابقاش حد يقدر يفتخر باهلاويته كان زمان وجبر تحياتى لكل من لا ينتمى الى نادى الاحمر وتحيه خاصه للناشر وتحيه للزمالكاويه احلى ناس فى,انا شايفه ناس اهلاويه بيتكلموا عن التحكيم ونزاهه التحكيم بالذمه ليكم عين تتكلموا بعد ماسمير عثمان ثيتها واكدها عليكم دنتوا لو عندكم ريحه الدم ماتدخلوش علي اي خبر ولا اي تعليق علي التحكيم وبلاش تصدقوا الاعلام السافر الي عاوز يخبي الفضيحه بضربه جزاء الزمالك في ماتش المحله دي حاجه عاديه ممكن اي حكم يغلط فيها اما ان حكم يلغي هدفين صحيحيي ويعيد ضربه جزاء لانها مادخلتش ويتعمد عدم طرد لاعب اخطء خطء يستحق الطرد ده غير ان هدف الاهلي اصلا ضربه مرمي وكل ده يحصل في مباراه واحده يانهار اسود ولسه حد اهلاوي بيجيب سيره التحكيم بطلوا نفاق وبلاش تضحكوا علي انفسكم انتم نادي مسنود مهما حاولتم اثبات عكس ذلك خلاص الي ماكانش متاكد اتاكد بعد فضيحه مباراه انبي وخلاص مابقاش حد يقدر يفتخر باهلاويته كان زمان وجبر تحياتي لكل من لا ينتمي الي نادي الاحمر وتحيه خاصه للناشر وتحيه للزمالكاويه احلي ناس في,انا شايفه ناس اهلاويه بيتكلموا عن التحكيم ونزاهه التحكيم بالذمه ليكم عين تتكلموا بعد ما[PERSON_1] ثيتها واكدها عليكم دنتوا لو عندكم ريحه الدم ماتدخلوش على اى خبر ولا اى تعليق على التحكيم وبلاش تصدقوا الاعلام السافر الى عاوز يخبى الفضيحه بضربه جزاء [ORG_1] فى ماتش [LOC_1] دى حاجه عاديه ممكن اى حكم يغلط فيها اما ان حكم يلغى هدفين صحيحيى ويعيد ضربه جزاء لانها مادخلتش ويتعمد عدم طرد لاعب اخطء خطء يستحق الطرد ده غير ان هدف [ORG_2] اصلا ضربه مرمى وكل ده يحصل فى مباراه واحده يانهار اسود ولسه حد اهلاوى بيجيب سيره التحكيم بطلوا نفاق وبلاش تضحكوا على انفسكم انتم نادى مسنود مهما حاولتم اثبات عكس ذلك خلاص الى ماكانش متاكد اتاكد بعد فضيحه مباراه [ORG_3] وخلاص مابقاش حد يقدر يفتخر باهلاويته كان زمان وجبر تحياتى لكل من لا ينتمى الى نادى الاحمر وتحيه خاصه للناشر وتحيه للزمالكاويه احلى ناس فى,"[{""start"": 87, ""end"": 97, ""placeholder"": ""[PERSON_1]"", ""surface_form"": ""سمير عثمان"", ""mask_type"": ""PERSON""}, {""start"": 248, ""end"": 255, ""placeholder"": ""[ORG_1]"", ""surface_form"": ""الزمالك"", ""mask_type"": ""ORG""}, {""start"": 264, ""end"": 270, ""placeholder"": ""[LOC_1]"", ""surface_form"": ""المحله"", ""mask_type"": ""LOC""}, {""start"": 421, ""end"": 427, ""placeholder"": ""[ORG_2]"", ""surface_form"": ""الاهلى"", ""mask_type"": ""ORG""}, {""start"": 639, ""end"": 643, ""placeholder"": ""[ORG_3]"", ""surface_form"": ""انبى"", ""mask_type"": ""ORG""}]",5,approved,,
mt_dial_glf_1d3beb63,train,9404,DIAL_GLF,وعاش ملك الانجازات الملك ابو,وعاش ملك الانجازات الملك ابو,وعاش ملك الانجازات الملك ابو,[],0,approved,,
mt_dial_lev_7f91e716,train,11906,DIAL_LEV,انا مستغرب من الهجوم على انتقال عبدالله ذيب يا جماعة هو حر وفي الاخر رح يعتزل ورح يمر بالشارع وماحدا رح يحكيلوا مرحبا حاله حال باقي النجوم السابقين . وبعدين لو اجا عبدالله ذيب ما اتوقع انوا رح يصير,انا مستغرب من الهجوم علي انتقال عبدالله ذيب يا جماعه هو حر وفي الاخر رح يعتزل ورح يمر بالشارع وماحدا رح يحكيلوا مرحبا حاله حال باقي النجوم السابقين وبعدين لو اجا عبدالله ذيب ما اتوقع انوا رح يصير,انا مستغرب من الهجوم على انتقال [PERSON_1] يا جماعة هو حر وفي الاخر رح يعتزل ورح يمر بالشارع وماحدا رح يحكيلوا مرحبا حاله حال باقي النجوم السابقين . وبعدين لو اجا [PERSON_1] ما اتوقع انوا رح يصير,"[{""start"": 32, ""end"": 43, ""placeholder"": ""[PERSON_1]"", ""surface_form"": ""عبدالله ذيب"", ""mask_type"": ""PERSON""}, {""start"": 164, ""end"": 175, ""placeholder"": ""[PERSON_1]"", ""surface_form"": ""عبدالله ذيب"", ""mask_type"": ""PERSON""}]",2,approved,,
mt_msa_93dfad6b,train,40044,MSA,رجاء الى ادراة الموقع ان ترفق جدول ترتيب المجموعات الثلاثة . .,رجاء الي ادراه الموقع ان ترفق جدول ترتيب المجموعات الثلاثه,رجاء الى ادراة الموقع ان ترفق جدول ترتيب المجموعات الثلاثة . .,[],0,approved,,
