example_id,source_split,source_row_id,dialect,original_text,normalized_text,masked_text,mask_spans_json,mask_count,annotation_status,annotator_model,notes
mt_dial_egy_2232f823,train,33195,DIAL_EGY,صاحب المقال أشار لعدد من التناقضات في كلام البرادعي وهو يتفق تماما مع عديد من الانتقادات الموجهه للبرادعي خاصه ماقاله د . يسري أبوشادي عن تعامل البرادعي مع المشاكل الدوليه بوشين حسب المكان الموجود فيه . البرادعي كله تناقضات في المسأله الدينيه فهو كان ضد الاخوان وفجاه يعلن تاييده لتكوين حزب للاخوان ثم يناقض نفسه ثانيه بطلب تغيير الماده الثانيه من الدستور بالغاء ان الدين الاسلامي هو المصدر الرئيسي للتشريع ويذهب للصلاه في الجوامع مع انه عمره ماعملها بل والمعروف عنه انه لا يمارس أي شعائر دينيه اسلاميه . ياريت من يطالبوا بالتغيير وهو طلب الكثير ان يتنبهوا لمن يعبر عنهم وهو بالقطع لا يمكن ان يكون,صاحب المقال اشار لعدد من التناقضات في كلام البرادعي وهو يتفق تماما مع عديد من الانتقادات الموجهه للبرادعي خاصه ماقاله د يسري ابوشادي عن تعامل البرادعي مع المشاكل الدوليه بوشين حسب المكان الموجود فيه البرادعي كله تناقضات في المساله الدينيه فهو كان ضد الاخوان وفجاه يعلن تاييده لتكوين حزب للاخوان ثم يناقض نفسه ثانيه بطلب تغيير الماده الثانيه من الدستور بالغاء ان الدين الاسلامي هو المصدر الرييسي للتشريع ويذهب للصلاه في الجوامع مع انه عمره ماعملها بل والمعروف عنه انه لا يمارس اي شعاير دينيه اسلاميه ياريت من يطالبوا بالتغيير وهو طلب الكثير ان يتنبهوا لمن يعبر عنهم وهو بالقطع لا يمكن ان يكون,صاحب المقال أشار لعدد من التناقضات في كلام [PERSON_1] وهو يتفق تماما مع عديد من الانتقادات الموجهه للبرادعي خاصه ماقاله د . [PERSON_2] عن تعامل [PERSON_1] مع المشاكل الدوليه بوشين حسب المكان الموجود فيه . [PERSON_1] كله تناقضات في المسأله الدينيه فهو كان ضد الاخوان وفجاه يعلن تاييده لتكوين حزب للاخوان ثم يناقض نفسه ثانيه بطلب تغيير الماده الثانيه من الدستور بالغاء ان الدين الاسلامي هو المصدر الرئيسي للتشريع ويذهب للصلاه في الجوامع مع انه عمره ماعملها بل والمعروف عنه انه لا يمارس أي شعائر دينيه اسلاميه . ياريت من يطالبوا بالتغيير وهو طلب الكثير ان يتنبهوا لمن يعبر عنهم وهو بالقطع لا يمكن ان يكون,"[{""start"": 43, ""end"": 51, ""placeholder"": ""[PERSON_1]"", ""surface_form"": ""البرادعي"", ""mask_type"": ""PERSON""}, {""start"": 122, ""end"": 134, ""placeholder"": ""[PERSON_2]"", ""surface_form"": ""يسري أبوشادي"", ""mask_type"": ""PERSON""}, {""start"": 144, ""end"": 152, ""placeholder"": ""[PERSON_1]"", ""surface_form"": ""البرادعي"", ""mask_type"": ""PERSON""}, {""start"": 203, ""end"": 211, ""placeholder"": ""[PERSON_1]"", ""surface_form"": ""البرادعي"", ""mask_type"": ""PERSON""}]",4,approved,,
mt_dial_glf_c3ee3e62,train,84456,DIAL_GLF,زعيم زعيم زعيم ولا عزاء للحاقدين,زعيم زعيم زعيم ولا عزاء للحاقدين,زعيم زعيم زعيم ولا عزاء للحاقدين,[],0,approved,,
mt_msa_4e2a5fa8,train,65583,MSA,* فى حالة ظهور بوادر تعثر للعميل فإنه يتم تهميش الفوائد و العمولات على ارصدة التسهيلات ، هذة الفوائد و العمولات المهمشه لا تدخل ضمن أرباح البنك الفعلية ، و لكن يطالب العميل بسدادها ، و هى من ضمن إجراءات الإفصاح و العلانية التى أقرتها معايير المحاسبه و المراجعة ، لأنه من غير المعقول أن يجنى البنك من العميل فوائد و عمولات وهمية تمثل أرباح لن تحصل من العميل مستقبلاً ، و أن من الأصول المحاسبية إظهار المركز المالية للمنشاءات على حقيقتها . و بالفعل فإن بنك القاهرة من البنوك المتعثرة مالياً و قد جرت محاولات لدمجه ببنك مصر لم تنجح و هو فى سبيله لتوفيق أوضاعه,في حاله ظهور بوادر تعثر للعميل فانه يتم تهميش الفوايد و العمولات علي ارصده التسهيلات هذه الفوايد و العمولات المهمشه لا تدخل ضمن ارباح البنك الفعليه و لكن يطالب العميل بسدادها و هي من ضمن اجراءات الافصاح و العلانيه التي اقرتها معايير المحاسبه و المراجعه لانه من غير المعقول ان يجني البنك من العميل فوايد و عمولات وهميه تمثل ارباح لن تحصل من العميل مستقبلا و ان من الاصول المحاسبيه اظهار المركز الماليه للمنشاءات علي حقيقتها و بالفعل فان بنك القاهره من البنوك المتعثره ماليا و قد جرت محاولات لدمجه ببنك مصر لم تنجح و هو في سبيله لتوفيق اوضاعه,* فى حالة ظهور بوادر تعثر للعميل فإنه يتم تهميش الفوائد و العمولات على ارصدة التسهيلات ، هذة الفوائد و العمولات المهمشه لا تدخل ضمن أرباح البنك الفعلية ، و لكن يطالب العميل بسدادها ، و هى من ضمن إجراءات الإفصاح و العلانية التى أقرتها معايير المحاسبه و المراجعة ، لأنه من غير المعقول أن يجنى البنك من العميل فوائد و عمولات وهمية تمثل أرباح لن تحصل من العميل مستقبلاً ، و أن من الأصول المحاسبية إظهار المركز المالية للمنشاءات على حقيقتها . و بالفعل فإن [ORG_1] من البنوك المتعثرة مالياً و قد جرت محاولات لدمجه ب[ORG_2] لم تنجح و هو فى سبيله لتوفيق أوضاعه,"[{""start"": 451, ""end"": 462, ""placeholder"": ""[ORG_1]"", ""surface_form"": ""بنك القاهرة"", ""mask_type"": ""ORG""}, {""start"": 513, ""end"": 520, ""placeholder"": ""[ORG_2]"", ""surface_form"": ""بنك مصر"", ""mask_type"": ""ORG""}]",2,approved,,
mt_dial_egy_b14fdf84,train,58736,DIAL_EGY,و كل ده مقموعين و مكبوتين و مفيش حرية,و كل ده مقموعين و مكبوتين و مفيش حريه,و كل ده مقموعين و مكبوتين و مفيش حرية,[],0,approved,,
mt_dial_glf_0dea4e00,train,77711,DIAL_GLF,"هل العملية مجرد طاولة وبروشورات موجودة في الجنادرية او في معرض جايتكس , والمشاركات الخارجين نايمين عنها , والله عالم نايمة عندنا ولو تكلمنا قالوا انت ماتفهم وماعند",هل العمليه مجرد طاوله وبروشورات موجوده في الجنادريه او في معرض جايتكس والمشاركات الخارجين نايمين عنها والله عالم نايمه عندنا ولو تكلمنا قالوا انت ماتفهم وماعند,"هل العملية مجرد طاولة وبروشورات موجودة في [LOC_1] او في معرض [ORG_1] , والمشاركات الخارجين نايمين عنها , والله عالم نايمة عندنا ولو تكلمنا قالوا انت ماتفهم وماعند","[{""start"": 42, ""end"": 51, ""placeholder"": ""[LOC_1]"", ""surface_form"": ""الجنادرية"", ""mask_type"": ""LOC""}, {""start"": 63, ""end"": 69, ""placeholder"": ""[ORG_1]"", ""surface_form"": ""جايتكس"", ""mask_type"": ""ORG""}]",2,approved,,
mt_dial_lev_e2a2bdac,train,1401,DIAL_LEV,انا ما شملني الإستطلاع وبحكيها بالفم,انا ما شملني الاستطلاع وبحكيها بالفم,انا ما شملني الإستطلاع وبحكيها بالفم,[],0,approved,,
mt_msa_78c9d373,train,4684,MSA,وبغض النظر عن تضارب أقوال أطراف القضية والقضايا السابقة فإنه يبدو أنه هناك خلل بالتعامل مع القانون ! !,وبغض النظر عن تضارب اقوال اطراف القضيه والقضايا السابقه فانه يبدو انه هناك خلل بالتعامل مع القانون,وبغض النظر عن تضارب أقوال أطراف القضية والقضايا السابقة فإنه يبدو أنه هناك خلل بالتعامل مع القانون ! !,[],0,approved,,
mt_dial_egy_2adfc1b8,train,45236,DIAL_EGY,مش مهم دلوقتى مين الاحق بالوصول لكأس العالم لكن التهجم على شخص علاء صادق جريمة بكل المقاييس لانة صاحب رؤية وفكر وقبل كل هذا وذاك مؤهل للنقد ولم يكن فى يوم يكتب لحساب ناد أو,مش مهم دلوقتي مين الاحق بالوصول لكاس العالم لكن التهجم علي شخص علاء صادق جريمه بكل المقاييس لانه صاحب رويه وفكر وقبل كل هذا وذاك موهل للنقد ولم يكن في يوم يكتب لحساب ناد او,مش مهم دلوقتى مين الاحق بالوصول لكأس العالم لكن التهجم على شخص [PERSON_1] جريمة بكل المقاييس لانة صاحب رؤية وفكر وقبل كل هذا وذاك مؤهل للنقد ولم يكن فى يوم يكتب لحساب ناد أو,"[{""start"": 63, ""end"": 72, ""placeholder"": ""[PERSON_1]"", ""surface_form"": ""علاء صادق"", ""mask_type"": ""PERSON""}]",1,approved,,
mt_dial_glf_d4ba4fa9,train,82457,DIAL_GLF,"كلً بيلقى نصيبة , هذا نصيب من الله , و الله سبحانه يوفق اللي ناوي يتزوج بغرض العفاف و بناء بيت عامر بذكر الله و تربية الأبناء على طاعة الله , الكثير للأسف يجعل الزواج مثل التحدي أو شف أنا كم دفعت في الحفلة , أو تقول المرأة أنا أبي حفلة كبيرة و و و و ليش فلانة أحسن مني في أيش",كل بيلقي نصيبه هذا نصيب من الله و الله سبحانه يوفق اللي ناوي يتزوج بغرض العفاف و بناء بيت عامر بذكر الله و تربيه الابناء علي طاعه الله الكثير للاسف يجعل الزواج مثل التحدي او شف انا كم دفعت في الحفله او تقول المراه انا ابي حفله كبيره و و و و ليش فلانه احسن مني في ايش,"كلً بيلقى نصيبة , هذا نصيب من الله , و الله سبحانه يوفق اللي ناوي يتزوج بغرض العفاف و بناء بيت عامر بذكر الله و تربية الأبناء على طاعة الله , الكثير للأسف يجعل الزواج مثل التحدي أو شف أنا كم دفعت في الحفلة , أو تقول المرأة أنا أبي حفلة كبيرة و و و و ليش فلانة أحسن مني في أيش",[],0,approved,,
mt_dial_lev_1a0792ab,train,39980,DIAL_LEV,والله لو ايصير النفط ابلاش لندفع ثمنه,والله لو ايصير النفط ابلاش لندفع ثمنه,والله لو ايصير النفط ابلاش لندفع ثمنه,[],0,approved,,
mt_msa_2b8671bc,train,52647,MSA,"جزاك الله خيرا . . . "" وشددت الاميرة الدكتورة الجوهرة على تمسكها بحجابها قائلة إنها تحضر المؤتمرات الداخلية والخارجية وتشارك باوراق العمل وتنظم الاجتماعات داخل الجامعة وهي متمسكة بحجابها وغطاء وجهها مؤكدة ان هذا الامر لم يضعف من ادائها او يهز ثقتها وثقة العالم بها """,جزاك الله خيرا وشددت الاميره الدكتوره الجوهره علي تمسكها بحجابها قايله انها تحضر الموتمرات الداخليه والخارجيه وتشارك باوراق العمل وتنظم الاجتماعات داخل الجامعه وهي متمسكه بحجابها وغطاء وجهها موكده ان هذا الامر لم يضعف من ادايها او يهز ثقتها وثقه العالم بها,"جزاك الله خيرا . . . "" وشددت الاميرة الدكتورة [PERSON_1] على تمسكها بحجابها قائلة إنها تحضر المؤتمرات الداخلية والخارجية وتشارك باوراق العمل وتنظم الاجتماعات داخل الجامعة وهي متمسكة بحجابها وغطاء وجهها مؤكدة ان هذا الامر لم يضعف من ادائها او يهز ثقتها وثقة العالم بها ""","[{""start"": 46, ""end"": 53, ""placeholder"": ""[PERSON_1]"", ""surface_form"": ""الجوهرة"", ""mask_type"": ""PERSON""}]",1,approved,,
