example_id,source_split,source_row_id,dialect,original_text,normalized_text,masked_text,mask_spans_json,mask_count,annotation_status,annotator_model,notes
mt_dial_egy_2ac90bb8,train,46159,DIAL_EGY,انا شايف ان مجرد قراءة الموضوع دة عن البنت مجرد تضييع للوقت دى بنت خسرت كل حاجة بشوية كلام فاضى اتقالتلها هاتندم علية عاجلا ام اجلا واللى بتبدأ حياتها بتزوير وارتداد وتنازلات مستنية اية حلو فى دنيتها بعد كدة ؟ ؟,انا شايف ان مجرد قراءه الموضوع ده عن البنت مجرد تضييع للوقت دي بنت خسرت كل حاجه بشويه كلام فاضي اتقالتلها هاتندم عليه عاجلا ام اجلا واللي بتبدا حياتها بتزوير وارتداد وتنازلات مستنيه ايه حلو في دنيتها بعد كده,انا شايف ان مجرد قراءة الموضوع دة عن البنت مجرد تضييع للوقت دى بنت خسرت كل حاجة بشوية كلام فاضى اتقالتلها هاتندم علية عاجلا ام اجلا واللى بتبدأ حياتها بتزوير وارتداد وتنازلات مستنية اية حلو فى دنيتها بعد كدة ؟ ؟,[],0,approved,,
mt_dial_glf_54f148e1,train,29585,DIAL_GLF,حتى انا اقدر اسويها سهله,حتي انا اقدر اسويها سهله,حتى انا اقدر اسويها سهله,[],0,approved,,
mt_dial_lev_b6575539,train,24933,DIAL_LEV,والله شكلنا راح نصير نزحف زحف لأنو ماراح نلاقي حتى بسكليت,والله شكلنا راح نصير نزحف زحف لانو ماراح نلاقي حتي بسكليت,والله شكلنا راح نصير نزحف زحف لأنو ماراح نلاقي حتى بسكليت,[],0,approved,,
mt_dial_egy_ecba8365,train,72243,DIAL_EGY,عايزين منك 10 يا شيخ والبلد,عايزين منك 10 يا شيخ والبلد,عايزين منك 10 يا شيخ والبلد,[],0,approved,,
mt_dial_glf_a4787853,train,18635,DIAL_GLF,"ويا الرائد , , الله يكون بعونكم يارب , , :",ويا الرايد الله يكون بعونكم يارب,"ويا [ORG_1] , , الله يكون بعونكم يارب , , :","[{""start"": 4, ""end"": 10, ""placeholder"": ""[ORG_1]"", ""surface_form"": ""الرائد"", ""mask_type"": ""ORG""}]",1,approved,,
mt_dial_lev_896341de,train,13427,DIAL_LEV,بس بحب أذكرك انه كأس العالم الماضية لما كانت مع الاي أر تي كانت اسعار البطاقات أضعاف ما تأخذه الجزيرة الآن,بس بحب اذكرك انه كاس العالم الماضيه لما كانت مع الاي ار تي كانت اسعار البطاقات اضعاف ما تاخذه الجزيره الان,بس بحب أذكرك انه كأس العالم الماضية لما كانت مع [ORG_1] كانت اسعار البطاقات أضعاف ما تأخذه [ORG_2] الآن,"[{""start"": 48, ""end"": 58, ""placeholder"": ""[ORG_1]"", ""surface_form"": ""الاي أر تي"", ""mask_type"": ""ORG""}, {""start"": 94, ""end"": 101, ""placeholder"": ""[ORG_2]"", ""surface_form"": ""الجزيرة"", ""mask_type"": ""ORG""}]",2,approved,,
mt_msa_6e212771,train,79055,MSA,جزاك الله خير الجزاء وجعل ذلك في موازين,جزاك الله خير الجزاء وجعل ذلك في موازين,جزاك الله خير الجزاء وجعل ذلك في موازين,[],0,approved,,
mt_dial_egy_55a9197a,train,63043,DIAL_EGY,"بجد الراجل ده مش طبيعى , نفسى اعرف اسمه ايه على الكوكب ايلى جاى منه ؟ ؟",بجد الراجل ده مش طبيعي نفسي اعرف اسمه ايه علي الكوكب ايلي جاي منه,"بجد الراجل ده مش طبيعى , نفسى اعرف اسمه ايه على الكوكب ايلى جاى منه ؟ ؟",[],0,approved,,
mt_dial_glf_a264ac2a,train,42023,DIAL_GLF,وماهمني اي تفكير مريض حاقد على,وماهمني اي تفكير مريض حاقد علي,وماهمني اي تفكير مريض حاقد على,[],0,approved,,
mt_dial_lev_99fa62d9,train,82316,DIAL_LEV,شو المشكله يعني شاي بدل العصير يا اخي جل من لا يسهو نست الحرمه الله يعين شغل البيت,شو المشكله يعني شاي بدل العصير يا اخي جل من لا يسهو نست الحرمه الله يعين شغل البيت,شو المشكله يعني شاي بدل العصير يا اخي جل من لا يسهو نست الحرمه الله يعين شغل البيت,[],0,approved,,
mt_msa_fcc155f0,train,27380,MSA,ثم اني ومن خلال متابعتي اري السيد الابشيهي ليه علم بفنون الصحافة ويكتب بالاسلوب الصحفي الجيد ويلتزم مع الجميع ادب الحوار فهو يقول ويعبر عن رايه دون الاساءة الى احد طالما لم يتهجم على الاديان والمقدسات,ثم اني ومن خلال متابعتي اري السيد الابشيهي ليه علم بفنون الصحافه ويكتب بالاسلوب الصحفي الجيد ويلتزم مع الجميع ادب الحوار فهو يقول ويعبر عن رايه دون الاساءه الي احد طالما لم يتهجم علي الاديان والمقدسات,ثم اني ومن خلال متابعتي اري السيد [PERSON_1] ليه علم بفنون الصحافة ويكتب بالاسلوب الصحفي الجيد ويلتزم مع الجميع ادب الحوار فهو يقول ويعبر عن رايه دون الاساءة الى احد طالما لم يتهجم على الاديان والمقدسات,"[{""start"": 34, ""end"": 42, ""placeholder"": ""[PERSON_1]"", ""surface_form"": ""الابشيهي"", ""mask_type"": ""PERSON""}]",1,approved,,
mt_dial_glf_33199fa4,train,22796,DIAL_GLF,خل عنكم خضيري وقبيلي وطبقوا سنة نبيكم في اختيار الزوج,خل عنكم خضيري وقبيلي وطبقوا سنه نبيكم في اختيار الزوج,خل عنكم خضيري وقبيلي وطبقوا سنة نبيكم في اختيار الزوج,[],0,approved,,
mt_dial_lev_7a661972,train,16957,DIAL_LEV,بدل كل هاد الحكي لازم نحط ادينا بإدين بعض و نساعد هاي العيلة . . . والله المسلمين اخوان يا,بدل كل هاد الحكي لازم نحط ادينا بادين بعض و نساعد هاي العيله والله المسلمين اخوان يا,بدل كل هاد الحكي لازم نحط ادينا بإدين بعض و نساعد هاي العيلة . . . والله المسلمين اخوان يا,[],0,approved,,
mt_msa_4386f383,train,9405,MSA,لأول مرة أجد نفسي متعاطفة مع الرجال بالنسبة لنقطة ذكورية المجتمع ، حيث أني لا أعتقد أن الموضوع له علاقة بذكورية المجتمع وأتفق مع من قال أن النساء في كافة بلاد العالم لا يقمن بإصلاح أعطال سياراتهن في الطريق بمفردهن ، وربما هي طبيعتنا الأنثوية التي تمنعنا من ذلك ، فأنا لا أستطيع تخيل نفسي منحنية في الشارع أغير بنشر أو أوسخ يداي بالزيوت . هذه الأعمال الخشنة من مهام الرجال ، ونحن أنعم وأكثر رقة من ذلك ، وأنا أشعر بالامتنان حقيقة لكل رجل ساعدني أو يمكن أن يساعدني إذا ما واجهت أي مشاكل مع سيارتي,لاول مره اجد نفسي متعاطفه مع الرجال بالنسبه لنقطه ذكوريه المجتمع حيث اني لا اعتقد ان الموضوع له علاقه بذكوريه المجتمع واتفق مع من قال ان النساء في كافه بلاد العالم لا يقمن باصلاح اعطال سياراتهن في الطريق بمفردهن وربما هي طبيعتنا الانثويه التي تمنعنا من ذلك فانا لا استطيع تخيل نفسي منحنيه في الشارع اغير بنشر او اوسخ يداي بالزيوت هذه الاعمال الخشنه من مهام الرجال ونحن انعم واكثر رقه من ذلك وانا اشعر بالامتنان حقيقه لكل رجل ساعدني او يمكن ان يساعدني اذا ما واجهت اي مشاكل مع سيارتي,لأول مرة أجد نفسي متعاطفة مع الرجال بالنسبة لنقطة ذكورية المجتمع ، حيث أني لا أعتقد أن الموضوع له علاقة بذكورية المجتمع وأتفق مع من قال أن النساء في كافة بلاد العالم لا يقمن بإصلاح أعطال سياراتهن في الطريق بمفردهن ، وربما هي طبيعتنا الأنثوية التي تمنعنا من ذلك ، فأنا لا أستطيع تخيل نفسي منحنية في الشارع أغير بنشر أو أوسخ يداي بالزيوت . هذه الأعمال الخشنة من مهام الرجال ، ونحن أنعم وأكثر رقة من ذلك ، وأنا أشعر بالامتنان حقيقة لكل رجل ساعدني أو يمكن أن يساعدني إذا ما واجهت أي مشاكل مع سيارتي,[],0,approved,,
mt_dial_egy_df4aacc2,train,60647,DIAL_EGY,رضا لعيب جامد وان شاء الله سكتك لمنتخب بلدك ول,رضا لعيب جامد وان شاء الله سكتك لمنتخب بلدك ول,[PERSON_1] لعيب جامد وان شاء الله سكتك لمنتخب بلدك ول,"[{""start"": 0, ""end"": 3, ""placeholder"": ""[PERSON_1]"", ""surface_form"": ""رضا"", ""mask_type"": ""PERSON""}]",1,approved,,
mt_dial_glf_20fe73e2,train,5046,DIAL_GLF,اغنية حلوة . . . بس من عزيزة,اغنيه حلوه بس من عزيزه,اغنية حلوة . . . بس من [PERSON_1],"[{""start"": 23, ""end"": 28, ""placeholder"": ""[PERSON_1]"", ""surface_form"": ""عزيزة"", ""mask_type"": ""PERSON""}]",1,approved,,
mt_msa_c5ffb4b2,train,45526,MSA,انا بصراحة تعجبني الرسائل الغبية . .,انا بصراحه تعجبني الرسايل الغبيه,انا بصراحة تعجبني الرسائل الغبية . .,[],0,approved,,
mt_dial_egy_93f079b5,train,8998,DIAL_EGY,والنبي مش ناس عبيطة بالذمة . .,والنبي مش ناس عبيطه بالذمه,والنبي مش ناس عبيطة بالذمة . .,[],0,approved,,
mt_dial_glf_e47ba201,train,78454,DIAL_GLF,ليش ما سفر من المملكة بعد ما فصل من عملة خصوصا,ليش ما سفر من المملكه بعد ما فصل من عمله خصوصا,ليش ما سفر من [LOC_1] بعد ما فصل من عملة خصوصا,"[{""start"": 14, ""end"": 21, ""placeholder"": ""[LOC_1]"", ""surface_form"": ""المملكة"", ""mask_type"": ""LOC""}]",1,approved,,
mt_dial_lev_4747c6b1,train,20379,DIAL_LEV,يا اخوان اللي بصير مع الوحدات شي عادي وبصير مع احسن الافرقة يعني ما حد يزعل ولا عبالو لانو من الصعب اي حد يوصل القمة ويحافظ عليها والوحدات هاي السنة بنعتبرها الو استراحة المحارب مع العلم انو انا وحداتي وكثير متعصب للوحدات بس برضو هاد الفريق اللي حبينا من الصغر وتابعنا وتعايشنا معو لحظة بلحظة لازم نكون معو بالسراء والضراء لانو مستحيل اي فريق بالعالم يفوز او يضل محافظ على مستوا والفريق الكبير يمرض ولا يموت والوحدات فريق كبير وخليها تكون فنرة مرض للوحدات وان شاءالله انها راح تعدي ومنها للاحسن ونعتبر منها ونتعلم الاخطاء اللي مرات فينا ومش عيب انو نخسر ولا عيب انو نتعلم من اخطاءنا واي بني ادم بمضي حياتو وهو بتعلم وان شاء الله يالاخضر منها للاحسن واحنا جماهيرك الوفية وراح نضل وفية الك وبنحبك وما قيمة حياتي ان لم اكن,يا اخوان اللي بصير مع الوحدات شي عادي وبصير مع احسن الافرقه يعني ما حد يزعل ولا عبالو لانو من الصعب اي حد يوصل القمه ويحافظ عليها والوحدات هاي السنه بنعتبرها الو استراحه المحارب مع العلم انو انا وحداتي وكثير متعصب للوحدات بس برضو هاد الفريق اللي حبينا من الصغر وتابعنا وتعايشنا معو لحظه بلحظه لازم نكون معو بالسراء والضراء لانو مستحيل اي فريق بالعالم يفوز او يضل محافظ علي مستوا والفريق الكبير يمرض ولا يموت والوحدات فريق كبير وخليها تكون فنره مرض للوحدات وان شاءالله انها راح تعدي ومنها للاحسن ونعتبر منها ونتعلم الاخطاء اللي مرات فينا ومش عيب انو نخسر ولا عيب انو نتعلم من اخطاءنا واي بني ادم بمضي حياتو وهو بتعلم وان شاء الله يالاخضر منها للاحسن واحنا جماهيرك الوفيه وراح نضل وفيه الك وبنحبك وما قيمه حياتي ان لم اكن,يا اخوان اللي بصير مع [ORG_1] شي عادي وبصير مع احسن الافرقة يعني ما حد يزعل ولا عبالو لانو من الصعب اي حد يوصل القمة ويحافظ عليها و[ORG_1] هاي السنة بنعتبرها الو استراحة المحارب مع العلم انو انا وحداتي وكثير متعصب للوحدات بس برضو هاد الفريق اللي حبينا من الصغر وتابعنا وتعايشنا معو لحظة بلحظة لازم نكون معو بالسراء والضراء لانو مستحيل اي فريق بالعالم يفوز او يضل محافظ على مستوا والفريق الكبير يمرض ولا يموت و[ORG_1] فريق كبير وخليها تكون فنرة مرض للوحدات وان شاءالله انها راح تعدي ومنها للاحسن ونعتبر منها ونتعلم الاخطاء اللي مرات فينا ومش عيب انو نخسر ولا عيب انو نتعلم من اخطاءنا واي بني ادم بمضي حياتو وهو بتعلم وان شاء الله يالاخضر منها للاحسن واحنا جماهيرك الوفية وراح نضل وفية الك وبنحبك وما قيمة حياتي ان لم اكن,"[{""start"": 22, ""end"": 29, ""placeholder"": ""[ORG_1]"", ""surface_form"": ""الوحدات"", ""mask_type"": ""ORG""}, {""start"": 131, ""end"": 138, ""placeholder"": ""[ORG_1]"", ""surface_form"": ""الوحدات"", ""mask_type"": ""ORG""}, {""start"": 409, ""end"": 416, ""placeholder"": ""[ORG_1]"", ""surface_form"": ""الوحدات"", ""mask_type"": ""ORG""}]",3,approved,,
mt_msa_7b04611a,train,65227,MSA,جزاكم الله خير الجزاء يامملكتنا الغاليه ومليكنت المفدى . واطبائنا الاعزاء,جزاكم الله خير الجزاء يامملكتنا الغاليه ومليكنت المفدي واطباينا الاعزاء,جزاكم الله خير الجزاء يامملكتنا الغاليه ومليكنت المفدى . واطبائنا الاعزاء,[],0,approved,,
mt_dial_egy_f67e3ecf,train,75312,DIAL_EGY,ان يصمت على السوقية وقلة,ان يصمت علي السوقيه وقله,ان يصمت على السوقية وقلة,[],0,approved,,
mt_dial_glf_cf72a8d2,train,59917,DIAL_GLF,ه أحلى خبر في حياتي كأني كاسب المليون,ه احلي خبر في حياتي كاني كاسب المليون,ه أحلى خبر في حياتي كأني كاسب المليون,[],0,approved,,
