example_id,source_split,source_row_id,dialect,original_text,normalized_text,masked_text,mask_spans_json,mask_count,annotation_status,annotator_model,notes
mt_dial_lev_c732e406,train,31052,DIAL_LEV,يعني ليش زعلانين يا تجار السيارات صحيح انكم مشمكلجية أنتوا ما بتعرفوا أنوا الحكومة الاردنية بتفهم اكثر من الحكومة الامرليكية بكثير وعلشان هيك اقتصاد الاردن اقوى مكن الاقتصاد الامريكي,يعني ليش زعلانين يا تجار السيارات صحيح انكم مشمكلجيه انتوا ما بتعرفوا انوا الحكومه الاردنيه بتفهم اكثر من الحكومه الامرليكيه بكثير وعلشان هيك اقتصاد الاردن اقوي مكن الاقتصاد الامريكي,يعني ليش زعلانين يا تجار السيارات صحيح انكم مشمكلجية أنتوا ما بتعرفوا أنوا الحكومة [ORG_1] بتفهم اكثر من الحكومة الامرليكية بكثير وعلشان هيك اقتصاد [LOC_1] اقوى مكن الاقتصاد الامريكي,"[{""start"": 83, ""end"": 91, ""placeholder"": ""[ORG_1]"", ""surface_form"": ""الاردنية"", ""mask_type"": ""ORG""}, {""start"": 149, ""end"": 155, ""placeholder"": ""[LOC_1]"", ""surface_form"": ""الاردن"", ""mask_type"": ""LOC""}]",2,approved,,
mt_dial_egy_b61b58cd,train,55526,DIAL_EGY,مش فاهم هو الكابتن ايمن يونس عاوز ايه بالضبط ؟ ؟,مش فاهم هو الكابتن ايمن يونس عاوز ايه بالضبط,مش فاهم هو الكابتن [PERSON_1] عاوز ايه بالضبط ؟ ؟,"[{""start"": 19, ""end"": 28, ""placeholder"": ""[PERSON_1]"", ""surface_form"": ""ايمن يونس"", ""mask_type"": ""PERSON""}]",1,approved,,
mt_dial_glf_33a04aac,train,25927,DIAL_GLF,حسبي الله عليكم يا مسؤولين عيالك مناصب ورواتب تمشي لهم واهم في البيت وعيال الناس شقق مفروشه وخضار,حسبي الله عليكم يا مسوولين عيالك مناصب ورواتب تمشي لهم واهم في البيت وعيال الناس شقق مفروشه وخضار,حسبي الله عليكم يا مسؤولين عيالك مناصب ورواتب تمشي لهم واهم في البيت وعيال الناس شقق مفروشه وخضار,[],0,approved,,
mt_dial_lev_4181073c,train,61200,DIAL_LEV,ومش بعيده تعمل شيك وتفرض,ومش بعيده تعمل شيك وتفرض,ومش بعيده تعمل شيك وتفرض,[],0,approved,,
mt_msa_b2fc26a3,train,24166,MSA,اذا كانت الأختان تنتظر من يدق الباب ولو أني أجد لديها الشجاعة للتواصل مع الغرباء . . . لماذا لايكون الأخ ايجابي ؟ ؟ لنفسه ولأختيه . . . وأخطب,اذا كانت الاختان تنتظر من يدق الباب ولو اني اجد لديها الشجاعه للتواصل مع الغرباء لماذا لايكون الاخ ايجابي لنفسه ولاختيه واخطب,اذا كانت الأختان تنتظر من يدق الباب ولو أني أجد لديها الشجاعة للتواصل مع الغرباء . . . لماذا لايكون الأخ ايجابي ؟ ؟ لنفسه ولأختيه . . . وأخطب,[],0,approved,,
mt_dial_egy_39ada871,train,3106,DIAL_EGY,بلاش عنصرية يانيفين ، ، ، هدف الاخوان البقاء فى معارضة أى حكم ، ، ، حتى يبقى عندهم قضية يلتفون حولها ، ، ، والا تفرغ بعضهم للقضاء على بعض ! ! ! الموضوع لاعلاقة له بالدين ! ! ! ولا دولة دينية . . . ياريت تتخلصى من ذكريات العصور الوسطى فى اوروبا ومحاكم التفتيش ! ! وصكوك الغفران . . . ماشى ياعسل . .,بلاش عنصريه يانيفين هدف الاخوان البقاء في معارضه اي حكم حتي يبقي عندهم قضيه يلتفون حولها والا تفرغ بعضهم للقضاء علي بعض الموضوع لاعلاقه له بالدين ولا دوله دينيه ياريت تتخلصي من ذكريات العصور الوسطي في اوروبا ومحاكم التفتيش وصكوك الغفران ماشي ياعسل,بلاش عنصرية يا[PERSON_1] ، ، ، هدف [ORG_1] البقاء فى معارضة أى حكم ، ، ، حتى يبقى عندهم قضية يلتفون حولها ، ، ، والا تفرغ بعضهم للقضاء على بعض ! ! ! الموضوع لاعلاقة له بالدين ! ! ! ولا دولة دينية . . . ياريت تتخلصى من ذكريات العصور الوسطى فى [LOC_1] ومحاكم التفتيش ! ! وصكوك الغفران . . . ماشى ياعسل . .,"[{""start"": 14, ""end"": 19, ""placeholder"": ""[PERSON_1]"", ""surface_form"": ""نيفين"", ""mask_type"": ""PERSON""}, {""start"": 30, ""end"": 37, ""placeholder"": ""[ORG_1]"", ""surface_form"": ""الاخوان"", ""mask_type"": ""ORG""}, {""start"": 237, ""end"": 243, ""placeholder"": ""[LOC_1]"", ""surface_form"": ""اوروبا"", ""mask_type"": ""LOC""}]",3,approved,,
mt_dial_glf_cfc2b081,train,22872,DIAL_GLF,بالكامب نو يعني سلملي على,بالكامب نو يعني سلملي علي,ب[LOC_1] يعني سلملي على,"[{""start"": 1, ""end"": 10, ""placeholder"": ""[LOC_1]"", ""surface_form"": ""الكامب نو"", ""mask_type"": ""LOC""}]",1,approved,,
mt_dial_lev_dfafe4a1,train,69208,DIAL_LEV,خطوة طيبه من شركه تحترم وتقدر اللاعب ، اللي بعرفه عن الشركه انها من اكثر الشركات المهتمه بموضوع الاعلانات وبتدغع منيح . . . وكان عندها حمله كبيره عالراديو . . . المهم سمعنا انه كل كابتن 10000 دينار ةانه الشركه بصدد التوقيع مع مهاجمين لنفس الحمله ، يرجى,خطوه طيبه من شركه تحترم وتقدر اللاعب اللي بعرفه عن الشركه انها من اكثر الشركات المهتمه بموضوع الاعلانات وبتدغع منيح وكان عندها حمله كبيره عالراديو المهم سمعنا انه كل كابتن 10000 دينار هانه الشركه بصدد التوقيع مع مهاجمين لنفس الحمله يرجي,خطوة طيبه من شركه تحترم وتقدر اللاعب ، اللي بعرفه عن الشركه انها من اكثر الشركات المهتمه بموضوع الاعلانات وبتدغع منيح . . . وكان عندها حمله كبيره عالراديو . . . المهم سمعنا انه كل كابتن [NUM_1] دينار ةانه الشركه بصدد التوقيع مع مهاجمين لنفس الحمله ، يرجى,"[{""start"": 186, ""end"": 191, ""placeholder"": ""[NUM_1]"", ""surface_form"": ""10000"", ""mask_type"": ""NUM""}]",1,approved,,
mt_msa_f5af6a91,train,70286,MSA,من العقليات التي أحترمها بصدق سعادة السفير عادل الجبير .,من العقليات التي احترمها بصدق سعاده السفير عادل الجبير,من العقليات التي أحترمها بصدق سعادة السفير [PERSON_1] .,"[{""start"": 43, ""end"": 54, ""placeholder"": ""[PERSON_1]"", ""surface_form"": ""عادل الجبير"", ""mask_type"": ""PERSON""}]",1,approved,,
