example_id,source_split,source_row_id,dialect,original_text,normalized_text,masked_text,mask_spans_json,mask_count,annotation_status,annotator_model,notes
mt_dial_lev_06f4fee4,train,77696,DIAL_LEV,وماقصده يقتل حدا بس الإحتياط مطلوب دايما,وماقصده يقتل حدا بس الاحتياط مطلوب دايما,وماقصده يقتل حدا بس الإحتياط مطلوب دايما,[],0,approved,,
mt_msa_f2427526,train,65579,MSA,والشباب ان شاء الله سيكون الطرف,والشباب ان شاء الله سيكون الطرف,والشباب ان شاء الله سيكون الطرف,[],0,approved,,
mt_dial_egy_7bedf356,train,5256,DIAL_EGY,اذن رئيس لسانة زفر ومرتزقة طيارين وخبراء دفاع جوى بجانب جيش عائد لتوة من ميادين القتال كنت عاوزنا ننتظر حتى يعتدى علينا المرتزقة كمان واللا ندمر لة المعدات والاسلحة والطيارات على الارض قبل مايطير بيها المرتزقة ولعلمك هو رجع الان لموضوع المرتوزقة وعلشان كدة اتجرأ على الصيادين وباءذن اللة نهبدة علقة تانية ندمر لة جعبوب والعضم والجفرة وتفر منة شركات البترول من برقة . ( كل ماتقلوا ادبكوا هانضربكوا ياقحف,اذن رييس لسانه زفر ومرتزقه طيارين وخبراء دفاع جوي بجانب جيش عايد لتوه من ميادين القتال كنت عاوزنا ننتظر حتي يعتدي علينا المرتزقه كمان واللا ندمر له المعدات والاسلحه والطيارات علي الارض قبل مايطير بيها المرتزقه ولعلمك هو رجع الان لموضوع المرتوزقه وعلشان كده اتجرا علي الصيادين وباءذن الله نهبده علقه تانيه ندمر له جعبوب والعضم والجفره وتفر منه شركات البترول من برقه كل ماتقلوا ادبكوا هانضربكوا ياقحف,اذن رئيس لسانة زفر ومرتزقة طيارين وخبراء دفاع جوى بجانب جيش عائد لتوة من ميادين القتال كنت عاوزنا ننتظر حتى يعتدى علينا المرتزقة كمان واللا ندمر لة المعدات والاسلحة والطيارات على الارض قبل مايطير بيها المرتزقة ولعلمك هو رجع الان لموضوع المرتوزقة وعلشان كدة اتجرأ على الصيادين وباءذن اللة نهبدة علقة تانية ندمر لة جعبوب والعضم والجفرة وتفر منة شركات البترول من [LOC_1] . ( كل ماتقلوا ادبكوا هانضربكوا ياقحف,"[{""start"": 360, ""end"": 364, ""placeholder"": ""[LOC_1]"", ""surface_form"": ""برقة"", ""mask_type"": ""LOC""}]",1,approved,,
mt_dial_glf_2a87f9a3,train,45243,DIAL_GLF,قبل فتره تفاجأت باحدى البنات حينما دارت احدى النقاشات عن الزواج قالت انا مراح اتزوج الا وحده امه متوفيه . . !,قبل فتره تفاجات باحدي البنات حينما دارت احدي النقاشات عن الزواج قالت انا مراح اتزوج الا وحده امه متوفيه,قبل فتره تفاجأت باحدى البنات حينما دارت احدى النقاشات عن الزواج قالت انا مراح اتزوج الا وحده امه متوفيه . . !,[],0,approved,,
mt_dial_lev_bf7fb5a8,train,71007,DIAL_LEV,"يعني هالمرة التفجير من الجهات المصرية مش من الاسرائيليين , الله يعطيكو العافية يا",يعني هالمره التفجير من الجهات المصريه مش من الاسراييليين الله يعطيكو العافيه يا,"يعني هالمرة التفجير من الجهات [ORG_1] مش من [ORG_2] , الله يعطيكو العافية يا","[{""start"": 30, ""end"": 37, ""placeholder"": ""[ORG_1]"", ""surface_form"": ""المصرية"", ""mask_type"": ""ORG""}, {""start"": 44, ""end"": 56, ""placeholder"": ""[ORG_2]"", ""surface_form"": ""الاسرائيليين"", ""mask_type"": ""ORG""}]",2,approved,,
mt_msa_b0850b7b,train,58013,MSA,فهو مازال مشبه به وليس القاتل,فهو مازال مشبه به وليس القاتل,فهو مازال مشبه به وليس القاتل,[],0,approved,,
mt_dial_egy_c3694adb,train,27081,DIAL_EGY,ربنا يولى من يصلح ومن المفروض على كل مسئول ان يحزو حزوه لانه لابد من الرقابة على كل,ربنا يولي من يصلح ومن المفروض علي كل مسيول ان يحزو حزوه لانه لابد من الرقابه علي كل,ربنا يولى من يصلح ومن المفروض على كل مسئول ان يحزو حزوه لانه لابد من الرقابة على كل,[],0,approved,,
mt_dial_glf_17d1af8c,train,49751,DIAL_GLF,اهل الزوج وافقو على كذا والشيعه يصلون في المسجد الحرام ومساجدنا حتى اهل الكتاب يجوز ان نتزوج منهم !,اهل الزوج وافقو علي كذا والشيعه يصلون في المسجد الحرام ومساجدنا حتي اهل الكتاب يجوز ان نتزوج منهم,اهل الزوج وافقو على كذا والشيعه يصلون في [LOC_1] ومساجدنا حتى اهل الكتاب يجوز ان نتزوج منهم !,"[{""start"": 41, ""end"": 54, ""placeholder"": ""[LOC_1]"", ""surface_form"": ""المسجد الحرام"", ""mask_type"": ""LOC""}]",1,approved,,
mt_dial_lev_c62d78a2,train,51240,DIAL_LEV,انا الخضرجي صاحبي عمرة ما عزم على كاسة مي,انا الخضرجي صاحبي عمره ما عزم علي كاسه مي,انا الخضرجي صاحبي عمرة ما عزم على كاسة مي,[],0,approved,,
mt_msa_a7b3fed7,train,85054,MSA,الي محرر الموقع أحترمكم عل سرعة التعديل و على الرد المهذب . . . فهذا هو سر ارتباطنا باليوم السابع . . إحترام القراء و سرعة الاعتراف بالخطأ و,الي محرر الموقع احترمكم عل سرعه التعديل و علي الرد المهذب فهذا هو سر ارتباطنا باليوم السابع احترام القراء و سرعه الاعتراف بالخطا و,الي محرر الموقع أحترمكم عل سرعة التعديل و على الرد المهذب . . . فهذا هو سر ارتباطنا ب[ORG_1] . . إحترام القراء و سرعة الاعتراف بالخطأ و,"[{""start"": 85, ""end"": 97, ""placeholder"": ""[ORG_1]"", ""surface_form"": ""اليوم السابع"", ""mask_type"": ""ORG""}]",1,approved,,
mt_dial_egy_24db0d40,train,13635,DIAL_EGY,ضربة الجزاء مفيش فيها اي صحة . . بس عشان احنا بنفهم وعارفين ان الغلطات دي مش مقصودة من الحكام قلنا عادي . . بس ورينا للناس ان الغلطة اهي .,ضربه الجزاء مفيش فيها اي صحه بس عشان احنا بنفهم وعارفين ان الغلطات دي مش مقصوده من الحكام قلنا عادي بس ورينا للناس ان الغلطه اهي,ضربة الجزاء مفيش فيها اي صحة . . بس عشان احنا بنفهم وعارفين ان الغلطات دي مش مقصودة من الحكام قلنا عادي . . بس ورينا للناس ان الغلطة اهي .,[],0,approved,,
mt_dial_glf_65203e31,train,33613,DIAL_GLF,يا بعد عمري حسبي الله ونعم الوكيل ما رحموا ابوه,يا بعد عمري حسبي الله ونعم الوكيل ما رحموا ابوه,يا بعد عمري حسبي الله ونعم الوكيل ما رحموا ابوه,[],0,approved,,
mt_dial_lev_69acdd6a,train,59781,DIAL_LEV,ولازم يكون عبرة لغيرة بس حسبي الله ونعم,ولازم يكون عبره لغيره بس حسبي الله ونعم,ولازم يكون عبرة لغيرة بس حسبي الله ونعم,[],0,approved,,
mt_dial_egy_32efd4f0,train,47178,DIAL_EGY,وانت في مقام محمد علي باشا . . مانت من مواليد 1900 . . . يعني برضه احترامك لسنك واجب,وانت في مقام محمد علي باشا مانت من مواليد 1900 يعني برضه احترامك لسنك واجب,وانت في مقام [PERSON_1] . . مانت من مواليد [DATE_1] . . . يعني برضه احترامك لسنك واجب,"[{""start"": 13, ""end"": 26, ""placeholder"": ""[PERSON_1]"", ""surface_form"": ""محمد علي باشا"", ""mask_type"": ""PERSON""}, {""start"": 46, ""end"": 50, ""placeholder"": ""[DATE_1]"", ""surface_form"": ""1900"", ""mask_type"": ""DATE""}]",2,approved,,
mt_dial_glf_f5a1d99e,train,60837,DIAL_GLF,الف مبروك للشباب رفعتو راسنا مو مثل الهلال ! !,الف مبروك للشباب رفعتو راسنا مو مثل الهلال,الف مبروك للشباب رفعتو راسنا مو مثل [ORG_1] ! !,"[{""start"": 36, ""end"": 42, ""placeholder"": ""[ORG_1]"", ""surface_form"": ""الهلال"", ""mask_type"": ""ORG""}]",1,approved,,
mt_dial_lev_66e20f7a,train,12938,DIAL_LEV,"الله سبحانه وتعالى ميزنابالعقل حتى نتحكم بشهواتنا وغرائزنا , ارضنا طيبه شوف هلبدائل الصحيه قلايه بندوره ( بدل قلايه الحمه ) برغل ( بدل الرز ) شوربه عدس بدل شوربة الكوارع والروس , زيت زيتون بدل السمنه , , الغي الشاورما والمقالي والفروج والكباب , وفر على الجيبه واكسب صحتك",الله سبحانه وتعالي ميزنابالعقل حتي نتحكم بشهواتنا وغرايزنا ارضنا طيبه شوف هلبدايل الصحيه قلايه بندوره بدل قلايه الحمه برغل بدل الرز شوربه عدس بدل شوربه الكوارع والروس زيت زيتون بدل السمنه الغي الشاورما والمقالي والفروج والكباب وفر علي الجيبه واكسب صحتك,"الله سبحانه وتعالى ميزنابالعقل حتى نتحكم بشهواتنا وغرائزنا , ارضنا طيبه شوف هلبدائل الصحيه قلايه بندوره ( بدل قلايه الحمه ) برغل ( بدل الرز ) شوربه عدس بدل شوربة الكوارع والروس , زيت زيتون بدل السمنه , , الغي الشاورما والمقالي والفروج والكباب , وفر على الجيبه واكسب صحتك",[],0,approved,,
mt_msa_d336b851,train,46821,MSA,يرسلون هؤلاء الاطفال الابرياء الى الموت بدلا من ان يرسلوهم الى المدارس وبعد ذلك يحتلفون بعودتهم ، اليس السجن ارحم من البحر الكاسر ، اليس السجن ارحم من هؤلاء الاباء الجشعين ، والله امركم,يرسلون هولاء الاطفال الابرياء الي الموت بدلا من ان يرسلوهم الي المدارس وبعد ذلك يحتلفون بعودتهم اليس السجن ارحم من البحر الكاسر اليس السجن ارحم من هولاء الاباء الجشعين والله امركم,يرسلون هؤلاء الاطفال الابرياء الى الموت بدلا من ان يرسلوهم الى المدارس وبعد ذلك يحتلفون بعودتهم ، اليس السجن ارحم من البحر الكاسر ، اليس السجن ارحم من هؤلاء الاباء الجشعين ، والله امركم,[],0,approved,,
mt_dial_egy_979e4628,train,46734,DIAL_EGY,مش عايزين شكر . . بس مش عايزين نكران,مش عايزين شكر بس مش عايزين نكران,مش عايزين شكر . . بس مش عايزين نكران,[],0,approved,,
mt_dial_glf_5f1fa1cd,train,24731,DIAL_GLF,الدعوه مش إختلاف نسب الدعوه إختلاف مذهب,الدعوه مش اختلاف نسب الدعوه اختلاف مذهب,الدعوه مش إختلاف نسب الدعوه إختلاف مذهب,[],0,approved,,
mt_dial_lev_259eeb8d,train,61587,DIAL_LEV,لو في قوانين صارمة كان ما اتجرأ وعمل,لو في قوانين صارمه كان ما اتجرا وعمل,لو في قوانين صارمة كان ما اتجرأ وعمل,[],0,approved,,
mt_msa_71ffe6c5,train,78972,MSA,على سنه الله ورسوله والله على مانقول,علي سنه الله ورسوله والله علي مانقول,على سنه الله ورسوله والله على مانقول,[],0,approved,,
mt_dial_egy_cefab54d,train,70710,DIAL_EGY,العالم العربى كله شاهد ما حدث فى المباراة بدليل تعليق اخون الجزائرى اللى اسمه فاروق,العالم العربي كله شاهد ما حدث في المباراه بدليل تعليق اخون الجزايري اللي اسمه فاروق,العالم العربى كله شاهد ما حدث فى المباراة بدليل تعليق اخون الجزائرى اللى اسمه [PERSON_1],"[{""start"": 78, ""end"": 83, ""placeholder"": ""[PERSON_1]"", ""surface_form"": ""فاروق"", ""mask_type"": ""PERSON""}]",1,approved,,
mt_dial_glf_c1162b24,train,44539,DIAL_GLF,و منيح انه العطر و الحبر مسموح يا اخت هدى !,و منيح انه العطر و الحبر مسموح يا اخت هدي,و منيح انه العطر و الحبر مسموح يا اخت [PERSON_1] !,"[{""start"": 38, ""end"": 41, ""placeholder"": ""[PERSON_1]"", ""surface_form"": ""هدى"", ""mask_type"": ""PERSON""}]",1,approved,,
mt_dial_lev_98d8853b,train,34722,DIAL_LEV,والله الواحد بدو يبطل يسمع اخبار,والله الواحد بدو يبطل يسمع اخبار,والله الواحد بدو يبطل يسمع اخبار,[],0,approved,,
mt_msa_8cab2865,train,53808,MSA,**إلى اليوم السابع : أرجو نشر,الي اليوم السابع ارجو نشر,**إلى [ORG_1] : أرجو نشر,"[{""start"": 6, ""end"": 18, ""placeholder"": ""[ORG_1]"", ""surface_form"": ""اليوم السابع"", ""mask_type"": ""ORG""}]",1,approved,,
mt_dial_egy_c68fb8e1,train,43832,DIAL_EGY,وهذا هو الحال فى اغلب قطاعات الدوله ( الا من رحم ربي ) . . والمذهل ان الجميع غارق تماما فى وضع خطط اصلاح ( ( غيره ) ) ! ! - شوف المصيبه .,وهذا هو الحال في اغلب قطاعات الدوله الا من رحم ربي والمذهل ان الجميع غارق تماما في وضع خطط اصلاح غيره شوف المصيبه,وهذا هو الحال فى اغلب قطاعات الدوله ( الا من رحم ربي ) . . والمذهل ان الجميع غارق تماما فى وضع خطط اصلاح ( ( غيره ) ) ! ! - شوف المصيبه .,[],0,approved,,
mt_dial_glf_166965a2,train,37225,DIAL_GLF,اذا الشيوخ قالوا كذا مانقول شي,اذا الشيوخ قالوا كذا مانقول شي,اذا الشيوخ قالوا كذا مانقول شي,[],0,approved,,
mt_dial_lev_4fb5874f,train,5081,DIAL_LEV,الله يحميك يا جلالة الملك الي حاسس بهموم المواطن والوطن احنا خلفك ومعاك واكيد الاردن امنها خط احمر للي بحب الاردن بعرف قيمة بلدنا و قايدنا الله يحميينا من كل شر يارب,الله يحميك يا جلاله الملك الي حاسس بهموم المواطن والوطن احنا خلفك ومعاك واكيد الاردن امنها خط احمر للي بحب الاردن بعرف قيمه بلدنا و قايدنا الله يحميينا من كل شر يارب,الله يحميك يا جلالة الملك الي حاسس بهموم المواطن والوطن احنا خلفك ومعاك واكيد [LOC_1] امنها خط احمر للي بحب [LOC_1] بعرف قيمة بلدنا و قايدنا الله يحميينا من كل شر يارب,"[{""start"": 78, ""end"": 84, ""placeholder"": ""[LOC_1]"", ""surface_form"": ""الاردن"", ""mask_type"": ""LOC""}, {""start"": 107, ""end"": 113, ""placeholder"": ""[LOC_1]"", ""surface_form"": ""الاردن"", ""mask_type"": ""LOC""}]",2,approved,,
mt_msa_1a6ced95,train,26059,MSA,مبروك للعربي ولفرق الشمال عموما بالفوز على البقعة والفيصلي وان شاء الله نهائي شمالي .,مبروك للعربي ولفرق الشمال عموما بالفوز علي البقعه والفيصلي وان شاء الله نهايي شمالي,مبروك ل[ORG_1] ولفرق الشمال عموما بالفوز على [ORG_2] و[ORG_3] وان شاء الله نهائي شمالي .,"[{""start"": 7, ""end"": 12, ""placeholder"": ""[ORG_1]"", ""surface_form"": ""لعربي"", ""mask_type"": ""ORG""}, {""start"": 43, ""end"": 49, ""placeholder"": ""[ORG_2]"", ""surface_form"": ""البقعة"", ""mask_type"": ""ORG""}, {""start"": 51, ""end"": 58, ""placeholder"": ""[ORG_3]"", ""surface_form"": ""الفيصلي"", ""mask_type"": ""ORG""}]",3,approved,,
mt_dial_egy_a615f3c7,train,32512,DIAL_EGY,تحياتى لكاتب المقال ومعزره انتا مكتبتش عن الى بيركبو لاتوبيس ويكون زحمه موت وهوا ماشى يقف واحد بعربيته الضخمه الفخمه ويعطلهم والناس بتموت وهوا قاعد فى التكييف والمترو وازمه الحمه والعيش ولغايه بكره اه اهمش عارف اقلك اد ايه,تحياتي لكاتب المقال ومعزره انتا مكتبتش عن الي بيركبو لاتوبيس ويكون زحمه موت وهوا ماشي يقف واحد بعربيته الضخمه الفخمه ويعطلهم والناس بتموت وهوا قاعد في التكييف والمترو وازمه الحمه والعيش ولغايه بكره اه اهمش عارف اقلك اد ايه,تحياتى لكاتب المقال ومعزره انتا مكتبتش عن الى بيركبو لاتوبيس ويكون زحمه موت وهوا ماشى يقف واحد بعربيته الضخمه الفخمه ويعطلهم والناس بتموت وهوا قاعد فى التكييف والمترو وازمه الحمه والعيش ولغايه بكره اه اهمش عارف اقلك اد ايه,[],0,approved,,
mt_dial_glf_d5c915d8,train,83640,DIAL_GLF,كل خطوه ممكن تجد فيها كم معاناه . .,كل خطوه ممكن تجد فيها كم معاناه,كل خطوه ممكن تجد فيها كم معاناه . .,[],0,approved,,
mt_dial_lev_cba14bf5,train,68839,DIAL_LEV,على كل حال هذا طبع البرازيل واسياد الكره اكيد الخير في الجايات . اما تعاني الامرين حلوه هاي,علي كل حال هذا طبع البرازيل واسياد الكره اكيد الخير في الجايات اما تعاني الامرين حلوه هاي,على كل حال هذا طبع [LOC_1] واسياد الكره اكيد الخير في الجايات . اما تعاني الامرين حلوه هاي,"[{""start"": 19, ""end"": 27, ""placeholder"": ""[LOC_1]"", ""surface_form"": ""البرازيل"", ""mask_type"": ""LOC""}]",1,approved,,
mt_dial_egy_d36d30f1,train,83763,DIAL_EGY,رانا طالعين زكارة في الغيارين : سنصعد ( الى المونديال ) رغم الغيورين .,رانا طالعين زكاره في الغيارين سنصعد الي المونديال رغم الغيورين,رانا طالعين زكارة في الغيارين : سنصعد ( الى المونديال ) رغم الغيورين .,[],0,approved,,
mt_dial_glf_8700172b,train,36494,DIAL_GLF,وربي الهلال فريق صح يفوز بس فوزه ما,وربي الهلال فريق صح يفوز بس فوزه ما,وربي [ORG_1] فريق صح يفوز بس فوزه ما,"[{""start"": 5, ""end"": 11, ""placeholder"": ""[ORG_1]"", ""surface_form"": ""الهلال"", ""mask_type"": ""ORG""}]",1,approved,,
mt_dial_lev_19565a93,train,8326,DIAL_LEV,طيب هذا اللي قتل ابن اختو علشان قطعة ارض هو راح يظل مخلد في هذه الارض وما بدو يموت,طيب هذا اللي قتل ابن اختو علشان قطعه ارض هو راح يظل مخلد في هذه الارض وما بدو يموت,طيب هذا اللي قتل ابن اختو علشان قطعة ارض هو راح يظل مخلد في هذه الارض وما بدو يموت,[],0,approved,,
mt_msa_94dbdfaa,train,26796,MSA,نذكر انه في العام الماضي ان الوحدات فاز في درع الاتحاد في الفريق الرديف الثاني حيث ضم هذا الفريق نخبه من الشباب المتميز الذي كان بأمكان النادي ان يستفيد منه في دكة البدلاء الا ان ادارة النادي ارتئة الى بيع هذه النخبه ومن ثم خلت مقاعد البدلاء من البديل المناسب,نذكر انه في العام الماضي ان الوحدات فاز في درع الاتحاد في الفريق الرديف الثاني حيث ضم هذا الفريق نخبه من الشباب المتميز الذي كان بامكان النادي ان يستفيد منه في دكه البدلاء الا ان اداره النادي ارتيه الي بيع هذه النخبه ومن ثم خلت مقاعد البدلاء من البديل المناسب,نذكر انه في العام الماضي ان [ORG_1] فاز في [ORG_2] في الفريق الرديف الثاني حيث ضم هذا الفريق نخبه من الشباب المتميز الذي كان بأمكان النادي ان يستفيد منه في دكة البدلاء الا ان ادارة النادي ارتئة الى بيع هذه النخبه ومن ثم خلت مقاعد البدلاء من البديل المناسب,"[{""start"": 28, ""end"": 35, ""placeholder"": ""[ORG_1]"", ""surface_form"": ""الوحدات"", ""mask_type"": ""ORG""}, {""start"": 43, ""end"": 54, ""placeholder"": ""[ORG_2]"", ""surface_form"": ""درع الاتحاد"", ""mask_type"": ""ORG""}]",2,approved,,
mt_dial_egy_e982822b,train,74343,DIAL_EGY,انا بجد مش عارفه اقول ايه للوزير بس هو فعلا كتر خيره فى اللى بيعمله وبقا فى نظام والمدارس بتتحسن كل يوم اكتر بس احنا خلاص بنتكلم فى الوقت الضايع واما نقول وقت ضايع يبقا بنتكلم عن الثانويه العامه جدول ظالم وتغير ظالم وقرارات اتاخدت وكانه حتى مفكرش هوا اخدها بناء على ايه كان فين من اول السنه احنا مش عرفين نروح المدارس ولا الدروس واللى بتقول ان الطلاب الثانويه المفرود يرواحوا المدارس ويرجعوا لدروس اكيد دى مش طالبه بجد حرام اللى هما عملوه فى طلاب الثانويه,انا بجد مش عارفه اقول ايه للوزير بس هو فعلا كتر خيره في اللي بيعمله وبقا في نظام والمدارس بتتحسن كل يوم اكتر بس احنا خلاص بنتكلم في الوقت الضايع واما نقول وقت ضايع يبقا بنتكلم عن الثانويه العامه جدول ظالم وتغير ظالم وقرارات اتاخدت وكانه حتي مفكرش هوا اخدها بناء علي ايه كان فين من اول السنه احنا مش عرفين نروح المدارس ولا الدروس واللي بتقول ان الطلاب الثانويه المفرود يرواحوا المدارس ويرجعوا لدروس اكيد دي مش طالبه بجد حرام اللي هما عملوه في طلاب الثانويه,انا بجد مش عارفه اقول ايه للوزير بس هو فعلا كتر خيره فى اللى بيعمله وبقا فى نظام والمدارس بتتحسن كل يوم اكتر بس احنا خلاص بنتكلم فى الوقت الضايع واما نقول وقت ضايع يبقا بنتكلم عن الثانويه العامه جدول ظالم وتغير ظالم وقرارات اتاخدت وكانه حتى مفكرش هوا اخدها بناء على ايه كان فين من اول السنه احنا مش عرفين نروح المدارس ولا الدروس واللى بتقول ان الطلاب الثانويه المفرود يرواحوا المدارس ويرجعوا لدروس اكيد دى مش طالبه بجد حرام اللى هما عملوه فى طلاب الثانويه,[],0,approved,,
mt_dial_glf_9ad88a4f,train,79954,DIAL_GLF,الله يحمي أبناء الأسلام والمسلمين من هذي السموم,الله يحمي ابناء الاسلام والمسلمين من هذي السموم,الله يحمي أبناء الأسلام والمسلمين من هذي السموم,[],0,approved,,
