example_id,source_split,source_row_id,dialect,original_text,normalized_text,masked_text,mask_spans_json,mask_count,annotation_status,annotator_model,notes
mt_dial_egy_9b1cef41,train,53316,DIAL_EGY,انا شغال فى الائتمان فى احد البنوك الكبرى مفيش اى رئيس بنك يقوم بايقاف سداد المديونية حتى لو قام ببيع جميع الضمانات لان ده هيعلى ارباح البنك وبيكون سبب فى التجديد لرائس البنك مرة اخرى بالتاكيد الضمانات اللى بتكلوموا عنها دى اما انها بضاعة وكانت منتهية الصلاحية او انه لم يجد من يشتريها بدليل انه حاول البيع وما تمكن الا ببيع جزاء,انا شغال في الايتمان في احد البنوك الكبري مفيش اي رييس بنك يقوم بايقاف سداد المديونيه حتي لو قام ببيع جميع الضمانات لان ده هيعلي ارباح البنك وبيكون سبب في التجديد لرايس البنك مره اخري بالتاكيد الضمانات اللي بتكلوموا عنها دي اما انها بضاعه وكانت منتهيه الصلاحيه او انه لم يجد من يشتريها بدليل انه حاول البيع وما تمكن الا ببيع جزاء,انا شغال فى الائتمان فى احد البنوك الكبرى مفيش اى رئيس بنك يقوم بايقاف سداد المديونية حتى لو قام ببيع جميع الضمانات لان ده هيعلى ارباح البنك وبيكون سبب فى التجديد لرائس البنك مرة اخرى بالتاكيد الضمانات اللى بتكلوموا عنها دى اما انها بضاعة وكانت منتهية الصلاحية او انه لم يجد من يشتريها بدليل انه حاول البيع وما تمكن الا ببيع جزاء,[],0,approved,,
mt_dial_glf_88d558f6,train,49627,DIAL_GLF,بصراحه انا من الناس إللي خايف من هذا النظام مع أني نظامي وعمري ما اخذت قسيمةالا مره واحدة عم ترك مسافة واحس أني مظلوم بها لشددة,بصراحه انا من الناس اللي خايف من هذا النظام مع اني نظامي وعمري ما اخذت قسيمهالا مره واحده عم ترك مسافه واحس اني مظلوم بها لشدده,بصراحه انا من الناس إللي خايف من هذا النظام مع أني نظامي وعمري ما اخذت قسيمةالا مره واحدة عم ترك مسافة واحس أني مظلوم بها لشددة,[],0,approved,,
mt_dial_lev_b3ce2b5d,train,38631,DIAL_LEV,اكيد طبعا لازم يكون فيه,اكيد طبعا لازم يكون فيه,اكيد طبعا لازم يكون فيه,[],0,approved,,
mt_msa_b9e7c555,train,58701,MSA,الفيصلي بطل تلك البطولة مرتين متتاليتين ووصيف بالثالثه وعلى التوالي للتذكير فقط,الفيصلي بطل تلك البطوله مرتين متتاليتين ووصيف بالثالثه وعلي التوالي للتذكير فقط,[ORG_1] بطل تلك البطولة مرتين متتاليتين ووصيف بالثالثه وعلى التوالي للتذكير فقط,"[{""start"": 0, ""end"": 7, ""placeholder"": ""[ORG_1]"", ""surface_form"": ""الفيصلي"", ""mask_type"": ""ORG""}]",1,approved,,
mt_dial_egy_b2d3a95a,train,21412,DIAL_EGY,يا رب ارحمنا من الوحوش الى وقعنا فى ايديهم,يا رب ارحمنا من الوحوش الي وقعنا في ايديهم,يا رب ارحمنا من الوحوش الى وقعنا فى ايديهم,[],0,approved,,
mt_dial_glf_5038ce02,train,4927,DIAL_GLF,كنت ( سعيدة الايام بنت روق ) . . والان لي عوده مع .,كنت سعيده الايام بنت روق والان لي عوده مع,كنت ( [HANDLE_1] ) . . والان لي عوده مع .,"[{""start"": 6, ""end"": 26, ""placeholder"": ""[HANDLE_1]"", ""surface_form"": ""سعيدة الايام بنت روق"", ""mask_type"": ""HANDLE""}]",1,approved,,
mt_dial_lev_075c060f,train,44610,DIAL_LEV,غرفة الاسنان الدخان فيها بكون زي,غرفه الاسنان الدخان فيها بكون زي,غرفة الاسنان الدخان فيها بكون زي,[],0,approved,,
mt_msa_3a704f6f,train,8646,MSA,كما يعد المشروع الذي يقام على مساحة مليوني متر مربع وبتكلفة إجمالية تتجاوز ألف مليون ريال,كما يعد المشروع الذي يقام علي مساحه مليوني متر مربع وبتكلفه اجماليه تتجاوز الف مليون ريال,كما يعد المشروع الذي يقام على مساحة مليوني متر مربع وبتكلفة إجمالية تتجاوز ألف مليون ريال,[],0,approved,,
mt_dial_egy_aee061f6,train,82163,DIAL_EGY,شوف يابدرى ياولدى واد عمنا الحضرى ماحترمناش واصل ولا احترم كبيرنا ومشى من رأسه ولولا عبدالواحد فى الزمالك ماهو زى الاسد كان راح اتاوى هناك وطلع لنا لساناته ولو جبته جول على المبادىء يارحمن يارحيم واللى يبيع الأهلى مايلزمناش واصل ولو بكى بدل الدموع دم مش محتاجينه واصل واصل واصل . .,شوف يابدري ياولدي واد عمنا الحضري ماحترمناش واصل ولا احترم كبيرنا ومشي من راسه ولولا عبدالواحد في الزمالك ماهو زي الاسد كان راح اتاوي هناك وطلع لنا لساناته ولو جبته جول علي المباديء يارحمن يارحيم واللي يبيع الاهلي مايلزمناش واصل ولو بكي بدل الدموع دم مش محتاجينه واصل واصل واصل,شوف يابدرى ياولدى واد عمنا [PERSON_1] ماحترمناش واصل ولا احترم كبيرنا ومشى من رأسه ولولا [PERSON_2] فى [ORG_1] ماهو زى الاسد كان راح اتاوى هناك وطلع لنا لساناته ولو جبته جول على المبادىء يارحمن يارحيم واللى يبيع [ORG_2] مايلزمناش واصل ولو بكى بدل الدموع دم مش محتاجينه واصل واصل واصل . .,"[{""start"": 27, ""end"": 33, ""placeholder"": ""[PERSON_1]"", ""surface_form"": ""الحضرى"", ""mask_type"": ""PERSON""}, {""start"": 85, ""end"": 94, ""placeholder"": ""[PERSON_2]"", ""surface_form"": ""عبدالواحد"", ""mask_type"": ""PERSON""}, {""start"": 98, ""end"": 105, ""placeholder"": ""[ORG_1]"", ""surface_form"": ""الزمالك"", ""mask_type"": ""ORG""}, {""start"": 207, ""end"": 213, ""placeholder"": ""[ORG_2]"", ""surface_form"": ""الأهلى"", ""mask_type"": ""ORG""}]",4,approved,,
mt_dial_glf_f57b06df,train,64497,DIAL_GLF,وبنفس الوقت الظاهر مشاهدها قليلة وباقي الوقت تكون فاضيه للزط,وبنفس الوقت الظاهر مشاهدها قليله وباقي الوقت تكون فاضيه للزط,وبنفس الوقت الظاهر مشاهدها قليلة وباقي الوقت تكون فاضيه للزط,[],0,approved,,
mt_msa_9504cb77,train,64793,MSA,ويخلف على اهلهم ويلهمهم الصبر,ويخلف علي اهلهم ويلهمهم الصبر,ويخلف على اهلهم ويلهمهم الصبر,[],0,approved,,
mt_dial_egy_6d4071e9,train,29303,DIAL_EGY,عشنا عمرنا كله نطارد من الاهل بسبب لعب الكرة التى تلهيك عن الدراسة وتجعلك من الفاشلين ودائمى الرسوب وبالطبع هى لعبة لاتستقيم مع التفوق العلمى لان اجادتها تستلزم الممارسة من الصغر ولذا نرى ان الاغلبية من اللاعبين بدون شهادات جامعية وعلى الاكثر اعدادية او دبلوم بعد استنزاف مرات الرسوب واحيانا شهادات جامعية متواضعة جدا من معاهد انتساب او شهادات مشكوك فى صحتها لان المنطق يقول انه لاوقت لدى هذ ه الفئه للانتظام فى تحصيل العلم حيث ان عائد الكرة لا يقارن بالشهادة الجامعية البائسةوالتى يضيع فيها اهم سنوات العطاء لكرة القدم وهذا لايعيب لاعبى كرة القدم . . . ولكن العيب ان تعمل فى مجال الاعلام فالاعلام ليس لعبة تمارسها هذه الفئة لان الاعلام علم وثقافة وسرعة بديهه وله كليات واصول لاتتوفر لدى هذه الفئة التى تجهل اصول اللغة العربية مابالك باللغات الاخرى ومعنى المصلحة العليا للدولة وما هو مسموح وغير مسموح والشاهد على ذلك ما تم فى مباراة الجزائر وما يتم تصديره بشكل يومى من احتقان وتعصب من خلال هؤلاء المهاويس مما يهدد امن الوطن والمواطن وللاسف الجميع يساهم فى هذه الكارثة القادمة لامحال بداية من رجال الاعمال اصحاب هذه القنوات بقصد تحقيق الربح دون النظر لامن الوطن او المواطن مثل قنوات دريم مع ان صاحبها نتوسم فيه العقلانية وكذلك مودرن واحيانا قناة النيل والمصيبة ان كل المذيعون يعلنوا عن انتمائهم الكروى ويقيموا معارك على الهواء ويمنحوا وقت مفتوح لايتاح لاىمسئول لكى يقتحم البيوت ويخدش الحياء والتعصب مثل معارك شوبير ومرتضى والمصيبة ان انضم لهم الصحافة المكتوبة برموز كنا نحترمها وانزلقت لهذا المستنقع من اجل المال جميعهم دون ذكر الاسماء وهذه البرامج اظهت تفاهتهم وتعصبهم الاعمى من اجل المال ! ! ! واسفاه وعليه لابد من اعادة النظر فهذه القنوات وتقنين العمل الاعلامى للفئات التى تستحق العمل فى هذا المجال وشرط المؤهل واللغة واختبارات حقيقية لهذا العمل ويحظر على لاعبى الكرة ممارسة الاعلام وكفاهم ما حققوه من اللعبه وان تعطى المهنة لمستحقيها ( ان يعطى العيش لخبازه ) وعزائى للدكتور علاء ان هذا الزمن زمنم السفهاء والجهله ولصوص هذا الزمان . .,عشنا عمرنا كله نطارد من الاهل بسبب لعب الكره التي تلهيك عن الدراسه وتجعلك من الفاشلين ودايمي الرسوب وبالطبع هي لعبه لاتستقيم مع التفوق العلمي لان اجادتها تستلزم الممارسه من الصغر ولذا نري ان الاغلبيه من اللاعبين بدون شهادات جامعيه وعلي الاكثر اعداديه او دبلوم بعد استنزاف مرات الرسوب واحيانا شهادات جامعيه متواضعه جدا من معاهد انتساب او شهادات مشكوك في صحتها لان المنطق يقول انه لاوقت لدي هذ ه الفيه للانتظام في تحصيل العلم حيث ان عايد الكره لا يقارن بالشهاده الجامعيه البايسهوالتي يضيع فيها اهم سنوات العطاء لكره القدم وهذا لايعيب لاعبي كره القدم ولكن العيب ان تعمل في مجال الاعلام فالاعلام ليس لعبه تمارسها هذه الفيه لان الاعلام علم وثقافه وسرعه بديهه وله كليات واصول لاتتوفر لدي هذه الفيه التي تجهل اصول اللغه العربيه مابالك باللغات الاخري ومعني المصلحه العليا للدوله وما هو مسموح وغير مسموح والشاهد علي ذلك ما تم في مباراه الجزاير وما يتم تصديره بشكل يومي من احتقان وتعصب من خلال هولاء المهاويس مما يهدد امن الوطن والمواطن وللاسف الجميع يساهم في هذه الكارثه القادمه لامحال بدايه من رجال الاعمال اصحاب هذه القنوات بقصد تحقيق الربح دون النظر لامن الوطن او المواطن مثل قنوات دريم مع ان صاحبها نتوسم فيه العقلانيه وكذلك مودرن واحيانا قناه النيل والمصيبه ان كل المذيعون يعلنوا عن انتمايهم الكروي ويقيموا معارك علي الهواء ويمنحوا وقت مفتوح لايتاح لايمسيول لكي يقتحم البيوت ويخدش الحياء والتعصب مثل معارك شوبير ومرتضي والمصيبه ان انضم لهم الصحافه المكتوبه برموز كنا نحترمها وانزلقت لهذا المستنقع من اجل المال جميعهم دون ذكر الاسماء وهذه البرامج اظهت تفاهتهم وتعصبهم الاعمي من اجل المال واسفاه وعليه لابد من اعاده النظر فهذه القنوات وتقنين العمل الاعلامي للفيات التي تستحق العمل في هذا المجال وشرط الموهل واللغه واختبارات حقيقيه لهذا العمل ويحظر علي لاعبي الكره ممارسه الاعلام وكفاهم ما حققوه من اللعبه وان تعطي المهنه لمستحقيها ان يعطي العيش لخبازه وعزايي للدكتور علاء ان هذا الزمن زمنم السفهاء والجهله ولصوص هذا الزمان,عشنا عمرنا كله نطارد من الاهل بسبب لعب الكرة التى تلهيك عن الدراسة وتجعلك من الفاشلين ودائمى الرسوب وبالطبع هى لعبة لاتستقيم مع التفوق العلمى لان اجادتها تستلزم الممارسة من الصغر ولذا نرى ان الاغلبية من اللاعبين بدون شهادات جامعية وعلى الاكثر اعدادية او دبلوم بعد استنزاف مرات الرسوب واحيانا شهادات جامعية متواضعة جدا من معاهد انتساب او شهادات مشكوك فى صحتها لان المنطق يقول انه لاوقت لدى هذ ه الفئه للانتظام فى تحصيل العلم حيث ان عائد الكرة لا يقارن بالشهادة الجامعية البائسةوالتى يضيع فيها اهم سنوات العطاء لكرة القدم وهذا لايعيب لاعبى كرة القدم . . . ولكن العيب ان تعمل فى مجال الاعلام فالاعلام ليس لعبة تمارسها هذه الفئة لان الاعلام علم وثقافة وسرعة بديهه وله كليات واصول لاتتوفر لدى هذه الفئة التى تجهل اصول اللغة العربية مابالك باللغات الاخرى ومعنى المصلحة العليا للدولة وما هو مسموح وغير مسموح والشاهد على ذلك ما تم فى مباراة [LOC_1] وما يتم تصديره بشكل يومى من احتقان وتعصب من خلال هؤلاء المهاويس مما يهدد امن الوطن والمواطن وللاسف الجميع يساهم فى هذه الكارثة القادمة لامحال بداية من رجال الاعمال اصحاب هذه القنوات بقصد تحقيق الربح دون النظر لامن الوطن او المواطن مثل قنوات [ORG_1] مع ان صاحبها نتوسم فيه العقلانية وكذلك [ORG_2] واحيانا قناة [ORG_3] والمصيبة ان كل المذيعون يعلنوا عن انتمائهم الكروى ويقيموا معارك على الهواء ويمنحوا وقت مفتوح لايتاح لاىمسئول لكى يقتحم البيوت ويخدش الحياء والتعصب مثل معارك [PERSON_1] و[PERSON_2] والمصيبة ان انضم لهم الصحافة المكتوبة برموز كنا نحترمها وانزلقت لهذا المستنقع من اجل المال جميعهم دون ذكر الاسماء وهذه البرامج اظهت تفاهتهم وتعصبهم الاعمى من اجل المال ! ! ! واسفاه وعليه لابد من اعادة النظر فهذه القنوات وتقنين العمل الاعلامى للفئات التى تستحق العمل فى هذا المجال وشرط المؤهل واللغة واختبارات حقيقية لهذا العمل ويحظر على لاعبى الكرة ممارسة الاعلام وكفاهم ما حققوه من اللعبه وان تعطى المهنة لمستحقيها ( ان يعطى العيش لخبازه ) وعزائى للدكتور [PERSON_3] ان هذا الزمن زمنم السفهاء والجهله ولصوص هذا الزمان . .,"[{""start"": 833, ""end"": 840, ""placeholder"": ""[LOC_1]"", ""surface_form"": ""الجزائر"", ""mask_type"": ""LOC""}, {""start"": 1082, ""end"": 1086, ""placeholder"": ""[ORG_1]"", ""surface_form"": ""دريم"", ""mask_type"": ""ORG""}, {""start"": 1126, ""end"": 1131, ""placeholder"": ""[ORG_2]"", ""surface_form"": ""مودرن"", ""mask_type"": ""ORG""}, {""start"": 1145, ""end"": 1150, ""placeholder"": ""[ORG_3]"", ""surface_form"": ""النيل"", ""mask_type"": ""ORG""}, {""start"": 1308, ""end"": 1313, ""placeholder"": ""[PERSON_1]"", ""surface_form"": ""شوبير"", ""mask_type"": ""PERSON""}, {""start"": 1315, ""end"": 1320, ""placeholder"": ""[PERSON_2]"", ""surface_form"": ""مرتضى"", ""mask_type"": ""PERSON""}, {""start"": 1777, ""end"": 1781, ""placeholder"": ""[PERSON_3]"", ""surface_form"": ""علاء"", ""mask_type"": ""PERSON""}]",7,approved,,
mt_dial_glf_0a064ae1,train,32313,DIAL_GLF,كفو ياشبية الريح واخوانا الشبابيين يستاهلون كل خير,كفو ياشبيه الريح واخوانا الشبابيين يستاهلون كل خير,كفو ياشبية الريح واخوانا [ORG_1] يستاهلون كل خير,"[{""start"": 25, ""end"": 34, ""placeholder"": ""[ORG_1]"", ""surface_form"": ""الشبابيين"", ""mask_type"": ""ORG""}]",1,approved,,
mt_dial_lev_6ec9a5c9,train,54521,DIAL_LEV,الف الحمد الله على سلامتك اخير ارتاح بال الوالدة بعودتك الله يخليلك ياها ويقومك,الف الحمد الله علي سلامتك اخير ارتاح بال الوالده بعودتك الله يخليلك ياها ويقومك,الف الحمد الله على سلامتك اخير ارتاح بال الوالدة بعودتك الله يخليلك ياها ويقومك,[],0,approved,,
mt_msa_36b3b799,train,54283,MSA,اللهم يا رب ياسامع الصوت ويا مجيب المضطر اذا,اللهم يا رب ياسامع الصوت ويا مجيب المضطر اذا,اللهم يا رب ياسامع الصوت ويا مجيب المضطر اذا,[],0,approved,,
mt_dial_egy_4a073909,train,13573,DIAL_EGY,المشكلة ان الحزب الحاكم حاسس بضعفه قدام البرادعي,المشكله ان الحزب الحاكم حاسس بضعفه قدام البرادعي,المشكلة ان الحزب الحاكم حاسس بضعفه قدام [PERSON_1],"[{""start"": 40, ""end"": 48, ""placeholder"": ""[PERSON_1]"", ""surface_form"": ""البرادعي"", ""mask_type"": ""PERSON""}]",1,approved,,
mt_dial_glf_36418d7c,train,15837,DIAL_GLF,طيب الي مو عاجبه يرجع,طيب الي مو عاجبه يرجع,طيب الي مو عاجبه يرجع,[],0,approved,,
mt_dial_lev_562224c1,train,50478,DIAL_LEV,عنجد الله يعين العرب والله مو ملحقين حروب . . . الخليج طلع مو النا كمان وبعديين ؟ ؟ ؟ مع انه احنا ما بنحب المشاكل والحروب بس بنضطر احياناان شاء الله تنحل سلمي وبلا حرب هالمرة امسحوها,عنجد الله يعين العرب والله مو ملحقين حروب الخليج طلع مو النا كمان وبعديين مع انه احنا ما بنحب المشاكل والحروب بس بنضطر احياناان شاء الله تنحل سلمي وبلا حرب هالمره امسحوها,عنجد الله يعين العرب والله مو ملحقين حروب . . . [LOC_1] طلع مو النا كمان وبعديين ؟ ؟ ؟ مع انه احنا ما بنحب المشاكل والحروب بس بنضطر احياناان شاء الله تنحل سلمي وبلا حرب هالمرة امسحوها,"[{""start"": 48, ""end"": 54, ""placeholder"": ""[LOC_1]"", ""surface_form"": ""الخليج"", ""mask_type"": ""LOC""}]",1,approved,,
mt_msa_95154da5,train,50509,MSA,ياعقيد عبدالرحمن قبل تطبيق نظام ساهر,ياعقيد عبدالرحمن قبل تطبيق نظام ساهر,ياعقيد [PERSON_1] قبل تطبيق نظام [ORG_1],"[{""start"": 7, ""end"": 16, ""placeholder"": ""[PERSON_1]"", ""surface_form"": ""عبدالرحمن"", ""mask_type"": ""PERSON""}, {""start"": 32, ""end"": 36, ""placeholder"": ""[ORG_1]"", ""surface_form"": ""ساهر"", ""mask_type"": ""ORG""}]",2,approved,,
mt_dial_egy_6f932318,train,52531,DIAL_EGY,اللهم انى ادعوك باسمك الاعضم ان تشيل اركان الاسمها نيفين شكرى يحى ياقيوم وتخرس لسنها بحق نبيك محمد ونبيك عيسى,اللهم اني ادعوك باسمك الاعضم ان تشيل اركان الاسمها نيفين شكري يحي ياقيوم وتخرس لسنها بحق نبيك محمد ونبيك عيسي,اللهم انى ادعوك باسمك الاعضم ان تشيل اركان الاسمها [PERSON_1] يحى ياقيوم وتخرس لسنها بحق نبيك [PERSON_2] ونبيك [PERSON_3],"[{""start"": 51, ""end"": 61, ""placeholder"": ""[PERSON_1]"", ""surface_form"": ""نيفين شكرى"", ""mask_type"": ""PERSON""}, {""start"": 94, ""end"": 98, ""placeholder"": ""[PERSON_2]"", ""surface_form"": ""محمد"", ""mask_type"": ""PERSON""}, {""start"": 105, ""end"": 109, ""placeholder"": ""[PERSON_3]"", ""surface_form"": ""عيسى"", ""mask_type"": ""PERSON""}]",3,approved,,
mt_dial_glf_00086582,train,76087,DIAL_GLF,بالتوفيق للزعيم واليث وان شاء الله الشباب الى الدور الثاني وهذي هي الأندية التي ترفع الراس مع عميد الأندية مو مثل الفريق لمهايطي كثير التصريحات ولا نشوفه في البطولات,بالتوفيق للزعيم واليث وان شاء الله الشباب الي الدور الثاني وهذي هي الانديه التي ترفع الراس مع عميد الانديه مو مثل الفريق لمهايطي كثير التصريحات ولا نشوفه في البطولات,بالتوفيق ل[ORG_1] واليث وان شاء الله [ORG_2] الى الدور الثاني وهذي هي الأندية التي ترفع الراس مع عميد الأندية مو مثل الفريق لمهايطي كثير التصريحات ولا نشوفه في البطولات,"[{""start"": 10, ""end"": 15, ""placeholder"": ""[ORG_1]"", ""surface_form"": ""لزعيم"", ""mask_type"": ""ORG""}, {""start"": 35, ""end"": 41, ""placeholder"": ""[ORG_2]"", ""surface_form"": ""الشباب"", ""mask_type"": ""ORG""}]",2,approved,,
mt_dial_lev_fa1b015e,train,30812,DIAL_LEV,بترجا انه ماحد يدخل في القضيه وتركها,بترجا انه ماحد يدخل في القضيه وتركها,بترجا انه ماحد يدخل في القضيه وتركها,[],0,approved,,
mt_msa_2b9d6973,train,80605,MSA,اشجع اي تحالف ان كان فيه صالح البلد حتي تتخلص من احتلال الحزب,اشجع اي تحالف ان كان فيه صالح البلد حتي تتخلص من احتلال الحزب,اشجع اي تحالف ان كان فيه صالح البلد حتي تتخلص من احتلال الحزب,[],0,approved,,
