example_id,source_split,source_row_id,dialect,original_text,normalized_text,masked_text,mask_spans_json,mask_count,annotation_status,annotator_model,notes
mt_dial_egy_9464ba1c,train,2115,DIAL_EGY,ايها المحرر الاهلاوى والى الاهلاوية علشان الاهلى تعادل لازم الزمالك يتعادل او يخسر توفيق السيد حكم ماتش بتروجيت والزمالك واحتسب على الزمالك ضربتى جزاء غير صحيحة ووقت ضائع عشر دقائف وبالمس ضربتى جزاء صححيتين للزمالك لم يحتسبهما وحكم الاهلى والمقاولين لم يحتسب ضربتى جزاء للمقاولين الم يخرج احد شعوره لكل هذا الظلم وفى حالة مايطلبه المحرر الاهلاوى واتحاد الكره الاهلاوى الفاشل فعلى ادارة الزمالك الانسحاب فورا وكفاية ظلم ( سمير زاهر - حازم الهوارى - مجدى عبد الغنى - سحر الهوارى - محمد حسام ) مبرك الدورى,ايها المحرر الاهلاوي والي الاهلاويه علشان الاهلي تعادل لازم الزمالك يتعادل او يخسر توفيق السيد حكم ماتش بتروجيت والزمالك واحتسب علي الزمالك ضربتي جزاء غير صحيحه ووقت ضايع عشر دقايف وبالمس ضربتي جزاء صححيتين للزمالك لم يحتسبهما وحكم الاهلي والمقاولين لم يحتسب ضربتي جزاء للمقاولين الم يخرج احد شعوره لكل هذا الظلم وفي حاله مايطلبه المحرر الاهلاوي واتحاد الكره الاهلاوي الفاشل فعلي اداره الزمالك الانسحاب فورا وكفايه ظلم سمير زاهر حازم الهواري مجدي عبد الغني سحر الهواري محمد حسام مبرك الدوري,ايها المحرر الاهلاوى والى الاهلاوية علشان [ORG_1] تعادل لازم [ORG_2] يتعادل او يخسر [PERSON_1] حكم ماتش [ORG_3] و[ORG_2] واحتسب على [ORG_2] ضربتى جزاء غير صحيحة ووقت ضائع عشر دقائف وبالمس ضربتى جزاء صححيتين للزمالك لم يحتسبهما وحكم [ORG_1] و[ORG_4] لم يحتسب ضربتى جزاء للمقاولين الم يخرج احد شعوره لكل هذا الظلم وفى حالة مايطلبه المحرر الاهلاوى واتحاد الكره الاهلاوى الفاشل فعلى ادارة [ORG_2] الانسحاب فورا وكفاية ظلم ( [PERSON_2] - [PERSON_3] - [PERSON_4] - [PERSON_5] - [PERSON_6] ) مبرك الدورى,"[{""start"": 42, ""end"": 48, ""placeholder"": ""[ORG_1]"", ""surface_form"": ""الاهلى"", ""mask_type"": ""ORG""}, {""start"": 60, ""end"": 67, ""placeholder"": ""[ORG_2]"", ""surface_form"": ""الزمالك"", ""mask_type"": ""ORG""}, {""start"": 83, ""end"": 94, ""placeholder"": ""[PERSON_1]"", ""surface_form"": ""توفيق السيد"", ""mask_type"": ""PERSON""}, {""start"": 104, ""end"": 111, ""placeholder"": ""[ORG_3]"", ""surface_form"": ""بتروجيت"", ""mask_type"": ""ORG""}, {""start"": 113, ""end"": 120, ""placeholder"": ""[ORG_2]"", ""surface_form"": ""الزمالك"", ""mask_type"": ""ORG""}, {""start"": 132, ""end"": 139, ""placeholder"": ""[ORG_2]"", ""surface_form"": ""الزمالك"", ""mask_type"": ""ORG""}, {""start"": 232, ""end"": 238, ""placeholder"": ""[ORG_1]"", ""surface_form"": ""الاهلى"", ""mask_type"": ""ORG""}, {""start"": 240, ""end"": 249, ""placeholder"": ""[ORG_4]"", ""surface_form"": ""المقاولين"", ""mask_type"": ""ORG""}, {""start"": 386, ""end"": 393, ""placeholder"": ""[ORG_2]"", ""surface_form"": ""الزمالك"", ""mask_type"": ""ORG""}, {""start"": 421, ""end"": 430, ""placeholder"": ""[PERSON_2]"", ""surface_form"": ""سمير زاهر"", ""mask_type"": ""PERSON""}, {""start"": 433, ""end"": 445, ""placeholder"": ""[PERSON_3]"", ""surface_form"": ""حازم الهوارى"", ""mask_type"": ""PERSON""}, {""start"": 448, ""end"": 462, ""placeholder"": ""[PERSON_4]"", ""surface_form"": ""مجدى عبد الغنى"", ""mask_type"": ""PERSON""}, {""start"": 465, ""end"": 476, ""placeholder"": ""[PERSON_5]"", ""surface_form"": ""سحر الهوارى"", ""mask_type"": ""PERSON""}, {""start"": 479, ""end"": 488, ""placeholder"": ""[PERSON_6]"", ""surface_form"": ""محمد حسام"", ""mask_type"": ""PERSON""}]",14,approved,,
mt_dial_lev_96ac0556,train,57911,DIAL_LEV,لواء القصر مش تابع للأردن والكرك ليش ما ظهر اله,لواء القصر مش تابع للاردن والكرك ليش ما ظهر اله,لواء القصر مش تابع ل[LOC_1] و[LOC_2] ليش ما ظهر اله,"[{""start"": 20, ""end"": 25, ""placeholder"": ""[LOC_1]"", ""surface_form"": ""لأردن"", ""mask_type"": ""LOC""}, {""start"": 27, ""end"": 32, ""placeholder"": ""[LOC_2]"", ""surface_form"": ""الكرك"", ""mask_type"": ""LOC""}]",2,approved,,
mt_msa_ff57a6d6,train,27682,MSA,اللهم ألحقهم بإبينا إبراهيم في,اللهم الحقهم بابينا ابراهيم في,اللهم ألحقهم بإبينا [PERSON_1] في,"[{""start"": 20, ""end"": 27, ""placeholder"": ""[PERSON_1]"", ""surface_form"": ""إبراهيم"", ""mask_type"": ""PERSON""}]",1,approved,,
mt_dial_egy_cb74d51e,train,55017,DIAL_EGY,الى صاحب التعليق رقم 14 فعلا الاعور وسط العميان ملك . . فقط اضيف ان الاعور افضل حالا من الاعمى . . وقد قالها المرحوم صالح سليم ان الاهلى يفوز بالدورى لانه لا يوجد من يريد ان يفوز به . .,الي صاحب التعليق رقم 14 فعلا الاعور وسط العميان ملك فقط اضيف ان الاعور افضل حالا من الاعمي وقد قالها المرحوم صالح سليم ان الاهلي يفوز بالدوري لانه لا يوجد من يريد ان يفوز به,الى صاحب التعليق رقم [NUM_1] فعلا الاعور وسط العميان ملك . . فقط اضيف ان الاعور افضل حالا من الاعمى . . وقد قالها المرحوم [PERSON_1] ان [ORG_1] يفوز بالدورى لانه لا يوجد من يريد ان يفوز به . .,"[{""start"": 21, ""end"": 23, ""placeholder"": ""[NUM_1]"", ""surface_form"": ""14"", ""mask_type"": ""NUM""}, {""start"": 117, ""end"": 126, ""placeholder"": ""[PERSON_1]"", ""surface_form"": ""صالح سليم"", ""mask_type"": ""PERSON""}, {""start"": 130, ""end"": 136, ""placeholder"": ""[ORG_1]"", ""surface_form"": ""الاهلى"", ""mask_type"": ""ORG""}]",3,approved,,
mt_dial_glf_856870c8,train,17159,DIAL_GLF,بالتوفيق لنادي الشباب وكل الشكر لرئيس نادي الهلال وربي كفو وفوق مستوى سطحيات العقول وأجسام العجول . . !,بالتوفيق لنادي الشباب وكل الشكر لرييس نادي الهلال وربي كفو وفوق مستوي سطحيات العقول واجسام العجول,بالتوفيق لنادي [ORG_1] وكل الشكر لرئيس نادي [ORG_2] وربي كفو وفوق مستوى سطحيات العقول وأجسام العجول . . !,"[{""start"": 15, ""end"": 21, ""placeholder"": ""[ORG_1]"", ""surface_form"": ""الشباب"", ""mask_type"": ""ORG""}, {""start"": 43, ""end"": 49, ""placeholder"": ""[ORG_2]"", ""surface_form"": ""الهلال"", ""mask_type"": ""ORG""}]",2,approved,,
mt_dial_lev_0dbeac2e,train,7186,DIAL_LEV,خبر جميل جدا وانشاء الله نصير نلبس الدشداش الابيض ونركب جيمس وما نسأل عن البنزين ونصير اصحاب اكبر دخل في العالم تخيلوا لما يصير الاردني صاحب اعلى دخل في العالم على قولة جدي اللي ما شفتو ( ( الوضع راح يصير جخه ) ) انشاء الله وبستاهل المواطن الاردني انه يكون,خبر جميل جدا وانشاء الله نصير نلبس الدشداش الابيض ونركب جيمس وما نسال عن البنزين ونصير اصحاب اكبر دخل في العالم تخيلوا لما يصير الاردني صاحب اعلي دخل في العالم علي قوله جدي اللي ما شفتو الوضع راح يصير جخه انشاء الله وبستاهل المواطن الاردني انه يكون,خبر جميل جدا وانشاء الله نصير نلبس الدشداش الابيض ونركب جيمس وما نسأل عن البنزين ونصير اصحاب اكبر دخل في العالم تخيلوا لما يصير الاردني صاحب اعلى دخل في العالم على قولة جدي اللي ما شفتو ( ( الوضع راح يصير جخه ) ) انشاء الله وبستاهل المواطن الاردني انه يكون,[],0,approved,,
mt_msa_30f69f7a,train,22944,MSA,ونجحو فى ذالك وحصلو على بطولات غير مستحقه,ونجحو في ذالك وحصلو علي بطولات غير مستحقه,ونجحو فى ذالك وحصلو على بطولات غير مستحقه,[],0,approved,,
mt_dial_egy_1250b14c,train,51284,DIAL_EGY,جدع والله علشان تنفي الكلام العبيط بتاع,جدع والله علشان تنفي الكلام العبيط بتاع,جدع والله علشان تنفي الكلام العبيط بتاع,[],0,approved,,
mt_dial_lev_7c212981,train,59187,DIAL_LEV,سبحان الله مافي رد عربي النوم في,سبحان الله مافي رد عربي النوم في,سبحان الله مافي رد عربي النوم في,[],0,approved,,
mt_msa_22e3fc4b,train,5945,MSA,وقيمته المنصفه 2222 ريال مازاد,وقيمته المنصفه 2222 ريال مازاد,وقيمته المنصفه [NUM_1] ريال مازاد,"[{""start"": 15, ""end"": 19, ""placeholder"": ""[NUM_1]"", ""surface_form"": ""2222"", ""mask_type"": ""NUM""}]",1,approved,,
mt_dial_egy_a051bdd1,train,40031,DIAL_EGY,خليكم في وكركم لانكم تريدون ان تبقوا انتم في السماء,خليكم في وكركم لانكم تريدون ان تبقوا انتم في السماء,خليكم في وكركم لانكم تريدون ان تبقوا انتم في السماء,[],0,approved,,
mt_msa_628c6f0a,train,58726,MSA,اتركوا عنكم التعصب ابن همام لم يضرنا بشي دائماً نرمي عيوبنا واخفاقاتنا على,اتركوا عنكم التعصب ابن همام لم يضرنا بشي دايما نرمي عيوبنا واخفاقاتنا علي,اتركوا عنكم التعصب [PERSON_1] لم يضرنا بشي دائماً نرمي عيوبنا واخفاقاتنا على,"[{""start"": 19, ""end"": 27, ""placeholder"": ""[PERSON_1]"", ""surface_form"": ""ابن همام"", ""mask_type"": ""PERSON""}]",1,approved,,
mt_dial_egy_b8b4d8a9,train,53522,DIAL_EGY,ثانياً الأمن مشغول بالجامعات و الفيس بوك و مؤيدين البرادعي و مش فاضي للعب العيال بتاعكم,ثانيا الامن مشغول بالجامعات و الفيس بوك و مويدين البرادعي و مش فاضي للعب العيال بتاعكم,ثانياً الأمن مشغول بالجامعات و [ORG_1] و مؤيدين [PERSON_1] و مش فاضي للعب العيال بتاعكم,"[{""start"": 31, ""end"": 40, ""placeholder"": ""[ORG_1]"", ""surface_form"": ""الفيس بوك"", ""mask_type"": ""ORG""}, {""start"": 50, ""end"": 58, ""placeholder"": ""[PERSON_1]"", ""surface_form"": ""البرادعي"", ""mask_type"": ""PERSON""}]",2,approved,,
mt_dial_glf_84427164,train,18935,DIAL_GLF,بس كل الحكايه . . مشغولين دراسه وعمل,بس كل الحكايه مشغولين دراسه وعمل,بس كل الحكايه . . مشغولين دراسه وعمل,[],0,approved,,
mt_dial_lev_bbd20bee,train,37467,DIAL_LEV,ايش ما بدكو احكو المهم والاهم اخذناه وهو . . . 0,ايش ما بدكو احكو المهم والاهم اخذناه وهو 0,ايش ما بدكو احكو المهم والاهم اخذناه وهو . . . 0,[],0,approved,,
mt_msa_da8ef143,train,43451,MSA,يارب انصر نصرك العالمي ورد كيدهم الزعيقيه في,يارب انصر نصرك العالمي ورد كيدهم الزعيقيه في,يارب انصر [ORG_1] العالمي ورد كيدهم الزعيقيه في,"[{""start"": 10, ""end"": 14, ""placeholder"": ""[ORG_1]"", ""surface_form"": ""نصرك"", ""mask_type"": ""ORG""}]",1,approved,,
