example_id,source_split,source_row_id,dialect,original_text,normalized_text,masked_text,mask_spans_json,mask_count,annotation_status,annotator_model,notes
mt_dial_lev_b4cd06da,train,5700,DIAL_LEV,انا الي تجارب معهم . . قتلو ابوي قبل هيك بابره غلط وما حدا سالهم ليش او,انا الي تجارب معهم قتلو ابوي قبل هيك بابره غلط وما حدا سالهم ليش او,انا الي تجارب معهم . . قتلو ابوي قبل هيك بابره غلط وما حدا سالهم ليش او,[],0,approved,,
mt_msa_f19ec620,train,4103,MSA,نظرا للمساعدات التي تقدمها امريكا لدول البؤر الساخنه في العالم وما يمثله الاردن من استقرار وتعاون في المنظومه,نظرا للمساعدات التي تقدمها امريكا لدول البور الساخنه في العالم وما يمثله الاردن من استقرار وتعاون في المنظومه,نظرا للمساعدات التي تقدمها [LOC_1] لدول البؤر الساخنه في العالم وما يمثله [LOC_2] من استقرار وتعاون في المنظومه,"[{""start"": 27, ""end"": 33, ""placeholder"": ""[LOC_1]"", ""surface_form"": ""امريكا"", ""mask_type"": ""LOC""}, {""start"": 73, ""end"": 79, ""placeholder"": ""[LOC_2]"", ""surface_form"": ""الاردن"", ""mask_type"": ""LOC""}]",2,approved,,
mt_dial_egy_94ab2030,train,23552,DIAL_EGY,قريب هتلاقيه يرفع ضرائب علي عدد الابناء في حد في الدنيا عاقل يخلي واحد يهودي يمسك بيت مال المسلمين حسبي الله ونعم,قريب هتلاقيه يرفع ضرايب علي عدد الابناء في حد في الدنيا عاقل يخلي واحد يهودي يمسك بيت مال المسلمين حسبي الله ونعم,قريب هتلاقيه يرفع ضرائب علي عدد الابناء في حد في الدنيا عاقل يخلي واحد يهودي يمسك بيت مال المسلمين حسبي الله ونعم,[],0,approved,,
mt_dial_glf_f2b99365,train,33871,DIAL_GLF,انا متفائل ان النصر بيفوز بنتيجه,انا متفايل ان النصر بيفوز بنتيجه,انا متفائل ان [ORG_1] بيفوز بنتيجه,"[{""start"": 14, ""end"": 19, ""placeholder"": ""[ORG_1]"", ""surface_form"": ""النصر"", ""mask_type"": ""ORG""}]",1,approved,,
mt_dial_lev_9127be07,train,52778,DIAL_LEV,اما الموظفين الذين تم انهاء خدماته في مياهنا فكان الامر تصفية حسابات ومزاجية ولو ان الامر تم على ضعف الاداء فكان الاولى ان يتم انهاء خدمات موظف ثبتت عليه الرشاوي والتلاعب بالعدادات والاعتراضات وتلقي رشاوي من متعهدين وناس شطبوا,اما الموظفين الذين تم انهاء خدماته في مياهنا فكان الامر تصفيه حسابات ومزاجيه ولو ان الامر تم علي ضعف الاداء فكان الاولي ان يتم انهاء خدمات موظف ثبتت عليه الرشاوي والتلاعب بالعدادات والاعتراضات وتلقي رشاوي من متعهدين وناس شطبوا,اما الموظفين الذين تم انهاء خدماته في [ORG_1] فكان الامر تصفية حسابات ومزاجية ولو ان الامر تم على ضعف الاداء فكان الاولى ان يتم انهاء خدمات موظف ثبتت عليه الرشاوي والتلاعب بالعدادات والاعتراضات وتلقي رشاوي من متعهدين وناس شطبوا,"[{""start"": 38, ""end"": 44, ""placeholder"": ""[ORG_1]"", ""surface_form"": ""مياهنا"", ""mask_type"": ""ORG""}]",1,approved,,
mt_msa_926c2511,train,48510,MSA,وتقوم الدول الغربيه بحماية هذا الكيان,وتقوم الدول الغربيه بحمايه هذا الكيان,وتقوم الدول الغربيه بحماية هذا الكيان,[],0,approved,,
mt_dial_egy_25c59b84,train,18822,DIAL_EGY,غريب تعليق مايكل التعليق الثالث كاتب الله اكبر هو انت مسلم ولا مسيحى ولا,غريب تعليق مايكل التعليق الثالث كاتب الله اكبر هو انت مسلم ولا مسيحي ولا,غريب تعليق [PERSON_1] التعليق الثالث كاتب الله اكبر هو انت مسلم ولا مسيحى ولا,"[{""start"": 11, ""end"": 16, ""placeholder"": ""[PERSON_1]"", ""surface_form"": ""مايكل"", ""mask_type"": ""PERSON""}]",1,approved,,
mt_msa_67c0cf6d,train,46925,MSA,لو مشيت بالحلال اقضل وكان المفروض الطلاق وهو ابغض الحلال . ولكن الله يرحمها ويصبر اهلهاوالطفل المسكين ماذا جني من هذه الجريمةمن اهل,لو مشيت بالحلال اقضل وكان المفروض الطلاق وهو ابغض الحلال ولكن الله يرحمها ويصبر اهلهاوالطفل المسكين ماذا جني من هذه الجريمهمن اهل,لو مشيت بالحلال اقضل وكان المفروض الطلاق وهو ابغض الحلال . ولكن الله يرحمها ويصبر اهلهاوالطفل المسكين ماذا جني من هذه الجريمةمن اهل,[],0,approved,,
mt_dial_egy_95d4957e,train,6222,DIAL_EGY,سيكون الفرصة اقوى لجمال ناصر الفقراء اللى حضرتك تريده,سيكون الفرصه اقوي لجمال ناصر الفقراء اللي حضرتك تريده,سيكون الفرصة اقوى ل[PERSON_1] ناصر الفقراء اللى حضرتك تريده,"[{""start"": 19, ""end"": 23, ""placeholder"": ""[PERSON_1]"", ""surface_form"": ""جمال"", ""mask_type"": ""PERSON""}]",1,approved,,
mt_dial_glf_9f1939b1,train,56073,DIAL_GLF,وعندما لاتكون موظف وش تسوي ؟ ؟,وعندما لاتكون موظف وش تسوي,وعندما لاتكون موظف وش تسوي ؟ ؟,[],0,approved,,
mt_dial_lev_e0645828,train,66575,DIAL_LEV,"مبروك للوحدات وهردلك للرمثا المتطور , , , ولا عزاء للثلاثي المرح",مبروك للوحدات وهردلك للرمثا المتطور ولا عزاء للثلاثي المرح,"مبروك ل[ORG_1] وهردلك ل[ORG_2] المتطور , , , ولا عزاء للثلاثي المرح","[{""start"": 7, ""end"": 13, ""placeholder"": ""[ORG_1]"", ""surface_form"": ""لوحدات"", ""mask_type"": ""ORG""}, {""start"": 22, ""end"": 27, ""placeholder"": ""[ORG_2]"", ""surface_form"": ""لرمثا"", ""mask_type"": ""ORG""}]",2,approved,,
mt_msa_ae784b24,train,38768,MSA,رغم أننى لا أقرأ لك كما لا أقرأ لكثير فى جريدة اليوم السابع الحبيبة إلا ان عنوانك اليوم إستوقفنى وكم تمنيت ان تكتب هذا الموضوع فى جريدة أخرى كى لا يتهمك احد بالنفاق والتملق ولكن كل واحد حر,رغم انني لا اقرا لك كما لا اقرا لكثير في جريده اليوم السابع الحبيبه الا ان عنوانك اليوم استوقفني وكم تمنيت ان تكتب هذا الموضوع في جريده اخري كي لا يتهمك احد بالنفاق والتملق ولكن كل واحد حر,رغم أننى لا أقرأ لك كما لا أقرأ لكثير فى [ORG_1] الحبيبة إلا ان عنوانك اليوم إستوقفنى وكم تمنيت ان تكتب هذا الموضوع فى جريدة أخرى كى لا يتهمك احد بالنفاق والتملق ولكن كل واحد حر,"[{""start"": 41, ""end"": 59, ""placeholder"": ""[ORG_1]"", ""surface_form"": ""جريدة اليوم السابع"", ""mask_type"": ""ORG""}]",1,approved,,
mt_dial_egy_27f7ffb3,train,28981,DIAL_EGY,اي قصه يكون فيها زكريا بطرس بتكون تأليف,اي قصه يكون فيها زكريا بطرس بتكون تاليف,اي قصه يكون فيها [PERSON_1] [PERSON_2] بتكون تأليف,"[{""start"": 17, ""end"": 22, ""placeholder"": ""[PERSON_1]"", ""surface_form"": ""زكريا"", ""mask_type"": ""PERSON""}, {""start"": 23, ""end"": 27, ""placeholder"": ""[PERSON_2]"", ""surface_form"": ""بطرس"", ""mask_type"": ""PERSON""}]",2,approved,,
mt_dial_glf_e981636c,train,76377,DIAL_GLF,كل هالمشاكل بسبب منع النساء من قيادة السيارة ولا استبعد من وجود تحرشات جنسية من بائعي جميع المستلزمات النسائية سواء ملابس او اكسسوارات او عطورات وغيرها لذا اطالب بالاستغناء عن الاجانب وكل الرجال الذين يعملون في خدمة النساء . والسماح للنساء في مزاولة جميع الانشطة التي تتعلق بهم أسوة بجميع الدول العربية والاوربية,كل هالمشاكل بسبب منع النساء من قياده السياره ولا استبعد من وجود تحرشات جنسيه من بايعي جميع المستلزمات النساييه سواء ملابس او اكسسوارات او عطورات وغيرها لذا اطالب بالاستغناء عن الاجانب وكل الرجال الذين يعملون في خدمه النساء والسماح للنساء في مزاوله جميع الانشطه التي تتعلق بهم اسوه بجميع الدول العربيه والاوربيه,كل هالمشاكل بسبب منع النساء من قيادة السيارة ولا استبعد من وجود تحرشات جنسية من بائعي جميع المستلزمات النسائية سواء ملابس او اكسسوارات او عطورات وغيرها لذا اطالب بالاستغناء عن الاجانب وكل الرجال الذين يعملون في خدمة النساء . والسماح للنساء في مزاولة جميع الانشطة التي تتعلق بهم أسوة بجميع الدول العربية والاوربية,[],0,approved,,
mt_dial_lev_027d259a,train,75834,DIAL_LEV,اقتسم القطبين الالقاب المحلية ونادي شباب الاردن والرمثا بقو متفرجين بهذه البطولات . . . بس الفطبول عنا تغير وصرنا نشوف تنافس اشد بين القطبين . . . بالنسبة لقلة الحضور الجماهيري سببه معاملة الدرك استاذ,اقتسم القطبين الالقاب المحليه ونادي شباب الاردن والرمثا بقو متفرجين بهذه البطولات بس الفطبول عنا تغير وصرنا نشوف تنافس اشد بين القطبين بالنسبه لقله الحضور الجماهيري سببه معامله الدرك استاذ,اقتسم القطبين الالقاب المحلية ونادي [ORG_1] و[ORG_2] بقو متفرجين بهذه البطولات . . . بس الفطبول عنا تغير وصرنا نشوف تنافس اشد بين القطبين . . . بالنسبة لقلة الحضور الجماهيري سببه معاملة [ORG_3] استاذ,"[{""start"": 36, ""end"": 47, ""placeholder"": ""[ORG_1]"", ""surface_form"": ""شباب الاردن"", ""mask_type"": ""ORG""}, {""start"": 49, ""end"": 55, ""placeholder"": ""[ORG_2]"", ""surface_form"": ""الرمثا"", ""mask_type"": ""ORG""}, {""start"": 189, ""end"": 194, ""placeholder"": ""[ORG_3]"", ""surface_form"": ""الدرك"", ""mask_type"": ""ORG""}]",3,approved,,
mt_msa_aa92ac43,train,82090,MSA,وأعتقد ان الضرر لا نرضاه لأهل حينا ولا لغيرنا من الأحياء فيجب إبعاد أماكن التفريغ عن داخل المدينة والمناطق السكنية,واعتقد ان الضرر لا نرضاه لاهل حينا ولا لغيرنا من الاحياء فيجب ابعاد اماكن التفريغ عن داخل المدينه والمناطق السكنيه,وأعتقد ان الضرر لا نرضاه لأهل حينا ولا لغيرنا من الأحياء فيجب إبعاد أماكن التفريغ عن داخل المدينة والمناطق السكنية,[],0,approved,,
mt_dial_egy_967bb8fa,train,23673,DIAL_EGY,مصر تستطيع الدفاع عن نفسها يا ع . وأسئل عن مصر والمصريين ماذا فعلوا فى أكتوبر 73 أسئل بتوع نصف الثمن ه القريب الدم,مصر تستطيع الدفاع عن نفسها يا ع واسيل عن مصر والمصريين ماذا فعلوا في اكتوبر 73 اسيل بتوع نصف الثمن ه القريب الدم,[LOC_1] تستطيع الدفاع عن نفسها يا [PERSON_1] . وأسئل عن [LOC_1] والمصريين ماذا فعلوا فى [DATE_1] أسئل بتوع نصف الثمن ه القريب الدم,"[{""start"": 0, ""end"": 3, ""placeholder"": ""[LOC_1]"", ""surface_form"": ""مصر"", ""mask_type"": ""LOC""}, {""start"": 30, ""end"": 31, ""placeholder"": ""[PERSON_1]"", ""surface_form"": ""ع"", ""mask_type"": ""PERSON""}, {""start"": 43, ""end"": 46, ""placeholder"": ""[LOC_1]"", ""surface_form"": ""مصر"", ""mask_type"": ""LOC""}, {""start"": 71, ""end"": 80, ""placeholder"": ""[DATE_1]"", ""surface_form"": ""أكتوبر 73"", ""mask_type"": ""DATE""}]",4,approved,,
mt_dial_glf_0f76e27e,train,33376,DIAL_GLF,لكن شكل همتها وطموحها حدوده ابعد مما يتخيل,لكن شكل همتها وطموحها حدوده ابعد مما يتخيل,لكن شكل همتها وطموحها حدوده ابعد مما يتخيل,[],0,approved,,
mt_dial_lev_13fa8644,train,81307,DIAL_LEV,وبعدين طلاب ال 48 ما الهم غير الجامعات الأردنيه يدرسوا فيها وعلى حساب جمعيه نجمة داوود وهادول شو رح تعمل فيهم ؟ وين يروحوا يدرسوا ومين برأيك رح يدرس الطلاب العرب هناك,وبعدين طلاب ال 48 ما الهم غير الجامعات الاردنيه يدرسوا فيها وعلي حساب جمعيه نجمه داوود وهادول شو رح تعمل فيهم وين يروحوا يدرسوا ومين برايك رح يدرس الطلاب العرب هناك,وبعدين طلاب ال [NUM_1] ما الهم غير الجامعات الأردنيه يدرسوا فيها وعلى حساب [ORG_1] وهادول شو رح تعمل فيهم ؟ وين يروحوا يدرسوا ومين برأيك رح يدرس الطلاب العرب هناك,"[{""start"": 15, ""end"": 17, ""placeholder"": ""[NUM_1]"", ""surface_form"": ""48"", ""mask_type"": ""NUM""}, {""start"": 70, ""end"": 86, ""placeholder"": ""[ORG_1]"", ""surface_form"": ""جمعيه نجمة داوود"", ""mask_type"": ""ORG""}]",2,approved,,
mt_msa_d4597de4,train,78179,MSA,الواجب ان ننظر في مايهم امور امتنا وصالح ديننا وأن ندفع الفساد والشبه وأن نفتح أي ثغرة لضعاف النفوس وخصوصاً واقع شباب امتنا والله الهادي إلى سواء,الواجب ان ننظر في مايهم امور امتنا وصالح ديننا وان ندفع الفساد والشبه وان نفتح اي ثغره لضعاف النفوس وخصوصا واقع شباب امتنا والله الهادي الي سواء,الواجب ان ننظر في مايهم امور امتنا وصالح ديننا وأن ندفع الفساد والشبه وأن نفتح أي ثغرة لضعاف النفوس وخصوصاً واقع شباب امتنا والله الهادي إلى سواء,[],0,approved,,
mt_dial_egy_79ed97b0,train,56581,DIAL_EGY,والله اللى اختشوا ماتوا الست ميهتاب وغيره من الزمالكوية اللى بيشجع تشجيع اعمى ومن وجهة نظرى لو الزمالك لبس فانلة حمرة مش ايشجعوه العفريت والبعبع ابتاعهم الاهلى كل مشكلة الاهلى هوه السبب يا ناس اختشوا على دمكم دا الاهلى الاول من بداية البطولة وانتوا فين من خمس سنوات الاهلى برضه بيرشى الحكام من خمس سنوات والشماعة دى مش اتقع علطول موجودة وابراهيم اللى المفروض يعينوه على اسطبل مش منسق ولاء عموما فى النهاية اتعلموا شوية من فريق البطولات وقلكم ريحوا وبالكم وخبوا عيالكم والبعبع جالكم ولا عزاء الا للحاقدين,والله اللي اختشوا ماتوا الست ميهتاب وغيره من الزمالكويه اللي بيشجع تشجيع اعمي ومن وجهه نظري لو الزمالك لبس فانله حمره مش ايشجعوه العفريت والبعبع ابتاعهم الاهلي كل مشكله الاهلي هوه السبب يا ناس اختشوا علي دمكم دا الاهلي الاول من بدايه البطوله وانتوا فين من خمس سنوات الاهلي برضه بيرشي الحكام من خمس سنوات والشماعه دي مش اتقع علطول موجوده وابراهيم اللي المفروض يعينوه علي اسطبل مش منسق ولاء عموما في النهايه اتعلموا شويه من فريق البطولات وقلكم ريحوا وبالكم وخبوا عيالكم والبعبع جالكم ولا عزاء الا للحاقدين,والله اللى اختشوا ماتوا الست [PERSON_1] وغيره من الزمالكوية اللى بيشجع تشجيع اعمى ومن وجهة نظرى لو [ORG_1] لبس فانلة حمرة مش ايشجعوه العفريت والبعبع ابتاعهم [ORG_2] كل مشكلة [ORG_2] هوه السبب يا ناس اختشوا على دمكم دا [ORG_2] الاول من بداية البطولة وانتوا فين من [NUM_1] سنوات [ORG_2] برضه بيرشى الحكام من [NUM_1] سنوات والشماعة دى مش اتقع علطول موجودة و[PERSON_2] اللى المفروض يعينوه على اسطبل مش منسق ولاء عموما فى النهاية اتعلموا شوية من فريق البطولات وقلكم ريحوا وبالكم وخبوا عيالكم والبعبع جالكم ولا عزاء الا للحاقدين,"[{""start"": 29, ""end"": 35, ""placeholder"": ""[PERSON_1]"", ""surface_form"": ""ميهتاب"", ""mask_type"": ""PERSON""}, {""start"": 95, ""end"": 102, ""placeholder"": ""[ORG_1]"", ""surface_form"": ""الزمالك"", ""mask_type"": ""ORG""}, {""start"": 153, ""end"": 159, ""placeholder"": ""[ORG_2]"", ""surface_form"": ""الاهلى"", ""mask_type"": ""ORG""}, {""start"": 169, ""end"": 175, ""placeholder"": ""[ORG_2]"", ""surface_form"": ""الاهلى"", ""mask_type"": ""ORG""}, {""start"": 212, ""end"": 218, ""placeholder"": ""[ORG_2]"", ""surface_form"": ""الاهلى"", ""mask_type"": ""ORG""}, {""start"": 256, ""end"": 259, ""placeholder"": ""[NUM_1]"", ""surface_form"": ""خمس"", ""mask_type"": ""NUM""}, {""start"": 266, ""end"": 272, ""placeholder"": ""[ORG_2]"", ""surface_form"": ""الاهلى"", ""mask_type"": ""ORG""}, {""start"": 294, ""end"": 297, ""placeholder"": ""[NUM_1]"", ""surface_form"": ""خمس"", ""mask_type"": ""NUM""}, {""start"": 338, ""end"": 345, ""placeholder"": ""[PERSON_2]"", ""surface_form"": ""ابراهيم"", ""mask_type"": ""PERSON""}]",9,approved,,
mt_dial_glf_2d341e2b,train,76709,DIAL_GLF,وين الرادع ؟ مافيه . وانت الله يهديك تنزل وتخلي بنيتك في السيارة لحالها وهي تشتغل بعد,وين الرادع مافيه وانت الله يهديك تنزل وتخلي بنيتك في السياره لحالها وهي تشتغل بعد,وين الرادع ؟ مافيه . وانت الله يهديك تنزل وتخلي بنيتك في السيارة لحالها وهي تشتغل بعد,[],0,approved,,
mt_dial_lev_89b5b91e,train,43473,DIAL_LEV,بس نفسي اعرف ليش البنت ضلت ساكته خمس سنين لازم نلاقي حل للخوف اللي جواناعشان ماحدا يقدر يظلمنا حتى اقرب الناس,بس نفسي اعرف ليش البنت ضلت ساكته خمس سنين لازم نلاقي حل للخوف اللي جواناعشان ماحدا يقدر يظلمنا حتي اقرب الناس,بس نفسي اعرف ليش البنت ضلت ساكته [NUM_1] سنين لازم نلاقي حل للخوف اللي جواناعشان ماحدا يقدر يظلمنا حتى اقرب الناس,"[{""start"": 33, ""end"": 36, ""placeholder"": ""[NUM_1]"", ""surface_form"": ""خمس"", ""mask_type"": ""NUM""}]",1,approved,,
mt_msa_f4dee41e,train,84267,MSA,يارب ان كان بريئا فأظهر برائته واشغل الحاقدين والشامتين في عيوبهم انك علي ذلك لقدير,يارب ان كان برييا فاظهر برايته واشغل الحاقدين والشامتين في عيوبهم انك علي ذلك لقدير,يارب ان كان بريئا فأظهر برائته واشغل الحاقدين والشامتين في عيوبهم انك علي ذلك لقدير,[],0,approved,,
mt_dial_glf_912bd475,train,43324,DIAL_GLF,مصيبة كبيره . . . عضل البنات . . لافرق لعربي على أعجمي الا بالتقوى . . زوجوا بناتكم بالكفؤ اللي يخاف الله ولا تنظروا للحسب والنسب فأن الله سيحاسبكم علىهذا,مصيبه كبيره عضل البنات لافرق لعربي علي اعجمي الا بالتقوي زوجوا بناتكم بالكفو اللي يخاف الله ولا تنظروا للحسب والنسب فان الله سيحاسبكم عليهذا,مصيبة كبيره . . . عضل البنات . . لافرق لعربي على أعجمي الا بالتقوى . . زوجوا بناتكم بالكفؤ اللي يخاف الله ولا تنظروا للحسب والنسب فأن الله سيحاسبكم علىهذا,[],0,approved,,
mt_dial_lev_38461a13,train,66373,DIAL_LEV,"تعادل ايجابي وعلى ملعبهم يعني فوز . شباب ابطال وبيضو الوجه , الله يوفقهم . .",تعادل ايجابي وعلي ملعبهم يعني فوز شباب ابطال وبيضو الوجه الله يوفقهم,"تعادل ايجابي وعلى ملعبهم يعني فوز . شباب ابطال وبيضو الوجه , الله يوفقهم . .",[],0,approved,,
mt_msa_48459809,train,59391,MSA,اي مستوى رائع فعله الفيصلي صدقني لاعب واحد حمزه الدردور دوخ دفاعات الفيصلي و افلت الفيصلي من هزيمة نكراء,اي مستوي رايع فعله الفيصلي صدقني لاعب واحد حمزه الدردور دوخ دفاعات الفيصلي و افلت الفيصلي من هزيمه نكراء,اي مستوى رائع فعله [ORG_1] صدقني لاعب واحد [PERSON_1] [PERSON_2] دوخ دفاعات [ORG_1] و افلت [ORG_1] من هزيمة نكراء,"[{""start"": 19, ""end"": 26, ""placeholder"": ""[ORG_1]"", ""surface_form"": ""الفيصلي"", ""mask_type"": ""ORG""}, {""start"": 43, ""end"": 47, ""placeholder"": ""[PERSON_1]"", ""surface_form"": ""حمزه"", ""mask_type"": ""PERSON""}, {""start"": 48, ""end"": 55, ""placeholder"": ""[PERSON_2]"", ""surface_form"": ""الدردور"", ""mask_type"": ""PERSON""}, {""start"": 67, ""end"": 74, ""placeholder"": ""[ORG_1]"", ""surface_form"": ""الفيصلي"", ""mask_type"": ""ORG""}, {""start"": 82, ""end"": 89, ""placeholder"": ""[ORG_1]"", ""surface_form"": ""الفيصلي"", ""mask_type"": ""ORG""}]",5,approved,,
mt_dial_egy_47ee87ce,train,64324,DIAL_EGY,هي الدنيا ما بقاش فيها إلا الدولتين,هي الدنيا ما بقاش فيها الا الدولتين,هي الدنيا ما بقاش فيها إلا الدولتين,[],0,approved,,
mt_dial_glf_87725e31,train,8580,DIAL_GLF,أو الضغوط القوية وصلتكم انت,او الضغوط القويه وصلتكم انت,أو الضغوط القوية وصلتكم انت,[],0,approved,,
mt_dial_lev_ab235e3c,train,53263,DIAL_LEV,الله يرحمهم برحمتو يارب وما تحطو الحق على الكوادر,الله يرحمهم برحمتو يارب وما تحطو الحق علي الكوادر,الله يرحمهم برحمتو يارب وما تحطو الحق على الكوادر,[],0,approved,,
mt_msa_8045d143,train,83508,MSA,التجربة تؤكد أن الاخوة الجزائريين على حق والاعتراف بالحق فضيلة والأخوين يجب وضع حد,التجربه توكد ان الاخوه الجزايريين علي حق والاعتراف بالحق فضيله والاخوين يجب وضع حد,التجربة تؤكد أن الاخوة الجزائريين على حق والاعتراف بالحق فضيلة والأخوين يجب وضع حد,[],0,approved,,
