example_id,source_split,source_row_id,dialect,original_text,normalized_text,masked_text,mask_spans_json,mask_count,annotation_status,annotator_model,notes
mt_dial_glf_b67c6e6f,train,29420,DIAL_GLF,ياي يارب ارزقني باللي نفسي,ياي يارب ارزقني باللي نفسي,ياي يارب ارزقني باللي نفسي,[],0,approved,,
mt_dial_lev_2df544fd,train,26987,DIAL_LEV,اصبح عندنا اهم من المنسف اشهر من القدره اهم من,اصبح عندنا اهم من المنسف اشهر من القدره اهم من,اصبح عندنا اهم من المنسف اشهر من القدره اهم من,[],0,approved,,
mt_msa_57bc61dd,train,37141,MSA,يأخي جزاك الله الف خير على حرصك على نفع إخوانك وتفريج كربهم بتبرعك بكليتك وان يجعل هذا العمل في موازين حسناتك و الله يكثر من امثالك . وتأكد ان الله سيرزقك من حيث,ياخي جزاك الله الف خير علي حرصك علي نفع اخوانك وتفريج كربهم بتبرعك بكليتك وان يجعل هذا العمل في موازين حسناتك و الله يكثر من امثالك وتاكد ان الله سيرزقك من حيث,يأخي جزاك الله الف خير على حرصك على نفع إخوانك وتفريج كربهم بتبرعك بكليتك وان يجعل هذا العمل في موازين حسناتك و الله يكثر من امثالك . وتأكد ان الله سيرزقك من حيث,[],0,approved,,
mt_dial_egy_7079ba4e,train,49657,DIAL_EGY,انت يعني عاوزه يدعو الناس للاصلاح من ملاعب الكورة ؟ ؟,انت يعني عاوزه يدعو الناس للاصلاح من ملاعب الكوره,انت يعني عاوزه يدعو الناس للاصلاح من ملاعب الكورة ؟ ؟,[],0,approved,,
mt_dial_glf_1e37d789,train,276,DIAL_GLF,واخيرا على اي اساس حددت السرعات واللي في اغلب الشوارع غير,واخيرا علي اي اساس حددت السرعات واللي في اغلب الشوارع غير,واخيرا على اي اساس حددت السرعات واللي في اغلب الشوارع غير,[],0,approved,,
mt_dial_lev_3fae37f4,train,36214,DIAL_LEV,اي خليكن بدراستكن احسنلكن وانسن,اي خليكن بدراستكن احسنلكن وانسن,اي خليكن بدراستكن احسنلكن وانسن,[],0,approved,,
mt_msa_52474f28,train,47930,MSA,يوصى شبيه الريح ويتعاقد لهم مع افضل,يوصي شبيه الريح ويتعاقد لهم مع افضل,يوصى شبيه الريح ويتعاقد لهم مع افضل,[],0,approved,,
mt_dial_glf_b8caceb8,train,34573,DIAL_GLF,ماأدري من وين جايبين الكوع ؟ لاوبعد على رادوي الشمري والله صعبة,ماادري من وين جايبين الكوع لاوبعد علي رادوي الشمري والله صعبه,ماأدري من وين جايبين الكوع ؟ لاوبعد على [PERSON_1] [PERSON_2] والله صعبة,"[{""start"": 40, ""end"": 45, ""placeholder"": ""[PERSON_1]"", ""surface_form"": ""رادوي"", ""mask_type"": ""PERSON""}, {""start"": 46, ""end"": 52, ""placeholder"": ""[PERSON_2]"", ""surface_form"": ""الشمري"", ""mask_type"": ""PERSON""}]",2,approved,,
