example_id,source_split,source_row_id,dialect,original_text,normalized_text,masked_text,mask_spans_json,mask_count,annotation_status,annotator_model,notes
mt_dial_egy_19818380,train,45937,DIAL_EGY,w . taghyeer . net يلا بينا نوقع على بيان الجمعه المستقله,w taghyeer net يلا بينا نوقع علي بيان الجمعه المستقله,[URL_1] يلا بينا نوقع على بيان الجمعه المستقله,"[{""start"": 0, ""end"": 18, ""placeholder"": ""[URL_1]"", ""surface_form"": ""w . taghyeer . net"", ""mask_type"": ""URL""}]",1,approved,,
mt_dial_glf_a9b4cf60,train,52743,DIAL_GLF,بس بصراحه تستاهلون لان الساكت عن الحق شيطان,بس بصراحه تستاهلون لان الساكت عن الحق شيطان,بس بصراحه تستاهلون لان الساكت عن الحق شيطان,[],0,approved,,
mt_dial_lev_87fe8e7c,train,52978,DIAL_LEV,يعني كلامو منزل وطاعتو واجب على كل كبير,يعني كلامو منزل وطاعتو واجب علي كل كبير,يعني كلامو منزل وطاعتو واجب على كل كبير,[],0,approved,,
mt_msa_a2e4b454,train,28678,MSA,الطريف . . . ان البعض مستغرب من وجود 65 الف,الطريف ان البعض مستغرب من وجود 65 الف,الطريف . . . ان البعض مستغرب من وجود [NUM_1] الف,"[{""start"": 37, ""end"": 39, ""placeholder"": ""[NUM_1]"", ""surface_form"": ""65"", ""mask_type"": ""NUM""}]",1,approved,,
mt_dial_egy_c1a8d27f,train,69630,DIAL_EGY,اعود واكرر ايران عمرها ماكان معاها مشكله مع امريكا واسرائيل واين كانو منذ 48 و الخ . وشوف الكدب الصريح بيقلك امريكا قتلت 300 الف عراقى . اقسم بالله ان هذا الكلب قتل من خلال الحرث الثورى الايرانى خلال الحرب الاخيره اكتر من 3 مليون سنى عراقى ومازال يفعل يوميا هذا بلاضافه لحالات الاعدام اليوميه لعدد كبير من السنه الايرانيين المضطهد ين هناك . الخلاصه الفيلم بكامله فيه الاعيب كثيره تحت الطاوله وما يطفو على السطح منها يحدث بعد عمل بروفات كثيره للتدريب عليه . . . ايها المسلمون لاتصدقو هذا الكذاب ومن على شاكلته امثال حسن نصر الله ومقتدى الصدر ونورى المالكى وغيرهم . .,اعود واكرر ايران عمرها ماكان معاها مشكله مع امريكا واسراييل واين كانو منذ 48 و الخ وشوف الكدب الصريح بيقلك امريكا قتلت 300 الف عراقي اقسم بالله ان هذا الكلب قتل من خلال الحرث الثوري الايراني خلال الحرب الاخيره اكتر من 3 مليون سني عراقي ومازال يفعل يوميا هذا بلاضافه لحالات الاعدام اليوميه لعدد كبير من السنه الايرانيين المضطهد ين هناك الخلاصه الفيلم بكامله فيه الاعيب كثيره تحت الطاوله وما يطفو علي السطح منها يحدث بعد عمل بروفات كثيره للتدريب عليه ايها المسلمون لاتصدقو هذا الكذاب ومن علي شاكلته امثال حسن نصر الله ومقتدي الصدر ونوري المالكي وغيرهم,اعود واكرر [LOC_1] عمرها ماكان معاها مشكله مع [LOC_2] و[LOC_3] واين كانو منذ [DATE_1] و الخ . وشوف الكدب الصريح بيقلك [LOC_2] قتلت [NUM_1] الف عراقى . اقسم بالله ان هذا الكلب قتل من خلال الحرث الثورى الايرانى خلال الحرب الاخيره اكتر من [NUM_2] مليون سنى عراقى ومازال يفعل يوميا هذا بلاضافه لحالات الاعدام اليوميه لعدد كبير من السنه الايرانيين المضطهد ين هناك . الخلاصه الفيلم بكامله فيه الاعيب كثيره تحت الطاوله وما يطفو على السطح منها يحدث بعد عمل بروفات كثيره للتدريب عليه . . . ايها المسلمون لاتصدقو هذا الكذاب ومن على شاكلته امثال [PERSON_1] و[PERSON_2] و[PERSON_3] وغيرهم . .,"[{""start"": 11, ""end"": 16, ""placeholder"": ""[LOC_1]"", ""surface_form"": ""ايران"", ""mask_type"": ""LOC""}, {""start"": 44, ""end"": 50, ""placeholder"": ""[LOC_2]"", ""surface_form"": ""امريكا"", ""mask_type"": ""LOC""}, {""start"": 52, ""end"": 59, ""placeholder"": ""[LOC_3]"", ""surface_form"": ""اسرائيل"", ""mask_type"": ""LOC""}, {""start"": 74, ""end"": 76, ""placeholder"": ""[DATE_1]"", ""surface_form"": ""48"", ""mask_type"": ""DATE""}, {""start"": 109, ""end"": 115, ""placeholder"": ""[LOC_2]"", ""surface_form"": ""امريكا"", ""mask_type"": ""LOC""}, {""start"": 121, ""end"": 124, ""placeholder"": ""[NUM_1]"", ""surface_form"": ""300"", ""mask_type"": ""NUM""}, {""start"": 222, ""end"": 223, ""placeholder"": ""[NUM_2]"", ""surface_form"": ""3"", ""mask_type"": ""NUM""}, {""start"": 515, ""end"": 527, ""placeholder"": ""[PERSON_1]"", ""surface_form"": ""حسن نصر الله"", ""mask_type"": ""PERSON""}, {""start"": 529, ""end"": 540, ""placeholder"": ""[PERSON_2]"", ""surface_form"": ""مقتدى الصدر"", ""mask_type"": ""PERSON""}, {""start"": 542, ""end"": 554, ""placeholder"": ""[PERSON_3]"", ""surface_form"": ""نورى المالكى"", ""mask_type"": ""PERSON""}]",10,approved,,
mt_dial_glf_2c31fda9,train,31020,DIAL_GLF,الحمد لله على سلامة ريفان وان شا الله ماتشوف مكروه يابن,الحمد لله علي سلامه ريفان وان شا الله ماتشوف مكروه يابن,الحمد لله على سلامة [PERSON_1] وان شا الله ماتشوف مكروه يابن,"[{""start"": 20, ""end"": 25, ""placeholder"": ""[PERSON_1]"", ""surface_form"": ""ريفان"", ""mask_type"": ""PERSON""}]",1,approved,,
mt_dial_lev_3ec81806,train,69112,DIAL_LEV,واحد رايح وخمسة جاي والرمثا باي,واحد رايح وخمسه جاي والرمثا باي,واحد رايح وخمسة جاي و[ORG_1] باي,"[{""start"": 21, ""end"": 27, ""placeholder"": ""[ORG_1]"", ""surface_form"": ""الرمثا"", ""mask_type"": ""ORG""}]",1,approved,,
mt_msa_4da4d59d,train,68203,MSA,لن تتطور الرياضة و لدينا عقلية مثل عقلية الهلاليين,لن تتطور الرياضه و لدينا عقليه مثل عقليه الهلاليين,لن تتطور الرياضة و لدينا عقلية مثل عقلية الهلاليين,[],0,approved,,
mt_dial_egy_3aaa19a4,train,17526,DIAL_EGY,ده هو مع بندق الزملكاوى يقول من حقه يدافع عن الزمالك ومستكر ده على اسماعيل يوسف المحترم ابن نادى الزمالك هو الكابين المحترم ابراهيم,ده هو مع بندق الزملكاوي يقول من حقه يدافع عن الزمالك ومستكر ده علي اسماعيل يوسف المحترم ابن نادي الزمالك هو الكابين المحترم ابراهيم,ده هو مع بندق الزملكاوى يقول من حقه يدافع عن [ORG_1] ومستكر ده على [PERSON_1] المحترم ابن نادى [ORG_1] هو الكابين المحترم [PERSON_2],"[{""start"": 45, ""end"": 52, ""placeholder"": ""[ORG_1]"", ""surface_form"": ""الزمالك"", ""mask_type"": ""ORG""}, {""start"": 67, ""end"": 79, ""placeholder"": ""[PERSON_1]"", ""surface_form"": ""اسماعيل يوسف"", ""mask_type"": ""PERSON""}, {""start"": 97, ""end"": 104, ""placeholder"": ""[ORG_1]"", ""surface_form"": ""الزمالك"", ""mask_type"": ""ORG""}, {""start"": 124, ""end"": 131, ""placeholder"": ""[PERSON_2]"", ""surface_form"": ""ابراهيم"", ""mask_type"": ""PERSON""}]",4,approved,,
mt_dial_lev_fdd3c119,train,28572,DIAL_LEV,2 - فش عرس . . . توفير 2000,2 فش عرس توفير 2000,[NUM_1] - فش عرس . . . توفير [NUM_2],"[{""start"": 0, ""end"": 1, ""placeholder"": ""[NUM_1]"", ""surface_form"": ""2"", ""mask_type"": ""NUM""}, {""start"": 23, ""end"": 27, ""placeholder"": ""[NUM_2]"", ""surface_form"": ""2000"", ""mask_type"": ""NUM""}]",2,approved,,
mt_msa_e33e0112,train,33326,MSA,لكن ألا تعتقدون معي أنه إذا وجد,لكن الا تعتقدون معي انه اذا وجد,لكن ألا تعتقدون معي أنه إذا وجد,[],0,approved,,
mt_dial_egy_9d357171,train,44509,DIAL_EGY,فين قانون الطوارئ منن دول ولا هما مابيستخدمهوش غير فى السياسه بس حسبى الله ونعم الوكيل دا وزاره الداخليه هى اللى واخده فلوس البلد,فين قانون الطواري منن دول ولا هما مابيستخدمهوش غير في السياسه بس حسبي الله ونعم الوكيل دا وزاره الداخليه هي اللي واخده فلوس البلد,فين قانون الطوارئ منن دول ولا هما مابيستخدمهوش غير فى السياسه بس حسبى الله ونعم الوكيل دا [ORG_1] هى اللى واخده فلوس البلد,"[{""start"": 90, ""end"": 104, ""placeholder"": ""[ORG_1]"", ""surface_form"": ""وزاره الداخليه"", ""mask_type"": ""ORG""}]",1,approved,,
mt_dial_glf_bf8baab2,train,38897,DIAL_GLF,ابو الحب اللي كذا . . الحين تجي وحده تقول الشباب السعودي مايطمر كذا ليه ؟ ه الله من الفهاوه,ابو الحب اللي كذا الحين تجي وحده تقول الشباب السعودي مايطمر كذا ليه ه الله من الفهاوه,ابو الحب اللي كذا . . الحين تجي وحده تقول الشباب [LOC_1] مايطمر كذا ليه ؟ ه الله من الفهاوه,"[{""start"": 49, ""end"": 56, ""placeholder"": ""[LOC_1]"", ""surface_form"": ""السعودي"", ""mask_type"": ""LOC""}]",1,approved,,
mt_dial_lev_a2f3ffd3,train,74185,DIAL_LEV,والله المعلقين في واد والدنيا في واد آخر . الدراسة صحيحة للأسف عندما يتم مقابلة للشخص الذي يبحث عن وظيفة فعليه أن يكون فخور ويحمل صفة الثقة بالنفس مع القليل من الغرور وخصوصا إذا كان يتقجم لموقع قيادي . ولكني أتفق مع المعلقين أن هذه ليست من صفات المسلم ولكن هذا الذي يحصل وأنا متخصص في هذا,والله المعلقين في واد والدنيا في واد اخر الدراسه صحيحه للاسف عندما يتم مقابله للشخص الذي يبحث عن وظيفه فعليه ان يكون فخور ويحمل صفه الثقه بالنفس مع القليل من الغرور وخصوصا اذا كان يتقجم لموقع قيادي ولكني اتفق مع المعلقين ان هذه ليست من صفات المسلم ولكن هذا الذي يحصل وانا متخصص في هذا,والله المعلقين في واد والدنيا في واد آخر . الدراسة صحيحة للأسف عندما يتم مقابلة للشخص الذي يبحث عن وظيفة فعليه أن يكون فخور ويحمل صفة الثقة بالنفس مع القليل من الغرور وخصوصا إذا كان يتقجم لموقع قيادي . ولكني أتفق مع المعلقين أن هذه ليست من صفات المسلم ولكن هذا الذي يحصل وأنا متخصص في هذا,[],0,approved,,
mt_msa_8e7a1e3e,train,42222,MSA,لقد طعن علاء صادق الوطنيه المصريه فى الظهر عندا اختار اكثر الاماكن عدائيه للفراعنه ليقول رايه مما يدل على سوء,لقد طعن علاء صادق الوطنيه المصريه في الظهر عندا اختار اكثر الاماكن عداييه للفراعنه ليقول رايه مما يدل علي سوء,لقد طعن [PERSON_1] الوطنيه [LOC_1] فى الظهر عندا اختار اكثر الاماكن عدائيه للفراعنه ليقول رايه مما يدل على سوء,"[{""start"": 8, ""end"": 17, ""placeholder"": ""[PERSON_1]"", ""surface_form"": ""علاء صادق"", ""mask_type"": ""PERSON""}, {""start"": 26, ""end"": 33, ""placeholder"": ""[LOC_1]"", ""surface_form"": ""المصريه"", ""mask_type"": ""LOC""}]",2,approved,,
mt_dial_glf_9288d9bf,train,30766,DIAL_GLF,ذلا وازيدكم من الشعر بيت الرساله قيمتها 3 ريال والله حراميه ** قال ايه قال ساهر اي ساهر قل نظام حراميه عشاناحدث معلوماتي ارسل رساله وادفع قيمه الرساله 3 ريال حراميه ويقولون انتما للوطن والله الواحد صار يكره شي اسمه وطن لانه كل شي فيه بفلوس,ذلا وازيدكم من الشعر بيت الرساله قيمتها 3 ريال والله حراميه قال ايه قال ساهر اي ساهر قل نظام حراميه عشاناحدث معلوماتي ارسل رساله وادفع قيمه الرساله 3 ريال حراميه ويقولون انتما للوطن والله الواحد صار يكره شي اسمه وطن لانه كل شي فيه بفلوس,ذلا وازيدكم من الشعر بيت الرساله قيمتها [NUM_1] ريال والله حراميه ** قال ايه قال ساهر اي ساهر قل نظام حراميه عشاناحدث معلوماتي ارسل رساله وادفع قيمه الرساله [NUM_1] ريال حراميه ويقولون انتما للوطن والله الواحد صار يكره شي اسمه وطن لانه كل شي فيه بفلوس,"[{""start"": 40, ""end"": 41, ""placeholder"": ""[NUM_1]"", ""surface_form"": ""3"", ""mask_type"": ""NUM""}, {""start"": 151, ""end"": 152, ""placeholder"": ""[NUM_1]"", ""surface_form"": ""3"", ""mask_type"": ""NUM""}]",2,approved,,
mt_dial_lev_0ada7403,train,12139,DIAL_LEV,يا ريت مرتي تسمع منك وترد على ها الحكي . . . صدقيني انها قوية وما حد بقدرلها . . وانا بصراحة خايف من الفظيحة . . . بس ربنا على,يا ريت مرتي تسمع منك وترد علي ها الحكي صدقيني انها قويه وما حد بقدرلها وانا بصراحه خايف من الفظيحه بس ربنا علي,يا ريت مرتي تسمع منك وترد على ها الحكي . . . صدقيني انها قوية وما حد بقدرلها . . وانا بصراحة خايف من الفظيحة . . . بس ربنا على,[],0,approved,,
mt_msa_10f65a39,train,8216,MSA,الله يرحمه ويرحم ابي وموت المسلمين أجمعين ويرحمنا اذا صارنا الى ماصاروا اليه ويبدله دار خير من داره واهل خير من اهله انا الى الله وانا اليه,الله يرحمه ويرحم ابي وموت المسلمين اجمعين ويرحمنا اذا صارنا الي ماصاروا اليه ويبدله دار خير من داره واهل خير من اهله انا الي الله وانا اليه,الله يرحمه ويرحم ابي وموت المسلمين أجمعين ويرحمنا اذا صارنا الى ماصاروا اليه ويبدله دار خير من داره واهل خير من اهله انا الى الله وانا اليه,[],0,approved,,
mt_dial_egy_72705863,train,53411,DIAL_EGY,هذا انسان مهبول ياكل كاشييات . . .,هذا انسان مهبول ياكل كاشييات,هذا انسان مهبول ياكل كاشييات . . .,[],0,approved,,
mt_dial_glf_3bd2c8d2,train,17260,DIAL_GLF,ولا دخل عليهم سكران او مواصل ترا تعبت من الحواذث,ولا دخل عليهم سكران او مواصل ترا تعبت من الحواذث,ولا دخل عليهم سكران او مواصل ترا تعبت من الحواذث,[],0,approved,,
mt_dial_lev_be62cdd7,train,61095,DIAL_LEV,طيب يا اخوان هذا كلام رئيس المستثمرين في المنطقة الحرة ؟ ؟ ؟ شو كلام الجمارك ؟ ؟ شو موقفها من هالكلام لانه كله كلام في كلام وبصراحة شبعنا كلام بدنا فعل بدنا حل لمشكلة السيارات الشمس حرقتنا في الحرة كل يوم وعلى,طيب يا اخوان هذا كلام رييس المستثمرين في المنطقه الحره شو كلام الجمارك شو موقفها من هالكلام لانه كله كلام في كلام وبصراحه شبعنا كلام بدنا فعل بدنا حل لمشكله السيارات الشمس حرقتنا في الحره كل يوم وعلي,طيب يا اخوان هذا كلام رئيس المستثمرين في [LOC_1] ؟ ؟ ؟ شو كلام [ORG_1] ؟ ؟ شو موقفها من هالكلام لانه كله كلام في كلام وبصراحة شبعنا كلام بدنا فعل بدنا حل لمشكلة السيارات الشمس حرقتنا في الحرة كل يوم وعلى,"[{""start"": 41, ""end"": 54, ""placeholder"": ""[LOC_1]"", ""surface_form"": ""المنطقة الحرة"", ""mask_type"": ""LOC""}, {""start"": 69, ""end"": 76, ""placeholder"": ""[ORG_1]"", ""surface_form"": ""الجمارك"", ""mask_type"": ""ORG""}]",2,approved,,
mt_msa_46b673eb,train,84070,MSA,ونتطلع نحن أبناء المحافظة إلى مزيد من هذا التعاون البناء,ونتطلع نحن ابناء المحافظه الي مزيد من هذا التعاون البناء,ونتطلع نحن أبناء المحافظة إلى مزيد من هذا التعاون البناء,[],0,approved,,
mt_dial_egy_60cdefe4,train,6581,DIAL_EGY,بس الموضوع ده هيفيده لو رفيع لانه هيتخن بعد ماينزل ( هيتنفخ,بس الموضوع ده هيفيده لو رفيع لانه هيتخن بعد ماينزل هيتنفخ,بس الموضوع ده هيفيده لو رفيع لانه هيتخن بعد ماينزل ( هيتنفخ,[],0,approved,,
mt_dial_glf_9eb462a7,train,45964,DIAL_GLF,شكلة فرح بالمنصب و راح بسبات عميق,شكله فرح بالمنصب و راح بسبات عميق,شكلة فرح بالمنصب و راح بسبات عميق,[],0,approved,,
mt_dial_lev_3a771ad6,train,67453,DIAL_LEV,ارواحنا فداك وحكمتك كلماتك تدل على قربك منا وحبك النا واحنا بنبادلك هذي المحبة والروح رخيصة,ارواحنا فداك وحكمتك كلماتك تدل علي قربك منا وحبك النا واحنا بنبادلك هذي المحبه والروح رخيصه,ارواحنا فداك وحكمتك كلماتك تدل على قربك منا وحبك النا واحنا بنبادلك هذي المحبة والروح رخيصة,[],0,approved,,
mt_msa_4f1c6860,train,17837,MSA,"كم كنت اكره المصريون إلا انه وبعد هذه المواقف أدركت مدى غباء وتخلف الأمة الإسلامية وكيف أصبح الأعداء يتلاعبون بنا إنا لا اقبل أن يهان لاعب عربي و مسلم , نشتم بعضنا البعض ما في مشكل . .",كم كنت اكره المصريون الا انه وبعد هذه المواقف ادركت مدي غباء وتخلف الامه الاسلاميه وكيف اصبح الاعداء يتلاعبون بنا انا لا اقبل ان يهان لاعب عربي و مسلم نشتم بعضنا البعض ما في مشكل,"كم كنت اكره المصريون إلا انه وبعد هذه المواقف أدركت مدى غباء وتخلف الأمة الإسلامية وكيف أصبح الأعداء يتلاعبون بنا إنا لا اقبل أن يهان لاعب عربي و مسلم , نشتم بعضنا البعض ما في مشكل . .",[],0,approved,,
mt_dial_egy_cc2072cc,train,7341,DIAL_EGY,انا عايز اتكلم بس خايف من قانون,انا عايز اتكلم بس خايف من قانون,انا عايز اتكلم بس خايف من قانون,[],0,approved,,
mt_dial_glf_b515c350,train,52506,DIAL_GLF,المشكله يامرزوقي اذا مافي احد حضر من جمهورك واذا حضرو من جمهور الليث قالو جمهور الاتي ولاالهلال ونسبو كل اللي يحضرون لفرقهم وان الليث ماله جمهور مثل مباراة العين لمن الباصات من كل المناطق تحركت لعيون الليث ونسبوها لهم اتمنى ماحد يحضر منهم ابرك واتمنى باصات المناطق تتحرك ولايحضر الاجمهورنا,المشكله يامرزوقي اذا مافي احد حضر من جمهورك واذا حضرو من جمهور الليث قالو جمهور الاتي ولاالهلال ونسبو كل اللي يحضرون لفرقهم وان الليث ماله جمهور مثل مباراه العين لمن الباصات من كل المناطق تحركت لعيون الليث ونسبوها لهم اتمني ماحد يحضر منهم ابرك واتمني باصات المناطق تتحرك ولايحضر الاجمهورنا,المشكله يا[PERSON_1] اذا مافي احد حضر من جمهورك واذا حضرو من جمهور الليث قالو جمهور [ORG_1] ولا[ORG_2] ونسبو كل اللي يحضرون لفرقهم وان الليث ماله جمهور مثل مباراة [ORG_3] لمن الباصات من كل المناطق تحركت لعيون الليث ونسبوها لهم اتمنى ماحد يحضر منهم ابرك واتمنى باصات المناطق تتحرك ولايحضر الاجمهورنا,"[{""start"": 10, ""end"": 16, ""placeholder"": ""[PERSON_1]"", ""surface_form"": ""مرزوقي"", ""mask_type"": ""PERSON""}, {""start"": 80, ""end"": 85, ""placeholder"": ""[ORG_1]"", ""surface_form"": ""الاتي"", ""mask_type"": ""ORG""}, {""start"": 89, ""end"": 95, ""placeholder"": ""[ORG_2]"", ""surface_form"": ""الهلال"", ""mask_type"": ""ORG""}, {""start"": 156, ""end"": 161, ""placeholder"": ""[ORG_3]"", ""surface_form"": ""العين"", ""mask_type"": ""ORG""}]",4,approved,,
mt_dial_lev_e40a8f4b,train,51016,DIAL_LEV,هوو مزبوط يعني الرجال عليه حئ لازم يروح ويشتغل بس ما لازم تكون هيك ردّة الفعل . . مسكين دبحتو . .,هوو مزبوط يعني الرجال عليه حي لازم يروح ويشتغل بس ما لازم تكون هيك رده الفعل مسكين دبحتو,هوو مزبوط يعني الرجال عليه حئ لازم يروح ويشتغل بس ما لازم تكون هيك ردّة الفعل . . مسكين دبحتو . .,[],0,approved,,
mt_msa_94480c49,train,74266,MSA,من زمن ماضي إلى هذا الزمان,من زمن ماضي الي هذا الزمان,من زمن ماضي إلى هذا الزمان,[],0,approved,,
mt_dial_egy_e030bb0d,train,23799,DIAL_EGY,ولوكان الموضوع سبوبه او تجاره مربحه لرضيت حماس ووقعت واصبحت هي صاحبة الكلمه لكن قادة حماس يدفعون ثمن صمودهم بأرواحهم وقائمة الشهداء من قادة حماس لاتنتهي ومن لايعرفهم يستطيع ان يبحث بالانترنت ليرى بعينه كم من قادة حماس استشهدوا ولم يتنازلوا .,ولوكان الموضوع سبوبه او تجاره مربحه لرضيت حماس ووقعت واصبحت هي صاحبه الكلمه لكن قاده حماس يدفعون ثمن صمودهم بارواحهم وقايمه الشهداء من قاده حماس لاتنتهي ومن لايعرفهم يستطيع ان يبحث بالانترنت ليري بعينه كم من قاده حماس استشهدوا ولم يتنازلوا,ولوكان الموضوع سبوبه او تجاره مربحه لرضيت [ORG_1] ووقعت واصبحت هي صاحبة الكلمه لكن قادة [ORG_1] يدفعون ثمن صمودهم بأرواحهم وقائمة الشهداء من قادة [ORG_1] لاتنتهي ومن لايعرفهم يستطيع ان يبحث بالانترنت ليرى بعينه كم من قادة [ORG_1] استشهدوا ولم يتنازلوا .,"[{""start"": 42, ""end"": 46, ""placeholder"": ""[ORG_1]"", ""surface_form"": ""حماس"", ""mask_type"": ""ORG""}, {""start"": 85, ""end"": 89, ""placeholder"": ""[ORG_1]"", ""surface_form"": ""حماس"", ""mask_type"": ""ORG""}, {""start"": 140, ""end"": 144, ""placeholder"": ""[ORG_1]"", ""surface_form"": ""حماس"", ""mask_type"": ""ORG""}, {""start"": 213, ""end"": 217, ""placeholder"": ""[ORG_1]"", ""surface_form"": ""حماس"", ""mask_type"": ""ORG""}]",4,approved,,
mt_dial_glf_99ce237f,train,66299,DIAL_GLF,الحمدالله على كل حال احنا بصحه وعافيه وديننا الاسلام يحثنا على النظافه . . . وعليكم,الحمدالله علي كل حال احنا بصحه وعافيه وديننا الاسلام يحثنا علي النظافه وعليكم,الحمدالله على كل حال احنا بصحه وعافيه وديننا الاسلام يحثنا على النظافه . . . وعليكم,[],0,approved,,
