example_id,source_split,source_row_id,dialect,original_text,normalized_text,masked_text,mask_spans_json,mask_count,annotation_status,annotator_model,notes
mt_msa_aa92ac43,train,82090,MSA,وأعتقد ان الضرر لا نرضاه لأهل حينا ولا لغيرنا من الأحياء فيجب إبعاد أماكن التفريغ عن داخل المدينة والمناطق السكنية,واعتقد ان الضرر لا نرضاه لاهل حينا ولا لغيرنا من الاحياء فيجب ابعاد اماكن التفريغ عن داخل المدينه والمناطق السكنيه,وأعتقد ان الضرر لا نرضاه لأهل حينا ولا لغيرنا من الأحياء فيجب إبعاد أماكن التفريغ عن داخل [LOC_1] والمناطق السكنية,"[{""start"": 90, ""end"": 97, ""placeholder"": ""[LOC_1]"", ""surface_form"": ""المدينة"", ""mask_type"": ""LOC""}]",1,approved,,
mt_dial_egy_967bb8fa,train,23673,DIAL_EGY,مصر تستطيع الدفاع عن نفسها يا ع . وأسئل عن مصر والمصريين ماذا فعلوا فى أكتوبر 73 أسئل بتوع نصف الثمن ه القريب الدم,مصر تستطيع الدفاع عن نفسها يا ع واسيل عن مصر والمصريين ماذا فعلوا في اكتوبر 73 اسيل بتوع نصف الثمن ه القريب الدم,[LOC_1] تستطيع الدفاع عن نفسها يا ع . وأسئل عن [LOC_1] والمصريين ماذا فعلوا فى أكتوبر 73 أسئل بتوع نصف الثمن ه القريب الدم,"[{""start"": 0, ""end"": 3, ""placeholder"": ""[LOC_1]"", ""surface_form"": ""مصر"", ""mask_type"": ""LOC""}, {""start"": 43, ""end"": 46, ""placeholder"": ""[LOC_1]"", ""surface_form"": ""مصر"", ""mask_type"": ""LOC""}]",2,approved,,
mt_dial_glf_0f76e27e,train,33376,DIAL_GLF,لكن شكل همتها وطموحها حدوده ابعد مما يتخيل,لكن شكل همتها وطموحها حدوده ابعد مما يتخيل,لكن شكل همتها وطموحها حدوده ابعد مما يتخيل,[],0,approved,,
mt_dial_lev_13fa8644,train,81307,DIAL_LEV,وبعدين طلاب ال 48 ما الهم غير الجامعات الأردنيه يدرسوا فيها وعلى حساب جمعيه نجمة داوود وهادول شو رح تعمل فيهم ؟ وين يروحوا يدرسوا ومين برأيك رح يدرس الطلاب العرب هناك,وبعدين طلاب ال 48 ما الهم غير الجامعات الاردنيه يدرسوا فيها وعلي حساب جمعيه نجمه داوود وهادول شو رح تعمل فيهم وين يروحوا يدرسوا ومين برايك رح يدرس الطلاب العرب هناك,وبعدين طلاب ال 48 ما الهم غير الجامعات الأردنيه يدرسوا فيها وعلى حساب جمعيه نجمة داوود وهادول شو رح تعمل فيهم ؟ وين يروحوا يدرسوا ومين برأيك رح يدرس الطلاب العرب هناك,[],0,approved,,
mt_msa_d4597de4,train,78179,MSA,الواجب ان ننظر في مايهم امور امتنا وصالح ديننا وأن ندفع الفساد والشبه وأن نفتح أي ثغرة لضعاف النفوس وخصوصاً واقع شباب امتنا والله الهادي إلى سواء,الواجب ان ننظر في مايهم امور امتنا وصالح ديننا وان ندفع الفساد والشبه وان نفتح اي ثغره لضعاف النفوس وخصوصا واقع شباب امتنا والله الهادي الي سواء,الواجب ان ننظر في مايهم امور امتنا وصالح ديننا وأن ندفع الفساد والشبه وأن نفتح أي ثغرة لضعاف النفوس وخصوصاً واقع شباب امتنا والله الهادي إلى سواء,[],0,approved,,
mt_dial_egy_79ed97b0,train,56581,DIAL_EGY,والله اللى اختشوا ماتوا الست ميهتاب وغيره من الزمالكوية اللى بيشجع تشجيع اعمى ومن وجهة نظرى لو الزمالك لبس فانلة حمرة مش ايشجعوه العفريت والبعبع ابتاعهم الاهلى كل مشكلة الاهلى هوه السبب يا ناس اختشوا على دمكم دا الاهلى الاول من بداية البطولة وانتوا فين من خمس سنوات الاهلى برضه بيرشى الحكام من خمس سنوات والشماعة دى مش اتقع علطول موجودة وابراهيم اللى المفروض يعينوه على اسطبل مش منسق ولاء عموما فى النهاية اتعلموا شوية من فريق البطولات وقلكم ريحوا وبالكم وخبوا عيالكم والبعبع جالكم ولا عزاء الا للحاقدين,والله اللي اختشوا ماتوا الست ميهتاب وغيره من الزمالكويه اللي بيشجع تشجيع اعمي ومن وجهه نظري لو الزمالك لبس فانله حمره مش ايشجعوه العفريت والبعبع ابتاعهم الاهلي كل مشكله الاهلي هوه السبب يا ناس اختشوا علي دمكم دا الاهلي الاول من بدايه البطوله وانتوا فين من خمس سنوات الاهلي برضه بيرشي الحكام من خمس سنوات والشماعه دي مش اتقع علطول موجوده وابراهيم اللي المفروض يعينوه علي اسطبل مش منسق ولاء عموما في النهايه اتعلموا شويه من فريق البطولات وقلكم ريحوا وبالكم وخبوا عيالكم والبعبع جالكم ولا عزاء الا للحاقدين,والله اللى اختشوا ماتوا الست ميهتاب وغيره من الزمالكوية اللى بيشجع تشجيع اعمى ومن وجهة نظرى لو الزمالك لبس فانلة حمرة مش ايشجعوه العفريت والبعبع ابتاعهم الاهلى كل مشكلة الاهلى هوه السبب يا ناس اختشوا على دمكم دا الاهلى الاول من بداية البطولة وانتوا فين من خمس سنوات الاهلى برضه بيرشى الحكام من خمس سنوات والشماعة دى مش اتقع علطول موجودة وابراهيم اللى المفروض يعينوه على اسطبل مش منسق ولاء عموما فى النهاية اتعلموا شوية من فريق البطولات وقلكم ريحوا وبالكم وخبوا عيالكم والبعبع جالكم ولا عزاء الا للحاقدين,[],0,approved,,
mt_dial_glf_2d341e2b,train,76709,DIAL_GLF,وين الرادع ؟ مافيه . وانت الله يهديك تنزل وتخلي بنيتك في السيارة لحالها وهي تشتغل بعد,وين الرادع مافيه وانت الله يهديك تنزل وتخلي بنيتك في السياره لحالها وهي تشتغل بعد,وين الرادع ؟ مافيه . وانت الله يهديك تنزل وتخلي بنيتك في السيارة لحالها وهي تشتغل بعد,[],0,approved,,
mt_dial_lev_89b5b91e,train,43473,DIAL_LEV,بس نفسي اعرف ليش البنت ضلت ساكته خمس سنين لازم نلاقي حل للخوف اللي جواناعشان ماحدا يقدر يظلمنا حتى اقرب الناس,بس نفسي اعرف ليش البنت ضلت ساكته خمس سنين لازم نلاقي حل للخوف اللي جواناعشان ماحدا يقدر يظلمنا حتي اقرب الناس,بس نفسي اعرف ليش البنت ضلت ساكته خمس سنين لازم نلاقي حل للخوف اللي جواناعشان ماحدا يقدر يظلمنا حتى اقرب الناس,[],0,approved,,
mt_msa_f4dee41e,train,84267,MSA,يارب ان كان بريئا فأظهر برائته واشغل الحاقدين والشامتين في عيوبهم انك علي ذلك لقدير,يارب ان كان برييا فاظهر برايته واشغل الحاقدين والشامتين في عيوبهم انك علي ذلك لقدير,يارب ان كان بريئا فأظهر برائته واشغل الحاقدين والشامتين في عيوبهم انك علي ذلك لقدير,[],0,approved,,
mt_dial_egy_eb3b2184,train,66071,DIAL_EGY,ان شاء الله وبقدرته تعالى سيكسب الزمالك اتحاد الشرطة وان شاء الله وباذنه سيفوز بالدورى ومفيش حاجة بعيدة على ربنا جل,ان شاء الله وبقدرته تعالي سيكسب الزمالك اتحاد الشرطه وان شاء الله وباذنه سيفوز بالدوري ومفيش حاجه بعيده علي ربنا جل,ان شاء الله وبقدرته تعالى سيكسب الزمالك اتحاد الشرطة وان شاء الله وباذنه سيفوز بالدورى ومفيش حاجة بعيدة على ربنا جل,[],0,approved,,
mt_dial_glf_912bd475,train,43324,DIAL_GLF,مصيبة كبيره . . . عضل البنات . . لافرق لعربي على أعجمي الا بالتقوى . . زوجوا بناتكم بالكفؤ اللي يخاف الله ولا تنظروا للحسب والنسب فأن الله سيحاسبكم علىهذا,مصيبه كبيره عضل البنات لافرق لعربي علي اعجمي الا بالتقوي زوجوا بناتكم بالكفو اللي يخاف الله ولا تنظروا للحسب والنسب فان الله سيحاسبكم عليهذا,مصيبة كبيره . . . عضل البنات . . لافرق لعربي على أعجمي الا بالتقوى . . زوجوا بناتكم بالكفؤ اللي يخاف الله ولا تنظروا للحسب والنسب فأن الله سيحاسبكم علىهذا,[],0,approved,,
mt_dial_lev_38461a13,train,66373,DIAL_LEV,"تعادل ايجابي وعلى ملعبهم يعني فوز . شباب ابطال وبيضو الوجه , الله يوفقهم . .",تعادل ايجابي وعلي ملعبهم يعني فوز شباب ابطال وبيضو الوجه الله يوفقهم,"تعادل ايجابي وعلى ملعبهم يعني فوز . شباب ابطال وبيضو الوجه , الله يوفقهم . .",[],0,approved,,
mt_msa_48459809,train,59391,MSA,اي مستوى رائع فعله الفيصلي صدقني لاعب واحد حمزه الدردور دوخ دفاعات الفيصلي و افلت الفيصلي من هزيمة نكراء,اي مستوي رايع فعله الفيصلي صدقني لاعب واحد حمزه الدردور دوخ دفاعات الفيصلي و افلت الفيصلي من هزيمه نكراء,اي مستوى رائع فعله [ORG_1] صدقني لاعب واحد حمزه الدردور دوخ دفاعات [ORG_1] و افلت [ORG_1] من هزيمة نكراء,"[{""start"": 19, ""end"": 26, ""placeholder"": ""[ORG_1]"", ""surface_form"": ""الفيصلي"", ""mask_type"": ""ORG""}, {""start"": 67, ""end"": 74, ""placeholder"": ""[ORG_1]"", ""surface_form"": ""الفيصلي"", ""mask_type"": ""ORG""}, {""start"": 82, ""end"": 89, ""placeholder"": ""[ORG_1]"", ""surface_form"": ""الفيصلي"", ""mask_type"": ""ORG""}]",3,approved,,
mt_dial_egy_47ee87ce,train,64324,DIAL_EGY,هي الدنيا ما بقاش فيها إلا الدولتين,هي الدنيا ما بقاش فيها الا الدولتين,هي الدنيا ما بقاش فيها إلا الدولتين,[],0,approved,,
mt_dial_glf_87725e31,train,8580,DIAL_GLF,أو الضغوط القوية وصلتكم انت,او الضغوط القويه وصلتكم انت,أو الضغوط القوية وصلتكم انت,[],0,approved,,
mt_dial_lev_ab235e3c,train,53263,DIAL_LEV,الله يرحمهم برحمتو يارب وما تحطو الحق على الكوادر,الله يرحمهم برحمتو يارب وما تحطو الحق علي الكوادر,الله يرحمهم برحمتو يارب وما تحطو الحق على الكوادر,[],0,approved,,
mt_msa_8045d143,train,83508,MSA,التجربة تؤكد أن الاخوة الجزائريين على حق والاعتراف بالحق فضيلة والأخوين يجب وضع حد,التجربه توكد ان الاخوه الجزايريين علي حق والاعتراف بالحق فضيله والاخوين يجب وضع حد,التجربة تؤكد أن الاخوة الجزائريين على حق والاعتراف بالحق فضيلة والأخوين يجب وضع حد,[],0,approved,,
mt_dial_egy_3154b867,train,84969,DIAL_EGY,حضرتك بتطلبي منا نقفل عنينا ونكدببها يعني الناس اللى شافت المر بعنيها ومعلم في جسمها واأطفال اللى شافوا أهلهم بتتهان وتنداس كرامتها بالجزم من السادة أبطال الشرطة واللى ماشي في الشارع واتاخد من غير أي ذنب وكل ده والله شوفته بعنيا مطلوب منهم بقا يدعوا للشرطة بطول العمر والبركة والخير ؟ ؟,حضرتك بتطلبي منا نقفل عنينا ونكدببها يعني الناس اللي شافت المر بعنيها ومعلم في جسمها وااطفال اللي شافوا اهلهم بتتهان وتنداس كرامتها بالجزم من الساده ابطال الشرطه واللي ماشي في الشارع واتاخد من غير اي ذنب وكل ده والله شوفته بعنيا مطلوب منهم بقا يدعوا للشرطه بطول العمر والبركه والخير,حضرتك بتطلبي منا نقفل عنينا ونكدببها يعني الناس اللى شافت المر بعنيها ومعلم في جسمها واأطفال اللى شافوا أهلهم بتتهان وتنداس كرامتها بالجزم من السادة أبطال الشرطة واللى ماشي في الشارع واتاخد من غير أي ذنب وكل ده والله شوفته بعنيا مطلوب منهم بقا يدعوا للشرطة بطول العمر والبركة والخير ؟ ؟,[],0,approved,,
mt_dial_glf_32e3e5c7,train,70715,DIAL_GLF,وانتظر التصنيف بعد اسياء راح يكون حوالي ثمانين او اكثر . . .,وانتظر التصنيف بعد اسياء راح يكون حوالي ثمانين او اكثر,وانتظر التصنيف بعد اسياء راح يكون حوالي ثمانين او اكثر . . .,[],0,approved,,
mt_dial_lev_28020b3d,train,74,DIAL_LEV,هو مين الي اله القرار الاول والاخير بجيزة البنت غير الام وكمان بجيزة الشاب ؟,هو مين الي اله القرار الاول والاخير بجيزه البنت غير الام وكمان بجيزه الشاب,هو مين الي اله القرار الاول والاخير بجيزة البنت غير الام وكمان بجيزة الشاب ؟,[],0,approved,,
mt_msa_203c24a8,train,49990,MSA,السؤال الذي يطرح نفسه دائما و ابدا ، هل يا قطر لو كان هؤلاء الصيادين ايرانيين ستستمر ازمتهم حتى اليوم ؟ ؟,السوال الذي يطرح نفسه دايما و ابدا هل يا قطر لو كان هولاء الصيادين ايرانيين ستستمر ازمتهم حتي اليوم,السؤال الذي يطرح نفسه دائما و ابدا ، هل يا [LOC_1] لو كان هؤلاء الصيادين ايرانيين ستستمر ازمتهم حتى اليوم ؟ ؟,"[{""start"": 43, ""end"": 46, ""placeholder"": ""[LOC_1]"", ""surface_form"": ""قطر"", ""mask_type"": ""LOC""}]",1,approved,,
mt_dial_egy_9217d45e,train,39224,DIAL_EGY,قم يامصري مصر دايما بتناديك خد بنصري نصري دين واجب عليك,قم يامصري مصر دايما بتناديك خد بنصري نصري دين واجب عليك,قم يامصري [LOC_1] دايما بتناديك خد بنصري نصري دين واجب عليك,"[{""start"": 10, ""end"": 13, ""placeholder"": ""[LOC_1]"", ""surface_form"": ""مصر"", ""mask_type"": ""LOC""}]",1,approved,,
mt_dial_glf_a6d71fbe,train,31204,DIAL_GLF,عقبالنا يا رب . . . لأننا حنا السبب في نشر هالعادات و التقاليد للدول الإسلامية على أنها من الإسلام ! و هي لا,عقبالنا يا رب لاننا حنا السبب في نشر هالعادات و التقاليد للدول الاسلاميه علي انها من الاسلام و هي لا,عقبالنا يا رب . . . لأننا حنا السبب في نشر هالعادات و التقاليد للدول الإسلامية على أنها من الإسلام ! و هي لا,[],0,approved,,
mt_dial_lev_2c1175e0,train,72580,DIAL_LEV,يعني مش عارف شو قصة الشعب والامن العام . . . تقول يه . . .,يعني مش عارف شو قصه الشعب والامن العام تقول يه,يعني مش عارف شو قصة الشعب والامن العام . . . تقول يه . . .,[],0,approved,,
mt_msa_ee19ce76,train,57685,MSA,انا اعتقد ان محمد نجيب ليس السبب في خروجنا من كاس العالم وتدني مستويات انديتنا بالاضافة الى المهازل التي تحدث في الدوري السعودي وبدل من ايقاف قناة متميزة في نقل الدوري نحاسب المقصرين في الاندية واللاعبين الذين لم يقوموا بواجبهم على اكمل,انا اعتقد ان محمد نجيب ليس السبب في خروجنا من كاس العالم وتدني مستويات انديتنا بالاضافه الي المهازل التي تحدث في الدوري السعودي وبدل من ايقاف قناه متميزه في نقل الدوري نحاسب المقصرين في الانديه واللاعبين الذين لم يقوموا بواجبهم علي اكمل,انا اعتقد ان محمد نجيب ليس السبب في خروجنا من كاس العالم وتدني مستويات انديتنا بالاضافة الى المهازل التي تحدث في الدوري السعودي وبدل من ايقاف قناة متميزة في نقل الدوري نحاسب المقصرين في الاندية واللاعبين الذين لم يقوموا بواجبهم على اكمل,[],0,approved,,
mt_dial_egy_1d69df85,train,80148,DIAL_EGY,انتي لسه معرفتوش سلوكيات ابراهيم ده اقل واجب لازم تعرفوها ده المفروض يعينوها في قسم الخلافات قسم قله الاداب ده مفيش حد عجبوا حتي احمد حسن وعلاء صادق ومحمد ابراهيم ورامي سعيد يعم كافيه عليك كده,انتي لسه معرفتوش سلوكيات ابراهيم ده اقل واجب لازم تعرفوها ده المفروض يعينوها في قسم الخلافات قسم قله الاداب ده مفيش حد عجبوا حتي احمد حسن وعلاء صادق ومحمد ابراهيم ورامي سعيد يعم كافيه عليك كده,انتي لسه معرفتوش سلوكيات ابراهيم ده اقل واجب لازم تعرفوها ده المفروض يعينوها في قسم الخلافات قسم قله الاداب ده مفيش حد عجبوا حتي [PERSON_1] وعلاء صادق و[PERSON_2] و[PERSON_3] يعم كافيه عليك كده,"[{""start"": 129, ""end"": 137, ""placeholder"": ""[PERSON_1]"", ""surface_form"": ""احمد حسن"", ""mask_type"": ""PERSON""}, {""start"": 150, ""end"": 162, ""placeholder"": ""[PERSON_2]"", ""surface_form"": ""محمد ابراهيم"", ""mask_type"": ""PERSON""}, {""start"": 164, ""end"": 173, ""placeholder"": ""[PERSON_3]"", ""surface_form"": ""رامي سعيد"", ""mask_type"": ""PERSON""}]",3,approved,,
mt_dial_glf_a3a88448,train,64572,DIAL_GLF,فيه نآس بتقول ليه كل هالصسرفياات ومدري آيش . . ومجهود بشري ضخم حيث فيه 45 ألف وآحد بيحسبون لدولة عدد مجموع سٌكآنهآ يتجآوز 20 مليون بين موآطن ومقيم ؟,فيه ناس بتقول ليه كل هالصسرفياات ومدري ايش ومجهود بشري ضخم حيث فيه 45 الف واحد بيحسبون لدوله عدد مجموع سكانها يتجاوز 20 مليون بين مواطن ومقيم,فيه نآس بتقول ليه كل هالصسرفياات ومدري آيش . . ومجهود بشري ضخم حيث فيه 45 ألف وآحد بيحسبون لدولة عدد مجموع سٌكآنهآ يتجآوز 20 مليون بين موآطن ومقيم ؟,[],0,approved,,
mt_dial_lev_76c175c0,train,19123,DIAL_LEV,ارتفع الذهب ولعت اسعاره طار عقل البشر وبعض المتزوجزن حطوا ايديهم على قلبوبهم ماذا سنفعل اقترب الزفاف والعروس تريد ( 6 ) اساور مبرومه وطقم جنزير وحلق اخر موديل واسواره خميله وليست رفيعه والعريس بلطم سعر اذهب ارتفع وبعض الحموات وابنتها تصر على الذهب والبعض العاقل اتفقوا على تمشيه ليله العرس بالذهب الروسي رخيص الثمن واللي بشوفه بقول عنه ذهب اصلي ولما تنزل الاسعار بنتشتري ذهب والبعض الاخر يستلف من هاي اساور ومن هاي حلق ومن هاي طقم للرقبه تمشيه حال مع ارتفاع,ارتفع الذهب ولعت اسعاره طار عقل البشر وبعض المتزوجزن حطوا ايديهم علي قلبوبهم ماذا سنفعل اقترب الزفاف والعروس تريد 6 اساور مبرومه وطقم جنزير وحلق اخر موديل واسواره خميله وليست رفيعه والعريس بلطم سعر اذهب ارتفع وبعض الحموات وابنتها تصر علي الذهب والبعض العاقل اتفقوا علي تمشيه ليله العرس بالذهب الروسي رخيص الثمن واللي بشوفه بقول عنه ذهب اصلي ولما تنزل الاسعار بنتشتري ذهب والبعض الاخر يستلف من هاي اساور ومن هاي حلق ومن هاي طقم للرقبه تمشيه حال مع ارتفاع,ارتفع الذهب ولعت اسعاره طار عقل البشر وبعض المتزوجزن حطوا ايديهم على قلبوبهم ماذا سنفعل اقترب الزفاف والعروس تريد ( 6 ) اساور مبرومه وطقم جنزير وحلق اخر موديل واسواره خميله وليست رفيعه والعريس بلطم سعر اذهب ارتفع وبعض الحموات وابنتها تصر على الذهب والبعض العاقل اتفقوا على تمشيه ليله العرس بالذهب الروسي رخيص الثمن واللي بشوفه بقول عنه ذهب اصلي ولما تنزل الاسعار بنتشتري ذهب والبعض الاخر يستلف من هاي اساور ومن هاي حلق ومن هاي طقم للرقبه تمشيه حال مع ارتفاع,[],0,approved,,
