example_id,source_split,source_row_id,dialect,original_text,normalized_text,masked_text,mask_spans_json,mask_count,annotation_status,annotator_model,notes
mt_dial_egy_6a32094d,train,4802,DIAL_EGY,ودعوته بعودة عصور الظلام والقهر والتكية الكان عايش فيها,ودعوته بعوده عصور الظلام والقهر والتكيه الكان عايش فيها,ودعوته بعودة عصور الظلام والقهر والتكية الكان عايش فيها,[],0,approved,,
mt_dial_glf_738c05f6,train,74310,DIAL_GLF,التعداد الي يقولون ماشفناه للحين منتضرينهم علي احر من الجمر سمعنا انهم يوزعون اجهزه كهربائيه علي,التعداد الي يقولون ماشفناه للحين منتضرينهم علي احر من الجمر سمعنا انهم يوزعون اجهزه كهرباييه علي,التعداد الي يقولون ماشفناه للحين منتضرينهم علي احر من الجمر سمعنا انهم يوزعون اجهزه كهربائيه علي,[],0,approved,,
mt_dial_lev_a9b78aef,train,58085,DIAL_LEV,دعم من السعودية ما يهمك يا,دعم من السعوديه ما يهمك يا,دعم من [LOC_1] ما يهمك يا,"[{""start"": 7, ""end"": 15, ""placeholder"": ""[LOC_1]"", ""surface_form"": ""السعودية"", ""mask_type"": ""LOC""}]",1,approved,,
mt_msa_11799622,train,17475,MSA,الله يرحمها ويتنجوز عن سيأتها ويزيد فى حسناتها ويسبتها عند السؤال ويجعل مسواها,الله يرحمها ويتنجوز عن سياتها ويزيد في حسناتها ويسبتها عند السوال ويجعل مسواها,الله يرحمها ويتنجوز عن سيأتها ويزيد فى حسناتها ويسبتها عند السؤال ويجعل مسواها,[],0,approved,,
mt_dial_egy_d4cedf23,train,76332,DIAL_EGY,ه الي مضحكني ذئب اسيوط مازالك حي ترزق حسبتك مت ياذئب بس شفتو قداش نحبو بلادنا نروح وين يروح الفريق نشري قميص يقارب مرتب شهري ونعطيكم معلومة صغيرة سعر تذكرة جنوب افريقيا 500 يورو فقط انا شخصيا تقارب نصف مرتبي الشهري فاكتر من 60 الف جزائري ذاهب باذن الله فترقبونا بعد الاشهار,ه الي مضحكني ذيب اسيوط مازالك حي ترزق حسبتك مت ياذيب بس شفتو قداش نحبو بلادنا نروح وين يروح الفريق نشري قميص يقارب مرتب شهري ونعطيكم معلومه صغيره سعر تذكره جنوب افريقيا 500 يورو فقط انا شخصيا تقارب نصف مرتبي الشهري فاكتر من 60 الف جزايري ذاهب باذن الله فترقبونا بعد الاشهار,ه الي مضحكني ذئب [LOC_1] مازالك حي ترزق حسبتك مت ياذئب بس شفتو قداش نحبو بلادنا نروح وين يروح الفريق نشري قميص يقارب مرتب شهري ونعطيكم معلومة صغيرة سعر تذكرة [LOC_2] [NUM_1] فقط انا شخصيا تقارب نصف مرتبي الشهري فاكتر من 60 الف جزائري ذاهب باذن الله فترقبونا بعد الاشهار,"[{""start"": 17, ""end"": 22, ""placeholder"": ""[LOC_1]"", ""surface_form"": ""اسيوط"", ""mask_type"": ""LOC""}, {""start"": 156, ""end"": 168, ""placeholder"": ""[LOC_2]"", ""surface_form"": ""جنوب افريقيا"", ""mask_type"": ""LOC""}, {""start"": 169, ""end"": 177, ""placeholder"": ""[NUM_1]"", ""surface_form"": ""500 يورو"", ""mask_type"": ""NUM""}]",3,approved,,
mt_dial_glf_3daf6513,train,51029,DIAL_GLF,حنا نريد والاتحاد يريد والله يفعل مايريد هارد لك للاتي والعوض ان شاء الله بباي الفرق المنافسه (,حنا نريد والاتحاد يريد والله يفعل مايريد هارد لك للاتي والعوض ان شاء الله بباي الفرق المنافسه,حنا نريد والاتحاد يريد والله يفعل مايريد هارد لك للاتي والعوض ان شاء الله بباي الفرق المنافسه (,[],0,approved,,
mt_dial_lev_f80b65e7,train,82021,DIAL_LEV,ماشاء الله عليك ياوحدات العز فعلا صيتك ذايع بكل مكان و جمهورك بالملايين حول العالم ، دعوة تدل على قيمة النادي الكبير عند أشقائه الوصلايه في الامارات و الوطن العربي الكبير تحية لنشامى الفارس الأخضر زعيم الأندية الأردنية نادي الوحدات الأردني صاحب أكبر جماهيرية محليا و اسيويا و عالميا و فعلا مسكين اللي ما عندو وحدات بطل الرباعية التاريخية,ماشاء الله عليك ياوحدات العز فعلا صيتك ذايع بكل مكان و جمهورك بالملايين حول العالم دعوه تدل علي قيمه النادي الكبير عند اشقايه الوصلايه في الامارات و الوطن العربي الكبير تحيه لنشامي الفارس الاخضر زعيم الانديه الاردنيه نادي الوحدات الاردني صاحب اكبر جماهيريه محليا و اسيويا و عالميا و فعلا مسكين اللي ما عندو وحدات بطل الرباعيه التاريخيه,ماشاء الله عليك ياوحدات العز فعلا صيتك ذايع بكل مكان و جمهورك بالملايين حول العالم ، دعوة تدل على قيمة النادي الكبير عند أشقائه الوصلايه في [LOC_1] و [LOC_2] الكبير تحية لنشامى الفارس الأخضر زعيم الأندية الأردنية [ORG_1] الأردني صاحب أكبر جماهيرية محليا و اسيويا و عالميا و فعلا مسكين اللي ما عندو وحدات بطل الرباعية التاريخية,"[{""start"": 140, ""end"": 148, ""placeholder"": ""[LOC_1]"", ""surface_form"": ""الامارات"", ""mask_type"": ""LOC""}, {""start"": 151, ""end"": 163, ""placeholder"": ""[LOC_2]"", ""surface_form"": ""الوطن العربي"", ""mask_type"": ""LOC""}, {""start"": 219, ""end"": 231, ""placeholder"": ""[ORG_1]"", ""surface_form"": ""نادي الوحدات"", ""mask_type"": ""ORG""}]",3,approved,,
mt_msa_1d52ff4d,train,27128,MSA,شيعان ان شاء الله في مستوى,شيعان ان شاء الله في مستوي,شيعان ان شاء الله في مستوى,[],0,approved,,
mt_dial_egy_fb1d932c,train,4468,DIAL_EGY,لاء بقي أمريكا ولية أمركم أنتم وحزبكم وذلك بوجب ما تمن علىكم يدها الكريمة سنويا بمليار دولار و هي التي تملي عليكم اللي يكون واللي ما يكونش . هذا وحتى الأصلاح الداخلي اللي سيتك بتقول علية اللي لازم يجي من الداخل كما تقول . نظامكم و حزبكم كاتم على نفسنا ونفس أي واحد يتكلم على الكرسي بتاع العرش و ماسكين باديكم وسنانكم في الحكم لانها فته ومولد وصحبة نايم وموش عارفين حيصحا امتى ولو حتي صحي من النوم مالوش دعوه ومنعنا من حتى التعبير السلمي عن ذلك وكل واحد من أعضاء الحزب ألا وطني بيشن حملة غبية وشعواء ضد الرجل الشريف البرادعي . وارجو أن تسمح لي أيها الفتى بتاع الشاطيء بان تبطل الكلام اللي بتردده دون أن تعرف معناه لانه كلام تافهة وليس له معنى معنا وهو الأجندات والبوتيكات و التليفزيونات و البلد عمرها ما هتغرق لاننا بنحب تربها ولا يمكن أبدن أن نسمح بذلك ولكن ممكن تغرق لا سمح الله لو فضل حزبكم الفاسد في,لاء بقي امريكا وليه امركم انتم وحزبكم وذلك بوجب ما تمن عليكم يدها الكريمه سنويا بمليار دولار و هي التي تملي عليكم اللي يكون واللي ما يكونش هذا وحتي الاصلاح الداخلي اللي سيتك بتقول عليه اللي لازم يجي من الداخل كما تقول نظامكم و حزبكم كاتم علي نفسنا ونفس اي واحد يتكلم علي الكرسي بتاع العرش و ماسكين باديكم وسنانكم في الحكم لانها فته ومولد وصحبه نايم وموش عارفين حيصحا امتي ولو حتي صحي من النوم مالوش دعوه ومنعنا من حتي التعبير السلمي عن ذلك وكل واحد من اعضاء الحزب الا وطني بيشن حمله غبيه وشعواء ضد الرجل الشريف البرادعي وارجو ان تسمح لي ايها الفتي بتاع الشاطيء بان تبطل الكلام اللي بتردده دون ان تعرف معناه لانه كلام تافهه وليس له معني معنا وهو الاجندات والبوتيكات و التليفزيونات و البلد عمرها ما هتغرق لاننا بنحب تربها ولا يمكن ابدن ان نسمح بذلك ولكن ممكن تغرق لا سمح الله لو فضل حزبكم الفاسد في,لاء بقي [LOC_1] ولية أمركم أنتم وحزبكم وذلك بوجب ما تمن علىكم يدها الكريمة سنويا بمليار دولار و هي التي تملي عليكم اللي يكون واللي ما يكونش . هذا وحتى الأصلاح الداخلي اللي سيتك بتقول علية اللي لازم يجي من الداخل كما تقول . نظامكم و حزبكم كاتم على نفسنا ونفس أي واحد يتكلم على الكرسي بتاع العرش و ماسكين باديكم وسنانكم في الحكم لانها فته ومولد وصحبة نايم وموش عارفين حيصحا امتى ولو حتي صحي من النوم مالوش دعوه ومنعنا من حتى التعبير السلمي عن ذلك وكل واحد من أعضاء الحزب ألا وطني بيشن حملة غبية وشعواء ضد الرجل الشريف [PERSON_1] . وارجو أن تسمح لي أيها الفتى بتاع الشاطيء بان تبطل الكلام اللي بتردده دون أن تعرف معناه لانه كلام تافهة وليس له معنى معنا وهو الأجندات والبوتيكات و التليفزيونات و البلد عمرها ما هتغرق لاننا بنحب تربها ولا يمكن أبدن أن نسمح بذلك ولكن ممكن تغرق لا سمح الله لو فضل حزبكم الفاسد في,"[{""start"": 8, ""end"": 14, ""placeholder"": ""[LOC_1]"", ""surface_form"": ""أمريكا"", ""mask_type"": ""LOC""}, {""start"": 515, ""end"": 523, ""placeholder"": ""[PERSON_1]"", ""surface_form"": ""البرادعي"", ""mask_type"": ""PERSON""}]",2,approved,,
mt_dial_glf_87be66d7,train,53660,DIAL_GLF,اهتمو بجمالكم الطبيعي وابعدو عن الخرابيط,اهتمو بجمالكم الطبيعي وابعدو عن الخرابيط,اهتمو بجمالكم الطبيعي وابعدو عن الخرابيط,[],0,approved,,
mt_dial_lev_7de92d3d,train,56644,DIAL_LEV,هذا كلام تخدير وكسب وقت أي دولة في عام 2010 لا يوجد فيها قطار الأنفاق ، لا يمكن دعم القطاع و تحفيز الناس على ترك السيارات الا من خلال القطار داخل البلد هكذا تخفض النفقات يا معالي الوزراء أما اي مجنون ممكن يترك سايرتو ويركب مواصلاتكم عشان يقضي ربع اليوم في الطريق ! !,هذا كلام تخدير وكسب وقت اي دوله في عام 2010 لا يوجد فيها قطار الانفاق لا يمكن دعم القطاع و تحفيز الناس علي ترك السيارات الا من خلال القطار داخل البلد هكذا تخفض النفقات يا معالي الوزراء اما اي مجنون ممكن يترك سايرتو ويركب مواصلاتكم عشان يقضي ربع اليوم في الطريق,هذا كلام تخدير وكسب وقت أي دولة في [DATE_1] لا يوجد فيها قطار الأنفاق ، لا يمكن دعم القطاع و تحفيز الناس على ترك السيارات الا من خلال القطار داخل البلد هكذا تخفض النفقات يا معالي الوزراء أما اي مجنون ممكن يترك سايرتو ويركب مواصلاتكم عشان يقضي ربع اليوم في الطريق ! !,"[{""start"": 35, ""end"": 43, ""placeholder"": ""[DATE_1]"", ""surface_form"": ""عام 2010"", ""mask_type"": ""DATE""}]",1,approved,,
mt_msa_1883d721,train,19780,MSA,حى ان المتبعون لدارسين عن انتشار الا,حي ان المتبعون لدارسين عن انتشار الا,حى ان المتبعون لدارسين عن انتشار الا,[],0,approved,,
mt_dial_egy_4a4677b0,train,63357,DIAL_EGY,الى تعليق واحد دى مش دكتورة دا مخبر واسمه زلطة هى دى وظيفته وبياخد عليها,الي تعليق واحد دي مش دكتوره دا مخبر واسمه زلطه هي دي وظيفته وبياخد عليها,الى تعليق واحد دى مش دكتورة دا مخبر واسمه زلطة هى دى وظيفته وبياخد عليها,[],0,approved,,
mt_dial_glf_635afe7c,train,24871,DIAL_GLF,إذا أبقى على فيقاروا ولم يجلب لاعبين سوبر ستار ستكون كما يقول المثل ( ليالي العيد تبين من عصاريها,اذا ابقي علي فيقاروا ولم يجلب لاعبين سوبر ستار ستكون كما يقول المثل ليالي العيد تبين من عصاريها,إذا أبقى على فيقاروا ولم يجلب لاعبين سوبر ستار ستكون كما يقول المثل ( ليالي العيد تبين من عصاريها,[],0,approved,,
mt_dial_lev_e30fba33,train,81779,DIAL_LEV,صار غير المدخن يحس حالو إشي غريب في هالمجتمع,صار غير المدخن يحس حالو اشي غريب في هالمجتمع,صار غير المدخن يحس حالو إشي غريب في هالمجتمع,[],0,approved,,
mt_msa_9dd80be9,train,53908,MSA,أفضل ان يراجع النصر نفسه على إدارة النصر أن تخرج جيل مثل جيل ماجد ومحيسن ويوسف خميس أما غير ذلك لايتحلم النصراويون ببطولة كهذه مع إنيأحب ذلك الجيل,افضل ان يراجع النصر نفسه علي اداره النصر ان تخرج جيل مثل جيل ماجد ومحيسن ويوسف خميس اما غير ذلك لايتحلم النصراويون ببطوله كهذه مع انياحب ذلك الجيل,أفضل ان يراجع [ORG_1] نفسه على إدارة [ORG_1] أن تخرج جيل مثل جيل ماجد ومحيسن ويوسف خميس أما غير ذلك لايتحلم النصراويون ببطولة كهذه مع إنيأحب ذلك الجيل,"[{""start"": 14, ""end"": 19, ""placeholder"": ""[ORG_1]"", ""surface_form"": ""النصر"", ""mask_type"": ""ORG""}, {""start"": 35, ""end"": 40, ""placeholder"": ""[ORG_1]"", ""surface_form"": ""النصر"", ""mask_type"": ""ORG""}]",2,approved,,
mt_dial_egy_20cd3ed8,train,23167,DIAL_EGY,اما طارق الفياشا فاقول له كرهكم للصهاينة والله عجب وكيف يكون الحب اذن,اما طارق الفياشا فاقول له كرهكم للصهاينه والله عجب وكيف يكون الحب اذن,اما طارق الفياشا فاقول له كرهكم للصهاينة والله عجب وكيف يكون الحب اذن,[],0,approved,,
mt_dial_glf_07fb7093,train,41251,DIAL_GLF,وين نمور زمان الدبانه يارقيب,وين نمور زمان الدبانه يارقيب,وين نمور زمان الدبانه يارقيب,[],0,approved,,
mt_dial_lev_848926d6,train,84089,DIAL_LEV,و الله الرمثا امتعنا يوم امس . ارجو من المدرب عدنان حمد استعاء الدردور و يا ريت فريق الوحدات يستقدمه فهذا اللعب فعلا سريع و مهاري و يجيد التسديد . حظا اوفر للفيصلي . الفريقين لعبوا جيدا و التوفيق للجميع,و الله الرمثا امتعنا يوم امس ارجو من المدرب عدنان حمد استعاء الدردور و يا ريت فريق الوحدات يستقدمه فهذا اللعب فعلا سريع و مهاري و يجيد التسديد حظا اوفر للفيصلي الفريقين لعبوا جيدا و التوفيق للجميع,و الله الرمثا امتعنا يوم امس . ارجو من المدرب [PERSON_1] استعاء الدردور و يا ريت فريق [ORG_1] يستقدمه فهذا اللعب فعلا سريع و مهاري و يجيد التسديد . حظا اوفر للفيصلي . الفريقين لعبوا جيدا و التوفيق للجميع,"[{""start"": 46, ""end"": 55, ""placeholder"": ""[PERSON_1]"", ""surface_form"": ""عدنان حمد"", ""mask_type"": ""PERSON""}, {""start"": 85, ""end"": 92, ""placeholder"": ""[ORG_1]"", ""surface_form"": ""الوحدات"", ""mask_type"": ""ORG""}]",2,approved,,
mt_msa_5e8c9ca7,train,79604,MSA,لماذا لايقدم المجلس توصية باعطاء المعلمين والمعلمات الدرجات المستحقة والفروقات المادية واحتساب سنوات بند 105 لماذا المجلس يدافع ويقدم توصيات لصالح دكاترة الجامعة ويتجاهل المعلمين ، للمعلومية كل عضو بالمجلس يستلم بدل سكن 100 الف ريال,لماذا لايقدم المجلس توصيه باعطاء المعلمين والمعلمات الدرجات المستحقه والفروقات الماديه واحتساب سنوات بند 105 لماذا المجلس يدافع ويقدم توصيات لصالح دكاتره الجامعه ويتجاهل المعلمين للمعلوميه كل عضو بالمجلس يستلم بدل سكن 100 الف ريال,لماذا لايقدم المجلس توصية باعطاء المعلمين والمعلمات الدرجات المستحقة والفروقات المادية واحتساب سنوات بند 105 لماذا المجلس يدافع ويقدم توصيات لصالح دكاترة الجامعة ويتجاهل المعلمين ، للمعلومية كل عضو بالمجلس يستلم بدل سكن [NUM_1],"[{""start"": 220, ""end"": 232, ""placeholder"": ""[NUM_1]"", ""surface_form"": ""100 الف ريال"", ""mask_type"": ""NUM""}]",1,approved,,
mt_dial_egy_37a7cb01,train,11821,DIAL_EGY,انتي فعلا شاطرة جدا جدا يا استازة منى وانا بحترمك جدا انا واسرتي كمان بنحترم البرنامج الروعة الي انتي بطلة قصتة والي متنوع بافكار شيقة للغاية اكيد من افكارك انتي وفريق العمل,انتي فعلا شاطره جدا جدا يا استازه مني وانا بحترمك جدا انا واسرتي كمان بنحترم البرنامج الروعه الي انتي بطله قصته والي متنوع بافكار شيقه للغايه اكيد من افكارك انتي وفريق العمل,انتي فعلا شاطرة جدا جدا يا استازة منى وانا بحترمك جدا انا واسرتي كمان بنحترم البرنامج الروعة الي انتي بطلة قصتة والي متنوع بافكار شيقة للغاية اكيد من افكارك انتي وفريق العمل,[],0,approved,,
mt_dial_glf_9d908f2b,train,30786,DIAL_GLF,واللي يبغى يختلط يطلع وياخذ راحته وينبسط . . وانتهى الموضوع ^,واللي يبغي يختلط يطلع وياخذ راحته وينبسط وانتهي الموضوع,واللي يبغى يختلط يطلع وياخذ راحته وينبسط . . وانتهى الموضوع ^,[],0,approved,,
mt_dial_lev_1a4c8de7,train,2600,DIAL_LEV,نفسي اشوف واحد من المشاة بمشي على الجسر بالعكس بقطعو من تحت الجسر و لما يندعس الحق طبعا على,نفسي اشوف واحد من المشاه بمشي علي الجسر بالعكس بقطعو من تحت الجسر و لما يندعس الحق طبعا علي,نفسي اشوف واحد من المشاة بمشي على الجسر بالعكس بقطعو من تحت الجسر و لما يندعس الحق طبعا على,[],0,approved,,
mt_msa_cd14c5db,train,35301,MSA,لقد تجرأت هذه العمالة كثيرا وعلى جميع المستويات من ترويج للخمور وعصابات للسرقة وبيوت دعارة و تزوير وبالمقابل مجلس الشورى يرفض نظام استقدام العمالة عن طريق الشركات الذي سوف يؤدي تطبيقه الى القضاء على تجارة الكفالات والعمالة السائبة,لقد تجرات هذه العماله كثيرا وعلي جميع المستويات من ترويج للخمور وعصابات للسرقه وبيوت دعاره و تزوير وبالمقابل مجلس الشوري يرفض نظام استقدام العماله عن طريق الشركات الذي سوف يودي تطبيقه الي القضاء علي تجاره الكفالات والعماله السايبه,لقد تجرأت هذه العمالة كثيرا وعلى جميع المستويات من ترويج للخمور وعصابات للسرقة وبيوت دعارة و تزوير وبالمقابل مجلس الشورى يرفض نظام استقدام العمالة عن طريق الشركات الذي سوف يؤدي تطبيقه الى القضاء على تجارة الكفالات والعمالة السائبة,[],0,approved,,
mt_dial_egy_40c27649,train,76548,DIAL_EGY,وبعدين مش هى دة الصفقات السوبر امل حماهير الاهلى,وبعدين مش هي ده الصفقات السوبر امل حماهير الاهلي,وبعدين مش هى دة الصفقات السوبر امل حماهير الاهلى,[],0,approved,,
mt_dial_glf_c68b74a4,train,71479,DIAL_GLF,والجنه الله المستعان خليها على اطمام المرحوم انجاك منهم شر ولا ماجاك انصاف يالله خليها على,والجنه الله المستعان خليها علي اطمام المرحوم انجاك منهم شر ولا ماجاك انصاف يالله خليها علي,والجنه الله المستعان خليها على اطمام المرحوم انجاك منهم شر ولا ماجاك انصاف يالله خليها على,[],0,approved,,
mt_dial_lev_3a8a2681,train,4015,DIAL_LEV,والله والله والله وكمان الي بلش في الشكله جمهوور ذات,والله والله والله وكمان الي بلش في الشكله جمهوور ذات,والله والله والله وكمان الي بلش في الشكله جمهوور ذات,[],0,approved,,
mt_msa_6365a349,train,19776,MSA,ملاحظة : أرجو النشر عملاً بحرية الرأي والرأي الآخر وشكرا للغد لإتاحة الفرصة للتعليق,ملاحظه ارجو النشر عملا بحريه الراي والراي الاخر وشكرا للغد لاتاحه الفرصه للتعليق,ملاحظة : أرجو النشر عملاً بحرية الرأي والرأي الآخر وشكرا للغد لإتاحة الفرصة للتعليق,[],0,approved,,
mt_dial_egy_183cea77,train,72310,DIAL_EGY,مش بعيد أن رجال الأمن من التحرشين أو من يساعدوا التحرشين أو نفسهم يتحرشوا أو بيساعدوا اللى نفسهم يتحرشوا إلا القيل علشان منظلمش الكل وربنا,مش بعيد ان رجال الامن من التحرشين او من يساعدوا التحرشين او نفسهم يتحرشوا او بيساعدوا اللي نفسهم يتحرشوا الا القيل علشان منظلمش الكل وربنا,مش بعيد أن رجال الأمن من التحرشين أو من يساعدوا التحرشين أو نفسهم يتحرشوا أو بيساعدوا اللى نفسهم يتحرشوا إلا القيل علشان منظلمش الكل وربنا,[],0,approved,,
