example_id,source_split,source_row_id,dialect,original_text,normalized_text,masked_text,mask_spans_json,mask_count,annotation_status,annotator_model,notes
mt_msa_c62ce8ce,train,71029,MSA,العراق في كل فترة من الفترات يتعرض الى غزوا ولكن الحب الموجود في داخل الانسان العراقي الى ارض العراق اقوى من الاحتلال واقوى من الذي يحاول ان يتاجر بحب العراق مثل الزيدي الذي عرض مهنة القلم الى الذل من اجل الحصول على الشهرة المقاومة من خلال الكلمة الشريفة ومن خلال الحب الحقيقي للعراق وليس من خلال حب المال,العراق في كل فتره من الفترات يتعرض الي غزوا ولكن الحب الموجود في داخل الانسان العراقي الي ارض العراق اقوي من الاحتلال واقوي من الذي يحاول ان يتاجر بحب العراق مثل الزيدي الذي عرض مهنه القلم الي الذل من اجل الحصول علي الشهره المقاومه من خلال الكلمه الشريفه ومن خلال الحب الحقيقي للعراق وليس من خلال حب المال,[LOC_1] في كل فترة من الفترات يتعرض الى غزوا ولكن الحب الموجود في داخل الانسان العراقي الى ارض [LOC_1] اقوى من الاحتلال واقوى من الذي يحاول ان يتاجر بحب [LOC_1] مثل الزيدي الذي عرض مهنة القلم الى الذل من اجل الحصول على الشهرة المقاومة من خلال الكلمة الشريفة ومن خلال الحب الحقيقي للعراق وليس من خلال حب المال,"[{""start"": 0, ""end"": 6, ""placeholder"": ""[LOC_1]"", ""surface_form"": ""العراق"", ""mask_type"": ""LOC""}, {""start"": 94, ""end"": 100, ""placeholder"": ""[LOC_1]"", ""surface_form"": ""العراق"", ""mask_type"": ""LOC""}, {""start"": 151, ""end"": 157, ""placeholder"": ""[LOC_1]"", ""surface_form"": ""العراق"", ""mask_type"": ""LOC""}]",3,approved,,
mt_dial_egy_e67ada33,train,78432,DIAL_EGY,ادينى فى الهايف وانا احبك,اديني في الهايف وانا احبك,ادينى فى الهايف وانا احبك,[],0,approved,,
mt_dial_glf_ec99fab2,train,11545,DIAL_GLF,والله هذي اخرتها لما نسكت عن الأخطاء,والله هذي اخرتها لما نسكت عن الاخطاء,والله هذي اخرتها لما نسكت عن الأخطاء,[],0,approved,,
mt_dial_lev_82548a66,train,56726,DIAL_LEV,شكرا لان الكل نفسه ينقذ موسمه بكاس الخواطر بعدين الفيصلي زهق البطولات وحتا خارجيا شباب الاردن اخد بطولات والوحدات لسا ما اخد وبتحكو انو اقوا من الفيصلي يلا يا عبد المنعم خلينا نسمع تعليقاتك كاس اسيا واخدنا والعرب واخدنا ايش بدنا كمان يلا,شكرا لان الكل نفسه ينقذ موسمه بكاس الخواطر بعدين الفيصلي زهق البطولات وحتا خارجيا شباب الاردن اخد بطولات والوحدات لسا ما اخد وبتحكو انو اقوا من الفيصلي يلا يا عبد المنعم خلينا نسمع تعليقاتك كاس اسيا واخدنا والعرب واخدنا ايش بدنا كمان يلا,شكرا لان الكل نفسه ينقذ موسمه بكاس الخواطر بعدين [ORG_1] زهق البطولات وحتا خارجيا [ORG_2] اخد بطولات و[ORG_3] لسا ما اخد وبتحكو انو اقوا من [ORG_1] يلا يا عبد المنعم خلينا نسمع تعليقاتك كاس اسيا واخدنا والعرب واخدنا ايش بدنا كمان يلا,"[{""start"": 49, ""end"": 56, ""placeholder"": ""[ORG_1]"", ""surface_form"": ""الفيصلي"", ""mask_type"": ""ORG""}, {""start"": 82, ""end"": 93, ""placeholder"": ""[ORG_2]"", ""surface_form"": ""شباب الاردن"", ""mask_type"": ""ORG""}, {""start"": 106, ""end"": 113, ""placeholder"": ""[ORG_3]"", ""surface_form"": ""الوحدات"", ""mask_type"": ""ORG""}, {""start"": 144, ""end"": 151, ""placeholder"": ""[ORG_1]"", ""surface_form"": ""الفيصلي"", ""mask_type"": ""ORG""}]",4,approved,,
mt_msa_1166b634,train,82891,MSA,نسال الله الشفاء لامتنا الاسلاميه والعربيه من المرض والمرض,نسال الله الشفاء لامتنا الاسلاميه والعربيه من المرض والمرض,نسال الله الشفاء لامتنا الاسلاميه والعربيه من المرض والمرض,[],0,approved,,
mt_dial_egy_696267cd,train,35606,DIAL_EGY,لا أحسن خلي الناس الهايفة والجاهلة يتاحكموا في مصير 80 مليون ( جاهل فاسد ولا عالم فاسد ه ) وبعدين هم مين النواب الفلاحين والعمال انت شفتهم دي نسبه محسوبة على الفاضي ولا ليها وجود كلام على الورق بس حلاوة روح من روح زمان ايه رأيكم نخلي نسبة للفلاحين ونسبة للعمال ونسمة للموظفين القطاع العام ونسبة للقطاع ونسبة للمسلمين ونسبة للمسحين ونسبة للفشلين ونسبة للناجحين ونسبة للمرأة ونسبة لرجل ونسبة للعيال عشان امهم ماتزعلش جاتكم خيبة هي دي مصر ومصرين ولا تقسمة انت من هنا وانا من هناك اللي يخدم يخدم مصر وصالح البلد مش يكون راجل رايح فين رايح الماجلس جاي منين جاي من المجلس لا ياعم انا ماليش دعوة انا نايب عن الفلاح ماليش دعوة دي مشكلة ماتخصنيش . . . وبعدين تعليق اللي كاتب وبيقول انه على الكمبيوتروالتويتروالفيس بوك طيب ومالوا لما يكون قادر يتواصل مع الناس اللي ليها علاقة بالحاجات دي ولا خليه احسن وراء الجموسة يحلب فيها - والله ممكن تلاقي نصهم ما قرا الدستور ولا القانون ولا اي حاجة وداخلها بعصبية ولا قبلية شغل عائلات يعني ولا تبع الحزب واطي . . . تتلغي كل التقسيمات ومايجيش حد تبع كوتة أو نظام مفروض على الناس ويتم الأنتخاب حسب المناطق فقط وبدون اي تقسيمات او اتجاهات مفروضة على الناس وبلاش المسميات الرنانة والخايبة - عمال وفلاحين هو انتم خاليتم في مصر غير,لا احسن خلي الناس الهايفه والجاهله يتاحكموا في مصير 80 مليون جاهل فاسد ولا عالم فاسد ه وبعدين هم مين النواب الفلاحين والعمال انت شفتهم دي نسبه محسوبه علي الفاضي ولا ليها وجود كلام علي الورق بس حلاوه روح من روح زمان ايه رايكم نخلي نسبه للفلاحين ونسبه للعمال ونسمه للموظفين القطاع العام ونسبه للقطاع ونسبه للمسلمين ونسبه للمسحين ونسبه للفشلين ونسبه للناجحين ونسبه للمراه ونسبه لرجل ونسبه للعيال عشان امهم ماتزعلش جاتكم خيبه هي دي مصر ومصرين ولا تقسمه انت من هنا وانا من هناك اللي يخدم يخدم مصر وصالح البلد مش يكون راجل رايح فين رايح الماجلس جاي منين جاي من المجلس لا ياعم انا ماليش دعوه انا نايب عن الفلاح ماليش دعوه دي مشكله ماتخصنيش وبعدين تعليق اللي كاتب وبيقول انه علي الكمبيوتروالتويتروالفيس بوك طيب ومالوا لما يكون قادر يتواصل مع الناس اللي ليها علاقه بالحاجات دي ولا خليه احسن وراء الجموسه يحلب فيها والله ممكن تلاقي نصهم ما قرا الدستور ولا القانون ولا اي حاجه وداخلها بعصبيه ولا قبليه شغل عايلات يعني ولا تبع الحزب واطي تتلغي كل التقسيمات ومايجيش حد تبع كوته او نظام مفروض علي الناس ويتم الانتخاب حسب المناطق فقط وبدون اي تقسيمات او اتجاهات مفروضه علي الناس وبلاش المسميات الرنانه والخايبه عمال وفلاحين هو انتم خاليتم في مصر غير,لا أحسن خلي الناس الهايفة والجاهلة يتاحكموا في مصير 80 مليون ( جاهل فاسد ولا عالم فاسد ه ) وبعدين هم مين النواب الفلاحين والعمال انت شفتهم دي نسبه محسوبة على الفاضي ولا ليها وجود كلام على الورق بس حلاوة روح من روح زمان ايه رأيكم نخلي نسبة للفلاحين ونسبة للعمال ونسمة للموظفين القطاع العام ونسبة للقطاع ونسبة للمسلمين ونسبة للمسحين ونسبة للفشلين ونسبة للناجحين ونسبة للمرأة ونسبة لرجل ونسبة للعيال عشان امهم ماتزعلش جاتكم خيبة هي دي [LOC_1] ومصرين ولا تقسمة انت من هنا وانا من هناك اللي يخدم يخدم [LOC_1] وصالح البلد مش يكون راجل رايح فين رايح الماجلس جاي منين جاي من المجلس لا ياعم انا ماليش دعوة انا نايب عن الفلاح ماليش دعوة دي مشكلة ماتخصنيش . . . وبعدين تعليق اللي كاتب وبيقول انه على الكمبيوتروالتويتروالفيس بوك طيب ومالوا لما يكون قادر يتواصل مع الناس اللي ليها علاقة بالحاجات دي ولا خليه احسن وراء الجموسة يحلب فيها - والله ممكن تلاقي نصهم ما قرا الدستور ولا القانون ولا اي حاجة وداخلها بعصبية ولا قبلية شغل عائلات يعني ولا تبع الحزب واطي . . . تتلغي كل التقسيمات ومايجيش حد تبع كوتة أو نظام مفروض على الناس ويتم الأنتخاب حسب المناطق فقط وبدون اي تقسيمات او اتجاهات مفروضة على الناس وبلاش المسميات الرنانة والخايبة - عمال وفلاحين هو انتم خاليتم في [LOC_1] غير,"[{""start"": 432, ""end"": 435, ""placeholder"": ""[LOC_1]"", ""surface_form"": ""مصر"", ""mask_type"": ""LOC""}, {""start"": 492, ""end"": 495, ""placeholder"": ""[LOC_1]"", ""surface_form"": ""مصر"", ""mask_type"": ""LOC""}, {""start"": 1147, ""end"": 1150, ""placeholder"": ""[LOC_1]"", ""surface_form"": ""مصر"", ""mask_type"": ""LOC""}]",3,approved,,
mt_dial_glf_da202a22,train,20899,DIAL_GLF,لكن ابشرك امورك محلولة بما ان المباراة القادمة امام الهلال وإلا صدقني لتبطي عظم ماخذت حقوقك . . وزيك زي الكوري,لكن ابشرك امورك محلوله بما ان المباراه القادمه امام الهلال والا صدقني لتبطي عظم ماخذت حقوقك وزيك زي الكوري,لكن ابشرك امورك محلولة بما ان المباراة القادمة امام [ORG_1] وإلا صدقني لتبطي عظم ماخذت حقوقك . . وزيك زي الكوري,"[{""start"": 52, ""end"": 58, ""placeholder"": ""[ORG_1]"", ""surface_form"": ""الهلال"", ""mask_type"": ""ORG""}]",1,approved,,
mt_dial_lev_baf9981a,train,32383,DIAL_LEV,عبد السلام قتل عمد وليس خطأ كل يوم بطلعوا قصة جديدة مش عارفين شو بدهم يحكوا طبعا مهو الموضوع . . . الله يرحمك يا عبد السلام النعيمات يا فقيد الأمة كلها لانه بالدنيا كلها ما في واحد,عبد السلام قتل عمد وليس خطا كل يوم بطلعوا قصه جديده مش عارفين شو بدهم يحكوا طبعا مهو الموضوع الله يرحمك يا عبد السلام النعيمات يا فقيد الامه كلها لانه بالدنيا كلها ما في واحد,عبد السلام قتل عمد وليس خطأ كل يوم بطلعوا قصة جديدة مش عارفين شو بدهم يحكوا طبعا مهو الموضوع . . . الله يرحمك يا عبد السلام النعيمات يا فقيد الأمة كلها لانه بالدنيا كلها ما في واحد,[],0,approved,,
mt_msa_b6879b3e,train,33417,MSA,الحمدلالله رجع السيف رمز العز والشجاعة الى دارة نجد موحد الجزيرة العربية وأهنيك ياخادم الحرمين برجوع الاجرب الى بلاد,الحمدلالله رجع السيف رمز العز والشجاعه الي داره نجد موحد الجزيره العربيه واهنيك ياخادم الحرمين برجوع الاجرب الي بلاد,الحمدلالله رجع السيف رمز العز والشجاعة الى دارة نجد موحد الجزيرة العربية وأهنيك ياخادم الحرمين برجوع الاجرب الى بلاد,[],0,approved,,
mt_dial_egy_fae3396f,train,62555,DIAL_EGY,ياعم الزملكاوي خليك في كوزك لما,ياعم الزملكاوي خليك في كوزك لما,ياعم الزملكاوي خليك في كوزك لما,[],0,approved,,
mt_dial_glf_37597775,train,16633,DIAL_GLF,"تقول فيه ريتك توفي بالقسم بعدرقم . . "" الحسابا",تقول فيه ريتك توفي بالقسم بعدرقم الحسابا,"تقول فيه ريتك توفي بالقسم بعدرقم . . "" الحسابا",[],0,approved,,
mt_dial_lev_a586382a,train,38478,DIAL_LEV,والنتيجة بدها تخطيط يا عطوفة الامين .,والنتيجه بدها تخطيط يا عطوفه الامين,والنتيجة بدها تخطيط يا عطوفة الامين .,[],0,approved,,
mt_msa_d34736db,train,40697,MSA,تلاقي أولها التعليم العالي والتدريب مصر 88 الحزائر,تلاقي اولها التعليم العالي والتدريب مصر 88 الحزاير,تلاقي أولها التعليم العالي والتدريب [LOC_1] 88 الحزائر,"[{""start"": 36, ""end"": 39, ""placeholder"": ""[LOC_1]"", ""surface_form"": ""مصر"", ""mask_type"": ""LOC""}]",1,approved,,
mt_dial_egy_3022ea92,train,37481,DIAL_EGY,بجد عيب اوي عليكم انكم تعملو موضوع سخيف زي ده ، ، واللي اسخف الصور اللي ملهاش اي علاقه بالموضوع ، دي صور ناس بتضحك مع بعضها وواحد وخطيبته وواحد مع العيله بتاعته,بجد عيب اوي عليكم انكم تعملو موضوع سخيف زي ده واللي اسخف الصور اللي ملهاش اي علاقه بالموضوع دي صور ناس بتضحك مع بعضها وواحد وخطيبته وواحد مع العيله بتاعته,بجد عيب اوي عليكم انكم تعملو موضوع سخيف زي ده ، ، واللي اسخف الصور اللي ملهاش اي علاقه بالموضوع ، دي صور ناس بتضحك مع بعضها وواحد وخطيبته وواحد مع العيله بتاعته,[],0,approved,,
mt_dial_glf_6c9eddac,train,69050,DIAL_GLF,وبعدين تخفف من زحمه خط جده الى,وبعدين تخفف من زحمه خط جده الي,وبعدين تخفف من زحمه خط جده الى,[],0,approved,,
mt_dial_lev_6ee01e6f,train,72398,DIAL_LEV,والله لو بثت كل البطوله مجاني والله غير تربح اضعاف الي راح تربحه وهي مش مجاني لانه راح يوصل لكل العالم وشوف الدعايات راح تشتغل صح والشركات كبيره وعالميه راح تتهافت لانه بهبمهم اعلانهم يوصل لاكبر شريحه من الناس هاد ازا مش كله . بس قناة عربيه ما بتفكر بطريقه سليمه ولا بتفكر ابعد من هيك غير باطماعها واسلوبها الي ما بعرف شو ممكن الواحد يحكي عنه والباقي,والله لو بثت كل البطوله مجاني والله غير تربح اضعاف الي راح تربحه وهي مش مجاني لانه راح يوصل لكل العالم وشوف الدعايات راح تشتغل صح والشركات كبيره وعالميه راح تتهافت لانه بهبمهم اعلانهم يوصل لاكبر شريحه من الناس هاد ازا مش كله بس قناه عربيه ما بتفكر بطريقه سليمه ولا بتفكر ابعد من هيك غير باطماعها واسلوبها الي ما بعرف شو ممكن الواحد يحكي عنه والباقي,والله لو بثت كل البطوله مجاني والله غير تربح اضعاف الي راح تربحه وهي مش مجاني لانه راح يوصل لكل العالم وشوف الدعايات راح تشتغل صح والشركات كبيره وعالميه راح تتهافت لانه بهبمهم اعلانهم يوصل لاكبر شريحه من الناس هاد ازا مش كله . بس قناة عربيه ما بتفكر بطريقه سليمه ولا بتفكر ابعد من هيك غير باطماعها واسلوبها الي ما بعرف شو ممكن الواحد يحكي عنه والباقي,[],0,approved,,
mt_msa_6232614a,train,85710,MSA,لاعبوا الوحدات كبار حتى ناشيئينهم,لاعبوا الوحدات كبار حتي ناشييينهم,لاعبوا [ORG_1] كبار حتى ناشيئينهم,"[{""start"": 7, ""end"": 14, ""placeholder"": ""[ORG_1]"", ""surface_form"": ""الوحدات"", ""mask_type"": ""ORG""}]",1,approved,,
mt_dial_egy_c7a80a85,train,74884,DIAL_EGY,لماذا انت دائم الحديث عالفاضية و المليانه ؟,لماذا انت دايم الحديث عالفاضيه و المليانه,لماذا انت دائم الحديث عالفاضية و المليانه ؟,[],0,approved,,
mt_dial_glf_e123f816,train,24452,DIAL_GLF,تدري ان الشي الوحيد اللي ناقص كتابتك هذي هو اغنيه,تدري ان الشي الوحيد اللي ناقص كتابتك هذي هو اغنيه,تدري ان الشي الوحيد اللي ناقص كتابتك هذي هو اغنيه,[],0,approved,,
mt_dial_lev_c1ba6a31,train,67134,DIAL_LEV,فعلا اول يوم بوصل فيه بقعد مع الاهل وتاني يوم مباشره بروح على شارع,فعلا اول يوم بوصل فيه بقعد مع الاهل وتاني يوم مباشره بروح علي شارع,فعلا اول يوم بوصل فيه بقعد مع الاهل وتاني يوم مباشره بروح على شارع,[],0,approved,,
mt_msa_5af4ec03,train,21391,MSA,الوحدات في اخر خمس مواسم احرز بطوله الدوري اربع مرات ( منها ثلاث سنوات متتاليه ) و لكنه ابدا لم يحرز الدوري لخمس سنوات متتاليه الا اذا اعتبرت انت ان نادي شباب الاردن هو نادي الوحدات,الوحدات في اخر خمس مواسم احرز بطوله الدوري اربع مرات منها ثلاث سنوات متتاليه و لكنه ابدا لم يحرز الدوري لخمس سنوات متتاليه الا اذا اعتبرت انت ان نادي شباب الاردن هو نادي الوحدات,[ORG_1] في اخر خمس مواسم احرز بطوله الدوري اربع مرات ( منها ثلاث سنوات متتاليه ) و لكنه ابدا لم يحرز الدوري لخمس سنوات متتاليه الا اذا اعتبرت انت ان نادي [ORG_2] هو [ORG_1],"[{""start"": 0, ""end"": 7, ""placeholder"": ""[ORG_1]"", ""surface_form"": ""الوحدات"", ""mask_type"": ""ORG""}, {""start"": 154, ""end"": 165, ""placeholder"": ""[ORG_2]"", ""surface_form"": ""شباب الاردن"", ""mask_type"": ""ORG""}, {""start"": 169, ""end"": 181, ""placeholder"": ""[ORG_1]"", ""surface_form"": ""نادي الوحدات"", ""mask_type"": ""ORG""}]",3,approved,,
mt_dial_egy_2476a330,train,82639,DIAL_EGY,شوفوا بقي التجسس وصل لدرجة اية انهم بيبعتوا حواسسهم علي انهم صحفيون علشان اللي يتمسك بعد كدة يبقي صحفي وجاي يعمل تحقيق حد يقدر يروح من المصريين ويعمل كدة ويدخل كنسهم ويعرف هما بيعملوا اية اوبيخططوا لايةربنا يسترها معانامع العلم دي اللي مش سيابة اي فرصة لمحاربتنا,شوفوا بقي التجسس وصل لدرجه ايه انهم بيبعتوا حواسسهم علي انهم صحفيون علشان اللي يتمسك بعد كده يبقي صحفي وجاي يعمل تحقيق حد يقدر يروح من المصريين ويعمل كده ويدخل كنسهم ويعرف هما بيعملوا ايه اوبيخططوا لايهربنا يسترها معانامع العلم دي اللي مش سيابه اي فرصه لمحاربتنا,شوفوا بقي التجسس وصل لدرجة اية انهم بيبعتوا حواسسهم علي انهم صحفيون علشان اللي يتمسك بعد كدة يبقي صحفي وجاي يعمل تحقيق حد يقدر يروح من المصريين ويعمل كدة ويدخل كنسهم ويعرف هما بيعملوا اية اوبيخططوا لايةربنا يسترها معانامع العلم دي اللي مش سيابة اي فرصة لمحاربتنا,[],0,approved,,
mt_dial_glf_338898db,train,44955,DIAL_GLF,ياأخي . . . ياما ترتكب محظورات باسم واستخدام الغطاء . . . الشيخ الالباني الله يرحمه يقول لايجوز ارغام البنت على تغطية الوجه فيجب مراجعة استخدامه وكذلك تعميم بطاقة المرأة بما فيها الصورة لعدم استغلال,يااخي ياما ترتكب محظورات باسم واستخدام الغطاء الشيخ الالباني الله يرحمه يقول لايجوز ارغام البنت علي تغطيه الوجه فيجب مراجعه استخدامه وكذلك تعميم بطاقه المراه بما فيها الصوره لعدم استغلال,ياأخي . . . ياما ترتكب محظورات باسم واستخدام الغطاء . . . الشيخ الالباني الله يرحمه يقول لايجوز ارغام البنت على تغطية الوجه فيجب مراجعة استخدامه وكذلك تعميم بطاقة المرأة بما فيها الصورة لعدم استغلال,[],0,approved,,
mt_dial_lev_85befb22,train,68015,DIAL_LEV,""" يعني انا لما اروح اشتري لمبة حقها 3 . 6 دينار ببطل اشتريها لانوا سعرها غالي",يعني انا لما اروح اشتري لمبه حقها 3 6 دينار ببطل اشتريها لانوا سعرها غالي,""" يعني انا لما اروح اشتري لمبة حقها 3 . 6 دينار ببطل اشتريها لانوا سعرها غالي",[],0,approved,,
mt_msa_487e5bf1,train,26887,MSA,في رايي انه شيء رائع على كل المستويات حينما يكون الشخص المناسب في المكان ( المنصب ) المناسب لأنه بذلك يكون مكسبا وطنيا وقوميا لايقدر بثمن .,في رايي انه شيء رايع علي كل المستويات حينما يكون الشخص المناسب في المكان المنصب المناسب لانه بذلك يكون مكسبا وطنيا وقوميا لايقدر بثمن,في رايي انه شيء رائع على كل المستويات حينما يكون الشخص المناسب في المكان ( المنصب ) المناسب لأنه بذلك يكون مكسبا وطنيا وقوميا لايقدر بثمن .,[],0,approved,,
mt_dial_egy_ef47d94b,train,29430,DIAL_EGY,اظاهر احنا عايزين شعب من برة يقوملنا بالتغيير و يروح بلده,اظاهر احنا عايزين شعب من بره يقوملنا بالتغيير و يروح بلده,اظاهر احنا عايزين شعب من برة يقوملنا بالتغيير و يروح بلده,[],0,approved,,
