example_id,source_split,source_row_id,dialect,original_text,normalized_text,masked_text,mask_spans_json,mask_count,annotation_status,annotator_model,notes
mt_msa_65cbc149,train,54692,MSA,علينا وضع نصب أعيننا اننا لن نعيش و لن نرضى أن نعيش إلا على تراب وطننا و أن تكون فلسطين دولة عربية . الصبر مفتاح الفرج,علينا وضع نصب اعيننا اننا لن نعيش و لن نرضي ان نعيش الا علي تراب وطننا و ان تكون فلسطين دوله عربيه الصبر مفتاح الفرج,,[],0,pending,,
mt_dial_egy_542f8b07,train,27306,DIAL_EGY,( على فكرة انا اهلاوي ومتعصب جدا,علي فكره انا اهلاوي ومتعصب جدا,,[],0,pending,,
mt_dial_glf_4c5382b6,train,83700,DIAL_GLF,الحين يا السدحان تتكلم في اصحاب رؤوس الاموال انهم ما يوظفون الشباب وفي نفس الخبر تتبجح ان عندك طاقم مميز للعمل وما اشوف فيهم ولا سعودي,الحين يا السدحان تتكلم في اصحاب رووس الاموال انهم ما يوظفون الشباب وفي نفس الخبر تتبجح ان عندك طاقم مميز للعمل وما اشوف فيهم ولا سعودي,,[],0,pending,,
mt_dial_lev_02ee3904,train,23003,DIAL_LEV,وعفية على القرود اللي حاولت تاخذ حقها بايديها وما سكتت عالظلم . . مش زينا . . قد ما انقرصنا عمرنا ما بنتعلم ولا,وعفيه علي القرود اللي حاولت تاخذ حقها بايديها وما سكتت عالظلم مش زينا قد ما انقرصنا عمرنا ما بنتعلم ولا,,[],0,pending,,
mt_msa_716c162e,train,155,MSA,أنا أفهم ان الكفاءة السياسية هي رغبة شخص ما في دخول المعترك السياسي للخدمة العامة وذو راي وفكر تحليلي وتفاوضي ويمتلك القدرة على ( المساومات ) . .,انا افهم ان الكفاءه السياسيه هي رغبه شخص ما في دخول المعترك السياسي للخدمه العامه وذو راي وفكر تحليلي وتفاوضي ويمتلك القدره علي المساومات,,[],0,pending,,
mt_dial_egy_b4247217,train,57407,DIAL_EGY,قناة للمعارضين فقط ! طبعا فرع من قناة الجزيرة 1 و طبعا هتستضيف اصحاب الراى المعارض فقط لكى تكون امتدادا للجزيرة و تستضيف من يشوهون صورة النظام و يتغزلون فى البرادعى ! و يعبرون عن وجهة نظر وحيدة ! يعنى كل الهيصة دى عشان حمدى قنديل مشوه من القنوات المصرية ؟ قوم راح قناة المنار ( قناة حزب الله ) و الجزيرة و عمل موضوع التعديل عشان ينتقم لنفسه و مكافأته هى قناة صغنونة على قدو يبقى هو صاحبها ؟ يا بلاش و اللهّ عشان كده الراجل كان تاعب نفسه,قناه للمعارضين فقط طبعا فرع من قناه الجزيره 1 و طبعا هتستضيف اصحاب الراي المعارض فقط لكي تكون امتدادا للجزيره و تستضيف من يشوهون صوره النظام و يتغزلون في البرادعي و يعبرون عن وجهه نظر وحيده يعني كل الهيصه دي عشان حمدي قنديل مشوه من القنوات المصريه قوم راح قناه المنار قناه حزب الله و الجزيره و عمل موضوع التعديل عشان ينتقم لنفسه و مكافاته هي قناه صغنونه علي قدو يبقي هو صاحبها يا بلاش و الله عشان كده الراجل كان تاعب نفسه,,[],0,pending,,
mt_dial_glf_b6da4da6,train,51272,DIAL_GLF,كذا صح من شان يعرفوا ان اللبنانين متحدين بكلمتهم واذا جد الجد فانهم علي كلمة واحدة علي اختلاف,كذا صح من شان يعرفوا ان اللبنانين متحدين بكلمتهم واذا جد الجد فانهم علي كلمه واحده علي اختلاف,,[],0,pending,,
mt_dial_lev_2aa17654,train,77700,DIAL_LEV,الاضحية خير وبركة وبطلعلك ناس بحكولك مش ضروري الاضحية والزمن تغير ! ! ! خذلك حكي من بعض,الاضحيه خير وبركه وبطلعلك ناس بحكولك مش ضروري الاضحيه والزمن تغير خذلك حكي من بعض,,[],0,pending,,
mt_msa_fbfaab82,train,4234,MSA,"مع كل الاحترام انا لا اقلل من شأن الفيصلي او لاعبيه , لكن هذا هو واقع الكرة الاردنية بشكل عام في تراجع مستمر",مع كل الاحترام انا لا اقلل من شان الفيصلي او لاعبيه لكن هذا هو واقع الكره الاردنيه بشكل عام في تراجع مستمر,,[],0,pending,,
mt_dial_egy_14c56a78,train,71853,DIAL_EGY,ربنا بسترها علينا جميعا الان الحوادث اصبحت مميته وكمن بالشوارع الداخليه وليست بطرق السفر فقط ولسه ، ،,ربنا بسترها علينا جميعا الان الحوادث اصبحت مميته وكمن بالشوارع الداخليه وليست بطرق السفر فقط ولسه,,[],0,pending,,
mt_dial_glf_cb857f75,train,10579,DIAL_GLF,لكن ما فهمت وشلون يعتمدون الساعات للممارس الصحي بمجرد إنه يشوف المحاضرة على القناة ؟ ؟ ؟,لكن ما فهمت وشلون يعتمدون الساعات للممارس الصحي بمجرد انه يشوف المحاضره علي القناه,,[],0,pending,,
mt_dial_lev_f792f9fc,train,13568,DIAL_LEV,والحكومة الرشيدة طول نهارها تشكي عجز بالموازنة اي والله فرق سعر بيع النفط بجيب ايرادات بلاوي,والحكومه الرشيده طول نهارها تشكي عجز بالموازنه اي والله فرق سعر بيع النفط بجيب ايرادات بلاوي,,[],0,pending,,
mt_msa_b5d283d3,train,26833,MSA,"أرى أن المشكلة الرئيسية ياعزيزي هي في أزمة الفهم الحقيقي للإسلام ! ! برؤية متجردة نجد الكثير من النماذج الناجحة من أبناء الجاليات المسلمة على كل المستويات , ولكن كل هذا التميز يذهب في لحظة واحدة ولايصبح للعقل أو المنطق أي وجود عندما يتم تسليم الفكر لوصاية مايسمى برجال الدين المتشددين",اري ان المشكله الرييسيه ياعزيزي هي في ازمه الفهم الحقيقي للاسلام برويه متجرده نجد الكثير من النماذج الناجحه من ابناء الجاليات المسلمه علي كل المستويات ولكن كل هذا التميز يذهب في لحظه واحده ولايصبح للعقل او المنطق اي وجود عندما يتم تسليم الفكر لوصايه مايسمي برجال الدين المتشددين,,[],0,pending,,
mt_dial_egy_f315f97d,train,25563,DIAL_EGY,والله مهما كانت الحرب على,والله مهما كانت الحرب علي,,[],0,pending,,
mt_dial_glf_6f4bed32,train,23419,DIAL_GLF,مين نصدق شيوخ يقولون لايجوز ومحرم وشيوخ يقولون يحوز وحلال لكن بضوابط معينه طيب وبعدين يعني كل السنوات الماضيه كان مجتمعنا على خطاء ذنب مين وين الادله التي ذكرها الشيخ الغامدي ليش كانت مخفيه وين المجمع الفقهي وين المفتي وين هيئة كبار العلماء ليش مااحد يرد ليش الصمت وين الحقيقه يعني انا عن نفسي بر جع لامهات الكتب والمراجع والتفاسير والاحاديث اقراء,مين نصدق شيوخ يقولون لايجوز ومحرم وشيوخ يقولون يحوز وحلال لكن بضوابط معينه طيب وبعدين يعني كل السنوات الماضيه كان مجتمعنا علي خطاء ذنب مين وين الادله التي ذكرها الشيخ الغامدي ليش كانت مخفيه وين المجمع الفقهي وين المفتي وين هييه كبار العلماء ليش مااحد يرد ليش الصمت وين الحقيقه يعني انا عن نفسي بر جع لامهات الكتب والمراجع والتفاسير والاحاديث اقراء,,[],0,pending,,
mt_dial_lev_9d8b6332,train,38252,DIAL_LEV,وكلنا نهتف واحد اثنين الدوري,وكلنا نهتف واحد اثنين الدوري,,[],0,pending,,
mt_msa_a652a8ea,train,78153,MSA,لماذا لا تتحمل الخزينة الفرق عن طريق التخفيض في الرسوم على المشغلين ؟ ! !,لماذا لا تتحمل الخزينه الفرق عن طريق التخفيض في الرسوم علي المشغلين,,[],0,pending,,
mt_dial_egy_f6ee42ef,train,16527,DIAL_EGY,خسارة كبيرة أن يجد الإعلام الرياضي مثل هذا الرجل مرة أخدى ولا يحق لنا أن نتهمه بأنه يتعالى ع منتخب مصر ويتصيد له الأخطاء وإنما الرجل يقول كلمة صادقة ع أية حال ويحاول التقويم من أداء المنتخب وأنا أتمنى ألا يترك الساحة الإعلامية فهذا الرجل قلما يجود الإعلام,خساره كبيره ان يجد الاعلام الرياضي مثل هذا الرجل مره اخدي ولا يحق لنا ان نتهمه بانه يتعالي ع منتخب مصر ويتصيد له الاخطاء وانما الرجل يقول كلمه صادقه ع ايه حال ويحاول التقويم من اداء المنتخب وانا اتمني الا يترك الساحه الاعلاميه فهذا الرجل قلما يجود الاعلام,,[],0,pending,,
mt_dial_glf_121caa39,train,50231,DIAL_GLF,نروح المدرسه بدري ونضحك داخل,نروح المدرسه بدري ونضحك داخل,,[],0,pending,,
mt_dial_lev_f9d5c961,train,19566,DIAL_LEV,هلا عمي يعني بالعربي ضحك على الذقون والهيئة مش عاملة اشي بس بتوخذ مصاري لجيبتها,هلا عمي يعني بالعربي ضحك علي الذقون والهييه مش عامله اشي بس بتوخذ مصاري لجيبتها,,[],0,pending,,
mt_msa_1f672104,train,30755,MSA,نيفين شكرى احد اشهر المعلقين على اليوم,نيفين شكري احد اشهر المعلقين علي اليوم,,[],0,pending,,
mt_dial_egy_38bd5103,train,9893,DIAL_EGY,انحطاط ، قله ادب ، بلطجه ، لغه شوارع ، والي ماعرفش اخده بلساني اخده,انحطاط قله ادب بلطجه لغه شوارع والي ماعرفش اخده بلساني اخده,,[],0,pending,,
mt_dial_glf_ae751a6f,train,15542,DIAL_GLF,وين العدل وين الممثلين الحلوين ليش ماتطلعون صورهم وتخبروننا,وين العدل وين الممثلين الحلوين ليش ماتطلعون صورهم وتخبروننا,,[],0,pending,,
mt_dial_lev_a173690e,train,1940,DIAL_LEV,من حق اللاعب رافت علي انه يطلب 24 الف دينار ومش كتير عليه لانه العتال و ابوكشكش مش احسن منه و قعوا ب 50 الف ورافت اكتر لاعب خدم النادي و فرح الجمهور باهدافه وصناعته,من حق اللاعب رافت علي انه يطلب 24 الف دينار ومش كتير عليه لانه العتال و ابوكشكش مش احسن منه و قعوا ب 50 الف ورافت اكتر لاعب خدم النادي و فرح الجمهور باهدافه وصناعته,,[],0,pending,,
mt_msa_78e02817,train,50378,MSA,بالعكس هذا الرجل قال ما يخشى الجميع ان يقول فان مصر هى الوحيدة التى تتصدر,بالعكس هذا الرجل قال ما يخشي الجميع ان يقول فان مصر هي الوحيده التي تتصدر,,[],0,pending,,
mt_dial_egy_199e435a,train,2608,DIAL_EGY,يا جماعة البلد دى مش بتاعتنا فريحوا نفسيكم استنوا دوركم فى فيرس سى او السرطان علشان متتعبوش نفسكم ولا تغيير ولا عبير لان مفيش فايدة يذهب ظالم ويأتى ديكتاتور هو ده حال مصر وحيفضل هذا الحال بوسة كوسة مصر اتوكست وحتفضل,يا جماعه البلد دي مش بتاعتنا فريحوا نفسيكم استنوا دوركم في فيرس سي او السرطان علشان متتعبوش نفسكم ولا تغيير ولا عبير لان مفيش فايده يذهب ظالم وياتي ديكتاتور هو ده حال مصر وحيفضل هذا الحال بوسه كوسه مصر اتوكست وحتفضل,,[],0,pending,,
mt_dial_glf_25c81ee5,train,82530,DIAL_GLF,شف الحرمة المسكينه هي لوحدها اللي,شف الحرمه المسكينه هي لوحدها اللي,,[],0,pending,,
mt_dial_lev_715ac379,train,7287,DIAL_LEV,العشائر الاردنيه بترفع الراس مش مافيا بتحمي الزعرنه .,العشاير الاردنيه بترفع الراس مش مافيا بتحمي الزعرنه,,[],0,pending,,
mt_msa_5b7e805b,train,23640,MSA,"انا يانيقين لاانحاز لاحد ولكن اذا رأيت موقف يستحق تأييد حسنى مبارك اؤيدة وخاصة كقائد قوات ناجح رغم اخفاقة كرئيس , ومن هنا فرأيى تجاة الرجل محايد تما ما ولا اتأثر بفكرة مسبقة تسيطر على",انا يانيقين لاانحاز لاحد ولكن اذا رايت موقف يستحق تاييد حسني مبارك اويده وخاصه كقايد قوات ناجح رغم اخفاقه كرييس ومن هنا فرايي تجاه الرجل محايد تما ما ولا اتاثر بفكره مسبقه تسيطر علي,,[],0,pending,,
mt_dial_egy_77e6ad57,train,1868,DIAL_EGY,امتى اشوف لاعب عربي زى ميسي او حتى نص ميسى دا لو الاهلى عنده ميسى كان ممكن يريح الفريق كله وينزل ميسى بس وكان هيهحسم الدورى من الدور الاول بس عدد الاهداف مجهولة لعدم القدرة على,امتي اشوف لاعب عربي زي ميسي او حتي نص ميسي دا لو الاهلي عنده ميسي كان ممكن يريح الفريق كله وينزل ميسي بس وكان هيهحسم الدوري من الدور الاول بس عدد الاهداف مجهوله لعدم القدره علي,,[],0,pending,,
mt_dial_glf_02ce52da,train,2882,DIAL_GLF,وليش هشموا زجاج الجمس ؟ ليه ما هشموا رأس الموذي منهم ؟ فكوا الناس من لقافتكم يابدو ، ترى الناس ضاق بيهم الحال,وليش هشموا زجاج الجمس ليه ما هشموا راس الموذي منهم فكوا الناس من لقافتكم يابدو تري الناس ضاق بيهم الحال,,[],0,pending,,
mt_dial_lev_c81ecb72,train,64688,DIAL_LEV,بحبك يا وحدات و هدا الاخضر ما,بحبك يا وحدات و هدا الاخضر ما,,[],0,pending,,
mt_msa_f547d6d7,train,16366,MSA,"لقد ضاق صدرى بما لا يقال ويبقى السؤال الحائر فى القلوب . إلى متى يستمر هذا الفساد . أما لهذا الليل من آخر . يا أمة ضحكت من جهلها الأمم . ختاما , , تعازينا للضحايا والمنكوبين ,",لقد ضاق صدري بما لا يقال ويبقي السوال الحاير في القلوب الي متي يستمر هذا الفساد اما لهذا الليل من اخر يا امه ضحكت من جهلها الامم ختاما تعازينا للضحايا والمنكوبين,,[],0,pending,,
