example_id,source_split,source_row_id,dialect,original_text,normalized_text,masked_text,mask_spans_json,mask_count,annotation_status,annotator_model,notes
mt_dial_egy_8b0a6039,train,46400,DIAL_EGY,حتى الفسيخ من كتر الفساد يقول انا ولا,حتي الفسيخ من كتر الفساد يقول انا ولا,,[],0,pending,,
mt_dial_glf_958d4c91,train,85863,DIAL_GLF,السلام عليكم . . يحلمون ويمكن بالخمسه ثاني يلقمون ؟ ! بس المهم عقلو جزارينكم الزعيم في مهمه لتشريف الوطن ؟ ! وبيوصل بأذن الله للنهائي الاسيوي ؟ ! يعني اتمنى المحافضه على نجوم الزعيم من الاصابات التي ستحدث بسبب التعبئه والشحن النفسي ؟ ؟ ومبروك للزعماء التأهل لنهائي ثالث بطولة لهذا الموسم ؟ ! وعقبال البطولة,السلام عليكم يحلمون ويمكن بالخمسه ثاني يلقمون بس المهم عقلو جزارينكم الزعيم في مهمه لتشريف الوطن وبيوصل باذن الله للنهايي الاسيوي يعني اتمني المحافضه علي نجوم الزعيم من الاصابات التي ستحدث بسبب التعبيه والشحن النفسي ومبروك للزعماء التاهل لنهايي ثالث بطوله لهذا الموسم وعقبال البطوله,,[],0,pending,,
mt_dial_lev_495b551e,train,11102,DIAL_LEV,ويعطيهم العافيه اطباء المدينه الطبيه والعقيد الدكتور ناجح العمري الله يعطيه العافيه والصحه والفريق الطبي,ويعطيهم العافيه اطباء المدينه الطبيه والعقيد الدكتور ناجح العمري الله يعطيه العافيه والصحه والفريق الطبي,,[],0,pending,,
mt_msa_2dd9e90d,train,15942,MSA,مع شكري وتقديري لوزارة الداخليه على جهودها لراحة المواطن والمقيم وسباقه في الخدمات,مع شكري وتقديري لوزاره الداخليه علي جهودها لراحه المواطن والمقيم وسباقه في الخدمات,,[],0,pending,,
mt_dial_egy_a99f1a0a,train,41514,DIAL_EGY,عايز افهمك ان عادى يحصل مشاكل فى الملاعب عندنا بس الغلطان بيعتذر بعد كده مش بيفضل يعاند ويقول انه,عايز افهمك ان عادي يحصل مشاكل في الملاعب عندنا بس الغلطان بيعتذر بعد كده مش بيفضل يعاند ويقول انه,,[],0,pending,,
mt_dial_glf_172ec84e,train,19335,DIAL_GLF,الايقاف احلا من الشطب كثير وسألو النعيمة . .,الايقاف احلا من الشطب كثير وسالو النعيمه,,[],0,pending,,
mt_dial_lev_58c8c268,train,66258,DIAL_LEV,بس اسمع مني بس اسمع,بس اسمع مني بس اسمع,,[],0,pending,,
mt_msa_d32e6474,train,20532,MSA,ماذا تقصد بالرحيل هل الموت أم الفراق أنافهمت أنه الموت عموما المقالة رائعة ومؤثرة جدا لقد أبكتنى وأحزنت قلبى فما خيال عاد يعنينى ولاواقع صار يؤوينى ما أشد وقع هذه,ماذا تقصد بالرحيل هل الموت ام الفراق انافهمت انه الموت عموما المقاله رايعه وموثره جدا لقد ابكتني واحزنت قلبي فما خيال عاد يعنيني ولاواقع صار يوويني ما اشد وقع هذه,,[],0,pending,,
mt_dial_egy_196c560b,train,753,DIAL_EGY,ولا شعب ولا تربية وتعليم ولا شوري وبكره حبايبك يلعبوبك الكورة انت : : : بتنقل اللي يضرب تلميذ انت مظبوط وشغال بس عملت ايه مع المدرس اللي خرم ايدين التلاميذ بالقلم وانت علي علم,ولا شعب ولا تربيه وتعليم ولا شوري وبكره حبايبك يلعبوبك الكوره انت بتنقل اللي يضرب تلميذ انت مظبوط وشغال بس عملت ايه مع المدرس اللي خرم ايدين التلاميذ بالقلم وانت علي علم,,[],0,pending,,
mt_dial_glf_735130c8,train,6733,DIAL_GLF,والي يقول نبي نموت قبل ذاك الوقت . . إذا بتموت خلال هال 50 سنة طيب أبناءك وأبناءنا والأحفاد وش ذا الأنانية ؟,والي يقول نبي نموت قبل ذاك الوقت اذا بتموت خلال هال 50 سنه طيب ابناءك وابناءنا والاحفاد وش ذا الانانيه,,[],0,pending,,
mt_dial_lev_63d2f7f8,train,11580,DIAL_LEV,ووقت الشباب بضيع بدل ما بيستفيدوا من طاقاتهم الشبابيه الي ممكن يشتغلوا ويتعبوا بداية حياتهم لحتى بيرتاحوا بعدين او بيكونوا متل ما طموحهم,ووقت الشباب بضيع بدل ما بيستفيدوا من طاقاتهم الشبابيه الي ممكن يشتغلوا ويتعبوا بدايه حياتهم لحتي بيرتاحوا بعدين او بيكونوا متل ما طموحهم,,[],0,pending,,
mt_msa_e72beead,train,76805,MSA,بالتاكيد يستحق عقوبة اكبر حتى يحترم اللاعبون انفسهم ويكونوا قدوة,بالتاكيد يستحق عقوبه اكبر حتي يحترم اللاعبون انفسهم ويكونوا قدوه,,[],0,pending,,
mt_dial_egy_ddc5ef43,train,49741,DIAL_EGY,فالحة بس تقبض ع الشرفاء ف كل مكان وتروع,فالحه بس تقبض ع الشرفاء ف كل مكان وتروع,,[],0,pending,,
mt_dial_glf_b65ff878,train,30747,DIAL_GLF,الأهم من هذا الموج الأزرق بيبتلع جميع الفرق الي تواجهه وبيضمن بطولة خادم الحرمين لبقية البطولات ويترك الحالمين بالفوز ببطولة . . عفوا اقصد يترك الحالمين بالفوز بمباراة ضد الزعيم,الاهم من هذا الموج الازرق بيبتلع جميع الفرق الي تواجهه وبيضمن بطوله خادم الحرمين لبقيه البطولات ويترك الحالمين بالفوز ببطوله عفوا اقصد يترك الحالمين بالفوز بمباراه ضد الزعيم,,[],0,pending,,
mt_dial_lev_fd2c2cc0,train,60483,DIAL_LEV,المشكلة مش في التجار ولا في الاسعار ( المشكلة فينا احنا,المشكله مش في التجار ولا في الاسعار المشكله فينا احنا,,[],0,pending,,
mt_msa_3feaf78d,train,38187,MSA,لا حول ولا قوة الا بالله . . . ربنا يهدي القلوب والعقول . . . لا تعليق ! !,لا حول ولا قوه الا بالله ربنا يهدي القلوب والعقول لا تعليق,,[],0,pending,,
mt_dial_egy_e7f4b168,train,72435,DIAL_EGY,انا في طبق اليوم سمعت عن فريق اسمه الزمالك كان في المركز ال قبل الاخير فاجئه يكون في المركز الثاني هذا يدل ان الفريق كله بيضربو منشطات ومن امثلهم شيكابالا وحسين ياسر وحازم امام وعبد الواحد,انا في طبق اليوم سمعت عن فريق اسمه الزمالك كان في المركز ال قبل الاخير فاجيه يكون في المركز الثاني هذا يدل ان الفريق كله بيضربو منشطات ومن امثلهم شيكابالا وحسين ياسر وحازم امام وعبد الواحد,,[],0,pending,,
mt_dial_glf_87cc7f80,train,32958,DIAL_GLF,لعن ابو الكورة اش اكرهها كره . . !,لعن ابو الكوره اش اكرهها كره,,[],0,pending,,
mt_dial_lev_4d36a308,train,34943,DIAL_LEV,الحلو انه التوقعات بدأت تزبط معنا هذه الايام وان شاء الله تعويذه سمور,الحلو انه التوقعات بدات تزبط معنا هذه الايام وان شاء الله تعويذه سمور,,[],0,pending,,
mt_msa_83bf80db,train,83401,MSA,الهلال يثبت مجدداً وفائه لأبناءه ممن خدموا هذا الكيان,الهلال يثبت مجددا وفايه لابناءه ممن خدموا هذا الكيان,,[],0,pending,,
mt_dial_egy_a2ed310c,train,80123,DIAL_EGY,للاسف يا حسام كل كلامك صح وانا كل اللي عاوز افهمه دلوقتي حاجه واحده ( ادارة الزمالك ) فين في كل اللي بيحصل ده خذلتونا في اكتر من موضوع - اولا - موضوع حرس الحدود وال 3 نقاط المفقوده الي الان وللابد - ثانيا - موضوع المحروس جدو اللي متاكد من دلوقتي انه هيخلص بشكل ودي ده اذا افتكروه اساسا - ثالثا - موضوع ابراهيم حسن وايقاف هاو هاو اللي برنامج زي الرياضه اليوم واقف بجانب ابراهيم اكتر من ادارة الزمالك نفسها - رابعا - ماتش الاهلي وانبي اللي بعد الماتش علي طول قالو انهم مش هيلعبو الا بحكام اجانب ولكن لا حياة لمن تنادي - خامسا - ماتش زي ماتش امبارح وانا متاكد انهم هيقولو أمين علي كل قرارات لجنة المسابقات في الاخر لي ملحوظتين مهمين اول ملحوظه - اقسم بالله انا كنت من اكبر المؤيدين لهذا المجلس بقيادة ممدوح عباس - تاني ملحوظه - بقول لكل الزملكاويه ( ماهيتاب - ندي - يوهان كرويف - ابو زياد - . . . ) حماسكم ودفاعكم وروحكم وحبكم للزمالك هو اكتر حاجه محبباني في الزمالك سلامي ليكم ولكل واحد بيموت في الزمالك وبيدافع عنه بجدد من غير اي كراسي ولا,للاسف يا حسام كل كلامك صح وانا كل اللي عاوز افهمه دلوقتي حاجه واحده اداره الزمالك فين في كل اللي بيحصل ده خذلتونا في اكتر من موضوع اولا موضوع حرس الحدود وال 3 نقاط المفقوده الي الان وللابد ثانيا موضوع المحروس جدو اللي متاكد من دلوقتي انه هيخلص بشكل ودي ده اذا افتكروه اساسا ثالثا موضوع ابراهيم حسن وايقاف هاو هاو اللي برنامج زي الرياضه اليوم واقف بجانب ابراهيم اكتر من اداره الزمالك نفسها رابعا ماتش الاهلي وانبي اللي بعد الماتش علي طول قالو انهم مش هيلعبو الا بحكام اجانب ولكن لا حياه لمن تنادي خامسا ماتش زي ماتش امبارح وانا متاكد انهم هيقولو امين علي كل قرارات لجنه المسابقات في الاخر لي ملحوظتين مهمين اول ملحوظه اقسم بالله انا كنت من اكبر المويدين لهذا المجلس بقياده ممدوح عباس تاني ملحوظه بقول لكل الزملكاويه ماهيتاب ندي يوهان كرويف ابو زياد حماسكم ودفاعكم وروحكم وحبكم للزمالك هو اكتر حاجه محبباني في الزمالك سلامي ليكم ولكل واحد بيموت في الزمالك وبيدافع عنه بجدد من غير اي كراسي ولا,,[],0,pending,,
mt_dial_glf_8c4b3a9f,train,35886,DIAL_GLF,شيء طيب جداً بس تراه مطبق بالكويت من زمان لا وبإمكانك تنقل ملكية السيارة المسعمله عن طريق الشركات الكبرى,شيء طيب جدا بس تراه مطبق بالكويت من زمان لا وبامكانك تنقل ملكيه السياره المسعمله عن طريق الشركات الكبري,,[],0,pending,,
mt_dial_lev_80e7610e,train,19385,DIAL_LEV,و شو بتعمل اذا عرفت انو اخوك على علاقة غير شرعية . . بتقتلو,و شو بتعمل اذا عرفت انو اخوك علي علاقه غير شرعيه بتقتلو,,[],0,pending,,
mt_msa_fc459c96,train,320,MSA,ابو ايمن . . . كالعادة مبدع وجميل يالك من,ابو ايمن كالعاده مبدع وجميل يالك من,,[],0,pending,,
mt_dial_egy_812cee91,train,38512,DIAL_EGY,قالت له اسهال معقوول ليه ؟ ؟,قالت له اسهال معقوول ليه,,[],0,pending,,
mt_dial_glf_2f540776,train,1489,DIAL_GLF,لايفوتكم ياجمهور الغفلة والثرثرة على الفاضي نهائي كاس اندية الخليج بين الوصل الاماراتي وقطر,لايفوتكم ياجمهور الغفله والثرثره علي الفاضي نهايي كاس انديه الخليج بين الوصل الاماراتي وقطر,,[],0,pending,,
mt_dial_lev_e7c544fe,train,58545,DIAL_LEV,دول العالم تدعم الشعب وتعينه وحكومتنا بتربح علينا وبتتحوط على حسابنا وتتحايل على الدستور بفرض ضريبة خاصة حيث انه لا يجوز فرض ضريبة اكثر من 16 % بس عباقرة ماشالله,دول العالم تدعم الشعب وتعينه وحكومتنا بتربح علينا وبتتحوط علي حسابنا وتتحايل علي الدستور بفرض ضريبه خاصه حيث انه لا يجوز فرض ضريبه اكثر من 16 بس عباقره ماشالله,,[],0,pending,,
mt_msa_2a35d967,train,20127,MSA,فيما خلت القائمة من آسم اي لآعب,فيما خلت القايمه من اسم اي لاعب,,[],0,pending,,
mt_dial_egy_261762ae,train,19770,DIAL_EGY,40 جنيه فاتورة المياه وشقتى صغيرة وميتهم وسخه والفاتوره كل شهر تقريبا . . . اللهم لاملجاء منك الا اليك وحسبنا الله ونعم الوكيل,40 جنيه فاتوره المياه وشقتي صغيره وميتهم وسخه والفاتوره كل شهر تقريبا اللهم لاملجاء منك الا اليك وحسبنا الله ونعم الوكيل,,[],0,pending,,
mt_dial_glf_f2ce9dd8,train,41576,DIAL_GLF,ما نبغى عقليات غبرة و,ما نبغي عقليات غبره و,,[],0,pending,,
mt_dial_lev_62c4cc2f,train,25879,DIAL_LEV,اهلا مصداقية و شفافيه . . بس احنا بصراحه بنستاهل !,اهلا مصداقيه و شفافيه بس احنا بصراحه بنستاهل,,[],0,pending,,
mt_msa_99508442,train,50094,MSA,ولكن ألا تطبق كلامك : ما يراه الغرب ليس,ولكن الا تطبق كلامك ما يراه الغرب ليس,,[],0,pending,,
mt_dial_egy_d448b751,train,1861,DIAL_EGY,هذه ايه ليغرف الجميع انهم فقراء الى الله وانهم محتاجون فى هذه اللحظات الصعبه عفو من ظلموهم وان دولة الظلم الى فناء ودولة الحق الى بقاءفالراجل العادل تدعى له كل الناس والرجل الظالم تدعوا عليه كل الخلائقوارجو منة الله ان يتعظ كل مسئول ويتقى الله فى الرعيه وحسبنا الله ونعم,هذه ايه ليغرف الجميع انهم فقراء الي الله وانهم محتاجون في هذه اللحظات الصعبه عفو من ظلموهم وان دوله الظلم الي فناء ودوله الحق الي بقاءفالراجل العادل تدعي له كل الناس والرجل الظالم تدعوا عليه كل الخلايقوارجو منه الله ان يتعظ كل مسيول ويتقي الله في الرعيه وحسبنا الله ونعم,,[],0,pending,,
mt_dial_glf_9fecfa83,train,70402,DIAL_GLF,يجب عى الحكومه وبالخصوص وزارة الدخليه وبذات امارة منطقة الرياض مع شرطة منطقة الرياض ايجاد حل لسرقة السيارات بالاسلوب هذا وان يتم القبض على السارق وتقطع يده امام جمهور من الناس من اجل العبره لغيره وتنشر صورته بعد تطبيق الحد عليه في جميع الصحف لكن ماعتقد ان امارة الرياض وكذلك الشرطه بيتجاوبون سريعاً وذلك للبيوقراطيه المعشعشه في تلك الجهازين والي مو مصدق يروح يراجع معامله له في احدهن وراح يعرف الحقيقه كل موظف سواء مدني او عسكري في الجهازين يعد نفسه هو الكل في الكل والباقين كمالة عدد والخافي اعظم,يجب عي الحكومه وبالخصوص وزاره الدخليه وبذات اماره منطقه الرياض مع شرطه منطقه الرياض ايجاد حل لسرقه السيارات بالاسلوب هذا وان يتم القبض علي السارق وتقطع يده امام جمهور من الناس من اجل العبره لغيره وتنشر صورته بعد تطبيق الحد عليه في جميع الصحف لكن ماعتقد ان اماره الرياض وكذلك الشرطه بيتجاوبون سريعا وذلك للبيوقراطيه المعشعشه في تلك الجهازين والي مو مصدق يروح يراجع معامله له في احدهن وراح يعرف الحقيقه كل موظف سواء مدني او عسكري في الجهازين يعد نفسه هو الكل في الكل والباقين كماله عدد والخافي اعظم,,[],0,pending,,
mt_dial_lev_352e142c,train,32725,DIAL_LEV,إذن حتى بقضية الرايح جاي الزعيم بطلها,اذن حتي بقضيه الرايح جاي الزعيم بطلها,,[],0,pending,,
mt_msa_dbab5841,train,36652,MSA,أنت تتكلم بصوت العقل في زمن تراكم الغبار على العقول فأصبحنا نعيش في الغلو المحرم ونحن,انت تتكلم بصوت العقل في زمن تراكم الغبار علي العقول فاصبحنا نعيش في الغلو المحرم ونحن,,[],0,pending,,
mt_dial_egy_c978806e,train,71129,DIAL_EGY,انت محموقة ليه كده ياست مهيتاب اهدي لايجيليك الضغط ولا السكر احنا يهمنا صحتك بس وعموما الاهلاوية بتحملوا إلا بيغلط فيهم بس متسؤوش فيها بقا لأن احنا الاب الكبير ( نادي القرن ) سمعتي ولا,انت محموقه ليه كده ياست مهيتاب اهدي لايجيليك الضغط ولا السكر احنا يهمنا صحتك بس وعموما الاهلاويه بتحملوا الا بيغلط فيهم بس متسووش فيها بقا لان احنا الاب الكبير نادي القرن سمعتي ولا,,[],0,pending,,
mt_dial_glf_08bf556e,train,85715,DIAL_GLF,ثالثا لو انك مسلمه وتخافين الله ومحافظه على صلواتك لما كان هذا,ثالثا لو انك مسلمه وتخافين الله ومحافظه علي صلواتك لما كان هذا,,[],0,pending,,
mt_dial_lev_316eb45a,train,15357,DIAL_LEV,فعلا انها بدها تروح حتى تخطف الاضواء من الاسطول اللي رايح لغزة والناس ازا شافتها رح تنسى غزة واللي فيها,فعلا انها بدها تروح حتي تخطف الاضواء من الاسطول اللي رايح لغزه والناس ازا شافتها رح تنسي غزه واللي فيها,,[],0,pending,,
mt_msa_87b12eea,train,61903,MSA,يارب اني اسئلك الستر وحسن الخاتمه والخلود في جنامك يارب . .,يارب اني اسيلك الستر وحسن الخاتمه والخلود في جنامك يارب,,[],0,pending,,
mt_dial_egy_9935e48c,train,16278,DIAL_EGY,والفقر ماهو عيب ولاهو باختياري . . . العيب لما امد يدي للنساء,والفقر ماهو عيب ولاهو باختياري العيب لما امد يدي للنساء,,[],0,pending,,
mt_dial_glf_def7fc6b,train,13837,DIAL_GLF,قالها النعيمه فتشوا في اللجان وراح تلقون اكثر من قوبع,قالها النعيمه فتشوا في اللجان وراح تلقون اكثر من قوبع,,[],0,pending,,
mt_dial_lev_8571234c,train,49919,DIAL_LEV,ليش ما الحكومة تبيع سياراتها و يقللوا من مصاريف البنزين وسواقين وصيانةومشتريات عشان يخففوا عجز ؟ ! !,ليش ما الحكومه تبيع سياراتها و يقللوا من مصاريف البنزين وسواقين وصيانهومشتريات عشان يخففوا عجز,,[],0,pending,,
mt_msa_bc7bcacc,train,40310,MSA,المسلم من سلم المسلمون من لسانه ويده . .,المسلم من سلم المسلمون من لسانه ويده,,[],0,pending,,
mt_dial_egy_304474d8,train,12181,DIAL_EGY,أنا نفسي أعرف هو المسيح لما اتصلب أنقذ البشرية من ايه بالضبط اللي فاهم,انا نفسي اعرف هو المسيح لما اتصلب انقذ البشريه من ايه بالضبط اللي فاهم,,[],0,pending,,
mt_dial_glf_87702a77,train,76768,DIAL_GLF,يعني مبدأ التجارة الحرة ما ينطبق إلا على هوامير الحديد و العقار ؟ ؟ الحلاقين والفوالين ما ينطبق عليهم مبدأ العرض و الطلب ؟ ؟ يا حلوك يا,يعني مبدا التجاره الحره ما ينطبق الا علي هوامير الحديد و العقار الحلاقين والفوالين ما ينطبق عليهم مبدا العرض و الطلب يا حلوك يا,,[],0,pending,,
mt_dial_lev_ca47c662,train,67072,DIAL_LEV,ان الحكومة تتعمد كل عام رفع المحروقات وبنسب عالية جدا في بداية موسم الصيف بموعد اقتراب إجازات المغتربين لشفط جيوبهم المتهالكة اصلا نظرا لزيادة الضغوطات عليهم من حيث ارتفاع المعيشة في دول الخليج وزيادة انفاقهم على اهلهم في الأردن ايضا بسبب كثرة الضرائب والمخالفات والنصب من التجار - بما ان الحكومة تنتظر المغتربين فإننا نقول لهم رح نيجي في الباصات وما بدنا انحط بنزين - يا اخوان سعر فل البنزين في السعودية 6 دنانير والفل بعمان 50 دينار واكثر,ان الحكومه تتعمد كل عام رفع المحروقات وبنسب عاليه جدا في بدايه موسم الصيف بموعد اقتراب اجازات المغتربين لشفط جيوبهم المتهالكه اصلا نظرا لزياده الضغوطات عليهم من حيث ارتفاع المعيشه في دول الخليج وزياده انفاقهم علي اهلهم في الاردن ايضا بسبب كثره الضرايب والمخالفات والنصب من التجار بما ان الحكومه تنتظر المغتربين فاننا نقول لهم رح نيجي في الباصات وما بدنا انحط بنزين يا اخوان سعر فل البنزين في السعوديه 6 دنانير والفل بعمان 50 دينار واكثر,,[],0,pending,,
mt_msa_a97df628,train,43977,MSA,على العموم بالتوفيق للزعيم في نهائي كأس,علي العموم بالتوفيق للزعيم في نهايي كاس,,[],0,pending,,
mt_dial_egy_23207588,train,24594,DIAL_EGY,الموضوع ده يحل مشاكل كثيره ومنها التعدد والنساء تتعلم الاداب كما,الموضوع ده يحل مشاكل كثيره ومنها التعدد والنساء تتعلم الاداب كما,,[],0,pending,,
mt_dial_glf_b6ef993f,train,51767,DIAL_GLF,خيالك روعه والله ان مكانك الدراما والسنما والاخراج كفأه حرام ان تهدر على الورق اطال الله عمرك من مفكر ( اجزم ان المتشددين كانو متوقعين انه عنهم الموضوع اللين اخر بيت وقلبت الدعوه في اتجاه خطير وحقيقي الى الاخت وزارة التخطيط المبجله ) شكرا,خيالك روعه والله ان مكانك الدراما والسنما والاخراج كفاه حرام ان تهدر علي الورق اطال الله عمرك من مفكر اجزم ان المتشددين كانو متوقعين انه عنهم الموضوع اللين اخر بيت وقلبت الدعوه في اتجاه خطير وحقيقي الي الاخت وزاره التخطيط المبجله شكرا,,[],0,pending,,
