example_id,source_split,source_row_id,dialect,original_text,normalized_text,masked_text,mask_spans_json,mask_count,annotation_status,annotator_model,notes
mt_dial_egy_bb9315a7,train,36829,DIAL_EGY,هل سمع احدكم بمشاكل العائدون للمسيحيه هل سمع احدكم بمشكله الطفليين اندرو وماريو واجبارهم علي ان يبقيا في اسلام والدهم وقولهم الاسلام مش بالعافيه هل فكر احدكم ماذا سوف يكون رد فعله لو المسيحيه قالت الكلام,هل سمع احدكم بمشاكل العايدون للمسيحيه هل سمع احدكم بمشكله الطفليين اندرو وماريو واجبارهم علي ان يبقيا في اسلام والدهم وقولهم الاسلام مش بالعافيه هل فكر احدكم ماذا سوف يكون رد فعله لو المسيحيه قالت الكلام,,[],0,pending,,
mt_dial_glf_0a2adbbc,train,13485,DIAL_GLF,صاحب التعليق رقم 2 ترا الهلال هو الأول على المجموعه لاتفرح كثيراً والهلا ل دائماً المبارايات اللتي لاتهم الفريق لايلقي لها حساب فهي مبارات تمرين لا اكثر ودائماً الفرق الكبيره مثل الهلال مايهتمون بمثل هالمباريات كأمها مبارات اعتزال او وديه ليش اكسر نفسي ولا ماعندي ثقه,صاحب التعليق رقم 2 ترا الهلال هو الاول علي المجموعه لاتفرح كثيرا والهلا ل دايما المبارايات اللتي لاتهم الفريق لايلقي لها حساب فهي مبارات تمرين لا اكثر ودايما الفرق الكبيره مثل الهلال مايهتمون بمثل هالمباريات كامها مبارات اعتزال او وديه ليش اكسر نفسي ولا ماعندي ثقه,,[],0,pending,,
mt_dial_lev_c55f39bc,train,10342,DIAL_LEV,ممكن نعرف وين بالضبط ممكن نقدم شكوى ؟,ممكن نعرف وين بالضبط ممكن نقدم شكوي,,[],0,pending,,
mt_msa_bd5b43c2,train,54058,MSA,وأنا مثلك أخي الكاتب اتسآئل هل هناك تضارب مصالح أو العكس بين رجال المرور وأصحاب السطحات هل يملكونها هل هناك نسبة على الرأس لماذا لا توكل لشركة مساهمة عامة مثل السيارات او غيرها من الشركات المختصة تقدر تشتكي تحاكم وغيره لكن في الاخير تبلش مع واحد بدون مستتر خلف رجل مرور مالك للسطحة,وانا مثلك اخي الكاتب اتسايل هل هناك تضارب مصالح او العكس بين رجال المرور واصحاب السطحات هل يملكونها هل هناك نسبه علي الراس لماذا لا توكل لشركه مساهمه عامه مثل السيارات او غيرها من الشركات المختصه تقدر تشتكي تحاكم وغيره لكن في الاخير تبلش مع واحد بدون مستتر خلف رجل مرور مالك للسطحه,,[],0,pending,,
mt_dial_egy_b41625f9,train,61139,DIAL_EGY,دلوقتى فهمت ليه سمو مصر ام,دلوقتي فهمت ليه سمو مصر ام,,[],0,pending,,
mt_dial_glf_cdb05d14,train,40029,DIAL_GLF,* بلاكم ماتدرون اننا محتاجين السواق والشغاله ماعندكم ناس كبار في السن على الاقل السواق يوديهم لمراجعه المستشفيات والشغاله تخدم العجوز يعني قصدكم نترك اشغالنا ونروح نراجع باهلينا للمستشفايات يالله اجل اسمحو لنا نخرج من,بلاكم ماتدرون اننا محتاجين السواق والشغاله ماعندكم ناس كبار في السن علي الاقل السواق يوديهم لمراجعه المستشفيات والشغاله تخدم العجوز يعني قصدكم نترك اشغالنا ونروح نراجع باهلينا للمستشفايات يالله اجل اسمحو لنا نخرج من,,[],0,pending,,
mt_dial_lev_021616af,train,8866,DIAL_LEV,ما دام الله معهم مهما عملوا مش راح يدخلوا,ما دام الله معهم مهما عملوا مش راح يدخلوا,,[],0,pending,,
mt_msa_52705bae,train,83907,MSA,ولما اعطته الجامعات المصرية العديد من درجات الدكتوراه الفخرية,ولما اعطته الجامعات المصريه العديد من درجات الدكتوراه الفخريه,,[],0,pending,,
mt_dial_egy_3910c5ed,train,29985,DIAL_EGY,طبعا ما فعله السيد الدكتور وزير التربية والتعليم كان من المفروض أن يحدث من زمان مع مجموعة لا يهمها سوى شئ واحد هو الحصول على المال فقط دون النظر إلى العملية التعليمية التي أصبحت يرثى لها فإن اليوم لا يستطيع التلميذ أن يكتب عشر كلمات على بعضها بالرغم من حصوله على الإعدادية بالرغم أنه قديما كان الواحد يزعل قوي عندما يحصل على تسعة من عشرة في الإملاء ولكن الآن لا يستطيع الطالب الكتابة إلا عن طريق الغش فالمطلوب من السادة المدرسين وكمان الجماعة بتوع النقابة يهتموا شوية بالعملية الدراسية التي من إجلها طلب الجميع بتطبيق الكادر على المعلمين من أجل الحصول على المال دون النظر إلى الدروس الخصوصية ولكن وضح مستوى السادة المدرسين فقد رسب منهم الكثير عند عقد إمتحان الكادر وبالرغم من كل ذلك فقد حصول على ما يريدون وبالرغم من ذلك لا يقوم المدرس منهم بأداء المطلوب منهم,طبعا ما فعله السيد الدكتور وزير التربيه والتعليم كان من المفروض ان يحدث من زمان مع مجموعه لا يهمها سوي شي واحد هو الحصول علي المال فقط دون النظر الي العمليه التعليميه التي اصبحت يرثي لها فان اليوم لا يستطيع التلميذ ان يكتب عشر كلمات علي بعضها بالرغم من حصوله علي الاعداديه بالرغم انه قديما كان الواحد يزعل قوي عندما يحصل علي تسعه من عشره في الاملاء ولكن الان لا يستطيع الطالب الكتابه الا عن طريق الغش فالمطلوب من الساده المدرسين وكمان الجماعه بتوع النقابه يهتموا شويه بالعمليه الدراسيه التي من اجلها طلب الجميع بتطبيق الكادر علي المعلمين من اجل الحصول علي المال دون النظر الي الدروس الخصوصيه ولكن وضح مستوي الساده المدرسين فقد رسب منهم الكثير عند عقد امتحان الكادر وبالرغم من كل ذلك فقد حصول علي ما يريدون وبالرغم من ذلك لا يقوم المدرس منهم باداء المطلوب منهم,,[],0,pending,,
mt_dial_glf_b0c0af03,train,56196,DIAL_GLF,خلق الله حسن . . . للحفاظ على نوعيه او جين لايكون بخلطه مع انواع اخرى انما بتهيئت المناخ والطعام حتى يتكاثر وفق الله الجميع لمافيه خير .,خلق الله حسن للحفاظ علي نوعيه او جين لايكون بخلطه مع انواع اخري انما بتهييت المناخ والطعام حتي يتكاثر وفق الله الجميع لمافيه خير,,[],0,pending,,
mt_dial_lev_4720b19f,train,16605,DIAL_LEV,عامر الحويطي بالنسبة الي لا يستحق العقوبة اما اذا في اشي بينه وبين النادي بصير كلام,عامر الحويطي بالنسبه الي لا يستحق العقوبه اما اذا في اشي بينه وبين النادي بصير كلام,,[],0,pending,,
mt_msa_b16d45b1,train,49419,MSA,لايمكن ان يفوز على الهلال حتى لو الحكم من,لايمكن ان يفوز علي الهلال حتي لو الحكم من,,[],0,pending,,
mt_dial_egy_1c44ca0f,train,17337,DIAL_EGY,الحمد لله ان الخطاب كان مكتوب لهانى هلال و الا كان شتم الناس و اعتدى عليهما مثلما يعمل فى مصر بس هناك فى ناس راح تحاسبة و احتمال ما يرجع مصر لكن هو فى مصر بيعمل كل اللى عايزه ويقول انا ما بخافش من حد ربنا يستر علينا برافو عليك يا هانى هلال و الحمد لله انك ما زودت ولا نقصت عن المكتوب لان دى دول راح تقع فى بعضها و سلامتك يا سى هانى و متشكرين و الله على الجهد المبذول و طبعا انت راح تفوت على بلجيكا و امريكا على حساب الدوله وربنا معاك و,الحمد لله ان الخطاب كان مكتوب لهاني هلال و الا كان شتم الناس و اعتدي عليهما مثلما يعمل في مصر بس هناك في ناس راح تحاسبه و احتمال ما يرجع مصر لكن هو في مصر بيعمل كل اللي عايزه ويقول انا ما بخافش من حد ربنا يستر علينا برافو عليك يا هاني هلال و الحمد لله انك ما زودت ولا نقصت عن المكتوب لان دي دول راح تقع في بعضها و سلامتك يا سي هاني و متشكرين و الله علي الجهد المبذول و طبعا انت راح تفوت علي بلجيكا و امريكا علي حساب الدوله وربنا معاك و,,[],0,pending,,
mt_dial_glf_1e154953,train,83833,DIAL_GLF,لا ولسه ياكثر المعرقلات الي بيواجهونها . .,لا ولسه ياكثر المعرقلات الي بيواجهونها,,[],0,pending,,
mt_dial_lev_790003bc,train,83897,DIAL_LEV,"يا اخوان انا عايش في امريكا و البنزين نزل 3 . 5 % و احنا في بلادنا برفعو والله حرام , على اساس انو حررو الاسعار , بدهم يغنو على ظهر الشعب",يا اخوان انا عايش في امريكا و البنزين نزل 3 5 و احنا في بلادنا برفعو والله حرام علي اساس انو حررو الاسعار بدهم يغنو علي ظهر الشعب,,[],0,pending,,
mt_msa_5c81800c,train,85323,MSA,ولا قلو لنا انها هبه من الدوله,ولا قلو لنا انها هبه من الدوله,,[],0,pending,,
mt_dial_egy_a5aa62c9,train,6012,DIAL_EGY,طب سؤال أنت مابتنتقدش ليه حضور جمال مبارك وبقية محاسيب الحزب الحاكم للقداس وحضورهم صلاة,طب سوال انت مابتنتقدش ليه حضور جمال مبارك وبقيه محاسيب الحزب الحاكم للقداس وحضورهم صلاه,,[],0,pending,,
mt_dial_glf_f88292f0,train,71744,DIAL_GLF,والله انى حسيت برعشه اول ماقريت,والله اني حسيت برعشه اول ماقريت,,[],0,pending,,
mt_dial_lev_4622cf08,train,19781,DIAL_LEV,الله يشفيه ويرجعلو صحته وعافيته ولا يريه مكروه يا,الله يشفيه ويرجعلو صحته وعافيته ولا يريه مكروه يا,,[],0,pending,,
mt_msa_2cfbb126,train,45962,MSA,تروح ارواح ابرياء ونقول خطاء ويحقق مع الطبيب على حد زعمهم ويسفر ما الذي استفاده ذوو الميت او حتى المصاب من تسفيره وعدم القصاص,تروح ارواح ابرياء ونقول خطاء ويحقق مع الطبيب علي حد زعمهم ويسفر ما الذي استفاده ذوو الميت او حتي المصاب من تسفيره وعدم القصاص,,[],0,pending,,
mt_dial_egy_61b7e3a9,train,62657,DIAL_EGY,بصراحة كان شكلك و حش,بصراحه كان شكلك و حش,,[],0,pending,,
mt_dial_glf_0eb1abaf,train,37064,DIAL_GLF,يا هئة الله يوفقكم تكفوكن كونو عند حسن ظن حكامنا,يا هيه الله يوفقكم تكفوكن كونو عند حسن ظن حكامنا,,[],0,pending,,
mt_dial_lev_9c2758fe,train,45447,DIAL_LEV,والله كنا خلف المنتخب دقيقة بدقيقة وثانية بثانية وبكينا من الفرح بعد كل مباراة بنتمنى إن شاء الله ترجع هالأيام بقيادة الكابتن *حسونة,والله كنا خلف المنتخب دقيقه بدقيقه وثانيه بثانيه وبكينا من الفرح بعد كل مباراه بنتمني ان شاء الله ترجع هالايام بقياده الكابتن حسونه,,[],0,pending,,
mt_msa_5a7e0b66,train,42287,MSA,اكبر دليل انهم ناقصات عقل ودين . . وجودهم بين,اكبر دليل انهم ناقصات عقل ودين وجودهم بين,,[],0,pending,,
mt_dial_egy_dd62dc1a,train,76506,DIAL_EGY,وأحبك تطبل تهلل تهبل عشان متش كورة وموفي,واحبك تطبل تهلل تهبل عشان متش كوره وموفي,,[],0,pending,,
mt_dial_glf_61cc35be,train,75899,DIAL_GLF,لك جمهورك اللي ينتظرك يافيصل لا,لك جمهورك اللي ينتظرك يافيصل لا,,[],0,pending,,
mt_dial_lev_4a07403c,train,83514,DIAL_LEV,وصفك كان دقيق ورائع النا نحن الفيصلاويين,وصفك كان دقيق ورايع النا نحن الفيصلاويين,,[],0,pending,,
mt_msa_464b9fd1,train,9052,MSA,وعذرا للخطا . . والفيصلي بطل الكاس ورافع,وعذرا للخطا والفيصلي بطل الكاس ورافع,,[],0,pending,,
mt_dial_egy_2249e15d,train,73217,DIAL_EGY,ياباسم ارحم نفسك شويه انت لسه عايش زمن التهديدات والغزو والكلام ده ؟ هو كان الاشاوس الغزاه اجداك اللى جاؤا من جزيره العرب محو الكنائس وخلصوا على المسيحيين واليهود اساسا اللى كانوا عايشين فى مصر لما انتم بقى حتعرفوا ؟ صدقنى انت مسكين جدا ومثير للشفقه عارف ليه ؟ ؟ لان كل اعتمادكم يا مسلميين على القوه الارضيه من سلاح وتعصب وحرب وطبعا سرقه وغنائم ! وبعدين نهايه كل انسان هو الموت وايه المشكله يعنى,ياباسم ارحم نفسك شويه انت لسه عايش زمن التهديدات والغزو والكلام ده هو كان الاشاوس الغزاه اجداك اللي جاوا من جزيره العرب محو الكنايس وخلصوا علي المسيحيين واليهود اساسا اللي كانوا عايشين في مصر لما انتم بقي حتعرفوا صدقني انت مسكين جدا ومثير للشفقه عارف ليه لان كل اعتمادكم يا مسلميين علي القوه الارضيه من سلاح وتعصب وحرب وطبعا سرقه وغنايم وبعدين نهايه كل انسان هو الموت وايه المشكله يعني,,[],0,pending,,
mt_dial_glf_22862d45,train,72298,DIAL_GLF,ياما نحن شعب مانفهم شي او ان شركة جدوى,ياما نحن شعب مانفهم شي او ان شركه جدوي,,[],0,pending,,
mt_dial_lev_b93aeeb8,train,62777,DIAL_LEV,"واالله ديفيد فيا و انيستا و راموس ما عملوها , بس في اشياء ( مش بني ادماحتراما للانسانيه ) عملوها يمكن اصولهم",واالله ديفيد فيا و انيستا و راموس ما عملوها بس في اشياء مش بني ادماحتراما للانسانيه عملوها يمكن اصولهم,,[],0,pending,,
mt_msa_dbe022be,train,1360,MSA,سؤال برئ ماهو الفرق بين الحجاب ورداء الر,سوال بري ماهو الفرق بين الحجاب ورداء الر,,[],0,pending,,
mt_dial_egy_577d46d7,train,28830,DIAL_EGY,ان البرادعى هو اللى طلب,ان البرادعي هو اللي طلب,,[],0,pending,,
mt_dial_glf_94064152,train,65062,DIAL_GLF,"الأمور خلاص منتهية للنصر من عدم ايقافات مستحقة للاعبي النصر الى تحكيم موصى توصية مزبوطة , , ( هذا ما رواه لي احد الثقاة ) وبعض كلامه حصل والباقي الله يستر",الامور خلاص منتهيه للنصر من عدم ايقافات مستحقه للاعبي النصر الي تحكيم موصي توصيه مزبوطه هذا ما رواه لي احد الثقاه وبعض كلامه حصل والباقي الله يستر,,[],0,pending,,
mt_dial_lev_ee0b98b3,train,6547,DIAL_LEV,اصلا لولا انو ما في عالبنزين ضرائب عاليه كان سعره اقل بكثير من,اصلا لولا انو ما في عالبنزين ضرايب عاليه كان سعره اقل بكثير من,,[],0,pending,,
mt_msa_698e99bb,train,59536,MSA,وأرجو من جميع المهتمين بهذه التقنية أن يشرفونا بالأنضمام للمجموعة الخاصة بالخدمة على الفيس بوك مما يعود بالنفع والافادة والمشاركة الفعالة التي تصب في تطوير الخدمة والتواصل مع جميع المهتمين,وارجو من جميع المهتمين بهذه التقنيه ان يشرفونا بالانضمام للمجموعه الخاصه بالخدمه علي الفيس بوك مما يعود بالنفع والافاده والمشاركه الفعاله التي تصب في تطوير الخدمه والتواصل مع جميع المهتمين,,[],0,pending,,
mt_dial_egy_593e3881,train,20044,DIAL_EGY,اعملوة عشان غلا الاسعار والمرتبات مش كلام,اعملوه عشان غلا الاسعار والمرتبات مش كلام,,[],0,pending,,
mt_dial_glf_48fb300a,train,35144,DIAL_GLF,بس الحين مطريس . . . احسن شئ لاتهتم وطنش وعيش يومك بس ولاتفكر باشياء انت بغناء وكدر عنها يعني لو تكتب من اليوم لبكره مااحد سمعك . . .,بس الحين مطريس احسن شي لاتهتم وطنش وعيش يومك بس ولاتفكر باشياء انت بغناء وكدر عنها يعني لو تكتب من اليوم لبكره مااحد سمعك,,[],0,pending,,
mt_dial_lev_e3d2e99c,train,32574,DIAL_LEV,انه الوحدات العريق الزعيم العميد والعقيد للكرة الاردنية وغير هيك مافي كاس الاردن للوحدات وكاس السوبر للوحدات المارد والامبراطور,انه الوحدات العريق الزعيم العميد والعقيد للكره الاردنيه وغير هيك مافي كاس الاردن للوحدات وكاس السوبر للوحدات المارد والامبراطور,,[],0,pending,,
mt_msa_0819c2ec,train,77172,MSA,نفذ فيه حكم الله فنسأل الله ان يغفر له ويكون القصاص كفارة له ونسأل الله ان يسكنه فسيح جناته ويلهم اهله الصبر . ويرحم المقتول ويسكنه,نفذ فيه حكم الله فنسال الله ان يغفر له ويكون القصاص كفاره له ونسال الله ان يسكنه فسيح جناته ويلهم اهله الصبر ويرحم المقتول ويسكنه,,[],0,pending,,
mt_dial_egy_407fa3e1,train,3416,DIAL_EGY,الاخ الفاشل إبراهيم حسن يتهم الرياضة فى مصر بأنهامنظومة فاشلة والله ماحد فاشل الا هو واللى اساء لمصر رياضياهو المنظومة لو فاشلة لم تحصل مصر على كأس الامم سبع مرات ولا تكون المتربعة على عرش إفريقيا لهذه اللحظة اما الاخ الفاشل واللى حصل منه اليوم ضد لاعبى الشرطة بسب انهم تعاملوا مع المباراة بشرف غير الفرق الاخرىفهذا يدل على فشلهم وان المباريلت التى فزوها كانت كلهابالرشوة هذه الشخصية تسىء الى مصر ومثل هذا الرجل يشطب من سجلات الرياضة الى الابد والدليل ما رأينه اليوم ضد مدرب الشرطةوالفضائح التى رأينها على الملابالصوت والصورة هذه الشخصية اخر من تتكلم على الفساد لانهم سببه,الاخ الفاشل ابراهيم حسن يتهم الرياضه في مصر بانهامنظومه فاشله والله ماحد فاشل الا هو واللي اساء لمصر رياضياهو المنظومه لو فاشله لم تحصل مصر علي كاس الامم سبع مرات ولا تكون المتربعه علي عرش افريقيا لهذه اللحظه اما الاخ الفاشل واللي حصل منه اليوم ضد لاعبي الشرطه بسب انهم تعاملوا مع المباراه بشرف غير الفرق الاخريفهذا يدل علي فشلهم وان المباريلت التي فزوها كانت كلهابالرشوه هذه الشخصيه تسيء الي مصر ومثل هذا الرجل يشطب من سجلات الرياضه الي الابد والدليل ما راينه اليوم ضد مدرب الشرطهوالفضايح التي راينها علي الملابالصوت والصوره هذه الشخصيه اخر من تتكلم علي الفساد لانهم سببه,,[],0,pending,,
mt_dial_glf_19846ac9,train,24822,DIAL_GLF,ا هم شي يشارك في المباراة لاعبين يدقون الكوره من السنتر بوينت الى هايبر بنده اللي هوا الباب ويدكون مرمى بربيكان بكم,ا هم شي يشارك في المباراه لاعبين يدقون الكوره من السنتر بوينت الي هايبر بنده اللي هوا الباب ويدكون مرمي بربيكان بكم,,[],0,pending,,
mt_dial_lev_b7f6ce8b,train,67785,DIAL_LEV,وزير اوقاف دايتون يقرر منع اذاعة القرآن الكريم على مآذن المساجد قبل آذان الفجر كرمال عيون المغتصبين الصهاينة وخوفا عليهم من ازعاجهم اثناء نومهم,وزير اوقاف دايتون يقرر منع اذاعه القران الكريم علي ماذن المساجد قبل اذان الفجر كرمال عيون المغتصبين الصهاينه وخوفا عليهم من ازعاجهم اثناء نومهم,,[],0,pending,,
mt_msa_29036c59,train,12990,MSA,حسبى الله ونعم الوكيل يمهل ولا,حسبي الله ونعم الوكيل يمهل ولا,,[],0,pending,,
mt_dial_egy_45fdde47,train,28379,DIAL_EGY,احنا مش بلطجية يا امورة زيكم مش شايليين مطاوى,احنا مش بلطجيه يا اموره زيكم مش شايليين مطاوي,,[],0,pending,,
mt_dial_glf_656a7bf3,train,23778,DIAL_GLF,وليش مايحاسبون اصحاب المشاوير الخاصة ؟,وليش مايحاسبون اصحاب المشاوير الخاصه,,[],0,pending,,
mt_dial_lev_8db219a5,train,224,DIAL_LEV,الحمد لله انهم بدهم يغيرو اللون الوردي عشانهم في هذا اللون ضيعو بطولات,الحمد لله انهم بدهم يغيرو اللون الوردي عشانهم في هذا اللون ضيعو بطولات,,[],0,pending,,
mt_msa_e033d9a3,train,55991,MSA,ولذلك وجب علينا أن نضع استراتجية معينة لمنع مثل هكذا أشياء من خلال التربية الحسنة في المنزل والمحارم عند,ولذلك وجب علينا ان نضع استراتجيه معينه لمنع مثل هكذا اشياء من خلال التربيه الحسنه في المنزل والمحارم عند,,[],0,pending,,
mt_dial_egy_8eb63387,train,17455,DIAL_EGY,الحمد لله غيرنا بقاله سنين مش لاقى شغل مش عارف ليه الناس مابتحمدش,الحمد لله غيرنا بقاله سنين مش لاقي شغل مش عارف ليه الناس مابتحمدش,,[],0,pending,,
mt_dial_glf_970103f6,train,57562,DIAL_GLF,عادي تعودنا الاستهبال حتى ان النصر لم يطالب بمحاسبة رئيس شرطة دبي بل العكس هو من هدد بالانتربول وهلحين غالي ؟ ويازمان العجايب يازمان,عادي تعودنا الاستهبال حتي ان النصر لم يطالب بمحاسبه رييس شرطه دبي بل العكس هو من هدد بالانتربول وهلحين غالي ويازمان العجايب يازمان,,[],0,pending,,
