example_id,source_split,source_row_id,dialect,original_text,normalized_text,masked_text,mask_spans_json,mask_count,annotation_status,annotator_model,notes
mt_dial_lev_dfbd2677,train,63677,DIAL_LEV,يعني هله الحجه صارت عند الشباب هي الذهب عشان بطلو يقدرو يتجوزو شو هالحكي هاد الذهب صار شماعه شودخل الذهب بالجيزه يعني بتقدر تحوشلك 500 دينار حق خاتمين واتجوز اذا معك تتجوز بس نصيحه مني بلا جيزه بلا هم خلي مصرياتك معك اريحلك وعيش ملك زمانك بكره حاتندم يا,يعني هله الحجه صارت عند الشباب هي الذهب عشان بطلو يقدرو يتجوزو شو هالحكي هاد الذهب صار شماعه شودخل الذهب بالجيزه يعني بتقدر تحوشلك 500 دينار حق خاتمين واتجوز اذا معك تتجوز بس نصيحه مني بلا جيزه بلا هم خلي مصرياتك معك اريحلك وعيش ملك زمانك بكره حاتندم يا,,[],0,pending,,
mt_msa_e36230ba,train,26727,MSA,المطبخ هو مملكة المرأة أي امرأة وهي تغار من إستعماله من زوجة الإبن والعكس,المطبخ هو مملكه المراه اي امراه وهي تغار من استعماله من زوجه الابن والعكس,,[],0,pending,,
mt_dial_egy_9884905a,train,44406,DIAL_EGY,ليست نفين شكرى المثقفة والتى تعرف كل شئ وتتعامل معه بمنطقية وعقلآنية وتخاطب لغة العقل ولغة الواقع وترضى بفلسفة النصيب والرضا بل الشعب المصرى كله كده ! !,ليست نفين شكري المثقفه والتي تعرف كل شي وتتعامل معه بمنطقيه وعقلانيه وتخاطب لغه العقل ولغه الواقع وترضي بفلسفه النصيب والرضا بل الشعب المصري كله كده,,[],0,pending,,
mt_dial_glf_a24cf7a2,train,41065,DIAL_GLF,ياناس والله احنا السبب في التسول عطيناهم,ياناس والله احنا السبب في التسول عطيناهم,,[],0,pending,,
mt_dial_lev_0757e0a0,train,65908,DIAL_LEV,مش فاهم و احد يشرحلي كيف الدراجات ترخص و هي ممنوعة ؟ ؟,مش فاهم و احد يشرحلي كيف الدراجات ترخص و هي ممنوعه,,[],0,pending,,
mt_msa_01795cd2,train,15633,MSA,بعد طلب الاهلى لأعانه مِن المجلس القومى للريآضه قرر يآسين منصور أن يلحق بالاهلى قبل أن يشحت .,بعد طلب الاهلي لاعانه من المجلس القومي للرياضه قرر ياسين منصور ان يلحق بالاهلي قبل ان يشحت,,[],0,pending,,
mt_dial_egy_51cb8ff6,train,80284,DIAL_EGY,اتمنى انك يااخى تفهم كويس وتقرا كويس وبعدين تتكلم وتنتقض حتى انك معلق تعليقك تحت مقال ينافى تماما كلامك حدود مين بالظبط اللى بنحميها ؟ مصر ؟ ومين اللى بيتفقد الجدار مش امريكا برده ؟ يااخى ده بدل ماتحاول تفهم الواقع وتحاول تشارك فى,اتمني انك يااخي تفهم كويس وتقرا كويس وبعدين تتكلم وتنتقض حتي انك معلق تعليقك تحت مقال ينافي تماما كلامك حدود مين بالظبط اللي بنحميها مصر ومين اللي بيتفقد الجدار مش امريكا برده يااخي ده بدل ماتحاول تفهم الواقع وتحاول تشارك في,,[],0,pending,,
mt_dial_glf_3b94c12e,train,24404,DIAL_GLF,ه حلوه مجلس جمهور الشباب كلهم كم نفر ومسوين زحمه أعلمك ياجمهور الهلال أو النصر أو الرائد أو,ه حلوه مجلس جمهور الشباب كلهم كم نفر ومسوين زحمه اعلمك ياجمهور الهلال او النصر او الرايد او,,[],0,pending,,
mt_dial_lev_5fd32446,train,49999,DIAL_LEV,طيب 10 علامات وعرفنا انو بدو اياهم يبوسو,طيب 10 علامات وعرفنا انو بدو اياهم يبوسو,,[],0,pending,,
mt_msa_997ea82e,train,37453,MSA,فلنعط المرأة حقوقها ولنكرمها لكي لا يأتي المجتمع الغربي ويطالبنا بسفور المرأة المسلمة فالعدل يكفينا شر الدول الغربية وبالعدل فقط يرضى ربنا علينا ويكفينا السوء,فلنعط المراه حقوقها ولنكرمها لكي لا ياتي المجتمع الغربي ويطالبنا بسفور المراه المسلمه فالعدل يكفينا شر الدول الغربيه وبالعدل فقط يرضي ربنا علينا ويكفينا السوء,,[],0,pending,,
mt_dial_egy_81780a74,train,34180,DIAL_EGY,وممكن جدا تكون حنان عند ربنا من اي حد يحرم عليها,وممكن جدا تكون حنان عند ربنا من اي حد يحرم عليها,,[],0,pending,,
mt_dial_glf_f8790a31,train,30089,DIAL_GLF,احس الموضوع هذا راح وقته ذا الحين ماعندنا عصبيه ولا,احس الموضوع هذا راح وقته ذا الحين ماعندنا عصبيه ولا,,[],0,pending,,
mt_dial_lev_b258ed73,train,78004,DIAL_LEV,ثالث اشي ياعاشق الوحدات شباب الاردن لم يخرخ خالي الوفاض من اي بطوله لسا ظايل عنده كاس الاتحاد الاسيوي . . . واليوم 7 - 0,ثالث اشي ياعاشق الوحدات شباب الاردن لم يخرخ خالي الوفاض من اي بطوله لسا ظايل عنده كاس الاتحاد الاسيوي واليوم 7 0,,[],0,pending,,
mt_msa_27cc1dde,train,43400,MSA,جزاك الله خير على نشر هذا الخبر المهم,جزاك الله خير علي نشر هذا الخبر المهم,,[],0,pending,,
mt_dial_egy_4f04e64c,train,55862,DIAL_EGY,الكمونى الى بيقولو علية بريء ضرب نار على الانبا كيرلس و حاول يقتلة هو,الكموني الي بيقولو عليه بريء ضرب نار علي الانبا كيرلس و حاول يقتله هو,,[],0,pending,,
mt_dial_glf_83db631b,train,10879,DIAL_GLF,وإلا على ظهر سفينه بوسط البحر,والا علي ظهر سفينه بوسط البحر,,[],0,pending,,
