example_id,source_split,source_row_id,dialect,original_text,normalized_text,masked_text,mask_spans_json,mask_count,annotation_status,annotator_model,notes
mt_dial_lev_87209dc2,train,59931,DIAL_LEV,مش مشكلة . . اشي عادي وبيصير بارقى,مش مشكله اشي عادي وبيصير بارقي,,[],0,pending,,
mt_msa_cedac11c,train,13410,MSA,شيئ مضحك ان يذكر العجلان نظرية قديمة من 25 سنة ( سبب حوادث السير تعود المعادلة لمرورية وهي المركبة والطريق والسائق ) احب اوضح لك ان هذه النظرية تغيرت خلا المؤتمر الدولي للسلامة على الطرق الذي عقد في جنيف / ( ن سبب الحوادث يعود الى الطريق ، السائق ، واعدم استخدام التقنية ) راجع توصيات المؤتمر,شيي مضحك ان يذكر العجلان نظريه قديمه من 25 سنه سبب حوادث السير تعود المعادله لمروريه وهي المركبه والطريق والسايق احب اوضح لك ان هذه النظريه تغيرت خلا الموتمر الدولي للسلامه علي الطرق الذي عقد في جنيف ن سبب الحوادث يعود الي الطريق السايق واعدم استخدام التقنيه راجع توصيات الموتمر,,[],0,pending,,
mt_dial_egy_477a99f0,train,18495,DIAL_EGY,أنا كنت هناك والشباب كانوا حترمين مع البنات جدا ودى تانى سنه و محصلش اى حاجه ليا ولا لزمايلى,انا كنت هناك والشباب كانوا حترمين مع البنات جدا ودي تاني سنه و محصلش اي حاجه ليا ولا لزمايلي,,[],0,pending,,
mt_dial_glf_b762f170,train,40393,DIAL_GLF,أبناء المنطقة / / / أرجو عدم دعم أي مبدأ أو هدف للعنصرية - تستاهل وترجع بالسلامة والله,ابناء المنطقه ارجو عدم دعم اي مبدا او هدف للعنصريه تستاهل وترجع بالسلامه والله,,[],0,pending,,
mt_dial_lev_21dd6438,train,2460,DIAL_LEV,ثاني شي بصراحة معظم التعليقات صحيحة ولو كانت بتجرح وسبحان الله هيك الجمهور بأول غلطة بينسوا كل محاسن الفريق ولو حتى جابله كاس العالم ! !,ثاني شي بصراحه معظم التعليقات صحيحه ولو كانت بتجرح وسبحان الله هيك الجمهور باول غلطه بينسوا كل محاسن الفريق ولو حتي جابله كاس العالم,,[],0,pending,,
mt_msa_9e895f1c,train,50272,MSA,توكل على الحي الذي لا,توكل علي الحي الذي لا,,[],0,pending,,
mt_dial_egy_116913de,train,31697,DIAL_EGY,يا جماعه برضو مرتضى مش والى او نبى مرتضى انسان مش كويس واحمد شوبير اكيد انه مش انسان اصلا علشان كده انهم الاتنين ظالمين والاتنين وقعوا,يا جماعه برضو مرتضي مش والي او نبي مرتضي انسان مش كويس واحمد شوبير اكيد انه مش انسان اصلا علشان كده انهم الاتنين ظالمين والاتنين وقعوا,,[],0,pending,,
mt_dial_glf_2175f17d,train,43022,DIAL_GLF,البطاله هم الجنسين بذات الشباب تحطموافبيوتهم اساسا لوفي عقول تستوعب الحاصل حاليافالمجتمع من جرائم ومصايب جان اكتشفوا ان السبب الرئيسي هالتحطيم اللي قيدوافيه عيالهم _لكن لاحياةلمن,البطاله هم الجنسين بذات الشباب تحطموافبيوتهم اساسا لوفي عقول تستوعب الحاصل حاليافالمجتمع من جرايم ومصايب جان اكتشفوا ان السبب الرييسي هالتحطيم اللي قيدوافيه عيالهم _لكن لاحياهلمن,,[],0,pending,,
mt_dial_lev_f30c1005,train,27749,DIAL_LEV,شو ها الناس هذه ما عندهم قلب وين العرب و المسلمين و وين,شو ها الناس هذه ما عندهم قلب وين العرب و المسلمين و وين,,[],0,pending,,
mt_msa_73fce306,train,28301,MSA,ويضيف سعد الدين إبراهيم الذى قام بالتدريس لكل من السيدة سوزان مبارك وجمال مبارك فى الجامعة إن جمال كان «ذو وجه بلا تعبير وبارد»,ويضيف سعد الدين ابراهيم الذي قام بالتدريس لكل من السيده سوزان مبارك وجمال مبارك في الجامعه ان جمال كان ذو وجه بلا تعبير وبارد,,[],0,pending,,
mt_dial_egy_8d2e004f,train,85154,DIAL_EGY,انا اهلاويه جدا بس عايزه اقول انه بقي كفايه,انا اهلاويه جدا بس عايزه اقول انه بقي كفايه,,[],0,pending,,
mt_dial_glf_bb6fa69c,train,60734,DIAL_GLF,"شكراً للمملكة رفعت روسنا في هالمعرض الدولي , ,",شكرا للمملكه رفعت روسنا في هالمعرض الدولي,,[],0,pending,,
mt_dial_lev_110361d5,train,27403,DIAL_LEV,والله يا ست امل سيدنا الله يمد بعمره ما ترك مجال للحكي بهاده الموضوع لانه كل المصابين بهاد المرض بتوجهوا الى الديوان الملكي العامر وبلاقو مطلبهم بنصحك انك تروحي على,والله يا ست امل سيدنا الله يمد بعمره ما ترك مجال للحكي بهاده الموضوع لانه كل المصابين بهاد المرض بتوجهوا الي الديوان الملكي العامر وبلاقو مطلبهم بنصحك انك تروحي علي,,[],0,pending,,
mt_msa_7a6a6665,train,60148,MSA,أقبلو اي شي واحمد ربكم خلوكم من,اقبلو اي شي واحمد ربكم خلوكم من,,[],0,pending,,
mt_dial_egy_44eb18d9,train,64028,DIAL_EGY,ده ماتش كورة يعني فايز او مهزوم و بعد كدة كلنا,ده ماتش كوره يعني فايز او مهزوم و بعد كده كلنا,,[],0,pending,,
mt_dial_glf_e35e37f5,train,63862,DIAL_GLF,ولا تلوم الماليزين لانهم جاهم فلوس ما يحلمون,ولا تلوم الماليزين لانهم جاهم فلوس ما يحلمون,,[],0,pending,,
mt_dial_lev_bf3cd60d,train,29733,DIAL_LEV,الحكومة مثل المنشار على الطالع بتقص وعلى النازل,الحكومه مثل المنشار علي الطالع بتقص وعلي النازل,,[],0,pending,,
mt_msa_33ab2565,train,49795,MSA,لم ولن تنجب آسيا حارس مرمى,لم ولن تنجب اسيا حارس مرمي,,[],0,pending,,
mt_dial_egy_1af9a399,train,64952,DIAL_EGY,نيفين شكري انت لم تردي على السؤال المتكرر 100 مره انت دكتوره تخصصك ايه بالظبط ثانيا انت مش ملاحظه انك نشاذ 000 ثالثا تؤيدي نظام بعينه هذا شأنك لكن لابد ان تحترمي عقول اولاد بلدك ولا تقلبي الحقائق ولا تنعتي الرجل بما ليس فيه رابعا سؤال يا بنت شكري انت مع الديمقراطية ام لا 0 خامسا ان كنت تؤمني بالديمقراطيه فأقسمي بالله العظيم ثلاث مرات ان النظام الذي تدافعين عنه نظام ديمقراطي يؤمن بتداول,نيفين شكري انت لم تردي علي السوال المتكرر 100 مره انت دكتوره تخصصك ايه بالظبط ثانيا انت مش ملاحظه انك نشاذ 000 ثالثا تويدي نظام بعينه هذا شانك لكن لابد ان تحترمي عقول اولاد بلدك ولا تقلبي الحقايق ولا تنعتي الرجل بما ليس فيه رابعا سوال يا بنت شكري انت مع الديمقراطيه ام لا 0 خامسا ان كنت تومني بالديمقراطيه فاقسمي بالله العظيم ثلاث مرات ان النظام الذي تدافعين عنه نظام ديمقراطي يومن بتداول,,[],0,pending,,
mt_dial_glf_53b5bd88,train,314,DIAL_GLF,فيه اصناف من الناس تحب البذخ والمضاهر حتى وان كان تفران يعني مفلس ويحب يضهر للناس عكس ماهو عايش والغريب ان جميع المتضاهرين بذلك تجدهم من طبقه المفلسين وجماعه القروض ماادري ليه ؟,فيه اصناف من الناس تحب البذخ والمضاهر حتي وان كان تفران يعني مفلس ويحب يضهر للناس عكس ماهو عايش والغريب ان جميع المتضاهرين بذلك تجدهم من طبقه المفلسين وجماعه القروض ماادري ليه,,[],0,pending,,
mt_dial_lev_8ea68544,train,50515,DIAL_LEV,هاض الاردن اردنا وابو حسين قائدنا والاردن اولا والفيصلي,هاض الاردن اردنا وابو حسين قايدنا والاردن اولا والفيصلي,,[],0,pending,,
mt_msa_1c35b9da,train,66565,MSA,يجب ان تكون البنات والمعلمات امينات على,يجب ان تكون البنات والمعلمات امينات علي,,[],0,pending,,
mt_dial_egy_da5ea7ae,train,25027,DIAL_EGY,الي يخلي الحكومة معاكم والحكام,الي يخلي الحكومه معاكم والحكام,,[],0,pending,,
mt_dial_glf_0c4dc54e,train,12538,DIAL_GLF,"من يوم قراءت عبارة علمت دنيا الرياضة , وانا مرتاح لان علمت هذة العبارة لها عدة احتمالات . الاحتمال الاول ان صابت الكلمة قالوا سبق لدنيا الرياضة ان تطرقت لهذة الموضوع وان اخطأةاسكتوا على الموضوع ولم يعقبوا عليه . يعني فقط ارباك الجمهور فقط اما الإدارة فهي تعلم بان حسام مقتنع بقوف نادي النادي معه",من يوم قراءت عباره علمت دنيا الرياضه وانا مرتاح لان علمت هذه العباره لها عده احتمالات الاحتمال الاول ان صابت الكلمه قالوا سبق لدنيا الرياضه ان تطرقت لهذه الموضوع وان اخطاهاسكتوا علي الموضوع ولم يعقبوا عليه يعني فقط ارباك الجمهور فقط اما الاداره فهي تعلم بان حسام مقتنع بقوف نادي النادي معه,,[],0,pending,,
mt_dial_lev_7c462c0d,train,17698,DIAL_LEV,سابعا : - كل الشكر للكبير خالد خطاطبة على هالاخبار الحلوة ولا تحرمنا منها يوم,سابعا كل الشكر للكبير خالد خطاطبه علي هالاخبار الحلوه ولا تحرمنا منها يوم,,[],0,pending,,
mt_msa_8de98952,train,16880,MSA,أدعوا جميع فئات الشعب لتأييد مشروع قانون النيابة الادارية المقدم لمجلس الشعب 2010 وذلك حفاظا علي المال العام وهو مال الشعب المصري كله فلذا أدعو جميع فئات الشعب من مثقفين وأدباء لتأيد هذا المشروع والمساهمه في دعوة أعضاء مجلسي الشعب والشوري لتأييدة,ادعوا جميع فيات الشعب لتاييد مشروع قانون النيابه الاداريه المقدم لمجلس الشعب 2010 وذلك حفاظا علي المال العام وهو مال الشعب المصري كله فلذا ادعو جميع فيات الشعب من مثقفين وادباء لتايد هذا المشروع والمساهمه في دعوه اعضاء مجلسي الشعب والشوري لتاييده,,[],0,pending,,
mt_dial_egy_2d6d27e0,train,17570,DIAL_EGY,النقطة الثانية التي أود التحدث فيه هو أن الاعلام للأسف معظمه فاسد سواء في الرياضة أو المجالات الأخرى لدرجة أن ما فعله ابوتريكة في هدفه في الجيش اعتبروه حلال وكمان أطلقوا على ابوتريكة القديس والشيخ والطيب وخلافة نفس اسأل سؤال لابوتريكة وإلي كل واحد أهلاوي هل ما فعله ابوتريكة حلال أم حرام . . . وهذا ما فعله مطصفي فهمي منه لله وشطة ابو شعر منكوش اللي نصفه شعر . . . فالزمالك اتسرق وهو اكبر منهم وسيظهر الحق في يوم,النقطه الثانيه التي اود التحدث فيه هو ان الاعلام للاسف معظمه فاسد سواء في الرياضه او المجالات الاخري لدرجه ان ما فعله ابوتريكه في هدفه في الجيش اعتبروه حلال وكمان اطلقوا علي ابوتريكه القديس والشيخ والطيب وخلافه نفس اسال سوال لابوتريكه والي كل واحد اهلاوي هل ما فعله ابوتريكه حلال ام حرام وهذا ما فعله مطصفي فهمي منه لله وشطه ابو شعر منكوش اللي نصفه شعر فالزمالك اتسرق وهو اكبر منهم وسيظهر الحق في يوم,,[],0,pending,,
mt_dial_glf_3a3a9023,train,50279,DIAL_GLF,بس غريبه ماطلع علينا قائد شرطة دبي . .,بس غريبه ماطلع علينا قايد شرطه دبي,,[],0,pending,,
mt_dial_lev_bc5d1a7c,train,16872,DIAL_LEV,بالنسبة لامير القلوب واسرها وحبيبها بيكاسو الكرة الاردنية رافت علي انا من رايي ان يتم التجديد لهذا اللاعب ل 5 مواسم ولو بدو مليون لانه لاعب من طراز رفيع وفنان وساحر والي نسي في الكورة اللاعبين قاعدين بتعلموا فلا يجب ان ننقص من قدر هذا اللاعب الذي لو ان له شوية حظ لرايتموه يلعب في الدوري الانجليزي او الاسباني ومع اكبر الاندية وانا ما ببالغ بكلامي لانو بيكاسو مش طبيعي والي بيقنعني بهالحكي انو لهسا عندو عطاء في لعب وحب الكرة لا يوصف وانشاء الله يا رافت تظلك فنان وامير القلوب لغاية خمس سنين كمان لحد الاعتزال يا كبير وتجيبلنا كاس الكؤوس السنة هاي كمان برجلتيك اللتان تتلفان حرير يا,بالنسبه لامير القلوب واسرها وحبيبها بيكاسو الكره الاردنيه رافت علي انا من رايي ان يتم التجديد لهذا اللاعب ل 5 مواسم ولو بدو مليون لانه لاعب من طراز رفيع وفنان وساحر والي نسي في الكوره اللاعبين قاعدين بتعلموا فلا يجب ان ننقص من قدر هذا اللاعب الذي لو ان له شويه حظ لرايتموه يلعب في الدوري الانجليزي او الاسباني ومع اكبر الانديه وانا ما ببالغ بكلامي لانو بيكاسو مش طبيعي والي بيقنعني بهالحكي انو لهسا عندو عطاء في لعب وحب الكره لا يوصف وانشاء الله يا رافت تظلك فنان وامير القلوب لغايه خمس سنين كمان لحد الاعتزال يا كبير وتجيبلنا كاس الكووس السنه هاي كمان برجلتيك اللتان تتلفان حرير يا,,[],0,pending,,
mt_msa_9722878d,train,70181,MSA,ثالثا لماذا تسمون من يحصل على معدل 59 . 9 في الثانوية انه ناجح على اساس هذا القانون الغير حكيم يعتبر اصحاب المعدلات من 59 . 5 فما دون راسبون في الثانوية ولا تقل لي ان يدرسوا في الكلية بسبب ما ذكر في بداية,ثالثا لماذا تسمون من يحصل علي معدل 59 9 في الثانويه انه ناجح علي اساس هذا القانون الغير حكيم يعتبر اصحاب المعدلات من 59 5 فما دون راسبون في الثانويه ولا تقل لي ان يدرسوا في الكليه بسبب ما ذكر في بدايه,,[],0,pending,,
mt_dial_egy_a43ddf2e,train,20827,DIAL_EGY,يارب اشفيه علشان لو فيه حد ليه حق عند الراجل ده يتاخد منه يوم,يارب اشفيه علشان لو فيه حد ليه حق عند الراجل ده يتاخد منه يوم,,[],0,pending,,
mt_dial_glf_2220b586,train,47342,DIAL_GLF,وان شاء الله 9 صفر وهذا اللي انا اتووقعه بأذن الله والكأس,وان شاء الله 9 صفر وهذا اللي انا اتووقعه باذن الله والكاس,,[],0,pending,,
mt_dial_lev_be0b1c54,train,45613,DIAL_LEV,و يا ريت يا حمد تختار لاعبين اصحاب نزعة دفاعية لاننا ذاهبون الى قطر للمحافظة على نظافة الشباك قدر المستطاع,و يا ريت يا حمد تختار لاعبين اصحاب نزعه دفاعيه لاننا ذاهبون الي قطر للمحافظه علي نظافه الشباك قدر المستطاع,,[],0,pending,,
mt_msa_17eaf5e8,train,48321,MSA,نحن نعتقد ان صدور هذا القانون بداية جيدة وطبقا لتطور الاحوال الاقتصادية والسوقية فان القوانين يمكن تطويرها او تعديلها,نحن نعتقد ان صدور هذا القانون بدايه جيده وطبقا لتطور الاحوال الاقتصاديه والسوقيه فان القوانين يمكن تطويرها او تعديلها,,[],0,pending,,
mt_dial_egy_9368e96e,train,948,DIAL_EGY,ال اي باد دة فايدته الأولي هي سعه تخزين عالية مع شاشة كبيرة مع خفة في الوزن وهي دي المواصفات القياسية لتخزين وقراءة الكتب يعني الشاب الأمريكي أو الأوربي بدل ما يروح الجامعة بكل كتبه ويتنقل بيها هيحطها علي ال اي,ال اي باد ده فايدته الاولي هي سعه تخزين عاليه مع شاشه كبيره مع خفه في الوزن وهي دي المواصفات القياسيه لتخزين وقراءه الكتب يعني الشاب الامريكي او الاوربي بدل ما يروح الجامعه بكل كتبه ويتنقل بيها هيحطها علي ال اي,,[],0,pending,,
mt_dial_glf_ccf0e1c2,train,17453,DIAL_GLF,قال الامام تركي رحمه الله . . حطيت الاجرب لي خويا امباري . .,قال الامام تركي رحمه الله حطيت الاجرب لي خويا امباري,,[],0,pending,,
mt_dial_lev_2be9e808,train,17008,DIAL_LEV,اتوقع ان نشاهد مباراه جميله فيها لمحات تثير اعجاب جمهور كلا الفريقين اما جمهور هداك فمساكين زعلانين لن تعجبهم المباراه حتى ولو كانت على مستوى القمه . . . يا حرام يا,اتوقع ان نشاهد مباراه جميله فيها لمحات تثير اعجاب جمهور كلا الفريقين اما جمهور هداك فمساكين زعلانين لن تعجبهم المباراه حتي ولو كانت علي مستوي القمه يا حرام يا,,[],0,pending,,
mt_msa_4b65df0f,train,24653,MSA,2 - يعلمنا ويذكرنا بما قاله,2 يعلمنا ويذكرنا بما قاله,,[],0,pending,,
mt_dial_egy_5d26c449,train,77465,DIAL_EGY,علشان انا بكره اسرائل الحقيرة الى يوم,علشان انا بكره اسرايل الحقيره الي يوم,,[],0,pending,,
mt_dial_glf_ead2d5af,train,4956,DIAL_GLF,كل وحده تطلب على حسب ظروفها والحياة اللي عاشتها .,كل وحده تطلب علي حسب ظروفها والحياه اللي عاشتها,,[],0,pending,,
mt_dial_lev_173f18bc,train,40152,DIAL_LEV,30 مليون من اصل 513 . 5 مليون يعني الباقي 483 . 5 مليون دولار ايش هاي المساعدات وين راحت اذا كان ثاني اهم قطاع بعد التعليم حصل على 30 مليون وين راحت المصاري الباقية لاوم نعرف اذا فعلا هالحكي صحيح امريكا ما بتعطي شيء لله اذا اعطت دولار بتاخذ بدلا عن عشرة ايش الثمن ممكن حد,30 مليون من اصل 513 5 مليون يعني الباقي 483 5 مليون دولار ايش هاي المساعدات وين راحت اذا كان ثاني اهم قطاع بعد التعليم حصل علي 30 مليون وين راحت المصاري الباقيه لاوم نعرف اذا فعلا هالحكي صحيح امريكا ما بتعطي شيء لله اذا اعطت دولار بتاخذ بدلا عن عشره ايش الثمن ممكن حد,,[],0,pending,,
mt_msa_7c34858a,train,80649,MSA,كل الشكر والتقدير والاحترام لمساعد وزير الدفاع للشئون الطيران المدني على جهوده,كل الشكر والتقدير والاحترام لمساعد وزير الدفاع للشيون الطيران المدني علي جهوده,,[],0,pending,,
mt_dial_egy_32e7975f,train,68458,DIAL_EGY,ايه راي اتحاد الكورة وازاى تعاقب اداري موقوف وممنوع من,ايه راي اتحاد الكوره وازاي تعاقب اداري موقوف وممنوع من,,[],0,pending,,
mt_dial_glf_6584b244,train,56203,DIAL_GLF,الي فيها خير بتقوى انها تتحمل ام زوجها حتى لو هي,الي فيها خير بتقوي انها تتحمل ام زوجها حتي لو هي,,[],0,pending,,
mt_dial_lev_55e1c133,train,15906,DIAL_LEV,ما شاء الله تعالو شوفو مدارس عمان الي مابترحم اكيد لوكان في رقابة عليهم ماكانو عملو هيك وكمان ما في بديل,ما شاء الله تعالو شوفو مدارس عمان الي مابترحم اكيد لوكان في رقابه عليهم ماكانو عملو هيك وكمان ما في بديل,,[],0,pending,,
mt_msa_0e05c43c,train,25812,MSA,نعم خالد جاسم افضل مذيع ومقدم في الخليج وبدون منازع ويستحق منا كل احترام وتقدير وانا من اشد محبية,نعم خالد جاسم افضل مذيع ومقدم في الخليج وبدون منازع ويستحق منا كل احترام وتقدير وانا من اشد محبيه,,[],0,pending,,
mt_dial_egy_8f9bf0a5,train,20890,DIAL_EGY,والله فريق الجونه ده فريق محترم والكلام ده ضريبة النجاح انه يتقال عليكم كدا زي ما اتقال علي الاهلي انه بيشتري الحكام وبياخد منشطات احنا في بلد النفاق,والله فريق الجونه ده فريق محترم والكلام ده ضريبه النجاح انه يتقال عليكم كدا زي ما اتقال علي الاهلي انه بيشتري الحكام وبياخد منشطات احنا في بلد النفاق,,[],0,pending,,
mt_dial_glf_c239a2f9,train,81233,DIAL_GLF,ارحمم يالهلال من جد ابطال بس قدام النصر,ارحمم يالهلال من جد ابطال بس قدام النصر,,[],0,pending,,
mt_dial_lev_9d4ae560,train,50987,DIAL_LEV,الحمدلله الي في بطيخ كان الفقير ما اله فواكه ياكلها . . . يعني لو اجيى على باله تفاح ما بلاقي غير التفاح المضروب عشان يشتريه ويقضي نفسه لانه التفاح الي بشهي والي سعر الكيلو تقريبا 1 . 750 لو يقعد 100 سنه ما بشتري اذا كان عنده عيله عشن هيك بنقول ما الك الا البطيخ والله يستر ما يصير سعره سياحي,الحمدلله الي في بطيخ كان الفقير ما اله فواكه ياكلها يعني لو اجيي علي باله تفاح ما بلاقي غير التفاح المضروب عشان يشتريه ويقضي نفسه لانه التفاح الي بشهي والي سعر الكيلو تقريبا 1 750 لو يقعد 100 سنه ما بشتري اذا كان عنده عيله عشن هيك بنقول ما الك الا البطيخ والله يستر ما يصير سعره سياحي,,[],0,pending,,
