example_id,source_split,source_row_id,dialect,original_text,normalized_text,masked_text,mask_spans_json,mask_count,annotation_status,annotator_model,notes
mt_dial_egy_775ae2a9,train,30912,DIAL_EGY,باين عليه مورينيو مش عارف هيقابل مين فى الدور قبل النهائى . اكيد بيحلم انه ياخد دورى الابطال السنه دى ولا عشان صعد الدور قبل النهائى على حساب فريق ضعيف يبقى كل الفرق اللى هيقابلها زى سسكا موسكو . دى برشلونه ياعم الحج . انت نسيت انك هتقابل برشلونه احسن فريق فى العالم ولا ايه . انشر يا عم ال,باين عليه مورينيو مش عارف هيقابل مين في الدور قبل النهايي اكيد بيحلم انه ياخد دوري الابطال السنه دي ولا عشان صعد الدور قبل النهايي علي حساب فريق ضعيف يبقي كل الفرق اللي هيقابلها زي سسكا موسكو دي برشلونه ياعم الحج انت نسيت انك هتقابل برشلونه احسن فريق في العالم ولا ايه انشر يا عم ال,,[],0,pending,,
mt_dial_glf_48eb0762,train,47173,DIAL_GLF,وانحآش ثاني يوم ولا يلاقوني ابد ابد ابد لاني مندس في البطحآء,وانحاش ثاني يوم ولا يلاقوني ابد ابد ابد لاني مندس في البطحاء,,[],0,pending,,
mt_dial_lev_11f6ef26,train,65534,DIAL_LEV,و بعدين يعني حسوا و ميزوا يا حكومتنا انه الشعب مكان سيرارتفاع بكل مقايس الحياة وانخفاض بكل معنى الكلمة بدخله و سلامتكم و يرحم ترابك يا جدي ارتحت من اخبار الساعه,و بعدين يعني حسوا و ميزوا يا حكومتنا انه الشعب مكان سيرارتفاع بكل مقايس الحياه وانخفاض بكل معني الكلمه بدخله و سلامتكم و يرحم ترابك يا جدي ارتحت من اخبار الساعه,,[],0,pending,,
mt_msa_cf4da6c4,train,50455,MSA,ياليت تكون هناك تجربة قبل الدفع بهذا النظام للعمل وأقترح اعادة دراسة قيم المخالفات حتى لايكون للإرتفاع في قيمها انعكاس على ولاء المواطن بسبب نظام مروري غير علمي ولم يأخذ جميع الأبعاد عند,ياليت تكون هناك تجربه قبل الدفع بهذا النظام للعمل واقترح اعاده دراسه قيم المخالفات حتي لايكون للارتفاع في قيمها انعكاس علي ولاء المواطن بسبب نظام مروري غير علمي ولم ياخذ جميع الابعاد عند,,[],0,pending,,
mt_dial_egy_22b89f8e,train,85048,DIAL_EGY,ان اسلوب الحكومة مع الشعب لم ينتج عنة الا شىء واحد وهو الأصرار على التغيير والوقوف امام الظلم مهما حدث لنا ولأهلنا ولأولادنا ولم نتراجع خلاص فوقنا,ان اسلوب الحكومه مع الشعب لم ينتج عنه الا شيء واحد وهو الاصرار علي التغيير والوقوف امام الظلم مهما حدث لنا ولاهلنا ولاولادنا ولم نتراجع خلاص فوقنا,,[],0,pending,,
mt_dial_glf_ef06ed0a,train,80323,DIAL_GLF,مواطن غيور رجال الوقت هذا مافيهم خير الامن رحم,مواطن غيور رجال الوقت هذا مافيهم خير الامن رحم,,[],0,pending,,
mt_dial_lev_a070e361,train,60438,DIAL_LEV,ومعلش يا لاعبينا اصبر عشان نوصل للي بدنا,ومعلش يا لاعبينا اصبر عشان نوصل للي بدنا,,[],0,pending,,
mt_msa_53a68f1a,train,78486,MSA,ان شالله اوضاع النزلاء تتحسن في المراكز مبروك على الدرع من الدكتور فوزي الحموري,ان شالله اوضاع النزلاء تتحسن في المراكز مبروك علي الدرع من الدكتور فوزي الحموري,,[],0,pending,,
mt_dial_egy_3b6db3a0,train,5205,DIAL_EGY,كل حاجة الاهلى كل حاجة الاهلى كل جملة مفيدةالاهلى الحكام الاهلى الاعلام الاهلى اتحادالكرةالاهلى لجنةمسابقات الاهلى الحكومة الاهلى يتغلبوا الاهلى انتخاباتهم الاهلى على فكرة ده بسبب عياطهم رئيس النادى عيط عضومجلس ادارة عيط اللعيبة بتعيط بسبب الاهلى حازم امام كبيراوصغيرا عيط شيكابالو عيط كله بيعيط بسبب الاهلى الغلاء بسبب الاهلى الحمدلله ان انا اهلاوى والله يكون فى عونهم الاهلى الاهلى الاهلى الاهلى الاهلى الاهلى الاهلى الاهلى الاهلى الاهلى الاهلى الاهلى الاهلى الاهلى الاهلى الاهلى انا اتجنت ياعالم,كل حاجه الاهلي كل حاجه الاهلي كل جمله مفيدهالاهلي الحكام الاهلي الاعلام الاهلي اتحادالكرهالاهلي لجنهمسابقات الاهلي الحكومه الاهلي يتغلبوا الاهلي انتخاباتهم الاهلي علي فكره ده بسبب عياطهم رييس النادي عيط عضومجلس اداره عيط اللعيبه بتعيط بسبب الاهلي حازم امام كبيراوصغيرا عيط شيكابالو عيط كله بيعيط بسبب الاهلي الغلاء بسبب الاهلي الحمدلله ان انا اهلاوي والله يكون في عونهم الاهلي الاهلي الاهلي الاهلي الاهلي الاهلي الاهلي الاهلي الاهلي الاهلي الاهلي الاهلي الاهلي الاهلي الاهلي الاهلي انا اتجنت ياعالم,,[],0,pending,,
mt_dial_glf_2a1b442c,train,11490,DIAL_GLF,المرور / اسكت لا احد يسمعك فضحتنا لا تقطع رزقنا خلنا نطلع قيمة رواتبنا وخارج دوامنا وانتداباتنا . . .,المرور اسكت لا احد يسمعك فضحتنا لا تقطع رزقنا خلنا نطلع قيمه رواتبنا وخارج دوامنا وانتداباتنا,,[],0,pending,,
mt_dial_lev_fa902f6d,train,79181,DIAL_LEV,وزي هيك اخبار بتفيد لانه المواطن المسكين بسير يقول الحمد لله ما صار رفع و بنسى انه اصلا الرفعه الموجوده اول,وزي هيك اخبار بتفيد لانه المواطن المسكين بسير يقول الحمد لله ما صار رفع و بنسي انه اصلا الرفعه الموجوده اول,,[],0,pending,,
mt_msa_65d3756e,train,60572,MSA,فخر لنا جميعا كسعوديين وعرب ومسلمين ، إذ يرفع راية العلم ناس رائعين مثل د . فوزان الكريّع .,فخر لنا جميعا كسعوديين وعرب ومسلمين اذ يرفع رايه العلم ناس رايعين مثل د فوزان الكريع,,[],0,pending,,
mt_dial_egy_4995f963,train,14236,DIAL_EGY,حكومة تشرف حكومة انقاذ وطني كلهم شرفاء لا مصلحة لهم الا الوطن والمواطن أسماء فوق مستوي الشبهات نتشرف بأن تكون حكومتنا ادعوا ربنا ان الناس دية تكون موجودة حد يساوم علي هذة الاسامي الكبيرة المحترمة الشبعانة مش حكومة البيزنس بتوع شاي ليبتون وبتوع جرانا وكايرو سكان ودار الفؤاد والمقاولات وشيفرولية والفقي وقبلهم والي الي خرب الزراعة وعبيد اللي خصص البلد وقعدوا يغنوا في توشكي وباعوا الارض بعقود ولا عقود الاستعمار الحزب الحاكم متحدثة الرسمي أبو حديد بالذمة لسة هتقولوا مسيحي ومسلم اللهم اللي احنا فية طايل الوطن والمواطن مافيش اسود من اللي عايشينة أمراض وغذاء مسمم وبطالة وقوانين جباية من مماليك العصر حتي فلوس الغلابة تاهت وضاعت التأمينات ولاعزاء للفقراء وتقولي واخد بالك مسيحي ومسلم فوقوا بقة وبصوا,حكومه تشرف حكومه انقاذ وطني كلهم شرفاء لا مصلحه لهم الا الوطن والمواطن اسماء فوق مستوي الشبهات نتشرف بان تكون حكومتنا ادعوا ربنا ان الناس ديه تكون موجوده حد يساوم علي هذه الاسامي الكبيره المحترمه الشبعانه مش حكومه البيزنس بتوع شاي ليبتون وبتوع جرانا وكايرو سكان ودار الفواد والمقاولات وشيفروليه والفقي وقبلهم والي الي خرب الزراعه وعبيد اللي خصص البلد وقعدوا يغنوا في توشكي وباعوا الارض بعقود ولا عقود الاستعمار الحزب الحاكم متحدثه الرسمي ابو حديد بالذمه لسه هتقولوا مسيحي ومسلم اللهم اللي احنا فيه طايل الوطن والمواطن مافيش اسود من اللي عايشينه امراض وغذاء مسمم وبطاله وقوانين جبايه من مماليك العصر حتي فلوس الغلابه تاهت وضاعت التامينات ولاعزاء للفقراء وتقولي واخد بالك مسيحي ومسلم فوقوا بقه وبصوا,,[],0,pending,,
mt_dial_glf_70214348,train,8916,DIAL_GLF,والحمد الله علا سلامة النمر سلطان,والحمد الله علا سلامه النمر سلطان,,[],0,pending,,
mt_dial_lev_c23545c9,train,54081,DIAL_LEV,انا مسيحي و لكني اعلم ان عقوبه الفتاه و الشاب الذي حملت منه الجلد كونهم غير متزوجين . . اما هنا قتلت الفتاه و عاد الزاني الى عمله و خلصت الحكايه .,انا مسيحي و لكني اعلم ان عقوبه الفتاه و الشاب الذي حملت منه الجلد كونهم غير متزوجين اما هنا قتلت الفتاه و عاد الزاني الي عمله و خلصت الحكايه,,[],0,pending,,
mt_msa_75f2e57c,train,85739,MSA,ينقل من يشاء و يفصل من,ينقل من يشاء و يفصل من,,[],0,pending,,
mt_dial_egy_5ddd90e0,train,37763,DIAL_EGY,شوف ياولدى مايعيد الحقوق إلا صحابها . . والعريان مايجدر يكسى غيره . والمزلول فى بلده,شوف ياولدي مايعيد الحقوق الا صحابها والعريان مايجدر يكسي غيره والمزلول في بلده,,[],0,pending,,
mt_dial_glf_60f09c4d,train,22979,DIAL_GLF,تستاهل كل خير يا كابتن,تستاهل كل خير يا كابتن,,[],0,pending,,
mt_dial_lev_ec5db4f9,train,46951,DIAL_LEV,والله لو إنو ببلاش وعلى قناة الجزيره ما رح بحضر اي برنامج ولازم الكل قاطع هالقناه اللي بين فترة والتانيه بتطلع بصرعه جديده ضد,والله لو انو ببلاش وعلي قناه الجزيره ما رح بحضر اي برنامج ولازم الكل قاطع هالقناه اللي بين فتره والتانيه بتطلع بصرعه جديده ضد,,[],0,pending,,
mt_msa_04433b76,train,22954,MSA,منتهى الإذلال للمرأة أن يجبرها,منتهي الاذلال للمراه ان يجبرها,,[],0,pending,,
mt_dial_egy_f63fdd89,train,84857,DIAL_EGY,عمو برادعي حيعمل إيه لوحده .,عمو برادعي حيعمل ايه لوحده,,[],0,pending,,
mt_dial_glf_a8246939,train,67629,DIAL_GLF,يوم شافو ان غالي بيهزم الزعيم وقفوه عن,يوم شافو ان غالي بيهزم الزعيم وقفوه عن,,[],0,pending,,
mt_dial_lev_5e2e3df7,train,7591,DIAL_LEV,قال ايش اتجوز يا حسرة ياريت ضلت ع العروس الغالية لا كمان الي بتلبسو لازم يكون غالي ( يالله يا كريم يا مرخص الحريم,قال ايش اتجوز يا حسره ياريت ضلت ع العروس الغاليه لا كمان الي بتلبسو لازم يكون غالي يالله يا كريم يا مرخص الحريم,,[],0,pending,,
mt_msa_f0616155,train,25377,MSA,أتمنى من أن المعرض يقام في جميع مدن المملكة الرئيسية مثل جدة والدمام والمناطق الشمالية والجنوبية,اتمني من ان المعرض يقام في جميع مدن المملكه الرييسيه مثل جده والدمام والمناطق الشماليه والجنوبيه,,[],0,pending,,
mt_dial_egy_95071f90,train,79999,DIAL_EGY,والله يا سى حماقى أنت سقت من نظر كثيراً من معجبيك اليوم وأحب أسئلك سؤال,والله يا سي حماقي انت سقت من نظر كثيرا من معجبيك اليوم واحب اسيلك سوال,,[],0,pending,,
mt_dial_glf_23977743,train,42276,DIAL_GLF,وين الجمال فيه . . والله من كلام الفاضي . . يا حبي لبنات,وين الجمال فيه والله من كلام الفاضي يا حبي لبنات,,[],0,pending,,
mt_dial_lev_1ff81b7a,train,80653,DIAL_LEV,لا تندهي ما في حدا . .,لا تندهي ما في حدا,,[],0,pending,,
mt_msa_16330588,train,59814,MSA,كل يوم اخبار عن المسلمين,كل يوم اخبار عن المسلمين,,[],0,pending,,
mt_dial_egy_0797fb96,train,76781,DIAL_EGY,انا متعاطف مع الاخت نجوى ولازم يكون لها حل وعن طريق هذه الصفحه لازم تكون هناك جهه مستقله عشان الناس متتظلمش كده وياريت تكون النيابه الاداريه هى هذه الجهه وهى فيها ناس كويسين وكفايه انهم مش هيكونوا تبع,انا متعاطف مع الاخت نجوي ولازم يكون لها حل وعن طريق هذه الصفحه لازم تكون هناك جهه مستقله عشان الناس متتظلمش كده وياريت تكون النيابه الاداريه هي هذه الجهه وهي فيها ناس كويسين وكفايه انهم مش هيكونوا تبع,,[],0,pending,,
mt_dial_glf_8ad11551,train,45112,DIAL_GLF,ومن كثر ما أعزك صرت أعز اللي,ومن كثر ما اعزك صرت اعز اللي,,[],0,pending,,
mt_dial_lev_2f471003,train,28953,DIAL_LEV,دخيلكوا هي الحكومة بتنتج النفط ، حسبى الله ونعم,دخيلكوا هي الحكومه بتنتج النفط حسبي الله ونعم,,[],0,pending,,
mt_msa_68b1104d,train,81125,MSA,السؤال : هل هو قال لأهلها او لا ؟,السوال هل هو قال لاهلها او لا,,[],0,pending,,
mt_dial_egy_e69e872a,train,80101,DIAL_EGY,الخطاء ان لازم يبقى فيه 2 اقباط فين,الخطاء ان لازم يبقي فيه 2 اقباط فين,,[],0,pending,,
mt_dial_glf_25f4d934,train,14637,DIAL_GLF,ي بعد عمرري هي ، الله يصبر اهلها,ي بعد عمرري هي الله يصبر اهلها,,[],0,pending,,
mt_dial_lev_b353921d,train,33758,DIAL_LEV,وكمان سيف ال خطاب بيسحق مثله تحية على روحه واخلاقة الرياضية اللي لو كان كل الجمهور مثل اخلاقه ما عمرنا سمعنا عن مشاكل والله لا يجيب المشاكل . .,وكمان سيف ال خطاب بيسحق مثله تحيه علي روحه واخلاقه الرياضيه اللي لو كان كل الجمهور مثل اخلاقه ما عمرنا سمعنا عن مشاكل والله لا يجيب المشاكل,,[],0,pending,,
mt_msa_9ec2bba2,train,33259,MSA,ومن بطولة الى بطولة والازرق من,ومن بطوله الي بطوله والازرق من,,[],0,pending,,
mt_dial_egy_b997e456,train,3874,DIAL_EGY,اولا القصة قديمة ومعروفة اسال عن سبب فتح الموضوع تانى ؟ سؤال برئ جدا اين الشهيدة وفاء قسطنطبن,اولا القصه قديمه ومعروفه اسال عن سبب فتح الموضوع تاني سوال بري جدا اين الشهيده وفاء قسطنطبن,,[],0,pending,,
mt_dial_glf_afb340b5,train,83237,DIAL_GLF,أعوذ بالله ، كل هذه فوائض ! ! لا وما هم,اعوذ بالله كل هذه فوايض لا وما هم,,[],0,pending,,
mt_dial_lev_e8700c6e,train,76827,DIAL_LEV,تحيه الى المبدع الرائع السيد خالد الخطاطبه المحترم كل يوم احلى من اللي قبله اخبار طازه وجديده ومنوعه والى الامام,تحيه الي المبدع الرايع السيد خالد الخطاطبه المحترم كل يوم احلي من اللي قبله اخبار طازه وجديده ومنوعه والي الامام,,[],0,pending,,
mt_msa_f0ce47b2,train,75227,MSA,قل الدين الدين يا ناس لا حول ولا قووه الا بالله اللهم اكفنا من فيه,قل الدين الدين يا ناس لا حول ولا قووه الا بالله اللهم اكفنا من فيه,,[],0,pending,,
mt_dial_egy_19818380,train,45937,DIAL_EGY,w . taghyeer . net يلا بينا نوقع على بيان الجمعه المستقله,w taghyeer net يلا بينا نوقع علي بيان الجمعه المستقله,,[],0,pending,,
mt_dial_glf_a9b4cf60,train,52743,DIAL_GLF,بس بصراحه تستاهلون لان الساكت عن الحق شيطان,بس بصراحه تستاهلون لان الساكت عن الحق شيطان,,[],0,pending,,
mt_dial_lev_87fe8e7c,train,52978,DIAL_LEV,يعني كلامو منزل وطاعتو واجب على كل كبير,يعني كلامو منزل وطاعتو واجب علي كل كبير,,[],0,pending,,
mt_msa_a2e4b454,train,28678,MSA,الطريف . . . ان البعض مستغرب من وجود 65 الف,الطريف ان البعض مستغرب من وجود 65 الف,,[],0,pending,,
mt_dial_egy_c1a8d27f,train,69630,DIAL_EGY,اعود واكرر ايران عمرها ماكان معاها مشكله مع امريكا واسرائيل واين كانو منذ 48 و الخ . وشوف الكدب الصريح بيقلك امريكا قتلت 300 الف عراقى . اقسم بالله ان هذا الكلب قتل من خلال الحرث الثورى الايرانى خلال الحرب الاخيره اكتر من 3 مليون سنى عراقى ومازال يفعل يوميا هذا بلاضافه لحالات الاعدام اليوميه لعدد كبير من السنه الايرانيين المضطهد ين هناك . الخلاصه الفيلم بكامله فيه الاعيب كثيره تحت الطاوله وما يطفو على السطح منها يحدث بعد عمل بروفات كثيره للتدريب عليه . . . ايها المسلمون لاتصدقو هذا الكذاب ومن على شاكلته امثال حسن نصر الله ومقتدى الصدر ونورى المالكى وغيرهم . .,اعود واكرر ايران عمرها ماكان معاها مشكله مع امريكا واسراييل واين كانو منذ 48 و الخ وشوف الكدب الصريح بيقلك امريكا قتلت 300 الف عراقي اقسم بالله ان هذا الكلب قتل من خلال الحرث الثوري الايراني خلال الحرب الاخيره اكتر من 3 مليون سني عراقي ومازال يفعل يوميا هذا بلاضافه لحالات الاعدام اليوميه لعدد كبير من السنه الايرانيين المضطهد ين هناك الخلاصه الفيلم بكامله فيه الاعيب كثيره تحت الطاوله وما يطفو علي السطح منها يحدث بعد عمل بروفات كثيره للتدريب عليه ايها المسلمون لاتصدقو هذا الكذاب ومن علي شاكلته امثال حسن نصر الله ومقتدي الصدر ونوري المالكي وغيرهم,,[],0,pending,,
mt_dial_glf_2c31fda9,train,31020,DIAL_GLF,الحمد لله على سلامة ريفان وان شا الله ماتشوف مكروه يابن,الحمد لله علي سلامه ريفان وان شا الله ماتشوف مكروه يابن,,[],0,pending,,
mt_dial_lev_3ec81806,train,69112,DIAL_LEV,واحد رايح وخمسة جاي والرمثا باي,واحد رايح وخمسه جاي والرمثا باي,,[],0,pending,,
mt_msa_4da4d59d,train,68203,MSA,لن تتطور الرياضة و لدينا عقلية مثل عقلية الهلاليين,لن تتطور الرياضه و لدينا عقليه مثل عقليه الهلاليين,,[],0,pending,,
mt_dial_egy_3aaa19a4,train,17526,DIAL_EGY,ده هو مع بندق الزملكاوى يقول من حقه يدافع عن الزمالك ومستكر ده على اسماعيل يوسف المحترم ابن نادى الزمالك هو الكابين المحترم ابراهيم,ده هو مع بندق الزملكاوي يقول من حقه يدافع عن الزمالك ومستكر ده علي اسماعيل يوسف المحترم ابن نادي الزمالك هو الكابين المحترم ابراهيم,,[],0,pending,,
mt_dial_glf_ad23e9a9,train,17320,DIAL_GLF,مشكله طلعت لامي في أختيار الوقت المناسب وهو مزعجنا بالثلاثيه ماتقول الا كان راس حربه الثلاثيه أتت بعد توفيق الله من محض خطط قامو بها رجال الإتحاد أمثال العضو الداعم وأسعدعبدالكريم وفهد بن خالد ومنصور البلوي وباناجه عدنان جمجوم يرحمه الله والرجال في الملعب والمدرب الناجح الذي أحضره العضو,مشكله طلعت لامي في اختيار الوقت المناسب وهو مزعجنا بالثلاثيه ماتقول الا كان راس حربه الثلاثيه اتت بعد توفيق الله من محض خطط قامو بها رجال الاتحاد امثال العضو الداعم واسعدعبدالكريم وفهد بن خالد ومنصور البلوي وباناجه عدنان جمجوم يرحمه الله والرجال في الملعب والمدرب الناجح الذي احضره العضو,,[],0,pending,,
mt_dial_lev_fdd3c119,train,28572,DIAL_LEV,2 - فش عرس . . . توفير 2000,2 فش عرس توفير 2000,,[],0,pending,,
mt_msa_e33e0112,train,33326,MSA,لكن ألا تعتقدون معي أنه إذا وجد,لكن الا تعتقدون معي انه اذا وجد,,[],0,pending,,
mt_dial_egy_9d357171,train,44509,DIAL_EGY,فين قانون الطوارئ منن دول ولا هما مابيستخدمهوش غير فى السياسه بس حسبى الله ونعم الوكيل دا وزاره الداخليه هى اللى واخده فلوس البلد,فين قانون الطواري منن دول ولا هما مابيستخدمهوش غير في السياسه بس حسبي الله ونعم الوكيل دا وزاره الداخليه هي اللي واخده فلوس البلد,,[],0,pending,,
mt_dial_glf_bf8baab2,train,38897,DIAL_GLF,ابو الحب اللي كذا . . الحين تجي وحده تقول الشباب السعودي مايطمر كذا ليه ؟ ه الله من الفهاوه,ابو الحب اللي كذا الحين تجي وحده تقول الشباب السعودي مايطمر كذا ليه ه الله من الفهاوه,,[],0,pending,,
mt_dial_lev_a2f3ffd3,train,74185,DIAL_LEV,والله المعلقين في واد والدنيا في واد آخر . الدراسة صحيحة للأسف عندما يتم مقابلة للشخص الذي يبحث عن وظيفة فعليه أن يكون فخور ويحمل صفة الثقة بالنفس مع القليل من الغرور وخصوصا إذا كان يتقجم لموقع قيادي . ولكني أتفق مع المعلقين أن هذه ليست من صفات المسلم ولكن هذا الذي يحصل وأنا متخصص في هذا,والله المعلقين في واد والدنيا في واد اخر الدراسه صحيحه للاسف عندما يتم مقابله للشخص الذي يبحث عن وظيفه فعليه ان يكون فخور ويحمل صفه الثقه بالنفس مع القليل من الغرور وخصوصا اذا كان يتقجم لموقع قيادي ولكني اتفق مع المعلقين ان هذه ليست من صفات المسلم ولكن هذا الذي يحصل وانا متخصص في هذا,,[],0,pending,,
mt_msa_8e7a1e3e,train,42222,MSA,لقد طعن علاء صادق الوطنيه المصريه فى الظهر عندا اختار اكثر الاماكن عدائيه للفراعنه ليقول رايه مما يدل على سوء,لقد طعن علاء صادق الوطنيه المصريه في الظهر عندا اختار اكثر الاماكن عداييه للفراعنه ليقول رايه مما يدل علي سوء,,[],0,pending,,
