example_id,source_split,source_row_id,dialect,original_text,normalized_text,masked_text,mask_spans_json,mask_count,annotation_status,annotator_model,notes
mt_dial_glf_c9ae62b4,train,32644,DIAL_GLF,الله يلعن ها السواقين مالعب في البلد الا اهم عيال * وبعدين كيف اروح اتعاقد مع واحد يشتغل على سياره خاصه فيه ما اعرف من وين ولا اعرف كيف اوصل له اتمنى الناس ينتبهون خاصه الي يخلون بناتهم يطلعون مع السواق كأنه اخوهم واذا قالو قالو هندي على فكره ترى حتى الهندي له مثل ما للسعودي من شهوه,الله يلعن ها السواقين مالعب في البلد الا اهم عيال وبعدين كيف اروح اتعاقد مع واحد يشتغل علي سياره خاصه فيه ما اعرف من وين ولا اعرف كيف اوصل له اتمني الناس ينتبهون خاصه الي يخلون بناتهم يطلعون مع السواق كانه اخوهم واذا قالو قالو هندي علي فكره تري حتي الهندي له مثل ما للسعودي من شهوه,,[],0,pending,,
mt_dial_lev_6d989831,train,5288,DIAL_LEV,"امبراطور الكرة الأردنية قادم بقوة يا سادة ، ، الوحدات الأخضر قادم يا حضرات ، ، بطولات الموسم الجاي راح تعمل أزمة مرورية على "" طلوع المصدار "" في طريقها للعرين",امبراطور الكره الاردنيه قادم بقوه يا ساده الوحدات الاخضر قادم يا حضرات بطولات الموسم الجاي راح تعمل ازمه مروريه علي طلوع المصدار في طريقها للعرين,,[],0,pending,,
mt_msa_09eb9b4a,train,80528,MSA,عندما خسر الوحدات امام شباب الاردن كان رصيد الوحدات 52 نقطة والفيصلي 50 نقطة . . يعني كان على فريق الفيصلي الفوز في مباراته الاخيرة على الرمثا من اجل نيل لقب بطولة الدوري بعد ان كافح ونافس كل الفرق لكي يحصل اكبر عدد من النقاط . . ولم يحصل على بطولة الدوري بتلك السهولة التي تدعونها يا صاحبي,عندما خسر الوحدات امام شباب الاردن كان رصيد الوحدات 52 نقطه والفيصلي 50 نقطه يعني كان علي فريق الفيصلي الفوز في مباراته الاخيره علي الرمثا من اجل نيل لقب بطوله الدوري بعد ان كافح ونافس كل الفرق لكي يحصل اكبر عدد من النقاط ولم يحصل علي بطوله الدوري بتلك السهوله التي تدعونها يا صاحبي,,[],0,pending,,
mt_dial_egy_4852b073,train,1627,DIAL_EGY,ابن مين في مصر هذا البني ادم المسمي ايمن,ابن مين في مصر هذا البني ادم المسمي ايمن,,[],0,pending,,
mt_dial_glf_74debcde,train,37074,DIAL_GLF,"الاب الله يرحم الحال فقير , والولد ماحصل",الاب الله يرحم الحال فقير والولد ماحصل,,[],0,pending,,
mt_dial_lev_2e80669f,train,39419,DIAL_LEV,اولا الف مبروك هذا الفوز الرائئع المملوء بروح الشباب لغزلان الشمال الرمثا وبقول لجمهور الفيصلي معلش فالاجدر سوف يتاهل بعد مباراة,اولا الف مبروك هذا الفوز الراييع المملوء بروح الشباب لغزلان الشمال الرمثا وبقول لجمهور الفيصلي معلش فالاجدر سوف يتاهل بعد مباراه,,[],0,pending,,
mt_msa_a25d1d1e,train,1174,MSA,مقال رائع ومميز شكرا بن,مقال رايع ومميز شكرا بن,,[],0,pending,,
mt_dial_egy_a7501d3d,train,48121,DIAL_EGY,انا نفسى اعرف الناس الى بتدخل تعترض على ابى بتقوله الصحيقه او حتى كلام الدكتور محمد البردعى بيعترصوا ليه يا سيدى لو مش عجبك البرادعى او الصحيفه الامريكيه خذ منهم مهو مفيد واترك شخصهم انا شايف ان 6 ابريل او الدكتور ابرادعى مش بيقول حاجه ابى حد فى العالم يقدر ينطق ببنت شفه ويوقل انها غلط الناس بطالب بلالغاء قانون الطوراى الى بيسمح الى عسكرى ان يدخل بيتك ويفتشوه حتى من غير تصريح نيابه يبقبى ده,انا نفسي اعرف الناس الي بتدخل تعترض علي ابي بتقوله الصحيقه او حتي كلام الدكتور محمد البردعي بيعترصوا ليه يا سيدي لو مش عجبك البرادعي او الصحيفه الامريكيه خذ منهم مهو مفيد واترك شخصهم انا شايف ان 6 ابريل او الدكتور ابرادعي مش بيقول حاجه ابي حد في العالم يقدر ينطق ببنت شفه ويوقل انها غلط الناس بطالب بلالغاء قانون الطوراي الي بيسمح الي عسكري ان يدخل بيتك ويفتشوه حتي من غير تصريح نيابه يبقبي ده,,[],0,pending,,
mt_dial_glf_05318870,train,8499,DIAL_GLF,هاذي الكلمه اشتهرت بعد ماقلها معلق مصري على مباراه قطر على ماعتقد فازت قطر في ذيك المباراه بس الغريب أن الي جاب الهدف المهاجم القطري ماكان عربي متجنس,هاذي الكلمه اشتهرت بعد ماقلها معلق مصري علي مباراه قطر علي ماعتقد فازت قطر في ذيك المباراه بس الغريب ان الي جاب الهدف المهاجم القطري ماكان عربي متجنس,,[],0,pending,,
mt_dial_lev_e3570aaf,train,56969,DIAL_LEV,الف مبروك عودتك للوطن الغالي و اسفين اذا مستقبلوك زين ببلدي العراق بس هو ضروفة تعبانة من هيج انشاء الله يرجع العراق وتزورنة هناك وتشوف الكرم العراقي .,الف مبروك عودتك للوطن الغالي و اسفين اذا مستقبلوك زين ببلدي العراق بس هو ضروفه تعبانه من هيج انشاء الله يرجع العراق وتزورنه هناك وتشوف الكرم العراقي,,[],0,pending,,
mt_msa_99c7110f,train,47675,MSA,خامسا : سيدتى الفاضلة : مارايك فى تزاوج السلطة بالمال ؟ مارايك فى اعضاء الحزن,خامسا سيدتي الفاضله مارايك في تزاوج السلطه بالمال مارايك في اعضاء الحزن,,[],0,pending,,
mt_dial_egy_2b4a331d,train,84716,DIAL_EGY,هو العيب في مين في الحكومة . . . ولا الناس اللي ماعندهاش اخلاق,هو العيب في مين في الحكومه ولا الناس اللي ماعندهاش اخلاق,,[],0,pending,,
mt_dial_glf_5488e344,train,46823,DIAL_GLF,نفسي اعرف بعد كل هذا غالي يتكبر على النصر والله لو يخلوه ليرجع مثل البس اتركوه يناقز ومرده لناديه,نفسي اعرف بعد كل هذا غالي يتكبر علي النصر والله لو يخلوه ليرجع مثل البس اتركوه يناقز ومرده لناديه,,[],0,pending,,
mt_dial_lev_4ec0a89b,train,65797,DIAL_LEV,الله يستر هالبلد . . . وبعدين ما بدنا نفتك من هالشغلة .,الله يستر هالبلد وبعدين ما بدنا نفتك من هالشغله,,[],0,pending,,
mt_msa_fc33254a,train,65382,MSA,لهذا حان الأن أيجاد محاط نقاط في كل أداره نسويه . .,لهذا حان الان ايجاد محاط نقاط في كل اداره نسويه,,[],0,pending,,
mt_dial_egy_3f982f21,train,58034,DIAL_EGY,الحضرى دمياطى بجد بيعرف يدحك على الهبل ( الجهلا وية ) يلعبلة متشين تلاتة ويلهفلة مليون او اثنين وبعد كدة يعتزل ويتعملة متش اعتزال ويتعين مدرب حراس مرمى زى معمل علاء ميهوب ( ابو دمعة ) اللى الاهلى مشاة ولعب للاتحاد السكندرى وجاب جول فى الاهلى وعمل التمثلية على شان الهبل يشغلوة مدرب ( وصبحان الرازق ) وسلملى على الطرابيش الحمر شكرا للموقع,الحضري دمياطي بجد بيعرف يدحك علي الهبل الجهلا ويه يلعبله متشين تلاته ويلهفله مليون او اثنين وبعد كده يعتزل ويتعمله متش اعتزال ويتعين مدرب حراس مرمي زي معمل علاء ميهوب ابو دمعه اللي الاهلي مشاه ولعب للاتحاد السكندري وجاب جول في الاهلي وعمل التمثليه علي شان الهبل يشغلوه مدرب وصبحان الرازق وسلملي علي الطرابيش الحمر شكرا للموقع,,[],0,pending,,
mt_dial_glf_c765aa5f,train,33523,DIAL_GLF,لله يبارك في شبية الريح,لله يبارك في شبيه الريح,,[],0,pending,,
mt_dial_lev_63b1d43b,train,42742,DIAL_LEV,اي الي بسمعها بقول انا بنوكل لحم ! ! اي عليم الله ما بنوكل اللحم مرة,اي الي بسمعها بقول انا بنوكل لحم اي عليم الله ما بنوكل اللحم مره,,[],0,pending,,
mt_msa_3b831e9a,train,42045,MSA,وسبحان الله ناس تصبر وتتقبل القضاء وناس تتشائم,وسبحان الله ناس تصبر وتتقبل القضاء وناس تتشايم,,[],0,pending,,
mt_dial_egy_2fd125f0,train,48533,DIAL_EGY,بطل كذب ياللى بتقول انه مسيحى ؟ من امتى حد مسيحى اسمه شعبان اتقى ربنا ياكداب وبعدين القذاره دى متطلعش من عندنا وانشر يااخ مش تنشر الفتن اللى بيسببها اصحاب ذلك الرد وخلاص ! !,بطل كذب ياللي بتقول انه مسيحي من امتي حد مسيحي اسمه شعبان اتقي ربنا ياكداب وبعدين القذاره دي متطلعش من عندنا وانشر يااخ مش تنشر الفتن اللي بيسببها اصحاب ذلك الرد وخلاص,,[],0,pending,,
mt_dial_glf_1b78fbf3,train,19274,DIAL_GLF,والله حالتكم حاله يانصراويه والاحد الموعد,والله حالتكم حاله يانصراويه والاحد الموعد,,[],0,pending,,
mt_dial_lev_5ac3f718,train,33654,DIAL_LEV,نفسي الوحدات يعطو الرمثا احلى هدية ويعطوهم الكاس لانو الرمثا فريق بيستاهل . وحداتي,نفسي الوحدات يعطو الرمثا احلي هديه ويعطوهم الكاس لانو الرمثا فريق بيستاهل وحداتي,,[],0,pending,,
mt_msa_38a7da85,train,26534,MSA,من ناحيته قال البرادعى فى مقابلته مع جوشوا إنه يدرك تماما أن النظام الحاكم سوف يحاربه بكل الوسائل المتاحة,من ناحيته قال البرادعي في مقابلته مع جوشوا انه يدرك تماما ان النظام الحاكم سوف يحاربه بكل الوسايل المتاحه,,[],0,pending,,
