example_id,source_split,source_row_id,dialect,original_text,normalized_text,masked_text,mask_spans_json,mask_count,annotation_status,annotator_model,notes
mt_dial_egy_1deaf1c4,train,70417,DIAL_EGY,مبروك عليك حكام مصر الدورى اللى فات و الدورى ده يا حسام البدرى سدقنى انتا مدرب فاشل و رغم لعيبت منتخب الاندية اللى فى الاهلى معاك انتا بردو مدرب فاشل و مغرور ارجو من الساده الكرام اصحاب الضمائر الصحيا النشر وشكرا ؟ ؟ من واحد بيحب مصر ونفسو يشوف دورى خالى من وساخت الحكام الجهلاوية اكلون الو نجز { { الدراهم - الدنانير },مبروك عليك حكام مصر الدوري اللي فات و الدوري ده يا حسام البدري سدقني انتا مدرب فاشل و رغم لعيبت منتخب الانديه اللي في الاهلي معاك انتا بردو مدرب فاشل و مغرور ارجو من الساده الكرام اصحاب الضماير الصحيا النشر وشكرا من واحد بيحب مصر ونفسو يشوف دوري خالي من وساخت الحكام الجهلاويه اكلون الو نجز الدراهم الدنانير,,[],0,pending,,
mt_dial_glf_01d6632e,train,32751,DIAL_GLF,الصيف مقبل . . . لا يسحبون رجلينا ويطلعون الهوامير . .,الصيف مقبل لا يسحبون رجلينا ويطلعون الهوامير,,[],0,pending,,
mt_dial_lev_db1e3695,train,23110,DIAL_LEV,بخصوص الكوفي شوب ولاعبي الانديه الرياضييه لماذا اسغلال الناس من اجل حضور المباريات لوجود لاعبيين معينيين في الكوفي شوب فنحن نحضر المباره في اي مكان وبدون نجوم وشورايحه تفرق موجود لاعب او لا في الكوفي شوب ارحمونا من كثره العرط والهرجه الزايده ومالو جارنا ابو صالح قاعد بجنبي وبنحضر الارجنتين واليونان والله احلى من ابو زمع ( تحيه لابو زمع,بخصوص الكوفي شوب ولاعبي الانديه الرياضييه لماذا اسغلال الناس من اجل حضور المباريات لوجود لاعبيين معينيين في الكوفي شوب فنحن نحضر المباره في اي مكان وبدون نجوم وشورايحه تفرق موجود لاعب او لا في الكوفي شوب ارحمونا من كثره العرط والهرجه الزايده ومالو جارنا ابو صالح قاعد بجنبي وبنحضر الارجنتين واليونان والله احلي من ابو زمع تحيه لابو زمع,,[],0,pending,,
mt_msa_9b99d952,train,14011,MSA,في انتظار قراءة تعقيب شخص مطلع على هذا الأمر,في انتظار قراءه تعقيب شخص مطلع علي هذا الامر,,[],0,pending,,
mt_dial_egy_4f4c78b9,train,74809,DIAL_EGY,وربنا يقويه على الفوضى والإهمال ويكرمنا بكثير من,وربنا يقويه علي الفوضي والاهمال ويكرمنا بكثير من,,[],0,pending,,
mt_dial_glf_e2bdd2d2,train,82043,DIAL_GLF,وباباى والسائق في الاخير كان غلطان بس الغلط,وباباي والسايق في الاخير كان غلطان بس الغلط,,[],0,pending,,
mt_dial_lev_43307b38,train,76830,DIAL_LEV,ودايما في قلوبنا يا ابا,ودايما في قلوبنا يا ابا,,[],0,pending,,
mt_msa_c1e67484,train,42248,MSA,"في خلال عدة أيام من بداية شهر يونية عام 1967 دفعت القوات المصرية بالفرقة الفلسطينية ( قوات عين جالوت ) التي تتألف من لوائي مشاة ( الكتيبة 107 و 108 ) وفوج صاعقة تقدر بعض المصادر تعدادهم بنحو ثلاثة الاف مقاتل ، نصفهم كانوا منتشرين على هيئة وحدات دفاعية صغيرة ثابتة ، تساندها جميعا وحدات المدفعية وحوالي كتيبة دبابات ( شيرمان ) يقودها ضابط بقيادة اللواء "" عبد المنعم حسني "" حاكم غزة الإداري ، تمركزت قوة من هذه القوات فوق "" تل المنطار "" الذي كان له نصيب الاسد في الدفاع عن المدينة بحكم موقعه المسيطر على الطريق الرئيسي والوحيد بين المستخربات الإسرائيلية ومدينة غزة ( طريق بئر السبع - غزة ) هذا الطريق الذي يمثل الخاصرة الموجعة للمدينة ، وعليه تقدمت نحوه كتيبة مشاه إسرائيلية في صباح يوم 5 / 6 / 1967 ، الا أن مقاومة الجنود البواسل اوقفت تقدمها بعد تدمير سبعة مجنزرات تابعة لها بما فيها من جنود واعطبت بعض الدبابات ، فأعادت القوات الإسرائيلية الهجوم ولكن بأسلوب مباغت ومن الخلف حيث اندفعت نحو التل "" المنطار "" كتيبة مظليين ونحو خمسون دبابة ( تشرمان ) ومجنزرة ، استشهد اثناءها عشرون جنديا وضابطا فلسطينياً ، الا أن المدينة لم تسقط واستمرت بالمقاومة على أيدي هؤلاء الجنود الذين دمروا بعض الدبابات الإسرائيلية عند مدخل غزة الشرقي . في الوقت الذي كانت فيه القوات الصهيونية تمطر المدينة بمدافعها وتقصف جميع المواقع الدفاعية المحيطة بها تساندها الطائرات ، وبعد توقف القصف قال أحد رجال المدفعية الصهاينة أنهم "" وحدهم قد استخدموا كمية من الذخيرة أكثر مما استخدم طوال حربهم السابقة ضد العرب ، كما جاء على لسان "" دافيد ديان "" في كتابه "" اضرب أولاً "" واصفا بسالة المقاومة الفلسطينية "" لقد كان جنود الفرقة الفلسطينية التي دافعت في بعض النقاط "" المنطار "" وضواحيها خصوماً اشداء "" . وقال أيضاً "" أن قتال الوحدات الفلسطينية يستحق الاحترام والتقدير ، وانهم "" لم يلقوا بسلاحهم ولم يتوقفوا عن القتال حتى تم تدمير كل شيء "" ، لكنها حقا كانت دفاعات صلبة ذات تكتيكات محلية وموضعية ناجحة وسط فشل استراتيجي عام نتج عن تعدد القيادات وبالتالي تضارب اوامرها وتعددها ، بالاضافة إلى ضعف التسليح وانتشار العديد من القوات على هيئة وحدات صغيرة مبعثرة هذا على نطاق القوات المتواجدة في القطاع الذي تم الاستيلاء عليه مع غروب شمس يوم 5 / 6 / 1967",في خلال عده ايام من بدايه شهر يونيه عام 1967 دفعت القوات المصريه بالفرقه الفلسطينيه قوات عين جالوت التي تتالف من لوايي مشاه الكتيبه 107 و 108 وفوج صاعقه تقدر بعض المصادر تعدادهم بنحو ثلاثه الاف مقاتل نصفهم كانوا منتشرين علي هييه وحدات دفاعيه صغيره ثابته تساندها جميعا وحدات المدفعيه وحوالي كتيبه دبابات شيرمان يقودها ضابط بقياده اللواء عبد المنعم حسني حاكم غزه الاداري تمركزت قوه من هذه القوات فوق تل المنطار الذي كان له نصيب الاسد في الدفاع عن المدينه بحكم موقعه المسيطر علي الطريق الرييسي والوحيد بين المستخربات الاسراييليه ومدينه غزه طريق بير السبع غزه هذا الطريق الذي يمثل الخاصره الموجعه للمدينه وعليه تقدمت نحوه كتيبه مشاه اسراييليه في صباح يوم 5 6 1967 الا ان مقاومه الجنود البواسل اوقفت تقدمها بعد تدمير سبعه مجنزرات تابعه لها بما فيها من جنود واعطبت بعض الدبابات فاعادت القوات الاسراييليه الهجوم ولكن باسلوب مباغت ومن الخلف حيث اندفعت نحو التل المنطار كتيبه مظليين ونحو خمسون دبابه تشرمان ومجنزره استشهد اثناءها عشرون جنديا وضابطا فلسطينيا الا ان المدينه لم تسقط واستمرت بالمقاومه علي ايدي هولاء الجنود الذين دمروا بعض الدبابات الاسراييليه عند مدخل غزه الشرقي في الوقت الذي كانت فيه القوات الصهيونيه تمطر المدينه بمدافعها وتقصف جميع المواقع الدفاعيه المحيطه بها تساندها الطايرات وبعد توقف القصف قال احد رجال المدفعيه الصهاينه انهم وحدهم قد استخدموا كميه من الذخيره اكثر مما استخدم طوال حربهم السابقه ضد العرب كما جاء علي لسان دافيد ديان في كتابه اضرب اولا واصفا بساله المقاومه الفلسطينيه لقد كان جنود الفرقه الفلسطينيه التي دافعت في بعض النقاط المنطار وضواحيها خصوما اشداء وقال ايضا ان قتال الوحدات الفلسطينيه يستحق الاحترام والتقدير وانهم لم يلقوا بسلاحهم ولم يتوقفوا عن القتال حتي تم تدمير كل شيء لكنها حقا كانت دفاعات صلبه ذات تكتيكات محليه وموضعيه ناجحه وسط فشل استراتيجي عام نتج عن تعدد القيادات وبالتالي تضارب اوامرها وتعددها بالاضافه الي ضعف التسليح وانتشار العديد من القوات علي هييه وحدات صغيره مبعثره هذا علي نطاق القوات المتواجده في القطاع الذي تم الاستيلاء عليه مع غروب شمس يوم 5 6 1967,,[],0,pending,,
mt_dial_egy_ec4da4e9,train,12071,DIAL_EGY,الكابتن إبراهيم شحن جمهور الزمالك ضد كل شئ بشكل مستفز ومش فى ماتش الشرطة فقط لالالا من قبل ذلك .,الكابتن ابراهيم شحن جمهور الزمالك ضد كل شي بشكل مستفز ومش في ماتش الشرطه فقط لالالا من قبل ذلك,,[],0,pending,,
mt_dial_glf_be6daac7,train,40615,DIAL_GLF,الدين يسر مهوب عسر وملعنه .,الدين يسر مهوب عسر وملعنه,,[],0,pending,,
mt_dial_lev_0febae55,train,81763,DIAL_LEV,والله فرحت بهالخبرية وانو رجع للتلفزيون من جديدومبروك عالخطوة,والله فرحت بهالخبريه وانو رجع للتلفزيون من جديدومبروك عالخطوه,,[],0,pending,,
mt_msa_f0f210a2,train,39365,MSA,وحسب التعليمات من ثاني رجال,وحسب التعليمات من ثاني رجال,,[],0,pending,,
mt_dial_egy_6a8b834d,train,71983,DIAL_EGY,ان كان الله معنا فمن علينا 0 تتاجل تتاجل القضيه لغايت تنطفى نار المسحية ويطلعوا براءة,ان كان الله معنا فمن علينا 0 تتاجل تتاجل القضيه لغايت تنطفي نار المسحيه ويطلعوا براءه,,[],0,pending,,
mt_dial_glf_6fb613ec,train,5511,DIAL_GLF,بومحمد سوف تظل انت الرئيس الذهبي للأتفاقيين لمده الحياه 000 وللمعلوميه بعض الاشخاص الذين يقلون انهم اعضاء شرف يريدون من هذا النادي العريق سلعه او مفرخه للأندايه المنتمين لهم كي يحققون ما كانوا يططون له كما صار للبلوي في الاتحاد 00 ( كليب العيون,بومحمد سوف تظل انت الرييس الذهبي للاتفاقيين لمده الحياه 000 وللمعلوميه بعض الاشخاص الذين يقلون انهم اعضاء شرف يريدون من هذا النادي العريق سلعه او مفرخه للاندايه المنتمين لهم كي يحققون ما كانوا يططون له كما صار للبلوي في الاتحاد 00 كليب العيون,,[],0,pending,,
mt_dial_lev_2f56288c,train,62631,DIAL_LEV,المسكين راح يبلعوا الإيرانيين بتهمة الخيانة و الولايات الأمريكية أخذت من المعلومات ما تريد . .,المسكين راح يبلعوا الايرانيين بتهمه الخيانه و الولايات الامريكيه اخذت من المعلومات ما تريد,,[],0,pending,,
mt_msa_f6fb1d70,train,16132,MSA,البرادعى ليس ملزما بتقديم برنامج,البرادعي ليس ملزما بتقديم برنامج,,[],0,pending,,
mt_dial_egy_8aeaf15f,train,4782,DIAL_EGY,نناشد سيادة المحافط المرور فجأة على مخابز رأس البر في السوق القديم لمشاهدة رغيف الخبز المدعم المسروق وزنه ومفتش التموين قاعد على بابه يبشرب الشاي مع صاحب,نناشد سياده المحافط المرور فجاه علي مخابز راس البر في السوق القديم لمشاهده رغيف الخبز المدعم المسروق وزنه ومفتش التموين قاعد علي بابه يبشرب الشاي مع صاحب,,[],0,pending,,
mt_dial_glf_f86424bd,train,23763,DIAL_GLF,هلا بطلتك شدتني صورتك استاذ عبدالعزيزالعتيبي وحبيت اقول فين الغيبه زيزو منو الجريدة والك وحشه . . . ؟ ؟,هلا بطلتك شدتني صورتك استاذ عبدالعزيزالعتيبي وحبيت اقول فين الغيبه زيزو منو الجريده والك وحشه,,[],0,pending,,
mt_dial_lev_eb787023,train,74372,DIAL_LEV,يعني بدل ما تنامو مره السبت نامو,يعني بدل ما تنامو مره السبت نامو,,[],0,pending,,
mt_msa_9e4ea215,train,55248,MSA,الف حالة انتحار سنويا ؟ ؟ ؟ كثرة الشغل وعدم الاهتمام,الف حاله انتحار سنويا كثره الشغل وعدم الاهتمام,,[],0,pending,,
mt_dial_egy_4869956f,train,54709,DIAL_EGY,انتوا ظلمين حماقي هو جيه عشان يغني ويفرح الناس وملهوش دعوة بالتحرش و الخناق اللي بتقولوا عليه ده والناس كلها كانت فرحانة بالحفلة ليه تطلعوا,انتوا ظلمين حماقي هو جيه عشان يغني ويفرح الناس وملهوش دعوه بالتحرش و الخناق اللي بتقولوا عليه ده والناس كلها كانت فرحانه بالحفله ليه تطلعوا,,[],0,pending,,
mt_dial_glf_799bd6d5,train,66184,DIAL_GLF,ومهم ان يسنون مباراة الثلاثة,ومهم ان يسنون مباراه الثلاثه,,[],0,pending,,
mt_dial_lev_99acb33b,train,75054,DIAL_LEV,طب ما احنا في الاردن اخنرعنا الجميد السائل عبر تطوير تكنولوجيا جديدة لهرسه و ما رحنا فضحنا العالم في هالاختراع العظيم . . . يللا النا الجنة و ارتفاع,طب ما احنا في الاردن اخنرعنا الجميد السايل عبر تطوير تكنولوجيا جديده لهرسه و ما رحنا فضحنا العالم في هالاختراع العظيم يللا النا الجنه و ارتفاع,,[],0,pending,,
mt_msa_4bed1ba6,train,25273,MSA,أتمنى الفوز لزعي الهلال م القارة الصفراء . .,اتمني الفوز لزعي الهلال م القاره الصفراء,,[],0,pending,,
mt_dial_egy_451d84d5,train,50016,DIAL_EGY,أيوة الجزائر أحق حتي لو كان المنتخب المصري أفضل ، لأن كاس العالم كان ليها تصفيات من ست مباريات وسابعة فاصلة ، وماكناش,ايوه الجزاير احق حتي لو كان المنتخب المصري افضل لان كاس العالم كان ليها تصفيات من ست مباريات وسابعه فاصله وماكناش,,[],0,pending,,
mt_dial_glf_2e825a5b,train,51815,DIAL_GLF,الحين الي كسر سيارة الهيئة مبسوط مسوي نفسه ماأحد قده وهو مايدري بأنه ماهي رجاله بالعكس نذاله وإن دل دل بأنه حقير يخس عليك لو أنك رجال تراجع المركز وتعتذر,الحين الي كسر سياره الهييه مبسوط مسوي نفسه مااحد قده وهو مايدري بانه ماهي رجاله بالعكس نذاله وان دل دل بانه حقير يخس عليك لو انك رجال تراجع المركز وتعتذر,,[],0,pending,,
mt_dial_lev_302cb06b,train,26792,DIAL_LEV,ويا ريت البنات يردوا عليك ويهتموا شوي بأنوثتهم وجمالهم . . . يعني البنت الي بتخليلي حواجبها 88 ما بتفرج على حالها قبل ما تطلع ؟ ؟,ويا ريت البنات يردوا عليك ويهتموا شوي بانوثتهم وجمالهم يعني البنت الي بتخليلي حواجبها 88 ما بتفرج علي حالها قبل ما تطلع,,[],0,pending,,
mt_msa_7c28865c,train,38477,MSA,فعلا موقع وجريدة محترمة وتنشر ما تريده من,فعلا موقع وجريده محترمه وتنشر ما تريده من,,[],0,pending,,
mt_dial_egy_6ad13a63,train,46793,DIAL_EGY,أستاذ ابرهيم ربيع مقارنه جميله ولكن ماردونا احرف بكتير ولكنى معجب,استاذ ابرهيم ربيع مقارنه جميله ولكن ماردونا احرف بكتير ولكني معجب,,[],0,pending,,
mt_dial_glf_06e76cd8,train,22281,DIAL_GLF,مافيه امل يجون بس كل يمني النفس واللي مايعرف يتكلم يلزمنا بسكوته,مافيه امل يجون بس كل يمني النفس واللي مايعرف يتكلم يلزمنا بسكوته,,[],0,pending,,
mt_dial_lev_b6cba4c6,train,18636,DIAL_LEV,"على هيك لما أتزوج اذا طلعت مرتي فيها رحمين بيطلعلي أتجوز بس تنتين غيرها بس يا حبيبي رحنا فيها , ولا سيبنا من هالحكي صارلي بشتغل سنتين مهندس ومش محوش قرش بفضل . . . يلا مو مشكلة بنشوفلنا وحدة تصرف علينا وعالبيت وينها الله يجبر بخاطرها",علي هيك لما اتزوج اذا طلعت مرتي فيها رحمين بيطلعلي اتجوز بس تنتين غيرها بس يا حبيبي رحنا فيها ولا سيبنا من هالحكي صارلي بشتغل سنتين مهندس ومش محوش قرش بفضل يلا مو مشكله بنشوفلنا وحده تصرف علينا وعالبيت وينها الله يجبر بخاطرها,,[],0,pending,,
mt_msa_89e4bd6d,train,78952,MSA,مع اني لا اثق بمصادقيه الخبر ولكن . .,مع اني لا اثق بمصادقيه الخبر ولكن,,[],0,pending,,
mt_dial_egy_bb4378ce,train,10442,DIAL_EGY,الله على الكرة في مصر والله انتم شعب همجي والفيفا كانت على حق عندما عاقبة ابراهيم حسن لمدة خمسة سنوات وهذه نقطة سوداء في الكرة المصرية لكي تظاف الى اللملف المعفن بتاعكم في الفيفا إنشالله إسلط عليكم عقوبة متلعبوش الكرة مدة 10,الله علي الكره في مصر والله انتم شعب همجي والفيفا كانت علي حق عندما عاقبه ابراهيم حسن لمده خمسه سنوات وهذه نقطه سوداء في الكره المصريه لكي تظاف الي اللملف المعفن بتاعكم في الفيفا انشالله اسلط عليكم عقوبه متلعبوش الكره مده 10,,[],0,pending,,
mt_dial_glf_d7b30bb5,train,17128,DIAL_GLF,عجبتني كلمت مدير اول شي وشلون مدير عام ومقيم وين التوضيف ياوزارة وابناء البلد مافيهم احد يسد يكون مدير بعدين صباح الخير يامقيم بدل ماتبوس يدك وش وقفا معيشينك ياوطي وماكل من خير البلد وعمرك 49 سنة والله زي هذا المفروض كل يوم يقطعون من رقبته شوي ويكملونه اليوم الثاني علشان يكون عبرة,عجبتني كلمت مدير اول شي وشلون مدير عام ومقيم وين التوضيف ياوزاره وابناء البلد مافيهم احد يسد يكون مدير بعدين صباح الخير يامقيم بدل ماتبوس يدك وش وقفا معيشينك ياوطي وماكل من خير البلد وعمرك 49 سنه والله زي هذا المفروض كل يوم يقطعون من رقبته شوي ويكملونه اليوم الثاني علشان يكون عبره,,[],0,pending,,
mt_dial_lev_f17d4868,train,64863,DIAL_LEV,"بصراحة انا عشت التجربة وفعلا انو الرجل اكثر مضره وخصوصا اذا كانت الزوجة غير مبالية بدون اي مسئولية , بس الي مهون علي وجود الاولاد",بصراحه انا عشت التجربه وفعلا انو الرجل اكثر مضره وخصوصا اذا كانت الزوجه غير مباليه بدون اي مسيوليه بس الي مهون علي وجود الاولاد,,[],0,pending,,
mt_msa_de0e7c38,train,17500,MSA,انت لاعب كبير وفى نادى محترم لا تلتفت الى الاصوات العاليه التى لا يسمعها احد وبالتوفيق ان شاء الله فى الملعب وخارج الملعب,انت لاعب كبير وفي نادي محترم لا تلتفت الي الاصوات العاليه التي لا يسمعها احد وبالتوفيق ان شاء الله في الملعب وخارج الملعب,,[],0,pending,,
mt_dial_egy_349e5df9,train,31968,DIAL_EGY,ياعم امبومة مين زى بتستوتا لعب,ياعم امبومه مين زي بتستوتا لعب,,[],0,pending,,
mt_dial_glf_4aa463d9,train,17858,DIAL_GLF,لا كشرت في وقتك ايامك السود .,لا كشرت في وقتك ايامك السود,,[],0,pending,,
mt_dial_lev_2e99c0b0,train,55842,DIAL_LEV,الحمدلله عنا مخ لانه في ناس بايعينه من زمان وقرأين عليه الفاتحة . .,الحمدلله عنا مخ لانه في ناس بايعينه من زمان وقراين عليه الفاتحه,,[],0,pending,,
mt_msa_d0063f47,train,3919,MSA,هذا دليل على الانسجاام بين الزوجين .,هذا دليل علي الانسجاام بين الزوجين,,[],0,pending,,
mt_dial_egy_94ab6700,train,19372,DIAL_EGY,مش عارف ليه الصحفيين مش مهتمين غير برشوة المرسيدس ؟ ولم يجرؤ واحد منهم أن يسأل أين تذهب فلوس قناة السويس التى يكفى دخلها وحدها ليعيش كل شعب مصر كأغنى شعب ؟ أو أين تذهب فلوس البترول ؟ أو من المسئول عن تصدير الغاز لإسرائيل بملاليم ؟ وما كمية ونوعية الرشوة التى حصل عليها ؟ إن هذا كله سببه غياب الديمقراطية وغياب المحاسبه . عرفتم ليه الحكومة بتحارب قانون محاكمة الوزراء ولن تسمح بالموافقة عليه,مش عارف ليه الصحفيين مش مهتمين غير برشوه المرسيدس ولم يجرو واحد منهم ان يسال اين تذهب فلوس قناه السويس التي يكفي دخلها وحدها ليعيش كل شعب مصر كاغني شعب او اين تذهب فلوس البترول او من المسيول عن تصدير الغاز لاسراييل بملاليم وما كميه ونوعيه الرشوه التي حصل عليها ان هذا كله سببه غياب الديمقراطيه وغياب المحاسبه عرفتم ليه الحكومه بتحارب قانون محاكمه الوزراء ولن تسمح بالموافقه عليه,,[],0,pending,,
mt_dial_glf_12aa7e9e,train,73455,DIAL_GLF,بس الزعيم باذن الله الى,بس الزعيم باذن الله الي,,[],0,pending,,
mt_dial_lev_98ea1a92,train,6747,DIAL_LEV,معلش خليها تاخد قسط من الراحه خلص بكفيها ما,معلش خليها تاخد قسط من الراحه خلص بكفيها ما,,[],0,pending,,
mt_msa_048b292c,train,81827,MSA,ما اجمل تونس في فصل,ما اجمل تونس في فصل,,[],0,pending,,
mt_dial_egy_188f064e,train,19161,DIAL_EGY,هما الى مدوا إديهم على الأمن,هما الي مدوا اديهم علي الامن,,[],0,pending,,
