example_id,source_split,source_row_id,dialect,original_text,normalized_text,masked_text,mask_spans_json,mask_count,annotation_status,annotator_model,notes
mt_msa_95524d12,train,49625,MSA,"ثانيا : توني بلير تتم محاسبته فى انجلترا لإنه ضلل و خدع الشعب و الرأي العام , و جر انجلترا الى الحرب خلف الولايات المتحدة , و الآن تكشفت الحقبقة أمام الرأي العام هناك و تبين كذب ادعاءات تونى بلير",ثانيا توني بلير تتم محاسبته في انجلترا لانه ضلل و خدع الشعب و الراي العام و جر انجلترا الي الحرب خلف الولايات المتحده و الان تكشفت الحقبقه امام الراي العام هناك و تبين كذب ادعاءات توني بلير,,[],0,pending,,
mt_dial_egy_a2be3485,train,24601,DIAL_EGY,ثانيا : كل واحد يحط نفسه مكان ابراهيم حسن ويشوف هيتصرف ازاى ةاللى مابيغيرش ع بيته ما يستحقش انه,ثانيا كل واحد يحط نفسه مكان ابراهيم حسن ويشوف هيتصرف ازاي هاللي مابيغيرش ع بيته ما يستحقش انه,,[],0,pending,,
mt_dial_glf_280d7f75,train,11174,DIAL_GLF,الله يرده له سالم معافى من كل,الله يرده له سالم معافي من كل,,[],0,pending,,
mt_dial_lev_74918cde,train,49799,DIAL_LEV,يا اما ملخبطين في البيبي بالمستشفى وهاي البنت مو بنتهم ( لازم يعملوا فحص دي إن إيه يتأكدوا,يا اما ملخبطين في البيبي بالمستشفي وهاي البنت مو بنتهم لازم يعملوا فحص دي ان ايه يتاكدوا,,[],0,pending,,
mt_msa_27c01a63,train,1251,MSA,و الى مزيد من هكذا مشاريع,و الي مزيد من هكذا مشاريع,,[],0,pending,,
mt_dial_egy_012879c1,train,56373,DIAL_EGY,"والله البنات دول احسن منك ؟ , ,",والله البنات دول احسن منك,,[],0,pending,,
mt_dial_glf_a38589a5,train,66017,DIAL_GLF,الله يفرح قلوبكم برجعته بالسلامه .,الله يفرح قلوبكم برجعته بالسلامه,,[],0,pending,,
mt_dial_lev_d2b2c59d,train,58684,DIAL_LEV,الله يعطيهم العافية اصحاب النقابات المهنية وخاصة صالونات الحلاقة الستاتي والرجالي وشفيرية التكاسي . . مصاريفهم زادت هالسنة على الاعلانات والشعارات .,الله يعطيهم العافيه اصحاب النقابات المهنيه وخاصه صالونات الحلاقه الستاتي والرجالي وشفيريه التكاسي مصاريفهم زادت هالسنه علي الاعلانات والشعارات,,[],0,pending,,
mt_msa_e8927a3b,train,19124,MSA,وضغوط كبار القوم وكبار الضابط والترجي والوعود بالاجازات والترقيات والرخص متى,وضغوط كبار القوم وكبار الضابط والترجي والوعود بالاجازات والترقيات والرخص متي,,[],0,pending,,
mt_dial_egy_b03f253e,train,45885,DIAL_EGY,الحكم حسب لهم يومين وقت بدل ضايع لزومه ايه الفشخرة و المزبة الفراغة بتاعت الزمبلك,الحكم حسب لهم يومين وقت بدل ضايع لزومه ايه الفشخره و المزبه الفراغه بتاعت الزمبلك,,[],0,pending,,
mt_dial_glf_9e9cc2af,train,73968,DIAL_GLF,"( الكلام اعلاه كلام شايبٍ من الربع , يعاني من التعداد ومن تطفلهم",الكلام اعلاه كلام شايب من الربع يعاني من التعداد ومن تطفلهم,,[],0,pending,,
mt_dial_lev_8c885358,train,74936,DIAL_LEV,الي بوخد كل هالمبلغ وبهرب فيو يعيش ملك ، ، بيكون شاطر : - ),الي بوخد كل هالمبلغ وبهرب فيو يعيش ملك بيكون شاطر,,[],0,pending,,
mt_msa_4cee0646,train,78430,MSA,صبرا فان الفجر قريب ان شاء,صبرا فان الفجر قريب ان شاء,,[],0,pending,,
mt_dial_egy_34c0abd3,train,79508,DIAL_EGY,من خالص اعماق قلبى اتقدم بالتهانى لكل الاخوه الجزائريين على قمرهم الجديد ودخولهم هذا النادى المهم وقبال الخطوه القادمه وهى التصنيع وربنا,من خالص اعماق قلبي اتقدم بالتهاني لكل الاخوه الجزايريين علي قمرهم الجديد ودخولهم هذا النادي المهم وقبال الخطوه القادمه وهي التصنيع وربنا,,[],0,pending,,
mt_dial_glf_2d0b9ace,train,43355,DIAL_GLF,طيب ليش وشلون وكيف يمكن فيه سبب وجيه,طيب ليش وشلون وكيف يمكن فيه سبب وجيه,,[],0,pending,,
mt_dial_lev_050c973d,train,7070,DIAL_LEV,"غريب و عجيب امر "" المثقفين "" و "" الفنانين "" . .",غريب و عجيب امر المثقفين و الفنانين,,[],0,pending,,
mt_msa_c7a6892c,train,47120,MSA,أسال الله الكريم ان يعوده,اسال الله الكريم ان يعوده,,[],0,pending,,
mt_dial_egy_41566db5,train,57655,DIAL_EGY,ما هو ده اللي المقال بيقوله يا حبيبي . . ما هو بيقولك حرية عقيدة . . هو حرية العقيدة دي يعني أيه ؟ أنكش ! ! أيه يا عم ؟ ما هو حرية عقيدة أنك تعمل ما بدالك في الدين طالما ما إعتدتش على غيرك . . ربي لحية ربي شعرك ربي عصفورة والأنثى تلبس حجاب أو في الحيط ! ! ! ده بيسموه حرية عقيدة ! ! فهمت ؟ ؟,ما هو ده اللي المقال بيقوله يا حبيبي ما هو بيقولك حريه عقيده هو حريه العقيده دي يعني ايه انكش ايه يا عم ما هو حريه عقيده انك تعمل ما بدالك في الدين طالما ما اعتدتش علي غيرك ربي لحيه ربي شعرك ربي عصفوره والانثي تلبس حجاب او في الحيط ده بيسموه حريه عقيده فهمت,,[],0,pending,,
mt_dial_glf_f852aef4,train,9960,DIAL_GLF,انها رصدت سياره نمشيها بس موب كن الي راكب يمين مطلع يده ومسوي حركة صوروني ؟ يقالك انها كاميرت المررو هذي يعني ؟ هالنظام يخوف والى الان المرور ماوضح للمواطنين وش نوع المخلفات الي يمكن يرصدها وهذا يعتبر تظليل وظلم بحق كل مواطن احنا تعودنا على الهمجية لانعرف النظام نحتاج لكتيبات تعطى للمرور الي,انها رصدت سياره نمشيها بس موب كن الي راكب يمين مطلع يده ومسوي حركه صوروني يقالك انها كاميرت المررو هذي يعني هالنظام يخوف والي الان المرور ماوضح للمواطنين وش نوع المخلفات الي يمكن يرصدها وهذا يعتبر تظليل وظلم بحق كل مواطن احنا تعودنا علي الهمجيه لانعرف النظام نحتاج لكتيبات تعطي للمرور الي,,[],0,pending,,
mt_dial_lev_19a1e5ff,train,20340,DIAL_LEV,ايام زمان احلى سينما زمان احلى كراسي خشب من النوع القديم سينما زمان وافلام زمان التذكره كانت ببلاش الحياه كانت ببلاش الاستمتاع بالفيلم كان روعه ومخمخه اليوم سينما اخر موديل في موقع اخر موديل مع ناس اخر موديل وباسعار اخر,ايام زمان احلي سينما زمان احلي كراسي خشب من النوع القديم سينما زمان وافلام زمان التذكره كانت ببلاش الحياه كانت ببلاش الاستمتاع بالفيلم كان روعه ومخمخه اليوم سينما اخر موديل في موقع اخر موديل مع ناس اخر موديل وباسعار اخر,,[],0,pending,,
mt_msa_d855a32d,train,77144,MSA,المقبل طوال المقابلة يقول ليس هدفنا جمع المخالفات ، هدفنا نشر الوعي المروري ، طيب اجال ليش تتدبل المخالفات ؟ إليس ذلك رباً واضحاً ؟ ؟ وألا تكيفون الدين على كيفكم,المقبل طوال المقابله يقول ليس هدفنا جمع المخالفات هدفنا نشر الوعي المروري طيب اجال ليش تتدبل المخالفات اليس ذلك ربا واضحا والا تكيفون الدين علي كيفكم,,[],0,pending,,
mt_dial_egy_ac3c7f00,train,52201,DIAL_EGY,ارجوا من السيد رئيس الجمهورية التدخل السريع والفورى لتنفيذ وتلبية رغبة الشارع المصرى فى تغيير مواد الدستور وخصوصا المواد 76 و 77 و 88 وانقاذ مصر من خطر داهم وقريب وهو الثورة الشعبية او بالأدق ثورة الجياع والمظلومين والمقهورين من الظلم ومن الفقر . وانا لاأرى عيبا فى ذلك ان يشرف القضاء على الانتخابات وطالما الحزب الوطنى كما يدعى حزب الاغلبية فماذا يضيره لو كانت الانتخابات نزيهة طالما كان واثقا فى شعبيته اللهم اذا كان غير ذلك والمطلب الثانى مطلي ايضا عادل وهو تحديد فترة حكم رئيس الجمهورية والا تزيد عن فترتين فكل الدول المتحضرة بتعمل كده وللشعب كامل حريته فى اختيار رئيسه وليست الداخلية هيا التى تختار الرئيس بدلا من الشعب وايضا مطلب حق المصريين اللى فى الخارج ان يشاركوا فى العملية الانتخابية فهم مصريين سواء فى الخارج أو الداخل ام أن الحكومة تعلم ان اصواتهم لن تكون فى صالحهم لأنهم بسياساته الخاطئة طفشوهم من مصر وجعلوهم يطوفون العالم من أجل لقمة العيش,ارجوا من السيد رييس الجمهوريه التدخل السريع والفوري لتنفيذ وتلبيه رغبه الشارع المصري في تغيير مواد الدستور وخصوصا المواد 76 و 77 و 88 وانقاذ مصر من خطر داهم وقريب وهو الثوره الشعبيه او بالادق ثوره الجياع والمظلومين والمقهورين من الظلم ومن الفقر وانا لااري عيبا في ذلك ان يشرف القضاء علي الانتخابات وطالما الحزب الوطني كما يدعي حزب الاغلبيه فماذا يضيره لو كانت الانتخابات نزيهه طالما كان واثقا في شعبيته اللهم اذا كان غير ذلك والمطلب الثاني مطلي ايضا عادل وهو تحديد فتره حكم رييس الجمهوريه والا تزيد عن فترتين فكل الدول المتحضره بتعمل كده وللشعب كامل حريته في اختيار رييسه وليست الداخليه هيا التي تختار الرييس بدلا من الشعب وايضا مطلب حق المصريين اللي في الخارج ان يشاركوا في العمليه الانتخابيه فهم مصريين سواء في الخارج او الداخل ام ان الحكومه تعلم ان اصواتهم لن تكون في صالحهم لانهم بسياساته الخاطيه طفشوهم من مصر وجعلوهم يطوفون العالم من اجل لقمه العيش,,[],0,pending,,
mt_dial_glf_38ce3d35,train,33491,DIAL_GLF,ه والله مو بعيد عن انجاز لقب نادي,ه والله مو بعيد عن انجاز لقب نادي,,[],0,pending,,
mt_dial_lev_43957bf9,train,26002,DIAL_LEV,هدم الكعبة اهون عند الله من اراقة دم مسلم والله انها الدنيا باخر وقت ياجماعة الخير والله شيكاغو ماهي هيك من اجل شبشب والله ياشبشب لازم الي قتل يضل ينلط بالشبشب حتى يعرف انه الله حق,هدم الكعبه اهون عند الله من اراقه دم مسلم والله انها الدنيا باخر وقت ياجماعه الخير والله شيكاغو ماهي هيك من اجل شبشب والله ياشبشب لازم الي قتل يضل ينلط بالشبشب حتي يعرف انه الله حق,,[],0,pending,,
mt_msa_79b48b1f,train,61405,MSA,انتم من يقوم بالمزايدة بالقضية الفلسطينية . . فلم نرى احد منكم يقوم ولو بوقفة احتجاجية سلمية ام اى سفارة اسرائلية او حتى عمل مظاهرات عندما قامت اسرائيل بضم الحرم الابراهيمى منذ نحو شهر بينما كانت الجامعات المصرية بالمظاهرات ! !,انتم من يقوم بالمزايده بالقضيه الفلسطينيه فلم نري احد منكم يقوم ولو بوقفه احتجاجيه سلميه ام اي سفاره اسرايليه او حتي عمل مظاهرات عندما قامت اسراييل بضم الحرم الابراهيمي منذ نحو شهر بينما كانت الجامعات المصريه بالمظاهرات,,[],0,pending,,
mt_dial_egy_3d245f18,train,28212,DIAL_EGY,والله يا استاذة فاطمة الوزير ده سعات احس انه كويس و ساعات احس انه زى اللى قابله واللى قابله ليه مواقف كويسة و ليه بلاوى,والله يا استاذه فاطمه الوزير ده سعات احس انه كويس و ساعات احس انه زي اللي قابله واللي قابله ليه مواقف كويسه و ليه بلاوي,,[],0,pending,,
mt_dial_glf_0d6ed54c,train,25903,DIAL_GLF,اللي عارفه ان تناول الشكولاته يقلل من,اللي عارفه ان تناول الشكولاته يقلل من,,[],0,pending,,
mt_dial_lev_96e80d76,train,43624,DIAL_LEV,الدريم تيم خسر اربعه مش معقول هم بفكروا حالهم الوحدات يلعبوا بالرديف ويفوزا,الدريم تيم خسر اربعه مش معقول هم بفكروا حالهم الوحدات يلعبوا بالرديف ويفوزا,,[],0,pending,,
mt_msa_f3044746,train,60919,MSA,البطولات القارية لا تقارن بالمونديال العالمي و إلا ما فازت بالبطولة الأوربية يوما اليونان و الدنمارك مثلا و بعدها لا صوت و لا خبر عنهم,البطولات القاريه لا تقارن بالمونديال العالمي و الا ما فازت بالبطوله الاوربيه يوما اليونان و الدنمارك مثلا و بعدها لا صوت و لا خبر عنهم,,[],0,pending,,
mt_dial_egy_6e2bb17d,train,67853,DIAL_EGY,شوفي الناس اللي بتدور على لقمة عيشها في صناديق القمامة وتهريب الدقيق واسعار اللحوم اللي وصلت مداها,شوفي الناس اللي بتدور علي لقمه عيشها في صناديق القمامه وتهريب الدقيق واسعار اللحوم اللي وصلت مداها,,[],0,pending,,
mt_dial_glf_95db2699,train,28522,DIAL_GLF,مفيش حل غير المقاطعة طبعا مع ان معظم الشعب مقاطع من,مفيش حل غير المقاطعه طبعا مع ان معظم الشعب مقاطع من,,[],0,pending,,
mt_dial_lev_c916de2b,train,79749,DIAL_LEV,بصراحه اداء سيء كان وبصعوبه فاز الوحدات على فريق كان بده يهبط لاخر مرحله وفوز من عنق,بصراحه اداء سيء كان وبصعوبه فاز الوحدات علي فريق كان بده يهبط لاخر مرحله وفوز من عنق,,[],0,pending,,
mt_msa_fe06591a,train,41759,MSA,""" أبن خلدون هو أبو الامبريقية ، وهي البحث العلمي القائم على ما هو موجود ، وليس على ما هو في الذهن أو ما يتمناه الإنسان ، وطبيعي أن جزء كبير من الواقع الذي درسه أبن خلدون لم يتغير ، فنحن بالفعل لم نتغير كثيرا عن عصر أبن خلدون ، ولكن هناك أفكارا كثيرة لأبن خلدون لا تزال حية من غير حتى موضوع البدو """,ابن خلدون هو ابو الامبريقيه وهي البحث العلمي القايم علي ما هو موجود وليس علي ما هو في الذهن او ما يتمناه الانسان وطبيعي ان جزء كبير من الواقع الذي درسه ابن خلدون لم يتغير فنحن بالفعل لم نتغير كثيرا عن عصر ابن خلدون ولكن هناك افكارا كثيره لابن خلدون لا تزال حيه من غير حتي موضوع البدو,,[],0,pending,,
mt_dial_egy_ee9568d0,train,46990,DIAL_EGY,مصر خربانة يعم خربانة بسم الله عليكم يا شباب مصر الحمد لله اني خرجت من مصر قبل ما كنت انحرف والله لو كنت فى مصر كنت هكون من المنحرفين ولك نعم من ربنا الحمد لله مليون الف مرة رغم ان قلبي يتقطع لاني بعيد عن اهلي ولكن الحمد لله بسم الله الرحمن الرحيم وعسي ان تكرهوا,مصر خربانه يعم خربانه بسم الله عليكم يا شباب مصر الحمد لله اني خرجت من مصر قبل ما كنت انحرف والله لو كنت في مصر كنت هكون من المنحرفين ولك نعم من ربنا الحمد لله مليون الف مره رغم ان قلبي يتقطع لاني بعيد عن اهلي ولكن الحمد لله بسم الله الرحمن الرحيم وعسي ان تكرهوا,,[],0,pending,,
mt_dial_glf_01323029,train,61577,DIAL_GLF,انااشهد انك كفو يانسل الكريمين - - ولاهي غريبة دام مجدك,انااشهد انك كفو يانسل الكريمين ولاهي غريبه دام مجدك,,[],0,pending,,
mt_dial_lev_720ed363,train,13919,DIAL_LEV,يعني احنا بحاجة الى مزيد من العراة على بحر ميت لايوجد عنده احساس,يعني احنا بحاجه الي مزيد من العراه علي بحر ميت لايوجد عنده احساس,,[],0,pending,,
mt_msa_ebfff8e5,train,82897,MSA,إذا قال لك حساوي يعني حساوي,اذا قال لك حساوي يعني حساوي,,[],0,pending,,
mt_dial_egy_13b78981,train,74054,DIAL_EGY,أنا فلاول إتاثرت بالحكاية وصعب علي القتيل بس لما عرفت إنو سفاح يعني قاتل محترف يبقى يستاهل واللي تجيب سفاح وتبكي عليه تبقى ريا أو سكينة الحمدلله إن اناس خلصت من شرو ومن أذاه ربنايجحمو مطرح مراح,انا فلاول اتاثرت بالحكايه وصعب علي القتيل بس لما عرفت انو سفاح يعني قاتل محترف يبقي يستاهل واللي تجيب سفاح وتبكي عليه تبقي ريا او سكينه الحمدلله ان اناس خلصت من شرو ومن اذاه ربنايجحمو مطرح مراح,,[],0,pending,,
mt_dial_glf_b16a54b1,train,75835,DIAL_GLF,مقال قمة بروعته^فالمشكلة تبدأ من البيئة ومحيطها^فمجتمعنا بالخصوصيات الطريفة التي يلصقها بنفسه^جعلته طرفة للمجتمعات الاخرة^فيطالب بتسفير المقميين^ويتأفف من عملهم^وان وُجد اليديل كما ذكرتي_يتشرط^فلا حل ( لشعب الله المختار ) هذا^ الا ان يُقال له هذا الموجود^او يذهب ويطر ويتعالج على حسابه^وخله يتذمر,مقال قمه بروعته فالمشكله تبدا من البييه ومحيطها فمجتمعنا بالخصوصيات الطريفه التي يلصقها بنفسه جعلته طرفه للمجتمعات الاخره فيطالب بتسفير المقميين ويتافف من عملهم وان وجد اليديل كما ذكرتي_يتشرط فلا حل لشعب الله المختار هذا الا ان يقال له هذا الموجود او يذهب ويطر ويتعالج علي حسابه وخله يتذمر,,[],0,pending,,
mt_dial_lev_9a2bcb22,train,4668,DIAL_LEV,اشناء الله مباراة الاياب راح تكون باذن الله كما عهدنا وحداتية اللعب والسيطرة والاداء والاهداف وربكوا كريم يا وحداتية وما قيمة حياتي ان لم اكن وحداتي والي ما يطول العنب حامض عنه يقول والوحداتي من الاشارة بفهم وسلمولي على جبر الخمس,اشناء الله مباراه الاياب راح تكون باذن الله كما عهدنا وحداتيه اللعب والسيطره والاداء والاهداف وربكوا كريم يا وحداتيه وما قيمه حياتي ان لم اكن وحداتي والي ما يطول العنب حامض عنه يقول والوحداتي من الاشاره بفهم وسلمولي علي جبر الخمس,,[],0,pending,,
mt_msa_79cf59ef,train,10149,MSA,"مرحبا باجنيد , ليس كل الزجاج ينكسر فبعضه ضد الكسر , ولكن الوعاء ربما يحدد المصير وبه تتحدد الأشياء من وراء الحجاب الزجاجي , وليتنا نسسلم في تعابيرنا من بعض الأحجبة التي نفقد بها التواصل مع الكثير من الأطياف بسبب هذا الواقف على عنق الزجاجة ! ! ! تحياتنا وجمعة مباركة للجميع هنا يارب . . . ! !",مرحبا باجنيد ليس كل الزجاج ينكسر فبعضه ضد الكسر ولكن الوعاء ربما يحدد المصير وبه تتحدد الاشياء من وراء الحجاب الزجاجي وليتنا نسسلم في تعابيرنا من بعض الاحجبه التي نفقد بها التواصل مع الكثير من الاطياف بسبب هذا الواقف علي عنق الزجاجه تحياتنا وجمعه مباركه للجميع هنا يارب,,[],0,pending,,
mt_dial_egy_9b5be92c,train,30347,DIAL_EGY,ولعلَّ هناك من يقول إننا لم نسمع فلانًا أو علاّنًا من الشيعة يطعن في الصحابة ، وهؤلاء أريد لفت أنظارهم إلى ثلاث نقاط .,ولعل هناك من يقول اننا لم نسمع فلانا او علانا من الشيعه يطعن في الصحابه وهولاء اريد لفت انظارهم الي ثلاث نقاط,,[],0,pending,,
mt_dial_glf_d116302b,train,60502,DIAL_GLF,صدقت والله ابو عبدالله مزين الصورة وتراه اللي في الصف الاول الثالث من اليمين,صدقت والله ابو عبدالله مزين الصوره وتراه اللي في الصف الاول الثالث من اليمين,,[],0,pending,,
mt_dial_lev_fabc2c4e,train,66316,DIAL_LEV,"والله ما ظل على الحكومه غير تبيعنا ملابسنا علشان يغطوا عجز الموازنه اللي مش راضي يتغطى , بجوز العجز مشوب على شان هيك مش حاب يتغطى",والله ما ظل علي الحكومه غير تبيعنا ملابسنا علشان يغطوا عجز الموازنه اللي مش راضي يتغطي بجوز العجز مشوب علي شان هيك مش حاب يتغطي,,[],0,pending,,
mt_msa_58c8c540,train,81356,MSA,ان اصحاب السوابق الذين يهددون امن المجتمع هم ارهابيون حقيقيون لا يتورعون عن استخدام العنف والقتل وللاسف فهم معروفون لدى الاجهزة الامنية التي تعجز عن معاقبتهم نتيجية الحماية التي تؤومنها لهم المحاكم لانهم لا يهددون امن الدولة بل يهددون امن المجتمع والناس البسطاء لذلك لا يعاملون معاملة,ان اصحاب السوابق الذين يهددون امن المجتمع هم ارهابيون حقيقيون لا يتورعون عن استخدام العنف والقتل وللاسف فهم معروفون لدي الاجهزه الامنيه التي تعجز عن معاقبتهم نتيجيه الحمايه التي توومنها لهم المحاكم لانهم لا يهددون امن الدوله بل يهددون امن المجتمع والناس البسطاء لذلك لا يعاملون معامله,,[],0,pending,,
