example_id,source_split,source_row_id,dialect,original_text,normalized_text,masked_text,mask_spans_json,mask_count,annotation_status,annotator_model,notes
mt_dial_lev_da263e36,train,23915,DIAL_LEV,بليز شو نجفة ما فهمت ؟ ؟,بليز شو نجفه ما فهمت,,[],0,pending,,
mt_msa_4499c1df,train,59982,MSA,يالله بالمطر يارب على كافة مناطق بلدنا الغاليه ياكريم اللهم اغثنا غيثا مغيثا نافعا غير ضار واسق المسلمين برحمتك ياارحم الراحمين واخر دعوانا ان الحمد لله رب العالمين . . . استغفرو ربكم يرسل السماء عليكم,يالله بالمطر يارب علي كافه مناطق بلدنا الغاليه ياكريم اللهم اغثنا غيثا مغيثا نافعا غير ضار واسق المسلمين برحمتك ياارحم الراحمين واخر دعوانا ان الحمد لله رب العالمين استغفرو ربكم يرسل السماء عليكم,,[],0,pending,,
mt_dial_egy_a61bc325,train,82175,DIAL_EGY,على فكرةفى ناس كتير مستعدة تضحى بروحها حتى يظل الحال على ماهو,علي فكرهفي ناس كتير مستعده تضحي بروحها حتي يظل الحال علي ماهو,,[],0,pending,,
mt_dial_glf_3f7a4c98,train,79284,DIAL_GLF,بالتوفيق للنصر العالمي والله ينصرنا على الهلال,بالتوفيق للنصر العالمي والله ينصرنا علي الهلال,,[],0,pending,,
mt_dial_lev_ff019177,train,34811,DIAL_LEV,الف سلامه الك يا ابو طعيمه والحمدالله على السلامع الحوت عامر,الف سلامه الك يا ابو طعيمه والحمدالله علي السلامع الحوت عامر,,[],0,pending,,
mt_msa_7b2f2b3e,train,33713,MSA,أبوحمزة المصري مفتي الجماعات الإرهابية بتكفير المسلمين في الجزائر,ابوحمزه المصري مفتي الجماعات الارهابيه بتكفير المسلمين في الجزاير,,[],0,pending,,
mt_dial_egy_4a27ddba,train,14855,DIAL_EGY,يا ابراهيم انت عظيم مش هقول اكتر من كدة انت واخوك رجالة,يا ابراهيم انت عظيم مش هقول اكتر من كده انت واخوك رجاله,,[],0,pending,,
mt_dial_glf_9a8d5288,train,15589,DIAL_GLF,في قناة الكاس بعد المباراة مأحد قال لكل فعل ردة فعل مثل ما قالوا بعد مبارة النصر ، بس والله يعجبوني في حسهم الوطني العالي نسو كل الانتمائات للأنديه وتكلموا على قلب واحد بعكس بعض السعوديين ( يمهل ولا يهمل,في قناه الكاس بعد المباراه ماحد قال لكل فعل رده فعل مثل ما قالوا بعد مباره النصر بس والله يعجبوني في حسهم الوطني العالي نسو كل الانتمايات للانديه وتكلموا علي قلب واحد بعكس بعض السعوديين يمهل ولا يهمل,,[],0,pending,,
mt_dial_lev_1f689e18,train,43949,DIAL_LEV,يا سيف ال خطاب خليك بحالك خليك بامورك النادويه خليك بالفيصلي افضل لك وانس المارد الاخضر له من يتابعه له من يناصره ونحن عندنا روح رياضيه ومبروك الدوري لكم بس حافظوا,يا سيف ال خطاب خليك بحالك خليك بامورك النادويه خليك بالفيصلي افضل لك وانس المارد الاخضر له من يتابعه له من يناصره ونحن عندنا روح رياضيه ومبروك الدوري لكم بس حافظوا,,[],0,pending,,
mt_msa_48cd93ab,train,24761,MSA,وكلامك منطقى وانا اعانى منه مع زوجتى,وكلامك منطقي وانا اعاني منه مع زوجتي,,[],0,pending,,
mt_dial_egy_239e42a7,train,9403,DIAL_EGY,مش تبقا فاسد وتطل الاخر يكون,مش تبقا فاسد وتطل الاخر يكون,,[],0,pending,,
mt_dial_glf_ebbc9466,train,32423,DIAL_GLF,قال ودي ينهزم الوصل عشان ننتقم من خمسة,قال ودي ينهزم الوصل عشان ننتقم من خمسه,,[],0,pending,,
mt_dial_lev_ce594ae5,train,34123,DIAL_LEV,رؤساء وزراء هي ضلت على,روساء وزراء هي ضلت علي,,[],0,pending,,
mt_msa_1e2f7ca7,train,29999,MSA,اللهم وفق المسلمين جميعاً وزدهم وزدنا علماً ، ويشف جميع مرضى المسلمين,اللهم وفق المسلمين جميعا وزدهم وزدنا علما ويشف جميع مرضي المسلمين,,[],0,pending,,
mt_dial_egy_be220f26,train,38015,DIAL_EGY,احنا مش كلنا عرب احنا اكترناا فراعنه اسلمنا و اما اللى من اصل عربى فاهلا بيه,احنا مش كلنا عرب احنا اكترناا فراعنه اسلمنا و اما اللي من اصل عربي فاهلا بيه,,[],0,pending,,
mt_dial_glf_b20bd6e2,train,21428,DIAL_GLF,مهم قلت لاتنسى ان الهلال فايز عليه 3 -,مهم قلت لاتنسي ان الهلال فايز عليه 3,,[],0,pending,,
mt_dial_lev_d834ab89,train,12495,DIAL_LEV,الله يعينهم بس يعني غرفة واحد ومخلفين اربع اطفال الله يسامحهم والزوج عندة كل هاالامراض ومخلف اربعة ، لازم الناس تفكر كيف بيدها تربي اولادها بس تخلف مش بس تجيب اولاد بعدين نقول كيف بيدنا نصرف عليهم,الله يعينهم بس يعني غرفه واحد ومخلفين اربع اطفال الله يسامحهم والزوج عنده كل هاالامراض ومخلف اربعه لازم الناس تفكر كيف بيدها تربي اولادها بس تخلف مش بس تجيب اولاد بعدين نقول كيف بيدنا نصرف عليهم,,[],0,pending,,
mt_msa_8fc69c17,train,5523,MSA,ربما غبت عن الفعاليات لكنك كنت الحاضرة رغم الغياب بروحك ومتابعتك دوما واهتمامك الجميل,ربما غبت عن الفعاليات لكنك كنت الحاضره رغم الغياب بروحك ومتابعتك دوما واهتمامك الجميل,,[],0,pending,,
mt_dial_egy_cfa2f86c,train,69341,DIAL_EGY,المدرس مش بيشرح بذمة ليه يا سيادة الوزير,المدرس مش بيشرح بذمه ليه يا سياده الوزير,,[],0,pending,,
mt_dial_glf_9cbeaa79,train,8432,DIAL_GLF,والله اني افرح السعوديه صارت من احسن الدول الي تفصل التوائم والله شي يرفع,والله اني افرح السعوديه صارت من احسن الدول الي تفصل التوايم والله شي يرفع,,[],0,pending,,
mt_dial_lev_606330d1,train,3286,DIAL_LEV,ال مبروك ف للوحدات وان شاء الله الوحدات راح يكون الموسم الجاي قنبلة الموسم ومبروك لكل عشاق,ال مبروك ف للوحدات وان شاء الله الوحدات راح يكون الموسم الجاي قنبله الموسم ومبروك لكل عشاق,,[],0,pending,,
mt_msa_de58a54a,train,72127,MSA,أتمنا أن يفيق الاخوة الجزائريين لما ينساقو ألية بفعل حكومة عاجزة عن فعل أي شيء للشعب الشقيق من صد الارهاب ألا بأحقر ألاساليب وهي ألهاء ألشعب بالفتن مع شعب شقيق بواصطت هذا الروراوة المستفيد الاول من الحكومة بتركة للبزنس المشبوة في أوربا يبق أن أشيد بزكاء وحترام السيد سعدان ولا الة الا اللة محمد رسول,اتمنا ان يفيق الاخوه الجزايريين لما ينساقو اليه بفعل حكومه عاجزه عن فعل اي شيء للشعب الشقيق من صد الارهاب الا باحقر الاساليب وهي الهاء الشعب بالفتن مع شعب شقيق بواصطت هذا الروراوه المستفيد الاول من الحكومه بتركه للبزنس المشبوه في اوربا يبق ان اشيد بزكاء وحترام السيد سعدان ولا اله الا الله محمد رسول,,[],0,pending,,
mt_dial_egy_50a48262,train,82650,DIAL_EGY,سؤال اخر ليه الاعلام الحكومي اللي بيقبض من فلوس الضرائب وقناة السويس والبترول بيعمل دعايه لمبارك هو كانت الفلوس من مرتب مبارك او جمال لابد من مقاطعة الاعلام الحكومي بقنواته مجموعة قنوات النيل الاولى الفضائية والمصرية القنوات الارضية طالما ان هذه القنوات تتحيز لصالح زمرة الحزب اللاوطني ضد الشعب الذي وصل الى درجة,سوال اخر ليه الاعلام الحكومي اللي بيقبض من فلوس الضرايب وقناه السويس والبترول بيعمل دعايه لمبارك هو كانت الفلوس من مرتب مبارك او جمال لابد من مقاطعه الاعلام الحكومي بقنواته مجموعه قنوات النيل الاولي الفضاييه والمصريه القنوات الارضيه طالما ان هذه القنوات تتحيز لصالح زمره الحزب اللاوطني ضد الشعب الذي وصل الي درجه,,[],0,pending,,
mt_dial_glf_b9b46506,train,20916,DIAL_GLF,صادق اخوي واهل العقول بنعمة هم واعلامهم الايوقفون لاعبي النصر يعني يبون يلعبون مع براعم العالمي,صادق اخوي واهل العقول بنعمه هم واعلامهم الايوقفون لاعبي النصر يعني يبون يلعبون مع براعم العالمي,,[],0,pending,,
mt_dial_lev_32afd0ae,train,34887,DIAL_LEV,ولا تمسكي في هاي النقطه فقد وردت خطأ مني وبسحبها لانه شرحها بدو صفحات - اعتبريها كانها لم,ولا تمسكي في هاي النقطه فقد وردت خطا مني وبسحبها لانه شرحها بدو صفحات اعتبريها كانها لم,,[],0,pending,,
mt_msa_ca85ca2d,train,1218,MSA,خبير فى علوم الحاسب الالى و تأمين المواقع الديناميك CMS . . .,خبير في علوم الحاسب الالي و تامين المواقع الديناميك CMS,,[],0,pending,,
mt_dial_egy_c18d392a,train,840,DIAL_EGY,سبحان الله فعلا مش هقول اكتر من اللى قاله الاخ نايف العتيبي,سبحان الله فعلا مش هقول اكتر من اللي قاله الاخ نايف العتيبي,,[],0,pending,,
mt_dial_glf_19f3025c,train,57764,DIAL_GLF,ياا ويلكم يا ويلكم يا,ياا ويلكم يا ويلكم يا,,[],0,pending,,
mt_dial_lev_3ecf6e76,train,3726,DIAL_LEV,يعني انسجن 3 سنين ، طيب وبعدين ما انحلت المشكله بالعكس كبرت,يعني انسجن 3 سنين طيب وبعدين ما انحلت المشكله بالعكس كبرت,,[],0,pending,,
mt_msa_0fc62f12,train,72616,MSA,انتشرت المعاكسات بطريقة مخزية . . حتى بعض كبار السن صار يبحث عن فريسة ! ! لتثبت الدنيا أن الرجل يبقى رجلاً مهما قيل عن فوائد الانفتاح,انتشرت المعاكسات بطريقه مخزيه حتي بعض كبار السن صار يبحث عن فريسه لتثبت الدنيا ان الرجل يبقي رجلا مهما قيل عن فوايد الانفتاح,,[],0,pending,,
mt_dial_egy_7872e8ff,train,42617,DIAL_EGY,الرجل دا مش لاقى اللى يلموا ولا ايه كل شويه فصخ ضبو وعامل ابوزيد الهلال ياعم حلوه يغور فى ستين داهيه هى الجزائر دفعت ليه,الرجل دا مش لاقي اللي يلموا ولا ايه كل شويه فصخ ضبو وعامل ابوزيد الهلال ياعم حلوه يغور في ستين داهيه هي الجزاير دفعت ليه,,[],0,pending,,
mt_dial_glf_07b310d6,train,107,DIAL_GLF,وامشي يوميا ساعة ( اذا على السير نهائيالاتخلي يدك ماسكةفي المقابض عشان تستفيدي ) ولاحظي اني قلت امشي يعني موتمشي ( مدي الخطوةوأنا اختك,وامشي يوميا ساعه اذا علي السير نهاييالاتخلي يدك ماسكهفي المقابض عشان تستفيدي ولاحظي اني قلت امشي يعني موتمشي مدي الخطوهوانا اختك,,[],0,pending,,
mt_dial_lev_1833a445,train,38823,DIAL_LEV,"والله في منه الحكي عن الاطباء . في يوم الثلاثاء الساعه 12 : 25 منتصف الليل رفض طبيب طوارئ جراحه م . حمزه علاجي بحجه انني اتيت مره سابقه ( قبل شهر ) وطلبت علاجي وكان هو المناوب وقال بصوت عالي : انت اجيت قبل هيك , انا متذكرك وبعثتك عجراحه الاعصاب ما عندي علاج الك انا ذاكرتي قويه , مع السلامه ( مع العلم انه كان يتحدث بالهاتف عن بيع وشراء سياره لمده 8 دقائق ) قبل ان يراني . كل ذلك قبل ان اقول له مما اشكو ! ! ! وكان عنده د . العظام وخرج . فذهبت لاسعاف العظام كون عياده الكشف مغلقه وقبل ان اقول له اي كلمه قال : ( عياده الاعصاب ) لان سمع زميله قال ذلك ! ! ! . فلملمت جراحي وعدت للبيت - فحسبنا الله ونعم",والله في منه الحكي عن الاطباء في يوم الثلاثاء الساعه 12 25 منتصف الليل رفض طبيب طواري جراحه م حمزه علاجي بحجه انني اتيت مره سابقه قبل شهر وطلبت علاجي وكان هو المناوب وقال بصوت عالي انت اجيت قبل هيك انا متذكرك وبعثتك عجراحه الاعصاب ما عندي علاج الك انا ذاكرتي قويه مع السلامه مع العلم انه كان يتحدث بالهاتف عن بيع وشراء سياره لمده 8 دقايق قبل ان يراني كل ذلك قبل ان اقول له مما اشكو وكان عنده د العظام وخرج فذهبت لاسعاف العظام كون عياده الكشف مغلقه وقبل ان اقول له اي كلمه قال عياده الاعصاب لان سمع زميله قال ذلك فلملمت جراحي وعدت للبيت فحسبنا الله ونعم,,[],0,pending,,
mt_msa_f7c3a0c6,train,56958,MSA,لهذا نشاهد في هذة القبائل يكثر عندهم الحسد والغيرة والإنتقام بين نسائهم لمحدودية الرجال الصالحين واللذين يتنافسون بنات تلك القبائل بالظفر بأحدهم,لهذا نشاهد في هذه القبايل يكثر عندهم الحسد والغيره والانتقام بين نسايهم لمحدوديه الرجال الصالحين واللذين يتنافسون بنات تلك القبايل بالظفر باحدهم,,[],0,pending,,
mt_dial_egy_1a25c7b6,train,40135,DIAL_EGY,قصه قديمه وعلي الرغم ان كتير سبقوني وقالوها بس مش قادر امسك,قصه قديمه وعلي الرغم ان كتير سبقوني وقالوها بس مش قادر امسك,,[],0,pending,,
mt_dial_glf_d7252ea1,train,16359,DIAL_GLF,طيب فهموني لأني ممارس صحي,طيب فهموني لاني ممارس صحي,,[],0,pending,,
mt_dial_lev_fa73811f,train,21946,DIAL_LEV,وكمان فيصل ابراهيم لانه مبدع,وكمان فيصل ابراهيم لانه مبدع,,[],0,pending,,
mt_msa_8f4d7930,train,79788,MSA,المشاركات الخارجية هل نسيت رباعيات ديمبو الهندي ( يا للفضيحة ) و رباعيات الفريق الصاعد من الدرجة الثانية في الدوري السوري ( يا للنكسه,المشاركات الخارجيه هل نسيت رباعيات ديمبو الهندي يا للفضيحه و رباعيات الفريق الصاعد من الدرجه الثانيه في الدوري السوري يا للنكسه,,[],0,pending,,
mt_dial_egy_e28d3b21,train,39409,DIAL_EGY,هو كل من هب و دب يتكلم على النقاب - بدل ما نخلى اللى لابسة النقاب و بتسرق,هو كل من هب و دب يتكلم علي النقاب بدل ما نخلي اللي لابسه النقاب و بتسرق,,[],0,pending,,
mt_dial_glf_a2d50697,train,6395,DIAL_GLF,زمانهم إنقلب و خرقت العلب والسبع نام والجرذ نصب,زمانهم انقلب و خرقت العلب والسبع نام والجرذ نصب,,[],0,pending,,
mt_dial_lev_f447419e,train,36736,DIAL_LEV,انتقالات اللاعبيين رايحه تولع هذه السنه والنادي اللي بدفع اكثر اللاعب رايح عنده مباشره ويوقع,انتقالات اللاعبيين رايحه تولع هذه السنه والنادي اللي بدفع اكثر اللاعب رايح عنده مباشره ويوقع,,[],0,pending,,
mt_msa_8cc45398,train,44043,MSA,اذا كانت الزوجه لاتريدني فكيف أريدها,اذا كانت الزوجه لاتريدني فكيف اريدها,,[],0,pending,,
mt_dial_egy_0ec87ffe,train,64817,DIAL_EGY,كل ده بسبب البنات اللي كانت في,كل ده بسبب البنات اللي كانت في,,[],0,pending,,
mt_dial_glf_9011c568,train,60327,DIAL_GLF,قلتو كلاما فاضي اجل وش الحل,قلتو كلاما فاضي اجل وش الحل,,[],0,pending,,
mt_dial_lev_842e57df,train,52740,DIAL_LEV,"ما في داعي نضحك على حالنا فالرمثا ما شاالله عليه شباب صغار ولكن الوحدات يملك الشباب والخبره فما فيه داعي للنفخ الزايد عن حده وانشاء الله بنشوف مباراه حلوه وتليق بالفريقين ,",ما في داعي نضحك علي حالنا فالرمثا ما شاالله عليه شباب صغار ولكن الوحدات يملك الشباب والخبره فما فيه داعي للنفخ الزايد عن حده وانشاء الله بنشوف مباراه حلوه وتليق بالفريقين,,[],0,pending,,
mt_msa_8636a2cd,train,69398,MSA,الحلول كل الاطراف في الداخل والخارج,الحلول كل الاطراف في الداخل والخارج,,[],0,pending,,
mt_dial_egy_a8fc116d,train,39572,DIAL_EGY,. . وأبوخ ما فى الأتنين هوا ( الأصوات ) إللى تجيب التخلف,وابوخ ما في الاتنين هوا الاصوات اللي تجيب التخلف,,[],0,pending,,
mt_dial_glf_0b94e661,train,51534,DIAL_GLF,اول مرة تقول شي صح 00 ليتك تجددمن افكارك وتبقى,اول مره تقول شي صح 00 ليتك تجددمن افكارك وتبقي,,[],0,pending,,
mt_dial_lev_67973afb,train,70997,DIAL_LEV,واذا ارتفع السعر في بلد المنشا نتيجة الضرائب ولكن الارز الموجود لديكم على السعر القديم وبلاش هالاسطوانة ملين من,واذا ارتفع السعر في بلد المنشا نتيجه الضرايب ولكن الارز الموجود لديكم علي السعر القديم وبلاش هالاسطوانه ملين من,,[],0,pending,,
mt_msa_5cbffaa8,train,63262,MSA,بصراحة كثرت الشكاوي ضد مستشفى النور بمكة من سوء الخدمات الطبية ومكوث المرضى في قسم الطوارئ مدة طويلة دون العناية بهم فلا يمر اسبوع كامل حتى نسمع عن حالات وفاة بسبب الاخطاء الطبية نرجو من المسؤولين في وزارة الصحة وضع حد لهذا الاستهتار بارواح المراجعين لهذا المستشفى ! !,بصراحه كثرت الشكاوي ضد مستشفي النور بمكه من سوء الخدمات الطبيه ومكوث المرضي في قسم الطواري مده طويله دون العنايه بهم فلا يمر اسبوع كامل حتي نسمع عن حالات وفاه بسبب الاخطاء الطبيه نرجو من المسوولين في وزاره الصحه وضع حد لهذا الاستهتار بارواح المراجعين لهذا المستشفي,,[],0,pending,,
