example_id,source_split,source_row_id,dialect,original_text,normalized_text,masked_text,mask_spans_json,mask_count,annotation_status,annotator_model,notes
mt_dial_egy_0293c02b,train,86025,DIAL_EGY,معلش يا جماعة اصل لبني ادم ده خايف,معلش يا جماعه اصل لبني ادم ده خايف,,[],0,pending,,
mt_dial_glf_25523d42,train,53718,DIAL_GLF,طموحك سوف يحولك نادي النصر احتياط لصالح صديق اوالبحري واخيراً يتنازل عنك لنادي التعاون شكلك مافكرت صح عند انتقالك لنادي الفقرواتعضت من مرزوق العتيبي والزهراني والبحري حولهم النصر الى نادي النسيان,طموحك سوف يحولك نادي النصر احتياط لصالح صديق اوالبحري واخيرا يتنازل عنك لنادي التعاون شكلك مافكرت صح عند انتقالك لنادي الفقرواتعضت من مرزوق العتيبي والزهراني والبحري حولهم النصر الي نادي النسيان,,[],0,pending,,
mt_dial_lev_8fb08e42,train,80704,DIAL_LEV,هاد مش اب هاد مجرم مستحيل يكون اب ما عنده ضمير ولا اخلاق يا خسارة اذ في لسة بهاد الزمن هيك,هاد مش اب هاد مجرم مستحيل يكون اب ما عنده ضمير ولا اخلاق يا خساره اذ في لسه بهاد الزمن هيك,,[],0,pending,,
mt_msa_76a0613f,train,24225,MSA,وانصح برفع هذا المقال الغريب الاكثر من,وانصح برفع هذا المقال الغريب الاكثر من,,[],0,pending,,
mt_dial_egy_b5b4f64f,train,64291,DIAL_EGY,طيب هل فيه حد حيتعظ ؟ فيه حد من المسئولين ممكن يتعظ ؟ فيه حد من الظالمين ممكن يتعظ ؟ فيه حد من خلق الله ممكن يتعظ ؟ طيب متى نتعظ ؟ لما ننزل القبر ولا ايه,طيب هل فيه حد حيتعظ فيه حد من المسيولين ممكن يتعظ فيه حد من الظالمين ممكن يتعظ فيه حد من خلق الله ممكن يتعظ طيب متي نتعظ لما ننزل القبر ولا ايه,,[],0,pending,,
mt_dial_glf_86cc1272,train,42363,DIAL_GLF,لانه وبكل بساطه لو جا شخص يناسبه وليس من قبيله معروفه او ليس قبيلي اساسا ماراح يوافقه اذا جا وقت,لانه وبكل بساطه لو جا شخص يناسبه وليس من قبيله معروفه او ليس قبيلي اساسا ماراح يوافقه اذا جا وقت,,[],0,pending,,
mt_dial_lev_081299e3,train,30877,DIAL_LEV,شو ها الناس هدول مافي في قلبهم,شو ها الناس هدول مافي في قلبهم,,[],0,pending,,
mt_msa_9bbb949f,train,22735,MSA,نحن الشباب معك يا دكتور برادعى,نحن الشباب معك يا دكتور برادعي,,[],0,pending,,
mt_dial_egy_c8b5a911,train,37615,DIAL_EGY,الحفلة كانت جامده موت والله وسمية فعلا كانت زى القمر والتواجد جامد,الحفله كانت جامده موت والله وسميه فعلا كانت زي القمر والتواجد جامد,,[],0,pending,,
mt_dial_glf_1082a19e,train,67563,DIAL_GLF,وبالنسبه للي يستغلون حاجة البنات للوظائف تراها كثرت بشده أكثر من وحده تقولي نفس السالفه ( @_@,وبالنسبه للي يستغلون حاجه البنات للوظايف تراها كثرت بشده اكثر من وحده تقولي نفس السالفه _,,[],0,pending,,
mt_dial_lev_b70409c3,train,30249,DIAL_LEV,الى نادي الجزيره اللحم الروماني مش زابط كيف لاعبين كره القدم,الي نادي الجزيره اللحم الروماني مش زابط كيف لاعبين كره القدم,,[],0,pending,,
mt_msa_bfe18f37,train,7559,MSA,كل الدول تهزأ بنا عند سقوط الامطار التي نستسقي,كل الدول تهزا بنا عند سقوط الامطار التي نستسقي,,[],0,pending,,
mt_dial_egy_13043db8,train,51225,DIAL_EGY,متقلقشى يادكتور الشعب بقالة 30 سنة نايم ومحتاج وقت وساعتها ولاحد حيقدر,متقلقشي يادكتور الشعب بقاله 30 سنه نايم ومحتاج وقت وساعتها ولاحد حيقدر,,[],0,pending,,
mt_dial_glf_fb28e751,train,20463,DIAL_GLF,"بالعمل هاذا الي البعض فرحان له , راح تتشويه صوره المسلمين اكثر واكثر عند الغرب وخاصه المسلمين منهم",بالعمل هاذا الي البعض فرحان له راح تتشويه صوره المسلمين اكثر واكثر عند الغرب وخاصه المسلمين منهم,,[],0,pending,,
mt_dial_lev_fa89e066,train,3058,DIAL_LEV,مين سألوا ممكن نعرف لأنه ما هي قادرة تتحمل شي من مسؤوليتها فرض ضرائب ورفع اسعار واكل اموال الناس رجعولنا 20 % من مصارينا في البورصة بعد ما حكوا النسبة وصلت 100 % لبعض,مين سالوا ممكن نعرف لانه ما هي قادره تتحمل شي من مسووليتها فرض ضرايب ورفع اسعار واكل اموال الناس رجعولنا 20 من مصارينا في البورصه بعد ما حكوا النسبه وصلت 100 لبعض,,[],0,pending,,
mt_msa_dc0cccb8,train,23272,MSA,اولا اتوجه بالشكر لكى سيدتى على قراءه كافه التعليقات او بعضها واشكرك ان كان العنوان جزء من تعليقى السابق فهذا يدل على حسن تجاوبك مع قراءاك الكرام بلا استثناء وارائهم المفيده للمجتمع . اما مازالنا فى صدد الانتخابات او كما قلنا سابقا المسرحيه الهزليه التى تحدث كل دوره انتخابيه ونرى مجلس يخرج الى الضوء ولكن بلانياب بمعنى ان الدوله لا تخشى المجلس ومن فيه حتى ولو استدعى وزير الى المجلس وكأنه ذاهب الى نزهه نحن يا سيدتى لا يوجد مجلس بمعنى مجلس يستطيع ان يغير وزير او يسحب الثقه من وزاره ولن اضرب امثله من الغرب ولكن ساضرب مثل بدوله الكويت التى نكن لها كل احترام اذا قلت دويله وليست دوله من حيث المساحه وعدد السكان بالنسبه لمصر انظرى سيدتى الى مجلس الامه كم مره يسحب الثقه من الحكومه وتسقط الحكومه فهل حدث ذلك فى مصر . مصر التى كانت تتمتع ببرلمان على اعلى مستوى وحياه برلمانيه ناجحه فى عهد الملك مثل حكومه النحاس باشا وكذلك حكومه احمد ماهر والنقراشى وغيرهم كانت عندنا حياه برلمانيه كريمه كان من يسعى للوصول للمجلس من اجل خدمه منطقته او ابناء دائرته حتى ولو كان اقطاعى كان ينظر لاهل الدائره التى يعمل بها كان يعطى ولا ياخد اما الان يصرف ملاين لكى يدخل المجلس من اجل جمع المليارات والمصالح الشخصيه المجلس اصبح برستيج الدوله تعمله لهدفين اولا لتلهى الشعب وتلهى الظالمين بعضهم ببعض وثانيا ان تكون امام العالم المتحضره عندها مجلس شعب يناقش قضايا الوطن وماهى الا فصول من فصول المسرحيه الهزليه التى تعيش فيها الامه التى سليبت حقها الشرعى فيمن يمثلها . فهيا نكمل المسرحيه,اولا اتوجه بالشكر لكي سيدتي علي قراءه كافه التعليقات او بعضها واشكرك ان كان العنوان جزء من تعليقي السابق فهذا يدل علي حسن تجاوبك مع قراءاك الكرام بلا استثناء وارايهم المفيده للمجتمع اما مازالنا في صدد الانتخابات او كما قلنا سابقا المسرحيه الهزليه التي تحدث كل دوره انتخابيه ونري مجلس يخرج الي الضوء ولكن بلانياب بمعني ان الدوله لا تخشي المجلس ومن فيه حتي ولو استدعي وزير الي المجلس وكانه ذاهب الي نزهه نحن يا سيدتي لا يوجد مجلس بمعني مجلس يستطيع ان يغير وزير او يسحب الثقه من وزاره ولن اضرب امثله من الغرب ولكن ساضرب مثل بدوله الكويت التي نكن لها كل احترام اذا قلت دويله وليست دوله من حيث المساحه وعدد السكان بالنسبه لمصر انظري سيدتي الي مجلس الامه كم مره يسحب الثقه من الحكومه وتسقط الحكومه فهل حدث ذلك في مصر مصر التي كانت تتمتع ببرلمان علي اعلي مستوي وحياه برلمانيه ناجحه في عهد الملك مثل حكومه النحاس باشا وكذلك حكومه احمد ماهر والنقراشي وغيرهم كانت عندنا حياه برلمانيه كريمه كان من يسعي للوصول للمجلس من اجل خدمه منطقته او ابناء دايرته حتي ولو كان اقطاعي كان ينظر لاهل الدايره التي يعمل بها كان يعطي ولا ياخد اما الان يصرف ملاين لكي يدخل المجلس من اجل جمع المليارات والمصالح الشخصيه المجلس اصبح برستيج الدوله تعمله لهدفين اولا لتلهي الشعب وتلهي الظالمين بعضهم ببعض وثانيا ان تكون امام العالم المتحضره عندها مجلس شعب يناقش قضايا الوطن وماهي الا فصول من فصول المسرحيه الهزليه التي تعيش فيها الامه التي سليبت حقها الشرعي فيمن يمثلها فهيا نكمل المسرحيه,,[],0,pending,,
mt_dial_egy_f69c7cbf,train,42837,DIAL_EGY,"البس اضيق غلط لكن ما هواش زي لطائفة معينة أو يميز دين معين ومصر كلنت بلد علملني وحر وكانت ألي بتلبسو في ذلك الوقت أغلبيت نساء القاهرة ( البندر ) وكان كل ألي بيشوفوة من الرياف بيتكسفو علشان ما أتعودوش علية عندهم , لكن بعد ما بتوع الأرياف زحفو للقاهرة بدل ما يجارو الموضة والعصر جلبو معهم عادتهم ألي سابو علشنها مدنهم الريفية وشوية شوية حولو القاهرة لغيط كبير علي الي فيها يمشو تبعهم وتبع تقاليدهم الريفية . لكن النقاب يخص فئة معينة دينية بحتة حتي شيخ الأزهر القديم والجديد رافضنها فما بالك بباقي الشعب ألي فيهم مسلمين ومسيحين وأجانب ودبلوماسين وعلمانين وملحدين وخلافة . ثما أن من ترتدي النقاب تعلم جيدآ أن صوت المرئة عورة أجمع عليها علماء المسلمين من ما يعني أنها يجب أن لا تتحدث مع أحد أو يسمع صوتها فكيف أزن تخطلط بالناس ؟ ؟ ؟ باللة عليك",البس اضيق غلط لكن ما هواش زي لطايفه معينه او يميز دين معين ومصر كلنت بلد علملني وحر وكانت الي بتلبسو في ذلك الوقت اغلبيت نساء القاهره البندر وكان كل الي بيشوفوه من الرياف بيتكسفو علشان ما اتعودوش عليه عندهم لكن بعد ما بتوع الارياف زحفو للقاهره بدل ما يجارو الموضه والعصر جلبو معهم عادتهم الي سابو علشنها مدنهم الريفيه وشويه شويه حولو القاهره لغيط كبير علي الي فيها يمشو تبعهم وتبع تقاليدهم الريفيه لكن النقاب يخص فيه معينه دينيه بحته حتي شيخ الازهر القديم والجديد رافضنها فما بالك بباقي الشعب الي فيهم مسلمين ومسيحين واجانب ودبلوماسين وعلمانين وملحدين وخلافه ثما ان من ترتدي النقاب تعلم جيدا ان صوت المريه عوره اجمع عليها علماء المسلمين من ما يعني انها يجب ان لا تتحدث مع احد او يسمع صوتها فكيف ازن تخطلط بالناس بالله عليك,,[],0,pending,,
mt_dial_glf_a3a741ae,train,63868,DIAL_GLF,للرجل فالرجل ( ياعيني ) دائما في قفص,للرجل فالرجل ياعيني دايما في قفص,,[],0,pending,,
mt_dial_lev_c2595928,train,29209,DIAL_LEV,يعتي أنا مو عارف وين راح كل هالمطر يللي نزل في الشتويه والله كانت تمطر بالاسابيع من غير ما توقف ! ! ! و حكو انو السدود تعبت ليش قلعدين بنحكي عن عجز مائي و احنا كلنا 5 مليون هادا كيف لو كنا 80 ميون زي مصر ! !,يعتي انا مو عارف وين راح كل هالمطر يللي نزل في الشتويه والله كانت تمطر بالاسابيع من غير ما توقف و حكو انو السدود تعبت ليش قلعدين بنحكي عن عجز مايي و احنا كلنا 5 مليون هادا كيف لو كنا 80 ميون زي مصر,,[],0,pending,,
mt_msa_41c4439f,train,33744,MSA,بشرى لاهالى الدائرة الرابعة بمحافظة,بشري لاهالي الدايره الرابعه بمحافظه,,[],0,pending,,
mt_dial_egy_6097e155,train,23500,DIAL_EGY,والله يا جماعه ده ملعوب كبير اوى,والله يا جماعه ده ملعوب كبير اوي,,[],0,pending,,
mt_dial_glf_76e25eec,train,23386,DIAL_GLF,إقتصاد على الاطلاق اذا ما عشنا صح لآن,اقتصاد علي الاطلاق اذا ما عشنا صح لان,,[],0,pending,,
mt_dial_lev_4cd7d60a,train,60233,DIAL_LEV,هيك احنا بيجي واحد عارف كل اشي عن ميسي وميسي ما بعرف الاردن ولا الوطن العربي,هيك احنا بيجي واحد عارف كل اشي عن ميسي وميسي ما بعرف الاردن ولا الوطن العربي,,[],0,pending,,
mt_msa_620c2946,train,46794,MSA,ويبدو ان ادارة الوحدات ايقنت تماما قدرة هذا المدرب على التحكم بمفاتيح اللعب بعد ان استهانو به كثيرا قبل مباراة الوحدات مع شباب الاردن ولذلك عرفو قيمته تماما بعد ان كان احد العوامل الرئيسة لتجريد الوحدات من لقب,ويبدو ان اداره الوحدات ايقنت تماما قدره هذا المدرب علي التحكم بمفاتيح اللعب بعد ان استهانو به كثيرا قبل مباراه الوحدات مع شباب الاردن ولذلك عرفو قيمته تماما بعد ان كان احد العوامل الرييسه لتجريد الوحدات من لقب,,[],0,pending,,
mt_dial_egy_823fc88e,train,25496,DIAL_EGY,هو الاهلي السبب ولا الحكم السبب ولا محمد ابراهيم المدرب السبب ولا عبدالمنعم مدلك اتحاد الشرطة السبب ولا رامي سعيد السبب . . . حرام عليكم مش لقيين حجج تتحججوا بيها . . . انتوا نادي فاشل وجمهور همجي والاتنين القرع سوف يتسببوا في كوارث للكرة المصرية بدئت في الجزائر وامس في استاد القاهرة . . . المفروض النادي الفاشل ياخد عقاب من الفيفا لانه بيشغل واحد موقوف دوليا واتحاد الكورة متستر عليه لانهم بيخافوا من قلة ادب الاتنين,هو الاهلي السبب ولا الحكم السبب ولا محمد ابراهيم المدرب السبب ولا عبدالمنعم مدلك اتحاد الشرطه السبب ولا رامي سعيد السبب حرام عليكم مش لقيين حجج تتحججوا بيها انتوا نادي فاشل وجمهور همجي والاتنين القرع سوف يتسببوا في كوارث للكره المصريه بديت في الجزاير وامس في استاد القاهره المفروض النادي الفاشل ياخد عقاب من الفيفا لانه بيشغل واحد موقوف دوليا واتحاد الكوره متستر عليه لانهم بيخافوا من قله ادب الاتنين,,[],0,pending,,
mt_dial_glf_1d2a3459,train,56520,DIAL_GLF,الله يستر ماصير انا معاهم,الله يستر ماصير انا معاهم,,[],0,pending,,
mt_dial_lev_a7abab59,train,37672,DIAL_LEV,وليش زعلان يا معلم الف مبروك لكم ولنا وبروح,وليش زعلان يا معلم الف مبروك لكم ولنا وبروح,,[],0,pending,,
mt_msa_03b69ab1,train,66070,MSA,- القضية ليست فقط مادية فهناك حقوق كثيرة مهضومة,القضيه ليست فقط ماديه فهناك حقوق كثيره مهضومه,,[],0,pending,,
mt_dial_egy_a51751f2,train,44365,DIAL_EGY,"ياجماعه الخبر عن نادى الزمالك مش عايزين اى واحد اهلاوى يستخف دمه ويعمل مفتح ويقول كلمتين مالهمش لازمه عشان الموضوع مايخصكمش وبعدين هو لو حسام بقى شديد مش عاجب ولو بقى مالوش كلمه برده مش عاجب , حاجه غريبه وبعدين النتائج هى الى بتحكم ومتهيألى النتائج",ياجماعه الخبر عن نادي الزمالك مش عايزين اي واحد اهلاوي يستخف دمه ويعمل مفتح ويقول كلمتين مالهمش لازمه عشان الموضوع مايخصكمش وبعدين هو لو حسام بقي شديد مش عاجب ولو بقي مالوش كلمه برده مش عاجب حاجه غريبه وبعدين النتايج هي الي بتحكم ومتهيالي النتايج,,[],0,pending,,
mt_dial_glf_0bda2230,train,64814,DIAL_GLF,ما احد جاب لها طاري من,ما احد جاب لها طاري من,,[],0,pending,,
mt_dial_lev_67c06afa,train,18102,DIAL_LEV,بس والله يا سوسن الصورة الي بالمقال ومنظر الشجرات بجنن . شكرا عل,بس والله يا سوسن الصوره الي بالمقال ومنظر الشجرات بجنن شكرا عل,,[],0,pending,,
mt_msa_6b01c52b,train,43082,MSA,ان شاء الله يفلسون اكثر من تراجع الفائض .,ان شاء الله يفلسون اكثر من تراجع الفايض,,[],0,pending,,
mt_dial_egy_69fac723,train,78883,DIAL_EGY,من هنا لبكرة الصبح وسلم لى ع إتحاد الكوسة,من هنا لبكره الصبح وسلم لي ع اتحاد الكوسه,,[],0,pending,,
mt_dial_glf_f76b185e,train,63876,DIAL_GLF,لو صار كذا راح تشوف الدعاة بالشوارع . .,لو صار كذا راح تشوف الدعاه بالشوارع,,[],0,pending,,
mt_dial_lev_12dff661,train,70877,DIAL_LEV,الدوري ذهب للفيصلي بواسطه بهديه شبابيه والدليله لعنه المارد الاخضر اقصت الفيصلي وشباب الاردن من الكأس لانهم لا,الدوري ذهب للفيصلي بواسطه بهديه شبابيه والدليله لعنه المارد الاخضر اقصت الفيصلي وشباب الاردن من الكاس لانهم لا,,[],0,pending,,
mt_msa_665ae31f,train,10744,MSA,معرض إكسبو في [ شنغهاي ] الإمارات العربية المتحده وصلو هناك,معرض اكسبو في شنغهاي الامارات العربيه المتحده وصلو هناك,,[],0,pending,,
mt_dial_egy_28fbdf72,train,81930,DIAL_EGY,طبعاً البلطجة رد فعل طبيعي مش لغياب الأمن بس لكن لآن الأمن تفرغ للفزاعة الإسلامية متعمداً العمل الدؤوب علي ملف الإخوان وملفات المناهضين للنظام من السياسيين طبعاً . . . هو قاتل اللواء عبدالموجوود إتمسك . . . سؤال إلي وزيرنا القوي حبيب العادلي لو كانت بس مظاهرة سلمية للإخوان كان الأمن المركزي حاصر الغربية مش طنطا . . . تصدقو المستفيد الوحيد من إنشغال الداخلية بالإخوان هما تجار المخدرات ودول مش بيشتغلو صدفة . . . توزيع المخدرات تضاعف . . . البلضجة بقت علي الشرطة كمان . . . ولكل شيء ثمن . . . برافو أهالي كفر عصام . . . هو بس الصوت العالي الي,طبعا البلطجه رد فعل طبيعي مش لغياب الامن بس لكن لان الامن تفرغ للفزاعه الاسلاميه متعمدا العمل الدووب علي ملف الاخوان وملفات المناهضين للنظام من السياسيين طبعا هو قاتل اللواء عبدالموجوود اتمسك سوال الي وزيرنا القوي حبيب العادلي لو كانت بس مظاهره سلميه للاخوان كان الامن المركزي حاصر الغربيه مش طنطا تصدقو المستفيد الوحيد من انشغال الداخليه بالاخوان هما تجار المخدرات ودول مش بيشتغلو صدفه توزيع المخدرات تضاعف البلضجه بقت علي الشرطه كمان ولكل شيء ثمن برافو اهالي كفر عصام هو بس الصوت العالي الي,,[],0,pending,,
mt_dial_glf_d548e1c2,train,45578,DIAL_GLF,يعني لكم اسبوع و كل يوم عشرين مقال تبون اللجنة تنفذ,يعني لكم اسبوع و كل يوم عشرين مقال تبون اللجنه تنفذ,,[],0,pending,,
mt_dial_lev_cc344eac,train,18114,DIAL_LEV,الحياه ماشيه يا اخوان بالطول بالعرض ما ظل قد اللي,الحياه ماشيه يا اخوان بالطول بالعرض ما ظل قد اللي,,[],0,pending,,
mt_msa_5e237dc2,train,62136,MSA,الف الف الف مبروك يا ابو,الف الف الف مبروك يا ابو,,[],0,pending,,
mt_dial_egy_3babb95f,train,3829,DIAL_EGY,ياعم يا خال ياجار يامسيحي ياعم سيح مزاجك,ياعم يا خال ياجار يامسيحي ياعم سيح مزاجك,,[],0,pending,,
mt_dial_glf_de529bc3,train,1296,DIAL_GLF,نسأل الله ان يفرج الكربة ، ما فيه فرق بين حصار اسرائيل ومصر ياالمصريين غمض عين وفتح عين لا تنسوا اليهود وما يعملون سورة البقرة تبين كل شيء,نسال الله ان يفرج الكربه ما فيه فرق بين حصار اسراييل ومصر ياالمصريين غمض عين وفتح عين لا تنسوا اليهود وما يعملون سوره البقره تبين كل شيء,,[],0,pending,,
mt_dial_lev_6f1c1a92,train,10165,DIAL_LEV,الله يعطيهم العافيه والله الشعب المصري عندهم رجوله بصراحه انا اقدر واحترم عملهم هذا الله يعطيهم العافيه والله ملعوبه عرفو يلعبوها الشباب,الله يعطيهم العافيه والله الشعب المصري عندهم رجوله بصراحه انا اقدر واحترم عملهم هذا الله يعطيهم العافيه والله ملعوبه عرفو يلعبوها الشباب,,[],0,pending,,
mt_msa_8c9ec7de,train,84979,MSA,الطريق الذهبى لكل الانتهازيين واعرف منهم,الطريق الذهبي لكل الانتهازيين واعرف منهم,,[],0,pending,,
mt_dial_egy_83d8cffb,train,182,DIAL_EGY,لصاحب التعليق رقم 3 من دمنا يا عم هو الفلوس كانت كام و بقت كام و الشعب الغلبان ده فى يد كبيره و وصله تخلص الاشياء ده و العموله يا اخى بالدولار ربنا يسهل,لصاحب التعليق رقم 3 من دمنا يا عم هو الفلوس كانت كام و بقت كام و الشعب الغلبان ده في يد كبيره و وصله تخلص الاشياء ده و العموله يا اخي بالدولار ربنا يسهل,,[],0,pending,,
mt_dial_glf_9b4a6bbe,train,53881,DIAL_GLF,افضل شي انهم يتحدثون عن البطاله لان زين فيه ناس تحس,افضل شي انهم يتحدثون عن البطاله لان زين فيه ناس تحس,,[],0,pending,,
mt_dial_lev_c26fa6cb,train,63860,DIAL_LEV,سلم سلامات كل البطولات للوحدات وسلملي على ابو,سلم سلامات كل البطولات للوحدات وسلملي علي ابو,,[],0,pending,,
