example_id,source_split,source_row_id,dialect,original_text,normalized_text,masked_text,mask_spans_json,mask_count,annotation_status,annotator_model,notes
mt_dial_egy_d7e87d4d,train,59293,DIAL_EGY,حازم اخطاء ولاكن الميكانيى اللى اسمه توفيق السيد المفروض يشتغل بياع بطاطا حسب ضربة جزاء كومديه فى مبارة بتروجت مع الزمالك واليوم تغاضى عن ضربتى جزاء صحيحتين ميه الميه وبعدين مين قال انه ضرب ايد الحكم وبعدين هو حاول يمسك ايد الحكم مثل كل اللاعبين المصريين وهى عادة,حازم اخطاء ولاكن الميكانيي اللي اسمه توفيق السيد المفروض يشتغل بياع بطاطا حسب ضربه جزاء كومديه في مباره بتروجت مع الزمالك واليوم تغاضي عن ضربتي جزاء صحيحتين ميه الميه وبعدين مين قال انه ضرب ايد الحكم وبعدين هو حاول يمسك ايد الحكم مثل كل اللاعبين المصريين وهي عاده,,[],0,pending,,
mt_dial_glf_a664c021,train,37942,DIAL_GLF,يالله كلها سنه ويطلعون لعالم السرقات مره,يالله كلها سنه ويطلعون لعالم السرقات مره,,[],0,pending,,
mt_dial_lev_97cf532b,train,17153,DIAL_LEV,ليش جماعة فتح الاسلام بدهم يهجمو ع السفارة اللبنانية يعني شو عاملينلهم لبنان مش ملاقينلهم شغلة وجايين ع لبنان ه دولة عربية والسفارة يعني يلي فيها شو,ليش جماعه فتح الاسلام بدهم يهجمو ع السفاره اللبنانيه يعني شو عاملينلهم لبنان مش ملاقينلهم شغله وجايين ع لبنان ه دوله عربيه والسفاره يعني يلي فيها شو,,[],0,pending,,
mt_msa_459e1900,train,70617,MSA,تشكر جميع إدارات النادي وفي مقدمتهم الجماهير الزرقاء على مر العهود السابقة على مجهوداتهم والان تحصد الثمار اكرر الشكر,تشكر جميع ادارات النادي وفي مقدمتهم الجماهير الزرقاء علي مر العهود السابقه علي مجهوداتهم والان تحصد الثمار اكرر الشكر,,[],0,pending,,
mt_dial_egy_61a4bcdf,train,33474,DIAL_EGY,مين بأه الممثلة الصاعدة بقوة نهى لطفي ؟ ؟,مين باه الممثله الصاعده بقوه نهي لطفي,,[],0,pending,,
mt_dial_glf_fd84f8d4,train,32938,DIAL_GLF,فيه شاب سعودي يقول ابي أمي يشوفونها زملاي,فيه شاب سعودي يقول ابي امي يشوفونها زملاي,,[],0,pending,,
mt_dial_lev_eb25508a,train,26028,DIAL_LEV,والله لو دفعنا مبلغ بسيط يمكن يرد عنا وعن أهلنا نصايب كبيرة,والله لو دفعنا مبلغ بسيط يمكن يرد عنا وعن اهلنا نصايب كبيره,,[],0,pending,,
mt_msa_bb001927,train,56472,MSA,ودليلي انه الفيصلي هو من ينتج النجوميه ويصدرها للانديه الاردنه حتى والعربيه للاستفاده من هذه الخامات احب ان اذكركم بذلك تتذكرون عندما استعنتم بلاعبي الفيصلي الزعيم في بطولة الانديه العربيه امام الشباب السعودي وهم مهند محادين والليث المخضرم هيثم الشبول والانسيتم هذا اكبر دليل انه الزعيم يصدر للانديه نجوم واللي عنده غير ذلك يقابلني حتى هذيك الايام حصل الوحدات على ركلة جزاء وتصدى لها مراد عوينه الله يسهل عليه مع العلم كان المتسبب فيها بدران الشقران وكان هو الاولى بتنفيذها ولكن حصل ماحصل . ليس . . . المهم الزعيم هو الاول والاخير بالاردن ويستعين بقدرات لاعبيه المسجلين لديه بغضي النظر من اين اتو فالزعيم زعيم بكل شيئ والاهم اننا حصلنا على الدوري الاحلى والاغلى والاهم وريحنا انفسنا من المتاعب والانتظار وصب لبن الدوري ازرق وكاس جبر الخواطر,ودليلي انه الفيصلي هو من ينتج النجوميه ويصدرها للانديه الاردنه حتي والعربيه للاستفاده من هذه الخامات احب ان اذكركم بذلك تتذكرون عندما استعنتم بلاعبي الفيصلي الزعيم في بطوله الانديه العربيه امام الشباب السعودي وهم مهند محادين والليث المخضرم هيثم الشبول والانسيتم هذا اكبر دليل انه الزعيم يصدر للانديه نجوم واللي عنده غير ذلك يقابلني حتي هذيك الايام حصل الوحدات علي ركله جزاء وتصدي لها مراد عوينه الله يسهل عليه مع العلم كان المتسبب فيها بدران الشقران وكان هو الاولي بتنفيذها ولكن حصل ماحصل ليس المهم الزعيم هو الاول والاخير بالاردن ويستعين بقدرات لاعبيه المسجلين لديه بغضي النظر من اين اتو فالزعيم زعيم بكل شيي والاهم اننا حصلنا علي الدوري الاحلي والاغلي والاهم وريحنا انفسنا من المتاعب والانتظار وصب لبن الدوري ازرق وكاس جبر الخواطر,,[],0,pending,,
mt_dial_egy_974f28e9,train,50116,DIAL_EGY,وصلك المضمون يا صاحب الردود شو هتسوى قطر وشو هتسوى السعودية وشو هتسوى الجزائر شو سويت أنت لمصر ؟ غير الحقد والخراب وكره الشعب,وصلك المضمون يا صاحب الردود شو هتسوي قطر وشو هتسوي السعوديه وشو هتسوي الجزاير شو سويت انت لمصر غير الحقد والخراب وكره الشعب,,[],0,pending,,
mt_dial_glf_01b63925,train,71385,DIAL_GLF,كل اللف والدوران عشان ودهم بكم مليون فوق المليارات اللي حصلوها من غير وجه حق,كل اللف والدوران عشان ودهم بكم مليون فوق المليارات اللي حصلوها من غير وجه حق,,[],0,pending,,
mt_dial_lev_471bb116,train,1482,DIAL_LEV,اللة ينصرك يا غزة وفك حصارك من هالعدو الصهيوني,الله ينصرك يا غزه وفك حصارك من هالعدو الصهيوني,,[],0,pending,,
mt_msa_124dac00,train,19401,MSA,هل الأمر بالمعروف والنهي عن المنكرفي هذاالزمان ( ( الذي إنقلب وخُرقت فيه العُلب والسبعُ أغمض طرفه ونام و الضفدُع نصب كرسيه وقام ) ) أن ينهى عن المعروف ويؤمر,هل الامر بالمعروف والنهي عن المنكرفي هذاالزمان الذي انقلب وخرقت فيه العلب والسبع اغمض طرفه ونام و الضفدع نصب كرسيه وقام ان ينهي عن المعروف ويومر,,[],0,pending,,
mt_dial_egy_ce906c8b,train,69848,DIAL_EGY,اوعي تهزك اوضاع حسام البدري انت نجم وبطل وكابتن فريق المنتخب وحسن شحاتة عمة ما يفرط فيك لانك احسن قائد للمنتخب والبدري عايز يحبط من نجوميتك فلا تهتز وتمشي احنا جماهير الاهلي نحبك اتر من البدري حقيقة لا,اوعي تهزك اوضاع حسام البدري انت نجم وبطل وكابتن فريق المنتخب وحسن شحاته عمه ما يفرط فيك لانك احسن قايد للمنتخب والبدري عايز يحبط من نجوميتك فلا تهتز وتمشي احنا جماهير الاهلي نحبك اتر من البدري حقيقه لا,,[],0,pending,,
mt_dial_glf_b29cd975,train,26687,DIAL_GLF,هي وينها ال 6 ميقا يامال الصلاح . . واي توفير مال . . تدري بكم سعر ال 4 ميقا . . وتدري انها تقطع الين تقطع روحك معها . . لدرجة اني مو واثق ان الاتصال يقضب روحة لين ارسل,هي وينها ال 6 ميقا يامال الصلاح واي توفير مال تدري بكم سعر ال 4 ميقا وتدري انها تقطع الين تقطع روحك معها لدرجه اني مو واثق ان الاتصال يقضب روحه لين ارسل,,[],0,pending,,
mt_dial_lev_6570ca5a,train,36989,DIAL_LEV,وان شاء الله يتمم على خير وربي يسعدك ويعطيك الصحه,وان شاء الله يتمم علي خير وربي يسعدك ويعطيك الصحه,,[],0,pending,,
mt_msa_06557a9a,train,52113,MSA,التلاعب في الاسعار و تعطيش السوق برضى الرقيب,التلاعب في الاسعار و تعطيش السوق برضي الرقيب,,[],0,pending,,
mt_dial_egy_fd9aae48,train,8146,DIAL_EGY,كلنا رأينا حسام وقت الشغب الجماهيرى صح ! ! ! فهو لم يبد أى اعتراض عارفين ليه ؟ عشان هو كان خسران خسران فعشان يلاقى شماعه يعلق عليها فشل لاعيبيه كان مبسوط جدا ! ! ! 1 وانا نفسى حد يوضحلى اى تصرف محترم امبارح من لاعيبة الزمالك دة بيعكس هجوم التوأم عالحكام والتأثير بتاع ده وكمان تعليمات حسام لكل اللاعيبه انهم يقعو من اقل لمسه عشان يعملو ضغط عالحكم فلما يقعو 10 مرات ويحسب واحده يبقا وصل للمطلوب ! ! ! أما مشكلة ابراهيم فمعروف سببها والحدق يفهم ان رامى سعيد والغردقه و . . . زلسة مأثرين فى كابتن,كلنا راينا حسام وقت الشغب الجماهيري صح فهو لم يبد اي اعتراض عارفين ليه عشان هو كان خسران خسران فعشان يلاقي شماعه يعلق عليها فشل لاعيبيه كان مبسوط جدا 1 وانا نفسي حد يوضحلي اي تصرف محترم امبارح من لاعيبه الزمالك ده بيعكس هجوم التوام عالحكام والتاثير بتاع ده وكمان تعليمات حسام لكل اللاعيبه انهم يقعو من اقل لمسه عشان يعملو ضغط عالحكم فلما يقعو 10 مرات ويحسب واحده يبقا وصل للمطلوب اما مشكله ابراهيم فمعروف سببها والحدق يفهم ان رامي سعيد والغردقه و زلسه ماثرين في كابتن,,[],0,pending,,
mt_dial_glf_df8c8572,train,34018,DIAL_GLF,البنت مزيونه . . تجرح عيونه . . واللي يعاند . . لاتلومونه .,البنت مزيونه تجرح عيونه واللي يعاند لاتلومونه,,[],0,pending,,
mt_dial_lev_3231f988,train,2459,DIAL_LEV,اعجبتني كثيرا فكرة استغلال نجومية وشعبية بعض لاعبينا الكبار في ناديي الفيصلي والوحدات من اجل الترويج للانتخابات النيابية المقبلة . . وميسي ورونالدو وكاكا مش احسن من حسونة ولؤي ورافت وعامر شفيع حتى يعملو دعاية مع بيبسي .,اعجبتني كثيرا فكره استغلال نجوميه وشعبيه بعض لاعبينا الكبار في ناديي الفيصلي والوحدات من اجل الترويج للانتخابات النيابيه المقبله وميسي ورونالدو وكاكا مش احسن من حسونه ولوي ورافت وعامر شفيع حتي يعملو دعايه مع بيبسي,,[],0,pending,,
mt_msa_69f168fb,train,65208,MSA,صدقت المخدرات افة العصر^واستغربت عندما شاهدت برنامج عرضته فضائية^وكان هناك مطوع شاهد بام عينه ويشرح^كيف ان المجاهدين المزعومين^الباحثين عن الحور العين^يدخنون الحشيش^كأول مهمة يتدربون عليها^وبعدها يكونوا اداة مطيعة لشياطينهم الكبار^لهذا يجب مراقبة خونة الداخل^الذي يصّرفون مايرسله خونة الخارج من,صدقت المخدرات افه العصر واستغربت عندما شاهدت برنامج عرضته فضاييه وكان هناك مطوع شاهد بام عينه ويشرح كيف ان المجاهدين المزعومين الباحثين عن الحور العين يدخنون الحشيش كاول مهمه يتدربون عليها وبعدها يكونوا اداه مطيعه لشياطينهم الكبار لهذا يجب مراقبه خونه الداخل الذي يصرفون مايرسله خونه الخارج من,,[],0,pending,,
mt_dial_egy_678b9481,train,69974,DIAL_EGY,هيخسرو من الشرطة اذا كان الحكم نزية وحكم يعرف الحق لاننا لو لاحظنا ان جميع المباريات التي فاز فيها الزمالك من اهداء الحكام مباراة المقاولون والاتحاد والمحلة والاسماعيلي وبتروجيت والانتاج كانت تفويت وكلة علشان عديمي الاخلاق الاختين الماسخين اللي دمهم ثقيل المرتزقة عملو ارهاب للحكام مافيش عدل حرام عليكم يا حكام مصر تخافو من عديمي,هيخسرو من الشرطه اذا كان الحكم نزيه وحكم يعرف الحق لاننا لو لاحظنا ان جميع المباريات التي فاز فيها الزمالك من اهداء الحكام مباراه المقاولون والاتحاد والمحله والاسماعيلي وبتروجيت والانتاج كانت تفويت وكله علشان عديمي الاخلاق الاختين الماسخين اللي دمهم ثقيل المرتزقه عملو ارهاب للحكام مافيش عدل حرام عليكم يا حكام مصر تخافو من عديمي,,[],0,pending,,
mt_dial_glf_a08eec44,train,31430,DIAL_GLF,لا حول ولا قوة الا بالله ؟ ؟ والله هذي ظاهره خطيره بدت تنتشر ؟ ؟ اخ انور نريد تحقيقات صحفيه من جازان ؟,لا حول ولا قوه الا بالله والله هذي ظاهره خطيره بدت تنتشر اخ انور نريد تحقيقات صحفيه من جازان,,[],0,pending,,
mt_dial_lev_562b5593,train,45446,DIAL_LEV,المهم الدوري ازرق للزعيم وما بدنا اكثر من هيك ونحن كجمهور الفيصلي نلتف كلنا حوله وحول ادارته الرائعة والاعرق في,المهم الدوري ازرق للزعيم وما بدنا اكثر من هيك ونحن كجمهور الفيصلي نلتف كلنا حوله وحول ادارته الرايعه والاعرق في,,[],0,pending,,
mt_msa_672c4247,train,63590,MSA,حتى الا اموات بعضهم لم يننعم بالبقاء فى,حتي الا اموات بعضهم لم يننعم بالبقاء في,,[],0,pending,,
mt_dial_egy_ad8e011b,train,68929,DIAL_EGY,أتحداك أن تكتب أى موضوع لنقد لكنيسة عارف ليه عشان المم إنت مش بتقبض من هناك حلال عليك صليبك تتربى فى,اتحداك ان تكتب اي موضوع لنقد لكنيسه عارف ليه عشان المم انت مش بتقبض من هناك حلال عليك صليبك تتربي في,,[],0,pending,,
mt_dial_glf_d49ec479,train,36194,DIAL_GLF,الحين صارت اخطاء سامي انه مثقف بعده,الحين صارت اخطاء سامي انه مثقف بعده,,[],0,pending,,
mt_dial_lev_4f5aa1b3,train,54340,DIAL_LEV,يعني نهاية المقال بتحسس البني ادم انه بنحكي عن شارع من شوارع باريس انامن سكان عمان بس درست بالجامعة الهاشمية فكنت مرات انزل عليه وبصراحة صراحة لازم يتسمى شارع التعاسة ! !,يعني نهايه المقال بتحسس البني ادم انه بنحكي عن شارع من شوارع باريس انامن سكان عمان بس درست بالجامعه الهاشميه فكنت مرات انزل عليه وبصراحه صراحه لازم يتسمي شارع التعاسه,,[],0,pending,,
mt_msa_578e0df5,train,2744,MSA,هل تعتقد انها في ظل مستواها الحالي تستطيع ان تفعل شيئا ؟ ؟,هل تعتقد انها في ظل مستواها الحالي تستطيع ان تفعل شييا,,[],0,pending,,
mt_dial_egy_fb491cb9,train,11689,DIAL_EGY,العار عارك فان كان نظام التعيين شئ موروث فما ذنب الازهر فهل كافحت وناضلت وسجنت من اجل تغيير هذا الارث ولاهى فرقعة للشهرة وما دخل الاقباط والشيعة ولاانت بتروج لهم وليه,العار عارك فان كان نظام التعيين شي موروث فما ذنب الازهر فهل كافحت وناضلت وسجنت من اجل تغيير هذا الارث ولاهي فرقعه للشهره وما دخل الاقباط والشيعه ولاانت بتروج لهم وليه,,[],0,pending,,
mt_dial_glf_dd184c12,train,48670,DIAL_GLF,يا اهالي الأحساء احمدوا ربكم انها دبابات مو هايلوكسات وربوع وقليل من,يا اهالي الاحساء احمدوا ربكم انها دبابات مو هايلوكسات وربوع وقليل من,,[],0,pending,,
mt_dial_lev_2a997e57,train,61654,DIAL_LEV,مش بدكو تطبعو من اسرائيل بدل ما تدعمو المزارع,مش بدكو تطبعو من اسراييل بدل ما تدعمو المزارع,,[],0,pending,,
mt_msa_5cd44c90,train,21927,MSA,لعب اتحاد مكشوف رفعات من نور لزيايه,لعب اتحاد مكشوف رفعات من نور لزيايه,,[],0,pending,,
mt_dial_egy_55bf8100,train,81219,DIAL_EGY,أنا إعتذرت لأيمن نور على كلام صاحب الغرزة دى وللعلم ده اكيد من الناس اللى إحتلت بورسعيد بعد الهجره وبالتالى لا ننسى إن بورسعيد بتتحارب النهاردة فى رزق البقية المتبقية من الشعب,انا اعتذرت لايمن نور علي كلام صاحب الغرزه دي وللعلم ده اكيد من الناس اللي احتلت بورسعيد بعد الهجره وبالتالي لا ننسي ان بورسعيد بتتحارب النهارده في رزق البقيه المتبقيه من الشعب,,[],0,pending,,
mt_dial_glf_43beb2f9,train,36972,DIAL_GLF,والله ان شوفتك ياشبيهالريح هي,والله ان شوفتك ياشبيهالريح هي,,[],0,pending,,
mt_dial_lev_2b61fa6c,train,5270,DIAL_LEV,السلاح الابيض صار الو موضه كمان احسن من السلاح الاسود ( المسدس ) طيب السوأل شو دخل السيارات الواقفه واصحابها والله حرام مليح ما تصاوب اي شخص من الماره في الطريق والله مصايب اخر زمن يامثبت العقل والدين يا عالم والله حرام,السلاح الابيض صار الو موضه كمان احسن من السلاح الاسود المسدس طيب السوال شو دخل السيارات الواقفه واصحابها والله حرام مليح ما تصاوب اي شخص من الماره في الطريق والله مصايب اخر زمن يامثبت العقل والدين يا عالم والله حرام,,[],0,pending,,
mt_msa_e127769a,train,59873,MSA,( التعليم / البنين تحت مكتب التعليم والآن إدارة,التعليم البنين تحت مكتب التعليم والان اداره,,[],0,pending,,
mt_dial_egy_79b95f55,train,23960,DIAL_EGY,يا اما لديه صديقة مخلصة تصرف,يا اما لديه صديقه مخلصه تصرف,,[],0,pending,,
mt_dial_glf_80c18b95,train,40786,DIAL_GLF,لماذا يباع ومنه المستفيد من بيعه ؟,لماذا يباع ومنه المستفيد من بيعه,,[],0,pending,,
mt_dial_lev_fa03093a,train,6372,DIAL_LEV,اذا الشاب بيكون على علاقة ببنت وبيروح وبيطلبها والاهل بيرفضوا . . ليش . . ؟ ؟ ؟ لانو تخلفهم بيحكي انو الحلال مش ماشي حالو لازم لازم يوقع الشاب والبنت بالحرام وبالاخر يطخوها علشان الاهل يقتنعوا انو اللي عملوا غلط . . . متى رح تتغير النظرة للبنت . . . متى . . متى . . ؟ ؟,اذا الشاب بيكون علي علاقه ببنت وبيروح وبيطلبها والاهل بيرفضوا ليش لانو تخلفهم بيحكي انو الحلال مش ماشي حالو لازم لازم يوقع الشاب والبنت بالحرام وبالاخر يطخوها علشان الاهل يقتنعوا انو اللي عملوا غلط متي رح تتغير النظره للبنت متي متي,,[],0,pending,,
mt_msa_9a0f5a4c,train,16096,MSA,استغرب منكم انتم الوحداتيون كلامكم عن,استغرب منكم انتم الوحداتيون كلامكم عن,,[],0,pending,,
mt_dial_egy_1d10e215,train,52528,DIAL_EGY,لا هم محتاجينها مني ولا أنا,لا هم محتاجينها مني ولا انا,,[],0,pending,,
mt_dial_glf_d7dfad4a,train,40541,DIAL_GLF,الي مبزوط في بيت اهله اول المدرسين يوقفونه عند حده بالمدرسه هذاك ببيت اهلك تبزوط هنا,الي مبزوط في بيت اهله اول المدرسين يوقفونه عند حده بالمدرسه هذاك ببيت اهلك تبزوط هنا,,[],0,pending,,
mt_dial_lev_f913f5cd,train,39368,DIAL_LEV,فلماذا لا توضع ضريبة ؟ أولا الدولة تستفيد و أيضا المواطن يفكر قبل ما يتصل بدون حاجة خلى الناس تصرف على بيوتها والله أنا أعرف ناس يدفعون الفواتير و بطاقات شحن على حساب أساسيات لحياه و نهاية الشهر يشحد ! ! الضريبة حل رادع جدا جدا و أنا مؤيد 100 % ! و من جاب أخلاقي توفير خدمة كالموبايل وفرت العديد من الوسائل الغير أخلاقية للعديد من الشباب و الشابات فرصه نرجع نصحى على أنفسنا ! حيث أن الإحصائيات تقول أن عدد مستخدمين الموبايل في سات بعد منتصف الليل و بين فئة الشباب . . . و العديد و ليس الكل يستخدمونه إستخدام منافي للأخلاق و الشرع و,فلماذا لا توضع ضريبه اولا الدوله تستفيد و ايضا المواطن يفكر قبل ما يتصل بدون حاجه خلي الناس تصرف علي بيوتها والله انا اعرف ناس يدفعون الفواتير و بطاقات شحن علي حساب اساسيات لحياه و نهايه الشهر يشحد الضريبه حل رادع جدا جدا و انا مويد 100 و من جاب اخلاقي توفير خدمه كالموبايل وفرت العديد من الوسايل الغير اخلاقيه للعديد من الشباب و الشابات فرصه نرجع نصحي علي انفسنا حيث ان الاحصاييات تقول ان عدد مستخدمين الموبايل في سات بعد منتصف الليل و بين فيه الشباب و العديد و ليس الكل يستخدمونه استخدام منافي للاخلاق و الشرع و,,[],0,pending,,
mt_msa_69b26abc,train,3347,MSA,قتل عمد و إزهاق روح من أجل خلافات زوجية و النتيجة 7 سنين و نصف في,قتل عمد و ازهاق روح من اجل خلافات زوجيه و النتيجه 7 سنين و نصف في,,[],0,pending,,
mt_dial_egy_335b073f,train,60527,DIAL_EGY,فين تعليق الدكتوره نيفين شكرى على البرادعى أو البردعى ماهو ياعينى جاتلكم أرتيكاريا من أى حاجه فيها بردعه ومش بعيد حزبكم يمنع العربجيه من,فين تعليق الدكتوره نيفين شكري علي البرادعي او البردعي ماهو ياعيني جاتلكم ارتيكاريا من اي حاجه فيها بردعه ومش بعيد حزبكم يمنع العربجيه من,,[],0,pending,,
mt_dial_glf_10c4578e,train,68313,DIAL_GLF,يستاهل الزعيم وان شاء الله مركز متقدم,يستاهل الزعيم وان شاء الله مركز متقدم,,[],0,pending,,
mt_dial_lev_230d0d35,train,38905,DIAL_LEV,اكيد بدها ترتفع من هالسيارات الي الي,اكيد بدها ترتفع من هالسيارات الي الي,,[],0,pending,,
