example_id,source_split,source_row_id,dialect,original_text,normalized_text,masked_text,mask_spans_json,mask_count,annotation_status,annotator_model,notes
mt_dial_egy_453f51f4,train,5862,DIAL_EGY,ابرأهيم حسن راجل غصب عن الحاقدين كفايه حقد علي ابراهيم وحسام وعلي الزمالك بقي كفايه عليكوا الحكام بتعطي ليكوا الدوري كل سنه حتي الحقد باين من كتابت كل واحد فيكم افهم كرة يابني وتعالوا اتكلموا سيبكوا من النفاق بقي الزمالك رجاله وحسام وابراهيم,ابراهيم حسن راجل غصب عن الحاقدين كفايه حقد علي ابراهيم وحسام وعلي الزمالك بقي كفايه عليكوا الحكام بتعطي ليكوا الدوري كل سنه حتي الحقد باين من كتابت كل واحد فيكم افهم كره يابني وتعالوا اتكلموا سيبكوا من النفاق بقي الزمالك رجاله وحسام وابراهيم,,[],0,pending,,
mt_dial_glf_e6dadd25,train,14208,DIAL_GLF,ميزانيتنا تكفي عشر دول وشبابنا ضايع اللي عاطل واللي مرتبه 1800 ماتغسل ملابسه لمده,ميزانيتنا تكفي عشر دول وشبابنا ضايع اللي عاطل واللي مرتبه 1800 ماتغسل ملابسه لمده,,[],0,pending,,
mt_dial_lev_14c0f05b,train,40826,DIAL_LEV,بس بدي اعرف بأي منطق واحد من البسطاء بدو يعمل شركة بسيطة برأس مال الف دينار بدو يهز سوق العقار وهذا يدل فعلا على تجار وخبراء هم من اساء لنا والى اقتصادنا,بس بدي اعرف باي منطق واحد من البسطاء بدو يعمل شركه بسيطه براس مال الف دينار بدو يهز سوق العقار وهذا يدل فعلا علي تجار وخبراء هم من اساء لنا والي اقتصادنا,,[],0,pending,,
mt_msa_2defbca4,train,27420,MSA,تلقى الواحد عمره 18 ولا,تلقي الواحد عمره 18 ولا,,[],0,pending,,
mt_dial_egy_242d019c,train,39815,DIAL_EGY,مرتضى منصور _ استاذ_ لانه عرف يقول كل الى عنده وبكل هدوء فى وقت كانت ردود شوبير الغير مقنعه والمستفزه احيانا وعرف كمان يغلطه ادام العالم ويجيب الحق ليه قبل ما يمشى لا بجد,مرتضي منصور _ استاذ_ لانه عرف يقول كل الي عنده وبكل هدوء في وقت كانت ردود شوبير الغير مقنعه والمستفزه احيانا وعرف كمان يغلطه ادام العالم ويجيب الحق ليه قبل ما يمشي لا بجد,,[],0,pending,,
mt_dial_glf_7a5c5454,train,81822,DIAL_GLF,لان مثل هالدوات تثقف الشخص بحياته بشكل عام,لان مثل هالدوات تثقف الشخص بحياته بشكل عام,,[],0,pending,,
mt_dial_lev_09301b43,train,79288,DIAL_LEV,عموما مافيه داعي وفهمنا الدرس اصلا حتى لو ماارتفع راح ترفعوا,عموما مافيه داعي وفهمنا الدرس اصلا حتي لو ماارتفع راح ترفعوا,,[],0,pending,,
mt_msa_734fda64,train,55544,MSA,ثانيا : اياك وأعراض العلماء ، هل تعرفين نية الشيخ خالد الجندي في ذلك ( وهي طيبة ان شاء الله,ثانيا اياك واعراض العلماء هل تعرفين نيه الشيخ خالد الجندي في ذلك وهي طيبه ان شاء الله,,[],0,pending,,
mt_dial_egy_84151cc7,train,69522,DIAL_EGY,بتهمة اعمال البطلجة واثارة الجماهير والشغب اه,بتهمه اعمال البطلجه واثاره الجماهير والشغب اه,,[],0,pending,,
mt_dial_glf_1fd50f69,train,86251,DIAL_GLF,لاوالله الا راحت سلوم الرجال - - - وشبابنا تقليد الغرب,لاوالله الا راحت سلوم الرجال وشبابنا تقليد الغرب,,[],0,pending,,
mt_dial_lev_36cf7a39,train,5743,DIAL_LEV,ما حدا بعرف شو وضع العيله . . . دقة بدقة ولو زدت لزاد السقا . . . هذا الانسان ( الاب ) عمل جريمتين زنا المحارم وقتل بنته و ابن بنته . . يا ترى شو حكمه شرعا . . طيب المحكمة شو رح تحكمه . . . اعدام بكفيه ؟ ؟ ؟ طيب اذا كان مريض نفسي ذنبه اللي عمله ؟ ؟ طيب وين مرته ؟ ؟ او بنته ؟ ؟,ما حدا بعرف شو وضع العيله دقه بدقه ولو زدت لزاد السقا هذا الانسان الاب عمل جريمتين زنا المحارم وقتل بنته و ابن بنته يا تري شو حكمه شرعا طيب المحكمه شو رح تحكمه اعدام بكفيه طيب اذا كان مريض نفسي ذنبه اللي عمله طيب وين مرته او بنته,,[],0,pending,,
mt_msa_aa7fd166,train,38338,MSA,ساعة الصفر تقترب أكتر فأكثر . . . و ما زلتم تحتمون في جنود الأمن المركزي . . . لكن لو خرج الشعب فسيعلم الذين ظلموا أي منقلب سوف ينقلبون !,ساعه الصفر تقترب اكتر فاكثر و ما زلتم تحتمون في جنود الامن المركزي لكن لو خرج الشعب فسيعلم الذين ظلموا اي منقلب سوف ينقلبون,,[],0,pending,,
mt_dial_egy_15002b58,train,17788,DIAL_EGY,إرحموا بناتنا وزوجاتنا من التحرش بيهم وضربهم على مؤخراتهم من الشباب اللى راكب موتوسيكلات بدون,ارحموا بناتنا وزوجاتنا من التحرش بيهم وضربهم علي موخراتهم من الشباب اللي راكب موتوسيكلات بدون,,[],0,pending,,
mt_dial_glf_f9f5c22c,train,41754,DIAL_GLF,ياهلال النعيمة يستحق اكثر من كده يجب على رجل الهلال الوقوف مع هذا,ياهلال النعيمه يستحق اكثر من كده يجب علي رجل الهلال الوقوف مع هذا,,[],0,pending,,
mt_dial_lev_0e8e34df,train,3929,DIAL_LEV,هاذا الهجوم اسموا ارهاب وهم ارهابيون وحشيون ولا ااقولكم غلط لانهم مش عرب او مسلمين خ حسبنا الله ونعم الوكيل ماهوه مفهوم الارهاب بس على المسلمين والعرب والباقي,هاذا الهجوم اسموا ارهاب وهم ارهابيون وحشيون ولا ااقولكم غلط لانهم مش عرب او مسلمين خ حسبنا الله ونعم الوكيل ماهوه مفهوم الارهاب بس علي المسلمين والعرب والباقي,,[],0,pending,,
mt_msa_c62ce8ce,train,71029,MSA,العراق في كل فترة من الفترات يتعرض الى غزوا ولكن الحب الموجود في داخل الانسان العراقي الى ارض العراق اقوى من الاحتلال واقوى من الذي يحاول ان يتاجر بحب العراق مثل الزيدي الذي عرض مهنة القلم الى الذل من اجل الحصول على الشهرة المقاومة من خلال الكلمة الشريفة ومن خلال الحب الحقيقي للعراق وليس من خلال حب المال,العراق في كل فتره من الفترات يتعرض الي غزوا ولكن الحب الموجود في داخل الانسان العراقي الي ارض العراق اقوي من الاحتلال واقوي من الذي يحاول ان يتاجر بحب العراق مثل الزيدي الذي عرض مهنه القلم الي الذل من اجل الحصول علي الشهره المقاومه من خلال الكلمه الشريفه ومن خلال الحب الحقيقي للعراق وليس من خلال حب المال,,[],0,pending,,
mt_dial_egy_e67ada33,train,78432,DIAL_EGY,ادينى فى الهايف وانا احبك,اديني في الهايف وانا احبك,,[],0,pending,,
mt_dial_glf_ec99fab2,train,11545,DIAL_GLF,والله هذي اخرتها لما نسكت عن الأخطاء,والله هذي اخرتها لما نسكت عن الاخطاء,,[],0,pending,,
mt_dial_lev_82548a66,train,56726,DIAL_LEV,شكرا لان الكل نفسه ينقذ موسمه بكاس الخواطر بعدين الفيصلي زهق البطولات وحتا خارجيا شباب الاردن اخد بطولات والوحدات لسا ما اخد وبتحكو انو اقوا من الفيصلي يلا يا عبد المنعم خلينا نسمع تعليقاتك كاس اسيا واخدنا والعرب واخدنا ايش بدنا كمان يلا,شكرا لان الكل نفسه ينقذ موسمه بكاس الخواطر بعدين الفيصلي زهق البطولات وحتا خارجيا شباب الاردن اخد بطولات والوحدات لسا ما اخد وبتحكو انو اقوا من الفيصلي يلا يا عبد المنعم خلينا نسمع تعليقاتك كاس اسيا واخدنا والعرب واخدنا ايش بدنا كمان يلا,,[],0,pending,,
mt_msa_1166b634,train,82891,MSA,نسال الله الشفاء لامتنا الاسلاميه والعربيه من المرض والمرض,نسال الله الشفاء لامتنا الاسلاميه والعربيه من المرض والمرض,,[],0,pending,,
mt_dial_egy_696267cd,train,35606,DIAL_EGY,لا أحسن خلي الناس الهايفة والجاهلة يتاحكموا في مصير 80 مليون ( جاهل فاسد ولا عالم فاسد ه ) وبعدين هم مين النواب الفلاحين والعمال انت شفتهم دي نسبه محسوبة على الفاضي ولا ليها وجود كلام على الورق بس حلاوة روح من روح زمان ايه رأيكم نخلي نسبة للفلاحين ونسبة للعمال ونسمة للموظفين القطاع العام ونسبة للقطاع ونسبة للمسلمين ونسبة للمسحين ونسبة للفشلين ونسبة للناجحين ونسبة للمرأة ونسبة لرجل ونسبة للعيال عشان امهم ماتزعلش جاتكم خيبة هي دي مصر ومصرين ولا تقسمة انت من هنا وانا من هناك اللي يخدم يخدم مصر وصالح البلد مش يكون راجل رايح فين رايح الماجلس جاي منين جاي من المجلس لا ياعم انا ماليش دعوة انا نايب عن الفلاح ماليش دعوة دي مشكلة ماتخصنيش . . . وبعدين تعليق اللي كاتب وبيقول انه على الكمبيوتروالتويتروالفيس بوك طيب ومالوا لما يكون قادر يتواصل مع الناس اللي ليها علاقة بالحاجات دي ولا خليه احسن وراء الجموسة يحلب فيها - والله ممكن تلاقي نصهم ما قرا الدستور ولا القانون ولا اي حاجة وداخلها بعصبية ولا قبلية شغل عائلات يعني ولا تبع الحزب واطي . . . تتلغي كل التقسيمات ومايجيش حد تبع كوتة أو نظام مفروض على الناس ويتم الأنتخاب حسب المناطق فقط وبدون اي تقسيمات او اتجاهات مفروضة على الناس وبلاش المسميات الرنانة والخايبة - عمال وفلاحين هو انتم خاليتم في مصر غير,لا احسن خلي الناس الهايفه والجاهله يتاحكموا في مصير 80 مليون جاهل فاسد ولا عالم فاسد ه وبعدين هم مين النواب الفلاحين والعمال انت شفتهم دي نسبه محسوبه علي الفاضي ولا ليها وجود كلام علي الورق بس حلاوه روح من روح زمان ايه رايكم نخلي نسبه للفلاحين ونسبه للعمال ونسمه للموظفين القطاع العام ونسبه للقطاع ونسبه للمسلمين ونسبه للمسحين ونسبه للفشلين ونسبه للناجحين ونسبه للمراه ونسبه لرجل ونسبه للعيال عشان امهم ماتزعلش جاتكم خيبه هي دي مصر ومصرين ولا تقسمه انت من هنا وانا من هناك اللي يخدم يخدم مصر وصالح البلد مش يكون راجل رايح فين رايح الماجلس جاي منين جاي من المجلس لا ياعم انا ماليش دعوه انا نايب عن الفلاح ماليش دعوه دي مشكله ماتخصنيش وبعدين تعليق اللي كاتب وبيقول انه علي الكمبيوتروالتويتروالفيس بوك طيب ومالوا لما يكون قادر يتواصل مع الناس اللي ليها علاقه بالحاجات دي ولا خليه احسن وراء الجموسه يحلب فيها والله ممكن تلاقي نصهم ما قرا الدستور ولا القانون ولا اي حاجه وداخلها بعصبيه ولا قبليه شغل عايلات يعني ولا تبع الحزب واطي تتلغي كل التقسيمات ومايجيش حد تبع كوته او نظام مفروض علي الناس ويتم الانتخاب حسب المناطق فقط وبدون اي تقسيمات او اتجاهات مفروضه علي الناس وبلاش المسميات الرنانه والخايبه عمال وفلاحين هو انتم خاليتم في مصر غير,,[],0,pending,,
mt_dial_glf_da202a22,train,20899,DIAL_GLF,لكن ابشرك امورك محلولة بما ان المباراة القادمة امام الهلال وإلا صدقني لتبطي عظم ماخذت حقوقك . . وزيك زي الكوري,لكن ابشرك امورك محلوله بما ان المباراه القادمه امام الهلال والا صدقني لتبطي عظم ماخذت حقوقك وزيك زي الكوري,,[],0,pending,,
mt_dial_lev_baf9981a,train,32383,DIAL_LEV,عبد السلام قتل عمد وليس خطأ كل يوم بطلعوا قصة جديدة مش عارفين شو بدهم يحكوا طبعا مهو الموضوع . . . الله يرحمك يا عبد السلام النعيمات يا فقيد الأمة كلها لانه بالدنيا كلها ما في واحد,عبد السلام قتل عمد وليس خطا كل يوم بطلعوا قصه جديده مش عارفين شو بدهم يحكوا طبعا مهو الموضوع الله يرحمك يا عبد السلام النعيمات يا فقيد الامه كلها لانه بالدنيا كلها ما في واحد,,[],0,pending,,
mt_msa_b6879b3e,train,33417,MSA,الحمدلالله رجع السيف رمز العز والشجاعة الى دارة نجد موحد الجزيرة العربية وأهنيك ياخادم الحرمين برجوع الاجرب الى بلاد,الحمدلالله رجع السيف رمز العز والشجاعه الي داره نجد موحد الجزيره العربيه واهنيك ياخادم الحرمين برجوع الاجرب الي بلاد,,[],0,pending,,
mt_dial_egy_fae3396f,train,62555,DIAL_EGY,ياعم الزملكاوي خليك في كوزك لما,ياعم الزملكاوي خليك في كوزك لما,,[],0,pending,,
mt_dial_glf_37597775,train,16633,DIAL_GLF,"تقول فيه ريتك توفي بالقسم بعدرقم . . "" الحسابا",تقول فيه ريتك توفي بالقسم بعدرقم الحسابا,,[],0,pending,,
mt_dial_lev_a586382a,train,38478,DIAL_LEV,والنتيجة بدها تخطيط يا عطوفة الامين .,والنتيجه بدها تخطيط يا عطوفه الامين,,[],0,pending,,
mt_msa_d34736db,train,40697,MSA,تلاقي أولها التعليم العالي والتدريب مصر 88 الحزائر,تلاقي اولها التعليم العالي والتدريب مصر 88 الحزاير,,[],0,pending,,
mt_dial_egy_3022ea92,train,37481,DIAL_EGY,بجد عيب اوي عليكم انكم تعملو موضوع سخيف زي ده ، ، واللي اسخف الصور اللي ملهاش اي علاقه بالموضوع ، دي صور ناس بتضحك مع بعضها وواحد وخطيبته وواحد مع العيله بتاعته,بجد عيب اوي عليكم انكم تعملو موضوع سخيف زي ده واللي اسخف الصور اللي ملهاش اي علاقه بالموضوع دي صور ناس بتضحك مع بعضها وواحد وخطيبته وواحد مع العيله بتاعته,,[],0,pending,,
mt_dial_glf_6c9eddac,train,69050,DIAL_GLF,وبعدين تخفف من زحمه خط جده الى,وبعدين تخفف من زحمه خط جده الي,,[],0,pending,,
mt_dial_lev_6ee01e6f,train,72398,DIAL_LEV,والله لو بثت كل البطوله مجاني والله غير تربح اضعاف الي راح تربحه وهي مش مجاني لانه راح يوصل لكل العالم وشوف الدعايات راح تشتغل صح والشركات كبيره وعالميه راح تتهافت لانه بهبمهم اعلانهم يوصل لاكبر شريحه من الناس هاد ازا مش كله . بس قناة عربيه ما بتفكر بطريقه سليمه ولا بتفكر ابعد من هيك غير باطماعها واسلوبها الي ما بعرف شو ممكن الواحد يحكي عنه والباقي,والله لو بثت كل البطوله مجاني والله غير تربح اضعاف الي راح تربحه وهي مش مجاني لانه راح يوصل لكل العالم وشوف الدعايات راح تشتغل صح والشركات كبيره وعالميه راح تتهافت لانه بهبمهم اعلانهم يوصل لاكبر شريحه من الناس هاد ازا مش كله بس قناه عربيه ما بتفكر بطريقه سليمه ولا بتفكر ابعد من هيك غير باطماعها واسلوبها الي ما بعرف شو ممكن الواحد يحكي عنه والباقي,,[],0,pending,,
mt_msa_6232614a,train,85710,MSA,لاعبوا الوحدات كبار حتى ناشيئينهم,لاعبوا الوحدات كبار حتي ناشييينهم,,[],0,pending,,
mt_dial_egy_c7a80a85,train,74884,DIAL_EGY,لماذا انت دائم الحديث عالفاضية و المليانه ؟,لماذا انت دايم الحديث عالفاضيه و المليانه,,[],0,pending,,
mt_dial_glf_e123f816,train,24452,DIAL_GLF,تدري ان الشي الوحيد اللي ناقص كتابتك هذي هو اغنيه,تدري ان الشي الوحيد اللي ناقص كتابتك هذي هو اغنيه,,[],0,pending,,
mt_dial_lev_c1ba6a31,train,67134,DIAL_LEV,فعلا اول يوم بوصل فيه بقعد مع الاهل وتاني يوم مباشره بروح على شارع,فعلا اول يوم بوصل فيه بقعد مع الاهل وتاني يوم مباشره بروح علي شارع,,[],0,pending,,
mt_msa_5af4ec03,train,21391,MSA,الوحدات في اخر خمس مواسم احرز بطوله الدوري اربع مرات ( منها ثلاث سنوات متتاليه ) و لكنه ابدا لم يحرز الدوري لخمس سنوات متتاليه الا اذا اعتبرت انت ان نادي شباب الاردن هو نادي الوحدات,الوحدات في اخر خمس مواسم احرز بطوله الدوري اربع مرات منها ثلاث سنوات متتاليه و لكنه ابدا لم يحرز الدوري لخمس سنوات متتاليه الا اذا اعتبرت انت ان نادي شباب الاردن هو نادي الوحدات,,[],0,pending,,
mt_dial_egy_2476a330,train,82639,DIAL_EGY,شوفوا بقي التجسس وصل لدرجة اية انهم بيبعتوا حواسسهم علي انهم صحفيون علشان اللي يتمسك بعد كدة يبقي صحفي وجاي يعمل تحقيق حد يقدر يروح من المصريين ويعمل كدة ويدخل كنسهم ويعرف هما بيعملوا اية اوبيخططوا لايةربنا يسترها معانامع العلم دي اللي مش سيابة اي فرصة لمحاربتنا,شوفوا بقي التجسس وصل لدرجه ايه انهم بيبعتوا حواسسهم علي انهم صحفيون علشان اللي يتمسك بعد كده يبقي صحفي وجاي يعمل تحقيق حد يقدر يروح من المصريين ويعمل كده ويدخل كنسهم ويعرف هما بيعملوا ايه اوبيخططوا لايهربنا يسترها معانامع العلم دي اللي مش سيابه اي فرصه لمحاربتنا,,[],0,pending,,
mt_dial_glf_338898db,train,44955,DIAL_GLF,ياأخي . . . ياما ترتكب محظورات باسم واستخدام الغطاء . . . الشيخ الالباني الله يرحمه يقول لايجوز ارغام البنت على تغطية الوجه فيجب مراجعة استخدامه وكذلك تعميم بطاقة المرأة بما فيها الصورة لعدم استغلال,يااخي ياما ترتكب محظورات باسم واستخدام الغطاء الشيخ الالباني الله يرحمه يقول لايجوز ارغام البنت علي تغطيه الوجه فيجب مراجعه استخدامه وكذلك تعميم بطاقه المراه بما فيها الصوره لعدم استغلال,,[],0,pending,,
mt_dial_lev_85befb22,train,68015,DIAL_LEV,""" يعني انا لما اروح اشتري لمبة حقها 3 . 6 دينار ببطل اشتريها لانوا سعرها غالي",يعني انا لما اروح اشتري لمبه حقها 3 6 دينار ببطل اشتريها لانوا سعرها غالي,,[],0,pending,,
mt_msa_487e5bf1,train,26887,MSA,في رايي انه شيء رائع على كل المستويات حينما يكون الشخص المناسب في المكان ( المنصب ) المناسب لأنه بذلك يكون مكسبا وطنيا وقوميا لايقدر بثمن .,في رايي انه شيء رايع علي كل المستويات حينما يكون الشخص المناسب في المكان المنصب المناسب لانه بذلك يكون مكسبا وطنيا وقوميا لايقدر بثمن,,[],0,pending,,
mt_dial_egy_ef47d94b,train,29430,DIAL_EGY,اظاهر احنا عايزين شعب من برة يقوملنا بالتغيير و يروح بلده,اظاهر احنا عايزين شعب من بره يقوملنا بالتغيير و يروح بلده,,[],0,pending,,
mt_dial_glf_35e200d1,train,13920,DIAL_GLF,بس ماعمري شفت فريق يخسر بخمسه مرتين ف اسبوع مثل الهلال و 13 سنه بدون بطوله و 10 سنوات بدون بطوله خارجيه وبدون عالميه,بس ماعمري شفت فريق يخسر بخمسه مرتين ف اسبوع مثل الهلال و 13 سنه بدون بطوله و 10 سنوات بدون بطوله خارجيه وبدون عالميه,,[],0,pending,,
mt_dial_lev_e00f99ac,train,68233,DIAL_LEV,بكرة بنغلبو الوحدات من الرفاع البحريني وبيجو يحكو والله انهم قويين ومش قادرين,بكره بنغلبو الوحدات من الرفاع البحريني وبيجو يحكو والله انهم قويين ومش قادرين,,[],0,pending,,
mt_msa_edb581ad,train,25147,MSA,وهنا يكمن خطا الاخوان الوحيد والاستراتيجى منذ اكثر من ثمانون عام وحتى الان فى انهم يتصورون انهم امام حكومات ديمقراطية منذ ثمانون,وهنا يكمن خطا الاخوان الوحيد والاستراتيجي منذ اكثر من ثمانون عام وحتي الان في انهم يتصورون انهم امام حكومات ديمقراطيه منذ ثمانون,,[],0,pending,,
mt_dial_egy_84223ac3,train,2009,DIAL_EGY,الحرام باين والحلال باين بمعنى ان كل انسان مسؤول عن مصيره سواء اختار يعيش فى نور او ظلامات فى الاول والاخر ( ربنا سبحانه وتعالى ) هو بس ليه الحق فى محاكمتهم سواء نار او جنه مش شويه ( ناس,الحرام باين والحلال باين بمعني ان كل انسان مسوول عن مصيره سواء اختار يعيش في نور او ظلامات في الاول والاخر ربنا سبحانه وتعالي هو بس ليه الحق في محاكمتهم سواء نار او جنه مش شويه ناس,,[],0,pending,,
mt_dial_glf_0d7d596b,train,20816,DIAL_GLF,تكفون أي واحد يشوف رسالتي يدعي لي بانهم,تكفون اي واحد يشوف رسالتي يدعي لي بانهم,,[],0,pending,,
mt_dial_lev_c8a46015,train,29646,DIAL_LEV,ما شاركنا في ارباحكم لحتى نشارك في الخسارة . . . الله يحميك يا اردن وتكون قادر على سد الدين في اسرع وقت وانشاءالله بيتحسن الوضع الاقتصادي في,ما شاركنا في ارباحكم لحتي نشارك في الخساره الله يحميك يا اردن وتكون قادر علي سد الدين في اسرع وقت وانشاءالله بيتحسن الوضع الاقتصادي في,,[],0,pending,,
