example_id,source_split,source_row_id,dialect,original_text,normalized_text,masked_text,mask_spans_json,mask_count,annotation_status,annotator_model,notes
mt_dial_lev_15295bb3,train,41380,DIAL_LEV,رنوش حياتى ربنا يوفقك يا رب تعملى احلى شغل انتى بجد موهبة حقيقية وصوتك تحفة وجميل جدا فى الطربى والخفيف وعندك كاريزما ووجه يخطف المشاهد والكاميرا وروح حلوة ودلع وخفة دم مش موجوده غير فى البنت المصرية مواه حبيبة قلبى اتمنالك التوفيق فى كل اختياراتك والنجاح دايما يا,رنوش حياتي ربنا يوفقك يا رب تعملي احلي شغل انتي بجد موهبه حقيقيه وصوتك تحفه وجميل جدا في الطربي والخفيف وعندك كاريزما ووجه يخطف المشاهد والكاميرا وروح حلوه ودلع وخفه دم مش موجوده غير في البنت المصريه مواه حبيبه قلبي اتمنالك التوفيق في كل اختياراتك والنجاح دايما يا,,[],0,pending,,
mt_msa_0bb853c6,train,38239,MSA,"بعد ما اصبح الشعب الأمريكي يقتني السياراة اليابانية لأنها اقتصاديه وعمليه وشكلها جذاب , لذا فإن الولايات المتحدة بدأت يتشويه سمعة الشركات اليابانيه , وفرض عليها غرامات لكي توقف الزحف الياباني ايضاً لكي تسوق منتجاتها .",بعد ما اصبح الشعب الامريكي يقتني السياراه اليابانيه لانها اقتصاديه وعمليه وشكلها جذاب لذا فان الولايات المتحده بدات يتشويه سمعه الشركات اليابانيه وفرض عليها غرامات لكي توقف الزحف الياباني ايضا لكي تسوق منتجاتها,,[],0,pending,,
mt_dial_egy_1b9d2c88,train,38488,DIAL_EGY,يعني حي جميل كالحي الملاصق لجامعة كفر الشيخ ( مساكن الري او حي مبارك ) باعتباره من الاحياء الهامة نظراً لقربه الشديد من صرح علمي عملاق كجامعة كفر الشيخ والذي انقلب بقدرة قادر من حي سكني الى حي تجاري غاية في الاتساخ حيث نجده يئن ويعاني من القمامة المبعثرة على الاسفلت وبين العمارات وامام المحلات وكانها منطقة ليس بها بشر,يعني حي جميل كالحي الملاصق لجامعه كفر الشيخ مساكن الري او حي مبارك باعتباره من الاحياء الهامه نظرا لقربه الشديد من صرح علمي عملاق كجامعه كفر الشيخ والذي انقلب بقدره قادر من حي سكني الي حي تجاري غايه في الاتساخ حيث نجده يين ويعاني من القمامه المبعثره علي الاسفلت وبين العمارات وامام المحلات وكانها منطقه ليس بها بشر,,[],0,pending,,
mt_dial_glf_37973f26,train,65299,DIAL_GLF,انتم ما تفهموون الادلة اللي يجيببيها قبل التحريم . . ! ! اتمنى للناس انهم ما يصدقون كلامة ماراح يصدقه الا القلوب الضعيفة . . ياخي الله يقويك مش بناتك ب بكيني ودرسهم باللي تبي بس ماتجي تفتي على,انتم ما تفهموون الادله اللي يجيببيها قبل التحريم اتمني للناس انهم ما يصدقون كلامه ماراح يصدقه الا القلوب الضعيفه ياخي الله يقويك مش بناتك ب بكيني ودرسهم باللي تبي بس ماتجي تفتي علي,,[],0,pending,,
mt_dial_lev_f944b22b,train,50288,DIAL_LEV,مثلا كم عدد وسائد الهواء وطريقه عملها اواي معلومات عن انظمه السلامه في,مثلا كم عدد وسايد الهواء وطريقه عملها اواي معلومات عن انظمه السلامه في,,[],0,pending,,
mt_msa_f8548939,train,39742,MSA,لا داعي من نشر أخبار بهذه الصورة ، ليحاكم دون أن يعرف المواطن بهذه الأشكال القذرة,لا داعي من نشر اخبار بهذه الصوره ليحاكم دون ان يعرف المواطن بهذه الاشكال القذره,,[],0,pending,,
mt_dial_egy_e09eac32,train,22032,DIAL_EGY,طيب لما إنت مش عجباك ( ما يسمى أرض الكنانة ) مالك محروق قوى كده ليه ؟ ومكلف نفسك وداخل على موقع مصرى وبدوَّر على تعليقات المصريين ليه ؟ . . ياريت تخليك مع جريدة الشرور بتاعتكم وتعيش مع الأفلام والمسلسلات إللى بيألفوها,طيب لما انت مش عجباك ما يسمي ارض الكنانه مالك محروق قوي كده ليه ومكلف نفسك وداخل علي موقع مصري وبدور علي تعليقات المصريين ليه ياريت تخليك مع جريده الشرور بتاعتكم وتعيش مع الافلام والمسلسلات اللي بيالفوها,,[],0,pending,,
mt_dial_glf_4d008258,train,81293,DIAL_GLF,الله من الشفاحه اعنبو الشيطان ماشفت خير,الله من الشفاحه اعنبو الشيطان ماشفت خير,,[],0,pending,,
mt_dial_lev_fad09f7c,train,44941,DIAL_LEV,كلام حق اريد به باطل الوحدات اول مره في تاريخ الحياه يفوز على فريق كبيره مثل الفيصلي مرتين ياأخي قبل خساره الوحدات من شباب الاردن كان الكلام كله على النادي الفيصلي ولو فاز الوحدات بالدوري كان نفس هذه الكلام بالحرف مكتوب على,كلام حق اريد به باطل الوحدات اول مره في تاريخ الحياه يفوز علي فريق كبيره مثل الفيصلي مرتين يااخي قبل خساره الوحدات من شباب الاردن كان الكلام كله علي النادي الفيصلي ولو فاز الوحدات بالدوري كان نفس هذه الكلام بالحرف مكتوب علي,,[],0,pending,,
mt_msa_ed8715af,train,78577,MSA,ولو ام الزوج عاملت الزوجه ك ( بنتها,ولو ام الزوج عاملت الزوجه ك بنتها,,[],0,pending,,
mt_dial_egy_a19f4d01,train,46718,DIAL_EGY,بس ما تخافش . . اسمع قلبك قبل,بس ما تخافش اسمع قلبك قبل,,[],0,pending,,
mt_dial_glf_8d8f9904,train,44436,DIAL_GLF,وش رايكم تصيرو انتو لجنه,وش رايكم تصيرو انتو لجنه,,[],0,pending,,
mt_dial_lev_129eda29,train,55810,DIAL_LEV,ليش يعني صارت المبارة في,ليش يعني صارت المباره في,,[],0,pending,,
mt_msa_d078242c,train,25807,MSA,لماذا كل جريمه في بدايتها لا يتم الكشف عنها,لماذا كل جريمه في بدايتها لا يتم الكشف عنها,,[],0,pending,,
mt_dial_egy_47ea419b,train,12920,DIAL_EGY,شهره وفلوش ونجوميه مهرجانات اللى تقدر تقاوم كل ده فى الزمن ده مش ممكن تبقى,شهره وفلوش ونجوميه مهرجانات اللي تقدر تقاوم كل ده في الزمن ده مش ممكن تبقي,,[],0,pending,,
mt_dial_glf_7c766197,train,44440,DIAL_GLF,من غيرت رقمي منهم لموبايلي نص الفاتوره طاحت مني وأرتحت نفسيآ بشكل كبير : ) حسافة السبع سنوات معهم أخ,من غيرت رقمي منهم لموبايلي نص الفاتوره طاحت مني وارتحت نفسيا بشكل كبير حسافه السبع سنوات معهم اخ,,[],0,pending,,
mt_dial_lev_766b1879,train,12510,DIAL_LEV,عندك الإنترنت و الفيس بوك أفضل وسيلة لحث الناس,عندك الانترنت و الفيس بوك افضل وسيله لحث الناس,,[],0,pending,,
mt_msa_050a8a14,train,84101,MSA,وأعداءالمرأه أثنان لاثالث لهماالجهل والمرأه نفسها .,واعداءالمراه اثنان لاثالث لهماالجهل والمراه نفسها,,[],0,pending,,
mt_dial_egy_df7533cc,train,42590,DIAL_EGY,لازم امريكا تتكلم والاتحاد الاوربي يتكلم عن الفساد المصري علشان نكافح الفساد ويقولوا بنعمل اصلاح داخلي دون اي تدخلات خارجيه ! ! ! طيب لوالقانون مصري واللي مقدمينه مصريين ممكن اعرف يترفض ليه ؟ ؟ ؟,لازم امريكا تتكلم والاتحاد الاوربي يتكلم عن الفساد المصري علشان نكافح الفساد ويقولوا بنعمل اصلاح داخلي دون اي تدخلات خارجيه طيب لوالقانون مصري واللي مقدمينه مصريين ممكن اعرف يترفض ليه,,[],0,pending,,
mt_dial_glf_7b491113,train,61306,DIAL_GLF,كفايه يا بها بيع نجوم الفريق وكفايه عدم صعود الفريق للمتاز اربع سنوات اخري مالذس حققته ! ! ؟,كفايه يا بها بيع نجوم الفريق وكفايه عدم صعود الفريق للمتاز اربع سنوات اخري مالذس حققته,,[],0,pending,,
mt_dial_lev_42c8ffda,train,17541,DIAL_LEV,الحق على الشاب اللي قتل البنت ومارس الجنس معها ولا على البنت اللي رضيت تمارس الرذيلة وأصرت عليها ولا على الأم اللي ماعرفت تربي بنتها ولا على مين وملا مين ؟ ؟,الحق علي الشاب اللي قتل البنت ومارس الجنس معها ولا علي البنت اللي رضيت تمارس الرذيله واصرت عليها ولا علي الام اللي ماعرفت تربي بنتها ولا علي مين وملا مين,,[],0,pending,,
mt_msa_8e314af5,train,51104,MSA,الا الرسول على الصلاة والسلام .,الا الرسول علي الصلاه والسلام,,[],0,pending,,
mt_dial_egy_03adecc8,train,33809,DIAL_EGY,ياعم اعطي النصيحة للراقصة او فنان,ياعم اعطي النصيحه للراقصه او فنان,,[],0,pending,,
mt_dial_glf_c753a166,train,86138,DIAL_GLF,بنت السحاب تسلم يديك : ) انا قلت في ردي السابق حتى لو البنت فسخت ملابسها في السوق . . هذا ما هو عذر ان الشاب يلاحقها زي الحيوان ! ! طيب افرض يا اخي ان اختك من النوع اللي يتبرج وتطلع للسوق متعطرة . . ترضى أحد يطالع فيها ويلاحقها ! ! اكيد بيقول لا ! طيب نفس الشي هذي اذا هي عاصية وما تخاف ربها وشو له تقرب منها أبعد عن الشرّ وغض بصرك . . تدخل نفسك في متاهات وعالم الدجة والخراب وكل هذا مكتوب عليك وبتحاسب عليه في قبرك وما راح ينفعك أحد وبتقول يا ليت ويا ليت ونفس الكلام ينطبق,بنت السحاب تسلم يديك انا قلت في ردي السابق حتي لو البنت فسخت ملابسها في السوق هذا ما هو عذر ان الشاب يلاحقها زي الحيوان طيب افرض يا اخي ان اختك من النوع اللي يتبرج وتطلع للسوق متعطره ترضي احد يطالع فيها ويلاحقها اكيد بيقول لا طيب نفس الشي هذي اذا هي عاصيه وما تخاف ربها وشو له تقرب منها ابعد عن الشر وغض بصرك تدخل نفسك في متاهات وعالم الدجه والخراب وكل هذا مكتوب عليك وبتحاسب عليه في قبرك وما راح ينفعك احد وبتقول يا ليت ويا ليت ونفس الكلام ينطبق,,[],0,pending,,
mt_dial_lev_4a1c3204,train,1112,DIAL_LEV,اكيد لأ معناه ليش تحكم او تعطي اراء من عندك على الكابتن حسونة الشيخ ؟,اكيد لا معناه ليش تحكم او تعطي اراء من عندك علي الكابتن حسونه الشيخ,,[],0,pending,,
mt_msa_f147244e,train,86163,MSA,اكيد مستواه ضايع وهذا ضرر على,اكيد مستواه ضايع وهذا ضرر علي,,[],0,pending,,
mt_dial_egy_4c7da984,train,74151,DIAL_EGY,و انت مالك يا حسين افندى . . . اهلا بالبرادعى فى الكنيسه بس يسيبه من الاخوان المسلمون لانهم ليس لهم عهد و لا,و انت مالك يا حسين افندي اهلا بالبرادعي في الكنيسه بس يسيبه من الاخوان المسلمون لانهم ليس لهم عهد و لا,,[],0,pending,,
mt_dial_glf_cf905a50,train,6562,DIAL_GLF,الان اصبحت العمالة الاجنبية يطلقون لحاهم لتوفير الامواس ويقصرون ثيابهم لكي تنطلي علينا حركة الضحك على الذقون . حتى اصبحت اللحية كأنها صك براءة بينما هم يخفون تحت لحاهم الهوائل . ولكي يبقول اطول مدة ممكنة في البلد لشفط,الان اصبحت العماله الاجنبيه يطلقون لحاهم لتوفير الامواس ويقصرون ثيابهم لكي تنطلي علينا حركه الضحك علي الذقون حتي اصبحت اللحيه كانها صك براءه بينما هم يخفون تحت لحاهم الهوايل ولكي يبقول اطول مده ممكنه في البلد لشفط,,[],0,pending,,
mt_dial_lev_a16152f6,train,49685,DIAL_LEV,يعني الدخان والقهوة وبطاقات الشحن ! ! ! والله هالحكومة كويسة بدها الشباب تنعدل بس ضل الجل ما حكو في غريبة,يعني الدخان والقهوه وبطاقات الشحن والله هالحكومه كويسه بدها الشباب تنعدل بس ضل الجل ما حكو في غريبه,,[],0,pending,,
mt_msa_3f49aee5,train,45142,MSA,إذا بليت فثق بالله وارضَ,اذا بليت فثق بالله وارض,,[],0,pending,,
mt_dial_egy_2f3d67bd,train,55668,DIAL_EGY,هنقول ونقول ديما ديما على طول,هنقول ونقول ديما ديما علي طول,,[],0,pending,,
mt_dial_glf_99d3c630,train,79210,DIAL_GLF,صرتوا تروون ايطاليا . . طبيتوا على,صرتوا تروون ايطاليا طبيتوا علي,,[],0,pending,,
mt_dial_lev_dc8a6b73,train,42280,DIAL_LEV,برشلونه خرجت امس من البطوله,برشلونه خرجت امس من البطوله,,[],0,pending,,
mt_msa_18c1e053,train,22006,MSA,نحن في الوقت الحاضر بالفعل لا نعاني من تسلط الحماة كما في السابق للأسباب,نحن في الوقت الحاضر بالفعل لا نعاني من تسلط الحماه كما في السابق للاسباب,,[],0,pending,,
mt_dial_egy_fc00a784,train,30296,DIAL_EGY,بس حمير طيبة روح يا حمار وتعالى ياحمار وهو مطيع طيب العلاج من اكل الحمير,بس حمير طيبه روح يا حمار وتعالي ياحمار وهو مطيع طيب العلاج من اكل الحمير,,[],0,pending,,
mt_dial_glf_c2d30cde,train,12344,DIAL_GLF,فهمتوني يا بنات . . . فالسّتر زين وانااخوكم . .,فهمتوني يا بنات فالستر زين وانااخوكم,,[],0,pending,,
mt_dial_lev_6faef93b,train,43951,DIAL_LEV,الي صار الها 10 سنين وهي,الي صار الها 10 سنين وهي,,[],0,pending,,
mt_msa_ad716223,train,43701,MSA,سوف تقوم الشركة بتوزيع قريثبا جدا يمكن نهاية هذا,سوف تقوم الشركه بتوزيع قريثبا جدا يمكن نهايه هذا,,[],0,pending,,
mt_dial_egy_b785831a,train,53455,DIAL_EGY,وغطاه فقر وتخلف وانحطاط خلقي نحن نستحي أن نتفرج علي أفلامكم التي تحتوي علي مشاهد اباحية أتركونا في حالنا أنتم ما تصدقو كلما يرد اسم الجزائر في صحفكم حتي,وغطاه فقر وتخلف وانحطاط خلقي نحن نستحي ان نتفرج علي افلامكم التي تحتوي علي مشاهد اباحيه اتركونا في حالنا انتم ما تصدقو كلما يرد اسم الجزاير في صحفكم حتي,,[],0,pending,,
mt_dial_glf_020614d5,train,20734,DIAL_GLF,بس صعب اللي قاعده اشوفه فوق يتطبق على ارض,بس صعب اللي قاعده اشوفه فوق يتطبق علي ارض,,[],0,pending,,
mt_dial_lev_53d74dac,train,63126,DIAL_LEV,يا رب المساعدة مع الشركات اللي راح اترجع,يا رب المساعده مع الشركات اللي راح اترجع,,[],0,pending,,
mt_msa_aced728e,train,82521,MSA,ان الصفات العقليه لاي مجتمع تظل ثابته في اي مجتمع اي انه لا يتأثر بالعلم ولا بالثقافة وهذا ما لمسناه وايده الشيخ صالح كامل في لقاء في قناة اقرأ عندما قال نحن اجلاف حتى ونحن ندعو الى الله برنامج السوق يوم 19 / 4 ويقول احد الفلاسف ان العربي قد يحرز المعلومات ولكنه لا ينال الا قشور الحضارة وليس لبها,ان الصفات العقليه لاي مجتمع تظل ثابته في اي مجتمع اي انه لا يتاثر بالعلم ولا بالثقافه وهذا ما لمسناه وايده الشيخ صالح كامل في لقاء في قناه اقرا عندما قال نحن اجلاف حتي ونحن ندعو الي الله برنامج السوق يوم 19 4 ويقول احد الفلاسف ان العربي قد يحرز المعلومات ولكنه لا ينال الا قشور الحضاره وليس لبها,,[],0,pending,,
mt_dial_egy_c82794d9,train,38005,DIAL_EGY,جايبين اتنين حبيبة وتقولوا تحرش هوة دة التحرش اللى فى,جايبين اتنين حبيبه وتقولوا تحرش هوه ده التحرش اللي في,,[],0,pending,,
mt_dial_glf_5954e415,train,69248,DIAL_GLF,الله ثم الله لا يوفقك العيبان بذن,الله ثم الله لا يوفقك العيبان بذن,,[],0,pending,,
mt_dial_lev_c052d5a6,train,82730,DIAL_LEV,بليز جريدة الغد لما يفتتحوها حطو خبر كرمال نرووح,بليز جريده الغد لما يفتتحوها حطو خبر كرمال نرووح,,[],0,pending,,
mt_msa_19c4b9c7,train,58737,MSA,اللهم بارك بأهله وأبنائه وأحفاده واجعلهم مسددين ،,اللهم بارك باهله وابنايه واحفاده واجعلهم مسددين,,[],0,pending,,
mt_dial_egy_504d4193,train,37997,DIAL_EGY,أعتقد من كام الدكتور البرادعى لو دى الأسماء يبقى احنا كدة فكرنا قاصر,اعتقد من كام الدكتور البرادعي لو دي الاسماء يبقي احنا كده فكرنا قاصر,,[],0,pending,,
mt_dial_glf_d317b26d,train,68194,DIAL_GLF,الكابتن غالي البيه سبق قدمت اليك نصيحة وكنت اعتفد انك لن تقرائها وان قراتها لن تفهمها عندما قلت لك اذا في رسالة سابقة في جريدة العرب جريدة الرياض . . . اذا رايت انياب الليث بارزة . . . الى اخر البيت ولكن اثبت انك قارئ جيد واحب مرة اخرى ان اذكرك انك اذا لم تستغل هذا الوفت لاخذ حفك فصدقني لن تحصل عليه الا بمحاكم وبالتقسيط الممل ! ! ! هذا ان حصلت عليه,الكابتن غالي البيه سبق قدمت اليك نصيحه وكنت اعتفد انك لن تقرايها وان قراتها لن تفهمها عندما قلت لك اذا في رساله سابقه في جريده العرب جريده الرياض اذا رايت انياب الليث بارزه الي اخر البيت ولكن اثبت انك قاري جيد واحب مره اخري ان اذكرك انك اذا لم تستغل هذا الوفت لاخذ حفك فصدقني لن تحصل عليه الا بمحاكم وبالتقسيط الممل هذا ان حصلت عليه,,[],0,pending,,
mt_dial_lev_e970d9d0,train,5759,DIAL_LEV,يعني النسوان طول السنة وهن يتفرجن على المسلسلات ولما اجت مباريات كأس العالم جايات بدهن يعترضن ؟ ؟,يعني النسوان طول السنه وهن يتفرجن علي المسلسلات ولما اجت مباريات كاس العالم جايات بدهن يعترضن,,[],0,pending,,
mt_msa_a2b92c0b,train,79897,MSA,والبطولة ( 14 ) في جدة عام,والبطوله 14 في جده عام,,[],0,pending,,
