example_id,source_split,source_row_id,dialect,original_text,normalized_text,masked_text,mask_spans_json,mask_count,annotation_status,annotator_model,notes
mt_dial_egy_61c3ddff,train,72683,DIAL_EGY,اخر مرة هرد بجد لازم تعرفى ان النادى الاهلى مش كورة وبس لا النادى الاهلى تاريخ عريق جدا . نحن الاهلوية نفخر كل الفخر اننا ننتمى للاهلى بل كل مصرى اصيل يفخر ان الاهلى من مصر . وانتى كذالك ياهناء يجب ان تفخرى بالنادى,اخر مره هرد بجد لازم تعرفي ان النادي الاهلي مش كوره وبس لا النادي الاهلي تاريخ عريق جدا نحن الاهلويه نفخر كل الفخر اننا ننتمي للاهلي بل كل مصري اصيل يفخر ان الاهلي من مصر وانتي كذالك ياهناء يجب ان تفخري بالنادي,,[],0,pending,,
mt_dial_glf_8f5f21b8,train,79715,DIAL_GLF,نسيتوا رادوي الجزار وش سوا فى الملاعب,نسيتوا رادوي الجزار وش سوا في الملاعب,,[],0,pending,,
mt_dial_lev_88d1f05a,train,4624,DIAL_LEV,"واذا لم ترد النقابة ان تصادق على ذلك , فبلا من هالختم احسن وبلا وجعة راس وتضييع وقت",واذا لم ترد النقابه ان تصادق علي ذلك فبلا من هالختم احسن وبلا وجعه راس وتضييع وقت,,[],0,pending,,
mt_msa_0c59ca1f,train,61192,MSA,اتمنى من اللاعبين النصرووايين الضغط على حامل الكرة من بداية المباراة وبأذن الله المباراة نصرواية على جمخهور الشمس الحضور مساندة اللاعبين وعدم الاستسلام لان الكرة لا تعرف المستحيل ومتفألون بأذن الله بفوز النصر واللعب في المباراة,اتمني من اللاعبين النصرووايين الضغط علي حامل الكره من بدايه المباراه وباذن الله المباراه نصروايه علي جمخهور الشمس الحضور مسانده اللاعبين وعدم الاستسلام لان الكره لا تعرف المستحيل ومتفالون باذن الله بفوز النصر واللعب في المباراه,,[],0,pending,,
mt_dial_egy_2e3bc7b5,train,11029,DIAL_EGY,انما مالناش فى الجزائى دول اى,انما مالناش في الجزايي دول اي,,[],0,pending,,
mt_dial_glf_0706f332,train,38343,DIAL_GLF,امطار اليومين هذي عذاب وصاحبها رياح شديدة تاتي قبل وبعد المطر مما يجعله ضارا غير,امطار اليومين هذي عذاب وصاحبها رياح شديده تاتي قبل وبعد المطر مما يجعله ضارا غير,,[],0,pending,,
mt_dial_lev_a7b63ad1,train,40955,DIAL_LEV,استاد الملك عبدالله سيشهد ملحمة كروية يوم السبت بطلها الفيصلي أما باعتقادي فان استاد الحسن بل اربد كلها رح تقلب,استاد الملك عبدالله سيشهد ملحمه كرويه يوم السبت بطلها الفيصلي اما باعتقادي فان استاد الحسن بل اربد كلها رح تقلب,,[],0,pending,,
mt_msa_16f12c44,train,56146,MSA,يعتدي هذا الجبان على طالبة ضعيفة ؟ ! على أنثى ؟ ! إن العرب عباد الأصنام في الجاهلية كانوا يتعففون عن فعل ذلك ، ، وصرنا في زمن الممسوخين المشوهين عبدة السلطة الذين يحاربون الله ورسوله ، ، فليبشروا بحسابهم بين يدي ربهم جبار السموات والأرض,يعتدي هذا الجبان علي طالبه ضعيفه علي انثي ان العرب عباد الاصنام في الجاهليه كانوا يتعففون عن فعل ذلك وصرنا في زمن الممسوخين المشوهين عبده السلطه الذين يحاربون الله ورسوله فليبشروا بحسابهم بين يدي ربهم جبار السموات والارض,,[],0,pending,,
mt_dial_egy_9bced3c5,train,42133,DIAL_EGY,أ . محمود . . . انت عملت اللى عليك وعتابى لك ان بلدنا بها اشياء اكبر من كده بكثير,ا محمود انت عملت اللي عليك وعتابي لك ان بلدنا بها اشياء اكبر من كده بكثير,,[],0,pending,,
mt_dial_glf_e811588f,train,37034,DIAL_GLF,"يقولون ضهر فقع في الجنوب , وش اخبار ام",يقولون ضهر فقع في الجنوب وش اخبار ام,,[],0,pending,,
mt_dial_lev_34f46389,train,35042,DIAL_LEV,يا اخوان الكل بحكي عن الفيصلي انو اخد كل هالالقاب ماشي صحيح الحكي بس الفيصلي اقدم الفرق الاردنية تاسيسا من الخمسينات ايامها ما كان غير الفيصلي يلعب يقسمو فريقين ويلعبو مع بعض وبحكيلك الفيصلي اخد الدوري ايامها ما كان غير الفيصلي وبالتالي كان شيء طبيعي انو باخد كل هالالقاب بس شوف من يوم تاسيس الوحدات وقارنو بعدها شو صار الفيصلي فيعني ما بدنا نحكي حكي عالفاضي مع تحيات صقر,يا اخوان الكل بحكي عن الفيصلي انو اخد كل هالالقاب ماشي صحيح الحكي بس الفيصلي اقدم الفرق الاردنيه تاسيسا من الخمسينات ايامها ما كان غير الفيصلي يلعب يقسمو فريقين ويلعبو مع بعض وبحكيلك الفيصلي اخد الدوري ايامها ما كان غير الفيصلي وبالتالي كان شيء طبيعي انو باخد كل هالالقاب بس شوف من يوم تاسيس الوحدات وقارنو بعدها شو صار الفيصلي فيعني ما بدنا نحكي حكي عالفاضي مع تحيات صقر,,[],0,pending,,
mt_msa_f7a460da,train,25909,MSA,ان موتى الحوادث المروريه بمعدل 17 شخص يومياً وعليك,ان موتي الحوادث المروريه بمعدل 17 شخص يوميا وعليك,,[],0,pending,,
mt_dial_egy_ecdfd097,train,42192,DIAL_EGY,انت عارف من جواك ان الاهلي عظيم بانجازه . . عايز تقول الزمالك كويس قول بس ماتقولش الاهلي وحش . . لانك انت اوحش . . وبكدة بتعرف الناس ان انت النار,انت عارف من جواك ان الاهلي عظيم بانجازه عايز تقول الزمالك كويس قول بس ماتقولش الاهلي وحش لانك انت اوحش وبكده بتعرف الناس ان انت النار,,[],0,pending,,
mt_dial_glf_ce9baece,train,20185,DIAL_GLF,أتمنى الفوز للشباب لاجل رجل محترم نحبه كسعودين إنه الامير خالد بن سلطان بن عبد العزيز وعندى تساؤل نوجهه لادارة الشباب ليش تزرعون فى نفوس اللاعبين المال مقابل الفوز ليش ما تزرعون حب النادى فى نفوسهم ما شفنا هذا التوجه مع ادارة الهلال مع لاعبيى الهلال امنيه على البلطان الاستقاله من ادارة,اتمني الفوز للشباب لاجل رجل محترم نحبه كسعودين انه الامير خالد بن سلطان بن عبد العزيز وعندي تساول نوجهه لاداره الشباب ليش تزرعون في نفوس اللاعبين المال مقابل الفوز ليش ما تزرعون حب النادي في نفوسهم ما شفنا هذا التوجه مع اداره الهلال مع لاعبيي الهلال امنيه علي البلطان الاستقاله من اداره,,[],0,pending,,
mt_dial_lev_47267e35,train,18466,DIAL_LEV,انا سياراتي بوصلو بعد اسبوع شو هالقرار انا اشتريتهم بشهر 2 والله,انا سياراتي بوصلو بعد اسبوع شو هالقرار انا اشتريتهم بشهر 2 والله,,[],0,pending,,
mt_msa_bf8f8720,train,7973,MSA,بالتوفيق لزعيم القصيم الحقيقي نادي,بالتوفيق لزعيم القصيم الحقيقي نادي,,[],0,pending,,
mt_dial_egy_7d5795f6,train,33832,DIAL_EGY,اخيرا ما حدث امس في مباراه الزمالك والشرطة من الحكم توفيق يدل فعلا ان اتحاد الكرة عنده مباديء والاهلي عندي مباديء والحكام عندي مباديء والوحيد اللي ما عندوش ماديء هو الزمالك وباقي الاندية . .,اخيرا ما حدث امس في مباراه الزمالك والشرطه من الحكم توفيق يدل فعلا ان اتحاد الكره عنده مباديء والاهلي عندي مباديء والحكام عندي مباديء والوحيد اللي ما عندوش ماديء هو الزمالك وباقي الانديه,,[],0,pending,,
mt_dial_glf_4fdced1e,train,19981,DIAL_GLF,المراه لها بيتها وعيالها وتربيتهم على الفطره,المراه لها بيتها وعيالها وتربيتهم علي الفطره,,[],0,pending,,
mt_dial_lev_b04c89c4,train,75773,DIAL_LEV,اذا بدكم مهندسين انا جاهز للعمل,اذا بدكم مهندسين انا جاهز للعمل,,[],0,pending,,
mt_msa_c84d525f,train,26772,MSA,أما آن للسلطة أن تعتبر من كل اتفاقية وقعتها ومن كل حوار مباشر أو غير مباشر أجرته,اما ان للسلطه ان تعتبر من كل اتفاقيه وقعتها ومن كل حوار مباشر او غير مباشر اجرته,,[],0,pending,,
mt_dial_egy_18ba10d6,train,51795,DIAL_EGY,وريس بلدنا اخر حلاوه وحنان,وريس بلدنا اخر حلاوه وحنان,,[],0,pending,,
mt_dial_glf_9538b7ac,train,10158,DIAL_GLF,لا لا لا لا وهم نفسهم ما,لا لا لا لا وهم نفسهم ما,,[],0,pending,,
mt_dial_lev_afbd0b33,train,30598,DIAL_LEV,مش لمواطنين عافين حالهم بدها شوية,مش لمواطنين عافين حالهم بدها شويه,,[],0,pending,,
mt_msa_7f02a870,train,15007,MSA,"وقال جيسون برونلى ، أستاذ العلوم السياسية بجامعة تكساس أوستن : "" إن جمال مبارك حصل على مباركة آخر رئيسين لأمريكا ، حيث زار واشنطن عام 2006 والتقى بالرئيس الأمريكى فى ذلك الوقت جورج بوش الابن ، ثم التقى بالرئيس الحالى باراك أوباما عندما زار الأخير القاهرة ، كما أن جمال مبارك يحظى بدعم الحزبين الجمهورى والديمقراطى فى واشنطن """,وقال جيسون برونلي استاذ العلوم السياسيه بجامعه تكساس اوستن ان جمال مبارك حصل علي مباركه اخر رييسين لامريكا حيث زار واشنطن عام 2006 والتقي بالرييس الامريكي في ذلك الوقت جورج بوش الابن ثم التقي بالرييس الحالي باراك اوباما عندما زار الاخير القاهره كما ان جمال مبارك يحظي بدعم الحزبين الجمهوري والديمقراطي في واشنطن,,[],0,pending,,
mt_dial_egy_c93be38b,train,52928,DIAL_EGY,عيب اللى حصل لفريق الشرطة اناعاوزمسؤولو الشرطه يجيبو حق منظرهم ومكانتهم ومحمد ابراهيم الراجل المؤدب منذ الصغر لأن المنظر كان بصراحه,عيب اللي حصل لفريق الشرطه اناعاوزمسوولو الشرطه يجيبو حق منظرهم ومكانتهم ومحمد ابراهيم الراجل المودب منذ الصغر لان المنظر كان بصراحه,,[],0,pending,,
mt_dial_glf_f7f33887,train,53329,DIAL_GLF,طبعاً المعالج لازم يكون أجنبي ! !,طبعا المعالج لازم يكون اجنبي,,[],0,pending,,
mt_dial_lev_00f5f50d,train,23694,DIAL_LEV,طيب ليش الحرص على الرقم 3 ما تكون 15 او,طيب ليش الحرص علي الرقم 3 ما تكون 15 او,,[],0,pending,,
mt_msa_6f75bb73,train,60709,MSA,احب اقول هذا فرض وإجبار للمرأة لم يكن لها يد بهذا القناع السخيف,احب اقول هذا فرض واجبار للمراه لم يكن لها يد بهذا القناع السخيف,,[],0,pending,,
mt_dial_egy_254c3223,train,7858,DIAL_EGY,مش ملاحظين ان كل فترة ينشر هذا الموقع معلومات خطائة حتى يزداد التعليقات ويكسب شهرة ويبقى افضل موقع على حساب الوقيعة بين المسلمين والمسحين لانة موضوع جذاب لى قارء على,مش ملاحظين ان كل فتره ينشر هذا الموقع معلومات خطايه حتي يزداد التعليقات ويكسب شهره ويبقي افضل موقع علي حساب الوقيعه بين المسلمين والمسحين لانه موضوع جذاب لي قارء علي,,[],0,pending,,
mt_dial_glf_1b981aaf,train,69833,DIAL_GLF,خاصة ان النصراوية متصورين غالي هو اللي بيجيب الاهداف,خاصه ان النصراويه متصورين غالي هو اللي بيجيب الاهداف,,[],0,pending,,
mt_dial_lev_67683984,train,53728,DIAL_LEV,لاحظتم كيف كان جمهور الفيصلي لما خسر مع الوحدات كيف تجمع الجمهور امام باب النادي الفيصلي يطالبون بالاستفسارات والتغيير واقاللات,لاحظتم كيف كان جمهور الفيصلي لما خسر مع الوحدات كيف تجمع الجمهور امام باب النادي الفيصلي يطالبون بالاستفسارات والتغيير واقاللات,,[],0,pending,,
mt_msa_4d76a313,train,44450,MSA,3 . قيام حملة اعلامية مكثفة للتعريف بالنظام في كافة وسائل,3 قيام حمله اعلاميه مكثفه للتعريف بالنظام في كافه وسايل,,[],0,pending,,
mt_dial_egy_ee2dff4f,train,5567,DIAL_EGY,يا أستاذ عب الهادي من أين تأتي بمعلوماتك ؟ حسني عبد ربه مواليد 1 نوفمبر 1984 أي ان عمره لم يكمل السادسة والعشرين,يا استاذ عب الهادي من اين تاتي بمعلوماتك حسني عبد ربه مواليد 1 نوفمبر 1984 اي ان عمره لم يكمل السادسه والعشرين,,[],0,pending,,
mt_dial_glf_f24c6d6a,train,53262,DIAL_GLF,يا ليت شركة الاتصالات توضح لنا ليه الواحد ينام بالليل ويصحى الصبح يلاقي الرصيد مسحوب,يا ليت شركه الاتصالات توضح لنا ليه الواحد ينام بالليل ويصحي الصبح يلاقي الرصيد مسحوب,,[],0,pending,,
mt_dial_lev_f5f2b11d,train,84031,DIAL_LEV,يل رب الالقاب الموسم للوحدات وكاس الاتحاد الاسيوي ويا رب رافت يبقى في المارد ويرجع عن قراره للانضمام للعربي,يل رب الالقاب الموسم للوحدات وكاس الاتحاد الاسيوي ويا رب رافت يبقي في المارد ويرجع عن قراره للانضمام للعربي,,[],0,pending,,
mt_msa_6b7fb8d4,train,49622,MSA,. لكن الغريب في الامر انهم وجدو ان الثيران لاتميز بين الالوان وخاصة اللون الاحمر ومع ذللك دائما يقتل الثور القوي والضعيف وينتصر,لكن الغريب في الامر انهم وجدو ان الثيران لاتميز بين الالوان وخاصه اللون الاحمر ومع ذللك دايما يقتل الثور القوي والضعيف وينتصر,,[],0,pending,,
mt_dial_egy_0b02ad12,train,72168,DIAL_EGY,يا رشدى كل كلامة ملوش قيمة الا لما تطالب بالكشف عن مصير وفاء,يا رشدي كل كلامه ملوش قيمه الا لما تطالب بالكشف عن مصير وفاء,,[],0,pending,,
mt_dial_glf_716ad342,train,9954,DIAL_GLF,اخوي صاحب التعليق 15 حرك لو سمحت,اخوي صاحب التعليق 15 حرك لو سمحت,,[],0,pending,,
mt_dial_lev_8da679ef,train,14238,DIAL_LEV,يعني بس لو هالحكومة ترحمنا شوي والله الراتب طار من اول الشهر والوضع مش,يعني بس لو هالحكومه ترحمنا شوي والله الراتب طار من اول الشهر والوضع مش,,[],0,pending,,
mt_msa_0a045218,train,60514,MSA,"الف مبروك والشكر لله ثم لحكومتنا الرشيدة والطاقم الطبي الله يعزهم ويسدد خطاهم , ,",الف مبروك والشكر لله ثم لحكومتنا الرشيده والطاقم الطبي الله يعزهم ويسدد خطاهم,,[],0,pending,,
mt_dial_egy_4402f0d8,train,12126,DIAL_EGY,3 . من خلال متابعه شوبير في البرنامج الرياضيه لنجوم اف ام - يصدق القول يموت الطبال وصوابعه بتلعب - ولن يتوقف عن تصفيه حساباته والنرحسيه مع الأخرين - اسمع تعليقه في موضوع عصام الحضري - منتهي الحقد والكراهيه,3 من خلال متابعه شوبير في البرنامج الرياضيه لنجوم اف ام يصدق القول يموت الطبال وصوابعه بتلعب ولن يتوقف عن تصفيه حساباته والنرحسيه مع الاخرين اسمع تعليقه في موضوع عصام الحضري منتهي الحقد والكراهيه,,[],0,pending,,
mt_dial_glf_a4c44e83,train,44659,DIAL_GLF,يا مار رادوي ركل ورفس عادي لو جاه كوع على,يا مار رادوي ركل ورفس عادي لو جاه كوع علي,,[],0,pending,,
mt_dial_lev_bc5fcfb4,train,44039,DIAL_LEV,أرجوكم يا إخوان حدا يفهمني شو اللي بصير ! ! لإني اللي فهمتوا إنه كل واحد نصب نفسه من القاتل والمقتول مكان رب العالمين أستغفر الله,ارجوكم يا اخوان حدا يفهمني شو اللي بصير لاني اللي فهمتوا انه كل واحد نصب نفسه من القاتل والمقتول مكان رب العالمين استغفر الله,,[],0,pending,,
mt_msa_c764655e,train,60829,MSA,كلام صائب وصحيح 100 % ففي باديتنا الشرقية يرتع التجار ويلعبون بمستقبل الشباب,كلام صايب وصحيح 100 ففي باديتنا الشرقيه يرتع التجار ويلعبون بمستقبل الشباب,,[],0,pending,,
mt_dial_egy_dc168dab,train,24247,DIAL_EGY,او بيكره النادي وبرضه هيكون ( زبالكاوي ) وهو نفس الشخص اللي فوق,او بيكره النادي وبرضه هيكون زبالكاوي وهو نفس الشخص اللي فوق,,[],0,pending,,
mt_dial_glf_40f41c8f,train,259,DIAL_GLF,طيب واللي بالرياض 10 و 15 و 20 بعد . . . وش,طيب واللي بالرياض 10 و 15 و 20 بعد وش,,[],0,pending,,
mt_dial_lev_10ff0ac8,train,67875,DIAL_LEV,يعني انه همو عندهم انتماء وانت ماعندك . بتمنى من الجريده ما يمسحو شي من التعليق مش احنا بلد ديمقراطي,يعني انه همو عندهم انتماء وانت ماعندك بتمني من الجريده ما يمسحو شي من التعليق مش احنا بلد ديمقراطي,,[],0,pending,,
mt_msa_0101d52b,train,26430,MSA,مع كل الاحترام للكاتب وللسادة القراء فان الاختلافات بين السنة ومذاهب الشيعة المختلفة ليست في الأمور البسيطة ولا الشكلية والا مادامت لألف وأربعمائة عام سفكت فيها دماء وسلخت فيها جلود وحشيت جثث بالقش واحرقت ولا انتزع الموتى من قبورهم ليضربوا بالسياط ويحرقوا ويصلبوا كل هذا واقع تاريخي لا خلاف عليه هل الأمور القشرية تحريف الآذان وابطال قواعدالارث وتكفير من لاإمام له وأكتفي بهذا القدر آملا أن يلتزم كل مسلم يصحيح الدين بما ورد في الكتاب,مع كل الاحترام للكاتب وللساده القراء فان الاختلافات بين السنه ومذاهب الشيعه المختلفه ليست في الامور البسيطه ولا الشكليه والا مادامت لالف واربعمايه عام سفكت فيها دماء وسلخت فيها جلود وحشيت جثث بالقش واحرقت ولا انتزع الموتي من قبورهم ليضربوا بالسياط ويحرقوا ويصلبوا كل هذا واقع تاريخي لا خلاف عليه هل الامور القشريه تحريف الاذان وابطال قواعدالارث وتكفير من لاامام له واكتفي بهذا القدر املا ان يلتزم كل مسلم يصحيح الدين بما ورد في الكتاب,,[],0,pending,,
mt_dial_egy_329e4805,train,68655,DIAL_EGY,يا عم خلاص بتوع الحناجل والمناجل,يا عم خلاص بتوع الحناجل والمناجل,,[],0,pending,,
mt_dial_glf_021675b2,train,71919,DIAL_GLF,الله وأكبر يبون يضللون التاريخ أربعين سنة من الإنتصارات للنصر وعشر سنين على قولتهم أو أقل يمكن سبع أو أقل نبت لهم ريش لكن أقول لفريق ويلهامسون مهو الهلال ويلهامسون مهو دايم يروح ونشوف,الله واكبر يبون يضللون التاريخ اربعين سنه من الانتصارات للنصر وعشر سنين علي قولتهم او اقل يمكن سبع او اقل نبت لهم ريش لكن اقول لفريق ويلهامسون مهو الهلال ويلهامسون مهو دايم يروح ونشوف,,[],0,pending,,
mt_dial_lev_75f42837,train,50680,DIAL_LEV,انا كيف بدي احصل حقي ؟ ؟,انا كيف بدي احصل حقي,,[],0,pending,,
mt_msa_d2a8ac8d,train,77582,MSA,يعني في السنة 15 مليار,يعني في السنه 15 مليار,,[],0,pending,,
mt_dial_egy_9bed779c,train,38117,DIAL_EGY,يبقى ايع اللى ناقص بعد كدة ! !,يبقي ايع اللي ناقص بعد كده,,[],0,pending,,
mt_dial_glf_00e9a296,train,4223,DIAL_GLF,الى قريب والحديد مجدع في جميع بقاع مملكتنا من كثره والأن مسمار تبغى تدقه بخشبه ما تلقاه غريبه وألف,الي قريب والحديد مجدع في جميع بقاع مملكتنا من كثره والان مسمار تبغي تدقه بخشبه ما تلقاه غريبه والف,,[],0,pending,,
mt_dial_lev_8f0d942a,train,76795,DIAL_LEV,انا مابعرف ليش هيك الواحد بتصرف إذا الواحد كان معو مصاري طباعاً وأكيد بروح على خاص وهناك برفهو كإنو مو بمستشفى في فندق وإزا الواحد كان على قد حالو وراح على المسلخ مابعبرو وبتعاملو مع الواحد كن فوقية كإنهم بتمننو عليه حسبي الله,انا مابعرف ليش هيك الواحد بتصرف اذا الواحد كان معو مصاري طباعا واكيد بروح علي خاص وهناك برفهو كانو مو بمستشفي في فندق وازا الواحد كان علي قد حالو وراح علي المسلخ مابعبرو وبتعاملو مع الواحد كن فوقيه كانهم بتمننو عليه حسبي الله,,[],0,pending,,
mt_msa_add14c5a,train,3737,MSA,هل يعرف الناس كيف يعمل هذا النظام,هل يعرف الناس كيف يعمل هذا النظام,,[],0,pending,,
mt_dial_egy_50f09306,train,3421,DIAL_EGY,مش قد حكمها سيبوها للي,مش قد حكمها سيبوها للي,,[],0,pending,,
mt_dial_glf_e4f2be60,train,84811,DIAL_GLF,الله يرجعه لهله سالم بس ودي افهم ليش اذا صار المسروق منزل ضعيف ما يصيدون الحرامي وذا المسروق من الطبقه الراقيه جابوه على طول كما قرأنا قبل ايام عن عصابه الست نساء وليش ما يخطف الى عيال الضعوف وذا اللى مخطوف ولد واحد مهم يطلع الخاطف بسرعه وش الحاجه اللى يستعملونها ويعرفون مكان الخاطف اكيد . . . وفهمكم,الله يرجعه لهله سالم بس ودي افهم ليش اذا صار المسروق منزل ضعيف ما يصيدون الحرامي وذا المسروق من الطبقه الراقيه جابوه علي طول كما قرانا قبل ايام عن عصابه الست نساء وليش ما يخطف الي عيال الضعوف وذا اللي مخطوف ولد واحد مهم يطلع الخاطف بسرعه وش الحاجه اللي يستعملونها ويعرفون مكان الخاطف اكيد وفهمكم,,[],0,pending,,
