example_id,source_split,source_row_id,dialect,original_text,normalized_text,masked_text,mask_spans_json,mask_count,annotation_status,annotator_model,notes
mt_dial_egy_19c00215,train,278,DIAL_EGY,القمر لا علاقة له بالتلفزيونان نحن في الجزائر نرسل اقمار صناعية لاهداف علمية وهذا هو دور السات 3 مثل سابقيه 1 و 2 . . وليس لبث لقطات هز الخصر . واحبم ونتجوز ومش عارف,القمر لا علاقه له بالتلفزيونان نحن في الجزاير نرسل اقمار صناعيه لاهداف علميه وهذا هو دور السات 3 مثل سابقيه 1 و 2 وليس لبث لقطات هز الخصر واحبم ونتجوز ومش عارف,,[],0,pending,,
mt_dial_glf_8ab6b66c,train,54177,DIAL_GLF,أهل مكة ادرى بشعابها ( انا اعمل في نفس جهاز الغامدي ومعروف عن الرجل إنحرافه الفكري والسلوكي مع كبر وغطرسة بشكل غيرطبيعي,اهل مكه ادري بشعابها انا اعمل في نفس جهاز الغامدي ومعروف عن الرجل انحرافه الفكري والسلوكي مع كبر وغطرسه بشكل غيرطبيعي,,[],0,pending,,
mt_dial_lev_2ab39f05,train,85156,DIAL_LEV,يا أخي شو اللي بدهم ياه يصيروا زي قناة أخرى . . . بدون ذكر أسماء تتنافس فيه المذيعات بكشف مفاتنها للناس,يا اخي شو اللي بدهم ياه يصيروا زي قناه اخري بدون ذكر اسماء تتنافس فيه المذيعات بكشف مفاتنها للناس,,[],0,pending,,
mt_msa_900e14c4,train,50176,MSA,كل المفاوضات من اجل الابطال فى سجون العدو والاسرى الفلسطينين والاردنيين شو فيها يعنى الرسول عليه الصلاه والسلام كان يفاوض,كل المفاوضات من اجل الابطال في سجون العدو والاسري الفلسطينين والاردنيين شو فيها يعني الرسول عليه الصلاه والسلام كان يفاوض,,[],0,pending,,
mt_dial_egy_eeb5c91d,train,62520,DIAL_EGY,رسالة شكر الي كل جزمجية الحزب الوطني لأن بهذا النفاق والتأفق انما سيقبل الناس البسيطة علي الدكتور البرادعي اكثر واكثر والمدعوة نيفين كشري شغل الجزمجية بتاعكوا,رساله شكر الي كل جزمجيه الحزب الوطني لان بهذا النفاق والتافق انما سيقبل الناس البسيطه علي الدكتور البرادعي اكثر واكثر والمدعوه نيفين كشري شغل الجزمجيه بتاعكوا,,[],0,pending,,
mt_dial_glf_b83c6ba4,train,5213,DIAL_GLF,أما تهاجموا من أول المباراه عز الله رحتوا,اما تهاجموا من اول المباراه عز الله رحتوا,,[],0,pending,,
mt_dial_lev_07675192,train,77852,DIAL_LEV,نصيحتي إلى كل الرجال ممارسة الرياضة بشكل منتظم على الأقل المشي السريع والهرولة قدر المستطاع . . كمان كل واحد لازم يدرب حاله شوي شوي ينسى همومه الي خارج البيت بمجرد ما يدخل على البيت مع الوقت بصير شغله تقريباً ما يخطر على باله . . أما الي حياته كلها شغل بدو يتحمل ويدفع الثمن . . ونصيحة أخيرة بلاش الأكل الدسم كتير والمناسف والروس والكرشات دائماً أهم إشي الخضار والفواكه والأسماك وخاصة الربيان بعطي نتائج غير متوقعه . . ويارب تمتع الجميع بالصحة والعافية وتسعدهم مع,نصيحتي الي كل الرجال ممارسه الرياضه بشكل منتظم علي الاقل المشي السريع والهروله قدر المستطاع كمان كل واحد لازم يدرب حاله شوي شوي ينسي همومه الي خارج البيت بمجرد ما يدخل علي البيت مع الوقت بصير شغله تقريبا ما يخطر علي باله اما الي حياته كلها شغل بدو يتحمل ويدفع الثمن ونصيحه اخيره بلاش الاكل الدسم كتير والمناسف والروس والكرشات دايما اهم اشي الخضار والفواكه والاسماك وخاصه الربيان بعطي نتايج غير متوقعه ويارب تمتع الجميع بالصحه والعافيه وتسعدهم مع,,[],0,pending,,
mt_msa_201e24ba,train,27308,MSA,- أعجبني الربط بين لعبة الشطرنج و الموضوع والذي يتقدم إلى طاولة الشطرنج عليه أن يذاكر جيدا قواعد اللعبة ودور كل قطعة وهو مايطلق عليه علم الإدارة كما أن تحريك القطع يحتاج إلى خطة وبعد نظر وقبل ذلك ذكاء لأن خطأ واحد في تحريك قطعة قد يفقدك الدور,اعجبني الربط بين لعبه الشطرنج و الموضوع والذي يتقدم الي طاوله الشطرنج عليه ان يذاكر جيدا قواعد اللعبه ودور كل قطعه وهو مايطلق عليه علم الاداره كما ان تحريك القطع يحتاج الي خطه وبعد نظر وقبل ذلك ذكاء لان خطا واحد في تحريك قطعه قد يفقدك الدور,,[],0,pending,,
mt_dial_egy_c87718c2,train,60512,DIAL_EGY,ازاي البنت تسيب البيت المدة دي كلها ويسبوهل لحد ما تحب وكمان,ازاي البنت تسيب البيت المده دي كلها ويسبوهل لحد ما تحب وكمان,,[],0,pending,,
mt_dial_glf_a68751bf,train,46032,DIAL_GLF,ليش ما سفروه لديرته او سجنوه على الأقل ؟ ؟,ليش ما سفروه لديرته او سجنوه علي الاقل,,[],0,pending,,
mt_dial_lev_a7ff90c3,train,10251,DIAL_LEV,اخبار زي الفل على هالصبح ونحن بانتظار ضرائب النصف الاخر من,اخبار زي الفل علي هالصبح ونحن بانتظار ضرايب النصف الاخر من,,[],0,pending,,
mt_msa_a54c04d4,train,84061,MSA,"لم نعرف التعصب والشحن إلا من فريق واحد وهو من زرع هذه الثقافه السيئه , , , أوقفوا عبث هذا النادي وتصاريحه اللامسؤوله وتنتهي",لم نعرف التعصب والشحن الا من فريق واحد وهو من زرع هذه الثقافه السييه اوقفوا عبث هذا النادي وتصاريحه اللامسووله وتنتهي,,[],0,pending,,
mt_dial_egy_bb2fe822,train,31253,DIAL_EGY,طيب لو الاهلي اللي وراها . . ليه الاهلي مافازش امبارح مع انه لو متوصي عليه توصية صغيرة قد كدة بس . . كان اتحسب له ضربة جزاء اللي هي اصلا ماتحسبتش بتاعة متعب . . ومع ذلك بنعترف ان الاخطاء واردة .,طيب لو الاهلي اللي وراها ليه الاهلي مافازش امبارح مع انه لو متوصي عليه توصيه صغيره قد كده بس كان اتحسب له ضربه جزاء اللي هي اصلا ماتحسبتش بتاعه متعب ومع ذلك بنعترف ان الاخطاء وارده,,[],0,pending,,
mt_dial_glf_28c81e43,train,53227,DIAL_GLF,الله يرده لكم سالم غاانم يا رب .,الله يرده لكم سالم غاانم يا رب,,[],0,pending,,
mt_dial_lev_1a8a6a84,train,33868,DIAL_LEV,و الثاني قتل مع الاصرار و قال ايش خلافا للمادة ( ) و عملا بالمادة ( ) تقرر تخفيف العقوبة بس 7 سنوات,و الثاني قتل مع الاصرار و قال ايش خلافا للماده و عملا بالماده تقرر تخفيف العقوبه بس 7 سنوات,,[],0,pending,,
mt_msa_37c9978a,train,25381,MSA,يارب تكون صفقة ناجحة فى صفوف الاهلى حبيب,يارب تكون صفقه ناجحه في صفوف الاهلي حبيب,,[],0,pending,,
mt_dial_egy_9a49f828,train,72525,DIAL_EGY,يعنى نغمة الحرية بس لغاية ما يوصلوا للحكم و بعد كده اللى يفتح بقه و يعترضه يقتلوه,يعني نغمه الحريه بس لغايه ما يوصلوا للحكم و بعد كده اللي يفتح بقه و يعترضه يقتلوه,,[],0,pending,,
mt_dial_glf_8d13f277,train,30193,DIAL_GLF,الظاهر الخوف لاتنكسر سنارة الصيد قام بعمل سمك لبن تمر هندى,الظاهر الخوف لاتنكسر سناره الصيد قام بعمل سمك لبن تمر هندي,,[],0,pending,,
mt_dial_lev_f15f6e1f,train,47972,DIAL_LEV,الفيصلي هو اقوى الاندية والسنة الجاي,الفيصلي هو اقوي الانديه والسنه الجاي,,[],0,pending,,
mt_msa_59324575,train,34092,MSA,بسنغافورة ثم الزمالك المصرى فاز على بترول الجزائر بعدها مباشرة وصعد الى كاس العالم للاندية وهذا تاكيد على تفوق مصر على الجزائر بشكل,بسنغافوره ثم الزمالك المصري فاز علي بترول الجزاير بعدها مباشره وصعد الي كاس العالم للانديه وهذا تاكيد علي تفوق مصر علي الجزاير بشكل,,[],0,pending,,
mt_dial_egy_b7ad2b9b,train,72545,DIAL_EGY,شاكلك فاهم اللعب يا واحد من الناس . .,شاكلك فاهم اللعب يا واحد من الناس,,[],0,pending,,
mt_dial_glf_b729a662,train,1050,DIAL_GLF,ه أحلى خبر في حياتي كأني كاسب المليون ريال . .,ه احلي خبر في حياتي كاني كاسب المليون ريال,,[],0,pending,,
mt_dial_lev_41cee65b,train,70721,DIAL_LEV,زكريا مدافع للرمثا معروف من زمان هاد الاشي مش من,زكريا مدافع للرمثا معروف من زمان هاد الاشي مش من,,[],0,pending,,
mt_msa_1847cebb,train,19155,MSA,والله يا سامي عيونك ما تشوف الا عبين الفرق الاخرى ولم نسمع بانك تطالب اللجنه بايقاف رادوي او خالد عزيز اذكرك بمقابله لرئيس نادي الهلال في اول الدوري عندما تعرض لاعب النصر لركل من خالد عزيز وفي منطق حساسه ولم يتم ايقافه وتصريح رئيسكم ان الهلال تعرض لمثل هذه امور ولماذا يوقفون خالد عزيز عجب,والله يا سامي عيونك ما تشوف الا عبين الفرق الاخري ولم نسمع بانك تطالب اللجنه بايقاف رادوي او خالد عزيز اذكرك بمقابله لرييس نادي الهلال في اول الدوري عندما تعرض لاعب النصر لركل من خالد عزيز وفي منطق حساسه ولم يتم ايقافه وتصريح رييسكم ان الهلال تعرض لمثل هذه امور ولماذا يوقفون خالد عزيز عجب,,[],0,pending,,
mt_dial_egy_d30461dc,train,1574,DIAL_EGY,"بالنسبة للتعليق رقم 5 "" مصري بجد "" ، ، مين الدكتورة نيفين شكري دي ؟ ! و مالها و مال البرادعي ؟ ! و النبي تطمني يا عم الحج ، ، أحسن الدكاترة بقوا بالزوفة اليومين دول ، ، و شكلي كدا حادَكتر نفسي انا كمان ، ، و لا يعني الكحكة ف إيد اليتيم",بالنسبه للتعليق رقم 5 مصري بجد مين الدكتوره نيفين شكري دي و مالها و مال البرادعي و النبي تطمني يا عم الحج احسن الدكاتره بقوا بالزوفه اليومين دول و شكلي كدا حادكتر نفسي انا كمان و لا يعني الكحكه ف ايد اليتيم,,[],0,pending,,
mt_dial_glf_7d9b82c0,train,26838,DIAL_GLF,بنت السحاب اجل طقي اللثمه ولا اكشفي مع كيلو كحل وصاع مكاييج وروج . . . الخ من مستحضراتكم وتعالي للسوق وقولي لحد يناظرني ولايعاكسني ؟ الشباب لهم عقول ( طبعا مو كلهم ) بس فيه نظرية الايجاب والقبول وهذي في موضوعنا هذا تاتي من النساء . وفي نظري ان ماتفعله بعض البنات اشارات الى ايجاب وقبول لما سياتي من الشاب,بنت السحاب اجل طقي اللثمه ولا اكشفي مع كيلو كحل وصاع مكاييج وروج الخ من مستحضراتكم وتعالي للسوق وقولي لحد يناظرني ولايعاكسني الشباب لهم عقول طبعا مو كلهم بس فيه نظريه الايجاب والقبول وهذي في موضوعنا هذا تاتي من النساء وفي نظري ان ماتفعله بعض البنات اشارات الي ايجاب وقبول لما سياتي من الشاب,,[],0,pending,,
mt_dial_lev_ba947e8f,train,79270,DIAL_LEV,أخضر يا بقدونس أحمر يا,اخضر يا بقدونس احمر يا,,[],0,pending,,
mt_msa_5ece3161,train,14267,MSA,حتى وإن كان هناك مخطئون وحتى إن لم ينال تصريح من طرف رضا البعض فلكل شئ حدود ولا يمكن أن يصدر من شخص محترم تعليق بهذا الشكل أبدا . .,حتي وان كان هناك مخطيون وحتي ان لم ينال تصريح من طرف رضا البعض فلكل شي حدود ولا يمكن ان يصدر من شخص محترم تعليق بهذا الشكل ابدا,,[],0,pending,,
mt_dial_egy_d4549dcc,train,346,DIAL_EGY,انت برضه مهما كان لعبت في النادي . .,انت برضه مهما كان لعبت في النادي,,[],0,pending,,
mt_dial_glf_d40c996d,train,22097,DIAL_GLF,من انت علشان تفتي جواز الاختلاط فقط لإرضاء رغباتك حسبي الله عليك,من انت علشان تفتي جواز الاختلاط فقط لارضاء رغباتك حسبي الله عليك,,[],0,pending,,
mt_dial_lev_f20b40ab,train,55640,DIAL_LEV,"اولا "" احر التعازي للحارس و قارابتي لؤي العمايرة و عظم الله",اولا احر التعازي للحارس و قارابتي لوي العمايره و عظم الله,,[],0,pending,,
mt_msa_0ff1a30d,train,26739,MSA,الواضح أنك تعيشين فى بلد غير مصر أو تتبعين الحزب,الواضح انك تعيشين في بلد غير مصر او تتبعين الحزب,,[],0,pending,,
mt_dial_egy_9d9f4af5,train,43744,DIAL_EGY,ايه اللى يضمن للناس ان الرقم,ايه اللي يضمن للناس ان الرقم,,[],0,pending,,
mt_dial_glf_98490af8,train,12111,DIAL_GLF,الصراحه لويخفضون رسوم التأشيره كان انااول واحد اقدم على,الصراحه لويخفضون رسوم التاشيره كان انااول واحد اقدم علي,,[],0,pending,,
mt_dial_lev_d7794909,train,61948,DIAL_LEV,ليش هالمنطق الاعوج وبدكم تسحبوا جنسيات ناس انولدوا بهالارض وعاشو واتربوا,ليش هالمنطق الاعوج وبدكم تسحبوا جنسيات ناس انولدوا بهالارض وعاشو واتربوا,,[],0,pending,,
mt_msa_6b7b538c,train,63752,MSA,فمن التي الآن لا تنظر للرجل السعودي على,فمن التي الان لا تنظر للرجل السعودي علي,,[],0,pending,,
mt_dial_egy_e6975f57,train,2022,DIAL_EGY,وشكرا علي اخلاصك ويا ريت تكون عرفت الفرق بين الجمهورين,وشكرا علي اخلاصك ويا ريت تكون عرفت الفرق بين الجمهورين,,[],0,pending,,
mt_dial_glf_0507499b,train,53492,DIAL_GLF,شافو الاهلي المصري اللي عمر ناديهم مية سنه ولطشو الفكره لا عمر النادي ولا عدد البطولات ولاهم يحزنون اصلا مافيه نادي في اسيا يستحق هذا اللقب ولا معترفين,شافو الاهلي المصري اللي عمر ناديهم ميه سنه ولطشو الفكره لا عمر النادي ولا عدد البطولات ولاهم يحزنون اصلا مافيه نادي في اسيا يستحق هذا اللقب ولا معترفين,,[],0,pending,,
mt_dial_lev_73884e47,train,83103,DIAL_LEV,وصلت للشرطة كمان والله لازم . .,وصلت للشرطه كمان والله لازم,,[],0,pending,,
mt_msa_d6d1a512,train,26171,MSA,غالبية السعوديين الذين يسافرون للبحرين هم من فئة الشباب وليس عائلات واظن ان الكثير يعلم لماذا يذهب هؤلاء الشباب للبحرين ! ! هل للطبيعة الخلابة وللجو العليل ؟ ! ابدا . . . في اعتقادي لو تم انشاء منطقة حرة بجوار قطر والامارات وتم بناء الفنادق والمنتجعات ووسائل الترفيه والمصانع لكان اجدى لنا اقتصاديا !,غالبيه السعوديين الذين يسافرون للبحرين هم من فيه الشباب وليس عايلات واظن ان الكثير يعلم لماذا يذهب هولاء الشباب للبحرين هل للطبيعه الخلابه وللجو العليل ابدا في اعتقادي لو تم انشاء منطقه حره بجوار قطر والامارات وتم بناء الفنادق والمنتجعات ووسايل الترفيه والمصانع لكان اجدي لنا اقتصاديا,,[],0,pending,,
mt_dial_egy_89d6cbdd,train,56805,DIAL_EGY,اللى بيتكلمو عن مصالح العمال هما فين اتعمو ولا ايه ولا مش من البلد,اللي بيتكلمو عن مصالح العمال هما فين اتعمو ولا ايه ولا مش من البلد,,[],0,pending,,
mt_dial_glf_1a5cc9e5,train,50656,DIAL_GLF,لاتينية بلا شك رح تكون,لاتينيه بلا شك رح تكون,,[],0,pending,,
mt_dial_lev_8e330504,train,80956,DIAL_LEV,كتير عجبني الكاركتير بس والله هالايام بنات ال 15 عقولهم مفتحه اكتر من بنت 30 لانو ما كان على ايام البنت الي عمرها 30 نت ولا بلاك بيري ولا هالتطورات الي موجود بهالايام والي موفره للبنت الي عمرها 10 مش 15 يعني بتفهم بنت العشره اكتر من بنت 15 وليش ما تستروا على البنات وهمه صغيرات ليش تستنوا الفضيحه توصل لباب بيتكو روحو شوفوا بنات بلدان تانيه من دون ذكر اسم البلد البنات عم بتزوجوا لحالهم استغنوا عن اهلهم والشرع حللهم الزواج العرفي واحنا ليش نستنا لمثل هذي اللحظه ليش ما نزوج بناتنا ونسترهم على عينا انا هذا رايي بالموضوع والرجاء ماحدا ياخد ايميلي,كتير عجبني الكاركتير بس والله هالايام بنات ال 15 عقولهم مفتحه اكتر من بنت 30 لانو ما كان علي ايام البنت الي عمرها 30 نت ولا بلاك بيري ولا هالتطورات الي موجود بهالايام والي موفره للبنت الي عمرها 10 مش 15 يعني بتفهم بنت العشره اكتر من بنت 15 وليش ما تستروا علي البنات وهمه صغيرات ليش تستنوا الفضيحه توصل لباب بيتكو روحو شوفوا بنات بلدان تانيه من دون ذكر اسم البلد البنات عم بتزوجوا لحالهم استغنوا عن اهلهم والشرع حللهم الزواج العرفي واحنا ليش نستنا لمثل هذي اللحظه ليش ما نزوج بناتنا ونسترهم علي عينا انا هذا رايي بالموضوع والرجاء ماحدا ياخد ايميلي,,[],0,pending,,
mt_msa_f94e2522,train,1783,MSA,تنافسو مع الحزم ونجران والرائد,تنافسو مع الحزم ونجران والرايد,,[],0,pending,,
mt_dial_egy_4de59d5d,train,42602,DIAL_EGY,عشان المفروض انها تقبل كل الاديان وكل الرموز سواء الصليب او المئذنه اللي في,عشان المفروض انها تقبل كل الاديان وكل الرموز سواء الصليب او الميذنه اللي في,,[],0,pending,,
mt_dial_glf_0062ff97,train,82324,DIAL_GLF,عبير صبري كانت محجبه ايش التغيرات هذي ياعبور الماده والدنيا غيرتك وانحرفتي الله يهديك,عبير صبري كانت محجبه ايش التغيرات هذي ياعبور الماده والدنيا غيرتك وانحرفتي الله يهديك,,[],0,pending,,
mt_dial_lev_7e05f46b,train,11620,DIAL_LEV,يا اخوان هذا الحكي صحيح 100 % بس في بلاد بره يعني هون اذا بتفوت على محل وبتحكي معهم بتواضع بعاملوك زي الكندرة بعكس بلادنا وبترجموها على انك مش واثق من حالك . اما اذا بتحكي من طراف مناخيرك بتلاقيهم بضحكولك . بالأول كانت هاي الشغله اتضايقني بس بعدين تعودت احكي بقرف,يا اخوان هذا الحكي صحيح 100 بس في بلاد بره يعني هون اذا بتفوت علي محل وبتحكي معهم بتواضع بعاملوك زي الكندره بعكس بلادنا وبترجموها علي انك مش واثق من حالك اما اذا بتحكي من طراف مناخيرك بتلاقيهم بضحكولك بالاول كانت هاي الشغله اتضايقني بس بعدين تعودت احكي بقرف,,[],0,pending,,
mt_msa_dc945bcb,train,63304,MSA,كالعاده هذا فريق العالمي كله مشاكل مع,كالعاده هذا فريق العالمي كله مشاكل مع,,[],0,pending,,
mt_dial_egy_b4b87022,train,84432,DIAL_EGY,جرى اية ان مواطن مصرى وبحب مصر على فكرة الاخوان اصل مثل العربجية وبيقولون قال اللة وقال الرسول وهم عينهم من الحكمانتو نسيتة ان مبارك زعيم السلام ولا انتم فكرين نفسكم فى زمن السيوف ياحبة,جري ايه ان مواطن مصري وبحب مصر علي فكره الاخوان اصل مثل العربجيه وبيقولون قال الله وقال الرسول وهم عينهم من الحكمانتو نسيته ان مبارك زعيم السلام ولا انتم فكرين نفسكم في زمن السيوف ياحبه,,[],0,pending,,
mt_dial_glf_6b1379be,train,6719,DIAL_GLF,هذلا لايمارس لعب كرة القدم هذا مصارع مصارعه ثيران بعد مهيب,هذلا لايمارس لعب كره القدم هذا مصارع مصارعه ثيران بعد مهيب,,[],0,pending,,
