example_id,source_split,source_row_id,dialect,original_text,normalized_text,masked_text,mask_spans_json,mask_count,annotation_status,annotator_model,notes
mt_dial_egy_4230a62a,train,868,DIAL_EGY,تلاقي المحلات بتبيع اجهزة المحمول الصيني عادي,تلاقي المحلات بتبيع اجهزه المحمول الصيني عادي,,[],0,pending,,
mt_dial_glf_a7769456,train,30094,DIAL_GLF,نفيز انانى وهمه التسجيل ع حساب الفريق وكل فاولاته بحائط,نفيز اناني وهمه التسجيل ع حساب الفريق وكل فاولاته بحايط,,[],0,pending,,
mt_dial_lev_54a6378a,train,65877,DIAL_LEV,يعني كل واحد حر باراؤه ناس بتدافع وناس,يعني كل واحد حر باراوه ناس بتدافع وناس,,[],0,pending,,
mt_msa_f62d67e6,train,41321,MSA,نحن الآن في عصر العولمة وإتفاقيات الجات وعلينا أن نقبل بالمنافسة لتقديم خدمات أحسن بأسعار ملائمة لخدمة الركاب من كل,نحن الان في عصر العولمه واتفاقيات الجات وعلينا ان نقبل بالمنافسه لتقديم خدمات احسن باسعار ملايمه لخدمه الركاب من كل,,[],0,pending,,
mt_dial_egy_1249548f,train,28533,DIAL_EGY,وادخل على محمد البرادعى وشوف الفرق بين دة ودة وياريت ساعتها تقول مين اللى احق انة يحكم مصر . . ولا مين اللى عندة المؤهلات للحكم إلا لو كان المؤهلات هيا التزوير وانة ابن الحاكم اقصد الملك المفدى او اى حاجة تانية من صفات المنافقين ودى صفحة البرادعى على ويكيبيديا شوفوا الفرق بالله عليكم http : / / ar . wikipedia . org / wiki / % D 9 % 85 % D 8 % AD % D 9 % 85 % D 8 % AF_ % D 8 % A 7 % D 9 % 84 % D 8 % A 8 % D 8 % B 1 % D 8 % A 7 % D 8 % AF % D 8 % B 9 % D 9 % 89,وادخل علي محمد البرادعي وشوف الفرق بين ده وده وياريت ساعتها تقول مين اللي احق انه يحكم مصر ولا مين اللي عنده الموهلات للحكم الا لو كان الموهلات هيا التزوير وانه ابن الحاكم اقصد الملك المفدي او اي حاجه تانيه من صفات المنافقين ودي صفحه البرادعي علي ويكيبيديا شوفوا الفرق بالله عليكم http ar wikipedia org wiki D 9 85 D 8 AD D 9 85 D 8 AF_ D 8 A 7 D 9 84 D 8 A 8 D 8 B 1 D 8 A 7 D 8 AF D 8 B 9 D 9 89,,[],0,pending,,
mt_dial_glf_e37d4d97,train,33036,DIAL_GLF,مابقي الا ابوك الذي رباك وتعب على عليك حتى اصبح رجل ودون خير منك يرتجيه تقووم بقتله,مابقي الا ابوك الذي رباك وتعب علي عليك حتي اصبح رجل ودون خير منك يرتجيه تقووم بقتله,,[],0,pending,,
mt_dial_lev_05c4514e,train,73858,DIAL_LEV,رجع الخي يا عين لا تدمعي . . . فوق كتاف رفقاتو,رجع الخي يا عين لا تدمعي فوق كتاف رفقاتو,,[],0,pending,,
mt_msa_846722c9,train,23530,MSA,اذا سمعوا عن ارتفاع عالمي رفعوا الاسعار الضعف,اذا سمعوا عن ارتفاع عالمي رفعوا الاسعار الضعف,,[],0,pending,,
mt_dial_egy_9578bc7a,train,24486,DIAL_EGY,ندا الى ندا الزمالكاويه موبيلى 0128934636 منتظر,ندا الي ندا الزمالكاويه موبيلي 0128934636 منتظر,,[],0,pending,,
mt_dial_glf_fd371590,train,41055,DIAL_GLF,وخلونا نفلها بس الله يستر من عذاب,وخلونا نفلها بس الله يستر من عذاب,,[],0,pending,,
mt_dial_lev_bf62a367,train,75304,DIAL_LEV,"حقيقه انو واقع محزن . . و ربنا يكون مع هالمزاريعين . . و على قول المثل "" ما في دخان من غير نار "" و قصة الاشتال الاسرائليه غير مستبعده لانو احنا ما بنمانع من التعاون التبادل التجاري مع العدو الاسرائيلي مع الاسف . . و اكيد كانت المصلحه الشخصيه لبعض المسؤولين الها دور اكبر في هيك صفقات . . و ما راحت الى على الزارع الاردني المسكين .",حقيقه انو واقع محزن و ربنا يكون مع هالمزاريعين و علي قول المثل ما في دخان من غير نار و قصه الاشتال الاسرايليه غير مستبعده لانو احنا ما بنمانع من التعاون التبادل التجاري مع العدو الاسراييلي مع الاسف و اكيد كانت المصلحه الشخصيه لبعض المسوولين الها دور اكبر في هيك صفقات و ما راحت الي علي الزارع الاردني المسكين,,[],0,pending,,
mt_msa_39aab8bf,train,77226,MSA,نحن شعب لم تقصر حكومتنا الا في ردع هؤلاء,نحن شعب لم تقصر حكومتنا الا في ردع هولاء,,[],0,pending,,
mt_dial_egy_341f05d3,train,2445,DIAL_EGY,أمبارح 4 تعليقات عملتهم و لم يتم نشرهم . . هل التعليق دة هينشر ولا لأ ؟ ؟ ؟ ! !,امبارح 4 تعليقات عملتهم و لم يتم نشرهم هل التعليق ده هينشر ولا لا,,[],0,pending,,
mt_dial_glf_b9d705ec,train,4891,DIAL_GLF,الف الف مبروك لليث فريقي المفضل والي مزين المبارت حضور الامير عبد الرحمان بن مساعد المتواضع الله يوفقه ان شاء,الف الف مبروك لليث فريقي المفضل والي مزين المبارت حضور الامير عبد الرحمان بن مساعد المتواضع الله يوفقه ان شاء,,[],0,pending,,
mt_dial_lev_590ab229,train,85345,DIAL_LEV,بس واحد يثبت بان هاي التعليقات بقرأها دولة رئيس الوزراء أو حتى اي واحد فاضى في اي وزارة كانت,بس واحد يثبت بان هاي التعليقات بقراها دوله رييس الوزراء او حتي اي واحد فاضي في اي وزاره كانت,,[],0,pending,,
mt_msa_5e5f7b5b,train,57637,MSA,هل نعاتب السرعة أم تعاتبنا وإلى متى,هل نعاتب السرعه ام تعاتبنا والي متي,,[],0,pending,,
mt_dial_egy_ad4b083a,train,47512,DIAL_EGY,اولا الحمد لله على التعادل رغم كل محاولات الحكم الاحمر لهزيمه الزمالك تحيه كبيره جدا للاعب شيكابالا اولا على الاخلاق العاليه ثانيا على المستوى الرائع الى ظهر بيه وتحيه للكابتن حسام حسن الى فاهم وعارف ان الاعداء متربصين ومنتظرين اى غلطه وتحيه على تصرفاته الاخلاقيه وكل العذر للكابتن ابراهيم حسن على انفعاله بسبب التحكيم الظالم السافر ويا اتحاد الكرة انتظروا الاسوء الى ان يعود العدل للملاعب حسبنا الله ونعم الوكيل فى الفساد يغور الدورى المشبوه وبالروح بالدم هانشجع الزمالك لاننا بنفهم كورة كويس وعارفين مين الحق ومين الباطل والزمالك هو الحق ومش محتاجين نوضح مين الباطل الدنيا كلها عارفاه مبروك ياجمهور الزمالك على التعادل الى بطعم الفوز رغم انف توفيق السيد توفيق ربنا كان,اولا الحمد لله علي التعادل رغم كل محاولات الحكم الاحمر لهزيمه الزمالك تحيه كبيره جدا للاعب شيكابالا اولا علي الاخلاق العاليه ثانيا علي المستوي الرايع الي ظهر بيه وتحيه للكابتن حسام حسن الي فاهم وعارف ان الاعداء متربصين ومنتظرين اي غلطه وتحيه علي تصرفاته الاخلاقيه وكل العذر للكابتن ابراهيم حسن علي انفعاله بسبب التحكيم الظالم السافر ويا اتحاد الكره انتظروا الاسوء الي ان يعود العدل للملاعب حسبنا الله ونعم الوكيل في الفساد يغور الدوري المشبوه وبالروح بالدم هانشجع الزمالك لاننا بنفهم كوره كويس وعارفين مين الحق ومين الباطل والزمالك هو الحق ومش محتاجين نوضح مين الباطل الدنيا كلها عارفاه مبروك ياجمهور الزمالك علي التعادل الي بطعم الفوز رغم انف توفيق السيد توفيق ربنا كان,,[],0,pending,,
mt_dial_glf_d96b14d4,train,30955,DIAL_GLF,تصدق اني فرحت الا شوي . . . قلت مهوب جايب طاري النساء,تصدق اني فرحت الا شوي قلت مهوب جايب طاري النساء,,[],0,pending,,
mt_dial_lev_0c4f8139,train,36091,DIAL_LEV,"فبالدول الغربية تصل هذه العملة عقوبتها الى 12 سنة لانهم يعتبروها تشويه خلقي , , , فلا ادري القانون عندنا 6 أشهر واطلع دور على ناس ثانية اضربهم ف ال 6 شهور لا أدري من اين اتى بها المشرع",فبالدول الغربيه تصل هذه العمله عقوبتها الي 12 سنه لانهم يعتبروها تشويه خلقي فلا ادري القانون عندنا 6 اشهر واطلع دور علي ناس ثانيه اضربهم ف ال 6 شهور لا ادري من اين اتي بها المشرع,,[],0,pending,,
mt_msa_da7331ad,train,36508,MSA,عادل حمدان معروف عند الجماهير الانصاريه وهو رجل الوقت الحالي لضخ الدماء الجديده في,عادل حمدان معروف عند الجماهير الانصاريه وهو رجل الوقت الحالي لضخ الدماء الجديده في,,[],0,pending,,
mt_dial_egy_d3f4e53f,train,78501,DIAL_EGY,اولا اشكر رجال الشرطه اللى فى المطار ثانيا هل هذا المكان المناسب لعرض الخبر فى فسم الحودث الخبر لا يمت للحودث,اولا اشكر رجال الشرطه اللي في المطار ثانيا هل هذا المكان المناسب لعرض الخبر في فسم الحودث الخبر لا يمت للحودث,,[],0,pending,,
mt_dial_glf_cca35008,train,41702,DIAL_GLF,اخرتاها بتسمعينه كلام يرفع ضغطه راسى يعورنى اصبر اللين ارضع الولد الخ الخ . .,اخرتاها بتسمعينه كلام يرفع ضغطه راسي يعورني اصبر اللين ارضع الولد الخ الخ,,[],0,pending,,
mt_dial_lev_eb6e977e,train,68388,DIAL_LEV,لعيون الوحداتييه غلبنا الفيصلاوييه والله نشامى يا رمثا ولكن وقعتكم هذه المره مع المارد الاخضر الذي لا يرحم فاحذورا غضبه واحذروا البركان الذي سيوجه الى بطوله كأس,لعيون الوحداتييه غلبنا الفيصلاوييه والله نشامي يا رمثا ولكن وقعتكم هذه المره مع المارد الاخضر الذي لا يرحم فاحذورا غضبه واحذروا البركان الذي سيوجه الي بطوله كاس,,[],0,pending,,
mt_msa_c94bbaac,train,22948,MSA,اعتقد ان سر جمع الرسول عليه الصلاة والسلام بين صفتي البخل والجبن في الاستعاذة يرجع لكون الجبن صفة ملازمة للبخل ، فالبخيل دائما يسكنه الجبن والعكس صحيح أيضاً ، ولذلك فهما صفتان متلازمتان لاتكاد تنفك إحداهما عن الأخرى عند معظم هؤلاء .,اعتقد ان سر جمع الرسول عليه الصلاه والسلام بين صفتي البخل والجبن في الاستعاذه يرجع لكون الجبن صفه ملازمه للبخل فالبخيل دايما يسكنه الجبن والعكس صحيح ايضا ولذلك فهما صفتان متلازمتان لاتكاد تنفك احداهما عن الاخري عند معظم هولاء,,[],0,pending,,
mt_dial_egy_3ee0d495,train,29575,DIAL_EGY,اية شوية المنافقين دول حاجة,ايه شويه المنافقين دول حاجه,,[],0,pending,,
mt_dial_glf_6876fe9c,train,4090,DIAL_GLF,انا ابي اعرف شي واحد الهلالين ليه تعليقاتهم على اخبار النصر اكثر من تعليقاتهم على اخبار ناديهم لهدرجه الحقد عامي,انا ابي اعرف شي واحد الهلالين ليه تعليقاتهم علي اخبار النصر اكثر من تعليقاتهم علي اخبار ناديهم لهدرجه الحقد عامي,,[],0,pending,,
mt_dial_lev_7ab39780,train,57888,DIAL_LEV,يسلم تمك استاذنا الكبير ولكن الا تلاحظ ان فريق الريان القطري لا يعتبر مثالا جيدا على الفريق القوي ! ! الم يخرج من الدور الثاني على يد فريق تايلندي مغمور ؟,يسلم تمك استاذنا الكبير ولكن الا تلاحظ ان فريق الريان القطري لا يعتبر مثالا جيدا علي الفريق القوي الم يخرج من الدور الثاني علي يد فريق تايلندي مغمور,,[],0,pending,,
mt_msa_1ba5f9aa,train,39822,MSA,وسرقوا الخدمه وحولها خبره . . وسفطوا الحقوق الاداريه والتقاعديه والماليه . . ولم ينصفوا كل مظلوم كان على بند 105,وسرقوا الخدمه وحولها خبره وسفطوا الحقوق الاداريه والتقاعديه والماليه ولم ينصفوا كل مظلوم كان علي بند 105,,[],0,pending,,
mt_dial_egy_1064fd3f,train,17623,DIAL_EGY,*ليه الدوله أسست تالت اكبر اكاديمية شرطه علي مستوي العالم و صرفت عليها مبالغ رهيبه من ميزانية الدوله مع ان فيه اشياء كتير اهم من بناء تالت اكبر اكاديميه شرطه علي مستوي العالم و ابسطها مياه الشرب الملوثه و جاي تقول مكلفين بحماية المواطن . . . ؟ ! !,ليه الدوله اسست تالت اكبر اكاديميه شرطه علي مستوي العالم و صرفت عليها مبالغ رهيبه من ميزانيه الدوله مع ان فيه اشياء كتير اهم من بناء تالت اكبر اكاديميه شرطه علي مستوي العالم و ابسطها مياه الشرب الملوثه و جاي تقول مكلفين بحمايه المواطن,,[],0,pending,,
mt_dial_glf_5baea62c,train,43458,DIAL_GLF,اللي قاهرني مواقع التفحيط معدوده ومعلومه عندكم وفيها مصايب مافيها لاكاميرا,اللي قاهرني مواقع التفحيط معدوده ومعلومه عندكم وفيها مصايب مافيها لاكاميرا,,[],0,pending,,
mt_dial_lev_4a27f387,train,50044,DIAL_LEV,إصحوا يا عالم و يا ناس على الهدر الغير مبرر للفلوس . . . و يا ريت إنه السجائر يأتي لكم بصحة جيدة . . . يظهر الشاب و أسنانه صفراء مقرفة و رائحته مقززة و لونه أسود ( فوق ما إحنا سمر ! ! ) و بعد عشرين سنة نضع له الشبكات في القلب . . . مش حرام عليكم ؟,اصحوا يا عالم و يا ناس علي الهدر الغير مبرر للفلوس و يا ريت انه السجاير ياتي لكم بصحه جيده يظهر الشاب و اسنانه صفراء مقرفه و رايحته مقززه و لونه اسود فوق ما احنا سمر و بعد عشرين سنه نضع له الشبكات في القلب مش حرام عليكم,,[],0,pending,,
mt_msa_30ee2aab,train,43467,MSA,ليس بغريب من اميرنا المحبوب وحبه للخير وتواضعه مع الصغير,ليس بغريب من اميرنا المحبوب وحبه للخير وتواضعه مع الصغير,,[],0,pending,,
mt_dial_egy_0f093abe,train,23275,DIAL_EGY,انا خائف علئ اوتوبيس الغزاويين الي فيهم,انا خايف علي اوتوبيس الغزاويين الي فيهم,,[],0,pending,,
mt_dial_glf_fb23f7b0,train,67424,DIAL_GLF,والله مالومها هربانه من الشر أهالهاوياليتهامركبة,والله مالومها هربانه من الشر اهالهاوياليتهامركبه,,[],0,pending,,
mt_dial_lev_6f97086a,train,37186,DIAL_LEV,لقد شدينا الحزام حتى وصل الى العظام . . ولم نعد نستطيع ان نتنفس بعد,لقد شدينا الحزام حتي وصل الي العظام ولم نعد نستطيع ان نتنفس بعد,,[],0,pending,,
mt_msa_17cd9353,train,20411,MSA,"نسبة ال 5 , 2 % ورسوم العقود ال 1400 لها مفعولها ، ،",نسبه ال 5 2 ورسوم العقود ال 1400 لها مفعولها,,[],0,pending,,
mt_dial_egy_224d4da9,train,990,DIAL_EGY,واحدبلديتنا اشترا عشرتلفزيونات مراتو بتسئلو لية كل المصاريف دى قال لها علشان اشوف المذيعة وهى,واحدبلديتنا اشترا عشرتلفزيونات مراتو بتسيلو ليه كل المصاريف دي قال لها علشان اشوف المذيعه وهي,,[],0,pending,,
mt_dial_glf_d735fa34,train,22216,DIAL_GLF,البيوت اسرار يمكن هذا الشايب عله جاب الي ولدة ازمة نفسية فية بعض الاباء موتهم رحمة لا يرحمون ولا يخلون رحمت ربي تنزل بس مسئلة تعقيد وفرض,البيوت اسرار يمكن هذا الشايب عله جاب الي ولده ازمه نفسيه فيه بعض الاباء موتهم رحمه لا يرحمون ولا يخلون رحمت ربي تنزل بس مسيله تعقيد وفرض,,[],0,pending,,
mt_dial_lev_1464bd3f,train,21619,DIAL_LEV,الكل معصبه معاه كيف المارد الاخضر سينتصر على,الكل معصبه معاه كيف المارد الاخضر سينتصر علي,,[],0,pending,,
mt_msa_11ecb501,train,74671,MSA,الى الاخ سالم اظن انك شخص مغيب التفكير لا تعلم ما تكتب فلوتعلم ما كنت تتحفتنا برايك مادا تفعل لو كانت هدة الفتاة امك او اختك اظنك مائة فى مائة انك احد خدام الحزب الصهيونى الديمقراطى حزب الاغلبية فى مصرادا كانت سياسة هدا الحزب هو انعدام النخوة و الوطنية فهم من باع الغاز المصرى لليهود من اجل ضرب غزة ومن اعطوا الصهاينة مواد التسليح لبناء صورلتجويع الفلسطنيون فليس بقليل ان يفعلوا دلك بابناء,الي الاخ سالم اظن انك شخص مغيب التفكير لا تعلم ما تكتب فلوتعلم ما كنت تتحفتنا برايك مادا تفعل لو كانت هده الفتاه امك او اختك اظنك مايه في مايه انك احد خدام الحزب الصهيوني الديمقراطي حزب الاغلبيه في مصرادا كانت سياسه هدا الحزب هو انعدام النخوه و الوطنيه فهم من باع الغاز المصري لليهود من اجل ضرب غزه ومن اعطوا الصهاينه مواد التسليح لبناء صورلتجويع الفلسطنيون فليس بقليل ان يفعلوا دلك بابناء,,[],0,pending,,
mt_dial_egy_91945159,train,31124,DIAL_EGY,ولحد إمتى يا زمالك حتبقى ملطشة ومطية للنادى الجهلى واللوبى الأحمر وأنا عايز اسأل سؤال لمسئولى نادى الزمالك منافسة إيه إللى بتحلموا بيها ما تفوقوا بقى وصحصحوا هو إنتم مش عارفين إنه ممنوع منافسة النادى الجهلى ومين إللى حيخليكم تاخدوا بطولة ولا إنتم نسيتم قول العضو الأحمر فى إتحاد كرة القدم الذى قال طول ما أنا عضو فى هذا الإتحاد فإن اولاد ال . . . كلمة شتيمة عمرهم ما حيشموا بطولة,ولحد امتي يا زمالك حتبقي ملطشه ومطيه للنادي الجهلي واللوبي الاحمر وانا عايز اسال سوال لمسيولي نادي الزمالك منافسه ايه اللي بتحلموا بيها ما تفوقوا بقي وصحصحوا هو انتم مش عارفين انه ممنوع منافسه النادي الجهلي ومين اللي حيخليكم تاخدوا بطوله ولا انتم نسيتم قول العضو الاحمر في اتحاد كره القدم الذي قال طول ما انا عضو في هذا الاتحاد فان اولاد ال كلمه شتيمه عمرهم ما حيشموا بطوله,,[],0,pending,,
mt_dial_glf_4617b29c,train,74050,DIAL_GLF,كبير من يومك يا بو,كبير من يومك يا بو,,[],0,pending,,
mt_dial_lev_46d8b8b2,train,14299,DIAL_LEV,يا عمي مالنا و مال الحكي الكاس محسوم للامبراطور,يا عمي مالنا و مال الحكي الكاس محسوم للامبراطور,,[],0,pending,,
mt_msa_3c2f9ff1,train,17225,MSA,""" لا يجوز بأي حال من الأحوال",لا يجوز باي حال من الاحوال,,[],0,pending,,
mt_dial_egy_4ef9c7f1,train,648,DIAL_EGY,انا مش فاهم هو فى معتقل وللا فى سجن عادى,انا مش فاهم هو في معتقل وللا في سجن عادي,,[],0,pending,,
mt_dial_glf_bff80810,train,18946,DIAL_GLF,حسستني انك لو بتعارض راح يقبلون,حسستني انك لو بتعارض راح يقبلون,,[],0,pending,,
mt_dial_lev_5c3e65a9,train,19188,DIAL_LEV,ارض اردن ما تنداس وابا الحسين قائدنا نحن طلقة في فرد ابا الحسين اردن اولا عاش ابا الحسين عاش ابا الحسين عاش عاش عاش بحبك و اللة,ارض اردن ما تنداس وابا الحسين قايدنا نحن طلقه في فرد ابا الحسين اردن اولا عاش ابا الحسين عاش ابا الحسين عاش عاش عاش بحبك و الله,,[],0,pending,,
mt_msa_ce5b89fb,train,76602,MSA,وبغير ذلك فإن الجميع سيظلون يعانون من القهر والظلم وسوء,وبغير ذلك فان الجميع سيظلون يعانون من القهر والظلم وسوء,,[],0,pending,,
mt_dial_egy_9b152d4e,train,19024,DIAL_EGY,انا مش عارف والله يا جماعة الراجل دة عايش معانا فى مصر ولا ساكن فى,انا مش عارف والله يا جماعه الراجل ده عايش معانا في مصر ولا ساكن في,,[],0,pending,,
mt_dial_glf_9ed5cf83,train,14229,DIAL_GLF,مبروك لشباب وشكر خاص لجميع,مبروك لشباب وشكر خاص لجميع,,[],0,pending,,
