example_id,source_split,source_row_id,dialect,original_text,normalized_text,masked_text,mask_spans_json,mask_count,annotation_status,annotator_model,notes
mt_dial_egy_28f2ab6d,train,22929,DIAL_EGY,ولكن عند المطالبة بحقوقهم مفيش حد بينزل,ولكن عند المطالبه بحقوقهم مفيش حد بينزل,,[],0,pending,,
mt_dial_glf_bca6bb8f,train,5442,DIAL_GLF,اسمع كلامك اصدقك اشوف امورك استعجب . . . يا,اسمع كلامك اصدقك اشوف امورك استعجب يا,,[],0,pending,,
mt_dial_lev_e8d56224,train,17078,DIAL_LEV,يا اخوان هون عنا احنا الواحد بس يكون بصحتو ويخدم العالم الكل بصير يحبو وبس يصير في شي من سبب الشغل بصير الشخص ما إلو داعي بس انا بحكي الله يعاقب كل واحد يتحكم في اموال الناس ويرجعها,يا اخوان هون عنا احنا الواحد بس يكون بصحتو ويخدم العالم الكل بصير يحبو وبس يصير في شي من سبب الشغل بصير الشخص ما الو داعي بس انا بحكي الله يعاقب كل واحد يتحكم في اموال الناس ويرجعها,,[],0,pending,,
mt_msa_100ead80,train,53548,MSA,الذين يطالبون الوزير بالرحيل هم من تغذوا علي الفساد والاهمال حتي صار هو,الذين يطالبون الوزير بالرحيل هم من تغذوا علي الفساد والاهمال حتي صار هو,,[],0,pending,,
mt_dial_egy_2c5748e7,train,27523,DIAL_EGY,دا كل لعيبتكم وقعت جوا 18 حتى الجحش احمد غانم اللى مش عارف,دا كل لعيبتكم وقعت جوا 18 حتي الجحش احمد غانم اللي مش عارف,,[],0,pending,,
mt_dial_glf_2ddac999,train,2726,DIAL_GLF,ربي بيكشف كل ظالم الله ينتقم من,ربي بيكشف كل ظالم الله ينتقم من,,[],0,pending,,
mt_dial_lev_83efc55f,train,69080,DIAL_LEV,والله يا عبدالله ذيب بتترك نادي الوحدات وبتروح على نادي درجة تانية والله هاي مبينة عيني عينك,والله يا عبدالله ذيب بتترك نادي الوحدات وبتروح علي نادي درجه تانيه والله هاي مبينه عيني عينك,,[],0,pending,,
mt_msa_4b948741,train,46363,MSA,مستر / متشل أنس ( الانجليزى ) أول رئيس للنادي الأهلي وذلك للاستفادة من,مستر متشل انس الانجليزي اول رييس للنادي الاهلي وذلك للاستفاده من,,[],0,pending,,
mt_dial_egy_d5c2134a,train,56142,DIAL_EGY,بتسألوا ليه انتشرت مثل هذه الاعمال اليكم بعض الاسباب,بتسالوا ليه انتشرت مثل هذه الاعمال اليكم بعض الاسباب,,[],0,pending,,
mt_dial_glf_a03c5abf,train,15991,DIAL_GLF,محمد نجيب من أفضل الإعلاميين العرب وخلو عنكم الكلام الفاضي . . . سنين وحنا نتابع القنوات المحلية اللي ما عندها الا المدح والتمجيد والضحك على المشاهد,محمد نجيب من افضل الاعلاميين العرب وخلو عنكم الكلام الفاضي سنين وحنا نتابع القنوات المحليه اللي ما عندها الا المدح والتمجيد والضحك علي المشاهد,,[],0,pending,,
mt_dial_lev_69ebaa33,train,31488,DIAL_LEV,شكرا جزيلا سيادة الوزير على عدم فرظ ظرائب جديدة هاظا العام ، لأن الوظع شوي متظعظع في هظه السنة . . . أما السنة القادمة فلا بأس . . . شكرا لكم مجددا سيدي .,شكرا جزيلا سياده الوزير علي عدم فرظ ظرايب جديده هاظا العام لان الوظع شوي متظعظع في هظه السنه اما السنه القادمه فلا باس شكرا لكم مجددا سيدي,,[],0,pending,,
mt_msa_fd4a9d73,train,48050,MSA,"والاسلام لم يغفل "" الآخر "" في احكامه . . وحتى هذا الاخر . . مادام يقيم ببلدك وهو معاهد . . يحكم فيه بشريعة الاسلام",والاسلام لم يغفل الاخر في احكامه وحتي هذا الاخر مادام يقيم ببلدك وهو معاهد يحكم فيه بشريعه الاسلام,,[],0,pending,,
mt_dial_egy_2f9de114,train,77721,DIAL_EGY,ابقى اديلهم دكتوراه شرفية فى العربى او نجيب واحد يكتبلهم عشان,ابقي اديلهم دكتوراه شرفيه في العربي او نجيب واحد يكتبلهم عشان,,[],0,pending,,
mt_dial_glf_b5596ebf,train,43120,DIAL_GLF,والشركه يقولون انه ما نضمن يمكن تروح,والشركه يقولون انه ما نضمن يمكن تروح,,[],0,pending,,
mt_dial_lev_6798000d,train,47386,DIAL_LEV,الله يخليله ولاده وعقبال مالمناصير يصير هو,الله يخليله ولاده وعقبال مالمناصير يصير هو,,[],0,pending,,
mt_msa_01573877,train,83162,MSA,تحيه الى معالي وزير الصحه وجهودكم مشكوره جدا للاهتمام المباشر بقضايا المستشفيات في المملكه أما من جانب آخر ماهي مقومات المستشفى ؟ وجود بناء صحي ؟ معدات وتجهيزات طبيه ؟ أدويه ؟ كوادر وطواقم مؤهله ؟ أطباء ؟ في الحقيقه عدنا لا نعلم هل ما يسمى بالتوتنجي مستشفى ؟ أم المقصود بهذا شيء آخر,تحيه الي معالي وزير الصحه وجهودكم مشكوره جدا للاهتمام المباشر بقضايا المستشفيات في المملكه اما من جانب اخر ماهي مقومات المستشفي وجود بناء صحي معدات وتجهيزات طبيه ادويه كوادر وطواقم موهله اطباء في الحقيقه عدنا لا نعلم هل ما يسمي بالتوتنجي مستشفي ام المقصود بهذا شيء اخر,,[],0,pending,,
mt_dial_egy_0a7c73d4,train,84399,DIAL_EGY,علشان يحترموا نفسهم ويراعوا ضميرهم,علشان يحترموا نفسهم ويراعوا ضميرهم,,[],0,pending,,
mt_dial_glf_1c79e04d,train,44533,DIAL_GLF,عطوك اللي تبي المفروض تقول اشكرهم موب احترم القرار بس وش هالسفره اللي خلتك تسوي اللي,عطوك اللي تبي المفروض تقول اشكرهم موب احترم القرار بس وش هالسفره اللي خلتك تسوي اللي,,[],0,pending,,
mt_dial_lev_cc36f798,train,56276,DIAL_LEV,بالنسبة للرئيس طارق خوري فهذا يا طارق ليس بالفعل وقت التهريج وتهبيط المعنويات واذا الكلام صحيح بش حلوة منك يا رئيس النادي الاروع في تاريخ الوحدات الكبير وبتمنى التاثير يكون ايجابي,بالنسبه للرييس طارق خوري فهذا يا طارق ليس بالفعل وقت التهريج وتهبيط المعنويات واذا الكلام صحيح بش حلوه منك يا رييس النادي الاروع في تاريخ الوحدات الكبير وبتمني التاثير يكون ايجابي,,[],0,pending,,
mt_msa_26f6bc76,train,84576,MSA,جميل أن ينهض الإنسان بعد أن,جميل ان ينهض الانسان بعد ان,,[],0,pending,,
mt_dial_egy_36fed734,train,35884,DIAL_EGY,بس السؤال يعني هو ماله ؟ ولا هو كان عايز يدرب الجزائر ويقبض فلوس منهم بس لما اعتمدوا علي مدرب وطني قال يتريق,بس السوال يعني هو ماله ولا هو كان عايز يدرب الجزاير ويقبض فلوس منهم بس لما اعتمدوا علي مدرب وطني قال يتريق,,[],0,pending,,
mt_dial_glf_75f55703,train,9135,DIAL_GLF,الجوال ما له علاقه ابدا بالعكس كثير من الناس يعطيها جوال لكي يكون عللا اطمئنان على اطفاله او بيته لابد من تطبيق العقوبه على الهارب والمتسبب بالهرب وخاصه المتسبب هو راس,الجوال ما له علاقه ابدا بالعكس كثير من الناس يعطيها جوال لكي يكون عللا اطمينان علي اطفاله او بيته لابد من تطبيق العقوبه علي الهارب والمتسبب بالهرب وخاصه المتسبب هو راس,,[],0,pending,,
mt_dial_lev_f382a7d7,train,39294,DIAL_LEV,مسكين ابصر شو اللي رماه هالرمية وجابو على,مسكين ابصر شو اللي رماه هالرميه وجابو علي,,[],0,pending,,
mt_msa_9d6f9399,train,19775,MSA,من اشعل فتيل الفتنة هو الاعلام,من اشعل فتيل الفتنه هو الاعلام,,[],0,pending,,
