example_id,source_split,source_row_id,dialect,original_text,normalized_text,masked_text,mask_spans_json,mask_count,annotation_status,annotator_model,notes
mt_dial_lev_fd2e1a95,train,51668,DIAL_LEV,هاي مصاري الكادحين من ابناء,هاي مصاري الكادحين من ابناء,,[],0,pending,,
mt_msa_e5e0c44a,train,45116,MSA,فوضى والدليل ان اهل السطحات من,فوضي والدليل ان اهل السطحات من,,[],0,pending,,
mt_dial_egy_bb96e1a4,train,19352,DIAL_EGY,يبدو انها لم تحصل على مرتب الشهر ومستنية تقبضانا,يبدو انها لم تحصل علي مرتب الشهر ومستنيه تقبضانا,,[],0,pending,,
mt_dial_glf_6e4eebd1,train,39643,DIAL_GLF,وترى الانثى حقته عندها غيرة لو يخونها ممكن تقتله !,وتري الانثي حقته عندها غيره لو يخونها ممكن تقتله,,[],0,pending,,
mt_dial_lev_28756a6c,train,64201,DIAL_LEV,محمد اليماني مدرب منيح ويمكن نظرته لحسام شديفات بجوز تكون,محمد اليماني مدرب منيح ويمكن نظرته لحسام شديفات بجوز تكون,,[],0,pending,,
mt_msa_4878c473,train,78867,MSA,احييك يا ابراهيم وارجوك ان تستمر حتى اقرأك فأراك وأرى كل الاصدقاء والاحبة,احييك يا ابراهيم وارجوك ان تستمر حتي اقراك فاراك واري كل الاصدقاء والاحبه,,[],0,pending,,
mt_dial_egy_a3b33bcb,train,44414,DIAL_EGY,وكمان مش بيسمعو قررات من,وكمان مش بيسمعو قررات من,,[],0,pending,,
mt_dial_glf_2b932af6,train,63346,DIAL_GLF,يارجال سددو راعي الوايت اللي يعبي البركه مدري المسبح اذا كان عندكم مسبح وبعدين دور ولكم,يارجال سددو راعي الوايت اللي يعبي البركه مدري المسبح اذا كان عندكم مسبح وبعدين دور ولكم,,[],0,pending,,
mt_dial_lev_fd2ef70d,train,60878,DIAL_LEV,انا تقدمت بطلب توظيف لديوان الخدمة المدنية منذ عشرة شهور ( آب 2009 ) ولا يوجدحتى الان طلب باسمي بديوان الخدمة كيف صارت اذا حد عنده تفسير يا ريت تخبروني وشكرا,انا تقدمت بطلب توظيف لديوان الخدمه المدنيه منذ عشره شهور اب 2009 ولا يوجدحتي الان طلب باسمي بديوان الخدمه كيف صارت اذا حد عنده تفسير يا ريت تخبروني وشكرا,,[],0,pending,,
mt_msa_13967e52,train,85853,MSA,يقول المفكر برهان غليون إن العلمانية التي لا تضمن الحرية الفكرية والسياسية وتحافظ عليها ، تفقد شرعيتها وتتحول إلى أداة لتسويق عقيدة سائدة ، مشيرا إلى أن العلمانية «لا تشكل عقيدة بحد ذاتها ، ولكنها تقدم نفسها على أنها المبدأ الذي يكفل ممارسة العقائد جميعا بقدر ما هو مؤسس لمفهوم الحرية الفكرية .,يقول المفكر برهان غليون ان العلمانيه التي لا تضمن الحريه الفكريه والسياسيه وتحافظ عليها تفقد شرعيتها وتتحول الي اداه لتسويق عقيده سايده مشيرا الي ان العلمانيه لا تشكل عقيده بحد ذاتها ولكنها تقدم نفسها علي انها المبدا الذي يكفل ممارسه العقايد جميعا بقدر ما هو موسس لمفهوم الحريه الفكريه,,[],0,pending,,
mt_dial_egy_8cf2a047,train,65572,DIAL_EGY,ينقص مصر الضمير وربما الادارة مفهوم مطاط ولا يخلو من القيل والقال هل كل مدير ناجح وهل كل مدير قائد وهل كل مدير لديه موهبة القيادة بالطبع لا فما بال الاخ الكاتب ان تكون هناك بيرو قراطية يعني بالبلدي عقبال القرار ما يتنفذ يكون ناس اتولدت وناس ماتت يبقي محلناش علي ما اظن اننا نحتاج الضمير اسهل ف التطبيق ومن اين ياتي عندما يكون هناك حاكم عادل يخاف الخالق ولا يهاب سواه ولديه بطانة صالحة ونحن بالطبع مميزين عن باقي خلق الله علي مدار التاريخ باننا نحتاج لمن ياخذ يد كل منا فلو تم وصل الحلقة المفقودة الخاصة بين المصري وحاكمه فعلم ولا ادارة ولا مدرب من البرازيل هينفع اهم حاجه روح الفريق ومش مهم مين يكسب المهم اننا نبقي منظرنا كويس زي ما قال الريس اللهم ولي امورنا خيارنا ولا تولي امورنا,ينقص مصر الضمير وربما الاداره مفهوم مطاط ولا يخلو من القيل والقال هل كل مدير ناجح وهل كل مدير قايد وهل كل مدير لديه موهبه القياده بالطبع لا فما بال الاخ الكاتب ان تكون هناك بيرو قراطيه يعني بالبلدي عقبال القرار ما يتنفذ يكون ناس اتولدت وناس ماتت يبقي محلناش علي ما اظن اننا نحتاج الضمير اسهل ف التطبيق ومن اين ياتي عندما يكون هناك حاكم عادل يخاف الخالق ولا يهاب سواه ولديه بطانه صالحه ونحن بالطبع مميزين عن باقي خلق الله علي مدار التاريخ باننا نحتاج لمن ياخذ يد كل منا فلو تم وصل الحلقه المفقوده الخاصه بين المصري وحاكمه فعلم ولا اداره ولا مدرب من البرازيل هينفع اهم حاجه روح الفريق ومش مهم مين يكسب المهم اننا نبقي منظرنا كويس زي ما قال الريس اللهم ولي امورنا خيارنا ولا تولي امورنا,,[],0,pending,,
mt_dial_glf_166532ca,train,54200,DIAL_GLF,اعجبتني حركة الرمل الليجابته من الامارات و نثرته هناك :,اعجبتني حركه الرمل الليجابته من الامارات و نثرته هناك,,[],0,pending,,
mt_dial_lev_4501fe74,train,55790,DIAL_LEV,واحد ازعر ضريب امواس بشوه شاب ابن ناس . بروح ابن الناس يشتكي للشرطة بصيروا يضحكوا عليه وطبعا مش رح يمسكوا الازعر ( على الاقل لازم تيجي عليه عشر شكاوي ) واذا الشرطة جابت الازعر وتحاكم بكون الحكم 3 اشهر مع امكانية دفع بدل مالي وبطلع عشان يكمل الزعرنة وضرب الامواس . يا جماعة انا بحكي عن تجربة مع هيك قصص . وحسبنا الله ونعم,واحد ازعر ضريب امواس بشوه شاب ابن ناس بروح ابن الناس يشتكي للشرطه بصيروا يضحكوا عليه وطبعا مش رح يمسكوا الازعر علي الاقل لازم تيجي عليه عشر شكاوي واذا الشرطه جابت الازعر وتحاكم بكون الحكم 3 اشهر مع امكانيه دفع بدل مالي وبطلع عشان يكمل الزعرنه وضرب الامواس يا جماعه انا بحكي عن تجربه مع هيك قصص وحسبنا الله ونعم,,[],0,pending,,
mt_msa_2489240d,train,8739,MSA,قوة الأمة وإرادتها وعزيمتها ( ( عيني متلهفة لرية رجال الامة ),قوه الامه وارادتها وعزيمتها عيني متلهفه لريه رجال الامه,,[],0,pending,,
mt_dial_egy_b441a96b,train,86053,DIAL_EGY,ومفيش أي لوم على سيادة المستشار . . . العيب كله عالفلاح شوبير اللي مش عارف يرد ومفكر نفسه قاعد على مسطبة,ومفيش اي لوم علي سياده المستشار العيب كله عالفلاح شوبير اللي مش عارف يرد ومفكر نفسه قاعد علي مسطبه,,[],0,pending,,
mt_dial_glf_f9a22e91,train,23074,DIAL_GLF,هل هذا هو فعل الكبار الذين المفروض منهم أن يكونون قدوات,هل هذا هو فعل الكبار الذين المفروض منهم ان يكونون قدوات,,[],0,pending,,
mt_dial_lev_04126491,train,68799,DIAL_LEV,اعرف شغلة وحدة انو الفيصلي,اعرف شغله وحده انو الفيصلي,,[],0,pending,,
mt_msa_aae43f32,train,17295,MSA,انت فاشل انت فاشل انت فاشل انت فاشل انت فاشل انت فاشل انت فاشل انت فاشلانت فاشل انت فاشل انت فاشل انت فاشل انت فاشل انت فاشل انت فاشل انت فاشل انت فاشل انت فاشل انت فاشل انت فاشل انت فاشل انت فاشل انت فاشل انت فاشل انت فاشل انت فاشل انت فاشل انت فاشل انت فاشل انت فاشل انت فاشل انت فاشل انت فاشل انت فاشل انت فاشل انت فاشل انت فاشل انت فاشل انت فاشل انت فاشل ا نت فاشل انت فاشل انت فاشل انت فاشل انت فاشل انت فاشل انت فاشل انت فاشل انت فاشل انت فاشل انت فاشل انت فاشل انت فاشل انت فاشل انت فاشل انت,انت فاشل انت فاشل انت فاشل انت فاشل انت فاشل انت فاشل انت فاشل انت فاشلانت فاشل انت فاشل انت فاشل انت فاشل انت فاشل انت فاشل انت فاشل انت فاشل انت فاشل انت فاشل انت فاشل انت فاشل انت فاشل انت فاشل انت فاشل انت فاشل انت فاشل انت فاشل انت فاشل انت فاشل انت فاشل انت فاشل انت فاشل انت فاشل انت فاشل انت فاشل انت فاشل انت فاشل انت فاشل انت فاشل انت فاشل انت فاشل ا نت فاشل انت فاشل انت فاشل انت فاشل انت فاشل انت فاشل انت فاشل انت فاشل انت فاشل انت فاشل انت فاشل انت فاشل انت فاشل انت فاشل انت فاشل انت,,[],0,pending,,
mt_dial_egy_c26d9b48,train,79041,DIAL_EGY,تسمي نفسها ابو جهل او أم جهل برضه هية نيفين شكري بأسلوبها و مفرداتها اللي مش عارفة,تسمي نفسها ابو جهل او ام جهل برضه هيه نيفين شكري باسلوبها و مفرداتها اللي مش عارفه,,[],0,pending,,
mt_dial_glf_a3dfa7ab,train,46010,DIAL_GLF,الله يحفظ حكومتنآ الرشيده والدكتور عبدالله الربيعه ويجزآه خير .,الله يحفظ حكومتنا الرشيده والدكتور عبدالله الربيعه ويجزاه خير,,[],0,pending,,
mt_dial_lev_d6136fbe,train,33072,DIAL_LEV,يعني حلو الجو بالقاهرة هل الايام ومتاكدة انهم حيقضوا وقت حلو بالشمسات ! !,يعني حلو الجو بالقاهره هل الايام ومتاكده انهم حيقضوا وقت حلو بالشمسات,,[],0,pending,,
mt_msa_ea076e94,train,6336,MSA,من ارض الامارات ارض العرب والكرم اقول مليار مبروك للوحدات وهاردلك يا رمثا فانت دائما بطل وستبقى بطل وتحياتي للفريقين فهما دائما فائزين |نشاء الله اللهم زد,من ارض الامارات ارض العرب والكرم اقول مليار مبروك للوحدات وهاردلك يا رمثا فانت دايما بطل وستبقي بطل وتحياتي للفريقين فهما دايما فايزين نشاء الله اللهم زد,,[],0,pending,,
mt_dial_egy_6a2c8a4f,train,10275,DIAL_EGY,هو الزمالك نادي الفاشلين ميدو لما يطالب الجمهور الانجليزي في النادي اللي بيلعب فية بعدم حاجة الفريق لخدماتة يقول انا عاوز ارد الجميل للزمالك اي لما يفشل يفتكر الزبالك عجبي انت فاشل ونادي الزمالك افشل منك يا عمي روح دخن شيشة بلاها,هو الزمالك نادي الفاشلين ميدو لما يطالب الجمهور الانجليزي في النادي اللي بيلعب فيه بعدم حاجه الفريق لخدماته يقول انا عاوز ارد الجميل للزمالك اي لما يفشل يفتكر الزبالك عجبي انت فاشل ونادي الزمالك افشل منك يا عمي روح دخن شيشه بلاها,,[],0,pending,,
mt_dial_glf_3dea060d,train,27285,DIAL_GLF,البطوله هذي بعض الدورات الرمضانيه اهم منها,البطوله هذي بعض الدورات الرمضانيه اهم منها,,[],0,pending,,
mt_dial_lev_9700dde0,train,72046,DIAL_LEV,اما بالنسبة لقولك ان لاعبي الوحدات لا يحردون ولا يتصادمون مع ادارتهم مثل الفيصلي فانا اكرر المعلومة للمرة الثالثة لمن لم يقراها . . فلاعبي الوحدات حردو وامتنعو عن اكمال الدوري عام 1993 بسبب المال واشياء اخرى ولا داعي لذكر,اما بالنسبه لقولك ان لاعبي الوحدات لا يحردون ولا يتصادمون مع ادارتهم مثل الفيصلي فانا اكرر المعلومه للمره الثالثه لمن لم يقراها فلاعبي الوحدات حردو وامتنعو عن اكمال الدوري عام 1993 بسبب المال واشياء اخري ولا داعي لذكر,,[],0,pending,,
mt_msa_6b5aea68,train,76424,MSA,كم انت رائع ايها المارد ففعلا انت مقبره الخصوم,كم انت رايع ايها المارد ففعلا انت مقبره الخصوم,,[],0,pending,,
mt_dial_egy_2427e3f4,train,4237,DIAL_EGY,ما حد يفهمنا يا جماعة ولا هى كلها فى بعضها عصابة واحدة وكل واحد ليه دور بينفذه ؟ ؟,ما حد يفهمنا يا جماعه ولا هي كلها في بعضها عصابه واحده وكل واحد ليه دور بينفذه,,[],0,pending,,
mt_dial_glf_34de516f,train,78054,DIAL_GLF,اقول الطاسة ضايعه وكلن يلعب على كيفه وحاميها هيئتها اقصد حراميها . . اعتذر للحراميه لتشبيههم بهيئة,اقول الطاسه ضايعه وكلن يلعب علي كيفه وحاميها هييتها اقصد حراميها اعتذر للحراميه لتشبيههم بهييه,,[],0,pending,,
mt_dial_lev_a5fab48b,train,16372,DIAL_LEV,و مع هيك برضو ما,و مع هيك برضو ما,,[],0,pending,,
mt_msa_f6dd1de9,train,39277,MSA,اللهم ارزقنا لسانا ذاكرا وقلبا خاشعا وجسدا على البلاء صابرا وعينان تدمعان من خشية الله اللهم آمين,اللهم ارزقنا لسانا ذاكرا وقلبا خاشعا وجسدا علي البلاء صابرا وعينان تدمعان من خشيه الله اللهم امين,,[],0,pending,,
mt_dial_egy_2aec38e2,train,23487,DIAL_EGY,ونبقى زى شعب فلسطين هم يعانو وحنا,ونبقي زي شعب فلسطين هم يعانو وحنا,,[],0,pending,,
mt_dial_glf_a669acf4,train,52680,DIAL_GLF,ه والله انك صادق يابو هليل الواحد الحين لا بغى احد في بيتهم دق عليه بالجوال والله انه نعمه,ه والله انك صادق يابو هليل الواحد الحين لا بغي احد في بيتهم دق عليه بالجوال والله انه نعمه,,[],0,pending,,
mt_dial_lev_5bc09fd2,train,10420,DIAL_LEV,- الصراحه راحه الوحدات بطل كأس,الصراحه راحه الوحدات بطل كاس,,[],0,pending,,
mt_msa_b68cf85d,train,85201,MSA,والدوري الاغلى والاحلى والاجمل للزعيم الاوحد في,والدوري الاغلي والاحلي والاجمل للزعيم الاوحد في,,[],0,pending,,
mt_dial_egy_df99e89e,train,50100,DIAL_EGY,شوية بعض المعارضة يشتموا و شوية يسيبوا الموضوع الاصلى او المقال,شويه بعض المعارضه يشتموا و شويه يسيبوا الموضوع الاصلي او المقال,,[],0,pending,,
mt_dial_glf_f57c3697,train,78738,DIAL_GLF,كلامك عسل يابو موزان وكذا الرجال,كلامك عسل يابو موزان وكذا الرجال,,[],0,pending,,
mt_dial_lev_58dcec4d,train,5653,DIAL_LEV,اكيد حسن نصرالله ضرب اسرائيل واحنا مش,اكيد حسن نصرالله ضرب اسراييل واحنا مش,,[],0,pending,,
mt_msa_a9adbbe2,train,62301,MSA,ياجماعه كفى جدال في امور,ياجماعه كفي جدال في امور,,[],0,pending,,
mt_dial_egy_2adf21db,train,46962,DIAL_EGY,ولا هو عشان بقالهم كتير محدش شتم ف بعضة فقالو نقومها شوية . . . ياريت تبقى دماغنا اكبر من كدا,ولا هو عشان بقالهم كتير محدش شتم ف بعضه فقالو نقومها شويه ياريت تبقي دماغنا اكبر من كدا,,[],0,pending,,
mt_dial_glf_2d340aa8,train,4561,DIAL_GLF,الشاب ماعنده شي يمنعه من معاكسة البنت الا اذا شافها متستره او معها مولي امرها !,الشاب ماعنده شي يمنعه من معاكسه البنت الا اذا شافها متستره او معها مولي امرها,,[],0,pending,,
mt_dial_lev_d5f4b50b,train,10596,DIAL_LEV,وبعد تفكير عميق دام طوال الليل وبعد الاتصالات المستمره مع اصدقائي في المانيا وفي ميونخ وفي هامبورغ وطلبت تقريرا سريعا ومفصلا عن هذا ( الاخطبوط ) وبعثت 10 ايميلات و 43 مسج و 76 مست كول حتى تصلني معلومات دقيقه وتبين ان الاخطبوط فلته تبين ان الاخطبوط ازعر تبين ان الاخطبوط له نهفات وتوقعات وشبكت على الياهو والمسنجر مع الاخطبوط مباشره وطلبت منه اخر التوقعات الاردنيه درع ودوري وكأس وكؤؤس وطلبت منه اخر تعويذه للوحدات حتى استعملها الموسم الجديد فكان توقع الاخطبوط كما يلي :,وبعد تفكير عميق دام طوال الليل وبعد الاتصالات المستمره مع اصدقايي في المانيا وفي ميونخ وفي هامبورغ وطلبت تقريرا سريعا ومفصلا عن هذا الاخطبوط وبعثت 10 ايميلات و 43 مسج و 76 مست كول حتي تصلني معلومات دقيقه وتبين ان الاخطبوط فلته تبين ان الاخطبوط ازعر تبين ان الاخطبوط له نهفات وتوقعات وشبكت علي الياهو والمسنجر مع الاخطبوط مباشره وطلبت منه اخر التوقعات الاردنيه درع ودوري وكاس وكووس وطلبت منه اخر تعويذه للوحدات حتي استعملها الموسم الجديد فكان توقع الاخطبوط كما يلي,,[],0,pending,,
mt_msa_dc0fac0d,train,32891,MSA,وَاقلَعْ جُذورَ الخَائنينَ * فَمنْهُم كُلُّ,واقلع جذور الخاينين فمنهم كل,,[],0,pending,,
mt_dial_egy_b09b785d,train,64269,DIAL_EGY,اه صحيح انتم اتزنقم والغيرة والحقد طفح,اه صحيح انتم اتزنقم والغيره والحقد طفح,,[],0,pending,,
mt_dial_glf_a8d01eac,train,12047,DIAL_GLF,"ياجماعه الخير خلونا واقعيين شوي ,",ياجماعه الخير خلونا واقعيين شوي,,[],0,pending,,
mt_dial_lev_04df77ae,train,65555,DIAL_LEV,والله انكم اسياد الطائرة وبنفتخر فيكم بس عتبنا ع الاتحاد بطريقة توزيع الجوائز يعني مش معقول بطل الدوري مايكون افضل ضارب وصانع العاب مش منه بس اتعودنا عهيك اختيارات مزاجية والمهم انه بطل الدوري بشهادة الكل وبظرف 24,والله انكم اسياد الطايره وبنفتخر فيكم بس عتبنا ع الاتحاد بطريقه توزيع الجوايز يعني مش معقول بطل الدوري مايكون افضل ضارب وصانع العاب مش منه بس اتعودنا عهيك اختيارات مزاجيه والمهم انه بطل الدوري بشهاده الكل وبظرف 24,,[],0,pending,,
mt_msa_171054b9,train,58650,MSA,نبارك للعثمان والغامدي هذا النجاح ومن نجاح الى,نبارك للعثمان والغامدي هذا النجاح ومن نجاح الي,,[],0,pending,,
mt_dial_egy_2c7af367,train,19143,DIAL_EGY,اضحكنى هتاف الهتيفة بفترة رئاسية اخرى . . والدعاء بالعمر المديد لحامى حمى النسبة المئوية خمسين فى الميه هليبة وشللية والموافقة بالاغلبية . . مش هو يا سادة اللى ارسى هذه النسبة دى ثورة يوليو التى قام بها سيده الذى بنى المصانع ووزع الاراضى الزراعية وقضى على الاقطاع والراسمالية وكان مجاور من اكبر الهتيفة فى الحزب الاشتراكى ( راجع تاريخك الفوضوى ) والان لم تعد هناك مصانع ولا صناعة . . ولم تعد اراضى زراعية ولا زراعة . . اى لم يعد هناك عمال ينتجون او فلاحين يزرعون . . كله من الفساد اما هج او طق من الحسرة ومات . . ولم يبقى الا طفلة المصلحجية وشلة الصهبجية وامان يا لا لى احكمنا كمان وكمان . . كفايكوا 30 سنة خراب وخلوا الناس تشم نفسها . . هو انتم تنفذوا السياسات الامريكية زى الكلاب بلا نباح . . وتتعللوا بالبرادعى وموالاته لها . . . خايفين من التغيير ليه . . خايفين من انتفاضة شعب تحملكم وتحمل فسادكم ليه . . هتعملوا ايه بالملايين اللى جمعتوها . . دا الكفن ملوش جيوب . . والموت مدرككم حتى لو كنتم فى قلوع الحزب,اضحكني هتاف الهتيفه بفتره رياسيه اخري والدعاء بالعمر المديد لحامي حمي النسبه الميويه خمسين في الميه هليبه وشلليه والموافقه بالاغلبيه مش هو يا ساده اللي ارسي هذه النسبه دي ثوره يوليو التي قام بها سيده الذي بني المصانع ووزع الاراضي الزراعيه وقضي علي الاقطاع والراسماليه وكان مجاور من اكبر الهتيفه في الحزب الاشتراكي راجع تاريخك الفوضوي والان لم تعد هناك مصانع ولا صناعه ولم تعد اراضي زراعيه ولا زراعه اي لم يعد هناك عمال ينتجون او فلاحين يزرعون كله من الفساد اما هج او طق من الحسره ومات ولم يبقي الا طفله المصلحجيه وشله الصهبجيه وامان يا لا لي احكمنا كمان وكمان كفايكوا 30 سنه خراب وخلوا الناس تشم نفسها هو انتم تنفذوا السياسات الامريكيه زي الكلاب بلا نباح وتتعللوا بالبرادعي وموالاته لها خايفين من التغيير ليه خايفين من انتفاضه شعب تحملكم وتحمل فسادكم ليه هتعملوا ايه بالملايين اللي جمعتوها دا الكفن ملوش جيوب والموت مدرككم حتي لو كنتم في قلوع الحزب,,[],0,pending,,
mt_dial_glf_b98d5ea0,train,72424,DIAL_GLF,بس احساسي انك بتاخذ هالفلوس,بس احساسي انك بتاخذ هالفلوس,,[],0,pending,,
mt_dial_lev_e6a604a7,train,34951,DIAL_LEV,مش عارف ليش الناس بالزرقاء معظمهم عصبيين نفسي ارحل مش قادر,مش عارف ليش الناس بالزرقاء معظمهم عصبيين نفسي ارحل مش قادر,,[],0,pending,,
mt_msa_39271d79,train,50137,MSA,هل هذي ترضية من نوع غريب لأن الهلال انهى المباراة,هل هذي ترضيه من نوع غريب لان الهلال انهي المباراه,,[],0,pending,,
