example_id,source_split,source_row_id,dialect,original_text,normalized_text,masked_text,mask_spans_json,mask_count,annotation_status,annotator_model,notes
mt_dial_lev_ebbf3544,train,10105,DIAL_LEV,ما بعرف كيف الطريقه للتاهل هل في تصفيات هل هي قرعه ام مشاركه هيك لله,ما بعرف كيف الطريقه للتاهل هل في تصفيات هل هي قرعه ام مشاركه هيك لله,,[],0,pending,,
mt_msa_506a58dd,train,8409,MSA,الهزائم وبالجمله وان شاء الله النصر قادر على الفوز ان شاء,الهزايم وبالجمله وان شاء الله النصر قادر علي الفوز ان شاء,,[],0,pending,,
mt_dial_egy_15af49a3,train,35143,DIAL_EGY,خلاص كل شىء كويس علشان نتكلم فى تحرش الانسانة العيزة تحترم رحها تلبس ملابس محترمة وتمشى بعتدال بس وهو دا كل,خلاص كل شيء كويس علشان نتكلم في تحرش الانسانه العيزه تحترم رحها تلبس ملابس محترمه وتمشي بعتدال بس وهو دا كل,,[],0,pending,,
mt_dial_glf_952cf479,train,43702,DIAL_GLF,بلا كذب الفلم ما حقق المرجو منه حتى المخرج نفسه النصدم من عدم نجاحه وكلها مجرد ضجه إعلاميه معروف عن الامريكيين يسون من الحبه قبه هم بنفسهم يسمونه الهندي,بلا كذب الفلم ما حقق المرجو منه حتي المخرج نفسه النصدم من عدم نجاحه وكلها مجرد ضجه اعلاميه معروف عن الامريكيين يسون من الحبه قبه هم بنفسهم يسمونه الهندي,,[],0,pending,,
mt_dial_lev_e0c2ddf5,train,65566,DIAL_LEV,يعني صحيح انا بنابع افلام هندية كتير وفي الاخر بطلع البطل والبطلة اخوان وبعرفو هذا الشيي يوم الزواج . . . بس ما صار انو كسر في الجمجة ، نزيف دموي حاد في الدماغ والبطن ، رضوض في جميع انحاء جسمة كل هاي من اثر سقوطة وهو يلعب ليش باقي يلعب على قمة جبل,يعني صحيح انا بنابع افلام هنديه كتير وفي الاخر بطلع البطل والبطله اخوان وبعرفو هذا الشيي يوم الزواج بس ما صار انو كسر في الجمجه نزيف دموي حاد في الدماغ والبطن رضوض في جميع انحاء جسمه كل هاي من اثر سقوطه وهو يلعب ليش باقي يلعب علي قمه جبل,,[],0,pending,,
mt_msa_e909c5e8,train,77292,MSA,فلماذا كل هذا . . . فكروا كثيرا قبل اللعب بالنار و اشعال الحرائق,فلماذا كل هذا فكروا كثيرا قبل اللعب بالنار و اشعال الحرايق,,[],0,pending,,
mt_dial_egy_f4139b16,train,18726,DIAL_EGY,دول لازمهم ايه داخل الوزارة ؟ هو احنا ماعندناش قيادات تستطيع ان تقود المؤسسة التعليمية برمتها بدون تدخلات من الجيش,دول لازمهم ايه داخل الوزاره هو احنا ماعندناش قيادات تستطيع ان تقود الموسسه التعليميه برمتها بدون تدخلات من الجيش,,[],0,pending,,
mt_dial_glf_0c625233,train,32954,DIAL_GLF,سواء كنت نصراوي او هلالي الكل يعرف ان النصر خبير في الدفاع يصطح كور عشوائية للهجوم السلق يعني الذبدة هجمات مرتدة عشان كذى مايتعبون وتشوفهم لاخر الدقايق كانهم ماخذين لجج . . مثل اخونا الله يهديه غالي .,سواء كنت نصراوي او هلالي الكل يعرف ان النصر خبير في الدفاع يصطح كور عشواييه للهجوم السلق يعني الذبده هجمات مرتده عشان كذي مايتعبون وتشوفهم لاخر الدقايق كانهم ماخذين لجج مثل اخونا الله يهديه غالي,,[],0,pending,,
mt_dial_lev_2a5f0f17,train,46611,DIAL_LEV,سيلين الله يرحمها . لازم نبحث شو الاسباب التي بتخلي الموظف يقصر بشغله ؟ شو السبب انا مش عارف . اخطاء قاتلة جسم السم نخره نخر . بنروح نجبصنه مش معقول . شو الي قاعد بسيرز معقول كان الكادر بتابع مباراة كأس,سيلين الله يرحمها لازم نبحث شو الاسباب التي بتخلي الموظف يقصر بشغله شو السبب انا مش عارف اخطاء قاتله جسم السم نخره نخر بنروح نجبصنه مش معقول شو الي قاعد بسيرز معقول كان الكادر بتابع مباراه كاس,,[],0,pending,,
mt_msa_4a051468,train,50848,MSA,ولو أن كل من تجرأ من الاعلاميين والكتاب وغيرهم ظلماً على مشائخنا ودعاتنا ( وكلهم يقومون بذلك من أجل الشهرة والصعود على أكتافهم ) حُوكم وحوسب على قد خطئه لما وجدنا مقالك يا حنان اليوم !,ولو ان كل من تجرا من الاعلاميين والكتاب وغيرهم ظلما علي مشايخنا ودعاتنا وكلهم يقومون بذلك من اجل الشهره والصعود علي اكتافهم حوكم وحوسب علي قد خطيه لما وجدنا مقالك يا حنان اليوم,,[],0,pending,,
mt_dial_egy_15361d63,train,37560,DIAL_EGY,خلونا نكون صريحين يا جماعة الكورة والروح الرياضية انقرضت من مصر وما بقي منها غير شوية عيال بنططوا قدامنا على التلفزيونات وعمالين طالعين نازلين على كل العالم يوم يسبو فريق ومن بكرة تلاقيه يحييه ويهتف باسمو وحياتو . .,خلونا نكون صريحين يا جماعه الكوره والروح الرياضيه انقرضت من مصر وما بقي منها غير شويه عيال بنططوا قدامنا علي التلفزيونات وعمالين طالعين نازلين علي كل العالم يوم يسبو فريق ومن بكره تلاقيه يحييه ويهتف باسمو وحياتو,,[],0,pending,,
mt_dial_glf_f45eff9c,train,39859,DIAL_GLF,باالتوفيق ياابو راكان بس المشكله ان المسلسل على القناه الاولى يعني متابعين مافيه ليتهم يعرضونه على اي قناه,باالتوفيق ياابو راكان بس المشكله ان المسلسل علي القناه الاولي يعني متابعين مافيه ليتهم يعرضونه علي اي قناه,,[],0,pending,,
mt_dial_lev_527ed648,train,52776,DIAL_LEV,الفيصلي فريق كبير ويستطيع ان يهزم اي فريق كان يكفي انه يرفع راسنا خارج الوطن في المشاركات الخارجيه ولا ننسى بانه بطل الدوري وشكرا,الفيصلي فريق كبير ويستطيع ان يهزم اي فريق كان يكفي انه يرفع راسنا خارج الوطن في المشاركات الخارجيه ولا ننسي بانه بطل الدوري وشكرا,,[],0,pending,,
mt_msa_e70074b3,train,24453,MSA,هذا هو ابو متعب صقر العروبة يتمتع بحكمة واسعة وياليت حكام العرب يستفيدوا من حكمة أبو متعب أطال الله في عمره وجعله ذخرا للإسلام والمسلمين حب شعبه فأحبوه وسهر على راحة زوار الحرمين فأحبوه ومن سمع عن أعمال فصل التوائم أحبه ملك إنسان ومن رأى بلد الحرمين أحبه مبروك,هذا هو ابو متعب صقر العروبه يتمتع بحكمه واسعه وياليت حكام العرب يستفيدوا من حكمه ابو متعب اطال الله في عمره وجعله ذخرا للاسلام والمسلمين حب شعبه فاحبوه وسهر علي راحه زوار الحرمين فاحبوه ومن سمع عن اعمال فصل التوايم احبه ملك انسان ومن راي بلد الحرمين احبه مبروك,,[],0,pending,,
mt_dial_egy_d5e30aec,train,81222,DIAL_EGY,1 - سوء تحكيم ولا تحكيم الحوكشه في,1 سوء تحكيم ولا تحكيم الحوكشه في,,[],0,pending,,
mt_dial_glf_25cdca2e,train,23504,DIAL_GLF,لاحول ولا قوة الا بالله ! ! ! الهم لك الحمد ولك الشكر على نعمة العقل . . حسبي الله عليك ، بس هذا مو صاحي,لاحول ولا قوه الا بالله الهم لك الحمد ولك الشكر علي نعمه العقل حسبي الله عليك بس هذا مو صاحي,,[],0,pending,,
mt_dial_lev_9dbdf823,train,66994,DIAL_LEV,واذا المرة طلقتك عادي . . بتلم اغراضك وبترجع بيت,واذا المره طلقتك عادي بتلم اغراضك وبترجع بيت,,[],0,pending,,
mt_msa_834f0a10,train,43853,MSA,ودائما وابدا كنت سباقا بتعليقاتك التى تعلمت منها,ودايما وابدا كنت سباقا بتعليقاتك التي تعلمت منها,,[],0,pending,,
mt_dial_egy_1b7a5bf7,train,23494,DIAL_EGY,ربنا يخدهم وما يطلعوش من,ربنا يخدهم وما يطلعوش من,,[],0,pending,,
mt_dial_glf_839cd6d8,train,40611,DIAL_GLF,ودعايه لدراية عشان تاخذ النسبة من,ودعايه لدرايه عشان تاخذ النسبه من,,[],0,pending,,
mt_dial_lev_4d1b9520,train,25256,DIAL_LEV,ماشاءالله احنا العرب بنستقبل التكنولوجيا استقبال خاطئ من الغرب وياريت لو بنستغلها بشكل الصحيح بتعرفوا ليش لأنو احنا هجينين بكل,ماشاءالله احنا العرب بنستقبل التكنولوجيا استقبال خاطي من الغرب وياريت لو بنستغلها بشكل الصحيح بتعرفوا ليش لانو احنا هجينين بكل,,[],0,pending,,
mt_msa_c90577da,train,33048,MSA,الطمع ! / البعد عن الايمان ! / الانانيه ! / عدم الرضا,الطمع البعد عن الايمان الانانيه عدم الرضا,,[],0,pending,,
mt_dial_egy_5b6a7379,train,66735,DIAL_EGY,كان لازم الفضيحة تبقي علني علشان الكل يتربي و العقاب يبقي شديد . . و الزمالك يبقي عبرة لكل الفرق . . الشرطة يا مفتري ؟ ؟ ؟ دة انت ليلتك سودا يا برهومة . . اعدام انشاءالله : ),كان لازم الفضيحه تبقي علني علشان الكل يتربي و العقاب يبقي شديد و الزمالك يبقي عبره لكل الفرق الشرطه يا مفتري ده انت ليلتك سودا يا برهومه اعدام انشاءالله,,[],0,pending,,
mt_dial_glf_6da4d33f,train,16988,DIAL_GLF,وينك فيه انا لي مدة ما,وينك فيه انا لي مده ما,,[],0,pending,,
mt_dial_lev_4daa8d4b,train,43916,DIAL_LEV,يعني لم تلد الاردنيات حتى اليوم من يقول لا ولو من باب تجريب الصوت ؟ ؟ ؟ انا نفسي اعرف موقف نفس ( المصفقين ) لو اعتذرت الجكومة بكره وقالت يا جماعه : بدنا نغير القانون . ستجد اغلبهم يصفقون لا لشيء ولكن حتى لا يتم تسجيل اسمه . . . يا عمي سجلوا اسمي انا مش,يعني لم تلد الاردنيات حتي اليوم من يقول لا ولو من باب تجريب الصوت انا نفسي اعرف موقف نفس المصفقين لو اعتذرت الجكومه بكره وقالت يا جماعه بدنا نغير القانون ستجد اغلبهم يصفقون لا لشيء ولكن حتي لا يتم تسجيل اسمه يا عمي سجلوا اسمي انا مش,,[],0,pending,,
mt_msa_e44abd60,train,72302,MSA,اليس جميلا كسر التابو واعطاء المرآة ما تريده,اليس جميلا كسر التابو واعطاء المراه ما تريده,,[],0,pending,,
mt_dial_egy_79b64a3a,train,9329,DIAL_EGY,التوأم البلطجي ولعوها و كشفوا حقيقة الجمهور البلطجي المصرائيلي الذي اعتدى على اللاعبين الجزائريين المسالمين العزل بالطوب ياريت الفيفا تفيق و تقصي هذه الدويلة البلطجية من كل المنافسات حتى يعدلوا أخلاقهم القبيحة كما قال أمير سعيود تتعلموا من أسيادكم الجزائريين الأدب و حسن الأخلاق و,التوام البلطجي ولعوها و كشفوا حقيقه الجمهور البلطجي المصراييلي الذي اعتدي علي اللاعبين الجزايريين المسالمين العزل بالطوب ياريت الفيفا تفيق و تقصي هذه الدويله البلطجيه من كل المنافسات حتي يعدلوا اخلاقهم القبيحه كما قال امير سعيود تتعلموا من اسيادكم الجزايريين الادب و حسن الاخلاق و,,[],0,pending,,
mt_dial_glf_d64d4844,train,65375,DIAL_GLF,كثر الخمسات يا مدرب الخمسات . . !,كثر الخمسات يا مدرب الخمسات,,[],0,pending,,
mt_dial_lev_c106bbe6,train,65885,DIAL_LEV,والله بلاش شو بدنا احسن من هييك يعني لو كل اسبوع بدنا كيلو لحمة يعني 40 دينار بالشهر ولا,والله بلاش شو بدنا احسن من هييك يعني لو كل اسبوع بدنا كيلو لحمه يعني 40 دينار بالشهر ولا,,[],0,pending,,
mt_msa_a940855e,train,11260,MSA,ويكأن مرض الفقير فارة لذنوبه ومرض الغني عقاب من,ويكان مرض الفقير فاره لذنوبه ومرض الغني عقاب من,,[],0,pending,,
mt_dial_egy_651a5fae,train,60616,DIAL_EGY,دايما انتم اشراف والبيت ده طول عمره طاهر وحيفضل طاهر ياام المطاهر رشوا الملح سبع رشات سبع رشات,دايما انتم اشراف والبيت ده طول عمره طاهر وحيفضل طاهر ياام المطاهر رشوا الملح سبع رشات سبع رشات,,[],0,pending,,
mt_dial_glf_c792a2e3,train,47067,DIAL_GLF,وراح تجي الوعود والهدايا والهبات,وراح تجي الوعود والهدايا والهبات,,[],0,pending,,
mt_dial_lev_28d0855f,train,33919,DIAL_LEV,صراحة أنا بستغرب كل هذا الهجوم عالجزيرة و هو سعر الباقة 75 دولار مش زي أيام ال art !,صراحه انا بستغرب كل هذا الهجوم عالجزيره و هو سعر الباقه 75 دولار مش زي ايام ال art,,[],0,pending,,
mt_msa_b20c2b46,train,22337,MSA,اولا الزيارات ليست مفاجئة وان كانت مفاجئة فكل مدرسة جاهزة دائما بالسجلات التى تدعم موقفها وتبين لاي زائر أو متابع ان العملية التعليمية على مايرام,اولا الزيارات ليست مفاجيه وان كانت مفاجيه فكل مدرسه جاهزه دايما بالسجلات التي تدعم موقفها وتبين لاي زاير او متابع ان العمليه التعليميه علي مايرام,,[],0,pending,,
mt_dial_egy_b86e56e9,train,29737,DIAL_EGY,ده ممكن يكون السبب رقم خمسين . . . لكن مس واحد واتنين وتالتة . . . :,ده ممكن يكون السبب رقم خمسين لكن مس واحد واتنين وتالته,,[],0,pending,,
mt_dial_glf_01ad7e1f,train,27186,DIAL_GLF,واخيرا . . بس الحمد لله زين لحقنا وإلا الناس انهبلت ماينفع معهم إلا قوة,واخيرا بس الحمد لله زين لحقنا والا الناس انهبلت ماينفع معهم الا قوه,,[],0,pending,,
mt_dial_lev_0519916e,train,33661,DIAL_LEV,اعتقد أن الطريقة اهجموا يا شباب شلباية من جهة وحليم من جهة ومعكم كمالة العدد كشكش وعوض واي واحد متوفر وكان الله بالعون بالدفاع واتبهدر يا,اعتقد ان الطريقه اهجموا يا شباب شلبايه من جهه وحليم من جهه ومعكم كماله العدد كشكش وعوض واي واحد متوفر وكان الله بالعون بالدفاع واتبهدر يا,,[],0,pending,,
mt_msa_5906dd8d,train,17211,MSA,بالمناسبة أنا حاصل على شهادتي أستاذ ونصف دكتوراة حتى الآن وخبرتي العملية برتبة مغترب محنك للقوة 3,بالمناسبه انا حاصل علي شهادتي استاذ ونصف دكتوراه حتي الان وخبرتي العمليه برتبه مغترب محنك للقوه 3,,[],0,pending,,
mt_dial_egy_ace10ad0,train,64427,DIAL_EGY,الخبر كويس وجميل بس المفروض وانتوا طبعا افضل مني في الصحافة ان اذكر سبب الخناقة ولا ايه,الخبر كويس وجميل بس المفروض وانتوا طبعا افضل مني في الصحافه ان اذكر سبب الخناقه ولا ايه,,[],0,pending,,
mt_dial_glf_d60cfbd0,train,64361,DIAL_GLF,بس توقيته قوي عرف كيف يلوي,بس توقيته قوي عرف كيف يلوي,,[],0,pending,,
mt_dial_lev_76b60b8e,train,38545,DIAL_LEV,الله يستر مش يعملو فينا زي الفصل الاول و الحكي عن التدقيق يكون كلام و,الله يستر مش يعملو فينا زي الفصل الاول و الحكي عن التدقيق يكون كلام و,,[],0,pending,,
mt_msa_1f6d7f0a,train,68650,MSA,والله انا عارفين انها مهمه لكن هل هى تقوم بواجباتها كما يجب عليها وتنصه لانظمه,والله انا عارفين انها مهمه لكن هل هي تقوم بواجباتها كما يجب عليها وتنصه لانظمه,,[],0,pending,,
mt_dial_egy_fa6b704b,train,23285,DIAL_EGY,المدعو ايمن يونس لا يصلح للتحليل يالمباريات لانه غير محايد ودا اسلوب غير اخلاقى لانه الفروض ان يعلق على ماشاهدته الملايين عبر الشاشات هو فاكر ان الزمالك هينافس الاهلى طبعا دا غباء منه الاهلى فين والمالك فين يادوب الزمالك يقدر يحافظ على مكانه المقضل التانى عموما هيه دى اخلاق الزملكاويه سواء لاعبين او مدربين او محلليين الاهلى تعادل والجمهور شجع الفريفين والان هل رأيتم ما فعله سئ السمعه الموقوف خمس,المدعو ايمن يونس لا يصلح للتحليل يالمباريات لانه غير محايد ودا اسلوب غير اخلاقي لانه الفروض ان يعلق علي ماشاهدته الملايين عبر الشاشات هو فاكر ان الزمالك هينافس الاهلي طبعا دا غباء منه الاهلي فين والمالك فين يادوب الزمالك يقدر يحافظ علي مكانه المقضل التاني عموما هيه دي اخلاق الزملكاويه سواء لاعبين او مدربين او محلليين الاهلي تعادل والجمهور شجع الفريفين والان هل رايتم ما فعله سي السمعه الموقوف خمس,,[],0,pending,,
mt_dial_glf_a808f3ff,train,56189,DIAL_GLF,الممثلات الأمريكيات دعايات لل make,الممثلات الامريكيات دعايات لل make,,[],0,pending,,
mt_dial_lev_38c26b67,train,84590,DIAL_LEV,وبنرجع وبنقول الفيصلي بطل الكاس ورافع الراس يا,وبنرجع وبنقول الفيصلي بطل الكاس ورافع الراس يا,,[],0,pending,,
mt_msa_efdce58b,train,76735,MSA,حتى جاءت شركة الاتصالات بهذه,حتي جاءت شركه الاتصالات بهذه,,[],0,pending,,
mt_dial_egy_26686134,train,1477,DIAL_EGY,كل مافتح موقع اوجريده الاقى التؤام نزاين تصاريح فعلا اكل العيش مر دى مش عقوبات اصلا المفروض ابراهيم الابيض يتشطب فرجتو علينا,كل مافتح موقع اوجريده الاقي التوام نزاين تصاريح فعلا اكل العيش مر دي مش عقوبات اصلا المفروض ابراهيم الابيض يتشطب فرجتو علينا,,[],0,pending,,
mt_dial_glf_1a31b8b8,train,19741,DIAL_GLF,الله يشفيهم ويقومهم بالسلامة و,الله يشفيهم ويقومهم بالسلامه و,,[],0,pending,,
mt_dial_lev_d88d8ae4,train,49890,DIAL_LEV,الفيصلي النسر الازرق وانا متأكد انه رح يحقق انجازات خارجيه و داخليه ان شاء,الفيصلي النسر الازرق وانا متاكد انه رح يحقق انجازات خارجيه و داخليه ان شاء,,[],0,pending,,
mt_msa_290e4341,train,81570,MSA,اعتقد ان المباراة سوف تكون قوية ولكن صعبة علي النصر يا,اعتقد ان المباراه سوف تكون قويه ولكن صعبه علي النصر يا,,[],0,pending,,
