example_id,source_split,source_row_id,dialect,original_text,normalized_text,masked_text,mask_spans_json,mask_count,annotation_status,annotator_model,notes
mt_dial_egy_41a8ce4a,train,50177,DIAL_EGY,علي فكرة أنا كزملكاوية عارفة كويس قوي قيمة وعظمة أحمد حسن ككابتن منتخب الساجدين وكاحسن لاعب ف افريقيا لكن يا احمد يا حسن عيب عليك لأن اللي سبقك ف العمادة حسام حسن معرفش للاسف رقي بأخلاقه ف نفس مستوي مهاراته وفنياته وانت مصر تمشي علي نفس,علي فكره انا كزملكاويه عارفه كويس قوي قيمه وعظمه احمد حسن ككابتن منتخب الساجدين وكاحسن لاعب ف افريقيا لكن يا احمد يا حسن عيب عليك لان اللي سبقك ف العماده حسام حسن معرفش للاسف رقي باخلاقه ف نفس مستوي مهاراته وفنياته وانت مصر تمشي علي نفس,,[],0,pending,,
mt_dial_glf_b08f5c8a,train,30143,DIAL_GLF,ومثلي كثير يحنون لهاك السكيك و,ومثلي كثير يحنون لهاك السكيك و,,[],0,pending,,
mt_dial_lev_72944e96,train,54569,DIAL_LEV,المانيا الفائزه ان شاء الله ورح,المانيا الفايزه ان شاء الله ورح,,[],0,pending,,
mt_msa_8d198335,train,79952,MSA,انا رغبتي اتزوج البنت القبيليه فهي تكا فئني,انا رغبتي اتزوج البنت القبيليه فهي تكا فيني,,[],0,pending,,
mt_dial_egy_584cb15c,train,13710,DIAL_EGY,وطبعا الجيب مليان وكلة من دم شعب غلبان يارب العرش العظيم اضرب الظالمين بالظالمين ونشوف اللى اتعمل فى رومانيا والعراق هنا وساعتها حنقول كلنا,وطبعا الجيب مليان وكله من دم شعب غلبان يارب العرش العظيم اضرب الظالمين بالظالمين ونشوف اللي اتعمل في رومانيا والعراق هنا وساعتها حنقول كلنا,,[],0,pending,,
mt_dial_glf_855b0aeb,train,77133,DIAL_GLF,و الله و المصالة و ثقالة الدم و الفقر الفني و الفكري في ذا الفريق .,و الله و المصاله و ثقاله الدم و الفقر الفني و الفكري في ذا الفريق,,[],0,pending,,
mt_dial_lev_d1262997,train,2787,DIAL_LEV,""" بصراحه العربي حاليا أفضل من الوحدات والفيصلي",بصراحه العربي حاليا افضل من الوحدات والفيصلي,,[],0,pending,,
mt_msa_1a7f57bf,train,82178,MSA,فعلاً كيف حارس مرمى العتيبي يتعدى على الحكم ولا تتكلم لجنة الانظباط ؟ ؟,فعلا كيف حارس مرمي العتيبي يتعدي علي الحكم ولا تتكلم لجنه الانظباط,,[],0,pending,,
mt_dial_egy_e5709838,train,9986,DIAL_EGY,ما تخفش مش حيحكم الماتش محمد سمير عثمان - ولو حيحكم عمره ماحيلغي للشرطة جونين 100 % صح علي انهم تسلل ولا حيلغلهم ضربه جزاء - ولا حيطلع كل ثانيه كارت اصفر علي امل انه يطرد واحد - والله اللي اختشوا ماتوا ( في ماتش انبي والاهلي,ما تخفش مش حيحكم الماتش محمد سمير عثمان ولو حيحكم عمره ماحيلغي للشرطه جونين 100 صح علي انهم تسلل ولا حيلغلهم ضربه جزاء ولا حيطلع كل ثانيه كارت اصفر علي امل انه يطرد واحد والله اللي اختشوا ماتوا في ماتش انبي والاهلي,,[],0,pending,,
mt_dial_glf_c5b7cd4c,train,8516,DIAL_GLF,كبرت حتى طاح قدام عيني .,كبرت حتي طاح قدام عيني,,[],0,pending,,
mt_dial_lev_e3bcfdcf,train,69582,DIAL_LEV,تعالوا شاهدوا الشارع الرئيسي الدي يمتد من اشارات راس العين بعد نزول جبل عمان الدوار الثالث والدي يمتد حتى اشارات المصدار ويمر امام مباني امانة عمان وانت تسوق السيارة تشعر بانك في الهبوط الحاد في الزفتة وكانها صممت,تعالوا شاهدوا الشارع الرييسي الدي يمتد من اشارات راس العين بعد نزول جبل عمان الدوار الثالث والدي يمتد حتي اشارات المصدار ويمر امام مباني امانه عمان وانت تسوق السياره تشعر بانك في الهبوط الحاد في الزفته وكانها صممت,,[],0,pending,,
mt_msa_4227d3b9,train,75628,MSA,الملاحظ انه لا يوجد اي تحذير لا من الارصاد الجوية في مثلا قناة الاخبارية ولا من امن,الملاحظ انه لا يوجد اي تحذير لا من الارصاد الجويه في مثلا قناه الاخباريه ولا من امن,,[],0,pending,,
mt_dial_egy_f76cb098,train,85234,DIAL_EGY,عندما تذهب الى اى طبييب يخبرك الآتى ابعد عن اى توتر ( ازاى ) ابعد عن التدخين ، ابعد عن المشروبات الغازيه ، ابعد عن الماء المثلج ، وبرضه هتتعب ومفيش فايده,عندما تذهب الي اي طبييب يخبرك الاتي ابعد عن اي توتر ازاي ابعد عن التدخين ابعد عن المشروبات الغازيه ابعد عن الماء المثلج وبرضه هتتعب ومفيش فايده,,[],0,pending,,
mt_dial_glf_825bbc74,train,35581,DIAL_GLF,اوكي اهو يصرف على عمره وانا اصرف على,اوكي اهو يصرف علي عمره وانا اصرف علي,,[],0,pending,,
mt_dial_lev_691bff9e,train,61798,DIAL_LEV,شو الفايدة من طرد السفراء او قطع العلاقات فكركم اسرائيل سائلة بحدا والله ما هي مكيلة بصاع حدا اسرائيل عندها,شو الفايده من طرد السفراء او قطع العلاقات فكركم اسراييل سايله بحدا والله ما هي مكيله بصاع حدا اسراييل عندها,,[],0,pending,,
mt_msa_93762ea6,train,78039,MSA,لا اعتقد ان هذا فيه اجرا اصلا بل,لا اعتقد ان هذا فيه اجرا اصلا بل,,[],0,pending,,
mt_dial_egy_be5d3d5c,train,53646,DIAL_EGY,معظم الشعب معاك لا تياس واحنا كلنا وراك لو خضت بنا البحر لخضناة معك \ \ بس خلي وكيل الوزارة يقوم بالمهمة دة وشد علية وهو حيعمل الي انت عايزة ووفر نفسك لحجات ومفاسد اخري في التعليم حاول تعدي الموجة دة وبعدين اعمل الي انت عايزة \ \ سياستك صح في الاداء وملاين عايزين يقوا الكلام دة ومش عاررفين ولابد ان الحكومة تامنك تجاة مسؤليتك النبيلة \ \ وشكرا ارجو من الاخ الناشر نشر مقالتي لانكم اول من شرعتم الحرية في الراي حني ولو مرة,معظم الشعب معاك لا تياس واحنا كلنا وراك لو خضت بنا البحر لخضناه معك بس خلي وكيل الوزاره يقوم بالمهمه ده وشد عليه وهو حيعمل الي انت عايزه ووفر نفسك لحجات ومفاسد اخري في التعليم حاول تعدي الموجه ده وبعدين اعمل الي انت عايزه سياستك صح في الاداء وملاين عايزين يقوا الكلام ده ومش عاررفين ولابد ان الحكومه تامنك تجاه مسوليتك النبيله وشكرا ارجو من الاخ الناشر نشر مقالتي لانكم اول من شرعتم الحريه في الراي حني ولو مره,,[],0,pending,,
mt_dial_glf_ab99d5ad,train,70260,DIAL_GLF,وانتم نسو هم وش سوا فيهم الوصل وهم,وانتم نسو هم وش سوا فيهم الوصل وهم,,[],0,pending,,
mt_dial_lev_1c10099b,train,11383,DIAL_LEV,والكل برا والكاس النا ان,والكل برا والكاس النا ان,,[],0,pending,,
mt_msa_18b8e7a6,train,53712,MSA,واتمنى من قلبي ان لاتمر ضربة فيقاروا لرادوي مرور كرام على لجنة الانضباط والشكووى لله ولكن خليل جلال اثار القهر للهلالين المتعصبين خصوصاً بمبدأ التعويض اتمنى من كل قلبي ان مبدأ التعويض لايكوون بين الاخوه الحكام,واتمني من قلبي ان لاتمر ضربه فيقاروا لرادوي مرور كرام علي لجنه الانضباط والشكووي لله ولكن خليل جلال اثار القهر للهلالين المتعصبين خصوصا بمبدا التعويض اتمني من كل قلبي ان مبدا التعويض لايكوون بين الاخوه الحكام,,[],0,pending,,
mt_dial_egy_4121fce1,train,40638,DIAL_EGY,يادكتورة ياريت تكونى واقعية وبلآش الهجوم ألأجوف والذى لآيرتقى الى ألأدلة والمستندات أكثر من أنه تحيذ أعمى لآأكثر ولآأقل !,يادكتوره ياريت تكوني واقعيه وبلاش الهجوم الاجوف والذي لايرتقي الي الادله والمستندات اكثر من انه تحيذ اعمي لااكثر ولااقل,,[],0,pending,,
mt_dial_glf_ed7c18f8,train,55578,DIAL_GLF,فيقاروا اول مرة تحدث منه وعاقبه الحكم بكرت,فيقاروا اول مره تحدث منه وعاقبه الحكم بكرت,,[],0,pending,,
mt_dial_lev_ef146675,train,40351,DIAL_LEV,الاستطلاع اللي تم سالو مين من الشعب لانه هي النسبة مش مزبوطة حكومة الرفاعي اذا حبينا نعطيها تصنيف على اكثر حد ممكن تحصل تاييد 40 % من الشعب والاغلبية من الاربعين راح يكونوا من سكان عمان الغربية,الاستطلاع اللي تم سالو مين من الشعب لانه هي النسبه مش مزبوطه حكومه الرفاعي اذا حبينا نعطيها تصنيف علي اكثر حد ممكن تحصل تاييد 40 من الشعب والاغلبيه من الاربعين راح يكونوا من سكان عمان الغربيه,,[],0,pending,,
mt_msa_3f06444a,train,62315,MSA,وكان موجود لديكم اشرطه المصاحبه لجميع,وكان موجود لديكم اشرطه المصاحبه لجميع,,[],0,pending,,
mt_dial_egy_35a46ff5,train,4379,DIAL_EGY,بس فكرة بقى انة مش عايز النقاب خالص انا مش معاة,بس فكره بقي انه مش عايز النقاب خالص انا مش معاه,,[],0,pending,,
mt_dial_glf_339c4bcb,train,81227,DIAL_GLF,يستاهل روني 34 هدف يحلينا هداف الدوري 12,يستاهل روني 34 هدف يحلينا هداف الدوري 12,,[],0,pending,,
mt_dial_lev_600ef006,train,57871,DIAL_LEV,"وعلى كل انا مبسوط انه البطوله راحت الكم , , , بتعرف ليش , , , لانه لو لم تفوزوا فيها , , , الله اعلم شو كانت رح تكون العواقب ونتائج البركان المحتقن الذي كان على شفا الانفجار",وعلي كل انا مبسوط انه البطوله راحت الكم بتعرف ليش لانه لو لم تفوزوا فيها الله اعلم شو كانت رح تكون العواقب ونتايج البركان المحتقن الذي كان علي شفا الانفجار,,[],0,pending,,
mt_msa_1f6f3ded,train,22859,MSA,والملعون الي طعن كمل مع ربعه كانو مافي اي,والملعون الي طعن كمل مع ربعه كانو مافي اي,,[],0,pending,,
mt_dial_egy_e929e475,train,64309,DIAL_EGY,انت خلاص انتهيت يا ميدو بسبب دعوات الشيخ حسن,انت خلاص انتهيت يا ميدو بسبب دعوات الشيخ حسن,,[],0,pending,,
mt_dial_glf_4584fe19,train,58611,DIAL_GLF,و لن تبقى إلى بالدين و المحافظة عليد و أنت ياأبو مطيز جاي تشعل فتنه نارها لن تنطفأ لو قامت بل ستكون على الصغير و,و لن تبقي الي بالدين و المحافظه عليد و انت ياابو مطيز جاي تشعل فتنه نارها لن تنطفا لو قامت بل ستكون علي الصغير و,,[],0,pending,,
mt_dial_lev_2af662ee,train,11808,DIAL_LEV,انا بعرف انه الديه عند العرب,انا بعرف انه الديه عند العرب,,[],0,pending,,
mt_msa_abb78a44,train,58371,MSA,الف مبروك باشا كل الحب والتقدير لشخصكم الكريم راجيا من الله التوفيق في ظل حضره صاحب الجلاله الملك عبدالله الثاني المعظم بن الحسين ادام الله,الف مبروك باشا كل الحب والتقدير لشخصكم الكريم راجيا من الله التوفيق في ظل حضره صاحب الجلاله الملك عبدالله الثاني المعظم بن الحسين ادام الله,,[],0,pending,,
mt_dial_egy_e0f6902f,train,17560,DIAL_EGY,يا ماهيتاب بالله عليكى صحتك يا اختى حاولى تهدى وتنسى الماتش وقومى اشربى بق,يا ماهيتاب بالله عليكي صحتك يا اختي حاولي تهدي وتنسي الماتش وقومي اشربي بق,,[],0,pending,,
mt_dial_glf_ddcc2d28,train,42376,DIAL_GLF,بعد سيل جده خافوا على مانصبهم ه مع انه ماراح فيها الا كتاب عدل ه بس على المرتبه السادسة,بعد سيل جده خافوا علي مانصبهم ه مع انه ماراح فيها الا كتاب عدل ه بس علي المرتبه السادسه,,[],0,pending,,
mt_dial_lev_db886cc5,train,62762,DIAL_LEV,معدل سعر النفط الذي تم على اساسة رفع الاسعار في 14 / 05 / 2010 و كان معلن على موقع وزارة الطاقةهو 85 . 05 و بعد هبوط اسعار النفط عالميا بقدرة قادر تغير و صار 83 . 46 . و الباقي,معدل سعر النفط الذي تم علي اساسه رفع الاسعار في 14 05 2010 و كان معلن علي موقع وزاره الطاقههو 85 05 و بعد هبوط اسعار النفط عالميا بقدره قادر تغير و صار 83 46 و الباقي,,[],0,pending,,
mt_msa_48e52412,train,68898,MSA,عند نهاية مباراة الفيصلي والرمثا الاخيرة قام معالج فريق الرمثابالرقص ورش االماء بطريقة غريبة امام الكاميرا وظلت جماهير الرمثا تغني للصباح واصبحت حالة شعور بالتوئمة مع الوحدات انا لا احرم ان يحتفل بفوز فريقه فهذا حقه ولكن كان الاحتفال وكأنهم فازوا على فريق من خارج الاردن او انهم فازوا بالبطولة مع ان الفيصلي اعطاهم عمر غازي الذي اشتراه الفيصلي ب 130 الف مجانا ( اعارة ) وحسام شديفات ( اعارة,عند نهايه مباراه الفيصلي والرمثا الاخيره قام معالج فريق الرمثابالرقص ورش االماء بطريقه غريبه امام الكاميرا وظلت جماهير الرمثا تغني للصباح واصبحت حاله شعور بالتويمه مع الوحدات انا لا احرم ان يحتفل بفوز فريقه فهذا حقه ولكن كان الاحتفال وكانهم فازوا علي فريق من خارج الاردن او انهم فازوا بالبطوله مع ان الفيصلي اعطاهم عمر غازي الذي اشتراه الفيصلي ب 130 الف مجانا اعاره وحسام شديفات اعاره,,[],0,pending,,
mt_dial_egy_425da595,train,82372,DIAL_EGY,نحن نعلق حبا فى تغيير مصر ولكنك تعلق لأنك مكلف بذلك وتقبض مرتبا من أجل ذلك ويا ريت تكتب اسمك الحقيقى يا جماعه المخبر ده اسمه,نحن نعلق حبا في تغيير مصر ولكنك تعلق لانك مكلف بذلك وتقبض مرتبا من اجل ذلك ويا ريت تكتب اسمك الحقيقي يا جماعه المخبر ده اسمه,,[],0,pending,,
mt_dial_glf_e6ce070e,train,13193,DIAL_GLF,والله بتشوف عواكيس وعكسيات ووناسه يوم الأحد يا أبو,والله بتشوف عواكيس وعكسيات ووناسه يوم الاحد يا ابو,,[],0,pending,,
mt_dial_lev_3e24994f,train,72839,DIAL_LEV,تعالوا نعملها ( ( ( صفر ) ) ) شي يوم,تعالوا نعملها صفر شي يوم,,[],0,pending,,
mt_msa_02062d89,train,56072,MSA,إني يا أمير المؤمنين وإن لم أبلغ بعظتي ما بلغه أولو النهي من قبلي فلم آلك شفقة ونصحاً فأنزل كتابي إليك كمداوي حبيبه يسقيه الأدوية الكريهة لما يرجو له في ذلك من العافية والصحة‏ .,اني يا امير المومنين وان لم ابلغ بعظتي ما بلغه اولو النهي من قبلي فلم الك شفقه ونصحا فانزل كتابي اليك كمداوي حبيبه يسقيه الادويه الكريهه لما يرجو له في ذلك من العافيه والصحه,,[],0,pending,,
mt_dial_egy_864ba42c,train,30559,DIAL_EGY,ايه المشكلة لما يكون وزنه زايد شوية ان شاء الله يرجع لمستواه في اقرب فرصة وعيب ان احنا نشتك في اللعيب بتاعنا,ايه المشكله لما يكون وزنه زايد شويه ان شاء الله يرجع لمستواه في اقرب فرصه وعيب ان احنا نشتك في اللعيب بتاعنا,,[],0,pending,,
mt_dial_glf_045d991a,train,54291,DIAL_GLF,ودولتنا غنيه وغنيه جدا وحنا,ودولتنا غنيه وغنيه جدا وحنا,,[],0,pending,,
mt_dial_lev_c18cea79,train,43154,DIAL_LEV,كل الحق على الشعب اللي مش عارف يوقف بوجه الحكومة و أستعبادها,كل الحق علي الشعب اللي مش عارف يوقف بوجه الحكومه و استعبادها,,[],0,pending,,
mt_msa_be3ffe9f,train,32992,MSA,دامت السعاده في حياتك و الافراح في دنياك يا أحلى خال .,دامت السعاده في حياتك و الافراح في دنياك يا احلي خال,,[],0,pending,,
mt_dial_egy_ef67ff97,train,37985,DIAL_EGY,اقرأو التاريخ وتعالوا نتناقش 00 وبعدين احنا خلصنا من الشلة الاولانية لما هتحلموا,اقراو التاريخ وتعالوا نتناقش 00 وبعدين احنا خلصنا من الشله الاولانيه لما هتحلموا,,[],0,pending,,
mt_dial_glf_ae4fff43,train,50041,DIAL_GLF,تلك التصريحات بما فيها من فرز وتصنيف وأحكام لم تأت لا غمزاً ولا لمزاً ، بل أطلقها رئيس النصر عياناً بياناً وفي برنامج تنقله قناتا ( ART ) و ( الجزيرة الرياضية ) اللتان يشاهدهما العالم من أقصاه إلى أقصاه ==> با ختصار هالأشكال فوق اي قانون يا حبيبي هذا جا يعرف بنفسه قال انا فيصل بن تركي بن ناصر بن عبدالعزير ال سعود . . و خالد البلطان المواطن كان هو المقصود مثل ماكلنا تابعنا و فهمنا . . الله المستعان,تلك التصريحات بما فيها من فرز وتصنيف واحكام لم تات لا غمزا ولا لمزا بل اطلقها رييس النصر عيانا بيانا وفي برنامج تنقله قناتا ART و الجزيره الرياضيه اللتان يشاهدهما العالم من اقصاه الي اقصاه با ختصار هالاشكال فوق اي قانون يا حبيبي هذا جا يعرف بنفسه قال انا فيصل بن تركي بن ناصر بن عبدالعزير ال سعود و خالد البلطان المواطن كان هو المقصود مثل ماكلنا تابعنا و فهمنا الله المستعان,,[],0,pending,,
mt_dial_lev_2eb47413,train,53255,DIAL_LEV,بدون زعل انا واحد من الناس ذهبت الي العقبه اول العام الماضي ونمت علي جانب الرصيف ليش لانه الفنادق ولعت الاسعار فيه وما الن قدره ندفع 50 دينار في اليليه,بدون زعل انا واحد من الناس ذهبت الي العقبه اول العام الماضي ونمت علي جانب الرصيف ليش لانه الفنادق ولعت الاسعار فيه وما الن قدره ندفع 50 دينار في اليليه,,[],0,pending,,
mt_msa_249d350c,train,63227,MSA,اول شي الامل بالله سبحانه قبل كل شي,اول شي الامل بالله سبحانه قبل كل شي,,[],0,pending,,
mt_dial_egy_c43700e4,train,67109,DIAL_EGY,صاحب التعليق رقم 1 كلامة فى بعض الصدق لان بالفعل فى تحالف قذر بين مصر واسرائيل ودة واضح جدا خاصة بعد حرب غزة وبعد بناء الجدار الفولازى بس للاسف ان صاحب التعليق رقم 1 مدخلش يقول تعليقة علشان حقيقة التحالف القذر بين مصر واسرائيل هو داخل يشتم فقط وبعدين للاسف بردو ان فى تحالف بين اسرائيل وبين جميع الدول العربية بل وهى التى تضع الانظمة العربية وما يفعلة الرئيس مبارك وحاشيتة من خدمة اسرائيل هو ليضمن بقاؤة فى,صاحب التعليق رقم 1 كلامه في بعض الصدق لان بالفعل في تحالف قذر بين مصر واسراييل وده واضح جدا خاصه بعد حرب غزه وبعد بناء الجدار الفولازي بس للاسف ان صاحب التعليق رقم 1 مدخلش يقول تعليقه علشان حقيقه التحالف القذر بين مصر واسراييل هو داخل يشتم فقط وبعدين للاسف بردو ان في تحالف بين اسراييل وبين جميع الدول العربيه بل وهي التي تضع الانظمه العربيه وما يفعله الرييس مبارك وحاشيته من خدمه اسراييل هو ليضمن بقاوه في,,[],0,pending,,
mt_dial_glf_2aafe8ac,train,62859,DIAL_GLF,"اخ والله جبتها على الجرح ، ، ، هذا حال كل مواطن من الطبقه الوسطه الي راح تختفي بعد مه بسيطه ويسر مجتمعنا الغبي والي مال امه داعي طبقتين طبقه غنيه وطبقه فقيره "" والله عندي احساس انو الحياه راح ترجع زي اول يعني راح ينعدم العلم وراح الموطن يشتغل اي شغله وكل شي يرجع وتشوفون وتذكرو كلامي مواطن مطعون",اخ والله جبتها علي الجرح هذا حال كل مواطن من الطبقه الوسطه الي راح تختفي بعد مه بسيطه ويسر مجتمعنا الغبي والي مال امه داعي طبقتين طبقه غنيه وطبقه فقيره والله عندي احساس انو الحياه راح ترجع زي اول يعني راح ينعدم العلم وراح الموطن يشتغل اي شغله وكل شي يرجع وتشوفون وتذكرو كلامي مواطن مطعون,,[],0,pending,,
mt_dial_lev_4db668b4,train,74364,DIAL_LEV,بطل الكاس رمثاوي وحداتي ما بتفرق اللي بدنا اياه عملناه وباي باي استنو السنة,بطل الكاس رمثاوي وحداتي ما بتفرق اللي بدنا اياه عملناه وباي باي استنو السنه,,[],0,pending,,
mt_msa_12da23d2,train,17227,MSA,""" نحن لم نتعود الهجوم على اللجان",نحن لم نتعود الهجوم علي اللجان,,[],0,pending,,
mt_dial_egy_4099fefd,train,57546,DIAL_EGY,يا عم ماوركش حاجة غير الكلام,يا عم ماوركش حاجه غير الكلام,,[],0,pending,,
mt_dial_glf_93a90ce1,train,23444,DIAL_GLF,بسم الله اولا انت ماتعرفون فارس نجد لا اشتها والله اني احس النتيجه بتفجعكم يكفي ان النصر فاز ب ( 13 ) بطوله و امام فريقكم المحلي واسالو الدعيع ه وبعدين انتو تحبون تسمعون اخبار العامي لانه تكتفنا والتالف الي صاير,بسم الله اولا انت ماتعرفون فارس نجد لا اشتها والله اني احس النتيجه بتفجعكم يكفي ان النصر فاز ب 13 بطوله و امام فريقكم المحلي واسالو الدعيع ه وبعدين انتو تحبون تسمعون اخبار العامي لانه تكتفنا والتالف الي صاير,,[],0,pending,,
