example_id,source_split,source_row_id,dialect,original_text,normalized_text,masked_text,mask_spans_json,mask_count,annotation_status,annotator_model,notes
mt_dial_egy_2e38ea3a,train,59840,DIAL_EGY,يا بدرى نرجوك بعد الدورى مايخلص تكون شفتلك نادى اخر ! !,يا بدري نرجوك بعد الدوري مايخلص تكون شفتلك نادي اخر,,[],0,pending,,
mt_dial_glf_82ce92d5,train,12109,DIAL_GLF,كيف كانت الحسبة التفاصيل علشان نقتنع ؟ ؟,كيف كانت الحسبه التفاصيل علشان نقتنع,,[],0,pending,,
mt_dial_lev_ab362b00,train,78973,DIAL_LEV,افهم شغلة وحدة بس ( كيف رفع البنزين بدو يحسن وضع الطبقة الفقيرة و المتوسطة,افهم شغله وحده بس كيف رفع البنزين بدو يحسن وضع الطبقه الفقيره و المتوسطه,,[],0,pending,,
mt_msa_a1c9a73a,train,30080,MSA,وتحميها دول الغرب وامريكا سياسيا وعسكريا,وتحميها دول الغرب وامريكا سياسيا وعسكريا,,[],0,pending,,
mt_dial_egy_8304adff,train,9944,DIAL_EGY,وياريت كل مديريات الامن بكل المحافظات تنحو هذا النحو دانا فاكر لما كنا نتمشى فى شارع السكة الجديده فى المنصوره وحد بس يفكر يعاكس لو بالكلام اى واحده بوليس الاداب ينقرله نقرة فى شعره بالما كينه مكنة الحلاقه نمره 3 عشان يضطر مرغما الى حلق شعره نمره 0 كان فيه ضبط وربط واحترام فى الشارع المصرى ياريت يعود وبااقصى سرعه,وياريت كل مديريات الامن بكل المحافظات تنحو هذا النحو دانا فاكر لما كنا نتمشي في شارع السكه الجديده في المنصوره وحد بس يفكر يعاكس لو بالكلام اي واحده بوليس الاداب ينقرله نقره في شعره بالما كينه مكنه الحلاقه نمره 3 عشان يضطر مرغما الي حلق شعره نمره 0 كان فيه ضبط وربط واحترام في الشارع المصري ياريت يعود وبااقصي سرعه,,[],0,pending,,
mt_dial_glf_53a07fd5,train,65413,DIAL_GLF,ه اسأله بدائيه جدا ارحمونا تكفون وترا الناس تفقه في الحوار احس ان الي قريته في ايام قديم جريدتي الرياض ( المفضله ) قال ايش قال لوحظ احمد سعد لاعب الاتفاق يتمشى على شاطيء الدمام قالك سبق صحفي طبعا زمان با,ه اساله بداييه جدا ارحمونا تكفون وترا الناس تفقه في الحوار احس ان الي قريته في ايام قديم جريدتي الرياض المفضله قال ايش قال لوحظ احمد سعد لاعب الاتفاق يتمشي علي شاطيء الدمام قالك سبق صحفي طبعا زمان با,,[],0,pending,,
mt_dial_lev_8117d06e,train,85645,DIAL_LEV,"كنظرة مستقبلية لا ارى ان الفيصلي مبشر و لديه ما يخفيه لاعبين كبار في السن بطئ في اللعب يجعلك تتثائب و انت تشاهد مباراة للفيصلي , دفاع يسهل اختراقه هل هذا اداء يليق بفريق فاز ببطولة الدوري , يحق لجمهور الفيصلي ان يلمع صورة ناديه و لكن الفيصلي يحتاج منكم النصيحة اكثر من التطبيل و التزمير لفريق متهالك زبطت معه هالسنه و اعتقد انه سيغيب كمان خمس سنين عن البطولات و وقتها سيذهب جمهور الفيصلي الى النادي و يطالبوا بالتغيير بعد ان وقع الفاس بالراس",كنظره مستقبليه لا اري ان الفيصلي مبشر و لديه ما يخفيه لاعبين كبار في السن بطي في اللعب يجعلك تتثايب و انت تشاهد مباراه للفيصلي دفاع يسهل اختراقه هل هذا اداء يليق بفريق فاز ببطوله الدوري يحق لجمهور الفيصلي ان يلمع صوره ناديه و لكن الفيصلي يحتاج منكم النصيحه اكثر من التطبيل و التزمير لفريق متهالك زبطت معه هالسنه و اعتقد انه سيغيب كمان خمس سنين عن البطولات و وقتها سيذهب جمهور الفيصلي الي النادي و يطالبوا بالتغيير بعد ان وقع الفاس بالراس,,[],0,pending,,
mt_msa_01200dc0,train,71506,MSA,أنظروا ما يقول أحد المعلقين ! !,انظروا ما يقول احد المعلقين,,[],0,pending,,
mt_dial_egy_ff6611af,train,71953,DIAL_EGY,انا متأكدة ان معظم المصريين مع اول صفارة في اول ماتش للجزائر قلبهم هيروح لمنتخب الجزائر حتي لو منهم من كان واخد قراره بعدم التشجيع . . الدم عمره ما هيبقي مية . . و لا عزاء للمتعصبين . . تحيا مصر و تحيا الجزائر,انا متاكده ان معظم المصريين مع اول صفاره في اول ماتش للجزاير قلبهم هيروح لمنتخب الجزاير حتي لو منهم من كان واخد قراره بعدم التشجيع الدم عمره ما هيبقي ميه و لا عزاء للمتعصبين تحيا مصر و تحيا الجزاير,,[],0,pending,,
mt_dial_glf_9707d349,train,77899,DIAL_GLF,ماعرفن حل لكم اول اذ خذ الواحد مخالفة قال ان ماخالفت والحين جد الكميرات وتقولون ليه يعني تبغون الدعوه فوضاء الله يقوي المرور ويفكون من بعض السرعه,ماعرفن حل لكم اول اذ خذ الواحد مخالفه قال ان ماخالفت والحين جد الكميرات وتقولون ليه يعني تبغون الدعوه فوضاء الله يقوي المرور ويفكون من بعض السرعه,,[],0,pending,,
mt_dial_lev_7c55bdeb,train,16843,DIAL_LEV,طيب شو اسم المكتب ؟ بس,طيب شو اسم المكتب بس,,[],0,pending,,
mt_msa_b221ae1f,train,74067,MSA,يشارك في البطولات ولا ياخذ,يشارك في البطولات ولا ياخذ,,[],0,pending,,
mt_dial_egy_9711cd5c,train,69863,DIAL_EGY,لاهوه ينفع ولا البردعي ولا مبارك ولا,لاهوه ينفع ولا البردعي ولا مبارك ولا,,[],0,pending,,
mt_dial_glf_9597b5c0,train,56512,DIAL_GLF,لنا سنين وحن ننتظر صكوك اراضي في الجبيل طريق ابو حدرية والى الان مانزل شىءياليت بس ينظرون في موضوع اراضي القرارات واللي احيا ارضة يعطونة,لنا سنين وحن ننتظر صكوك اراضي في الجبيل طريق ابو حدريه والي الان مانزل شيءياليت بس ينظرون في موضوع اراضي القرارات واللي احيا ارضه يعطونه,,[],0,pending,,
mt_dial_lev_7b26f46b,train,61618,DIAL_LEV,1 ) إدارة الوحدات ممتازة جدا وأفضل من إدارة الزعيم : أنا باحكيلك نحن غير راضون عن ادارتنا نهائيا والتغيير بإ 1 ن الله قادم لأن هذه الإدارة هي التي تسببت بنالنتائج الكارثية الموسم الماضي وخصوصا على المستوى الخارجي ! ! أما إداراتك فلا تعليق اسأل منتديات الوحدات نت ورايحين بيجاوبوك عنها ولن اتدخل بإدارة الوحدات لأنه أمر خاص,1 اداره الوحدات ممتازه جدا وافضل من اداره الزعيم انا باحكيلك نحن غير راضون عن ادارتنا نهاييا والتغيير با 1 ن الله قادم لان هذه الاداره هي التي تسببت بنالنتايج الكارثيه الموسم الماضي وخصوصا علي المستوي الخارجي اما اداراتك فلا تعليق اسال منتديات الوحدات نت ورايحين بيجاوبوك عنها ولن اتدخل باداره الوحدات لانه امر خاص,,[],0,pending,,
mt_msa_d2df2b7d,train,56318,MSA,عانسات بسبب الغلا في المهر . .,عانسات بسبب الغلا في المهر,,[],0,pending,,
mt_dial_egy_628a973d,train,19365,DIAL_EGY,لكن اللى حصل اناهرده ده و الصور اللى قدامنا دي بجد مهانة و حاجة,لكن اللي حصل اناهرده ده و الصور اللي قدامنا دي بجد مهانه و حاجه,,[],0,pending,,
mt_dial_glf_860b4121,train,38921,DIAL_GLF,ماني شايف إنه تكلم عن شيء محرم الإختلاط في الأسواق والحياة العامة موجود من 1431,ماني شايف انه تكلم عن شيء محرم الاختلاط في الاسواق والحياه العامه موجود من 1431,,[],0,pending,,
mt_dial_lev_d3b7efb9,train,19936,DIAL_LEV,امريكا وعزرايل بتضحك عليكووبتوكل في عقلكو حلاوا هو انت مصدق يعملو لكم دوله عبر التاريخ الطويل منذ الاف السنين اكدب شعوب العالم قتله الانبيا لاامان لهم الاقصي لايتحرر الابدم وقتال شرس غير ذلك حط راسك ونام واهلين سلام,امريكا وعزرايل بتضحك عليكووبتوكل في عقلكو حلاوا هو انت مصدق يعملو لكم دوله عبر التاريخ الطويل منذ الاف السنين اكدب شعوب العالم قتله الانبيا لاامان لهم الاقصي لايتحرر الابدم وقتال شرس غير ذلك حط راسك ونام واهلين سلام,,[],0,pending,,
mt_msa_af1d4daa,train,80940,MSA,و أشعر بمرور كل الأرواح .,و اشعر بمرور كل الارواح,,[],0,pending,,
mt_dial_egy_15157487,train,70450,DIAL_EGY,""" وأنها أفكار مشبوهة وتعد عودة لعصور الإقطاع والرأسمالية البغيضة "" . أمال إحنا عايشين فى أى عصور ؟ لما البلد بيملكها 100 او 200 شخص بعينهم ، وإنتم , العمال , بتتباعوا مع شركاتكم كمصاريف مش أصول مهمه فى الشركة ، وبعدين اللى بيشترى شركاتكم يبهدلكم ويخليكوا تباتوا فى الشارع بالاسبوع والاسبوعين علشان تاخدوا مرتباتكم المتأخرة عليكم لشهرين وتلاته . بجد بقى القائمين عليكم خلوا كلمة عمال شئ يصعب على الكافر ، يبقى إزاى تقدروا تمثلوا شعب عايز كرامه ؟",وانها افكار مشبوهه وتعد عوده لعصور الاقطاع والراسماليه البغيضه امال احنا عايشين في اي عصور لما البلد بيملكها 100 او 200 شخص بعينهم وانتم العمال بتتباعوا مع شركاتكم كمصاريف مش اصول مهمه في الشركه وبعدين اللي بيشتري شركاتكم يبهدلكم ويخليكوا تباتوا في الشارع بالاسبوع والاسبوعين علشان تاخدوا مرتباتكم المتاخره عليكم لشهرين وتلاته بجد بقي القايمين عليكم خلوا كلمه عمال شي يصعب علي الكافر يبقي ازاي تقدروا تمثلوا شعب عايز كرامه,,[],0,pending,,
mt_dial_glf_f6fd28f2,train,57505,DIAL_GLF,وانا مع الاخوان ( امسكوا عنزكم تيسنا مايجيكم ) الله لا,وانا مع الاخوان امسكوا عنزكم تيسنا مايجيكم الله لا,,[],0,pending,,
mt_dial_lev_c53a8d23,train,59079,DIAL_LEV,انا متاكده انو هالرجال عمرو ما فكر يبوس ايد اموه او ايد مرتو من اول ما انخلق جاي يتزانخ عضيوف هالبلد بدو يطلع علينا سمعه سيئه باحترام الضيوف ؟,انا متاكده انو هالرجال عمرو ما فكر يبوس ايد اموه او ايد مرتو من اول ما انخلق جاي يتزانخ عضيوف هالبلد بدو يطلع علينا سمعه سييه باحترام الضيوف,,[],0,pending,,
mt_msa_6bdab49e,train,57691,MSA,أين تشدق الخليوي وكيل وزارة العمل الأسبوع الماضي في أمريكا بأنه لايوجد فصل تعسفي من الشركات ضد المواطنيين ؟ !,اين تشدق الخليوي وكيل وزاره العمل الاسبوع الماضي في امريكا بانه لايوجد فصل تعسفي من الشركات ضد المواطنيين,,[],0,pending,,
mt_dial_egy_203b8970,train,63337,DIAL_EGY,بص حواليك واقرا احوال البلاد والعباد بداية عز افندى جالنا منين واشترى شركت الحديد من مين وبكام وفى فترة وجيزة وفى غفلة من الزمان اصبح معاه كام وياترى بيلعب لوحده ولاوراه ناس بالسلطة وهو مجرد صورة بتخفى وراها اشرار اقسموا على تدمير البلادلعقد بداخلهم ولامن اجل مصلحة اليهود كمان 00 نوايب حزبك فسادهم للركب ولاانت مش شايفهم كمان بص وشوف واحد بتاع قمار ومن قبله حبيب وغاوى نسوان وحرامى اراضى بوسام على صدره اتحطله نشان وواحد بيصدر الغاز لاسرائيل ببلاش وبمباركة منكم بغرض تدمير اخوان لنا فى الاسلام وواحد جلبلنا من اليهود حبوب مسرطنة لتدمير العباد والاقصى بيصرخ ويستغيث ولاحول ولاقوة اهل السلطة خرجوا يشجعوا الكورة وعلى اخوانهم فى الجزائر عملوا رجالة ياولاد وحرقوا اعلامها وطردوا سفيرها وسبوا شهدائها والاقصى مازال بيصرخ والله ياولاد وعز تانى راجع وطالع علينا يولع الحديد لاجل مايخرب بيوت العباد وبيطلب كمان من اهل السلطة لاجل ماتسانده فى تجاة الاثار ياولاد وولاد البلد اتشردوا اب وولد وبنت وست كمان باسم الخصخصة اللىباسمها باعوا الشركات لبعضهم بابخس الاثمان وهبا اصبحوا اصحاب مليارات من دم العباد الشقيانة ياولاد 000 حقيقى خسارة والف خسارة على اللى مسكوا البلد وخلوها خردة ياولاد 0000 بس لازم تعرف ويعرفوا ان اخر الانحدار بتكون بداية النهاية والخلاص من الظلم والظالمين ياولاد دى سنت الكون واقرا وخليهم معاك يقرؤا التاريخ كويس منذ فرعون وانت جاى بالتاريخ لقدام 000 مافيش ظالم كمل بظلمه على الارض لان ربك دايما للظالم وللظلم متربص ولايمكن ينسى عبده المظلوم وهو القائل سبحانه عبدى وعزتى وجلالى لانصرنك ولو بعد حين 000 واخيرا اتمنى ان تعمل حاجة كويسة تخلى الناس تحبك كانسان وفى ذات الوقت تلقى بيها ربك وهوراض عنك لان كل كلاب السلطة لن ينفعوك بداية اذا هبت ثورة الجياع ومعها الطوفان فكل منهم سيقول نفسى تفسى لانها طبيعة الخسيس والجبان واللى اتربى وجعل من نفسه عبد للانسان وفى الاخرة سيكونوا عليك شهود كمان 000 نصيحتى لك توضاء وصلى ركعتين وامسك بكتاب الله عز وجل وتدبر اياته علها تنير لك بصيرتك وتعمل حاجة يكون من شانها اصلاح حال البلاد والعباد 00000 مواطن مسلم مصرى يحزنه حال مالت اليه حال البلاد والعباد 0000 ارجو النشر مع جزيل الشكر,بص حواليك واقرا احوال البلاد والعباد بدايه عز افندي جالنا منين واشتري شركت الحديد من مين وبكام وفي فتره وجيزه وفي غفله من الزمان اصبح معاه كام وياتري بيلعب لوحده ولاوراه ناس بالسلطه وهو مجرد صوره بتخفي وراها اشرار اقسموا علي تدمير البلادلعقد بداخلهم ولامن اجل مصلحه اليهود كمان 00 نوايب حزبك فسادهم للركب ولاانت مش شايفهم كمان بص وشوف واحد بتاع قمار ومن قبله حبيب وغاوي نسوان وحرامي اراضي بوسام علي صدره اتحطله نشان وواحد بيصدر الغاز لاسراييل ببلاش وبمباركه منكم بغرض تدمير اخوان لنا في الاسلام وواحد جلبلنا من اليهود حبوب مسرطنه لتدمير العباد والاقصي بيصرخ ويستغيث ولاحول ولاقوه اهل السلطه خرجوا يشجعوا الكوره وعلي اخوانهم في الجزاير عملوا رجاله ياولاد وحرقوا اعلامها وطردوا سفيرها وسبوا شهدايها والاقصي مازال بيصرخ والله ياولاد وعز تاني راجع وطالع علينا يولع الحديد لاجل مايخرب بيوت العباد وبيطلب كمان من اهل السلطه لاجل ماتسانده في تجاه الاثار ياولاد وولاد البلد اتشردوا اب وولد وبنت وست كمان باسم الخصخصه الليباسمها باعوا الشركات لبعضهم بابخس الاثمان وهبا اصبحوا اصحاب مليارات من دم العباد الشقيانه ياولاد 000 حقيقي خساره والف خساره علي اللي مسكوا البلد وخلوها خرده ياولاد 0000 بس لازم تعرف ويعرفوا ان اخر الانحدار بتكون بدايه النهايه والخلاص من الظلم والظالمين ياولاد دي سنت الكون واقرا وخليهم معاك يقروا التاريخ كويس منذ فرعون وانت جاي بالتاريخ لقدام 000 مافيش ظالم كمل بظلمه علي الارض لان ربك دايما للظالم وللظلم متربص ولايمكن ينسي عبده المظلوم وهو القايل سبحانه عبدي وعزتي وجلالي لانصرنك ولو بعد حين 000 واخيرا اتمني ان تعمل حاجه كويسه تخلي الناس تحبك كانسان وفي ذات الوقت تلقي بيها ربك وهوراض عنك لان كل كلاب السلطه لن ينفعوك بدايه اذا هبت ثوره الجياع ومعها الطوفان فكل منهم سيقول نفسي تفسي لانها طبيعه الخسيس والجبان واللي اتربي وجعل من نفسه عبد للانسان وفي الاخره سيكونوا عليك شهود كمان 000 نصيحتي لك توضاء وصلي ركعتين وامسك بكتاب الله عز وجل وتدبر اياته علها تنير لك بصيرتك وتعمل حاجه يكون من شانها اصلاح حال البلاد والعباد 00000 مواطن مسلم مصري يحزنه حال مالت اليه حال البلاد والعباد 0000 ارجو النشر مع جزيل الشكر,,[],0,pending,,
mt_dial_glf_a4a158fd,train,77242,DIAL_GLF,من المنامه جيت عاني . . . جيت اقدم,من المنامه جيت عاني جيت اقدم,,[],0,pending,,
mt_dial_lev_12752119,train,14950,DIAL_LEV,انا بناشد كل الموظفين المريشين والتجار الكبار ورؤوس,انا بناشد كل الموظفين المريشين والتجار الكبار ورووس,,[],0,pending,,
mt_msa_01a07ed8,train,44874,MSA,نريد من منظمة الصحة حل حازم لمرض الكبد المنتشر بين المصريين ويزداد يوم عن يوم ونريد من جريدة اليوم السابع خصوصا بحملة كبيرة لاتنتهى لهذا المرض اللعين وتوعية المصريين للحذر رجاءا رجاءا وحس جميع اجهزة الدولة والفضائيات لنشر التوعية وليكون عام 2010 عام للمحافظة على الكبد يارب يارب ولابد من وقف الاسباب اهم من العلاج وغلاء سعر الدواء وتحية للدكتور ماهر الاعصر على,نريد من منظمه الصحه حل حازم لمرض الكبد المنتشر بين المصريين ويزداد يوم عن يوم ونريد من جريده اليوم السابع خصوصا بحمله كبيره لاتنتهي لهذا المرض اللعين وتوعيه المصريين للحذر رجاءا رجاءا وحس جميع اجهزه الدوله والفضاييات لنشر التوعيه وليكون عام 2010 عام للمحافظه علي الكبد يارب يارب ولابد من وقف الاسباب اهم من العلاج وغلاء سعر الدواء وتحيه للدكتور ماهر الاعصر علي,,[],0,pending,,
mt_dial_egy_dd228c45,train,50012,DIAL_EGY,لازم بداية يغير اسمه او,لازم بدايه يغير اسمه او,,[],0,pending,,
mt_dial_glf_f171bdec,train,21762,DIAL_GLF,الظروف تغيرت الان لا اعتقد انسان يقد ان يعيش بدون كهرباء وبدون حقوق وواجبات اهل بيته ومطلبات المدارس والمصاريف لماذا يريد البعض العوده الي حياة البدائية وهي مرفوضه هنا في اللمكله مثل ما حصل للذين لا يريدون ان يعيشون او يختلطون بالمجتمع منه في منطقه القصيم والكثير جنوب المملكه لم تتركهم الدوله,الظروف تغيرت الان لا اعتقد انسان يقد ان يعيش بدون كهرباء وبدون حقوق وواجبات اهل بيته ومطلبات المدارس والمصاريف لماذا يريد البعض العوده الي حياه البداييه وهي مرفوضه هنا في اللمكله مثل ما حصل للذين لا يريدون ان يعيشون او يختلطون بالمجتمع منه في منطقه القصيم والكثير جنوب المملكه لم تتركهم الدوله,,[],0,pending,,
mt_dial_lev_e41a6f44,train,48060,DIAL_LEV,لم نعد قادرين على الانتظار لوقت المباراة تواقون الى الفوز الاخضر من الان انشاء الله ما تطول فرحتنا في نجوم الزعيم الاخضر وهم يرفعون الكاس عاليا ويهدونه لجماهيرهم الوفية في,لم نعد قادرين علي الانتظار لوقت المباراه تواقون الي الفوز الاخضر من الان انشاء الله ما تطول فرحتنا في نجوم الزعيم الاخضر وهم يرفعون الكاس عاليا ويهدونه لجماهيرهم الوفيه في,,[],0,pending,,
mt_msa_46beb9fc,train,42968,MSA,الفخر تكون لدينا مصانع داخل قلوبنا والعقول . .,الفخر تكون لدينا مصانع داخل قلوبنا والعقول,,[],0,pending,,
mt_dial_egy_d924a52b,train,45166,DIAL_EGY,حد خد بالة ان المخرج جاب لقطة تشجيع من مدرجات الاهلى فى عز ثورة الجماهير فى الملعب الحقيقة انا مش عارف اقول اية على العموم حسبنا اللة ونعم,حد خد باله ان المخرج جاب لقطه تشجيع من مدرجات الاهلي في عز ثوره الجماهير في الملعب الحقيقه انا مش عارف اقول ايه علي العموم حسبنا الله ونعم,,[],0,pending,,
mt_dial_glf_f1d60713,train,62652,DIAL_GLF,صحيح والله ياليت القرض الحسن للبنك العقاري طلع أسمي والله ماأقدر أسوي شيئ ب 300 مع أرتفاع الحديد ماتصلح لي إلا السور أعتقد والقواعد حقات البيت,صحيح والله ياليت القرض الحسن للبنك العقاري طلع اسمي والله مااقدر اسوي شيي ب 300 مع ارتفاع الحديد ماتصلح لي الا السور اعتقد والقواعد حقات البيت,,[],0,pending,,
