example_id,source_split,source_row_id,dialect,original_text,normalized_text,masked_text,mask_spans_json,mask_count,annotation_status,annotator_model,notes
mt_msa_1d8a2326,train,85841,MSA,بورك فيك أيها الدكتورو المعلم والوزير فأنت الآن حققت الحكمة ( من أطعمني سمكة أشبعني يوما ومن يعلمني الصيد يشبعني كل يوم ) وها أنت تعلم الطلاب لكي يكون لدينا أكثر من جراح يجري هذه العمليات مستقبلا ولم تكن أنانيا وهذا هو العطاء الحقيقي الذي يعكس روح المواطنة وفقك الله والى الأمام ومزيدا من النجاحات باذن الله,بورك فيك ايها الدكتورو المعلم والوزير فانت الان حققت الحكمه من اطعمني سمكه اشبعني يوما ومن يعلمني الصيد يشبعني كل يوم وها انت تعلم الطلاب لكي يكون لدينا اكثر من جراح يجري هذه العمليات مستقبلا ولم تكن انانيا وهذا هو العطاء الحقيقي الذي يعكس روح المواطنه وفقك الله والي الامام ومزيدا من النجاحات باذن الله,,[],0,pending,,
mt_dial_egy_1343fc7a,train,79692,DIAL_EGY,فكرة حلوة جدا ويارت تتنفذ مع كاترين زيتا جونز مثلا :,فكره حلوه جدا ويارت تتنفذ مع كاترين زيتا جونز مثلا,,[],0,pending,,
mt_dial_glf_f93ebb5c,train,32886,DIAL_GLF,الله راح يمهل لكنه سبحانه,الله راح يمهل لكنه سبحانه,,[],0,pending,,
mt_dial_lev_f244cd44,train,10818,DIAL_LEV,ومع هيك كل فترة والثانية بغسلها في مغسلة علشان شفط الغبرة وغيرو من الشغلات . .,ومع هيك كل فتره والثانيه بغسلها في مغسله علشان شفط الغبره وغيرو من الشغلات,,[],0,pending,,
mt_msa_b4f7b102,train,5508,MSA,ندعو بالمغفرة للقاتل والمقتول . نريد ان نسمع عن تنفيذ القصاص في المهربين والمروجين للسموم اللعينة التي تكاد جرائمهم تهز المجتمع . ولا يكاد يوم يمر الا ونسمع عن تهريب باطنان الحشيش وملايين الحبوب المخدرة التي تفتك بالشباب من الجنسين,ندعو بالمغفره للقاتل والمقتول نريد ان نسمع عن تنفيذ القصاص في المهربين والمروجين للسموم اللعينه التي تكاد جرايمهم تهز المجتمع ولا يكاد يوم يمر الا ونسمع عن تهريب باطنان الحشيش وملايين الحبوب المخدره التي تفتك بالشباب من الجنسين,,[],0,pending,,
