example_id,source_split,source_row_id,dialect,original_text,normalized_text,masked_text,mask_spans_json,mask_count,annotation_status,annotator_model,notes
mt_dial_lev_e8126d61,train,1999,DIAL_LEV,كلام فاضي منذ ثلاثةشهور ونصف لم تصل المياه لمنزلي ولجيراني مع العلم تقدمنا بشكوى للسلطة ولم نستفيدوجاء مدير اقليم الشمال الى الحي وقال يوم الخميس بتجي المياه بس اي خميس الله اعلم وتم كتابة اكثر من تعليق في اكثر من جريدة ولا حياة في ما تنادي مع العلم ان الشارع المجاورالذي تصل له المياه قبلنا من نفس الماسورة تصل المياه الى الطابق الرابع لأنه شارع البنوك ومسجد ابو بكر الصديق المجاور لناأصبح المسجد يشتري المياه لكي يتوضىء المصلون المارون من الشارع فهل يعقل ان لا تصل المياه للمسجد وتصل المياه لشارع البنوك لأنه شارع البنوك واذا سئلت مراقب السلطة يقول انا افتح محابس المياه حسب,كلام فاضي منذ ثلاثهشهور ونصف لم تصل المياه لمنزلي ولجيراني مع العلم تقدمنا بشكوي للسلطه ولم نستفيدوجاء مدير اقليم الشمال الي الحي وقال يوم الخميس بتجي المياه بس اي خميس الله اعلم وتم كتابه اكثر من تعليق في اكثر من جريده ولا حياه في ما تنادي مع العلم ان الشارع المجاورالذي تصل له المياه قبلنا من نفس الماسوره تصل المياه الي الطابق الرابع لانه شارع البنوك ومسجد ابو بكر الصديق المجاور لنااصبح المسجد يشتري المياه لكي يتوضيء المصلون المارون من الشارع فهل يعقل ان لا تصل المياه للمسجد وتصل المياه لشارع البنوك لانه شارع البنوك واذا سيلت مراقب السلطه يقول انا افتح محابس المياه حسب,,[],0,pending,,
mt_msa_2ea15cde,train,18091,MSA,اتمنى الابقاء على فيجاروا وباسكال والبحث عن لاعب محور ومدافع اجانب بالتوفيق للعالمي حبي الاول,اتمني الابقاء علي فيجاروا وباسكال والبحث عن لاعب محور ومدافع اجانب بالتوفيق للعالمي حبي الاول,,[],0,pending,,
mt_dial_egy_461bdb72,train,77362,DIAL_EGY,ياابوتريكة المفرض انك راجل متدين وبتراعى ربنا في كل اعمالك 0 ياريت تخلى عندك ضمير وتبطل تمثيل على الحكام علشان تاخد بلنتات ودة مشحقق يعنى دة يعتبر غش وخداع ودة منعنا منة نبينا سيدنا محمد علية الصلاة والسلام 0 الاهلى لا يدافع عنك يوم القيامةارجع الى اللة واستغفرة يغفرلنا ولك والمؤمنون وشرا للموقع,ياابوتريكه المفرض انك راجل متدين وبتراعي ربنا في كل اعمالك 0 ياريت تخلي عندك ضمير وتبطل تمثيل علي الحكام علشان تاخد بلنتات وده مشحقق يعني ده يعتبر غش وخداع وده منعنا منه نبينا سيدنا محمد عليه الصلاه والسلام 0 الاهلي لا يدافع عنك يوم القيامهارجع الي الله واستغفره يغفرلنا ولك والمومنون وشرا للموقع,,[],0,pending,,
mt_dial_glf_f08ab557,train,26420,DIAL_GLF,س / وشو الدخان الي عندهم ؟,س وشو الدخان الي عندهم,,[],0,pending,,
mt_dial_lev_5948f29a,train,25401,DIAL_LEV,تسلم إيديكو ، ويعطيكو ألف عافية,تسلم ايديكو ويعطيكو الف عافيه,,[],0,pending,,
mt_msa_81eda74e,train,1182,MSA,لمن يريد تعلم الانجليزية بل,لمن يريد تعلم الانجليزيه بل,,[],0,pending,,
mt_dial_egy_58528519,train,5199,DIAL_EGY,خلاص يا ابو الكباتن اسمك محفوظ كابتن مدحت شنبى !,خلاص يا ابو الكباتن اسمك محفوظ كابتن مدحت شنبي,,[],0,pending,,
mt_dial_glf_e9f6f44f,train,51887,DIAL_GLF,ممكن كلامك صحيح لكن بعدما وقع الفاس في الرأس,ممكن كلامك صحيح لكن بعدما وقع الفاس في الراس,,[],0,pending,,
mt_dial_lev_8f2ff1bd,train,47711,DIAL_LEV,الاخطبوط توقع فوز المانيا على اسبانيا بنهائي امم اروبا و لكن جرى العكس هالمرة توقع فوز اسبانيا بس ان شاء الله تفوز,الاخطبوط توقع فوز المانيا علي اسبانيا بنهايي امم اروبا و لكن جري العكس هالمره توقع فوز اسبانيا بس ان شاء الله تفوز,,[],0,pending,,
mt_msa_a147f576,train,54507,MSA,{ 9 مليون وافد . . سنامي يغرقنا كل يوم ؟,9 مليون وافد سنامي يغرقنا كل يوم,,[],0,pending,,
mt_dial_egy_55678eff,train,63650,DIAL_EGY,اسهل شيئ للكنيسة لا بلاش . . . لا احذف . . . لا,اسهل شيي للكنيسه لا بلاش لا احذف لا,,[],0,pending,,
mt_dial_glf_a130a3a7,train,74962,DIAL_GLF,بكره بيكذب الخبر وبيقول انا ما تكلمت اي,بكره بيكذب الخبر وبيقول انا ما تكلمت اي,,[],0,pending,,
mt_dial_lev_67b10293,train,35567,DIAL_LEV,مشكورة اخت مريم عنجد موضوع رائع ومهم جدا بهذا الوقت لاننا على ابواب رمضان فهي فرصة ممتازة للمدخنين للاقلاع عنه,مشكوره اخت مريم عنجد موضوع رايع ومهم جدا بهذا الوقت لاننا علي ابواب رمضان فهي فرصه ممتازه للمدخنين للاقلاع عنه,,[],0,pending,,
mt_msa_550bd514,train,68564,MSA,لابد أن يعلموا الجزائريين أن مصر لن تترك لهم بطولة تكون مصر طرف فيها . وكان لازم يعرفوا كدة بعد أحداث السودان الغادرة . والأيام القادمة سوف تثبت ذلك,لابد ان يعلموا الجزايريين ان مصر لن تترك لهم بطوله تكون مصر طرف فيها وكان لازم يعرفوا كده بعد احداث السودان الغادره والايام القادمه سوف تثبت ذلك,,[],0,pending,,
mt_dial_egy_f4d741fe,train,8577,DIAL_EGY,والني يا عم ايمن الله لا يسيئك وحياة ولادك ياشيخ سيبنا ف حالنا وما تخرطش علي قلبنا بصل اصل الحكايه مش نفصاك . واذا كنت لسة متمسك بحكاية الزعامة دي خلاص يا سيدي زعمناك علي عواجيز الفرح واقعد اخطب فيهم زي ما انت عايز . أو روح حته تانيه اخطب فيها وتكون اوسع من ميدان التحرير منطقة الخانكه محافظة القليوبيه . ح تلاقي هناك ناس طيبين قوي وبيسمعوا من غير ما يعلقوا . أمة مين يا أيمن باشا زغلول اللي بتتكلم باسمها انت عملت زي جحا كدبت الكدبه وصدقتها ولا ايه . اذا كنت لا تستطيع التحدث باسم امه صغيره تتكون من 4 أو 5 افراد هي امتك الصغيره - أقصد طبعا أسرتك الصغيره _ فكيف تجرؤ او حتي تفكر بأن تتحدث ياسمنا . ام تظننا أمة قد ضحكت من جهلها الأمم . بالمناسبه هذا الكلام ينسحب علي اي زعيم اممي آخر مهما كان انتمائه . وسلم لي علي,والني يا عم ايمن الله لا يسييك وحياه ولادك ياشيخ سيبنا ف حالنا وما تخرطش علي قلبنا بصل اصل الحكايه مش نفصاك واذا كنت لسه متمسك بحكايه الزعامه دي خلاص يا سيدي زعمناك علي عواجيز الفرح واقعد اخطب فيهم زي ما انت عايز او روح حته تانيه اخطب فيها وتكون اوسع من ميدان التحرير منطقه الخانكه محافظه القليوبيه ح تلاقي هناك ناس طيبين قوي وبيسمعوا من غير ما يعلقوا امه مين يا ايمن باشا زغلول اللي بتتكلم باسمها انت عملت زي جحا كدبت الكدبه وصدقتها ولا ايه اذا كنت لا تستطيع التحدث باسم امه صغيره تتكون من 4 او 5 افراد هي امتك الصغيره اقصد طبعا اسرتك الصغيره _ فكيف تجرو او حتي تفكر بان تتحدث ياسمنا ام تظننا امه قد ضحكت من جهلها الامم بالمناسبه هذا الكلام ينسحب علي اي زعيم اممي اخر مهما كان انتمايه وسلم لي علي,,[],0,pending,,
mt_dial_glf_30cab31e,train,12620,DIAL_GLF,"كلمة "" كبير "" يابو عبدالله قليلة",كلمه كبير يابو عبدالله قليله,,[],0,pending,,
mt_dial_lev_68bb8055,train,64431,DIAL_LEV,خلي الشعب ينسى الغلى ويتفرج على كره منفوخه هواء . . . قسما بالله كل ما فينا بنرجع للخلف . .,خلي الشعب ينسي الغلي ويتفرج علي كره منفوخه هواء قسما بالله كل ما فينا بنرجع للخلف,,[],0,pending,,
mt_msa_80e118d7,train,61277,MSA,يجب على ولاة الامر تحديد المهور بجميع مناطق المملكة صدقوني لن تجدوا هذه الارقام المخيفه من,يجب علي ولاه الامر تحديد المهور بجميع مناطق المملكه صدقوني لن تجدوا هذه الارقام المخيفه من,,[],0,pending,,
mt_dial_egy_efa6e60d,train,72593,DIAL_EGY,فين برنامج الريس اللى كان ف انتخابات 2005 واتحقق منه ايه وليه مش حاسيين بيه انت كلامك صح ان الدكتور البرادعى مش ليه اجنده او برنامج بس برده الريس لم يحقق البرنامج بتاعه ولا حسينا بحاجه كويسه بالعكس الدنيا بتغلى اكتر والاجور زى ماهى لو الريس نزل الانتجابات بالبرنامج بتاعه اكيد مش هديله صوتى لانه مش عمل البرنامج القديم علشان يعمل,فين برنامج الريس اللي كان ف انتخابات 2005 واتحقق منه ايه وليه مش حاسيين بيه انت كلامك صح ان الدكتور البرادعي مش ليه اجنده او برنامج بس برده الريس لم يحقق البرنامج بتاعه ولا حسينا بحاجه كويسه بالعكس الدنيا بتغلي اكتر والاجور زي ماهي لو الريس نزل الانتجابات بالبرنامج بتاعه اكيد مش هديله صوتي لانه مش عمل البرنامج القديم علشان يعمل,,[],0,pending,,
mt_dial_glf_5f679c09,train,31510,DIAL_GLF,هذا مو في القويعيه بس في جميع قرى الرياض المجاوره لعنبوها من حاله مالقو الا الحلاقه هي الي مسويه زحمه تعالو للاتراك والمغاربه في الرياض وشوفو الاسعار شي,هذا مو في القويعيه بس في جميع قري الرياض المجاوره لعنبوها من حاله مالقو الا الحلاقه هي الي مسويه زحمه تعالو للاتراك والمغاربه في الرياض وشوفو الاسعار شي,,[],0,pending,,
mt_dial_lev_ed392b28,train,70318,DIAL_LEV,واللي علقوا امبارح ودعوا الله ان يخسر الوحدات . . هاهو المارد فاز وان الله لم يستجيب دعائكم والف مبروك للاخضر .,واللي علقوا امبارح ودعوا الله ان يخسر الوحدات هاهو المارد فاز وان الله لم يستجيب دعايكم والف مبروك للاخضر,,[],0,pending,,
mt_msa_9e975c83,train,64454,MSA,إذا أنت لم تعشق ولم تدرِ ما,اذا انت لم تعشق ولم تدر ما,,[],0,pending,,
mt_dial_egy_4f1517d0,train,72173,DIAL_EGY,ثالثا جتك خيبة عليكي وعلي ابو حسن وحسين وخال حسين وعماتة واعمامة وكل من لة صلة قرابة من بعيد او من قريب بيكي وبا ابو حسن روحي اعملي حاجة مفيدة بدل ما انتي بتتكلمي علي اسيادك الي هما طبعا,ثالثا جتك خيبه عليكي وعلي ابو حسن وحسين وخال حسين وعماته واعمامه وكل من له صله قرابه من بعيد او من قريب بيكي وبا ابو حسن روحي اعملي حاجه مفيده بدل ما انتي بتتكلمي علي اسيادك الي هما طبعا,,[],0,pending,,
mt_dial_glf_f36e042b,train,63908,DIAL_GLF,التعليق تحت الصورة رقم واحد غير صحيح . . اي برد واحنا مشغلين المكيفات من شهرين ؟ ؟,التعليق تحت الصوره رقم واحد غير صحيح اي برد واحنا مشغلين المكيفات من شهرين,,[],0,pending,,
mt_dial_lev_a0e5af4d,train,82075,DIAL_LEV,ازا طلع الحكي صح واثبتو انا هيا السبب بموتو فحسبي الله,ازا طلع الحكي صح واثبتو انا هيا السبب بموتو فحسبي الله,,[],0,pending,,
mt_msa_27983c63,train,30551,MSA,و تصميماتها تواكب الموضة تماشيا مع تعاليم ديننا الحنيف . .,و تصميماتها تواكب الموضه تماشيا مع تعاليم ديننا الحنيف,,[],0,pending,,
mt_dial_egy_6bf7a4b2,train,30522,DIAL_EGY,كثر ة التعليقات على موضوع فاضى يدل هلى ان الناس دى فاضيه مش لاقيه حاجه تشغلها ومع ذلك عجبنى التعليق رقم 4 ( شغل 3 ابتدائى,كثر ه التعليقات علي موضوع فاضي يدل هلي ان الناس دي فاضيه مش لاقيه حاجه تشغلها ومع ذلك عجبني التعليق رقم 4 شغل 3 ابتدايي,,[],0,pending,,
mt_dial_glf_67244641,train,23496,DIAL_GLF,كل شيء في صالح المواطن مرفوض ياشورتنا ليه ما تشوفون مجلس الشعب الكويتي وش سصون عليه,كل شيء في صالح المواطن مرفوض ياشورتنا ليه ما تشوفون مجلس الشعب الكويتي وش سصون عليه,,[],0,pending,,
mt_dial_lev_17b1cd98,train,61701,DIAL_LEV,مقال اكثر من رائع يا سيدة سوسن . . وفي مكانه . . عشان الصغار يضحكو ويبتسمو قد ما فيهم قبل ما يكبرو ويشوفو البلاوي اللي قدامهم ومش بس ينسو يبتسمو . . وكمان اساميهم :,مقال اكثر من رايع يا سيده سوسن وفي مكانه عشان الصغار يضحكو ويبتسمو قد ما فيهم قبل ما يكبرو ويشوفو البلاوي اللي قدامهم ومش بس ينسو يبتسمو وكمان اساميهم,,[],0,pending,,
mt_msa_7a28d1c9,train,57552,MSA,لاإله الا الله محمد رسول,لااله الا الله محمد رسول,,[],0,pending,,
