example_id,source_split,source_row_id,dialect,original_text,normalized_text,masked_text,mask_spans_json,mask_count,annotation_status,annotator_model,notes
mt_dial_egy_59a55182,train,45795,DIAL_EGY,لا تخف مفيش حركة محافظين الايام ديه ا نام قرير العين وريحنا من آرائك ربنا,لا تخف مفيش حركه محافظين الايام ديه ا نام قرير العين وريحنا من ارايك ربنا,,[],0,pending,,
mt_dial_glf_71cbbefb,train,8166,DIAL_GLF,والله صدق شفعت الخماسية التاريخية لفيقاروا لكن يازين هزيمتهم بوجود الجزار غالي وفيقاروا ونكرر الخماسية ثاني,والله صدق شفعت الخماسيه التاريخيه لفيقاروا لكن يازين هزيمتهم بوجود الجزار غالي وفيقاروا ونكرر الخماسيه ثاني,,[],0,pending,,
mt_dial_lev_449f9e8c,train,35389,DIAL_LEV,بالتوفيق ليكى يااحلى واجمل ستار وانتى فخر لكل جمهورك وفى انتظاار اعمالك الى هيحكى عليها كل العالم لجمالها وبنموت فيكى,بالتوفيق ليكي يااحلي واجمل ستار وانتي فخر لكل جمهورك وفي انتظاار اعمالك الي هيحكي عليها كل العالم لجمالها وبنموت فيكي,,[],0,pending,,
mt_msa_6be2c8a1,train,79230,MSA,1 - يعني تسعه الالف ريال,1 يعني تسعه الالف ريال,,[],0,pending,,
mt_dial_egy_58208074,train,48946,DIAL_EGY,يااما بيكره النادي وده معروفين ( الزبالكاوية,يااما بيكره النادي وده معروفين الزبالكاويه,,[],0,pending,,
mt_dial_glf_67f210f1,train,2332,DIAL_GLF,ه في زعبيل احباب النصراويين ه الوصل هي هي هي هي,ه في زعبيل احباب النصراويين ه الوصل هي هي هي هي,,[],0,pending,,
mt_dial_lev_4f33669a,train,72410,DIAL_LEV,ثانيا ما بسمع لشعور المريض وبتاهون وبستاهل مع تشخيصه وبعد التشخيص السي ببلش الطبيب يتحزر شو مال المريض . . . والادهى من هيك بفكر الطبيب انه بس هو هو هو الي الي الي بفهم بفهم بفهم لوحده لوحده والباقي مرضى بس مش عارفين الله وين حاططهم . .,ثانيا ما بسمع لشعور المريض وبتاهون وبستاهل مع تشخيصه وبعد التشخيص السي ببلش الطبيب يتحزر شو مال المريض والادهي من هيك بفكر الطبيب انه بس هو هو هو الي الي الي بفهم بفهم بفهم لوحده لوحده والباقي مرضي بس مش عارفين الله وين حاططهم,,[],0,pending,,
mt_msa_f28c3c4e,train,62090,MSA,الحمد لله على فضله ومنّه بعودة الطفلة لحضن والديها,الحمد لله علي فضله ومنه بعوده الطفله لحضن والديها,,[],0,pending,,
mt_dial_egy_4619f927,train,75182,DIAL_EGY,دى بلد خربانة وملهاش صحاب كلو بيضحك على كلة مفيش حاجة واحدة حتى مظبوطة كلها سرقة ونصب البلد اتباعت لى عز وامثالو ؟ ؟ ؟ . . . ويجعلو عامر الرجاء,دي بلد خربانه وملهاش صحاب كلو بيضحك علي كله مفيش حاجه واحده حتي مظبوطه كلها سرقه ونصب البلد اتباعت لي عز وامثالو ويجعلو عامر الرجاء,,[],0,pending,,
mt_dial_glf_0d384bc5,train,5805,DIAL_GLF,ابني له اكثر من ثلاث سنوات منوم في المستشفى بعد ان تعلمو فية طلب جامعة الملك فيصل بالدمام واصيب بهشاش في العظام وجميع المستشفيات اعتذرة عن حالته ورئيس اللجنة الطبية العليا الله لايسامحة دنياء واخرة امين رفض قرار اللجنة الطبية الفرعية بالشرقية ولقد حاولة اقابل الدكتور الربيعة ورفضووقدصدر امر علاجه من الملك عبدالله واللجنة الطبية ترفض والمستشفى المنوم فيه يطلب نقلة إلى مركز متقدم ووزارة الصحه كلهانفاق وقدقابلة وكيل الوزارة لشئون علاقات المرض وكانت مواعيدة كله غير صادقه ومن خلال هذة الجريدة اطلب,ابني له اكثر من ثلاث سنوات منوم في المستشفي بعد ان تعلمو فيه طلب جامعه الملك فيصل بالدمام واصيب بهشاش في العظام وجميع المستشفيات اعتذره عن حالته ورييس اللجنه الطبيه العليا الله لايسامحه دنياء واخره امين رفض قرار اللجنه الطبيه الفرعيه بالشرقيه ولقد حاوله اقابل الدكتور الربيعه ورفضووقدصدر امر علاجه من الملك عبدالله واللجنه الطبيه ترفض والمستشفي المنوم فيه يطلب نقله الي مركز متقدم ووزاره الصحه كلهانفاق وقدقابله وكيل الوزاره لشيون علاقات المرض وكانت مواعيده كله غير صادقه ومن خلال هذه الجريده اطلب,,[],0,pending,,
mt_dial_lev_7cf6f21d,train,64080,DIAL_LEV,في كل البطولات الاربعة الدرع الدوري الكاس كاس الكووس وخلي السامع,في كل البطولات الاربعه الدرع الدوري الكاس كاس الكووس وخلي السامع,,[],0,pending,,
mt_msa_217c968c,train,53228,MSA,هل من الممكن ان تصدر مديرة مدرسة قرار ادارى بمنعى من دخول المدرسة عن طريق الفراشين و رفع اسمى من كشوف المرتبات و الحضور و الانصراف و ان تقوم بفتح الغرفه الخاصه بى فى عدم وجودى و القاء جميع متعلقاتى و ادواتى و كتبى فى عدم وجودى او ابلغى حتى او عمل جرد و تحديد,هل من الممكن ان تصدر مديره مدرسه قرار اداري بمنعي من دخول المدرسه عن طريق الفراشين و رفع اسمي من كشوف المرتبات و الحضور و الانصراف و ان تقوم بفتح الغرفه الخاصه بي في عدم وجودي و القاء جميع متعلقاتي و ادواتي و كتبي في عدم وجودي او ابلغي حتي او عمل جرد و تحديد,,[],0,pending,,
mt_dial_egy_ec7250e2,train,42795,DIAL_EGY,يارتني كنت معاهم - يارتني كنت,يارتني كنت معاهم يارتني كنت,,[],0,pending,,
mt_dial_glf_09ebacdc,train,19364,DIAL_GLF,اما تعيين تكليف الحبلى يستاهل ثقة المسئو لين اما رئيس البلديه ما قدم شي والطريق الي يخترق الا سياح الي جا به,اما تعيين تكليف الحبلي يستاهل ثقه المسيو لين اما رييس البلديه ما قدم شي والطريق الي يخترق الا سياح الي جا به,,[],0,pending,,
mt_dial_lev_cec3d05e,train,14406,DIAL_LEV,وعلى قولة الأخ زيد الربابعه بدل ما تنامو يوم السبت مرة نامو,وعلي قوله الاخ زيد الربابعه بدل ما تنامو يوم السبت مره نامو,,[],0,pending,,
mt_msa_0ea2480f,train,49607,MSA,والله نظام ناجح 100 % نحن شعب متخلف جدا,والله نظام ناجح 100 نحن شعب متخلف جدا,,[],0,pending,,
mt_dial_egy_d383260a,train,32136,DIAL_EGY,ياشيخة حرام عليكى انتى طلعتلنا من اى مصيبة خنقتينا وخنقتى اهالينا,ياشيخه حرام عليكي انتي طلعتلنا من اي مصيبه خنقتينا وخنقتي اهالينا,,[],0,pending,,
mt_dial_glf_191be406,train,22144,DIAL_GLF,بقول شي بس الفضاء مفتوح ولله,بقول شي بس الفضاء مفتوح ولله,,[],0,pending,,
mt_dial_lev_8dbc9171,train,21234,DIAL_LEV,والله نفسي الكل يوصل لمرحلة النضج العقلي بكل شي . . بالتعامل وبالزواج وبالتعليم وحتى لما نشاهد مسلسل لازم نكون ناضجين وعاقلين ونضبط مشاعرنا بعقلانية .,والله نفسي الكل يوصل لمرحله النضج العقلي بكل شي بالتعامل وبالزواج وبالتعليم وحتي لما نشاهد مسلسل لازم نكون ناضجين وعاقلين ونضبط مشاعرنا بعقلانيه,,[],0,pending,,
mt_msa_b07f3a1a,train,55291,MSA,انا مع البرادعى فى كل,انا مع البرادعي في كل,,[],0,pending,,
mt_dial_egy_6c0094bf,train,36020,DIAL_EGY,طول مافي رائس الافعا والوزرة وامسال عز وامسال سرور ويوسف والشريف وكم من مجلس الشعب والدخلية الفاسده عمر مصر ماتعمر انتم بنادو في بلده موتا وهم صحيين ولا فائده فيما تقولو للناس اناس مش لافيه الاكل بسبب الفساد ناس معها ملاين ومليارات وناس مش لقيه المليم وبتاكل في اطين عشان الحرميه تعيش اكبر شعب واقدم شعب في العالم مش عارف يعيش بسبب الحزب الفاسد واعوانو شعب مصر مات منزمن بعيد والان كتر الفساد والخراب والدمار والعار والعار والعار والدعاره الله لايبارك في اللي كان اسبب من حاكم ومن وزير ومن مدير ومن غفير تاسببف في دمار اكبروقدم شعب في العالم,طول مافي رايس الافعا والوزره وامسال عز وامسال سرور ويوسف والشريف وكم من مجلس الشعب والدخليه الفاسده عمر مصر ماتعمر انتم بنادو في بلده موتا وهم صحيين ولا فايده فيما تقولو للناس اناس مش لافيه الاكل بسبب الفساد ناس معها ملاين ومليارات وناس مش لقيه المليم وبتاكل في اطين عشان الحرميه تعيش اكبر شعب واقدم شعب في العالم مش عارف يعيش بسبب الحزب الفاسد واعوانو شعب مصر مات منزمن بعيد والان كتر الفساد والخراب والدمار والعار والعار والعار والدعاره الله لايبارك في اللي كان اسبب من حاكم ومن وزير ومن مدير ومن غفير تاسببف في دمار اكبروقدم شعب في العالم,,[],0,pending,,
mt_dial_glf_bec89614,train,51732,DIAL_GLF,عما تصاب به الانسانيه في آخر الزمان .,عما تصاب به الانسانيه في اخر الزمان,,[],0,pending,,
mt_dial_lev_841e96a7,train,59495,DIAL_LEV,يا جماعة الخير ديرو بالكم و الله القيادة على الخط السريع خطيرة يا رب إرحمهم برحمتك و صبر أهل الفقيدين و ألهمهم الصبر و السلوان . .,يا جماعه الخير ديرو بالكم و الله القياده علي الخط السريع خطيره يا رب ارحمهم برحمتك و صبر اهل الفقيدين و الهمهم الصبر و السلوان,,[],0,pending,,
mt_msa_c5171c0c,train,85567,MSA,"استوقفتني تلك العبارة "" ان نستبدل الركيك بالاكفأ "" . . فما هو معيار الكفاءة هنا",استوقفتني تلك العباره ان نستبدل الركيك بالاكفا فما هو معيار الكفاءه هنا,,[],0,pending,,
mt_dial_egy_7378e82a,train,39063,DIAL_EGY,واو حيكون يوم عيدانشاء الله وكلنا معاكم يا,واو حيكون يوم عيدانشاء الله وكلنا معاكم يا,,[],0,pending,,
mt_dial_glf_cbd04d7d,train,25361,DIAL_GLF,وابشركم ترى مغسلة الملابس صار فيها توصيل طلبات ومو بعيده تلقى ملزقين استيكر على باب,وابشركم تري مغسله الملابس صار فيها توصيل طلبات ومو بعيده تلقي ملزقين استيكر علي باب,,[],0,pending,,
mt_dial_lev_331af49d,train,39784,DIAL_LEV,طيب نزل 17 % ليش الحكومه العتيده الحريصه على مصالح الشعب الغلبان ما خفضت الى الان اسعار المحروقات ؟ ؟ ؟ ! ! ! والله احنا بندعي على كل انسان يسبب معانا للمواطن فحذري يا حكومه من دعاء المظلومين وخفضي,طيب نزل 17 ليش الحكومه العتيده الحريصه علي مصالح الشعب الغلبان ما خفضت الي الان اسعار المحروقات والله احنا بندعي علي كل انسان يسبب معانا للمواطن فحذري يا حكومه من دعاء المظلومين وخفضي,,[],0,pending,,
mt_msa_c98720c1,train,56827,MSA,طاش يحتاج للرجوع للقصص الواقعية لكشف الحقيقةعن معانات المواطن وطرق حلها وايصالها مرئية للمسئولين في الدولة,طاش يحتاج للرجوع للقصص الواقعيه لكشف الحقيقهعن معانات المواطن وطرق حلها وايصالها مرييه للمسيولين في الدوله,,[],0,pending,,
mt_dial_egy_446a0bdf,train,28165,DIAL_EGY,دى حقيقة ستيف جوبز من أم أمريكية وأب مصرى ومن الصعيد كمان يعنى جينات الفراعنة جواه متأصلة ، يمكنكم التأكد عن طريق جوجل وقراءة تاريخ هذا الرجل ، منتهى السخرية أن المصريين الأصليين لا يستطيعون عمل لمبة كهربائية مش جهاز كومبيوتر رغم امكاناتعم العقلية الهائلة ، ربنا ياخد اللى خلوا مصر والمصريين على هذا,دي حقيقه ستيف جوبز من ام امريكيه واب مصري ومن الصعيد كمان يعني جينات الفراعنه جواه متاصله يمكنكم التاكد عن طريق جوجل وقراءه تاريخ هذا الرجل منتهي السخريه ان المصريين الاصليين لا يستطيعون عمل لمبه كهرباييه مش جهاز كومبيوتر رغم امكاناتعم العقليه الهايله ربنا ياخد اللي خلوا مصر والمصريين علي هذا,,[],0,pending,,
mt_dial_glf_a797b616,train,5405,DIAL_GLF,ترا ما طاح من النجوم أخف,ترا ما طاح من النجوم اخف,,[],0,pending,,
mt_dial_lev_45f4ebd0,train,55585,DIAL_LEV,احلى تحيه للسامبا واحلى تحيه للاعبي المنتخب البرازيلي الممتع حقيقه هذه المنتخبات اللي تفرحك وتبسطك بصراحه مستوى عالي تكتيك عالي فنيات واضحه انتشار جيد وحصول على نتائج,احلي تحيه للسامبا واحلي تحيه للاعبي المنتخب البرازيلي الممتع حقيقه هذه المنتخبات اللي تفرحك وتبسطك بصراحه مستوي عالي تكتيك عالي فنيات واضحه انتشار جيد وحصول علي نتايج,,[],0,pending,,
mt_msa_5138970e,train,17474,MSA,- انت اردتي نقد ممارسة ام فكرة ؟ ؟ ؟ !,انت اردتي نقد ممارسه ام فكره,,[],0,pending,,
mt_dial_egy_1e9469a8,train,68760,DIAL_EGY,والله انا شايف الموضوع من زاويه تانيه ان الاهلي اخد بطولات من غير الحضري يعني عدم وجوده ماكانش له التاثير الكبير يعني . اما ثانيا عندنا اتنين حراس حالا والله خامه كويسه جدا بس عايزين الصبر شويه والمباريات الكتير مش اكتر والله ما انتوا طبعا فاكرين الحضري بقي حضري بعد كام سنه لعب وغلطات قاتله صح ولا,والله انا شايف الموضوع من زاويه تانيه ان الاهلي اخد بطولات من غير الحضري يعني عدم وجوده ماكانش له التاثير الكبير يعني اما ثانيا عندنا اتنين حراس حالا والله خامه كويسه جدا بس عايزين الصبر شويه والمباريات الكتير مش اكتر والله ما انتوا طبعا فاكرين الحضري بقي حضري بعد كام سنه لعب وغلطات قاتله صح ولا,,[],0,pending,,
mt_dial_glf_7b1e5d02,train,82329,DIAL_GLF,ايوالله هذا الحال وحسبي الله على الازواج اللي تسذا .,ايوالله هذا الحال وحسبي الله علي الازواج اللي تسذا,,[],0,pending,,
mt_dial_lev_654c7eb3,train,58001,DIAL_LEV,والله الفيصلي بيشتغل صح ومدير الفريق كمان زلمه فهمان وعارف الامور الصحيحه والفيصلي السنه راح يعمل اشي والله اني حاسس مع تعاقدات الي عملها مع المهاجم والمدافع الروماني وكمان قاعد بيعزز الفريق بلعيبه مهارين ومدرب لياقه خاص بلفريق . . . وبخصوص خالد سعد الله يوفقو وين ما راح مع اني حابب يرجع للفيلي وكمان قصي ايو عاليه يا ريت يرجع للفيصلي بس قصي موقع على عقد 3 سنين ولسا ما انتهى العقد . وبتمنى انو الفيصلي مايقصر مع,والله الفيصلي بيشتغل صح ومدير الفريق كمان زلمه فهمان وعارف الامور الصحيحه والفيصلي السنه راح يعمل اشي والله اني حاسس مع تعاقدات الي عملها مع المهاجم والمدافع الروماني وكمان قاعد بيعزز الفريق بلعيبه مهارين ومدرب لياقه خاص بلفريق وبخصوص خالد سعد الله يوفقو وين ما راح مع اني حابب يرجع للفيلي وكمان قصي ايو عاليه يا ريت يرجع للفيصلي بس قصي موقع علي عقد 3 سنين ولسا ما انتهي العقد وبتمني انو الفيصلي مايقصر مع,,[],0,pending,,
mt_msa_19234603,train,35452,MSA,أما المؤسسات الفردية ما كانت تُصدر لهم بطاقات صراف .,اما الموسسات الفرديه ما كانت تصدر لهم بطاقات صراف,,[],0,pending,,
mt_dial_egy_5904c312,train,61128,DIAL_EGY,مبروك البراءة ، بس براءة من ايه ! !,مبروك البراءه بس براءه من ايه,,[],0,pending,,
mt_dial_glf_5b834e20,train,76026,DIAL_GLF,كفو ابن همام رجل عربي اصيل مجتهد ربي يوفقه ونجح بمجهودة ودعم دولة لة واتمنى لة التوفيق في اسياء وفي,كفو ابن همام رجل عربي اصيل مجتهد ربي يوفقه ونجح بمجهوده ودعم دوله له واتمني له التوفيق في اسياء وفي,,[],0,pending,,
mt_dial_lev_15524340,train,34705,DIAL_LEV,كنا نتوقع كما كتب احد المعلقين ان تبادر الامانة الى تقديم الشكر والامتنان لشركة المميز على خطوتها بتخفيض الاجرة بدلا من العنطزة الفارغة التي ان دلت على شيء انما تدل على ابتعاد الامانة عن مبداء الامانة في اعتراضها على خطوة التكسي المميز,كنا نتوقع كما كتب احد المعلقين ان تبادر الامانه الي تقديم الشكر والامتنان لشركه المميز علي خطوتها بتخفيض الاجره بدلا من العنطزه الفارغه التي ان دلت علي شيء انما تدل علي ابتعاد الامانه عن مبداء الامانه في اعتراضها علي خطوه التكسي المميز,,[],0,pending,,
mt_msa_3f277aaa,train,64173,MSA,دولة عبدالرؤوف من اصدق واشرف واخلص الرجال التي عرفتهم الاردن على مر التاريخ,دوله عبدالرووف من اصدق واشرف واخلص الرجال التي عرفتهم الاردن علي مر التاريخ,,[],0,pending,,
mt_dial_egy_5b3bf1da,train,25916,DIAL_EGY,أولاً هل نريد أن نتخلص من شلة فاسدة إلي شلة,اولا هل نريد ان نتخلص من شله فاسده الي شله,,[],0,pending,,
mt_dial_glf_186ee3de,train,46703,DIAL_GLF,الحين كل هذي غزلان ؟ ؟ ؟ كم غزال مع بعض ؟ ؟ اعوذ بالله من غضب الله !,الحين كل هذي غزلان كم غزال مع بعض اعوذ بالله من غضب الله,,[],0,pending,,
mt_dial_lev_ce19a940,train,86393,DIAL_LEV,كنت بفضل انو اسعار المحروقات البنزين بالتحديد تكون مرتفعه . لانو صار نسبه كبيره من السائقين اولاد وشباب صغار ما دون 20 سنه,كنت بفضل انو اسعار المحروقات البنزين بالتحديد تكون مرتفعه لانو صار نسبه كبيره من السايقين اولاد وشباب صغار ما دون 20 سنه,,[],0,pending,,
mt_msa_61cada4b,train,34590,MSA,ج / إذا صرنا مثل الاماراتيين أو,ج اذا صرنا مثل الاماراتيين او,,[],0,pending,,
mt_dial_egy_7a432a55,train,39067,DIAL_EGY,ياريت تقولوا للناس نوع الخلاف الشخصي اللي بين ابراهيم ورامي,ياريت تقولوا للناس نوع الخلاف الشخصي اللي بين ابراهيم ورامي,,[],0,pending,,
mt_dial_glf_0f0efb23,train,34889,DIAL_GLF,يا رجال عساكم سالمين ؟ ؟ اذا ما تشعر في حجم المعانات لا يمكن تجد حل لها ؟ ؟ بس تنظير ؟,يا رجال عساكم سالمين اذا ما تشعر في حجم المعانات لا يمكن تجد حل لها بس تنظير,,[],0,pending,,
mt_dial_lev_11e5362b,train,27772,DIAL_LEV,با ترى لو كان هذا المواطن له عشيرة اوقبيلة تحمية هل سيتعاملون معه بهذه,با تري لو كان هذا المواطن له عشيره اوقبيله تحميه هل سيتعاملون معه بهذه,,[],0,pending,,
mt_msa_a0b5b240,train,53756,MSA,لم نقرأ او نسمع مطلقا ، عن منظمة تمويل تغييرات الدستور ، لو مؤسسة تمويل التعديلات الدستورية العالمية ، فما هى الجهة التى ترعى و تتبنى و تمول تكلفة التعديلات الدستورية المصرية ؟ و تتبع من ؟ و لاى هدف ؟ و ما صفتها الرسمية ؟ لابد ان هناك جهة ما ، تدفع تكاليف قنوات و مراكز و مكاتب ، ما هى هذه الجهة او المنظمة او المؤسسة ؟ و لماذا تدعم التعديلات المصرية ؟ هل هى امريكا ؟ ما مصلحتها ؟ هل هى ايران ؟ ما صفتها ؟ هل هى قطر ؟ لاجل ماذا,لم نقرا او نسمع مطلقا عن منظمه تمويل تغييرات الدستور لو موسسه تمويل التعديلات الدستوريه العالميه فما هي الجهه التي ترعي و تتبني و تمول تكلفه التعديلات الدستوريه المصريه و تتبع من و لاي هدف و ما صفتها الرسميه لابد ان هناك جهه ما تدفع تكاليف قنوات و مراكز و مكاتب ما هي هذه الجهه او المنظمه او الموسسه و لماذا تدعم التعديلات المصريه هل هي امريكا ما مصلحتها هل هي ايران ما صفتها هل هي قطر لاجل ماذا,,[],0,pending,,
mt_dial_egy_d78dddef,train,9004,DIAL_EGY,رامي رامي اوعى يجيلك رامي . . . وتغطى وانت,رامي رامي اوعي يجيلك رامي وتغطي وانت,,[],0,pending,,
mt_dial_glf_baf7eceb,train,23041,DIAL_GLF,من جد هاذي بشر من دم ولحم [ أشك انه ما تحس,من جد هاذي بشر من دم ولحم اشك انه ما تحس,,[],0,pending,,
mt_dial_lev_f8d9afa6,train,6454,DIAL_LEV,ارفعوا كل البطاقات خلي الحبيبة تبطل وترجع الناس,ارفعوا كل البطاقات خلي الحبيبه تبطل وترجع الناس,,[],0,pending,,
mt_msa_de44da49,train,16034,MSA,فليس بجديد إطلاق مثل هذه الخدمة من صحيفتنا المبدعة والمتصدرة قائمة الصحف في بلادنا .,فليس بجديد اطلاق مثل هذه الخدمه من صحيفتنا المبدعه والمتصدره قايمه الصحف في بلادنا,,[],0,pending,,
