example_id,source_split,source_row_id,dialect,original_text,normalized_text,masked_text,mask_spans_json,mask_count,annotation_status,annotator_model,notes
mt_dial_lev_7ea5f249,train,69651,DIAL_LEV,احلى جزيرة واحلى ابو عابد وأن شاء االلة بترجع مجد,احلي جزيره واحلي ابو عابد وان شاء االله بترجع مجد,,[],0,pending,,
mt_msa_6152d55f,train,54171,MSA,الحب الحقيقي هو الذي يكبر مع الأيام وتجربة,الحب الحقيقي هو الذي يكبر مع الايام وتجربه,,[],0,pending,,
mt_dial_egy_2d40b8be,train,6394,DIAL_EGY,يا جماعة الخير انا نفسى اسال سؤال واحد بس انتم ليه شغلين نفسكم فى موضوع الرياسة كدة ليه كل واحد بياخد نصيبة فى الدنيا واللى بيظلم فيها هيتحاسب والمظلوم ربنا هايعوض علية فى الاخرة وارجو ان لا ننسى الايه الكريمة التى تقول وان اجتمع القوم على ان يضروك بشيئ فلن يضروك الا بما كتب الله لك وان اجتمعو على ان يفيدوك بشيئ فلن يفيدوك الا بما كتب الله لك خليها على ربنا واللى بيقول يارب وبصدق وخشوع عمر ربنا ما بيرد,يا جماعه الخير انا نفسي اسال سوال واحد بس انتم ليه شغلين نفسكم في موضوع الرياسه كده ليه كل واحد بياخد نصيبه في الدنيا واللي بيظلم فيها هيتحاسب والمظلوم ربنا هايعوض عليه في الاخره وارجو ان لا ننسي الايه الكريمه التي تقول وان اجتمع القوم علي ان يضروك بشيي فلن يضروك الا بما كتب الله لك وان اجتمعو علي ان يفيدوك بشيي فلن يفيدوك الا بما كتب الله لك خليها علي ربنا واللي بيقول يارب وبصدق وخشوع عمر ربنا ما بيرد,,[],0,pending,,
mt_dial_glf_4ea04c37,train,45668,DIAL_GLF,والعيب ليس في اللجنة العيب على اللي ساكت عنها ويصفق,والعيب ليس في اللجنه العيب علي اللي ساكت عنها ويصفق,,[],0,pending,,
mt_dial_lev_3135b76f,train,14168,DIAL_LEV,1 ) الرايح جاي وخذني جيتك : الزعيم فاز على الوحدات بخذني جيتك 7 مواسم ( 76 و 85 و 89 و 93 و 2003 و 2006 و 2007 بكأس الاتحاد الآسيوي والموسم الماضي في 12 يوم أخذ الزعيم شقيقه الوحدات وهو في أفضل مواسمه والزعيم في أسوأها وغيابات بالجملة رايح جاي مرتين 1 - 0 و 1 - 0 في حين فاز الوحدات فقط 4 مرات رايح,1 الرايح جاي وخذني جيتك الزعيم فاز علي الوحدات بخذني جيتك 7 مواسم 76 و 85 و 89 و 93 و 2003 و 2006 و 2007 بكاس الاتحاد الاسيوي والموسم الماضي في 12 يوم اخذ الزعيم شقيقه الوحدات وهو في افضل مواسمه والزعيم في اسواها وغيابات بالجمله رايح جاي مرتين 1 0 و 1 0 في حين فاز الوحدات فقط 4 مرات رايح,,[],0,pending,,
mt_msa_718e6fb8,train,36278,MSA,في البداية لن اقول اسمي حتى لا اتهم,في البدايه لن اقول اسمي حتي لا اتهم,,[],0,pending,,
mt_dial_egy_51dde6d9,train,47639,DIAL_EGY,ليه حكام اجانب بين المحله والجونه هيا مصر خلاص معدشى فيها حكام نظاف ولا ايه عجبت لك,ليه حكام اجانب بين المحله والجونه هيا مصر خلاص معدشي فيها حكام نظاف ولا ايه عجبت لك,,[],0,pending,,
mt_dial_glf_dbcdaa91,train,1011,DIAL_GLF,رجع غالي وسهلاوي وباسكال ودوخي,رجع غالي وسهلاوي وباسكال ودوخي,,[],0,pending,,
mt_dial_lev_87fd5ef7,train,17769,DIAL_LEV,ما حدى بعرف الحقيقة ! ! ! اللي بعرف بعرف واللي ما بعرف الى يعرف . . . الله يرحمك يا يوسف ! !,ما حدي بعرف الحقيقه اللي بعرف بعرف واللي ما بعرف الي يعرف الله يرحمك يا يوسف,,[],0,pending,,
mt_msa_6d67ab32,train,46818,MSA,العبيد هم عبيد القهر يتلذذون بالثروات الحرام ويقهرون من يحكمونهم,العبيد هم عبيد القهر يتلذذون بالثروات الحرام ويقهرون من يحكمونهم,,[],0,pending,,
mt_dial_egy_e75f7f3f,train,57199,DIAL_EGY,بس عجبتنى كلمتك لما قولت عن البرادعي انه مثل مدرب,بس عجبتني كلمتك لما قولت عن البرادعي انه مثل مدرب,,[],0,pending,,
mt_dial_glf_468a20fe,train,78122,DIAL_GLF,اما الجني الاجني فله حق كبير علينا وعيب يتمرمط بين الجهات الحكومية يحول لهيئة الاستثمار مهما كانت تجارته وياخذ الرخصة وهو يشرب الشاي حتى لويبيع,اما الجني الاجني فله حق كبير علينا وعيب يتمرمط بين الجهات الحكوميه يحول لهييه الاستثمار مهما كانت تجارته وياخذ الرخصه وهو يشرب الشاي حتي لويبيع,,[],0,pending,,
mt_dial_lev_4ac3c4ab,train,7201,DIAL_LEV,المارد الاخضر ولعها امس اضاع ( 15 ) هدفا ولدغ المرمى الرمثاوي بقرصه مميته في وقت قاتل من,المارد الاخضر ولعها امس اضاع 15 هدفا ولدغ المرمي الرمثاوي بقرصه مميته في وقت قاتل من,,[],0,pending,,
mt_msa_3a05aa4a,train,82133,MSA,السياحة سوق ، غذا كانت البضاعة منافسة ومتنوعة فلا يحتاج الناس إلى دعاية ، أي إنها نشاط اقتصادي - كما تعرف وتُسوّق,السياحه سوق غذا كانت البضاعه منافسه ومتنوعه فلا يحتاج الناس الي دعايه اي انها نشاط اقتصادي كما تعرف وتسوق,,[],0,pending,,
mt_dial_egy_07222e9c,train,38852,DIAL_EGY,ياريت كل واحد يعلق يكون بيفهم فى البنوك اولا ثانيا كل البهوات اللى هربوا هيرجعوا الان ليه لن سياسة الحكومة الان انهم يرجعوا ويسددوا الديون اللى عليهم طيب منين,ياريت كل واحد يعلق يكون بيفهم في البنوك اولا ثانيا كل البهوات اللي هربوا هيرجعوا الان ليه لن سياسه الحكومه الان انهم يرجعوا ويسددوا الديون اللي عليهم طيب منين,,[],0,pending,,
mt_dial_glf_2dd7dbee,train,48180,DIAL_GLF,ما قصر أبو محمد و عبد الله الحميدي,ما قصر ابو محمد و عبد الله الحميدي,,[],0,pending,,
mt_dial_lev_b0e90505,train,83092,DIAL_LEV,الدنيا صارت بلا طعم وعم نسمع اخبار اشي بخزي واشي بحزن واشي ببكي واشي بقرف وبين كل مليون خبر شنيع بنسمع خبر,الدنيا صارت بلا طعم وعم نسمع اخبار اشي بخزي واشي بحزن واشي ببكي واشي بقرف وبين كل مليون خبر شنيع بنسمع خبر,,[],0,pending,,
mt_msa_1b86ef60,train,44946,MSA,افدت واجدت وفقك الله وحفظك يا شيخنا ابن منيع وصحيح اننا لم نتتلمذ على يديك ولكنا تلاميذ بين يدي فتاواك وعلمك ونصيحتي لمن لا يعلم الا يتحدث في امور الدين والشرع حتى يعلم بالكتاب والسنة والصحيح والضعيف والناسخ والمنسوخ وفق الله الجميع لما يحبه ويرضاه,افدت واجدت وفقك الله وحفظك يا شيخنا ابن منيع وصحيح اننا لم نتتلمذ علي يديك ولكنا تلاميذ بين يدي فتاواك وعلمك ونصيحتي لمن لا يعلم الا يتحدث في امور الدين والشرع حتي يعلم بالكتاب والسنه والصحيح والضعيف والناسخ والمنسوخ وفق الله الجميع لما يحبه ويرضاه,,[],0,pending,,
mt_dial_egy_75fa2c68,train,56941,DIAL_EGY,ولا هو كمان مستني قرار رئيس الجمهورية في إستقالته . . زي شيخ,ولا هو كمان مستني قرار رييس الجمهوريه في استقالته زي شيخ,,[],0,pending,,
mt_dial_glf_e793533a,train,60761,DIAL_GLF,لاتخافون يا جريده الرياض كل يوم يبي يجيكم اخبار مثل هذي واردى والسبب العطآله وقل الاهتمام بالشباب .,لاتخافون يا جريده الرياض كل يوم يبي يجيكم اخبار مثل هذي واردي والسبب العطاله وقل الاهتمام بالشباب,,[],0,pending,,
mt_dial_lev_dc09db69,train,33774,DIAL_LEV,اذا كانت الحياة جميلة فالمارد الاخضر اجمل مافيها الوحدات على الراس بينحط مهما صار معة بضل وحدات وخلي جمهور الفيصلي يفرحوا اشوي من خمس سنين مافرحوا حرام خليهم يفرحوا,اذا كانت الحياه جميله فالمارد الاخضر اجمل مافيها الوحدات علي الراس بينحط مهما صار معه بضل وحدات وخلي جمهور الفيصلي يفرحوا اشوي من خمس سنين مافرحوا حرام خليهم يفرحوا,,[],0,pending,,
mt_msa_4e1e0b10,train,42300,MSA,الله فوق الكل ومن توكل على الله حق توكله لرزقه كما يرزق,الله فوق الكل ومن توكل علي الله حق توكله لرزقه كما يرزق,,[],0,pending,,
mt_dial_egy_aa08ee75,train,53927,DIAL_EGY,من صُغر سنّي ونا ع الحرب,من صغر سني ونا ع الحرب,,[],0,pending,,
mt_dial_glf_c090e41d,train,84740,DIAL_GLF,حسام غالي الشي الايجابي فيه عاجبني انه حماسي بحت . . وان شاء الله العالمي,حسام غالي الشي الايجابي فيه عاجبني انه حماسي بحت وان شاء الله العالمي,,[],0,pending,,
mt_dial_lev_baf26b39,train,18376,DIAL_LEV,صوتكم ما وصل ولا راح يوصل حكومتنا طفرانه فا انا بقول نلم تبرعات عشان بسهرو و . . . و . .,صوتكم ما وصل ولا راح يوصل حكومتنا طفرانه فا انا بقول نلم تبرعات عشان بسهرو و و,,[],0,pending,,
mt_msa_bbf125b3,train,28228,MSA,والدوري الاسباني بطريقه الى مدريد .,والدوري الاسباني بطريقه الي مدريد,,[],0,pending,,
mt_dial_egy_454064aa,train,52546,DIAL_EGY,"ما تفهموش ان هيا دخلت دين النصرانية لأنها معتقدة بيها لأن مفيش حد يعتقد بالخرافات "" وقال الله تعالى ( لقد كفر الذين قالوا إن الله ثالث ثلاثة "" ) والمشكلة انها عشقت الشخص ده فى الحرام ولأن مفيش حد من المسلمين هيعمل حاجه محرمة الا لو كان عاصى فالقضية مش اسلام ونصرانية ده قضية عشق وغرام . .",ما تفهموش ان هيا دخلت دين النصرانيه لانها معتقده بيها لان مفيش حد يعتقد بالخرافات وقال الله تعالي لقد كفر الذين قالوا ان الله ثالث ثلاثه والمشكله انها عشقت الشخص ده في الحرام ولان مفيش حد من المسلمين هيعمل حاجه محرمه الا لو كان عاصي فالقضيه مش اسلام ونصرانيه ده قضيه عشق وغرام,,[],0,pending,,
mt_dial_glf_e9336687,train,115,DIAL_GLF,من زمان سمعنا عن المشروع لكن ماشفنا شي يعني اليوم بسنه ودمتم سالمين . . . ! !,من زمان سمعنا عن المشروع لكن ماشفنا شي يعني اليوم بسنه ودمتم سالمين,,[],0,pending,,
mt_dial_lev_90186e1f,train,9845,DIAL_LEV,بس ما عرفنا شو اخبار مدينة الحجاج التي اطلقت الوعود بانشائها احد محاور المنطقة التنموية منذ سنوات والى الان لم ترى النور . نريد افعال وشياء ملموسة لامخططات ومجسمات وفرضيات دون ان نلمس ونرى شيء على ارض,بس ما عرفنا شو اخبار مدينه الحجاج التي اطلقت الوعود بانشايها احد محاور المنطقه التنمويه منذ سنوات والي الان لم تري النور نريد افعال وشياء ملموسه لامخططات ومجسمات وفرضيات دون ان نلمس ونري شيء علي ارض,,[],0,pending,,
mt_msa_cf238088,train,30034,MSA,وحظ الوحدات انه يقع في البطولات العربيه في مجموعات ناريه وفرق محترفه تغط باللاعبيين البرازليين والمهره,وحظ الوحدات انه يقع في البطولات العربيه في مجموعات ناريه وفرق محترفه تغط باللاعبيين البرازليين والمهره,,[],0,pending,,
mt_dial_egy_abfcec0f,train,82008,DIAL_EGY,الله لا يوردكوا على جنة ابدا بحق المهازل التي,الله لا يوردكوا علي جنه ابدا بحق المهازل التي,,[],0,pending,,
mt_dial_glf_9d77e4f9,train,77030,DIAL_GLF,عموما أهم قرار عند شراء منزل بالتمويل هو مدى مشروعية المعاملة وخلوها من الربا بعدها يتم اخذ عناصر التكاليف في,عموما اهم قرار عند شراء منزل بالتمويل هو مدي مشروعيه المعامله وخلوها من الربا بعدها يتم اخذ عناصر التكاليف في,,[],0,pending,,
mt_dial_lev_dc122f72,train,52503,DIAL_LEV,الله يرحمها ويصبر اهلها . . القصة من بدايتها عجيبة يعني لو انه الطبيب درس فن او اي مجال بعيد عن الطب كان عرف انه الاعراض اعراض تسمم اواقلها حاول يعمل فحوصات للطفلة المسكينة التي ضلت تعاني طوال هالمدة ورايحه جايه ع المستشفى .,الله يرحمها ويصبر اهلها القصه من بدايتها عجيبه يعني لو انه الطبيب درس فن او اي مجال بعيد عن الطب كان عرف انه الاعراض اعراض تسمم اواقلها حاول يعمل فحوصات للطفله المسكينه التي ضلت تعاني طوال هالمده ورايحه جايه ع المستشفي,,[],0,pending,,
mt_msa_78e5bd90,train,11701,MSA,الى ادارتنا الحبيبه ادعوكم الى الاهتمام بالنادي واللاعبيين في هذه الفتره,الي ادارتنا الحبيبه ادعوكم الي الاهتمام بالنادي واللاعبيين في هذه الفتره,,[],0,pending,,
mt_dial_egy_becc71c4,train,81771,DIAL_EGY,ايه دخل الجيش وسينا في مبارة في الدوري الاوربي يا عالم يا تيت ، فرحانين قوي وانتوا بتشتموا في بعض جاتكوا ستين نيلة انت,ايه دخل الجيش وسينا في مباره في الدوري الاوربي يا عالم يا تيت فرحانين قوي وانتوا بتشتموا في بعض جاتكوا ستين نيله انت,,[],0,pending,,
mt_dial_glf_ed5e210c,train,57908,DIAL_GLF,انا الصراحه اعجبتني حملة مقاطة من البنات للبائع الرجل اللي يبيع ملابس داخلية او ماشابه للنساء,انا الصراحه اعجبتني حمله مقاطه من البنات للبايع الرجل اللي يبيع ملابس داخليه او ماشابه للنساء,,[],0,pending,,
mt_dial_lev_8e772318,train,10776,DIAL_LEV,عمو سمور عدنان حمد وقع زمان بس الكادر الي معو ما,عمو سمور عدنان حمد وقع زمان بس الكادر الي معو ما,,[],0,pending,,
mt_msa_4824469e,train,73302,MSA,قال الله سبحانه : وَلاَ تَأْكُلُواْ أَمْوَالَكُم بَيْنَكُم بِالْبَاطِلِ وَتُدْلُواْ بِهَا إِلَى الْحُكَّامِ لِتَأْكُلُواْ فَرِيقًا مِّنْ أَمْوَالِ النَّاسِ بِالإِثْمِ وَأَنتُمْ تَعْلَمُونَ [ البقرة : 188,قال الله سبحانه ولا تاكلوا اموالكم بينكم بالباطل وتدلوا بها الي الحكام لتاكلوا فريقا من اموال الناس بالاثم وانتم تعلمون البقره 188,,[],0,pending,,
mt_dial_egy_6bfeb103,train,17919,DIAL_EGY,طب المره دى الموضوع اتكتب فى الصحافه والناس عرفت ده فى ألاف المرات الناس بتدخل وبتخرج و بيجمعوا المعلومات الى هما عاوزينهم ولا حد بيكلمهم أصل دى بلدهم مش,طب المره دي الموضوع اتكتب في الصحافه والناس عرفت ده في الاف المرات الناس بتدخل وبتخرج و بيجمعوا المعلومات الي هما عاوزينهم ولا حد بيكلمهم اصل دي بلدهم مش,,[],0,pending,,
mt_dial_glf_300d6353,train,74396,DIAL_GLF,ومعقوله موديل 2003 وللحين ماحسو بالمشكله وهى,ومعقوله موديل 2003 وللحين ماحسو بالمشكله وهي,,[],0,pending,,
mt_dial_lev_e58e1687,train,40482,DIAL_LEV,صدق بندلي لما غنا في بداية الثمانيات . . . راحت ايام عبي فول هلا تنكة . . . ساق الله على ايام الكروزات هلا شفطا . . . راحت ايام المعاليق هلا فرمة . . . وهذا حالنا نحن الاردنين نازلين فينا رفع اسعار هو ويلنا من البنزين ولا الاكل . . . الملابس الفواتير . . . المعيشة الصعبة اصبحت حياتنا لاتطاق خاصة ذوي الدخل المحدود الرواتب العالية مش فارقة على . . . بس الله يكون في عونا وتسلم لنا الحكومة الرشيدة التي تهتم في المواطن الاردني الفقير وشكرا لموقع الغدالي بخلينا انفش غولنا ارجوا النشر .,صدق بندلي لما غنا في بدايه الثمانيات راحت ايام عبي فول هلا تنكه ساق الله علي ايام الكروزات هلا شفطا راحت ايام المعاليق هلا فرمه وهذا حالنا نحن الاردنين نازلين فينا رفع اسعار هو ويلنا من البنزين ولا الاكل الملابس الفواتير المعيشه الصعبه اصبحت حياتنا لاتطاق خاصه ذوي الدخل المحدود الرواتب العاليه مش فارقه علي بس الله يكون في عونا وتسلم لنا الحكومه الرشيده التي تهتم في المواطن الاردني الفقير وشكرا لموقع الغدالي بخلينا انفش غولنا ارجوا النشر,,[],0,pending,,
mt_msa_0fc5fcb7,train,86221,MSA,شخصياً أرى أنه لاداعي لنفخ الجمر فالهلال طرف في النهائي باذن الله فقط قليل من الحكمة,شخصيا اري انه لاداعي لنفخ الجمر فالهلال طرف في النهايي باذن الله فقط قليل من الحكمه,,[],0,pending,,
mt_dial_egy_009ac6de,train,13241,DIAL_EGY,واللة حرام شاب 19 سنة يسبوا جثتة فى,والله حرام شاب 19 سنه يسبوا جثته في,,[],0,pending,,
mt_dial_glf_dd14030a,train,74203,DIAL_GLF,يا حبيبي قبيلة واحدة في كينيا تعدادها حوالي عشرين مليون !,يا حبيبي قبيله واحده في كينيا تعدادها حوالي عشرين مليون,,[],0,pending,,
mt_dial_lev_aa3ef6a0,train,37354,DIAL_LEV,يا اخي انا بدي اعرف . . . هو ما في في كل المملكة حكام الا ابو لوم ودرويش واللوزي . . بتبدلو في كل مبارة . . . والثلاث ما شاء الله عليهم تحكيم ولا في زيو في,يا اخي انا بدي اعرف هو ما في في كل المملكه حكام الا ابو لوم ودرويش واللوزي بتبدلو في كل مباره والثلاث ما شاء الله عليهم تحكيم ولا في زيو في,,[],0,pending,,
mt_msa_2bc0344e,train,84396,MSA,* التشكيله المناسبه من اول المباره والتبديلات الموفقه وحسب المعطيات في,التشكيله المناسبه من اول المباره والتبديلات الموفقه وحسب المعطيات في,,[],0,pending,,
mt_dial_egy_34ff9a0c,train,72085,DIAL_EGY,انا شايف ان فيه ناس بتولع الدنيا و غالبا بتوع الجماعات اللى عدوهم الشرطة زى ما,انا شايف ان فيه ناس بتولع الدنيا و غالبا بتوع الجماعات اللي عدوهم الشرطه زي ما,,[],0,pending,,
mt_dial_glf_e236b191,train,58676,DIAL_GLF,الوعد الأحد السهلاوي ناوي هاترك ان شاء الله وريان بيسجل اثنين العالمي ناوي يتأهل,الوعد الاحد السهلاوي ناوي هاترك ان شاء الله وريان بيسجل اثنين العالمي ناوي يتاهل,,[],0,pending,,
mt_dial_lev_8d74c6c6,train,51830,DIAL_LEV,شو صار في المليار الاختلاس ؟ ؟,شو صار في المليار الاختلاس,,[],0,pending,,
mt_msa_5d6c78a8,train,26237,MSA,العربى انجح قياده وإنتاج . والمثل واضح فى العراق . وحجز,العربي انجح قياده وانتاج والمثل واضح في العراق وحجز,,[],0,pending,,
