example_id,source_split,source_row_id,dialect,original_text,normalized_text,masked_text,mask_spans_json,mask_count,annotation_status,annotator_model,notes
mt_msa_932f3127,train,50551,MSA,ان مجلس الشعب بصورته الحالية يمكن الطعن على كل القوانين اللتى يصدرها حيث أن ثلث أعضائه مدانون بالحصول بطريق غير مشروع على قرابة مليون جنيه شهريا تمثل تكاليف علاج أبناء دوائرهم وذلك لحسابهم الخاص وتم دفن الموضوع فى المجلس الموقر بالأنتقال الى جدول الأعمال كالعادة وان كان ذلك لا يسقط عنهم هذه التهم لذا يتم ابلاغ النائب العام لفتح هذا الملف ومن ثم الطعن على كل القرارات اللتى صدرت خلال ممارستهم للعضوية المشوبة بالفساد اللذى تم التغاضى عنه دون سند من قانون الا الأنتقال الى جدول الأعمال ونرجو بعد ذلك الأنتقال الى جدول الضرب فقد يكون أفضل لمصرنا,ان مجلس الشعب بصورته الحاليه يمكن الطعن علي كل القوانين اللتي يصدرها حيث ان ثلث اعضايه مدانون بالحصول بطريق غير مشروع علي قرابه مليون جنيه شهريا تمثل تكاليف علاج ابناء دوايرهم وذلك لحسابهم الخاص وتم دفن الموضوع في المجلس الموقر بالانتقال الي جدول الاعمال كالعاده وان كان ذلك لا يسقط عنهم هذه التهم لذا يتم ابلاغ النايب العام لفتح هذا الملف ومن ثم الطعن علي كل القرارات اللتي صدرت خلال ممارستهم للعضويه المشوبه بالفساد اللذي تم التغاضي عنه دون سند من قانون الا الانتقال الي جدول الاعمال ونرجو بعد ذلك الانتقال الي جدول الضرب فقد يكون افضل لمصرنا,,[],0,pending,,
mt_dial_egy_a1a93b42,train,10644,DIAL_EGY,خلاص هيا مظبطه نفسها مع اللى فوق . . . ام اللى,خلاص هيا مظبطه نفسها مع اللي فوق ام اللي,,[],0,pending,,
mt_dial_glf_bdf7896b,train,3256,DIAL_GLF,الشيخ حلل الاختلاط ليخفف العبء على رجال الهيئة لانهم تعبوا من كثرة الاختلاط في الاسواق وما لقوا حل الا يتركوا الاختلاط عن طريق اصدار فتوى من,الشيخ حلل الاختلاط ليخفف العبء علي رجال الهييه لانهم تعبوا من كثره الاختلاط في الاسواق وما لقوا حل الا يتركوا الاختلاط عن طريق اصدار فتوي من,,[],0,pending,,
mt_dial_lev_64b936e5,train,61699,DIAL_LEV,الحمد لله الي منتخب ها السلة رفع راسنا بين العالم و تستاهلوا منا كل الدعم و,الحمد لله الي منتخب ها السله رفع راسنا بين العالم و تستاهلوا منا كل الدعم و,,[],0,pending,,
mt_msa_bdebfff6,train,27169,MSA,"قدرة الحكومة على كبح جماح الغضب الشعبي لها حدود , وقد قارب الشعب على الانفجار",قدره الحكومه علي كبح جماح الغضب الشعبي لها حدود وقد قارب الشعب علي الانفجار,,[],0,pending,,
mt_dial_egy_9a5df121,train,80566,DIAL_EGY,1 / انتم شغلكم مع المجرمين والحرمية وتعرف انى السكرتير هو وكيل النيابة عندكم انتم ( شويش استيفاء ) بل شويش الاستيفاء احسن,1 انتم شغلكم مع المجرمين والحرميه وتعرف اني السكرتير هو وكيل النيابه عندكم انتم شويش استيفاء بل شويش الاستيفاء احسن,,[],0,pending,,
mt_dial_glf_9a49d262,train,42797,DIAL_GLF,اعوذبالله من هالعقلية و صدق صلى الله عليه وسلم عندما قال ( دعوها فإنها منتنة ) . .,اعوذبالله من هالعقليه و صدق صلي الله عليه وسلم عندما قال دعوها فانها منتنه,,[],0,pending,,
mt_dial_lev_6b337aff,train,15161,DIAL_LEV,ما يهمكو يا شركة الكهرباء الوطنيه الشعب بسد العجز ، ابشروا وزيدو التعرفه ، و انا بقترح اتزيدوا رسم التلفزيون كمان دينار او رسم النفايات ، اتدللو,ما يهمكو يا شركه الكهرباء الوطنيه الشعب بسد العجز ابشروا وزيدو التعرفه و انا بقترح اتزيدوا رسم التلفزيون كمان دينار او رسم النفايات اتدللو,,[],0,pending,,
mt_msa_06c0b4cd,train,15882,MSA,بينما في مرقس 1 : 6 أن ذلك كان بعد دعوة بطرس وأندراوس,بينما في مرقس 1 6 ان ذلك كان بعد دعوه بطرس واندراوس,,[],0,pending,,
mt_dial_egy_51ff0e4d,train,7881,DIAL_EGY,دلوقتى عامل راجل على الزمالك وواقف تهدد وتتوعد وماعملتش راجل ليه وجبت حق الزمال فى مباراة الحرس الشهيرة ولا حق أنبى فى مباراة الأهلى الفضيحة أتقى الله با زاهر وبلاش تسخر كل الأحداث لمصلحة الأهلى,دلوقتي عامل راجل علي الزمالك وواقف تهدد وتتوعد وماعملتش راجل ليه وجبت حق الزمال في مباراه الحرس الشهيره ولا حق انبي في مباراه الاهلي الفضيحه اتقي الله با زاهر وبلاش تسخر كل الاحداث لمصلحه الاهلي,,[],0,pending,,
mt_dial_glf_197e4138,train,69558,DIAL_GLF,أهلي مين ياعم تحلم انت ما تأهل إلا الهلال,اهلي مين ياعم تحلم انت ما تاهل الا الهلال,,[],0,pending,,
mt_dial_lev_c634d0fb,train,78007,DIAL_LEV,هارد لك للشباب والله ما قصرتوا . . . وكان بالامكان افضل . . . مش زي بعض الفرق بخسروا و بالاربعة من ديمبو الهندي . .,هارد لك للشباب والله ما قصرتوا وكان بالامكان افضل مش زي بعض الفرق بخسروا و بالاربعه من ديمبو الهندي,,[],0,pending,,
mt_msa_db3a391b,train,47688,MSA,ارجو من ادارة الزمالك عدم التعقود مع الاعب حسنى,ارجو من اداره الزمالك عدم التعقود مع الاعب حسني,,[],0,pending,,
mt_dial_egy_480b3416,train,58370,DIAL_EGY,وبعدين مهو مفيش مسيحين في منتخب مصر ومفيش مسيحيين في اماكن كتير ولا السياسة لازم يبقي فيها راجل وست ومسلم ومسيحي و عمال وفئات وكمان مفيش مسلمين في بعض الاماكن ولا كل حاجة لازم نعرض دي مجرد فكرة واحتمال حدوثها ضعيف جدا بس لازم ننسي نغمة مسلم - مسيحي احنا مصريين أولا,وبعدين مهو مفيش مسيحين في منتخب مصر ومفيش مسيحيين في اماكن كتير ولا السياسه لازم يبقي فيها راجل وست ومسلم ومسيحي و عمال وفيات وكمان مفيش مسلمين في بعض الاماكن ولا كل حاجه لازم نعرض دي مجرد فكره واحتمال حدوثها ضعيف جدا بس لازم ننسي نغمه مسلم مسيحي احنا مصريين اولا,,[],0,pending,,
mt_dial_glf_0e56b5da,train,70447,DIAL_GLF,الواحد له كرامته ومستحيل اعيش مع وحده ما,الواحد له كرامته ومستحيل اعيش مع وحده ما,,[],0,pending,,
mt_dial_lev_e412335e,train,55818,DIAL_LEV,والله ما لقيته الا من اسرائيل تامنه علي زراعتكم منها خذوا من جميع الدول الا اليهود الغدارين,والله ما لقيته الا من اسراييل تامنه علي زراعتكم منها خذوا من جميع الدول الا اليهود الغدارين,,[],0,pending,,
mt_msa_37b9046d,train,33932,MSA,فهنيئاً لنا بوطننا و هنيئاً لنا بقيادتنا التي استثمرت في ابناء الوطن و هاهم يرفعون الراس في كل الميادين,فهنييا لنا بوطننا و هنييا لنا بقيادتنا التي استثمرت في ابناء الوطن و هاهم يرفعون الراس في كل الميادين,,[],0,pending,,
mt_dial_egy_018974d5,train,21932,DIAL_EGY,ايوة انا بشترى من كازينو فراخ حلال كمان فية لحمة و لانشون بس فيه محلات جزارة عربية كتير بتبيع لحم و فراخ حلال . . بس سمعت انهم فى كازينو بيشيلوا تاريخ الصلاحية و بيحطوا تاريخ جديد لما الصلاحية بتنتهى ( شكل كازينو بيستعين بالخبرة المصرية فى الفهلوة او يمكن يكون صاحبه مصرى ) اية دة هو انا اسيب الفهلوة المصرية فى مصر الاقيها ورايا فى فرنسا . . حد يعرف مكان مفيهوش فهلوة,ايوه انا بشتري من كازينو فراخ حلال كمان فيه لحمه و لانشون بس فيه محلات جزاره عربيه كتير بتبيع لحم و فراخ حلال بس سمعت انهم في كازينو بيشيلوا تاريخ الصلاحيه و بيحطوا تاريخ جديد لما الصلاحيه بتنتهي شكل كازينو بيستعين بالخبره المصريه في الفهلوه او يمكن يكون صاحبه مصري ايه ده هو انا اسيب الفهلوه المصريه في مصر الاقيها ورايا في فرنسا حد يعرف مكان مفيهوش فهلوه,,[],0,pending,,
mt_dial_glf_88fe7b0a,train,7375,DIAL_GLF,معليش ياحسام رواتبك المتاخره ليست من النصر يناير مع منتخب بلادك وفبرير ومارس موقوف بقرار اللجان بمعني لاتلوي ذراع النادي الذي وقف معك وساندك في محنتك حقك تاخذه من منتخب مصر والاتحاد السعودي بحكم اللجان التابعه,معليش ياحسام رواتبك المتاخره ليست من النصر يناير مع منتخب بلادك وفبرير ومارس موقوف بقرار اللجان بمعني لاتلوي ذراع النادي الذي وقف معك وساندك في محنتك حقك تاخذه من منتخب مصر والاتحاد السعودي بحكم اللجان التابعه,,[],0,pending,,
mt_dial_lev_93630386,train,59075,DIAL_LEV,يعني مهو قرب يموت وبينتحر اخر,يعني مهو قرب يموت وبينتحر اخر,,[],0,pending,,
mt_msa_927e3b6b,train,27637,MSA,وفي ذات الوقت يقسو على نفسه لدرجة كبيرة,وفي ذات الوقت يقسو علي نفسه لدرجه كبيره,,[],0,pending,,
mt_dial_egy_5f5640a4,train,39686,DIAL_EGY,دول ناس عارفه بتعمل ايه وأيه نتيجة قراراتهم الغير مدروسة ! !,دول ناس عارفه بتعمل ايه وايه نتيجه قراراتهم الغير مدروسه,,[],0,pending,,
mt_dial_glf_cdba13e6,train,4629,DIAL_GLF,إلى متى البنات يعطون الشباب وجه و هي ما تعرفه أصلا,الي متي البنات يعطون الشباب وجه و هي ما تعرفه اصلا,,[],0,pending,,
mt_dial_lev_13167465,train,8066,DIAL_LEV,ينفتح لأسباب انسانية مشان القافلة ؟ ؟,ينفتح لاسباب انسانيه مشان القافله,,[],0,pending,,
mt_msa_5a1b9c85,train,72658,MSA,ربنا معاك للإصلاح وأرجو ان تبتعد عن آراء رجال الحزب الوطنى إليى ضيعوا الشعب المصرى وأرجو أن تتعامل مع ولى أمر المصرين الآب الفاضل شفاه الله وعفاه سيادة الرئيس مباشرتاً فى قراراتك وأفكارك لكى تتضح له الصورة,ربنا معاك للاصلاح وارجو ان تبتعد عن اراء رجال الحزب الوطني اليي ضيعوا الشعب المصري وارجو ان تتعامل مع ولي امر المصرين الاب الفاضل شفاه الله وعفاه سياده الرييس مباشرتا في قراراتك وافكارك لكي تتضح له الصوره,,[],0,pending,,
mt_dial_egy_786529f8,train,28531,DIAL_EGY,لقد انتشر فيديو زياره وزير التعليم للمدرسه فى حدائق حلوان ورأينا ورأي الناس فى الخارج حال المدرسين والمدير . . اللي الواحد منهم لسانه متر ويتفلسف وينظر ويتكلم عن الفساد - وسايبين شغلهم والمدرسه مزبله . . وهم اصل الداء وسببه !,لقد انتشر فيديو زياره وزير التعليم للمدرسه في حدايق حلوان وراينا وراي الناس في الخارج حال المدرسين والمدير اللي الواحد منهم لسانه متر ويتفلسف وينظر ويتكلم عن الفساد وسايبين شغلهم والمدرسه مزبله وهم اصل الداء وسببه,,[],0,pending,,
mt_dial_glf_7e470714,train,11903,DIAL_GLF,ازعجنا النصر بمشاكلة وتصريحاتة خلصنا من الدوخي وجاك بعدة احداث زعبيل وقبلة وبعدة حسام,ازعجنا النصر بمشاكله وتصريحاته خلصنا من الدوخي وجاك بعده احداث زعبيل وقبله وبعده حسام,,[],0,pending,,
mt_dial_lev_46701828,train,52162,DIAL_LEV,الف مبروك يا دكتورة نادية وعقبال,الف مبروك يا دكتوره ناديه وعقبال,,[],0,pending,,
mt_msa_bb50d475,train,39227,MSA,والامثال كثر عندك . . عبدالغني و الجيزاني وغيرهم .,والامثال كثر عندك عبدالغني و الجيزاني وغيرهم,,[],0,pending,,
mt_dial_egy_ed30e791,train,18532,DIAL_EGY,س : ليه المخ الصيدى أغلى بكتير من الأمريكى والألمانى,س ليه المخ الصيدي اغلي بكتير من الامريكي والالماني,,[],0,pending,,
mt_dial_glf_cd93315b,train,68567,DIAL_GLF,انا اقول الحمد له انه 4 مراكز,انا اقول الحمد له انه 4 مراكز,,[],0,pending,,
mt_dial_lev_b28b0ea8,train,34861,DIAL_LEV,مرة ولد ضغير ، اول ما بلش يحكي صار ينادي على اخوه ، مات اخوه . صار ينادي على امه ، ماتت امه . صار ينادي على خاله فمات خاله . صار ينادي على ابوه مات ابن الجيران ! !,مره ولد ضغير اول ما بلش يحكي صار ينادي علي اخوه مات اخوه صار ينادي علي امه ماتت امه صار ينادي علي خاله فمات خاله صار ينادي علي ابوه مات ابن الجيران,,[],0,pending,,
mt_msa_587c75b0,train,44589,MSA,هنيئا للأردن بهكذا رجال يحرصون على المصلحة الوطنية وقوة الدولة ووحدتها وليس اثارة الطائفية والفتن,هنييا للاردن بهكذا رجال يحرصون علي المصلحه الوطنيه وقوه الدوله ووحدتها وليس اثاره الطايفيه والفتن,,[],0,pending,,
