example_id,source_split,source_row_id,dialect,original_text,normalized_text,masked_text,mask_spans_json,mask_count,annotation_status,annotator_model,notes
mt_dial_egy_f07ac941,train,73400,DIAL_EGY,*ليه و دي من اهم النقاط لا يوجد اي احترام من الشرطه للمواطن العادي كانسان له حقوقه الانسانيه حتي و لو كان متهم و جاي تقول مكلفين بحماية المواطن . . . ؟ ! !,ليه و دي من اهم النقاط لا يوجد اي احترام من الشرطه للمواطن العادي كانسان له حقوقه الانسانيه حتي و لو كان متهم و جاي تقول مكلفين بحمايه المواطن,,[],0,pending,,
mt_dial_glf_a3d2eb08,train,58791,DIAL_GLF,يملكون منازل والله حرام والله,يملكون منازل والله حرام والله,,[],0,pending,,
mt_dial_lev_1c88fa13,train,14199,DIAL_LEV,انا و الله المشروع ممتاز بس المصيبه انو بعد ما ينجز المشروع يكتشفو انو لازم يكون حضاري و يقررو هدمه و اعادة بناءه مثل الساحه الهاشميه و مجمع رغدان . طبعا هدا طبيعى عنافي الاردن لذلك اطلب من امين عمان ان ينفذ المشروع من الالف الى الياء شركات من اوروبالانهم افهم منا بكثير شغلات و عندهم افكار خلاقه,انا و الله المشروع ممتاز بس المصيبه انو بعد ما ينجز المشروع يكتشفو انو لازم يكون حضاري و يقررو هدمه و اعاده بناءه مثل الساحه الهاشميه و مجمع رغدان طبعا هدا طبيعي عنافي الاردن لذلك اطلب من امين عمان ان ينفذ المشروع من الالف الي الياء شركات من اوروبالانهم افهم منا بكثير شغلات و عندهم افكار خلاقه,,[],0,pending,,
mt_msa_b9d274a7,train,49984,MSA,باالعكس الحكم خليل جلال يعد من أفضل الحكام لدينا باالسعوديه وما يضر ويوضع الحكام لدينا تحت ضغط وشحن يفقده من خلاله ان يكون مبدع أو بارع ، سوى هذه التعصبات لدى بعض الكتاب والاعلام لأنديتهم وبعدين الحكم جلال مثل البلد خارجيا ودوليا أخر مشاركه له كانت بالبطوله الأفريقيه وأجاد هناك يبدو انك متعصبا,باالعكس الحكم خليل جلال يعد من افضل الحكام لدينا باالسعوديه وما يضر ويوضع الحكام لدينا تحت ضغط وشحن يفقده من خلاله ان يكون مبدع او بارع سوي هذه التعصبات لدي بعض الكتاب والاعلام لانديتهم وبعدين الحكم جلال مثل البلد خارجيا ودوليا اخر مشاركه له كانت بالبطوله الافريقيه واجاد هناك يبدو انك متعصبا,,[],0,pending,,
mt_dial_egy_5a99e37e,train,76257,DIAL_EGY,وجوه مكررة ونفس الملل ونفس الكهولة بل انيل مفيش اقباط ومفيش امرأة واحمد زى الحاج احمد ياعينى يامصر مابقتيش ولادة والا ايه والا بتولدى مسلمين وعواجيز ورجالة,وجوه مكرره ونفس الملل ونفس الكهوله بل انيل مفيش اقباط ومفيش امراه واحمد زي الحاج احمد ياعيني يامصر مابقتيش ولاده والا ايه والا بتولدي مسلمين وعواجيز ورجاله,,[],0,pending,,
mt_dial_glf_0254d72f,train,45308,DIAL_GLF,والمفروض يخلون التعداد من السبت للثلاثاء,والمفروض يخلون التعداد من السبت للثلاثاء,,[],0,pending,,
mt_dial_lev_be40cb98,train,31464,DIAL_LEV,لو عندنا 3 تشافيز في الوطن العربي لكانت الامور تسير باتجاه اخر نحو الكرامه,لو عندنا 3 تشافيز في الوطن العربي لكانت الامور تسير باتجاه اخر نحو الكرامه,,[],0,pending,,
mt_msa_bee1caec,train,38686,MSA,امين الصندوق / الرئيس مشغول يكتب,امين الصندوق الرييس مشغول يكتب,,[],0,pending,,
mt_dial_egy_0d5d7009,train,42869,DIAL_EGY,الحضرى من احسن الحراس ف العالم احنا عيبنا كدا لما واحد بيغلط الكل يهزء فيه وما حدش يفتكر كل اللى عمله للاهلى والمنخب انتوا نسيتا اللى عمله فى امم افريقيا 2006 وكاس القارات وانجولا 2010 ولو سمحتوا ما تضيعوش الاهلى لانه محتاج حارس مرمى ممتاز ليحافظ على شباكه نظيفه والكل,الحضري من احسن الحراس ف العالم احنا عيبنا كدا لما واحد بيغلط الكل يهزء فيه وما حدش يفتكر كل اللي عمله للاهلي والمنخب انتوا نسيتا اللي عمله في امم افريقيا 2006 وكاس القارات وانجولا 2010 ولو سمحتوا ما تضيعوش الاهلي لانه محتاج حارس مرمي ممتاز ليحافظ علي شباكه نظيفه والكل,,[],0,pending,,
mt_dial_glf_afee647f,train,80919,DIAL_GLF,ياخي صلحوا الشوراع اول وحطوا لوحات واضحة تبين,ياخي صلحوا الشوراع اول وحطوا لوحات واضحه تبين,,[],0,pending,,
mt_dial_lev_049d4339,train,20876,DIAL_LEV,بعدين الحلو بالموضوع انها بتزيد الجمرك على الشغلات المفيدة التي تقلل من صرف البنزين زي الهايبرد,بعدين الحلو بالموضوع انها بتزيد الجمرك علي الشغلات المفيده التي تقلل من صرف البنزين زي الهايبرد,,[],0,pending,,
mt_msa_23624765,train,62438,MSA,مجرد أرض يغطيها التراب و,مجرد ارض يغطيها التراب و,,[],0,pending,,
mt_dial_egy_6a7714ee,train,71053,DIAL_EGY,عليا الطلاق من خطيبتى انتوا الاتنين عاملين زى سحابة القاهرة السوداء شوية وهتروح,عليا الطلاق من خطيبتي انتوا الاتنين عاملين زي سحابه القاهره السوداء شويه وهتروح,,[],0,pending,,
mt_dial_glf_e702dcda,train,41340,DIAL_GLF,حسبي الله عليهم ونعم الوكيل لاواللي قاهرني بعد قالوا ايش بلد الحريات المفروض علينا كامسلمين الرد على هذه الدول اللتي ذلت المسلمين بالمثل او على الاقل اصدار بيان و تصريح من جهة مسؤله لان للآسف هذا اللي تعودنا عليه . . .,حسبي الله عليهم ونعم الوكيل لاواللي قاهرني بعد قالوا ايش بلد الحريات المفروض علينا كامسلمين الرد علي هذه الدول اللتي ذلت المسلمين بالمثل او علي الاقل اصدار بيان و تصريح من جهه مسوله لان للاسف هذا اللي تعودنا عليه,,[],0,pending,,
mt_dial_lev_7788a973,train,59402,DIAL_LEV,قصي ابو عالية و رافت علي من افضل الوسط بل الاردن,قصي ابو عاليه و رافت علي من افضل الوسط بل الاردن,,[],0,pending,,
mt_msa_3d0cbc19,train,49072,MSA,الدوله تستثمر في جميع المجالات وتوفر جميع الفرص لكن يوجد الحاقدين والحاسدين الله يكفينا شرهم يارب في الطلاب ترسل كل سنه على حسابها مبتعثين وفرت المشريع الضخمه للحدائق وقامت بمشاريع جباره للحرمين ويكفي مشروع توسعه المسعى وتوسعه الحرم الجديده والشوارع الضخمه السريعه والمشاريع الاقتصاديه والمشاريع التعليميه والله مااقدر اعدها ولا احصيها الحمدالله اولا بان انعم علينا قياده حكيمه بقياده الملك عبدالله بن عبدالعزيز ال سعود الله يحفظه ويرعاه والحمدالله على,الدوله تستثمر في جميع المجالات وتوفر جميع الفرص لكن يوجد الحاقدين والحاسدين الله يكفينا شرهم يارب في الطلاب ترسل كل سنه علي حسابها مبتعثين وفرت المشريع الضخمه للحدايق وقامت بمشاريع جباره للحرمين ويكفي مشروع توسعه المسعي وتوسعه الحرم الجديده والشوارع الضخمه السريعه والمشاريع الاقتصاديه والمشاريع التعليميه والله مااقدر اعدها ولا احصيها الحمدالله اولا بان انعم علينا قياده حكيمه بقياده الملك عبدالله بن عبدالعزيز ال سعود الله يحفظه ويرعاه والحمدالله علي,,[],0,pending,,
mt_dial_egy_f2bff617,train,2062,DIAL_EGY,واللى مش عايزهم يطالبوا بيه يبقى,واللي مش عايزهم يطالبوا بيه يبقي,,[],0,pending,,
mt_dial_glf_e37d45e2,train,20218,DIAL_GLF,والله انكم تحومن الكبد يا الهلالية ببعض,والله انكم تحومن الكبد يا الهلاليه ببعض,,[],0,pending,,
mt_dial_lev_25e5a77a,train,58852,DIAL_LEV,فالاردن بتشحن بخمسة عشر دينار بيشحنولك بعشرة وبعدين بيخصموا كمان دينار بدل,فالاردن بتشحن بخمسه عشر دينار بيشحنولك بعشره وبعدين بيخصموا كمان دينار بدل,,[],0,pending,,
mt_msa_a1b1212f,train,70443,MSA,أسال الله العلي العظيم رب العرش العظيم أن يشفي هذا الطفل وجميع مرضى المسلمين وأن يسخر له الأسباب والحمدلله أن ولاة الأمر هم من يسعون لفعل الخير سواء داخل وخارج الوطن وأمير الخير سلطان الخير هو الأمل بعد الله سبحانه ولن يتردد لحظة إذا علم,اسال الله العلي العظيم رب العرش العظيم ان يشفي هذا الطفل وجميع مرضي المسلمين وان يسخر له الاسباب والحمدلله ان ولاه الامر هم من يسعون لفعل الخير سواء داخل وخارج الوطن وامير الخير سلطان الخير هو الامل بعد الله سبحانه ولن يتردد لحظه اذا علم,,[],0,pending,,
mt_dial_egy_51d562c0,train,13063,DIAL_EGY,"العمال جزء لا يتجزء عن مصر مينفعش نتغاضى عنهم جميع الفئات المجتمع لابد من وجود احد يمثلهم فى مجلس الشعب لو عيزين مصر تتقدم , لذالك ارجو من د \ البردعى ان يعيد النظر فى تلك",العمال جزء لا يتجزء عن مصر مينفعش نتغاضي عنهم جميع الفيات المجتمع لابد من وجود احد يمثلهم في مجلس الشعب لو عيزين مصر تتقدم لذالك ارجو من د البردعي ان يعيد النظر في تلك,,[],0,pending,,
mt_dial_glf_f810f571,train,10961,DIAL_GLF,"نستاهل طبعا "" بس مهم مايشغلنا عن استحقاقات دور ال",نستاهل طبعا بس مهم مايشغلنا عن استحقاقات دور ال,,[],0,pending,,
mt_dial_lev_0aa8ed44,train,2402,DIAL_LEV,2 ) اول فريق اردني بنسحب من مبارة بعد خروج اربع لاعبين لانو تبهدل من شباب,2 اول فريق اردني بنسحب من مباره بعد خروج اربع لاعبين لانو تبهدل من شباب,,[],0,pending,,
mt_msa_75984578,train,14310,MSA,شكرا لرجال الامن ، ونرجوا ان تعلن عقوبه الجريمة وتكون عبرة للمجرمين امثاله,شكرا لرجال الامن ونرجوا ان تعلن عقوبه الجريمه وتكون عبره للمجرمين امثاله,,[],0,pending,,
mt_dial_egy_99562fae,train,83347,DIAL_EGY,مقال رائع فعلا فيه مقالات مكتوبة من أرض الواقع مقالات تخرج بين بين الشعب المطحون في زمن الرشوة والفساد اللى ريحته طلعت جوه وبره ، عكس المقالات التانية اللى تشم منها ريحة النفاق من أول ما تشوف اسم كاتبها ولما تقرأها تحس انهم عايشين في كوكب تانى ورافضين أبدا يشوفوا,مقال رايع فعلا فيه مقالات مكتوبه من ارض الواقع مقالات تخرج بين بين الشعب المطحون في زمن الرشوه والفساد اللي ريحته طلعت جوه وبره عكس المقالات التانيه اللي تشم منها ريحه النفاق من اول ما تشوف اسم كاتبها ولما تقراها تحس انهم عايشين في كوكب تاني ورافضين ابدا يشوفوا,,[],0,pending,,
mt_dial_glf_34e4e694,train,58841,DIAL_GLF,اللهم لا اعتراض بس امدا النصر الحين اللي اخذ البطولة لو ما تلطشوا في زعبيل وتمسخروا اخر,اللهم لا اعتراض بس امدا النصر الحين اللي اخذ البطوله لو ما تلطشوا في زعبيل وتمسخروا اخر,,[],0,pending,,
mt_dial_lev_aff445a2,train,42085,DIAL_LEV,طبعا لازم تزيد البطاله لانه لاتوجد رواتب كافيه في بداية التعليم وبالذات تعلم الصنعات وايضا غير مشجع تعلمها من حيث التامين الصحي والضمان الاجتماعي وهل 370 دينار كافيه لعيش,طبعا لازم تزيد البطاله لانه لاتوجد رواتب كافيه في بدايه التعليم وبالذات تعلم الصنعات وايضا غير مشجع تعلمها من حيث التامين الصحي والضمان الاجتماعي وهل 370 دينار كافيه لعيش,,[],0,pending,,
mt_msa_7bfe6562,train,47229,MSA,"بالتوفيق يالعالمي , , , شدوا الهمه , والله يوفقكم",بالتوفيق يالعالمي شدوا الهمه والله يوفقكم,,[],0,pending,,
