example_id,source_split,source_row_id,dialect,original_text,normalized_text,masked_text,mask_spans_json,mask_count,annotation_status,annotator_model,notes
mt_dial_lev_4cea0690,train,45025,DIAL_LEV,اليوم الجو شايفته لطيف ، ما توقعت ترجعوا تحكوا فيه حر اليومين الجايين . الله يسامحكم بس . زعلتوني,اليوم الجو شايفته لطيف ما توقعت ترجعوا تحكوا فيه حر اليومين الجايين الله يسامحكم بس زعلتوني,,[],0,pending,,
mt_msa_ec7b4630,train,15416,MSA,- وأظن أن هذه الكلمات كانت بمثابة الحجر الذي القي في المياه الراكدة فحركته حتي فارت . . . ووجدت لها صدي لدي باقي الأعضاء القدامى وجميع العاملين . وما أظن أن تهدأ حتي يصبح مشروع هيئة الملكية العقارية والتوثيق واقعا,واظن ان هذه الكلمات كانت بمثابه الحجر الذي القي في المياه الراكده فحركته حتي فارت ووجدت لها صدي لدي باقي الاعضاء القدامي وجميع العاملين وما اظن ان تهدا حتي يصبح مشروع هييه الملكيه العقاريه والتوثيق واقعا,,[],0,pending,,
mt_dial_egy_ea4877d1,train,17103,DIAL_EGY,اللى حصل من جمهور الزمالك دا بلطجة هما عاوزين يكسبوا بالعافيه ودى مش اول مرة هما نسيوا اللى حصل فى ماتش بتروجيت فى لدور الاول هما طول عمرهم بلطجية وانضملهم البلطجى الكبير ابراهيم الابيض والطيور على اشكالها تقع ( انا عاجبنى حسام وشيكا وعبد الحليم فى تهدئة الجمهور ) ( حازم امام وعلاء على انتوا لسة فى اول الطريق ولو هاتبتدو كدا يبقى مش هاتكملوا,اللي حصل من جمهور الزمالك دا بلطجه هما عاوزين يكسبوا بالعافيه ودي مش اول مره هما نسيوا اللي حصل في ماتش بتروجيت في لدور الاول هما طول عمرهم بلطجيه وانضملهم البلطجي الكبير ابراهيم الابيض والطيور علي اشكالها تقع انا عاجبني حسام وشيكا وعبد الحليم في تهديه الجمهور حازم امام وعلاء علي انتوا لسه في اول الطريق ولو هاتبتدو كدا يبقي مش هاتكملوا,,[],0,pending,,
mt_dial_glf_189ba4cd,train,69385,DIAL_GLF,عاد اقول لأمي مدام سويتو بزوجة اخوي الكبير كذا اجل تبون تعاملون زوجتي بعدين زي كذا جلست أمي تضحك تقول أنت برضو جايك أدور لاتخاف ه صدق مهبل الحريم الكبار مع ذالك أموت وأحيى تحت رجول الوالدة بنفس,عاد اقول لامي مدام سويتو بزوجه اخوي الكبير كذا اجل تبون تعاملون زوجتي بعدين زي كذا جلست امي تضحك تقول انت برضو جايك ادور لاتخاف ه صدق مهبل الحريم الكبار مع ذالك اموت واحيي تحت رجول الوالده بنفس,,[],0,pending,,
mt_dial_lev_bd7425ec,train,830,DIAL_LEV,حتى ترخص اسعار السيارات وتخلي الموظفيين الطفرانيين مثلنا يركبو,حتي ترخص اسعار السيارات وتخلي الموظفيين الطفرانيين مثلنا يركبو,,[],0,pending,,
mt_msa_f0d8500a,train,76421,MSA,رأيتك في مباراه الديربي شخصا,رايتك في مباراه الديربي شخصا,,[],0,pending,,
mt_dial_egy_4c37c417,train,10661,DIAL_EGY,هو ده الكلام . . . كل شئ ممكن . . مافيش مستحيل . . . طبعاً هم دول أهل الخبرة للي,هو ده الكلام كل شي ممكن مافيش مستحيل طبعا هم دول اهل الخبره للي,,[],0,pending,,
mt_dial_glf_b7532793,train,21179,DIAL_GLF,لاحول ولاقوه الا بالله . . . تحيااتي لك اخوي,لاحول ولاقوه الا بالله تحيااتي لك اخوي,,[],0,pending,,
mt_dial_lev_e1bc7889,train,82692,DIAL_LEV,"الله المستعان . . . بس احنا في الاردن دائما نساعد أهل غزة . . . وهناك مستشفيات ميدانية في قطاع . . . طيب ليش أهل غزة الي عندنا الحكومة ما تساعدهم . . القران يقول "" الاقربون أولى بالمعروف",الله المستعان بس احنا في الاردن دايما نساعد اهل غزه وهناك مستشفيات ميدانيه في قطاع طيب ليش اهل غزه الي عندنا الحكومه ما تساعدهم القران يقول الاقربون اولي بالمعروف,,[],0,pending,,
mt_msa_323e526c,train,12612,MSA,سوى اخلاء سريع لمدرج الاصفر خلال عشرين دقيقه,سوي اخلاء سريع لمدرج الاصفر خلال عشرين دقيقه,,[],0,pending,,
mt_dial_egy_c477e915,train,83398,DIAL_EGY,وأحبك تسافر وتبعد تهاجر وتبعت فلوسك دولار او,واحبك تسافر وتبعد تهاجر وتبعت فلوسك دولار او,,[],0,pending,,
mt_dial_glf_e1ea1ae8,train,10629,DIAL_GLF,الله يوفق الثلاثة الكبار وعقبال بقية الصغار واقول وجه السعد لعبدالرحمن بن مساعد كان وجه خير وفاز الشباب واتمنى من الفرق الاخرى الصغيرة عدم التصاريح واعطاء البيانات ومحاولة التسبب في ارباك الفرق الكبيرة وخصوصا ابوزعيبل وابارك للاماراتين وخصوصا لنادي الوصل الذي استحق لقب بطولة الخليج عن,الله يوفق الثلاثه الكبار وعقبال بقيه الصغار واقول وجه السعد لعبدالرحمن بن مساعد كان وجه خير وفاز الشباب واتمني من الفرق الاخري الصغيره عدم التصاريح واعطاء البيانات ومحاوله التسبب في ارباك الفرق الكبيره وخصوصا ابوزعيبل وابارك للاماراتين وخصوصا لنادي الوصل الذي استحق لقب بطوله الخليج عن,,[],0,pending,,
mt_dial_lev_9914687e,train,25761,DIAL_LEV,"يا حرام . مش طبيعي هالولد , الله يعلم مسؤلية مين",يا حرام مش طبيعي هالولد الله يعلم مسوليه مين,,[],0,pending,,
mt_msa_c3bf01ec,train,54779,MSA,هذا يعني أنكم ترون أن ما فعله فيقاروا لا يخالف,هذا يعني انكم ترون ان ما فعله فيقاروا لا يخالف,,[],0,pending,,
mt_dial_egy_69001e10,train,27107,DIAL_EGY,عدلى القيعى طلع مجنون يا,عدلي القيعي طلع مجنون يا,,[],0,pending,,
mt_dial_glf_d4114aea,train,58408,DIAL_GLF,الله يبتليك في نفسك اذا كان لك سبب في هذا الوضع وهذا,الله يبتليك في نفسك اذا كان لك سبب في هذا الوضع وهذا,,[],0,pending,,
mt_dial_lev_a44521eb,train,47569,DIAL_LEV,والتكسي الاصفر له الله مين بدو يدعمو ياسيدي والله نخسر مش جايب تكاليف تشغيله خلال سنه ونص زادو السرافيس والباصات 3 مرات مع انه الطلاب والموظفين يستعملونها أكثر من التكسي الذي زادوه مره واحده 10 قروش وزاد بعديها البنزين 1500 دينار ونص الله بقولها يطلعوا 3 او 4 ركاب من البلد للنظيف والمريخ والتاج والجوفه وألاشرفيه 50 قرش والسرفيس اجاره 1200 دينار وعشرين قرش التكسي في العالم كله جايب تكاليف التشغيل ألا عند الامانه الموقره التي تدعم المميز لماذا لاأحد يدري نحن انتهينا نشتغل 12 او 13 ساعه على,والتكسي الاصفر له الله مين بدو يدعمو ياسيدي والله نخسر مش جايب تكاليف تشغيله خلال سنه ونص زادو السرافيس والباصات 3 مرات مع انه الطلاب والموظفين يستعملونها اكثر من التكسي الذي زادوه مره واحده 10 قروش وزاد بعديها البنزين 1500 دينار ونص الله بقولها يطلعوا 3 او 4 ركاب من البلد للنظيف والمريخ والتاج والجوفه والاشرفيه 50 قرش والسرفيس اجاره 1200 دينار وعشرين قرش التكسي في العالم كله جايب تكاليف التشغيل الا عند الامانه الموقره التي تدعم المميز لماذا لااحد يدري نحن انتهينا نشتغل 12 او 13 ساعه علي,,[],0,pending,,
mt_msa_a4cc501d,train,56202,MSA,لا بد من النظر في تربية الابناء وتعليمهم الشجاعه ومواجهة,لا بد من النظر في تربيه الابناء وتعليمهم الشجاعه ومواجهه,,[],0,pending,,
mt_dial_egy_a39c5788,train,15148,DIAL_EGY,خلاص كل مشاكل مصر انحلت ، ومش باقي غير مشكلة شوبير بيه ومرتضي بيه ، / والناس تتباع في شغف شديد و انتظار مجحف ، اللقاء الخطير ، لهذه الدرجة وصل تفكير هذا الشعب ، تحية وانحاء لحكومة الحزب الوطنى ، التى استطاعت انت تزل شعب عجز عنه اسيادنا الدول المتقدمة ، واسرائيل ، فرنسا ، الانجليز وغيرهم علي مدار تاريخ,خلاص كل مشاكل مصر انحلت ومش باقي غير مشكله شوبير بيه ومرتضي بيه والناس تتباع في شغف شديد و انتظار مجحف اللقاء الخطير لهذه الدرجه وصل تفكير هذا الشعب تحيه وانحاء لحكومه الحزب الوطني التي استطاعت انت تزل شعب عجز عنه اسيادنا الدول المتقدمه واسراييل فرنسا الانجليز وغيرهم علي مدار تاريخ,,[],0,pending,,
mt_dial_glf_b6e4f9c6,train,68374,DIAL_GLF,هذه المباراة مهمه يجب اعطاء اللاعبين حقوقهم عشان يعطون داخل,هذه المباراه مهمه يجب اعطاء اللاعبين حقوقهم عشان يعطون داخل,,[],0,pending,,
mt_dial_lev_56feedd0,train,47616,DIAL_LEV,وبحب ابشرك السنة هاي راح تكون متوشحة باللون الازرق .,وبحب ابشرك السنه هاي راح تكون متوشحه باللون الازرق,,[],0,pending,,
mt_msa_a992ad23,train,70338,MSA,في المدينة نلحظ الأسواق والأماكن العامة في البادية,في المدينه نلحظ الاسواق والاماكن العامه في الباديه,,[],0,pending,,
mt_dial_egy_19fbe317,train,37976,DIAL_EGY,حرام اللى بيحصل ده دول بيطلعوا المجرمين و البلطجية و بيبهدلوا البنات اللى فى المظاهرات ارحمونا احنا حاسيين انهم اسؤ من الاحتلال الانجليز ما خربوش مصر,حرام اللي بيحصل ده دول بيطلعوا المجرمين و البلطجيه و بيبهدلوا البنات اللي في المظاهرات ارحمونا احنا حاسيين انهم اسو من الاحتلال الانجليز ما خربوش مصر,,[],0,pending,,
mt_dial_glf_2b5d3c38,train,66277,DIAL_GLF,لا والله رحنا فيها بساهر الفاشل . . .,لا والله رحنا فيها بساهر الفاشل,,[],0,pending,,
mt_dial_lev_129e6b54,train,122,DIAL_LEV,الحكم يعكس العقلية البدائية التقليدية التي لن تتغير ابدا . دم البنت راح,الحكم يعكس العقليه البداييه التقليديه التي لن تتغير ابدا دم البنت راح,,[],0,pending,,
mt_msa_d388a985,train,3075,MSA,فهذا التكريم للوطن قبل الهلال وأنتم من,فهذا التكريم للوطن قبل الهلال وانتم من,,[],0,pending,,
mt_dial_egy_a0f73717,train,78372,DIAL_EGY,نوى البلح فى مصر وموسم البلح هييجى امتى,نوي البلح في مصر وموسم البلح هييجي امتي,,[],0,pending,,
mt_dial_glf_17f973b7,train,1938,DIAL_GLF,"من حق المرأه ان تسكن في بيت مستقل ، وليس من حقها ان تحول بين الرجل وامه ( امي الله بحفظها ويرعاها هي عمود البيت رضت المرأة والا مارضت ) دامها ماخذه حقها كامل , واذا ماعجبها بيت اهلها استر",من حق المراه ان تسكن في بيت مستقل وليس من حقها ان تحول بين الرجل وامه امي الله بحفظها ويرعاها هي عمود البيت رضت المراه والا مارضت دامها ماخذه حقها كامل واذا ماعجبها بيت اهلها استر,,[],0,pending,,
mt_dial_lev_e0739a28,train,3259,DIAL_LEV,واضح انك سعيد ومتفائل بس مهما بلغت درجة التفاؤل لا تصل الى هذا الحد . . . شو 200 سنة ؟ ؟ ؟ ما بكفو دراسة واعادة طرح عطاء ومن ثم سحبه . .,واضح انك سعيد ومتفايل بس مهما بلغت درجه التفاول لا تصل الي هذا الحد شو 200 سنه ما بكفو دراسه واعاده طرح عطاء ومن ثم سحبه,,[],0,pending,,
mt_msa_62e3cccf,train,80750,MSA,ولكن فى الاخر خرجا اخوه متحابين دون اى شجار او تناحر او تراشق,ولكن في الاخر خرجا اخوه متحابين دون اي شجار او تناحر او تراشق,,[],0,pending,,
mt_dial_egy_fbf4f27d,train,64955,DIAL_EGY,كل التمثيليه دى علشان ماتش القمه عتى فكرة هذا نتيجة الفساد الموجود فى كل شى فى البلد فلا نستغرب ان يصل للرياضه واعتقد انها صورة على الهواء للفساد الحاصل وحسبى الله ونعم,كل التمثيليه دي علشان ماتش القمه عتي فكره هذا نتيجه الفساد الموجود في كل شي في البلد فلا نستغرب ان يصل للرياضه واعتقد انها صوره علي الهواء للفساد الحاصل وحسبي الله ونعم,,[],0,pending,,
mt_dial_glf_b859b75b,train,20359,DIAL_GLF,خلك عند كلمتك ولا يهمك,خلك عند كلمتك ولا يهمك,,[],0,pending,,
mt_dial_lev_be400d3a,train,12477,DIAL_LEV,غير يضلوا يكتبو عن الاتحادوالاندية واللاعبين,غير يضلوا يكتبو عن الاتحادوالانديه واللاعبين,,[],0,pending,,
mt_msa_f8d36575,train,61341,MSA,ليتك تجمعين هذه المقالات في كتاب,ليتك تجمعين هذه المقالات في كتاب,,[],0,pending,,
mt_dial_egy_168e1b16,train,31257,DIAL_EGY,وكونت في الحفله وكانت جامده اخر,وكونت في الحفله وكانت جامده اخر,,[],0,pending,,
mt_dial_glf_ff613eb9,train,83157,DIAL_GLF,مع انهم كانو في الاهلي مستواهم عادي,مع انهم كانو في الاهلي مستواهم عادي,,[],0,pending,,
mt_dial_lev_881941fe,train,71826,DIAL_LEV,بس انت نسيت شغلة قبل اسبوعين كان في مباراتين بين الجزيرة والفيصلي والجزيرة فاز فيهم ارجو,بس انت نسيت شغله قبل اسبوعين كان في مباراتين بين الجزيره والفيصلي والجزيره فاز فيهم ارجو,,[],0,pending,,
mt_msa_4e80e950,train,47767,MSA,آخر ما ينقصنا محاضر آخر فيما يصح و لايصح يعلمنا من هو الخائن ومن هو الوطني .,اخر ما ينقصنا محاضر اخر فيما يصح و لايصح يعلمنا من هو الخاين ومن هو الوطني,,[],0,pending,,
mt_dial_egy_475947b2,train,34519,DIAL_EGY,اي كلام فاضي وخلاص والصور لا توحي بشيء صور تعباته جدا وخبر مريض,اي كلام فاضي وخلاص والصور لا توحي بشيء صور تعباته جدا وخبر مريض,,[],0,pending,,
mt_dial_glf_20c5f29c,train,15330,DIAL_GLF,ماشاء الله من البديه جازين معهم البيض عارفين في طق وطيق وطاق,ماشاء الله من البديه جازين معهم البيض عارفين في طق وطيق وطاق,,[],0,pending,,
mt_dial_lev_ad82ee4a,train,69900,DIAL_LEV,بالتوفبق للمنشية بس حسام شديفات لاعب الفيصلى مش المنشية لانة كان السنة الماضية معار,بالتوفبق للمنشيه بس حسام شديفات لاعب الفيصلي مش المنشيه لانه كان السنه الماضيه معار,,[],0,pending,,
mt_msa_51920080,train,64293,MSA,والله لو كانت هذه الرواية صحيحة كما رواها والد هذا الطفل المسكين فيجب أن يطبق على هذا الضابط حد الحرابة بأن يقتل أو يصلب أو تقطع يديه ورجليه من خلاف وإذا لم يوجد من يطبق شرع الله عليه فيجب على أبيه أو أحد أقاربه أن يأخذ بثأر هذا الطفل والله سينصره إن شاء,والله لو كانت هذه الروايه صحيحه كما رواها والد هذا الطفل المسكين فيجب ان يطبق علي هذا الضابط حد الحرابه بان يقتل او يصلب او تقطع يديه ورجليه من خلاف واذا لم يوجد من يطبق شرع الله عليه فيجب علي ابيه او احد اقاربه ان ياخذ بثار هذا الطفل والله سينصره ان شاء,,[],0,pending,,
mt_dial_egy_f3e838af,train,60693,DIAL_EGY,الامن المصري متهور واللي بيتهور لازم يتعور - اسيكوا وارجع لكباياتي وقزازاتي - واسد نفس واكتم - وأشد واكتم وكان يجب علي الشبكه الاورومتوسطيه التكتيم من منطلق شد,الامن المصري متهور واللي بيتهور لازم يتعور اسيكوا وارجع لكباياتي وقزازاتي واسد نفس واكتم واشد واكتم وكان يجب علي الشبكه الاورومتوسطيه التكتيم من منطلق شد,,[],0,pending,,
mt_dial_glf_d2d108b7,train,51761,DIAL_GLF,الله يرحم حالك يالدعيع اعتزل وانا اخوك لاتفضح نفسك وترا مستواك قام يتدهور اعتزل اتكلم عربي . . .,الله يرحم حالك يالدعيع اعتزل وانا اخوك لاتفضح نفسك وترا مستواك قام يتدهور اعتزل اتكلم عربي,,[],0,pending,,
mt_dial_lev_70663688,train,19961,DIAL_LEV,حابب تلعب في استاد الامير محمد بالزرقاء ؟ ؟ من عيوني,حابب تلعب في استاد الامير محمد بالزرقاء من عيوني,,[],0,pending,,
mt_msa_1ab3c3a8,train,59418,MSA,تسارعت هذه الأيام خطوات المنافقين وأذناب الغرب الحاقدين . . فإن الخطب لعظيم وإنه ليسمع إذا ناديت حياً,تسارعت هذه الايام خطوات المنافقين واذناب الغرب الحاقدين فان الخطب لعظيم وانه ليسمع اذا ناديت حيا,,[],0,pending,,
mt_dial_egy_f11cf4b5,train,49435,DIAL_EGY,وأخيرا وليس آخرا . . . بلاش تقطيم ف الناس اللي شايفه,واخيرا وليس اخرا بلاش تقطيم ف الناس اللي شايفه,,[],0,pending,,
mt_dial_glf_261ba3cf,train,73134,DIAL_GLF,ولا لو حاصلتله ما دور,ولا لو حاصلتله ما دور,,[],0,pending,,
mt_dial_lev_529a84ee,train,21470,DIAL_LEV,الاخ يوسف من سويسرا . . . انت عايش بسويسرا ومش داري شو صائر بالشعب الي هلكته الضرائب . . . خبر علمي مين والناس نايمين ! ! أنا برأيي انه التعليقات تعكس حال الشعب الاردني البائس والباحث عن اي شي ممكن يضحكه شوي وينسيه همومه . . حتى لو كان بخبر علمي او بسن ديناصور او حتى حمامة فيل زهري زي الي لاقاه صاحبنا امبارح ورا الدار !,الاخ يوسف من سويسرا انت عايش بسويسرا ومش داري شو صاير بالشعب الي هلكته الضرايب خبر علمي مين والناس نايمين انا برايي انه التعليقات تعكس حال الشعب الاردني البايس والباحث عن اي شي ممكن يضحكه شوي وينسيه همومه حتي لو كان بخبر علمي او بسن ديناصور او حتي حمامه فيل زهري زي الي لاقاه صاحبنا امبارح ورا الدار,,[],0,pending,,
mt_msa_0abad204,train,65781,MSA,خارج عن نطاق التعليم العالي مالياً وأدارياً ونظاماً . .,خارج عن نطاق التعليم العالي ماليا واداريا ونظاما,,[],0,pending,,
