example_id,source_split,source_row_id,dialect,original_text,normalized_text,masked_text,mask_spans_json,mask_count,annotation_status,annotator_model,notes
mt_dial_lev_787e9e47,train,32317,DIAL_LEV,بس خلوا المواطن العادي المسكين في,بس خلوا المواطن العادي المسكين في,,[],0,pending,,
mt_msa_1c87740a,train,7439,MSA,هل سنجد في الحزب الوطني من يتعظ بالمرض وموت الفجأه ام انهم يمضون في غفلتهم الى نهايتهم القريبة جدا بأذن الله ؛ عموما أنا أشك في أنهم,هل سنجد في الحزب الوطني من يتعظ بالمرض وموت الفجاه ام انهم يمضون في غفلتهم الي نهايتهم القريبه جدا باذن الله عموما انا اشك في انهم,,[],0,pending,,
mt_dial_egy_d5929afc,train,49174,DIAL_EGY,مش ممكن اللى بتعمله ده يا عبداللطيف المفروض تكتب عن مصر عيب,مش ممكن اللي بتعمله ده يا عبداللطيف المفروض تكتب عن مصر عيب,,[],0,pending,,
mt_dial_glf_189328f4,train,83228,DIAL_GLF,لانه نسى حكم التقيد بالاوامر ولم يتحمل بجاحة الطرف,لانه نسي حكم التقيد بالاوامر ولم يتحمل بجاحه الطرف,,[],0,pending,,
mt_dial_lev_e072bfd0,train,32583,DIAL_LEV,كمان كلهم ناشرين نفس الخبر بنفس,كمان كلهم ناشرين نفس الخبر بنفس,,[],0,pending,,
mt_msa_7c707a00,train,34486,MSA,بينما الخدمات لا تزال سيئة و لا يوجد تطوير للخدمات,بينما الخدمات لا تزال سييه و لا يوجد تطوير للخدمات,,[],0,pending,,
mt_dial_egy_3a8e68b9,train,33717,DIAL_EGY,الاهلى محتاج الجماهير الاهلى بطل الدورى شكلا يا منصور و هنولع,الاهلي محتاج الجماهير الاهلي بطل الدوري شكلا يا منصور و هنولع,,[],0,pending,,
mt_dial_glf_576edd3b,train,83647,DIAL_GLF,بس يبي الفلة وغيرها والاخت تصدق انه حبها ويبي يتزوج,بس يبي الفله وغيرها والاخت تصدق انه حبها ويبي يتزوج,,[],0,pending,,
mt_dial_lev_71fcafaf,train,85321,DIAL_LEV,الشاب بدو يخطب بنشف ريقه هو واهله وهمه رايحيين جايين للتعارف على,الشاب بدو يخطب بنشف ريقه هو واهله وهمه رايحيين جايين للتعارف علي,,[],0,pending,,
mt_msa_bf008b10,train,65042,MSA,جزاكم الله خير يا حكومة خادم الحرمين,جزاكم الله خير يا حكومه خادم الحرمين,,[],0,pending,,
mt_dial_egy_1e8d4ab7,train,15926,DIAL_EGY,على فكره انا صاحب هانى ووائل معاهم فى الكليه والخمسه اللى كانوا فى العربيه ماتوا وحضرت الصلاه والعزاء ويا ريت محدش يغلط حرام عليكم ممكن اى حد يحصله كده فى لحظه بدل ماتدعولهم وتقروا الفاتحه بتحاسبوهم وخلاص وكفايه منظر اهاليهم حرام عليكم والله وربنا يرحمهم ان شاء الله انا هانى كان صاحبى اوى ومعايا 3 سنين وعارفه هوا ووائل بلاش بس كلام من غير ماحد يعرف حاجه وياريت تقروا الفاتحه ليهم الخمسه وربنا يرحمهم ان شاء,علي فكره انا صاحب هاني ووايل معاهم في الكليه والخمسه اللي كانوا في العربيه ماتوا وحضرت الصلاه والعزاء ويا ريت محدش يغلط حرام عليكم ممكن اي حد يحصله كده في لحظه بدل ماتدعولهم وتقروا الفاتحه بتحاسبوهم وخلاص وكفايه منظر اهاليهم حرام عليكم والله وربنا يرحمهم ان شاء الله انا هاني كان صاحبي اوي ومعايا 3 سنين وعارفه هوا ووايل بلاش بس كلام من غير ماحد يعرف حاجه وياريت تقروا الفاتحه ليهم الخمسه وربنا يرحمهم ان شاء,,[],0,pending,,
mt_dial_glf_9b20df3f,train,65028,DIAL_GLF,والله ما مثلش في هالدنيا,والله ما مثلش في هالدنيا,,[],0,pending,,
mt_dial_lev_fb21fad8,train,61360,DIAL_LEV,بتمنى من المسؤلين المحترمين بنظروا في هذا القرار جيدا لانه اتصور مثل هيك مشروع بدو شوارع لا تقل عرضها عن 100 متر ونحن في شارع الجامعة نعاني من الازدحامات الخانقة وخاصة عند اشارة الدوريات الخارجية وفي فصل الصيف بالاخص ونحن نعلم بأن شارع الجامعة كل صايد يحتوي على 3 مسارب فما بالكم على الوضع الجديد ؟ ؟,بتمني من المسولين المحترمين بنظروا في هذا القرار جيدا لانه اتصور مثل هيك مشروع بدو شوارع لا تقل عرضها عن 100 متر ونحن في شارع الجامعه نعاني من الازدحامات الخانقه وخاصه عند اشاره الدوريات الخارجيه وفي فصل الصيف بالاخص ونحن نعلم بان شارع الجامعه كل صايد يحتوي علي 3 مسارب فما بالكم علي الوضع الجديد,,[],0,pending,,
mt_msa_f376c6a6,train,24359,MSA,بسؤلِِ للسماء هل تعود بلادى,بسول للسماء هل تعود بلادي,,[],0,pending,,
mt_dial_egy_4b080c5d,train,43200,DIAL_EGY,لوفهمت ياخي الكريم ليه الصهاينه مركزين علي السفيين بذات لم تتكلم ياريت تكون الرساله وصلت لانهم لايخافون الامن اهل السنه لانهم هم السلفيون وعمر المظاهرات بجين نتيجه ماذا فعلت المظارات اللهم اهدي قومي فانهم لا,لوفهمت ياخي الكريم ليه الصهاينه مركزين علي السفيين بذات لم تتكلم ياريت تكون الرساله وصلت لانهم لايخافون الامن اهل السنه لانهم هم السلفيون وعمر المظاهرات بجين نتيجه ماذا فعلت المظارات اللهم اهدي قومي فانهم لا,,[],0,pending,,
mt_dial_glf_11708a65,train,74176,DIAL_GLF,لاحول ولا قوة الا بالله . . كثر القتل والعياذ بالله الله لا يبلانا,لاحول ولا قوه الا بالله كثر القتل والعياذ بالله الله لا يبلانا,,[],0,pending,,
mt_dial_lev_d58357c3,train,61169,DIAL_LEV,طبعا اشي اكيد اي فريق بالعالم بصير فيه هيك بس الوحدات لازم يعالج اموره قبل فوات,طبعا اشي اكيد اي فريق بالعالم بصير فيه هيك بس الوحدات لازم يعالج اموره قبل فوات,,[],0,pending,,
mt_msa_04b7a7e8,train,32002,MSA,وبحثتم عن شئ اخر تلعبوا بة بدلا من اللعب بالفتنة,وبحثتم عن شي اخر تلعبوا به بدلا من اللعب بالفتنه,,[],0,pending,,
mt_dial_egy_9aed162a,train,10574,DIAL_EGY,الحريم اللى بتصرف على رجالتها عندكوا انتوا يا قر . . . انشر يا مصرى يا,الحريم اللي بتصرف علي رجالتها عندكوا انتوا يا قر انشر يا مصري يا,,[],0,pending,,
mt_dial_glf_578f7cb8,train,10155,DIAL_GLF,اصلا هو مريض من يوم يقول المحلات ماتسكر وقت,اصلا هو مريض من يوم يقول المحلات ماتسكر وقت,,[],0,pending,,
mt_dial_lev_0d5dc070,train,49847,DIAL_LEV,والله فتحنا الخبر و بلشت اقرا ، و إز ، الاقتصادين هم : معالي وزير المالية الحالي ! ! ! اعطيني مهنية ! ! ! و معالي وزير التخطيط الاسبق ! ! ! احلى خبراء ! ! ! و بالاخر على الاخر يعني ، فقرة صغيرة لحمارنه ( على اساس الراي الاخر يعني ! ! !,والله فتحنا الخبر و بلشت اقرا و از الاقتصادين هم معالي وزير الماليه الحالي اعطيني مهنيه و معالي وزير التخطيط الاسبق احلي خبراء و بالاخر علي الاخر يعني فقره صغيره لحمارنه علي اساس الراي الاخر يعني,,[],0,pending,,
mt_msa_4a5f9e4e,train,2165,MSA,يجب أن يفهم على هذا,يجب ان يفهم علي هذا,,[],0,pending,,
mt_dial_egy_4d8143d2,train,71082,DIAL_EGY,جامعة عين شمس بكراعاملة حافلة لمحمد حماقى عشان طبعا يلهوا الشباب,جامعه عين شمس بكراعامله حافله لمحمد حماقي عشان طبعا يلهوا الشباب,,[],0,pending,,
mt_dial_glf_028cfa14,train,69751,DIAL_GLF,الله يستر ولله المشي زين اقل شي يحرق السكر الله لا,الله يستر ولله المشي زين اقل شي يحرق السكر الله لا,,[],0,pending,,
mt_dial_lev_580782b0,train,40781,DIAL_LEV,والله مساكين الكوريين حزين عليهم رح يشوفو شي ما,والله مساكين الكوريين حزين عليهم رح يشوفو شي ما,,[],0,pending,,
mt_msa_34d47369,train,40079,MSA,اشكر لك تعليقك وثنائك ونحن نعمل ونصب اعيننا خدمة مجتمعاتنا العربية واثراء ثقافتنا ومعارفنا,اشكر لك تعليقك وثنايك ونحن نعمل ونصب اعيننا خدمه مجتمعاتنا العربيه واثراء ثقافتنا ومعارفنا,,[],0,pending,,
mt_dial_egy_670056a9,train,48261,DIAL_EGY,بس فى غيرك كل يوم بيتهانوا داخل مقر امن الدولة بالاميرية وناس بقالها شهور وزويهم لا تعرف حتى مقابلتهم لا توجد حتى جريمة فعلوها نفسى يتم التحقيق مع ظباط امن الدولة بالاميرية ومعرفة المحتجزون بدون وجهة حق كلمة حق ومطر اقولها لعل وعسى يسمعها مسئول مزال قلبة ينبض بالضمير ! !,بس في غيرك كل يوم بيتهانوا داخل مقر امن الدوله بالاميريه وناس بقالها شهور وزويهم لا تعرف حتي مقابلتهم لا توجد حتي جريمه فعلوها نفسي يتم التحقيق مع ظباط امن الدوله بالاميريه ومعرفه المحتجزون بدون وجهه حق كلمه حق ومطر اقولها لعل وعسي يسمعها مسيول مزال قلبه ينبض بالضمير,,[],0,pending,,
mt_dial_glf_676fa95d,train,36571,DIAL_GLF,والله شركه الزجاج بدات تتنحنح تبي ترفع السعر ه الزجاج مهو مثل,والله شركه الزجاج بدات تتنحنح تبي ترفع السعر ه الزجاج مهو مثل,,[],0,pending,,
mt_dial_lev_23f7718b,train,70995,DIAL_LEV,طول عمرنا نحلب الوطن 00 فيش طريقه نعملها لشطب هذه الديون ؟,طول عمرنا نحلب الوطن 00 فيش طريقه نعملها لشطب هذه الديون,,[],0,pending,,
mt_msa_9575ae24,train,15230,MSA,وهاجمت وسببت توفيق السيد لانك تفول انه ظلم الزمالك ولم يحتسب ضربات جزاء للزمالك وطالبت بعقابه,وهاجمت وسببت توفيق السيد لانك تفول انه ظلم الزمالك ولم يحتسب ضربات جزاء للزمالك وطالبت بعقابه,,[],0,pending,,
mt_dial_egy_cfe075ca,train,15118,DIAL_EGY,وحياه امى لبطلك تكتب بس,وحياه امي لبطلك تكتب بس,,[],0,pending,,
mt_dial_glf_8507cb97,train,62525,DIAL_GLF,الجواب من التخلف اللي قاعد يصير,الجواب من التخلف اللي قاعد يصير,,[],0,pending,,
mt_dial_lev_c7bd6440,train,86211,DIAL_LEV,يعني بصنعوا الحاجه وبعدين بطلعوا فيها مشاكل . . . بس معلومه جيده يا ريت لو توصل للامهات البسيطات الي ثقافتهم تحت خط,يعني بصنعوا الحاجه وبعدين بطلعوا فيها مشاكل بس معلومه جيده يا ريت لو توصل للامهات البسيطات الي ثقافتهم تحت خط,,[],0,pending,,
mt_msa_db755ec2,train,29197,MSA,حرام خيرنا لغيرنا . الاقربون اولى,حرام خيرنا لغيرنا الاقربون اولي,,[],0,pending,,
mt_dial_egy_282768b6,train,73833,DIAL_EGY,يابني ياحبيبي شعب الجزائر ده شعب متخلف ارجوا من سعاتك ان تترك الجزائر وتعيش ولو حتي في الصومال احسنلك وبلاش تستفزوا المصريين احسن المصريين مستحلفين ليكم لو مسكوكم انتم الجانيين علي نفسكم ومع السلامه يابلد العبيد,يابني ياحبيبي شعب الجزاير ده شعب متخلف ارجوا من سعاتك ان تترك الجزاير وتعيش ولو حتي في الصومال احسنلك وبلاش تستفزوا المصريين احسن المصريين مستحلفين ليكم لو مسكوكم انتم الجانيين علي نفسكم ومع السلامه يابلد العبيد,,[],0,pending,,
mt_dial_glf_a06f1b28,train,72367,DIAL_GLF,اذا حطيت اختيار الشبكة في جوالك يدوي ، اختر الشركة العميله لشركتك واهرب من الشركات المنافسه ففرق السعر حوالي 800 % على اقل تقدير,اذا حطيت اختيار الشبكه في جوالك يدوي اختر الشركه العميله لشركتك واهرب من الشركات المنافسه ففرق السعر حوالي 800 علي اقل تقدير,,[],0,pending,,
mt_dial_lev_c19e5380,train,76243,DIAL_LEV,يجب إعلان الدولة الفلسطينية بأسرع وقت و ليصير يصير . . أكتر من هيك ما ضل و عليه يجب جميع الدول العربية بهذه الدولة الفلسطينية قبل اندثار الفكرة و وقف خطط الترانسفير و مخططات الوطن البديل . لا مجال للإنتظار أكثر من هذا . . على الاقل يتم الإعلان و في المستقبل يتم تحسين الأمور و بإذن الله ربنا,يجب اعلان الدوله الفلسطينيه باسرع وقت و ليصير يصير اكتر من هيك ما ضل و عليه يجب جميع الدول العربيه بهذه الدوله الفلسطينيه قبل اندثار الفكره و وقف خطط الترانسفير و مخططات الوطن البديل لا مجال للانتظار اكثر من هذا علي الاقل يتم الاعلان و في المستقبل يتم تحسين الامور و باذن الله ربنا,,[],0,pending,,
mt_msa_8d5bf6dc,train,2971,MSA,اقترح عمل اجتماع داخل الكعبه المشرفه يضم كل الرؤساء العرب .,اقترح عمل اجتماع داخل الكعبه المشرفه يضم كل الروساء العرب,,[],0,pending,,
mt_dial_egy_5373a62f,train,34863,DIAL_EGY,ياريت كل الوزراء زي بدر كفاية اهمال و تسيب الاولاد عقولهم اصبحت,ياريت كل الوزراء زي بدر كفايه اهمال و تسيب الاولاد عقولهم اصبحت,,[],0,pending,,
mt_dial_glf_c7a43806,train,70636,DIAL_GLF,الله يسعدك ويوفقك على هآلمقآل آلصريح وآلقوي وآللي فعلآ فعلآ فعلآ,الله يسعدك ويوفقك علي هالمقال الصريح والقوي واللي فعلا فعلا فعلا,,[],0,pending,,
mt_dial_lev_bf97327b,train,15467,DIAL_LEV,"و "" علويت "" ( يا ريت ) كل الدكاترة مثلك ياأبو",و علويت يا ريت كل الدكاتره مثلك ياابو,,[],0,pending,,
mt_msa_b29b0cd8,train,11703,MSA,حقه دون اطلاق نار من منطلق قول الله تعالى وان,حقه دون اطلاق نار من منطلق قول الله تعالي وان,,[],0,pending,,
mt_dial_egy_73457bda,train,70209,DIAL_EGY,انا ام حبيبة ارجو ان اعرف شاهد العيان هناك محضر فى نيابة 6 اكتوبر ارجوك روح ادلى بشهادة الحق العندك الله يخليلك,انا ام حبيبه ارجو ان اعرف شاهد العيان هناك محضر في نيابه 6 اكتوبر ارجوك روح ادلي بشهاده الحق العندك الله يخليلك,,[],0,pending,,
mt_dial_glf_b9be4928,train,53647,DIAL_GLF,البرطم يمثل ? ? ? من اجمالي مساحه الوجه . اعتقد ان الموضوع فيه لبس :,البرطم يمثل من اجمالي مساحه الوجه اعتقد ان الموضوع فيه لبس,,[],0,pending,,
mt_dial_lev_af0416f8,train,57183,DIAL_LEV,انا لما قريت العنوان فكرت انه ما لقي في البيت شي عشان هيك اشتكى,انا لما قريت العنوان فكرت انه ما لقي في البيت شي عشان هيك اشتكي,,[],0,pending,,
mt_msa_1bf8dcdf,train,58233,MSA,ولو خسرت ولعبت الافضل وظلمت سيعملون منك,ولو خسرت ولعبت الافضل وظلمت سيعملون منك,,[],0,pending,,
mt_dial_egy_612b0515,train,77259,DIAL_EGY,انا زملكاوي و لكن الحق يقال ان شوبير هو من طور البرنامج الرياضي بلا شك اما انت ايها المتلون علاء صادق فانت صاحب الريادة في الفتنة و مهاجمة الشرفاء فأنت من افسد النقد الرياضي في مصر و انت من تحارب الحكام لأهوائك الشخصية فاخطاء الحكام في اعظم بلاد الكورة و ها هو تشيلسي يهزم مانشستر بهدف تسلل فاضح في قمة الدوري الانجليزي و قد يكون هذا الهدف هو سبب فوز تشيلسي بالبريمير ليج و ما ادراك ما البرمير,انا زملكاوي و لكن الحق يقال ان شوبير هو من طور البرنامج الرياضي بلا شك اما انت ايها المتلون علاء صادق فانت صاحب الرياده في الفتنه و مهاجمه الشرفاء فانت من افسد النقد الرياضي في مصر و انت من تحارب الحكام لاهوايك الشخصيه فاخطاء الحكام في اعظم بلاد الكوره و ها هو تشيلسي يهزم مانشستر بهدف تسلل فاضح في قمه الدوري الانجليزي و قد يكون هذا الهدف هو سبب فوز تشيلسي بالبريمير ليج و ما ادراك ما البرمير,,[],0,pending,,
mt_dial_glf_e578586c,train,20687,DIAL_GLF,أنتم شايفين عندنا إنقاذ مثل 911 على هالثقه ؟ ولا شايفين مهتمين بالمواطنين وحاطين سياج على الأماكن الخطره ولا حتى لوحات إرشاديه ؟ ولا شايفينهم مسوين تصريف سيول مثل الخلق ؟ ! أنتبهوا لأنفسكم .,انتم شايفين عندنا انقاذ مثل 911 علي هالثقه ولا شايفين مهتمين بالمواطنين وحاطين سياج علي الاماكن الخطره ولا حتي لوحات ارشاديه ولا شايفينهم مسوين تصريف سيول مثل الخلق انتبهوا لانفسكم,,[],0,pending,,
mt_dial_lev_17cce800,train,69975,DIAL_LEV,ولله ولله لو كل دول العالم بها ملك مثل ملكنا لما كان هناك اية مشكله دائما & quot ; شاعر مع مواطنيه من كل قلبه الله يطول عمره بالصحه والعافيه ويبقى فوق روؤسنا جميعا & quot ; وياريت يا سيدنا بان يقوم القطاع الخاص ويعدل الرواتب والاجور ويشعر,ولله ولله لو كل دول العالم بها ملك مثل ملكنا لما كان هناك ايه مشكله دايما quot شاعر مع مواطنيه من كل قلبه الله يطول عمره بالصحه والعافيه ويبقي فوق رووسنا جميعا quot وياريت يا سيدنا بان يقوم القطاع الخاص ويعدل الرواتب والاجور ويشعر,,[],0,pending,,
mt_msa_601ba3e2,train,50533,MSA,نفذتم قرارات الامين بحق عمان والعمانين وجاء وقتكم .,نفذتم قرارات الامين بحق عمان والعمانين وجاء وقتكم,,[],0,pending,,
