example_id,source_split,source_row_id,dialect,original_text,normalized_text,masked_text,mask_spans_json,mask_count,annotation_status,annotator_model,notes
mt_dial_egy_793f7dda,train,14633,DIAL_EGY,بصرف النظر عن اى اراء قد يتفق البعض فيها ويختلف البعض الاخر عن من احق بالتاهل لكاس العالم ؟ ؟ لكن الفرق الوحيد الذى اراة ظاهرا بقوة للجميع هو تعامل الحكومتين المصرية والجزائرية مع الازمة لاول مرة ارى هذة الهمجية من حكومة واقصد الجزائرية طبعا فمهما حدث ففى النهاية هناك مصالح دول وشعوب لابد ان تقدم على مصالح الافراد والله ان في هذة الايام تحسرت على الاسلام والعرب وتخيلت الامريكان واليهود يحتسون الخمر بمنتهى اللذة وهم يتابعون اخبارنا ويقولون لبعضهم لقد اقتربنا كثيرا جدا من هدفنا . . . اول مرة اشوف رئيس دولة يحشد جيوشة من اجل كرة قدم ياريتك وديتهم فلسطين مادمت بالهمة دى جاتكوا ستين خيبة حكومة خايبة بتدارى على خيبتها بشوية بلطجية واكيد ان فية جزائريين محترمين وهم كثر ولن نصدق مهما اقنعتنا وسائل الاعلام ان دول هم شعب الجزائر كما لم نصدق ان شعب مصر عبارة عن فنانات العري هناك شرفاء من هنا وهناك ولكن للاسف ليس من صالح الجميع ان يظهروا على الساحة . . . كان يجب ع الحكومة الجزائرية التصرف بحكمة وعقلانية تصرف القادة ولكن ما رايناة لايعبر عن تصرف عسكرى,بصرف النظر عن اي اراء قد يتفق البعض فيها ويختلف البعض الاخر عن من احق بالتاهل لكاس العالم لكن الفرق الوحيد الذي اراه ظاهرا بقوه للجميع هو تعامل الحكومتين المصريه والجزايريه مع الازمه لاول مره اري هذه الهمجيه من حكومه واقصد الجزايريه طبعا فمهما حدث ففي النهايه هناك مصالح دول وشعوب لابد ان تقدم علي مصالح الافراد والله ان في هذه الايام تحسرت علي الاسلام والعرب وتخيلت الامريكان واليهود يحتسون الخمر بمنتهي اللذه وهم يتابعون اخبارنا ويقولون لبعضهم لقد اقتربنا كثيرا جدا من هدفنا اول مره اشوف رييس دوله يحشد جيوشه من اجل كره قدم ياريتك وديتهم فلسطين مادمت بالهمه دي جاتكوا ستين خيبه حكومه خايبه بتداري علي خيبتها بشويه بلطجيه واكيد ان فيه جزايريين محترمين وهم كثر ولن نصدق مهما اقنعتنا وسايل الاعلام ان دول هم شعب الجزاير كما لم نصدق ان شعب مصر عباره عن فنانات العري هناك شرفاء من هنا وهناك ولكن للاسف ليس من صالح الجميع ان يظهروا علي الساحه كان يجب ع الحكومه الجزايريه التصرف بحكمه وعقلانيه تصرف القاده ولكن ما رايناه لايعبر عن تصرف عسكري,,[],0,pending,,
mt_dial_glf_37094f66,train,44820,DIAL_GLF,يفرزها الجسم بس عند الكويكبي,يفرزها الجسم بس عند الكويكبي,,[],0,pending,,
mt_dial_lev_c5b77d5a,train,27994,DIAL_LEV,لما قرأت كلمة دعم حكيت دعم البترول دعم الخبز دعم المحتاجين دعم الفقراء بالاخر طلعت دعم محمد رمضان مبارح كان في مقابله مع ابو محمد رمضان كأنه على مزاج اف ام بحكي انه الاردن كلها بتمر بوقت عصبي وانه هو بمثل الاردن طبعا ما حبيت ارفع ضغط اكثر من هيك وغيرت عن المحطة هلا زين وامنية واورنج بسرقو من الرصيد وما حدا بنتبه انا مني وعليه أكيد ما راح اصوت مين هو وبشو راح يمثل الاردن راح يطلع يرقص ويغني ويلم,لما قرات كلمه دعم حكيت دعم البترول دعم الخبز دعم المحتاجين دعم الفقراء بالاخر طلعت دعم محمد رمضان مبارح كان في مقابله مع ابو محمد رمضان كانه علي مزاج اف ام بحكي انه الاردن كلها بتمر بوقت عصبي وانه هو بمثل الاردن طبعا ما حبيت ارفع ضغط اكثر من هيك وغيرت عن المحطه هلا زين وامنيه واورنج بسرقو من الرصيد وما حدا بنتبه انا مني وعليه اكيد ما راح اصوت مين هو وبشو راح يمثل الاردن راح يطلع يرقص ويغني ويلم,,[],0,pending,,
mt_msa_7c2b9742,train,49199,MSA,"حقيقي برافو حنان شومان . . لقد اصبتي كبد الجقيقة . . والف برافو حنان شومان . . لقد امتلكتي شجاعة هانت علي فرسان الاعلام الذين يملأون الدنيا ضجيج وصخب . لقد كنت اول اعلامية تنطق اسم "" مرتضي منصور "" مجرد من اي القاب . . وهذا لاول مرة اراه في اعلامنا المنبطح والمرتعش . . كلمة شكر تستحقينها وجبت علينا . . وكلمات رثاء . . يستحقها الاعلام فقد تسببوا في تسمم 80 مليون مصري واصابتهم بالغثيان من تلك المهزلة الاعلامية . . "" صلح مرتضي وشوبير "" . . اخشي مااخشاه ان اجدك مطاردة ب 50 قضية سب وقذف من وراء اجتراءك علي قول كلمة حق . وانا لله وانا اليه راجعون """,حقيقي برافو حنان شومان لقد اصبتي كبد الجقيقه والف برافو حنان شومان لقد امتلكتي شجاعه هانت علي فرسان الاعلام الذين يملاون الدنيا ضجيج وصخب لقد كنت اول اعلاميه تنطق اسم مرتضي منصور مجرد من اي القاب وهذا لاول مره اراه في اعلامنا المنبطح والمرتعش كلمه شكر تستحقينها وجبت علينا وكلمات رثاء يستحقها الاعلام فقد تسببوا في تسمم 80 مليون مصري واصابتهم بالغثيان من تلك المهزله الاعلاميه صلح مرتضي وشوبير اخشي مااخشاه ان اجدك مطارده ب 50 قضيه سب وقذف من وراء اجتراءك علي قول كلمه حق وانا لله وانا اليه راجعون,,[],0,pending,,
mt_dial_egy_0a908527,train,24184,DIAL_EGY,"يااخ عدلى لا تطمئن بمن حولك منهم فهم عبيد لاى محافظ اخر يأتى غيرك واسأل من قبلك من المحافظين شوف هم بيتصلوا بمين فيهم بعد ما يقع من على الكرسى وبطل بأه تصريحاتك دى احس خلاص انت اصبحت كارت "" . . . "" واشرب قرفة ونعناع احسن ؟ ؟",يااخ عدلي لا تطمين بمن حولك منهم فهم عبيد لاي محافظ اخر ياتي غيرك واسال من قبلك من المحافظين شوف هم بيتصلوا بمين فيهم بعد ما يقع من علي الكرسي وبطل باه تصريحاتك دي احس خلاص انت اصبحت كارت واشرب قرفه ونعناع احسن,,[],0,pending,,
mt_dial_glf_ddb5c7a0,train,26653,DIAL_GLF,والله عيب ترى ترجع على الشاب,والله عيب تري ترجع علي الشاب,,[],0,pending,,
mt_dial_lev_d50edacc,train,6839,DIAL_LEV,واذا طلع الوحدات بالبطولة التنشيطية يحمدوا,واذا طلع الوحدات بالبطوله التنشيطيه يحمدوا,,[],0,pending,,
mt_msa_efdd7db3,train,58300,MSA,أو مكتب CIA الذي قام مديره باغتصاب نسائكم وعاد إلى بلده ولم يقل له مخنث عندكم نصف كلمة . . . بل إن التحقيق في الموضوع تم في أمريكا وكأن الموضوع لا,او مكتب CIA الذي قام مديره باغتصاب نسايكم وعاد الي بلده ولم يقل له مخنث عندكم نصف كلمه بل ان التحقيق في الموضوع تم في امريكا وكان الموضوع لا,,[],0,pending,,
mt_dial_egy_ad64f824,train,81532,DIAL_EGY,وانا شوفت امبارح لقاء مع الاستاذ جورج اسحق احد المشاركين فى هذه المظاهرات و معه الاستاذ صلاح عيسى و اتفقوا امبارح على ان هذه المظاهرات كانت ايجابيه ووضعت الحكومه فى موقف حرج واستنكروا عدوان الحكومه على المتظاهرين وان الذى يحدث هو نتيجه لسياسات الحزب من 30 سنه وانها تراكمات وثورات على فترات متباعده وانه حان الوقت للتغيير الديموقراطى فى مصر واشار الاستاذ جورج اسحق ان للحريه ثمن يدفع وانه مفيش حاجه حتتغير فى مصر بين يوم وليله والتغيير لن يكون سهلا ولا,وانا شوفت امبارح لقاء مع الاستاذ جورج اسحق احد المشاركين في هذه المظاهرات و معه الاستاذ صلاح عيسي و اتفقوا امبارح علي ان هذه المظاهرات كانت ايجابيه ووضعت الحكومه في موقف حرج واستنكروا عدوان الحكومه علي المتظاهرين وان الذي يحدث هو نتيجه لسياسات الحزب من 30 سنه وانها تراكمات وثورات علي فترات متباعده وانه حان الوقت للتغيير الديموقراطي في مصر واشار الاستاذ جورج اسحق ان للحريه ثمن يدفع وانه مفيش حاجه حتتغير في مصر بين يوم وليله والتغيير لن يكون سهلا ولا,,[],0,pending,,
mt_dial_glf_2c497efa,train,46355,DIAL_GLF,كان ودي أن تذكروا ولو قصص من أحد افراد جهاز الهيئة حتى تسمعوا العجب,كان ودي ان تذكروا ولو قصص من احد افراد جهاز الهييه حتي تسمعوا العجب,,[],0,pending,,
mt_dial_lev_3703e887,train,54105,DIAL_LEV,والله مو لاقين اشي تحكو مو شاطرين الا على بعض,والله مو لاقين اشي تحكو مو شاطرين الا علي بعض,,[],0,pending,,
mt_msa_7b0aa96d,train,83097,MSA,* ملاحظات : - ستتوقف المباره 10 دقائق للاعتراض الرمثانه على الهدف الثانئ لعامر,ملاحظات ستتوقف المباره 10 دقايق للاعتراض الرمثانه علي الهدف الثاني لعامر,,[],0,pending,,
mt_dial_egy_11583a36,train,5050,DIAL_EGY,روحي شوفي حسين فين . . واكلي ابو حسين بدل ما انتي دايره ورا كل خبر,روحي شوفي حسين فين واكلي ابو حسين بدل ما انتي دايره ورا كل خبر,,[],0,pending,,
mt_dial_glf_335c287a,train,25407,DIAL_GLF,هل وصلت او تصير مثل المئة الف اللى وعدبها الاداره قبل موسمين والى هالحين ما شفناها حتى على حساب الخلود وده يترزز بس لايطلع بكرا ويقول انا اللى صعدت الفريق للممتاز ترى له اذناب من نادينا يستغلون هالفوز ويجيرونه للبلطان على حساب اناس ضحو من اجل الكيان ولا يهون دوح,هل وصلت او تصير مثل الميه الف اللي وعدبها الاداره قبل موسمين والي هالحين ما شفناها حتي علي حساب الخلود وده يترزز بس لايطلع بكرا ويقول انا اللي صعدت الفريق للممتاز تري له اذناب من نادينا يستغلون هالفوز ويجيرونه للبلطان علي حساب اناس ضحو من اجل الكيان ولا يهون دوح,,[],0,pending,,
mt_dial_lev_12b64303,train,60494,DIAL_LEV,الله يرزقك أحسن منها . زوجة تملك الدين والايمان تهنيك في الدنيا وتكون زوجة لك في الآخرة في جنات النعيم . والى الاخ ابو الحظوظ أكيد لو أنك بار في أمك والله لن تسمع منها إلا الدعوات والرضا عليك يا أخي . أرجو ان تكون بارا بوالديك لكي تسمع دعوات الرضا . وأكيد ما في لا كنافة ولا مبرومة . في كيك وعصير بس,الله يرزقك احسن منها زوجه تملك الدين والايمان تهنيك في الدنيا وتكون زوجه لك في الاخره في جنات النعيم والي الاخ ابو الحظوظ اكيد لو انك بار في امك والله لن تسمع منها الا الدعوات والرضا عليك يا اخي ارجو ان تكون بارا بوالديك لكي تسمع دعوات الرضا واكيد ما في لا كنافه ولا مبرومه في كيك وعصير بس,,[],0,pending,,
mt_msa_03374c70,train,64728,MSA,وهذا اكبر دليل على اهمال مديرى المدارس للمدرسين ونشر النظام داخل المدرسة,وهذا اكبر دليل علي اهمال مديري المدارس للمدرسين ونشر النظام داخل المدرسه,,[],0,pending,,
mt_dial_egy_c175431a,train,8728,DIAL_EGY,ومن حقنا نفرح بين اهلنا وناسنا ومن حقنا نرفع بين الخلايق راسنا ومن حقنا نقول عشنا فى عصر كمال دا اللى ماعاشى فى عصره عمره ماكان له لازمة . . . حمدالله على السلامة يامعالى الوزير نسال الله ان يتمم شفائك على خير يامن وهبت حياتك لمصر الغالية على المستوى العام ولمركز الباجور على المستوى الخاص . . . هنيئا لنا,ومن حقنا نفرح بين اهلنا وناسنا ومن حقنا نرفع بين الخلايق راسنا ومن حقنا نقول عشنا في عصر كمال دا اللي ماعاشي في عصره عمره ماكان له لازمه حمدالله علي السلامه يامعالي الوزير نسال الله ان يتمم شفايك علي خير يامن وهبت حياتك لمصر الغاليه علي المستوي العام ولمركز الباجور علي المستوي الخاص هنييا لنا,,[],0,pending,,
mt_dial_glf_a7d25b14,train,15297,DIAL_GLF,اتوقع نسيت او ماشفت التقرير حادث السيارة اللي طاحت بحفريات بطريق الملك عبدالله بسبب ان السائق لف مع طريق مافيه اي لوحه وهو طريق حفره ماهو طريق سالك,اتوقع نسيت او ماشفت التقرير حادث السياره اللي طاحت بحفريات بطريق الملك عبدالله بسبب ان السايق لف مع طريق مافيه اي لوحه وهو طريق حفره ماهو طريق سالك,,[],0,pending,,
mt_dial_lev_f6d754d7,train,15049,DIAL_LEV,*عامر شفيع الحمد لله عالسلامه ولك مقال خاص بعد قليل ( بصراحه تامه,عامر شفيع الحمد لله عالسلامه ولك مقال خاص بعد قليل بصراحه تامه,,[],0,pending,,
mt_msa_36b9a29e,train,27664,MSA,يكفي طلوعكم على ظهور الاندية من لجانكم,يكفي طلوعكم علي ظهور الانديه من لجانكم,,[],0,pending,,
