example_id,source_split,source_row_id,dialect,original_text,normalized_text,masked_text,mask_spans_json,mask_count,annotation_status,annotator_model,notes
mt_dial_egy_e1eb9829,train,75707,DIAL_EGY,و جورج اسحاق طبعا وزير البيئة لانه لازم يبقى مسيحى,و جورج اسحاق طبعا وزير البييه لانه لازم يبقي مسيحي,,[],0,pending,,
mt_dial_glf_9c7caffa,train,72485,DIAL_GLF,ربك يحلها طال عمرك والهلال بعون الله قادر يتعدى هالمعمعه اللي حصلت من لجنه الانضباط,ربك يحلها طال عمرك والهلال بعون الله قادر يتعدي هالمعمعه اللي حصلت من لجنه الانضباط,,[],0,pending,,
mt_dial_lev_b7a75437,train,34759,DIAL_LEV,أنا شاب وعرسي بعد شهرين بإذن الله ولا أكترث لبدلة عروستي وشكلها وثمنها ولا أهتم أيضا لبدلتي ولو كان بمقدوري الزواج دون إقامة عرس لأنها شكليات ولا تعبر بالضرورة عن سعادة العروسين والعرس بمجمل تفاصيله محرم في الدين الإسلامي فكيف يجلس الرجل وهو العريس بين مئات الفتيات في الصالة ويرقصن أمامه !,انا شاب وعرسي بعد شهرين باذن الله ولا اكترث لبدله عروستي وشكلها وثمنها ولا اهتم ايضا لبدلتي ولو كان بمقدوري الزواج دون اقامه عرس لانها شكليات ولا تعبر بالضروره عن سعاده العروسين والعرس بمجمل تفاصيله محرم في الدين الاسلامي فكيف يجلس الرجل وهو العريس بين ميات الفتيات في الصاله ويرقصن امامه,,[],0,pending,,
mt_msa_f473a2d0,train,27333,MSA,أتمنى أن ينعكس ذلك التعاون على مدينة جده من خلال الاستفادة من تدريس الطلاب السعوديين في الجامعة الكندية وعندما يتخرجوا يقام توظيفهم كل حسب تخصصه بدل العمالة المتخلفة التي أقحمت نفسها على المجتمع السعودي بعدما تهربت عن قوافل الحجاج العائدين إلى بلدانهم ولن يتم ذلك إلا إذا أحللنا المقيم ورحبنا,اتمني ان ينعكس ذلك التعاون علي مدينه جده من خلال الاستفاده من تدريس الطلاب السعوديين في الجامعه الكنديه وعندما يتخرجوا يقام توظيفهم كل حسب تخصصه بدل العماله المتخلفه التي اقحمت نفسها علي المجتمع السعودي بعدما تهربت عن قوافل الحجاج العايدين الي بلدانهم ولن يتم ذلك الا اذا احللنا المقيم ورحبنا,,[],0,pending,,
mt_dial_egy_754f6428,train,14554,DIAL_EGY,هما مدير المدرسة و الزائرة الصحية ذنبهم ايه ؟,هما مدير المدرسه و الزايره الصحيه ذنبهم ايه,,[],0,pending,,
mt_dial_glf_381b0129,train,69066,DIAL_GLF,طيب ليش ما رفعوا ايقاف الدوخي ؟ الكل اتفق انه ما يستحق الطرد اما الاهلي مو نفس الشي رفعوه عن الدوسري,طيب ليش ما رفعوا ايقاف الدوخي الكل اتفق انه ما يستحق الطرد اما الاهلي مو نفس الشي رفعوه عن الدوسري,,[],0,pending,,
mt_dial_lev_c3b2e93b,train,6449,DIAL_LEV,ويعطيكو العافية يا نشامى الزعيم على المجهود واللعب الجميل ولكن الحظ عاندكم يوم امس ولم يكن بالامكان افضل مما كان وهذه حال كرة القدم . . فائز وخاسر . . ويكفينا الدوري والدرع هذا الموسم وان كنا نطمح بان يكون الكاس ثالثهما ولكن قدر الله وما شاء,ويعطيكو العافيه يا نشامي الزعيم علي المجهود واللعب الجميل ولكن الحظ عاندكم يوم امس ولم يكن بالامكان افضل مما كان وهذه حال كره القدم فايز وخاسر ويكفينا الدوري والدرع هذا الموسم وان كنا نطمح بان يكون الكاس ثالثهما ولكن قدر الله وما شاء,,[],0,pending,,
mt_msa_dbe437a6,train,20368,MSA,الله يرحمها ويغفر لها هذا اجلها,الله يرحمها ويغفر لها هذا اجلها,,[],0,pending,,
mt_dial_egy_e0b5a8fe,train,73255,DIAL_EGY,مع العلم انا مواطن عادي جدآ ومش شغال في,مع العلم انا مواطن عادي جدا ومش شغال في,,[],0,pending,,
mt_dial_glf_6e5fc9d7,train,19348,DIAL_GLF,ه قسمن اني آمنت بمن خلق,ه قسمن اني امنت بمن خلق,,[],0,pending,,
mt_dial_lev_e758a06e,train,5798,DIAL_LEV,كل يوم بقرا الجريده بتفاجئ انو في حد مقتول او معتدى عليه او حوادث سير شو الحكايه يا جماعه ؟,كل يوم بقرا الجريده بتفاجي انو في حد مقتول او معتدي عليه او حوادث سير شو الحكايه يا جماعه,,[],0,pending,,
mt_msa_38ecaf1b,train,13876,MSA,إنها قد تكون وعود صادقة من الرئيس الامريكى اوباما فى ان يكون عهده افضل ممن سبقه فى تحقيق السلام المنشود فى الشرق الاوسط ، وحل القضية الصراع العربى الاسرائيلى ، ولكن الكلام والوعود شئ والامر الواقع شئ اخر ، وقد اعترف اوباما نفسه بانه لم يكن يتوقع بالصعوبات والتعقيدات التى واجهته فى ان يكون هناك اتفاق,انها قد تكون وعود صادقه من الرييس الامريكي اوباما في ان يكون عهده افضل ممن سبقه في تحقيق السلام المنشود في الشرق الاوسط وحل القضيه الصراع العربي الاسراييلي ولكن الكلام والوعود شي والامر الواقع شي اخر وقد اعترف اوباما نفسه بانه لم يكن يتوقع بالصعوبات والتعقيدات التي واجهته في ان يكون هناك اتفاق,,[],0,pending,,
mt_dial_egy_c74549ed,train,32838,DIAL_EGY,الاخ الحبيب مصيلحى ابشرك النادى رايح فى داهيه بسبب سلبيتك يا سياده النائب كفايه ظهور فى البرامج التليفزيونيه و اصحى و فوق انت و مجلسك ابو لسان طويل وشتائم وبطل كلمه فلان ده راجل محترم ( اللازمه اللى فى لسانك دايما ) النادى خرب روح افتح لك نادى فى الحضره و اعمل اول عضويه لعادل شكل وباقى رفاقه و مبروك عليك كابرال للاسف الشديد انا و الله العظيم انا نادم على صوتى اللى اعطيته,الاخ الحبيب مصيلحي ابشرك النادي رايح في داهيه بسبب سلبيتك يا سياده النايب كفايه ظهور في البرامج التليفزيونيه و اصحي و فوق انت و مجلسك ابو لسان طويل وشتايم وبطل كلمه فلان ده راجل محترم اللازمه اللي في لسانك دايما النادي خرب روح افتح لك نادي في الحضره و اعمل اول عضويه لعادل شكل وباقي رفاقه و مبروك عليك كابرال للاسف الشديد انا و الله العظيم انا نادم علي صوتي اللي اعطيته,,[],0,pending,,
mt_dial_glf_a5695453,train,20691,DIAL_GLF,ولما ذاق الم الكوع طالبو بايقاف من ضربه ولسان حالهم,ولما ذاق الم الكوع طالبو بايقاف من ضربه ولسان حالهم,,[],0,pending,,
mt_dial_lev_f11f8dc8,train,54398,DIAL_LEV,بصراحة مش مستوعب ؟ ؟ ؟ ! ! ! ؟ ؟ ؟ كيف حد الفقر 46 دينار شو هاد كفيف بقيسوها على اجار البيوت و لا مثلا الفقير فقط بياكل شاي و خبزا مثلا . . . الرجاء توضيح سلة الغذاء للفقير و كيفية قياسها,بصراحه مش مستوعب كيف حد الفقر 46 دينار شو هاد كفيف بقيسوها علي اجار البيوت و لا مثلا الفقير فقط بياكل شاي و خبزا مثلا الرجاء توضيح سله الغذاء للفقير و كيفيه قياسها,,[],0,pending,,
mt_msa_a099f716,train,50171,MSA,2 - قام بإثارة الجمهور ( العام ) و هذه قضية أمن,2 قام باثاره الجمهور العام و هذه قضيه امن,,[],0,pending,,
mt_dial_egy_d4623380,train,45161,DIAL_EGY,> ولا حركات ولا مظاهرات . . . الظلم خلاص ولى,ولا حركات ولا مظاهرات الظلم خلاص ولي,,[],0,pending,,
mt_dial_glf_ce379929,train,23808,DIAL_GLF,والغيرة شي طبيعي في النساء شلون لو كانت ام بس عاد ماتزودها,والغيره شي طبيعي في النساء شلون لو كانت ام بس عاد ماتزودها,,[],0,pending,,
mt_dial_lev_6f4a3999,train,21315,DIAL_LEV,لف في الأردن و شوف الناس ! ! ! الناس جاعت و صارت تاكل ببعض . . زعران و جرائم و سرقات ! !,لف في الاردن و شوف الناس الناس جاعت و صارت تاكل ببعض زعران و جرايم و سرقات,,[],0,pending,,
mt_msa_0e7f1258,train,7944,MSA,عدد ايام الشهر 30 * 210 ربحه اليومي = 6300 ريال,عدد ايام الشهر 30 210 ربحه اليومي 6300 ريال,,[],0,pending,,
mt_dial_egy_4d13edf5,train,7610,DIAL_EGY,موضوع حلو اوى وكتابة متميزة برافو يا,موضوع حلو اوي وكتابه متميزه برافو يا,,[],0,pending,,
mt_dial_glf_f60c6f3a,train,16995,DIAL_GLF,لو ما تعقل انت وياه لا اجيب الزبيريه وارنك على,لو ما تعقل انت وياه لا اجيب الزبيريه وارنك علي,,[],0,pending,,
mt_dial_lev_23cc4207,train,79563,DIAL_LEV,للاخ سمور لا تهتم لا احد اخبارك كتير ممتعا وبتمنا كل يوم,للاخ سمور لا تهتم لا احد اخبارك كتير ممتعا وبتمنا كل يوم,,[],0,pending,,
mt_msa_72c0ea24,train,2229,MSA,يا سيد أحمد كلما اقترب موعد المونديال العالمي في جنوب القارة التي نسكن شمالها و نقف على بوابتها الشرقية ازدادت الحسرة لأنك و رفاقك قد أضعتم الفرصة التي كانت قاب قوسين أو أدنى . . و فشلتم فشلا ذريعا يدون في تاريخك و زملائك يا من تبحث عن عمادة لاعبي العالم على حساب تاريخ الكرة في مصر .,يا سيد احمد كلما اقترب موعد المونديال العالمي في جنوب القاره التي نسكن شمالها و نقف علي بوابتها الشرقيه ازدادت الحسره لانك و رفاقك قد اضعتم الفرصه التي كانت قاب قوسين او ادني و فشلتم فشلا ذريعا يدون في تاريخك و زملايك يا من تبحث عن عماده لاعبي العالم علي حساب تاريخ الكره في مصر,,[],0,pending,,
mt_dial_egy_a67d7e9e,train,75680,DIAL_EGY,مين اللى سمح باستيراد هذه الأجهزة مش الحكومة خلاص تدفع الثمن وتعويض للمواطنين عن الأضرار الناجمة عن هذا,مين اللي سمح باستيراد هذه الاجهزه مش الحكومه خلاص تدفع الثمن وتعويض للمواطنين عن الاضرار الناجمه عن هذا,,[],0,pending,,
mt_dial_glf_0135c9f4,train,30320,DIAL_GLF,مضبط الشنب قبل السفر يبي يعذبهم,مضبط الشنب قبل السفر يبي يعذبهم,,[],0,pending,,
mt_dial_lev_11e79b1d,train,17482,DIAL_LEV,يا جماعة انا حاب اعرف تفاصيل ديوني ! ! من وين ايجو ! لاني ما بعزكت ايشي ، نمشي الحيط الحيط .,يا جماعه انا حاب اعرف تفاصيل ديوني من وين ايجو لاني ما بعزكت ايشي نمشي الحيط الحيط,,[],0,pending,,
mt_msa_f12584c3,train,27073,MSA,الجزيرة تضع دستورا جديدا لمصر و تختار مرشحا للرئاسة المصرية,الجزيره تضع دستورا جديدا لمصر و تختار مرشحا للرياسه المصريه,,[],0,pending,,
mt_dial_egy_b5741e09,train,58488,DIAL_EGY,دا كلام جرايد المحافظ فى مكتبة والتقارير بتقول تمام يا فندم فقط . . . ينزل بنقفسة يتابع يشوف احوال المحافظة والرشاوى المنتشرة ( معاى موافقة المحافظ وموافقة وزير التعليم ومش عارف احول ابنى علشان مش عايز ادفع رشوة ) ينزل يشوف مديرة التجريبيان هنذادة وجبروتها وكلامها انها هى الكل فى الكل وان هى المحافظ ورضاها اهم شئ فى,دا كلام جرايد المحافظ في مكتبه والتقارير بتقول تمام يا فندم فقط ينزل بنقفسه يتابع يشوف احوال المحافظه والرشاوي المنتشره معاي موافقه المحافظ وموافقه وزير التعليم ومش عارف احول ابني علشان مش عايز ادفع رشوه ينزل يشوف مديره التجريبيان هنذاده وجبروتها وكلامها انها هي الكل في الكل وان هي المحافظ ورضاها اهم شي في,,[],0,pending,,
mt_dial_glf_57d665e2,train,1635,DIAL_GLF,اللي دآيمآ لهم السبق في تحقيق أي لقب .,اللي دايما لهم السبق في تحقيق اي لقب,,[],0,pending,,
mt_dial_lev_4d5441a5,train,73351,DIAL_LEV,الحمد لله رب العالمين . . . إنه طلعلي,الحمد لله رب العالمين انه طلعلي,,[],0,pending,,
mt_msa_9142df4a,train,73029,MSA,عليهم أن يشاركوا في جمع توقيعات تعديل الدستور كما فعلوا منذ أشهر لجمع توقيعات ضد الجدار الفولاذي و استخدموا كل قدرات الجماعة سواء على الأرض أو نوافذها الإعلامية عبر مواقع,عليهم ان يشاركوا في جمع توقيعات تعديل الدستور كما فعلوا منذ اشهر لجمع توقيعات ضد الجدار الفولاذي و استخدموا كل قدرات الجماعه سواء علي الارض او نوافذها الاعلاميه عبر مواقع,,[],0,pending,,
mt_dial_egy_c5c9b0c3,train,76216,DIAL_EGY,من ستر مؤمن ستر الله عليه يوم القيامه ومن فرج كربه عن مؤمن فرج عليه الله كربه من كرب يوم القيامه اللهم فرج كربه الكابتن شوبير يا رب السيد المنتشار او الموجود فى كل حتى ناقص افتح الحنفيه ينزل منها قلبه غلف لا يسمع الا نفسه فقط كل لما يتكلم يفضل يقول انا مستشار وقاضى سابق ومحامى وعضو مجلس شعب سابق ورئيس مجلس ادارة نادى الزمالك سابق من كتر ما رددها نفس الجمله حفظتها بالترتيب اللى بيقوله عرفته مين عنده الغرور والتعالى والكبر الراجل اعتذر عايز ايه تانى يميل يبوس ايدك ايه الله اكبر يا اخى ارحم ربنا عزوجل بيرحم وانت من طين مش من دهب يعنى اتق الله,من ستر مومن ستر الله عليه يوم القيامه ومن فرج كربه عن مومن فرج عليه الله كربه من كرب يوم القيامه اللهم فرج كربه الكابتن شوبير يا رب السيد المنتشار او الموجود في كل حتي ناقص افتح الحنفيه ينزل منها قلبه غلف لا يسمع الا نفسه فقط كل لما يتكلم يفضل يقول انا مستشار وقاضي سابق ومحامي وعضو مجلس شعب سابق ورييس مجلس اداره نادي الزمالك سابق من كتر ما رددها نفس الجمله حفظتها بالترتيب اللي بيقوله عرفته مين عنده الغرور والتعالي والكبر الراجل اعتذر عايز ايه تاني يميل يبوس ايدك ايه الله اكبر يا اخي ارحم ربنا عزوجل بيرحم وانت من طين مش من دهب يعني اتق الله,,[],0,pending,,
mt_dial_glf_5b2678ba,train,79608,DIAL_GLF,ياليت الهلال يلعب بالصف الثالث عشان,ياليت الهلال يلعب بالصف الثالث عشان,,[],0,pending,,
mt_dial_lev_0cd0ea47,train,60762,DIAL_LEV,شايفين مين الوحدات والحكي اللك ياست,شايفين مين الوحدات والحكي اللك ياست,,[],0,pending,,
mt_msa_705c73a8,train,47866,MSA,ومن كان منكم بلا خطيئه فليرمها بحجر,ومن كان منكم بلا خطييه فليرمها بحجر,,[],0,pending,,
mt_dial_egy_afdd5101,train,2312,DIAL_EGY,انت مين انت استاذ منير عشان تتكلم بلسان الاقباط ؟ ؟,انت مين انت استاذ منير عشان تتكلم بلسان الاقباط,,[],0,pending,,
mt_dial_glf_84e369df,train,53925,DIAL_GLF,يعني هالاميرة محظوظين فيها اهل,يعني هالاميره محظوظين فيها اهل,,[],0,pending,,
mt_dial_lev_73b45bfa,train,9712,DIAL_LEV,يعني وين المشكلة و ما تلف بالشارع مش غلط توعي الناس على الاكل,يعني وين المشكله و ما تلف بالشارع مش غلط توعي الناس علي الاكل,,[],0,pending,,
mt_msa_70ded6ae,train,13772,MSA,ان شاء الله ان الليث يحافظ عل كاس,ان شاء الله ان الليث يحافظ عل كاس,,[],0,pending,,
mt_dial_egy_02f2f0d9,train,45118,DIAL_EGY,يانهار اسود . . خليكو في ماتشاتكم وعموما انا هقولها لك كلمة .,يانهار اسود خليكو في ماتشاتكم وعموما انا هقولها لك كلمه,,[],0,pending,,
mt_dial_glf_357b8824,train,54991,DIAL_GLF,اسوأ مدرب مر على الإتحاد . . ومحمد نور ماقصر لكن لم يساعده المشعل بسبب ثقله وتأخره الكثير .,اسوا مدرب مر علي الاتحاد ومحمد نور ماقصر لكن لم يساعده المشعل بسبب ثقله وتاخره الكثير,,[],0,pending,,
mt_dial_lev_0d256251,train,27419,DIAL_LEV,الله اكبر على امريكا وحلفائها . . . والله رح يجيهم يوم يندموا على كل شي,الله اكبر علي امريكا وحلفايها والله رح يجيهم يوم يندموا علي كل شي,,[],0,pending,,
mt_msa_ca1871f4,train,82012,MSA,بالنسبة لهذا الموضوع انا راي الشخصية انه لايحق لي شخص كان ان يقتل انسان اخر لو كان رجل امن فليس له السلطة لقتل انسان ومهما كانت جريمةالمتوفى لا يحق ان يقوموا,بالنسبه لهذا الموضوع انا راي الشخصيه انه لايحق لي شخص كان ان يقتل انسان اخر لو كان رجل امن فليس له السلطه لقتل انسان ومهما كانت جريمهالمتوفي لا يحق ان يقوموا,,[],0,pending,,
mt_dial_egy_58bfe06e,train,81746,DIAL_EGY,انت فوق ياهنيدي وحلمي وسعد تحت انت الافضل يا هنيدي =,انت فوق ياهنيدي وحلمي وسعد تحت انت الافضل يا هنيدي,,[],0,pending,,
mt_dial_glf_6e683852,train,44579,DIAL_GLF,حتى لو انه غني والا,حتي لو انه غني والا,,[],0,pending,,
mt_dial_lev_9d7e0163,train,53471,DIAL_LEV,صراحة انا انبسطت على القانون من ناحية الاجازات و خاصة للي اتخرجو جديد فرصة ما يكرهوا اشي اسمو شغل بأول حياتهم و يصير بدهم يسافروا لبرة فهاي الحركة جد رح تقلل من الكّأبة و ترفع شوي من نفسياتنا بس بالجهة المقابلة هبطّوا نفسيتنا عالاخر و يا ريت ترجعوا تدرسوا الموضوع من ناحية الفصل التعسفي يعني اللي زينا بغيروا و ببدلوا فينا ع كيفهم خصوصا انو النا اقل من سنة,صراحه انا انبسطت علي القانون من ناحيه الاجازات و خاصه للي اتخرجو جديد فرصه ما يكرهوا اشي اسمو شغل باول حياتهم و يصير بدهم يسافروا لبره فهاي الحركه جد رح تقلل من الكابه و ترفع شوي من نفسياتنا بس بالجهه المقابله هبطوا نفسيتنا عالاخر و يا ريت ترجعوا تدرسوا الموضوع من ناحيه الفصل التعسفي يعني اللي زينا بغيروا و ببدلوا فينا ع كيفهم خصوصا انو النا اقل من سنه,,[],0,pending,,
mt_msa_07014876,train,85435,MSA,اليهود تشردوا بكل مكان وكل ارض وتبعوا كل,اليهود تشردوا بكل مكان وكل ارض وتبعوا كل,,[],0,pending,,
mt_dial_egy_4dd46aa3,train,78681,DIAL_EGY,نزولا عند طلبات الجمهور المصري الذي تدركون حبي له ولبلده اعلن الحكم على المصري ابراهيم حسن رائد قلة الادب في العالم العربي بالايقاف مدى الحياة مع الاعمال الشاقة ( جمع الكرات في الملاعب الجزائرية ) . . الى اللقاء في قرار اخر يكون ان شاء الله من طرف الفيفا . . اصل مصر دي كبيرة اوي . . مصر الحضارة والاخلاق مش ممكن اولادها يعملوا كده ابدا . .,نزولا عند طلبات الجمهور المصري الذي تدركون حبي له ولبلده اعلن الحكم علي المصري ابراهيم حسن رايد قله الادب في العالم العربي بالايقاف مدي الحياه مع الاعمال الشاقه جمع الكرات في الملاعب الجزايريه الي اللقاء في قرار اخر يكون ان شاء الله من طرف الفيفا اصل مصر دي كبيره اوي مصر الحضاره والاخلاق مش ممكن اولادها يعملوا كده ابدا,,[],0,pending,,
mt_dial_glf_b72fa6e5,train,31499,DIAL_GLF,العزوبيه احسن الف مره ذا,العزوبيه احسن الف مره ذا,,[],0,pending,,
