example_id,source_split,source_row_id,dialect,original_text,normalized_text,masked_text,mask_spans_json,mask_count,annotation_status,annotator_model,notes
mt_dial_lev_50940449,train,41078,DIAL_LEV,ويلي راح يصير قريبا ببطل في محارم وببطل اشي اسمو زنا,ويلي راح يصير قريبا ببطل في محارم وببطل اشي اسمو زنا,,[],0,pending,,
mt_msa_f51a629d,train,635,MSA,لايمكن ان نحمل خسارة اي مباراة الى احد افراد الفريق فالمدرب القوي يجهز للمباراة بشكل جيد ويقراالمباراة من بداياتهاويغيرنحو الافضل بعكس ماشهدناةمن تغيرات لاحدمدربي نادي معروف في مباريات الكاس اخرج الاقوى وادخل اضعف منهم وكانت النتيجة خسارة مؤلمة لايمكن تحميل نتيجتها الاالى المدرب والجهاز,لايمكن ان نحمل خساره اي مباراه الي احد افراد الفريق فالمدرب القوي يجهز للمباراه بشكل جيد ويقراالمباراه من بداياتهاويغيرنحو الافضل بعكس ماشهدناهمن تغيرات لاحدمدربي نادي معروف في مباريات الكاس اخرج الاقوي وادخل اضعف منهم وكانت النتيجه خساره مولمه لايمكن تحميل نتيجتها الاالي المدرب والجهاز,,[],0,pending,,
mt_dial_egy_4c05032a,train,13311,DIAL_EGY,عبارة عن شوية عسل بس ( أسود,عباره عن شويه عسل بس اسود,,[],0,pending,,
mt_dial_glf_b9fdc85a,train,40265,DIAL_GLF,والله انتوا يالهلالية كلكم تستاهلون كوع ماعندكم ماعند جدتي والله انكم فريق,والله انتوا يالهلاليه كلكم تستاهلون كوع ماعندكم ماعند جدتي والله انكم فريق,,[],0,pending,,
mt_dial_lev_3faa1c67,train,67139,DIAL_LEV,انا بحكي شغلة وحدة بس .,انا بحكي شغله وحده بس,,[],0,pending,,
mt_msa_a9d47936,train,46847,MSA,على وجهها كدرة وكأبة . . سبحانك يا,علي وجهها كدره وكابه سبحانك يا,,[],0,pending,,
mt_dial_egy_b03e1068,train,12980,DIAL_EGY,كلنا متفائلين خير فى احمد زكى بدر بس بصراحه مش متفائلين خير فى,كلنا متفايلين خير في احمد زكي بدر بس بصراحه مش متفايلين خير في,,[],0,pending,,
mt_dial_glf_fd2f07ad,train,36430,DIAL_GLF,كل الكرامه ما تجي ربع,كل الكرامه ما تجي ربع,,[],0,pending,,
mt_dial_lev_63df292a,train,19702,DIAL_LEV,كونه أصاب اقرب الناس على قلبي .,كونه اصاب اقرب الناس علي قلبي,,[],0,pending,,
mt_msa_3dc267d3,train,81513,MSA,والصبر لي لي خوان والنوم من عيني,والصبر لي لي خوان والنوم من عيني,,[],0,pending,,
mt_dial_egy_8acc4e6b,train,74968,DIAL_EGY,ياريت كان لعيبة الزمالك و كل مسئول عن الرياضة شاهدوا مبارة مانشتر مع بايرن التى اقيمت بانجلترا وخرج مانشستر من بطولة اوروبا وطرد لاعب ولم يحدث مثل مهزلة الأمس لقد فاز الشرطة من قبل على الأهلى و الأسماعيلى ولم يحدث مثل ماحدث بالأمس اعتقد ان ماحدث هو وصمة عار ليس على ابراهيم حسن فقط بل على ادارة نادى الزمالك لقد احسنت اختيار حسام كمدرب واصبح يعى المسئولية ولكن كان يجب على ادارة تادى الزمالك ان تفهم من هو ابراهيم و تاريخة فى البلطجة كيف نزل ابراهيم الملعب و كيف قام بهذه الأحداث و كيف بلاعب صغير مثل علاء على يقوم بهذه الفعلة بعد المباراة وهو ناشئ فماذا لوكان لآعب كبير ! !,ياريت كان لعيبه الزمالك و كل مسيول عن الرياضه شاهدوا مباره مانشتر مع بايرن التي اقيمت بانجلترا وخرج مانشستر من بطوله اوروبا وطرد لاعب ولم يحدث مثل مهزله الامس لقد فاز الشرطه من قبل علي الاهلي و الاسماعيلي ولم يحدث مثل ماحدث بالامس اعتقد ان ماحدث هو وصمه عار ليس علي ابراهيم حسن فقط بل علي اداره نادي الزمالك لقد احسنت اختيار حسام كمدرب واصبح يعي المسيوليه ولكن كان يجب علي اداره تادي الزمالك ان تفهم من هو ابراهيم و تاريخه في البلطجه كيف نزل ابراهيم الملعب و كيف قام بهذه الاحداث و كيف بلاعب صغير مثل علاء علي يقوم بهذه الفعله بعد المباراه وهو ناشي فماذا لوكان لاعب كبير,,[],0,pending,,
mt_dial_glf_03fe5152,train,44842,DIAL_GLF,الف الف الف الف مبروك الزواج ياولد,الف الف الف الف مبروك الزواج ياولد,,[],0,pending,,
mt_dial_lev_30c57dec,train,83206,DIAL_LEV,ليش مش هو هسه بزمن الديمقراطية والحرية فليش علاجه يمكن الاحترام والرقي اللي لاقاه بدي يتعالج,ليش مش هو هسه بزمن الديمقراطيه والحريه فليش علاجه يمكن الاحترام والرقي اللي لاقاه بدي يتعالج,,[],0,pending,,
mt_msa_6dc0ad61,train,83078,MSA,خاطئ . افراط في استعمال منبه السياره . . بصراحه,خاطي افراط في استعمال منبه السياره بصراحه,,[],0,pending,,
mt_dial_egy_3cdafd2e,train,12349,DIAL_EGY,ثانيا : . حسام حسن لم يسب لاعيبيه بامه فى الملعب وعلى شاشة التليفزيون ولا,ثانيا حسام حسن لم يسب لاعيبيه بامه في الملعب وعلي شاشه التليفزيون ولا,,[],0,pending,,
mt_dial_glf_f21af684,train,19337,DIAL_GLF,هذا الرجال تتوقعون لو لاقي شي يسد الفقر ويغنيه عن هالمخاطره كان لقيتوه هنامع هالطرق يعرض نفسه للخطرأكيد,هذا الرجال تتوقعون لو لاقي شي يسد الفقر ويغنيه عن هالمخاطره كان لقيتوه هنامع هالطرق يعرض نفسه للخطراكيد,,[],0,pending,,
mt_dial_lev_86a0d651,train,81170,DIAL_LEV,طبعا ما في احلى من التواجد مع الاهل و الاصدقاء بس و الله الغلاء الفاحش و ارتفاع الاسعار و مصداقيه الحكومه الرائعه في اسعار النفط جعلتني احسب الف حساب للتصيف في الاردن . الرحلات في المنتزهات و الاماكن العامه متنفس للكثيرين من اصحاب الدخول المحدوده و المتوسطه ( بركي تفرض الحومه دخوليه عليها مشان تعذبنا اكثر ) لكن اتوقع من الجميع مراعاه للنظافه العامه و توخي الحذر عند اطفاء نيران الهش و النش مشان لا تولع الدنيا و تنحرق اشجارنا الحرجيه ! ! ! و الله يستر من مصاريف عطله السنه,طبعا ما في احلي من التواجد مع الاهل و الاصدقاء بس و الله الغلاء الفاحش و ارتفاع الاسعار و مصداقيه الحكومه الرايعه في اسعار النفط جعلتني احسب الف حساب للتصيف في الاردن الرحلات في المنتزهات و الاماكن العامه متنفس للكثيرين من اصحاب الدخول المحدوده و المتوسطه بركي تفرض الحومه دخوليه عليها مشان تعذبنا اكثر لكن اتوقع من الجميع مراعاه للنظافه العامه و توخي الحذر عند اطفاء نيران الهش و النش مشان لا تولع الدنيا و تنحرق اشجارنا الحرجيه و الله يستر من مصاريف عطله السنه,,[],0,pending,,
mt_msa_d0dd986b,train,76534,MSA,ثم انه لم يظهر لك سابقة ان تضع رأسك برؤوس من ذكرت في الفتيا,ثم انه لم يظهر لك سابقه ان تضع راسك برووس من ذكرت في الفتيا,,[],0,pending,,
mt_dial_egy_1d9ca63c,train,62954,DIAL_EGY,الاهلويه مش لاقيين حاجه تبرر موقفهم و وقوف التحكيم معهم لاهداههم الدورى وخايفين الناس تقول ان الاهلى اخد الدورى بالتحكيم والمنشطات فا عايزين يتكلموا فى اى حاجه يتوهوه بيها الناس,الاهلويه مش لاقيين حاجه تبرر موقفهم و وقوف التحكيم معهم لاهداههم الدوري وخايفين الناس تقول ان الاهلي اخد الدوري بالتحكيم والمنشطات فا عايزين يتكلموا في اي حاجه يتوهوه بيها الناس,,[],0,pending,,
mt_dial_glf_1cef0487,train,53758,DIAL_GLF,الحل اخذقرض من البنك علشان اجيب شغاله الصراحه والله حاله زواج مو,الحل اخذقرض من البنك علشان اجيب شغاله الصراحه والله حاله زواج مو,,[],0,pending,,
mt_dial_lev_92f4bdcc,train,57293,DIAL_LEV,لا حول ولا قوه الا بالله حسبي الله ونعم الوكيل . . . بس وين دور البنت الي بتمارس الجنس مع ابوها من خمس سنوات . . . ؟ يعني ماعرفت تهرب تلجا الى مركز امني . . . ؟ مش مستوعبها,لا حول ولا قوه الا بالله حسبي الله ونعم الوكيل بس وين دور البنت الي بتمارس الجنس مع ابوها من خمس سنوات يعني ماعرفت تهرب تلجا الي مركز امني مش مستوعبها,,[],0,pending,,
mt_msa_847b0956,train,17564,MSA,دعم جريدة الرياض لهذه المواضيع يثير شبها كثيره . . وتعليق كل شيء على شماعة ( سماحة الدين ) تنفيه الصورة الاخيرة بالموضوع . . تلك التي تضهر المسلمة فيها بدون حجاب شرعي ( حتى ذلك الذي يغطي الشعر ) . . فعن أي سماحة,دعم جريده الرياض لهذه المواضيع يثير شبها كثيره وتعليق كل شيء علي شماعه سماحه الدين تنفيه الصوره الاخيره بالموضوع تلك التي تضهر المسلمه فيها بدون حجاب شرعي حتي ذلك الذي يغطي الشعر فعن اي سماحه,,[],0,pending,,
mt_dial_egy_09151b84,train,85628,DIAL_EGY,لوحد سابك فى مصر مش حتسيبك اللى,لوحد سابك في مصر مش حتسيبك اللي,,[],0,pending,,
mt_dial_glf_e133d12a,train,64182,DIAL_GLF,عزالله انت الوحيد الي فاهم كورة . .,عزالله انت الوحيد الي فاهم كوره,,[],0,pending,,
mt_dial_lev_3ff44cb4,train,22619,DIAL_LEV,ما تعرف خيرها غير لما تجرب غيرها,ما تعرف خيرها غير لما تجرب غيرها,,[],0,pending,,
mt_msa_51c7ee2b,train,13095,MSA,ألف مبروك فوزنا بالأمس المستحق بنتيجه تاريخيه و لكنني استغرب من بعض جمهور الرمثا الذين قالو بالأمس انهم سوف يفوزوا على الوحدات,الف مبروك فوزنا بالامس المستحق بنتيجه تاريخيه و لكنني استغرب من بعض جمهور الرمثا الذين قالو بالامس انهم سوف يفوزوا علي الوحدات,,[],0,pending,,
mt_dial_egy_0f4ba95b,train,60544,DIAL_EGY,زى البشر وطالع من غير معاش,زي البشر وطالع من غير معاش,,[],0,pending,,
mt_dial_glf_7eed3e1a,train,2285,DIAL_GLF,الحين الخطوط الاقتصادية عندنا اذا تأخرت و راحت عليك الرحلة لأي سبب طارت الدراهم اما اذا تأخروا و خلوط بالمطار 5 ساعات و داخل الطائرة كم ساعة او حتى الغاء الرحلة و يرجعون لك فلوسك بدون تعويض الرحلة تكون شاريها قبل 3 شهور ب 400 ريال بعرض و الان ب,الحين الخطوط الاقتصاديه عندنا اذا تاخرت و راحت عليك الرحله لاي سبب طارت الدراهم اما اذا تاخروا و خلوط بالمطار 5 ساعات و داخل الطايره كم ساعه او حتي الغاء الرحله و يرجعون لك فلوسك بدون تعويض الرحله تكون شاريها قبل 3 شهور ب 400 ريال بعرض و الان ب,,[],0,pending,,
mt_dial_lev_d92d2318,train,46438,DIAL_LEV,صدقوني بعد هالقرعة اللي وضعتنا بين ابطال اسيا الافضل ان يبقى حمد بضل التكلفة المالية اقل من ما نجيب مدرب عالي المستوى من اوروبا او الارجنتين او,صدقوني بعد هالقرعه اللي وضعتنا بين ابطال اسيا الافضل ان يبقي حمد بضل التكلفه الماليه اقل من ما نجيب مدرب عالي المستوي من اوروبا او الارجنتين او,,[],0,pending,,
mt_msa_8f73b249,train,57830,MSA,والله العظيم رقم كبير جدا الله !,والله العظيم رقم كبير جدا الله,,[],0,pending,,
mt_dial_egy_cc209880,train,49713,DIAL_EGY,اولا / من يرتضى ان تهان الشرطة و رجال الامن و يصاب ضباط و امن مركزى من جراء القاء مشاغبى المعارضة الطوب عليهم ؟ هل يجب ان يكون الامن ملطشة لهم ؟ او يقابلوا الطوب بالورود ؟ ابسط الاشياء الاعتقال,اولا من يرتضي ان تهان الشرطه و رجال الامن و يصاب ضباط و امن مركزي من جراء القاء مشاغبي المعارضه الطوب عليهم هل يجب ان يكون الامن ملطشه لهم او يقابلوا الطوب بالورود ابسط الاشياء الاعتقال,,[],0,pending,,
mt_dial_glf_185a661f,train,35264,DIAL_GLF,بالنسبة للأخ اللي سمى نفسه ( نشمي ) أرجو عرض نفسك على أقرب طبيب نفسي لأن حالتك صعبة ، بعدين حاول تبحث عن مدرس خصوصي يعلمك الإملاء لأن حالتك معه أصعب,بالنسبه للاخ اللي سمي نفسه نشمي ارجو عرض نفسك علي اقرب طبيب نفسي لان حالتك صعبه بعدين حاول تبحث عن مدرس خصوصي يعلمك الاملاء لان حالتك معه اصعب,,[],0,pending,,
mt_dial_lev_7793faab,train,26938,DIAL_LEV,يا هيفاء وهبي خليك بالواو,يا هيفاء وهبي خليك بالواو,,[],0,pending,,
mt_msa_26668ca3,train,67625,MSA,المطلوب الآن من الجميع ان نبتعد عن التعليقات الساخرة والتي لا تمت الى الموضوع بصلةاو التي باطنها التحيز,المطلوب الان من الجميع ان نبتعد عن التعليقات الساخره والتي لا تمت الي الموضوع بصلهاو التي باطنها التحيز,,[],0,pending,,
mt_dial_egy_1df60b6b,train,17651,DIAL_EGY,"انا اول مرة اسمع عن ان انهم بيعتقلوا الحرامية دى , وبعدين حتى لو عليه احكام المفروض بيبقى ليها جلسات و تأجيلات واثباتات واللام دا كله , دا اتاخد كدة من الدار للنار وقالوله انتا عندك كذا وكذا وكذا ؟ , شيل بأة يا",انا اول مره اسمع عن ان انهم بيعتقلوا الحراميه دي وبعدين حتي لو عليه احكام المفروض بيبقي ليها جلسات و تاجيلات واثباتات واللام دا كله دا اتاخد كده من الدار للنار وقالوله انتا عندك كذا وكذا وكذا شيل باه يا,,[],0,pending,,
mt_dial_glf_29fd565e,train,5025,DIAL_GLF,الف مبروك يابلد البشير عاد ليكي,الف مبروك يابلد البشير عاد ليكي,,[],0,pending,,
mt_dial_lev_c85841bd,train,71366,DIAL_LEV,يعني الله أكبر 48 سيارة وبالنهاية فطنوا انو في حركه غريبة والله,يعني الله اكبر 48 سياره وبالنهايه فطنوا انو في حركه غريبه والله,,[],0,pending,,
mt_msa_e3bbcad5,train,11178,MSA,و قناة الجزيرة القطرية بطل اساسى فى,و قناه الجزيره القطريه بطل اساسي في,,[],0,pending,,
mt_dial_egy_815d865b,train,38413,DIAL_EGY,حلوه على الرغم انك جزائرى بس حلوه,حلوه علي الرغم انك جزايري بس حلوه,,[],0,pending,,
mt_dial_glf_8b2c926b,train,13147,DIAL_GLF,وترا شعبنا يتكلم حتى لو كنتوا طبيبات او بساطات في سوق او وزيرات,وترا شعبنا يتكلم حتي لو كنتوا طبيبات او بساطات في سوق او وزيرات,,[],0,pending,,
mt_dial_lev_98d03474,train,54451,DIAL_LEV,شو هالاتحاد . . . فريق يبلغ نهائيات كاس العالم والاتحاد يعاني . . . لما لم تعطي اللجنة الاولمبية هذا المنتخب الاولوية المطلوبة كونه صاحب الانجاز التاريخي هذا الانجاز الذي قتل قبل ان يولدمن قبل المسؤوليين عن الرياضة الذي لم يعطوا هذا المنتخب حقه فلم يحظى بالتكريم اللائق عن بلوغه التصفيات وها نحن نرى ونشاهد ما يعانيه الفريق والمدربيين من صعوبات حتى ان البرنامج التدريبي الذي اعده المدرب تم اجهاظه وتم تدمير اي فرصه للظهور المشرف على اقل تقدير في المنوديال فهل يعقل ان يتم التذرع بعدم القدرة للحصول على تاشيرات لدخوال ايطاليا ! ! ! واذا كان هو الحال كيف سيتم الدخول الى تركيا والمشاركة في كاس العام . . . هل يعقل عدم صرف رواتب ولاعبين رفعوا علم الوطن عاليا في هذا المحقل الدولي . . . هنالك امور تحدث مع هذا النتخب لانستطيع تفسيرها واحتى مجرد التفكير بها وتقبلها . . . لماذا هذا اللتقصير والاجحاف في حق ابناء الوطن الذين انجزوا وقدموا للوطن وكانو نموذجا مشرفا لاهل العزم والهمة . . . ولكن مكافاتهم كانت بقتل روحهم المعنوية واذلالهم للحصول على رواتبهم ( مع التذكير بانهم محترفيين اي انهم متفرغيين للعبة لايوجد لهم مصدر دخل اخر غير من اللعب ) وبالاضافة الى تشةيه الصوره المشرفة البهية التي رسموها وسطروها باحرف من ذهب خلال التصفيات . .,شو هالاتحاد فريق يبلغ نهاييات كاس العالم والاتحاد يعاني لما لم تعطي اللجنه الاولمبيه هذا المنتخب الاولويه المطلوبه كونه صاحب الانجاز التاريخي هذا الانجاز الذي قتل قبل ان يولدمن قبل المسووليين عن الرياضه الذي لم يعطوا هذا المنتخب حقه فلم يحظي بالتكريم اللايق عن بلوغه التصفيات وها نحن نري ونشاهد ما يعانيه الفريق والمدربيين من صعوبات حتي ان البرنامج التدريبي الذي اعده المدرب تم اجهاظه وتم تدمير اي فرصه للظهور المشرف علي اقل تقدير في المنوديال فهل يعقل ان يتم التذرع بعدم القدره للحصول علي تاشيرات لدخوال ايطاليا واذا كان هو الحال كيف سيتم الدخول الي تركيا والمشاركه في كاس العام هل يعقل عدم صرف رواتب ولاعبين رفعوا علم الوطن عاليا في هذا المحقل الدولي هنالك امور تحدث مع هذا النتخب لانستطيع تفسيرها واحتي مجرد التفكير بها وتقبلها لماذا هذا اللتقصير والاجحاف في حق ابناء الوطن الذين انجزوا وقدموا للوطن وكانو نموذجا مشرفا لاهل العزم والهمه ولكن مكافاتهم كانت بقتل روحهم المعنويه واذلالهم للحصول علي رواتبهم مع التذكير بانهم محترفيين اي انهم متفرغيين للعبه لايوجد لهم مصدر دخل اخر غير من اللعب وبالاضافه الي تشهيه الصوره المشرفه البهيه التي رسموها وسطروها باحرف من ذهب خلال التصفيات,,[],0,pending,,
mt_msa_8d1828ea,train,8481,MSA,فلا تخطؤو في حق المغرب و تونس . المسألة بيننا و بينكم,فلا تخطوو في حق المغرب و تونس المساله بيننا و بينكم,,[],0,pending,,
mt_dial_egy_4293536d,train,86068,DIAL_EGY,بصراحة بنحلم بحكومة تحس بينا وتكون بجد مننّا مش بعيدة كل البعد عننّا وبنحلم,بصراحه بنحلم بحكومه تحس بينا وتكون بجد مننا مش بعيده كل البعد عننا وبنحلم,,[],0,pending,,
mt_dial_glf_5f6d084f,train,38624,DIAL_GLF,وشو رنيه انت وين عايش شكلك مو,وشو رنيه انت وين عايش شكلك مو,,[],0,pending,,
mt_dial_lev_0ff66970,train,56543,DIAL_LEV,أصلاً ايران كلها ما فيها مساجد للسنة وكل مساجدها للشيعة,اصلا ايران كلها ما فيها مساجد للسنه وكل مساجدها للشيعه,,[],0,pending,,
mt_msa_6032d379,train,37943,MSA,اصعب احساس - - جهل الاخر با احساسك -,اصعب احساس جهل الاخر با احساسك,,[],0,pending,,
mt_dial_egy_11905582,train,26658,DIAL_EGY,اه يا بلد عاوزة ولد ! !,اه يا بلد عاوزه ولد,,[],0,pending,,
mt_dial_glf_b41f7b37,train,80435,DIAL_GLF,سبحان الله والله نعمة الاسلام اكبر نعم الله سبحانة شوفوا خيانة وطلاق ومخدرات مافي وازع ديني . سبحان ربي,سبحان الله والله نعمه الاسلام اكبر نعم الله سبحانه شوفوا خيانه وطلاق ومخدرات مافي وازع ديني سبحان ربي,,[],0,pending,,
mt_dial_lev_91b5a266,train,57310,DIAL_LEV,ولا من قلة الالقاب صايرين اتعلقوا على اي,ولا من قله الالقاب صايرين اتعلقوا علي اي,,[],0,pending,,
mt_msa_dbbf851b,train,74831,MSA,لو كان كلامك صحيح لما كنت انت الان تتحدث و لما كانت بلاد المسلمين اليوم مليئه باكنائس و اسبانيا مساجدها العظام تحولت الى كنائس يا منصف يا,لو كان كلامك صحيح لما كنت انت الان تتحدث و لما كانت بلاد المسلمين اليوم ملييه باكنايس و اسبانيا مساجدها العظام تحولت الي كنايس يا منصف يا,,[],0,pending,,
