example_id,source_split,source_row_id,dialect,original_text,normalized_text,masked_text,mask_spans_json,mask_count,annotation_status,annotator_model,notes
mt_dial_glf_dc0efb5a,train,3892,DIAL_GLF,صراحة المفروض بعد يضعون تسعيرة للمشاغل النسائية لأن أسعارهم خيال ويتشرطون بعد خاصة في المكياج والتسريحة على بالهم فرنسا ولالبنان ومن زين مكياجهم ياأما يحطونه تقل وحش أو ممطوط والحرمة المغفلة تدفع على بالها بتصير ملكة جمال الكون,صراحه المفروض بعد يضعون تسعيره للمشاغل النساييه لان اسعارهم خيال ويتشرطون بعد خاصه في المكياج والتسريحه علي بالهم فرنسا ولالبنان ومن زين مكياجهم يااما يحطونه تقل وحش او ممطوط والحرمه المغفله تدفع علي بالها بتصير ملكه جمال الكون,,[],0,pending,,
mt_dial_lev_9ef93daf,train,35528,DIAL_LEV,لما يكون الله لا يوفقو حاط المايونيز في سطل وصاير فصل بين المكونات . .,لما يكون الله لا يوفقو حاط المايونيز في سطل وصاير فصل بين المكونات,,[],0,pending,,
mt_msa_4e1529a0,train,38495,MSA,ليس عيباً ان تضع نظام ولكن العيب ان تقصد ناس بعينة لهذا,ليس عيبا ان تضع نظام ولكن العيب ان تقصد ناس بعينه لهذا,,[],0,pending,,
mt_dial_egy_0517679a,train,5929,DIAL_EGY,شايف جنابك ديول الخلايق . . وديلك .,شايف جنابك ديول الخلايق وديلك,,[],0,pending,,
mt_dial_glf_261de4a5,train,32459,DIAL_GLF,ياسبحن الله غصب يفرض رايه والله لو تألف مجلدات الحلا بين والحرام بين . . . صدق من قال خالف تعرف . . . يارب ثبت قلبي على,ياسبحن الله غصب يفرض رايه والله لو تالف مجلدات الحلا بين والحرام بين صدق من قال خالف تعرف يارب ثبت قلبي علي,,[],0,pending,,
mt_dial_lev_3f3e7a48,train,58855,DIAL_LEV,و الفيصلي السنه الجاي راح ياكل الاخضر و اليابس و لا تحلموا,و الفيصلي السنه الجاي راح ياكل الاخضر و اليابس و لا تحلموا,,[],0,pending,,
mt_msa_66714d1a,train,17937,MSA,بسم الله ( بصراحة الزمالك لعب مباراةجميلة جدا جدا واتمني الفوزللزمالك بالدوري ان شاء الله ),بسم الله بصراحه الزمالك لعب مباراهجميله جدا جدا واتمني الفوزللزمالك بالدوري ان شاء الله,,[],0,pending,,
mt_dial_egy_ce89a9f5,train,3637,DIAL_EGY,مين نزيهه دى يا جمال بيه ؟ ؟ ! ! ! المشكله فى حاجه ياجمال بيه أنك أتعودت تدى تصريحات خادعه لأعلام السلطه و هما يقولو أمين أنما فورين بولسى مش الأهرام أو الأخبار أو روزا اليوسف . . جمال بيه ياريت تشوف موضوع تانى تتكلم فيه . . . بيس يا,مين نزيهه دي يا جمال بيه المشكله في حاجه ياجمال بيه انك اتعودت تدي تصريحات خادعه لاعلام السلطه و هما يقولو امين انما فورين بولسي مش الاهرام او الاخبار او روزا اليوسف جمال بيه ياريت تشوف موضوع تاني تتكلم فيه بيس يا,,[],0,pending,,
mt_dial_glf_622ad757,train,35433,DIAL_GLF,قالها مشجع لافظ فوه ( ( ركود الزعيم موجود ) ),قالها مشجع لافظ فوه ركود الزعيم موجود,,[],0,pending,,
mt_dial_lev_b9fdbdbb,train,21336,DIAL_LEV,"الله اكبر يا ابو محيسن , , , انت رجل بتقول انك بتصوم النوافل وبتعرف حق ربنا جيدا , , , واللي بعرف حق ربنا ما بزيف الحقائق ويدعي علم كل شيء خاصة اذا تعلق الامر بالوحدات",الله اكبر يا ابو محيسن انت رجل بتقول انك بتصوم النوافل وبتعرف حق ربنا جيدا واللي بعرف حق ربنا ما بزيف الحقايق ويدعي علم كل شيء خاصه اذا تعلق الامر بالوحدات,,[],0,pending,,
mt_msa_8ceff70f,train,37646,MSA,انت انسان راقي في التعامل ومحترم,انت انسان راقي في التعامل ومحترم,,[],0,pending,,
mt_dial_egy_f5238a68,train,69932,DIAL_EGY,طبعا أنا مع كل التعليقات اللي استنكرت كلام المش محافظ,طبعا انا مع كل التعليقات اللي استنكرت كلام المش محافظ,,[],0,pending,,
mt_dial_glf_2b00bc6f,train,68426,DIAL_GLF,الواجب ان الود لا يلعب اللاعب اللى بعد التاكد 100 % من نتيجة,الواجب ان الود لا يلعب اللاعب اللي بعد التاكد 100 من نتيجه,,[],0,pending,,
mt_dial_lev_83b8ee02,train,78661,DIAL_LEV,انا من سكان ماركا الشمالية والبنت الي طعنوها عمرها 14 سنة والله لو تشوفو شكل البنت لتبكو عليها ما حدا قدر يقرب اخوانها شكلهم مجانين ما فهمو القصة . .,انا من سكان ماركا الشماليه والبنت الي طعنوها عمرها 14 سنه والله لو تشوفو شكل البنت لتبكو عليها ما حدا قدر يقرب اخوانها شكلهم مجانين ما فهمو القصه,,[],0,pending,,
mt_msa_0d085f88,train,57419,MSA,"السرعه السرعه السرعه السرعه الزائده , , , قاتله الله يحمي كل اب و كل ابن وكل خال وكل عم وكل جار وكل صديق اللهم امين",السرعه السرعه السرعه السرعه الزايده قاتله الله يحمي كل اب و كل ابن وكل خال وكل عم وكل جار وكل صديق اللهم امين,,[],0,pending,,
mt_dial_egy_b7421469,train,51856,DIAL_EGY,شكرآ على مقالك الممتاز ومن الأحداث المؤسفة التى نراها على يد الفاسدين والعابثين والمتسلقين أللى شوهوا صورة مصر على الساحةالدولية . . وسؤالى لكاتب المقال هل لايوجد نهاية حقيقية لهؤلاء ليكونوا عبرة لمن يفكر أن يتلاعب بشعبناالطيب . . وتحيةوتقديرلجريدةاليوم السابع المحترمين . . عبدالرحيم,شكرا علي مقالك الممتاز ومن الاحداث الموسفه التي نراها علي يد الفاسدين والعابثين والمتسلقين اللي شوهوا صوره مصر علي الساحهالدوليه وسوالي لكاتب المقال هل لايوجد نهايه حقيقيه لهولاء ليكونوا عبره لمن يفكر ان يتلاعب بشعبناالطيب وتحيهوتقديرلجريدهاليوم السابع المحترمين عبدالرحيم,,[],0,pending,,
mt_dial_glf_c6160958,train,41728,DIAL_GLF,كذب المنجمون ولو صدقوا وهذا كله بعلم الغيب محد,كذب المنجمون ولو صدقوا وهذا كله بعلم الغيب محد,,[],0,pending,,
mt_dial_lev_ce4b3676,train,80054,DIAL_LEV,يعني قبل فترة قرانا عن قيام امراة سعودية بضرب زوجها لانه اراد ان يوقضها لصلاة الفجر ولم تكن المرة الاولى التي يتعرض فيها هذا الزوج للضرب على يدي زوجته بل انه كان دائما ياكل كتلة محرزة وبشكل,يعني قبل فتره قرانا عن قيام امراه سعوديه بضرب زوجها لانه اراد ان يوقضها لصلاه الفجر ولم تكن المره الاولي التي يتعرض فيها هذا الزوج للضرب علي يدي زوجته بل انه كان دايما ياكل كتله محرزه وبشكل,,[],0,pending,,
mt_msa_35076675,train,46399,MSA,اكيد عاطل عن العمل حسبي الله ونعم الوكيل الا متى والشباب على هذه الحاله ياويل المسئولين من رب العالمين لان هم السبب في هذا الوضع الا متى الا متى الامتى والشباب يقدم على الانتحار من الفراغ ومن البطاله . .,اكيد عاطل عن العمل حسبي الله ونعم الوكيل الا متي والشباب علي هذه الحاله ياويل المسيولين من رب العالمين لان هم السبب في هذا الوضع الا متي الا متي الامتي والشباب يقدم علي الانتحار من الفراغ ومن البطاله,,[],0,pending,,
mt_dial_egy_c0550d3b,train,26038,DIAL_EGY,وبعدين ليه حازم امام اطرد امبارح بسبب غلط هو ارتكبه ولا اخطاء ارتكبها,وبعدين ليه حازم امام اطرد امبارح بسبب غلط هو ارتكبه ولا اخطاء ارتكبها,,[],0,pending,,
mt_dial_glf_1e91e5b8,train,73150,DIAL_GLF,حبيب قلبي ابو محمد . . . اقتلهم باللاعب,حبيب قلبي ابو محمد اقتلهم باللاعب,,[],0,pending,,
mt_dial_lev_1565b780,train,35219,DIAL_LEV,الاتحاد هو الذي خسر الوحدات مو,الاتحاد هو الذي خسر الوحدات مو,,[],0,pending,,
mt_msa_dee3a558,train,33125,MSA,وفي حديث عمر : فذلك حين استَهْرَجَ له الرأْيُ أَي قَوِيَ واتسع,وفي حديث عمر فذلك حين استهرج له الراي اي قوي واتسع,,[],0,pending,,
mt_dial_egy_0406a40c,train,10448,DIAL_EGY,ليه يا اختى كاتمه على نفسك كده فكيها وبلاش النص الفوقانى ركزى على,ليه يا اختي كاتمه علي نفسك كده فكيها وبلاش النص الفوقاني ركزي علي,,[],0,pending,,
mt_dial_glf_661b4ae9,train,4073,DIAL_GLF,ه لا وأنت الصادق الدختور قصده 3 ملاس,ه لا وانت الصادق الدختور قصده 3 ملاس,,[],0,pending,,
mt_dial_lev_2acee817,train,2573,DIAL_LEV,طيب مثلآ هذا الدكتور إلي طخ عميدة,طيب مثلا هذا الدكتور الي طخ عميده,,[],0,pending,,
mt_msa_6a5bd850,train,47115,MSA,اعتماد الاقتصاد الامريكي الحالي في اغلبه على صفقات دول الخليج ودعمها . . وبالأخص السعودية . . لكي تدعم قوتها العسكرية,اعتماد الاقتصاد الامريكي الحالي في اغلبه علي صفقات دول الخليج ودعمها وبالاخص السعوديه لكي تدعم قوتها العسكريه,,[],0,pending,,
mt_dial_egy_daf621b7,train,75471,DIAL_EGY,كلوا جاتوه سواريه و احنا ناكل خرة . . حطى كالونيا حطى جاتوه . . كتكوا,كلوا جاتوه سواريه و احنا ناكل خره حطي كالونيا حطي جاتوه كتكوا,,[],0,pending,,
mt_dial_glf_42d8500b,train,18665,DIAL_GLF,لو تنزل ماجد ومحيسن والهريفي فوز مافيه احلمو ايه الحالمين الهلال للنهائي 100 % 100 انتضرو خمسه مره ثانيه ان شاء الله 1 2 3 4,لو تنزل ماجد ومحيسن والهريفي فوز مافيه احلمو ايه الحالمين الهلال للنهايي 100 100 انتضرو خمسه مره ثانيه ان شاء الله 1 2 3 4,,[],0,pending,,
mt_dial_lev_75539333,train,78629,DIAL_LEV,شفولكم حل ليش لا سمح الله ما تفكروا ببناء مصانع تابعه للحكومة ليش ما تلاقوا استثمارات اهم شي عندكم ضريبة الحل السريع والمتوفر عندكم هاد اللي شاطرين فيه انا حالتي على الله بس عندي سيارة بعد ما الله تاب علينا من مواصلات بدكم ترجعولنا الها حسبي الله ونعم الوكيل وانتي يا جريدة الغد لا تشطبي شي ممكن .,شفولكم حل ليش لا سمح الله ما تفكروا ببناء مصانع تابعه للحكومه ليش ما تلاقوا استثمارات اهم شي عندكم ضريبه الحل السريع والمتوفر عندكم هاد اللي شاطرين فيه انا حالتي علي الله بس عندي سياره بعد ما الله تاب علينا من مواصلات بدكم ترجعولنا الها حسبي الله ونعم الوكيل وانتي يا جريده الغد لا تشطبي شي ممكن,,[],0,pending,,
mt_msa_e8daab8f,train,19134,MSA,"واعتبر أن بناء عز للمصنع الجديد سيكرس من احتكاره للسوق المصرية ، حيث أنه من المعلوم أن مصر تنتج 6 , 5 مليون طن سنويا - حصة عز منها 4 , 6 مليون طن - وهو ما يعني بعد إنتاج مصنع الدرفلة الجديد الذي يتم بناؤه حاليا تحت سمع وبصر جميع الأجهزة المعنية أنه سوف ينتج 5 , 6 ملايين طن ليصبح صاحب الحصة الحاكمة المسيطرة",واعتبر ان بناء عز للمصنع الجديد سيكرس من احتكاره للسوق المصريه حيث انه من المعلوم ان مصر تنتج 6 5 مليون طن سنويا حصه عز منها 4 6 مليون طن وهو ما يعني بعد انتاج مصنع الدرفله الجديد الذي يتم بناوه حاليا تحت سمع وبصر جميع الاجهزه المعنيه انه سوف ينتج 5 6 ملايين طن ليصبح صاحب الحصه الحاكمه المسيطره,,[],0,pending,,
