example_id,source_split,source_row_id,dialect,original_text,normalized_text,masked_text,mask_spans_json,mask_count,annotation_status,annotator_model,notes
mt_dial_glf_2dfa1d97,train,18893,DIAL_GLF,والله إذا الرجال شايف نفسه انه يجلس في,والله اذا الرجال شايف نفسه انه يجلس في,,[],0,pending,,
mt_dial_lev_a1631e63,train,44737,DIAL_LEV,لما حكيت كلمة حق بمعلمين اليوم استغلوها المغرضين وقوموا القيامة نحن اولياء الامور نشد على يدك ياريت يتم تعيين المعلمات بعد المقابلات والتاكد من حسن السيرة والالتزام باللباس الاسلامي لانه درهم وقاية خير من . . . تاتوعلى مؤخرات,لما حكيت كلمه حق بمعلمين اليوم استغلوها المغرضين وقوموا القيامه نحن اولياء الامور نشد علي يدك ياريت يتم تعيين المعلمات بعد المقابلات والتاكد من حسن السيره والالتزام باللباس الاسلامي لانه درهم وقايه خير من تاتوعلي موخرات,,[],0,pending,,
mt_msa_0bbd9d74,train,18545,MSA,ربما يذهب فيصل عبدالهادي للجنة الفنية الاسويه ويطلب بالغى الكروت من اجل الاطاحه بالزعيم مثل ما اخفي سكور مباراة الاهلي والنصر والغيت كروت عباس وفجاروا وبرناوي ؟ ؟,ربما يذهب فيصل عبدالهادي للجنه الفنيه الاسويه ويطلب بالغي الكروت من اجل الاطاحه بالزعيم مثل ما اخفي سكور مباراه الاهلي والنصر والغيت كروت عباس وفجاروا وبرناوي,,[],0,pending,,
mt_dial_egy_cce8f00a,train,11532,DIAL_EGY,أمجاد زمان هترجع تاني . . و البطولات تيجي من,امجاد زمان هترجع تاني و البطولات تيجي من,,[],0,pending,,
mt_dial_glf_f02edde0,train,45763,DIAL_GLF,لو النصر يفتك منك كان يكون,لو النصر يفتك منك كان يكون,,[],0,pending,,
mt_dial_lev_7af875ab,train,58003,DIAL_LEV,مقارنه بسيطه والبقيه تأتي وسلم سلامات كأس الاردن,مقارنه بسيطه والبقيه تاتي وسلم سلامات كاس الاردن,,[],0,pending,,
mt_msa_d8ed3e08,train,5096,MSA,من المسئول عن عدم تنمية سيناء بعد رجوها إلينا من 30 سنة وتعرضها الآن,من المسيول عن عدم تنميه سيناء بعد رجوها الينا من 30 سنه وتعرضها الان,,[],0,pending,,
mt_dial_egy_384c99f8,train,61980,DIAL_EGY,سابعاً : إلى كل المشتاقين وشلة المنتفعين وأصحاب المصالح نقول : موسم الهجوم على البرادعى بدأ . . . إلحق إحدف طوبه . . . أو سجل موقف ! !,سابعا الي كل المشتاقين وشله المنتفعين واصحاب المصالح نقول موسم الهجوم علي البرادعي بدا الحق احدف طوبه او سجل موقف,,[],0,pending,,
mt_dial_glf_7428d8d9,train,28656,DIAL_GLF,أهم شي إشعار المخالف بأسرع وقت ممكن بحيث يتم تحصيل المخالفه بأسرع وقت ممكن . واللي يبي يموت بكيفه بس أهم شي يسدد المخالفه,اهم شي اشعار المخالف باسرع وقت ممكن بحيث يتم تحصيل المخالفه باسرع وقت ممكن واللي يبي يموت بكيفه بس اهم شي يسدد المخالفه,,[],0,pending,,
mt_dial_lev_f69ff955,train,77550,DIAL_LEV,يعني واحد مطخوخ براسة مو مبين معكم,يعني واحد مطخوخ براسه مو مبين معكم,,[],0,pending,,
mt_msa_07832c34,train,19935,MSA,بالتوفيق للحسين اربد وانشاء الله نتيجة تاريخية لاسود الشمال ( 6 - 2,بالتوفيق للحسين اربد وانشاء الله نتيجه تاريخيه لاسود الشمال 6 2,,[],0,pending,,
mt_dial_egy_291fb416,train,31024,DIAL_EGY,واللي بتكلم شروي غروي مالو علاقه انما الاعمال,واللي بتكلم شروي غروي مالو علاقه انما الاعمال,,[],0,pending,,
mt_dial_glf_be0b97f7,train,45189,DIAL_GLF,مو اشغلتونا احترموا التخصص . . . وين التخصص الان لماذا لم تحترموه وين فتاوى العلماء الكبار امثال الشيخ ابن باز والعثيمين وال الشيخ هولاء فنيت اعمارهم وهم يطلبون العلم وليس تخصص حاسب ! !,مو اشغلتونا احترموا التخصص وين التخصص الان لماذا لم تحترموه وين فتاوي العلماء الكبار امثال الشيخ ابن باز والعثيمين وال الشيخ هولاء فنيت اعمارهم وهم يطلبون العلم وليس تخصص حاسب,,[],0,pending,,
mt_dial_lev_86ef586e,train,10317,DIAL_LEV,يا جماعه عندي سؤال صغير وين ولادها ما في حدن يسال عنها وين الجيران الله,يا جماعه عندي سوال صغير وين ولادها ما في حدن يسال عنها وين الجيران الله,,[],0,pending,,
mt_msa_083b295b,train,77836,MSA,الى كل المعلقين من صرف مئات من الريالات لاتنسو الناس محتاجة الى الترفيه من ضغط العمل وليس دائما شغل بشغل والاطفال محتاجة,الي كل المعلقين من صرف ميات من الريالات لاتنسو الناس محتاجه الي الترفيه من ضغط العمل وليس دايما شغل بشغل والاطفال محتاجه,,[],0,pending,,
