example_id,source_split,source_row_id,dialect,original_text,normalized_text,masked_text,mask_spans_json,mask_count,annotation_status,annotator_model,notes
mt_msa_42fa4248,train,80200,MSA,الفريدي سيئ سيئ في الملعب سلوكاً ولعبا لايقدر المسؤولية دائماً متنرفز أحرج فريقه في عدة مباريات لافائدة للهلال منه ففي الهلال عدد من النجوم ممن يقدرون المسؤولية لم اقتنع به يوما كثير المشاكسات التي لاينبغي أن يتصف بها رياضي يجب عليه أن يضبط أعصابه وإلا ما الفائدة من ذهابه وراء لاعب مس كرمان وضربه,الفريدي سيي سيي في الملعب سلوكا ولعبا لايقدر المسووليه دايما متنرفز احرج فريقه في عده مباريات لافايده للهلال منه ففي الهلال عدد من النجوم ممن يقدرون المسووليه لم اقتنع به يوما كثير المشاكسات التي لاينبغي ان يتصف بها رياضي يجب عليه ان يضبط اعصابه والا ما الفايده من ذهابه وراء لاعب مس كرمان وضربه,,[],0,pending,,
mt_dial_egy_2916d202,train,100,DIAL_EGY,فلابد من انتشار الجرائم التى تهز قلوبنا وتدمع اعيننا على ما نسمعه ولا يوجد حلول لما نحن فيه من مشاكل ليست لها حلول خالص,فلابد من انتشار الجرايم التي تهز قلوبنا وتدمع اعيننا علي ما نسمعه ولا يوجد حلول لما نحن فيه من مشاكل ليست لها حلول خالص,,[],0,pending,,
mt_dial_glf_c9b35370,train,26905,DIAL_GLF,والله اذا ماحشمة امي مالها محل عندي و المراة بدالها الف مراة لكن الام اذا زعلت وين نجيب امي ثانية,والله اذا ماحشمه امي مالها محل عندي و المراه بدالها الف مراه لكن الام اذا زعلت وين نجيب امي ثانيه,,[],0,pending,,
mt_dial_lev_88553878,train,623,DIAL_LEV,"بوجود ابطال الفيصلي و الاخوان الوحداتية و الشبابية و الرمثاوية و الجميع سنكون ان شاء الله جاهزين للمباريات امام الذكاء الياباني و الاخضر السعودي و المحترفين السوريين و ان شاء الله نكون قدها , , , حبيبو",بوجود ابطال الفيصلي و الاخوان الوحداتيه و الشبابيه و الرمثاويه و الجميع سنكون ان شاء الله جاهزين للمباريات امام الذكاء الياباني و الاخضر السعودي و المحترفين السوريين و ان شاء الله نكون قدها حبيبو,,[],0,pending,,
mt_msa_1ff4ad98,train,55105,MSA,العقد شريعة المتعاقدين . إدارة الموقع المصرية أي توفيق وهشام ومساعدوهم لم تكن إدارتهم المالية شفافة ، لقد ميزوا البعض من المقربين على البعض من غير المقربين . لا داعي للكذب على القطريين فلا ذنب لهم فيما جنته أيادي المصريين المذكورين . تذكروا أن الحكومة المصرية نفسها شتت وخربت بيوت صحفيي جريدتين كبيرتين هما الشعب وآفاق عربية . لماذا الكيل بمكياليين,العقد شريعه المتعاقدين اداره الموقع المصريه اي توفيق وهشام ومساعدوهم لم تكن ادارتهم الماليه شفافه لقد ميزوا البعض من المقربين علي البعض من غير المقربين لا داعي للكذب علي القطريين فلا ذنب لهم فيما جنته ايادي المصريين المذكورين تذكروا ان الحكومه المصريه نفسها شتت وخربت بيوت صحفيي جريدتين كبيرتين هما الشعب وافاق عربيه لماذا الكيل بمكياليين,,[],0,pending,,
