example_id,source_split,source_row_id,dialect,original_text,normalized_text,masked_text,mask_spans_json,mask_count,annotation_status,annotator_model,notes
mt_dial_lev_87399e16,train,61151,DIAL_LEV,جمال محمود بالسلامه يا كابتن وتحيه اليك من اخ عزيز وحب شخصيا للكابتن جمال محمود والله,جمال محمود بالسلامه يا كابتن وتحيه اليك من اخ عزيز وحب شخصيا للكابتن جمال محمود والله,,[],0,pending,,
mt_msa_8d815a4b,train,71022,MSA,هذا يدل على حسن تفكير الرجل لانه يريد ابعاد المنافسه واحلال التكامل بين المستشفيات وهذا باعتقادي عين,هذا يدل علي حسن تفكير الرجل لانه يريد ابعاد المنافسه واحلال التكامل بين المستشفيات وهذا باعتقادي عين,,[],0,pending,,
mt_dial_egy_33f69c71,train,59599,DIAL_EGY,انا مصرية و بحب سيرين تمثيلا و غناء بالتوفيق دائما ان شاء,انا مصريه و بحب سيرين تمثيلا و غناء بالتوفيق دايما ان شاء,,[],0,pending,,
mt_dial_glf_74611214,train,2636,DIAL_GLF,علا انة في شباب يوصل مصروفهم الي 30 ريال,علا انه في شباب يوصل مصروفهم الي 30 ريال,,[],0,pending,,
mt_dial_lev_a236f3f5,train,8902,DIAL_LEV,انا في حياتي زرت تقريبا حتى هذه اللحظة حوالي اربع دول فقيرة جدا بالاضافة لزيارتي لدول عربية مثل مصر والمغرب وليبيا وصدقوني انني لم اشاهد شوارع عليها مناهل بهذا الكم مثل شوارع عاصمتنا الحبيبة عمان حيث كما ذكر احد الاخوة في احد التعليقات انه في الحقيقة هناك الكثير من الشوارع يكون المنهل بعيد عن المنهل الاخر حوالي متر او متر ونصف وشاهدت الكثير من الشوارع مليئة بالمناهل ولا اعرف ما جدوى هذه التقنية حيث ان الكثير من هذه المناهل تكون مكسور جزء منها او بارزة او منخفضة عن الشارع فتسبب الاذى للمركبات وبعض الاحيان تسبب الحوادث عند تجنبها فيشعر السائق انه في شارع العاب اتاري عليه ان يبتعد عن الفخ كي لا يسقط,انا في حياتي زرت تقريبا حتي هذه اللحظه حوالي اربع دول فقيره جدا بالاضافه لزيارتي لدول عربيه مثل مصر والمغرب وليبيا وصدقوني انني لم اشاهد شوارع عليها مناهل بهذا الكم مثل شوارع عاصمتنا الحبيبه عمان حيث كما ذكر احد الاخوه في احد التعليقات انه في الحقيقه هناك الكثير من الشوارع يكون المنهل بعيد عن المنهل الاخر حوالي متر او متر ونصف وشاهدت الكثير من الشوارع ملييه بالمناهل ولا اعرف ما جدوي هذه التقنيه حيث ان الكثير من هذه المناهل تكون مكسور جزء منها او بارزه او منخفضه عن الشارع فتسبب الاذي للمركبات وبعض الاحيان تسبب الحوادث عند تجنبها فيشعر السايق انه في شارع العاب اتاري عليه ان يبتعد عن الفخ كي لا يسقط,,[],0,pending,,
mt_msa_300c3cd4,train,6608,MSA,مع تمنياتي بالتوفيق للزعيم القارة الآسيوية في مبارة النصر والحصول على البطولة أن شاءالله البطولة للأبطال وتحقيق بطولة الآسيوية الهلال السنة هذي هو البطل رضي من رضي,مع تمنياتي بالتوفيق للزعيم القاره الاسيويه في مباره النصر والحصول علي البطوله ان شاءالله البطوله للابطال وتحقيق بطوله الاسيويه الهلال السنه هذي هو البطل رضي من رضي,,[],0,pending,,
mt_dial_egy_ca6240f1,train,55525,DIAL_EGY,ايه الجمال و ايه العظمة دي تشعر انه يلعب كورة سهلة جدا و الكرة تحبه و يفعل ما يشاء و الاروع هو تواضع هذا,ايه الجمال و ايه العظمه دي تشعر انه يلعب كوره سهله جدا و الكره تحبه و يفعل ما يشاء و الاروع هو تواضع هذا,,[],0,pending,,
mt_dial_glf_5484d134,train,48209,DIAL_GLF,"اصلا التخفيض والزياده لايقررها "" مجلس الشورى "" مع كامل احترامي له ولاعضائه ! الغريب يااخواني المواطنين ان مجلس الشورى لديهم خيمه كبيره بجوار المقر هذه الخيمه انشأت بمبلغ "" "" "" 11 مليون "" "" ريال ! ! ! شر البليه مايضحك ه !",اصلا التخفيض والزياده لايقررها مجلس الشوري مع كامل احترامي له ولاعضايه الغريب يااخواني المواطنين ان مجلس الشوري لديهم خيمه كبيره بجوار المقر هذه الخيمه انشات بمبلغ 11 مليون ريال شر البليه مايضحك ه,,[],0,pending,,
mt_dial_lev_370cf294,train,10623,DIAL_LEV,اه يا ختي شاركي وماله شو علي,اه يا ختي شاركي وماله شو علي,,[],0,pending,,
mt_msa_4405c65a,train,44353,MSA,أرجو أن تشاهد فيلم شادية وعبد المنعم أبراهيم في النوبة لتري أختلاف,ارجو ان تشاهد فيلم شاديه وعبد المنعم ابراهيم في النوبه لتري اختلاف,,[],0,pending,,
mt_dial_egy_5de9506b,train,28070,DIAL_EGY,تجيبها كده هي كده توديها كده هي كده ياعم كده دي بلدنا,تجيبها كده هي كده توديها كده هي كده ياعم كده دي بلدنا,,[],0,pending,,
mt_dial_glf_8ae1d77f,train,720,DIAL_GLF,يلعن أبو الحاجه ألي خلته يصرح ؟ ؟,يلعن ابو الحاجه الي خلته يصرح,,[],0,pending,,
mt_dial_lev_15295bb3,train,41380,DIAL_LEV,رنوش حياتى ربنا يوفقك يا رب تعملى احلى شغل انتى بجد موهبة حقيقية وصوتك تحفة وجميل جدا فى الطربى والخفيف وعندك كاريزما ووجه يخطف المشاهد والكاميرا وروح حلوة ودلع وخفة دم مش موجوده غير فى البنت المصرية مواه حبيبة قلبى اتمنالك التوفيق فى كل اختياراتك والنجاح دايما يا,رنوش حياتي ربنا يوفقك يا رب تعملي احلي شغل انتي بجد موهبه حقيقيه وصوتك تحفه وجميل جدا في الطربي والخفيف وعندك كاريزما ووجه يخطف المشاهد والكاميرا وروح حلوه ودلع وخفه دم مش موجوده غير في البنت المصريه مواه حبيبه قلبي اتمنالك التوفيق في كل اختياراتك والنجاح دايما يا,,[],0,pending,,
mt_msa_0bb853c6,train,38239,MSA,"بعد ما اصبح الشعب الأمريكي يقتني السياراة اليابانية لأنها اقتصاديه وعمليه وشكلها جذاب , لذا فإن الولايات المتحدة بدأت يتشويه سمعة الشركات اليابانيه , وفرض عليها غرامات لكي توقف الزحف الياباني ايضاً لكي تسوق منتجاتها .",بعد ما اصبح الشعب الامريكي يقتني السياراه اليابانيه لانها اقتصاديه وعمليه وشكلها جذاب لذا فان الولايات المتحده بدات يتشويه سمعه الشركات اليابانيه وفرض عليها غرامات لكي توقف الزحف الياباني ايضا لكي تسوق منتجاتها,,[],0,pending,,
mt_dial_egy_1b9d2c88,train,38488,DIAL_EGY,يعني حي جميل كالحي الملاصق لجامعة كفر الشيخ ( مساكن الري او حي مبارك ) باعتباره من الاحياء الهامة نظراً لقربه الشديد من صرح علمي عملاق كجامعة كفر الشيخ والذي انقلب بقدرة قادر من حي سكني الى حي تجاري غاية في الاتساخ حيث نجده يئن ويعاني من القمامة المبعثرة على الاسفلت وبين العمارات وامام المحلات وكانها منطقة ليس بها بشر,يعني حي جميل كالحي الملاصق لجامعه كفر الشيخ مساكن الري او حي مبارك باعتباره من الاحياء الهامه نظرا لقربه الشديد من صرح علمي عملاق كجامعه كفر الشيخ والذي انقلب بقدره قادر من حي سكني الي حي تجاري غايه في الاتساخ حيث نجده يين ويعاني من القمامه المبعثره علي الاسفلت وبين العمارات وامام المحلات وكانها منطقه ليس بها بشر,,[],0,pending,,
mt_dial_glf_37973f26,train,65299,DIAL_GLF,انتم ما تفهموون الادلة اللي يجيببيها قبل التحريم . . ! ! اتمنى للناس انهم ما يصدقون كلامة ماراح يصدقه الا القلوب الضعيفة . . ياخي الله يقويك مش بناتك ب بكيني ودرسهم باللي تبي بس ماتجي تفتي على,انتم ما تفهموون الادله اللي يجيببيها قبل التحريم اتمني للناس انهم ما يصدقون كلامه ماراح يصدقه الا القلوب الضعيفه ياخي الله يقويك مش بناتك ب بكيني ودرسهم باللي تبي بس ماتجي تفتي علي,,[],0,pending,,
mt_dial_lev_f944b22b,train,50288,DIAL_LEV,مثلا كم عدد وسائد الهواء وطريقه عملها اواي معلومات عن انظمه السلامه في,مثلا كم عدد وسايد الهواء وطريقه عملها اواي معلومات عن انظمه السلامه في,,[],0,pending,,
mt_msa_f8548939,train,39742,MSA,لا داعي من نشر أخبار بهذه الصورة ، ليحاكم دون أن يعرف المواطن بهذه الأشكال القذرة,لا داعي من نشر اخبار بهذه الصوره ليحاكم دون ان يعرف المواطن بهذه الاشكال القذره,,[],0,pending,,
mt_dial_egy_e09eac32,train,22032,DIAL_EGY,طيب لما إنت مش عجباك ( ما يسمى أرض الكنانة ) مالك محروق قوى كده ليه ؟ ومكلف نفسك وداخل على موقع مصرى وبدوَّر على تعليقات المصريين ليه ؟ . . ياريت تخليك مع جريدة الشرور بتاعتكم وتعيش مع الأفلام والمسلسلات إللى بيألفوها,طيب لما انت مش عجباك ما يسمي ارض الكنانه مالك محروق قوي كده ليه ومكلف نفسك وداخل علي موقع مصري وبدور علي تعليقات المصريين ليه ياريت تخليك مع جريده الشرور بتاعتكم وتعيش مع الافلام والمسلسلات اللي بيالفوها,,[],0,pending,,
mt_dial_glf_4d008258,train,81293,DIAL_GLF,الله من الشفاحه اعنبو الشيطان ماشفت خير,الله من الشفاحه اعنبو الشيطان ماشفت خير,,[],0,pending,,
mt_dial_lev_fad09f7c,train,44941,DIAL_LEV,كلام حق اريد به باطل الوحدات اول مره في تاريخ الحياه يفوز على فريق كبيره مثل الفيصلي مرتين ياأخي قبل خساره الوحدات من شباب الاردن كان الكلام كله على النادي الفيصلي ولو فاز الوحدات بالدوري كان نفس هذه الكلام بالحرف مكتوب على,كلام حق اريد به باطل الوحدات اول مره في تاريخ الحياه يفوز علي فريق كبيره مثل الفيصلي مرتين يااخي قبل خساره الوحدات من شباب الاردن كان الكلام كله علي النادي الفيصلي ولو فاز الوحدات بالدوري كان نفس هذه الكلام بالحرف مكتوب علي,,[],0,pending,,
mt_msa_ed8715af,train,78577,MSA,ولو ام الزوج عاملت الزوجه ك ( بنتها,ولو ام الزوج عاملت الزوجه ك بنتها,,[],0,pending,,
