example_id,source_split,source_row_id,dialect,original_text,normalized_text,masked_text,mask_spans_json,mask_count,annotation_status,annotator_model,notes
mt_dial_lev_7d6ef987,train,30247,DIAL_LEV,ثانياً : - تعليقات جمهور الوحدات غير منطقية على الاطلاق فالفيصلي لم تحتسب له ثلاثة اهداف صحييحة مئةبالمئة في آخر ثلاث مباريات بدون المبارة الاخيرة مع الرمثا بشهادة كل من شاهد المبارة من معلقين ومختصين ومحايدين لا اشخاصاً ملأ الحقد اعينهم لدرجة انهم بطلوا يشوفو الحقيقة,ثانيا تعليقات جمهور الوحدات غير منطقيه علي الاطلاق فالفيصلي لم تحتسب له ثلاثه اهداف صحييحه ميهبالميه في اخر ثلاث مباريات بدون المباره الاخيره مع الرمثا بشهاده كل من شاهد المباره من معلقين ومختصين ومحايدين لا اشخاصا ملا الحقد اعينهم لدرجه انهم بطلوا يشوفو الحقيقه,,[],0,pending,,
mt_msa_d9dd5e3a,train,20244,MSA,عذرا الله جل شأنه القدوس لا يساوم الانسان ابدا بل تكون كلمته قاطعه ولا حل وسط فيها,عذرا الله جل شانه القدوس لا يساوم الانسان ابدا بل تكون كلمته قاطعه ولا حل وسط فيها,,[],0,pending,,
mt_dial_egy_759b7d82,train,21768,DIAL_EGY,لمتابعة النت والرد والدعم لمساندة البرادعى فوقوا الحكاية أكبر من كدة بكتير والعامة من الشعب 95 % لاعلاقة لها بالنت مشكلكتكم أنكم فاكرين أنكم بتتكلوا مع الشعب,لمتابعه النت والرد والدعم لمسانده البرادعي فوقوا الحكايه اكبر من كده بكتير والعامه من الشعب 95 لاعلاقه لها بالنت مشكلكتكم انكم فاكرين انكم بتتكلوا مع الشعب,,[],0,pending,,
mt_dial_glf_24a340f3,train,2496,DIAL_GLF,والله هزه العادة تشبه عادات الجاهلية والمجتمع السعودي مجتمع مثقف حقو البنات اعملن عصيان حتي لو اوديهم,والله هزه العاده تشبه عادات الجاهليه والمجتمع السعودي مجتمع مثقف حقو البنات اعملن عصيان حتي لو اوديهم,,[],0,pending,,
mt_dial_lev_d4739dfb,train,31608,DIAL_LEV,بداية تشكيلة امبارح راح منها اهم لاعب بمبارياتنا السابقه والي هوا يحيى جمعه اللاعب المتميز ( ( بعدين اتزكر ينزله ),بدايه تشكيله امبارح راح منها اهم لاعب بمبارياتنا السابقه والي هوا يحيي جمعه اللاعب المتميز بعدين اتزكر ينزله,,[],0,pending,,
mt_msa_3fad7aca,train,14892,MSA,والإنتر لعب مع الهلال باعتزال نواف ووصل النهائي .,والانتر لعب مع الهلال باعتزال نواف ووصل النهايي,,[],0,pending,,
mt_dial_egy_d179eeae,train,54732,DIAL_EGY,رنا كبير ومش بينسا حد وانت حكم كبير وشريف وانشاء الله الحق هيرجع لاصحابة,رنا كبير ومش بينسا حد وانت حكم كبير وشريف وانشاء الله الحق هيرجع لاصحابه,,[],0,pending,,
mt_dial_glf_015e8d0e,train,43100,DIAL_GLF,هذه ظواهر التخلّف وأمراضه قادمة الله,هذه ظواهر التخلف وامراضه قادمه الله,,[],0,pending,,
mt_dial_lev_a2871ee9,train,10417,DIAL_LEV,"الاخ سيف : معلش اذا الوحدات كما تقول اخذ المركز الثالث او الرابع , فان الفيصلي لم يحصل المركز الثامن بعد ان اذاقه الغزلان مر العلقم رايح جاي بخمسه",الاخ سيف معلش اذا الوحدات كما تقول اخذ المركز الثالث او الرابع فان الفيصلي لم يحصل المركز الثامن بعد ان اذاقه الغزلان مر العلقم رايح جاي بخمسه,,[],0,pending,,
mt_msa_26b0b015,train,13283,MSA,سبحان الله انا لست متشددة على الاطلاق ولكنى مسلمة وافتخر,سبحان الله انا لست متشدده علي الاطلاق ولكني مسلمه وافتخر,,[],0,pending,,
mt_dial_egy_0e5caba1,train,77576,DIAL_EGY,"وصراحة مش عارف هو عاجبه ايه فى احمد على ماعنده بركات او احمد فتحى واحد منهم يلعب فى اليمين والبدرى شكله عاوز يخلص على ابو تريكه واحده واحده زى احمد حسن كل مباراه يخرجه والعيب محتاج ياخذسقا اقطرعلى شان يرجع لمستواه البدرى من اول الدور الثانى وهوه ماعملش اى حاجه غير انه عاوز يقضى على العيبه الكبيره امثال بلال واسامه وكمان العجيزى واخرهم احمد حسن وابو تريكه والدور جاى على وائل جمعه وسيد معوض , , , وفى النهايه احب ابعث برقية تهنئه مكلله بلورد والريحانالى اخى وحبيبى محمد كمال الزمالكوى حتى النخاع واقوله مبروك عليكم التعادل واقوله متزعلش منى وخلى روحك رياضية يافوله",وصراحه مش عارف هو عاجبه ايه في احمد علي ماعنده بركات او احمد فتحي واحد منهم يلعب في اليمين والبدري شكله عاوز يخلص علي ابو تريكه واحده واحده زي احمد حسن كل مباراه يخرجه والعيب محتاج ياخذسقا اقطرعلي شان يرجع لمستواه البدري من اول الدور الثاني وهوه ماعملش اي حاجه غير انه عاوز يقضي علي العيبه الكبيره امثال بلال واسامه وكمان العجيزي واخرهم احمد حسن وابو تريكه والدور جاي علي وايل جمعه وسيد معوض وفي النهايه احب ابعث برقيه تهنيه مكلله بلورد والريحانالي اخي وحبيبي محمد كمال الزمالكوي حتي النخاع واقوله مبروك عليكم التعادل واقوله متزعلش مني وخلي روحك رياضيه يافوله,,[],0,pending,,
mt_dial_glf_d0beb4ea,train,83149,DIAL_GLF,وانا اقول والي مو عاجبو النقاب في هذا البلد وينتقده يرجع بلدو,وانا اقول والي مو عاجبو النقاب في هذا البلد وينتقده يرجع بلدو,,[],0,pending,,
mt_dial_lev_e089f4c6,train,77872,DIAL_LEV,* النتيجه : - ( قنبلتين وحداتيين ) في مرمى,النتيجه قنبلتين وحداتيين في مرمي,,[],0,pending,,
mt_msa_d1e986c8,train,45400,MSA,اقدم خالص التحية والتقدير للأستاذ محمد السكري على هذا الأنجاز الجديد في عالم الصحافة وإلى الأمام,اقدم خالص التحيه والتقدير للاستاذ محمد السكري علي هذا الانجاز الجديد في عالم الصحافه والي الامام,,[],0,pending,,
mt_dial_egy_741902de,train,53850,DIAL_EGY,لوكان الاسلام دموي كان زمانك في,لوكان الاسلام دموي كان زمانك في,,[],0,pending,,
mt_dial_glf_9d1436db,train,50218,DIAL_GLF,والا انتم اجتمعتو او افترقتوا كلها,والا انتم اجتمعتو او افترقتوا كلها,,[],0,pending,,
mt_dial_lev_5c3536a6,train,41158,DIAL_LEV,مش عارف كيف انحسبت هيك 46 دينار شهري . شكلو احنا مبذرين,مش عارف كيف انحسبت هيك 46 دينار شهري شكلو احنا مبذرين,,[],0,pending,,
mt_msa_ddb6be94,train,60052,MSA,لم تتحدثي عن الطرف الاخر الذي اصابته لوثة الشهرة وكثر المطبلون له عندما اباح ماباح .,لم تتحدثي عن الطرف الاخر الذي اصابته لوثه الشهره وكثر المطبلون له عندما اباح ماباح,,[],0,pending,,
mt_dial_egy_ffc3b70d,train,34939,DIAL_EGY,والأم تنصح بنتها . . . أنسي همومك,والام تنصح بنتها انسي همومك,,[],0,pending,,
mt_dial_glf_e095e605,train,81161,DIAL_GLF,انا اللي عجزت افهمه ليش يعدون السكان بالشكل اليدوي هذا مع ان عندهم سجلات في الاحوال المدنيه ! !,انا اللي عجزت افهمه ليش يعدون السكان بالشكل اليدوي هذا مع ان عندهم سجلات في الاحوال المدنيه,,[],0,pending,,
mt_dial_lev_de3d6909,train,31405,DIAL_LEV,الدرع وحداتي ان شاء الله والهداف مين ه مبينة حسن عبد الفتاح الوحدات اقوى هجوم واقوى دفاع والهداف وحداتي موسم مبين من اولو وحداتي,الدرع وحداتي ان شاء الله والهداف مين ه مبينه حسن عبد الفتاح الوحدات اقوي هجوم واقوي دفاع والهداف وحداتي موسم مبين من اولو وحداتي,,[],0,pending,,
mt_msa_00798d1f,train,42757,MSA,هداها الله ، ، نعم صدق سمو سيدي الأمير فيصل بن خالد لم توفق المعلمة في اختيار الأسلوب المناسب ،,هداها الله نعم صدق سمو سيدي الامير فيصل بن خالد لم توفق المعلمه في اختيار الاسلوب المناسب,,[],0,pending,,
mt_dial_egy_40e36970,train,29183,DIAL_EGY,انت هتحلل اللي القرآن حرمه ؟ ؟ يعني ايه مسلمة تتجوز مسيحي,انت هتحلل اللي القران حرمه يعني ايه مسلمه تتجوز مسيحي,,[],0,pending,,
mt_dial_glf_2e0e08fa,train,54498,DIAL_GLF,مبروك للشباب . . والله يحفظك يابن مساعد .,مبروك للشباب والله يحفظك يابن مساعد,,[],0,pending,,
mt_dial_lev_8720b428,train,62891,DIAL_LEV,بحب اضع ملاحظة وهي ان جميع عطل هذه السنه تأتي يوم سبت عدا عيد الأضحى ويوم الإستقلال 25 / 5 الثلاثاء ان كان يوم عطله واللي مش مصدق يشوف الرزنامه,بحب اضع ملاحظه وهي ان جميع عطل هذه السنه تاتي يوم سبت عدا عيد الاضحي ويوم الاستقلال 25 5 الثلاثاء ان كان يوم عطله واللي مش مصدق يشوف الرزنامه,,[],0,pending,,
mt_msa_f92400f8,train,1239,MSA,مع اطيب الامنيات ودوام التوفيق لكل مافيه خير لهذا البلد,مع اطيب الامنيات ودوام التوفيق لكل مافيه خير لهذا البلد,,[],0,pending,,
mt_dial_egy_5eb9c8a7,train,37088,DIAL_EGY,"انا عايزه اقول ان الكلام ده مش بس معقول لأ ده معقول جدا كمان , عجبني جدا الموضوع و خليت جوزي يقراه عشان يعرف شويه عن عالمنا . . . شكرا للكاتبه , ياريت من ده",انا عايزه اقول ان الكلام ده مش بس معقول لا ده معقول جدا كمان عجبني جدا الموضوع و خليت جوزي يقراه عشان يعرف شويه عن عالمنا شكرا للكاتبه ياريت من ده,,[],0,pending,,
mt_dial_glf_3c048e75,train,16832,DIAL_GLF,راح نشوف متعه كرويه ليس لها,راح نشوف متعه كرويه ليس لها,,[],0,pending,,
mt_dial_lev_df281cc4,train,50380,DIAL_LEV,لماذا دائما المعلم مهمش لماذا لا تكون هناك نقابة للمعلمين على غرار المهندسين والاطباء والمحامين وكافة المهن الاخرى . لماذا كل هذا بحق المعلمين الفئه المكافحه مخرجة الاجيال اجيال,لماذا دايما المعلم مهمش لماذا لا تكون هناك نقابه للمعلمين علي غرار المهندسين والاطباء والمحامين وكافه المهن الاخري لماذا كل هذا بحق المعلمين الفيه المكافحه مخرجه الاجيال اجيال,,[],0,pending,,
mt_msa_80a68fef,train,17863,MSA,اولا الرئاسة لديها علم بذالك ثانيا مبروك البطولة للأتحاد على الفوز في بطولة ممتاز ( الشباب ) يكفي أنهم ركيزة النادي والمنتخب . والوطنية أنهانت في خليج الأمارات وشكرا للثقافة الوطنية عند بعض,اولا الرياسه لديها علم بذالك ثانيا مبروك البطوله للاتحاد علي الفوز في بطوله ممتاز الشباب يكفي انهم ركيزه النادي والمنتخب والوطنيه انهانت في خليج الامارات وشكرا للثقافه الوطنيه عند بعض,,[],0,pending,,
mt_dial_egy_3e54f03c,train,24382,DIAL_EGY,بس بصراحة لا اعلم الكنيسة هتلاقيها منين ؟ ؟ !,بس بصراحه لا اعلم الكنيسه هتلاقيها منين,,[],0,pending,,
mt_dial_glf_d75ef831,train,70889,DIAL_GLF,صحيح ولكن خل المراءه الحين - خل الذكور يلقون وظايف بعدين تكلم عن المراءه - الاهم الرجل الذي يعول المراءه ان كان عاطل والمراءه عامله فهذه مشكله,صحيح ولكن خل المراءه الحين خل الذكور يلقون وظايف بعدين تكلم عن المراءه الاهم الرجل الذي يعول المراءه ان كان عاطل والمراءه عامله فهذه مشكله,,[],0,pending,,
mt_dial_lev_df7d56a9,train,69409,DIAL_LEV,الى اداره الوحدات المحترمه شايف كل ما تشدوا على يد مدرب عراقي وتطلبوا التجديد معه يطالب برفع الاجور والمكأفات والمستحقات ولماذا يرفض جسام بهذا الوقت بالذات هل ليضع النادي في ( خانه اليك ) وبعد ما طار الدوري كان المدرب ثائر جسام ( حاطط يديه على قلبه ) خوفا من الاستغناء عنه لكن الاداره الحكيمه المحترمه في نادي الوحدات جعلته يستمر وملتزمه بالعقد وبعد احرز مع الوحدات كأس الاردن ظن ثائر جسام انه مدرب القرن مدرب العالم والان اصبح يتكبر ويطالب اكثر وهذا مثل ما فعله مواطنه اكرم,الي اداره الوحدات المحترمه شايف كل ما تشدوا علي يد مدرب عراقي وتطلبوا التجديد معه يطالب برفع الاجور والمكافات والمستحقات ولماذا يرفض جسام بهذا الوقت بالذات هل ليضع النادي في خانه اليك وبعد ما طار الدوري كان المدرب ثاير جسام حاطط يديه علي قلبه خوفا من الاستغناء عنه لكن الاداره الحكيمه المحترمه في نادي الوحدات جعلته يستمر وملتزمه بالعقد وبعد احرز مع الوحدات كاس الاردن ظن ثاير جسام انه مدرب القرن مدرب العالم والان اصبح يتكبر ويطالب اكثر وهذا مثل ما فعله مواطنه اكرم,,[],0,pending,,
mt_msa_4708978b,train,36516,MSA,ولكن أين هو من هذا,ولكن اين هو من هذا,,[],0,pending,,
mt_dial_egy_2bc38a5f,train,80053,DIAL_EGY,صدقوني كل البلطجية وتجار المخدرات اعضاء في هذا الحزب المشبوة وكل عربجي من دوول معاه كارنية الحزب وحتشوفهم في لجان الانتخاب يوم الانتخابات ووزارة الداخلية شغاله كويس ومحدش يقدر يقول غير كدة لأن البلجية شغاليين معاهم ولحساب وزارة الداخلية عرفتوا الحقيقة ريحوا نفسكم انتو في عصر الحرمية والبلطجية وتجار الحديد الخردة اللي حاسس نفسة محترم يشفلة بلد,صدقوني كل البلطجيه وتجار المخدرات اعضاء في هذا الحزب المشبوه وكل عربجي من دوول معاه كارنيه الحزب وحتشوفهم في لجان الانتخاب يوم الانتخابات ووزاره الداخليه شغاله كويس ومحدش يقدر يقول غير كده لان البلجيه شغاليين معاهم ولحساب وزاره الداخليه عرفتوا الحقيقه ريحوا نفسكم انتو في عصر الحرميه والبلطجيه وتجار الحديد الخرده اللي حاسس نفسه محترم يشفله بلد,,[],0,pending,,
mt_dial_glf_5518f4a3,train,7120,DIAL_GLF,والله مافهمت شي بس احس ان الواحد يسكن في عشه ابرك,والله مافهمت شي بس احس ان الواحد يسكن في عشه ابرك,,[],0,pending,,
mt_dial_lev_1b2b926c,train,428,DIAL_LEV,ياوحدات شو الى صار كاس الكؤؤس فى,ياوحدات شو الي صار كاس الكووس في,,[],0,pending,,
mt_msa_10d0d3cb,train,1988,MSA,إنتاج أدبي في كتب التراث نسب للجن ولبني عبقر وبني الشيصبان وفي تراث ( أم خلوي وأم سرور ) قبل ثلث قرن,انتاج ادبي في كتب التراث نسب للجن ولبني عبقر وبني الشيصبان وفي تراث ام خلوي وام سرور قبل ثلث قرن,,[],0,pending,,
mt_dial_egy_3e2cb13b,train,48751,DIAL_EGY,ومراتك كانت حتوت بحسرتها لما عرفت وباالتالى طلبت,ومراتك كانت حتوت بحسرتها لما عرفت وباالتالي طلبت,,[],0,pending,,
mt_dial_glf_55cb172e,train,25939,DIAL_GLF,وما اظن مجانين يدفعو له نص مليون ع مبارة هم مو متاهلين,وما اظن مجانين يدفعو له نص مليون ع مباره هم مو متاهلين,,[],0,pending,,
mt_dial_lev_755337bb,train,7856,DIAL_LEV,خافوا الله ياناس ماوصلت بس والله صار امر طبيعي بايامنا,خافوا الله ياناس ماوصلت بس والله صار امر طبيعي بايامنا,,[],0,pending,,
mt_msa_5ca7c866,train,79727,MSA,أبو اكرم وما ادراك ما ابو اكرم . هو من اهم معالم مخيمنا الاصيل الذي نقشت ذكرياته في قلوبنا ولن تمحى ابدا مهما بعدت المسافات بيننا وبين مخيمنا الاصيل . مهما سكنا في الاحياء الراقيه والجميله فسيبقى مخيم الوحدات المكان الذي نفخر به ويذكرنا باصالتنا تراحمنا وتعاطفنا . انا تركت مخيم الوحدات منذ اكثر من 30 سنه لكن الوحدات في قلبي ولا يمكن ان اذهب اجازه الى الاردن ولا اذهب الى الوحدات لاتصفح الذكريات في ازقته وحواريه وبالذات حرتنا العتيقه وبيتنا القديم . ابو اكرم هذا الرجل الشهم الاصيل ليس من الممكن نسيانه ادعو له من كل قلبي أن يمتعه الله بالصحه وبكل لحظه من حياته لان له دين كبير في اعناقنا فكم خفف عنا اللآم لك منا ايها الرجل الكريم كل الحب والتقدير والاحترام . والله عليك يا وحدات ساعه في شوارعك وازقتك والساحه العامه احسن من سنه في شارع الوكالات,ابو اكرم وما ادراك ما ابو اكرم هو من اهم معالم مخيمنا الاصيل الذي نقشت ذكرياته في قلوبنا ولن تمحي ابدا مهما بعدت المسافات بيننا وبين مخيمنا الاصيل مهما سكنا في الاحياء الراقيه والجميله فسيبقي مخيم الوحدات المكان الذي نفخر به ويذكرنا باصالتنا تراحمنا وتعاطفنا انا تركت مخيم الوحدات منذ اكثر من 30 سنه لكن الوحدات في قلبي ولا يمكن ان اذهب اجازه الي الاردن ولا اذهب الي الوحدات لاتصفح الذكريات في ازقته وحواريه وبالذات حرتنا العتيقه وبيتنا القديم ابو اكرم هذا الرجل الشهم الاصيل ليس من الممكن نسيانه ادعو له من كل قلبي ان يمتعه الله بالصحه وبكل لحظه من حياته لان له دين كبير في اعناقنا فكم خفف عنا اللام لك منا ايها الرجل الكريم كل الحب والتقدير والاحترام والله عليك يا وحدات ساعه في شوارعك وازقتك والساحه العامه احسن من سنه في شارع الوكالات,,[],0,pending,,
mt_dial_egy_2cedb195,train,57274,DIAL_EGY,الناس زمان كان ممكن يضحك عليهم لكن النهارده اظن,الناس زمان كان ممكن يضحك عليهم لكن النهارده اظن,,[],0,pending,,
mt_dial_glf_e33c5954,train,43871,DIAL_GLF,الاخ صاحب تعليق رقم واحد الكاميرا ممكن تعمل بنظام النيقاتيف أو الابيض والاسود يعني حتى لو صبغتها بوية بعد والله يجيبونك ويجيبون,الاخ صاحب تعليق رقم واحد الكاميرا ممكن تعمل بنظام النيقاتيف او الابيض والاسود يعني حتي لو صبغتها بويه بعد والله يجيبونك ويجيبون,,[],0,pending,,
mt_dial_lev_ef128e2c,train,23905,DIAL_LEV,الف مليون مبروك للمارد الاخضر وانشاء الله بفوز كأس الاردن وبفرح جماهير طالت انتظارها والى الامام انشاء,الف مليون مبروك للمارد الاخضر وانشاء الله بفوز كاس الاردن وبفرح جماهير طالت انتظارها والي الامام انشاء,,[],0,pending,,
mt_msa_46096250,train,37878,MSA,ونفع الله بك امة الاسلام,ونفع الله بك امه الاسلام,,[],0,pending,,
mt_dial_egy_f5870151,train,80656,DIAL_EGY,يا ريت تخلي مقالاتك أسبوعية .,يا ريت تخلي مقالاتك اسبوعيه,,[],0,pending,,
mt_dial_glf_bd0a62c5,train,53393,DIAL_GLF,انا ابي قرض ابني بيت وابيكم تقسطون لي في الشهر الف وخمس لمدة عشرين سنة يالله موافقين تكفون اقرضوني,انا ابي قرض ابني بيت وابيكم تقسطون لي في الشهر الف وخمس لمده عشرين سنه يالله موافقين تكفون اقرضوني,,[],0,pending,,
mt_dial_lev_1e076f08,train,25379,DIAL_LEV,اود اعلامكم بان الوحدات سيأخذ كأس الاردن هذا العام واهدي الكأس الى سيف ال خطاب ابو الاحساس من دون الناس وانسى يا سيف ال خطاب كل وسواس والله يعين هزيمه الفيصلي من الرمثا اللي بتوجع,اود اعلامكم بان الوحدات سياخذ كاس الاردن هذا العام واهدي الكاس الي سيف ال خطاب ابو الاحساس من دون الناس وانسي يا سيف ال خطاب كل وسواس والله يعين هزيمه الفيصلي من الرمثا اللي بتوجع,,[],0,pending,,
mt_msa_9f8c7333,train,53388,MSA,4 - من المسئول عن تراجع مكانة مصر أقليميا ودوليا,4 من المسيول عن تراجع مكانه مصر اقليميا ودوليا,,[],0,pending,,
