example_id,source_split,source_row_id,dialect,original_text,normalized_text,masked_text,mask_spans_json,mask_count,annotation_status,annotator_model,notes
mt_dial_lev_1c8a3b4f,train,86213,DIAL_LEV,شايفين يا مسلمسن الي كيفتو عليه . . . ولن ترضى عنك اليهود ولا النصارى . .,شايفين يا مسلمسن الي كيفتو عليه ولن ترضي عنك اليهود ولا النصاري,,[],0,pending,,
mt_msa_8d6c1c79,train,56295,MSA,مبروك يا نجمة الصعود و دوري الممتاز يشتاق لحصانة الاسود الذي سطر ملاحم و قدم النجوم للمنتخبات الوطنية مبروك العودة يا النجمة و عقبال العربي ايضا و كل فرق المنطقة التي تستحق الصعود الرمة و التقدم ايضا قدموا موسم رائع و جهود طيبة و لا ننسي شباب الخلود ايضا و عقبال مارد ممثل,مبروك يا نجمه الصعود و دوري الممتاز يشتاق لحصانه الاسود الذي سطر ملاحم و قدم النجوم للمنتخبات الوطنيه مبروك العوده يا النجمه و عقبال العربي ايضا و كل فرق المنطقه التي تستحق الصعود الرمه و التقدم ايضا قدموا موسم رايع و جهود طيبه و لا ننسي شباب الخلود ايضا و عقبال مارد ممثل,,[],0,pending,,
mt_dial_egy_425df7f8,train,80677,DIAL_EGY,الاهلوية مصدقين انهم بيرضوا بالحكام واخطائها امال ولولوا ليه بعد ماتش الحرس بس هو دايما والحق يقال ان الحكم مش بيتاخروا عن الاهلى فى الماتشات الصعبة زى بنالتى المصرى وضربة الجزاء اللى من برة ال 18 فى الشرطة وكانت الجون التانى والنتيجة 1 / 1,الاهلويه مصدقين انهم بيرضوا بالحكام واخطايها امال ولولوا ليه بعد ماتش الحرس بس هو دايما والحق يقال ان الحكم مش بيتاخروا عن الاهلي في الماتشات الصعبه زي بنالتي المصري وضربه الجزاء اللي من بره ال 18 في الشرطه وكانت الجون التاني والنتيجه 1 1,,[],0,pending,,
mt_dial_glf_d2b63f9a,train,61343,DIAL_GLF,ولنا عوده مع محبوبتي الغاليه والدلوعه ( جريدة الرياض ) . . كنت ( سعيدة الايام بنت روق ) والان . . من جد اشتقت لكم جميعا .,ولنا عوده مع محبوبتي الغاليه والدلوعه جريده الرياض كنت سعيده الايام بنت روق والان من جد اشتقت لكم جميعا,,[],0,pending,,
mt_dial_lev_ae9a4fa8,train,61160,DIAL_LEV,الله يعطك العافية يا الكاتب عاطف عساف وعاطف,الله يعطك العافيه يا الكاتب عاطف عساف وعاطف,,[],0,pending,,
mt_msa_105d85a7,train,20722,MSA,واستعاد الممثل جوني دب مكانته بين أجمل رجال العالم,واستعاد الممثل جوني دب مكانته بين اجمل رجال العالم,,[],0,pending,,
mt_dial_egy_248ab7aa,train,2169,DIAL_EGY,بيقولك مرة واحد صعيدى طلع الهرم معرفش ينزل,بيقولك مره واحد صعيدي طلع الهرم معرفش ينزل,,[],0,pending,,
mt_dial_glf_64cb10da,train,29413,DIAL_GLF,الأجانب شبعوا وبعد شبعهم هذا صاروا يناهقون ويبون يفرضون علينا بالقوه الجبريه مايريدون,الاجانب شبعوا وبعد شبعهم هذا صاروا يناهقون ويبون يفرضون علينا بالقوه الجبريه مايريدون,,[],0,pending,,
mt_dial_lev_dea11ffe,train,21810,DIAL_LEV,يارب سلم سلم وخليلنا رأفت,يارب سلم سلم وخليلنا رافت,,[],0,pending,,
mt_msa_2e51d9f2,train,48318,MSA,الله يجعلها أمطار خير وبركه ويعم بها وبخيرها أرجاء مملكتنا الغاليه,الله يجعلها امطار خير وبركه ويعم بها وبخيرها ارجاء مملكتنا الغاليه,,[],0,pending,,
mt_dial_egy_f4dab093,train,75939,DIAL_EGY,"يا جماعة بلاش تعصب , وكلام عن الحكام , خلينا نتفق ان غلطات الحكام أحيانا بتكون معانا أو ضدنا سواء كنا أهلاوية أو زملكاوية أو بنشجع أى نادى تانى , الغلطات دى أحيانا بتفيدنا وكتير جدا بتضرنا",يا جماعه بلاش تعصب وكلام عن الحكام خلينا نتفق ان غلطات الحكام احيانا بتكون معانا او ضدنا سواء كنا اهلاويه او زملكاويه او بنشجع اي نادي تاني الغلطات دي احيانا بتفيدنا وكتير جدا بتضرنا,,[],0,pending,,
mt_dial_glf_e02f55b4,train,5145,DIAL_GLF,هلا بالطله الحلوه مبطين عنك ياشاعرنا,هلا بالطله الحلوه مبطين عنك ياشاعرنا,,[],0,pending,,
mt_dial_lev_66e6053b,train,70487,DIAL_LEV,اكريموا اللحه وآهينوا الشوارب ولا صارت عكسية,اكريموا اللحه واهينوا الشوارب ولا صارت عكسيه,,[],0,pending,,
mt_msa_21945c1b,train,13041,MSA,4 ) المشاركة الثالثة للوحدات كانت عام 95 وخسر من الزوراء العراقي 4 - 0 في عمان و 3 - 1 في,4 المشاركه الثالثه للوحدات كانت عام 95 وخسر من الزوراء العراقي 4 0 في عمان و 3 1 في,,[],0,pending,,
mt_dial_egy_14665074,train,83794,DIAL_EGY,بكره يقولوا أبوه كان مبرمج كمبيوتر,بكره يقولوا ابوه كان مبرمج كمبيوتر,,[],0,pending,,
mt_dial_glf_b1a255a8,train,13934,DIAL_GLF,ليش البلديات لا يستفاد منها الأ,ليش البلديات لا يستفاد منها الا,,[],0,pending,,
mt_dial_lev_d86497a9,train,11451,DIAL_LEV,يا ريت تكون في رقابة على أطقم المستشفيات كمعاملة وتأدية واجب التطبب حتى لو,يا ريت تكون في رقابه علي اطقم المستشفيات كمعامله وتاديه واجب التطبب حتي لو,,[],0,pending,,
mt_msa_9ef3601d,train,49679,MSA,"الحكم شاهد فيقاروا واعطاه كرت , بخلاف رادوي واتمنى من إدارة النصر ان تضع حد لهذا الضغط المستمر على لجنة",الحكم شاهد فيقاروا واعطاه كرت بخلاف رادوي واتمني من اداره النصر ان تضع حد لهذا الضغط المستمر علي لجنه,,[],0,pending,,
mt_dial_egy_a6fd862c,train,43209,DIAL_EGY,اتكلم في موضوع يخص الناس مش موضوع,اتكلم في موضوع يخص الناس مش موضوع,,[],0,pending,,
mt_dial_glf_22303844,train,49866,DIAL_GLF,ارجوا من لديه خبره يجاوبنا,ارجوا من لديه خبره يجاوبنا,,[],0,pending,,
mt_dial_lev_236b40fd,train,76803,DIAL_LEV,يلا مش مشكلة بس انشالله ايطاليا,يلا مش مشكله بس انشالله ايطاليا,,[],0,pending,,
mt_msa_1130e493,train,23116,MSA,كثير من نساءنا عندما تتزوج تحاول عزل زوجها عن,كثير من نساءنا عندما تتزوج تحاول عزل زوجها عن,,[],0,pending,,
mt_dial_egy_2efdeebf,train,981,DIAL_EGY,لعنة الله على ثلاثتكم ملقيتوش غير صور بنات مسلمات,لعنه الله علي ثلاثتكم ملقيتوش غير صور بنات مسلمات,,[],0,pending,,
mt_dial_glf_1e64e375,train,47773,DIAL_GLF,بالنسبة لمدينة الرياض جميع الحوادث الي تحصل تكون في جهة الشرق الجهة المنسية من قبلكم جميع الحوادث تحصل على امتداد طريق خريص شرق بعد حي النظيم وهو طرق تريلات وويت صرف صحي ويوميا ثلاث حالة وفاة وانت عارف الشي ابغاك تجي وتشوف الطريق بس وشف التريلات كيف تمشي ! !,بالنسبه لمدينه الرياض جميع الحوادث الي تحصل تكون في جهه الشرق الجهه المنسيه من قبلكم جميع الحوادث تحصل علي امتداد طريق خريص شرق بعد حي النظيم وهو طرق تريلات وويت صرف صحي ويوميا ثلاث حاله وفاه وانت عارف الشي ابغاك تجي وتشوف الطريق بس وشف التريلات كيف تمشي,,[],0,pending,,
mt_dial_lev_54774512,train,23062,DIAL_LEV,ممكن يااشتغلى ممكن انا من سكان,ممكن يااشتغلي ممكن انا من سكان,,[],0,pending,,
mt_msa_d1b923fa,train,28494,MSA,واليمن والصومال ورقه بيد الغير ضد,واليمن والصومال ورقه بيد الغير ضد,,[],0,pending,,
mt_dial_egy_0e9c104e,train,2598,DIAL_EGY,الباشا المخبر - ج - : ضربونى بقفاهم على ايدى يا فندم . . حتى شوف,الباشا المخبر ج ضربوني بقفاهم علي ايدي يا فندم حتي شوف,,[],0,pending,,
mt_dial_glf_4ac3ccc9,train,41345,DIAL_GLF,ليش مانستضيفه ونتحاور معاه ونشوف وش عنده,ليش مانستضيفه ونتحاور معاه ونشوف وش عنده,,[],0,pending,,
mt_dial_lev_d764bd14,train,40478,DIAL_LEV,( سلم سلامات كل البطولات للوحدات,سلم سلامات كل البطولات للوحدات,,[],0,pending,,
mt_msa_08d96bab,train,27454,MSA,أما حال النقابات . . فهو عجب . . فهل هناك من نقابة تستطيع القيام بدورها,اما حال النقابات فهو عجب فهل هناك من نقابه تستطيع القيام بدورها,,[],0,pending,,
mt_dial_egy_638d56ef,train,1923,DIAL_EGY,وشكلك قرفان من اوضاع الغلط اللي مع تراكمات السنين بقت حاجات طبيعية مالوفة وما عدش حد بياخد باله منها من كتر ما اتعودنا,وشكلك قرفان من اوضاع الغلط اللي مع تراكمات السنين بقت حاجات طبيعيه مالوفه وما عدش حد بياخد باله منها من كتر ما اتعودنا,,[],0,pending,,
mt_dial_glf_28a787ec,train,39355,DIAL_GLF,البطوله خلاص بين . . بايرن ميونخ + الأنتر .,البطوله خلاص بين بايرن ميونخ الانتر,,[],0,pending,,
mt_dial_lev_09e36b48,train,37350,DIAL_LEV,هذا الحكي الصح والله كلنا اخوان واقسم بربي اني احب تراب الاردن كما احب تراب فلسطين نحن عشنا في الاردن وتربينا بها وقائدنا وسيدنا وتاج راسنا جلالة الملك عبد الله اطال الله في عمره وهاي رسالتي من القلب دون اي مبالغة,هذا الحكي الصح والله كلنا اخوان واقسم بربي اني احب تراب الاردن كما احب تراب فلسطين نحن عشنا في الاردن وتربينا بها وقايدنا وسيدنا وتاج راسنا جلاله الملك عبد الله اطال الله في عمره وهاي رسالتي من القلب دون اي مبالغه,,[],0,pending,,
mt_msa_64b6ec41,train,50780,MSA,فعلا لعبة السياسة تحتاج الى الكذب والنفاق والتلون بأكثر من وجه ونكران الجميل والخضوع لاسرائيل وامريكا ولكم فى السادات اسوة وقدوه ، ولكن هل البرادعى لو وصل الى الحكم سوف يتخلى عن تلك الصفات المذموهة ؟,فعلا لعبه السياسه تحتاج الي الكذب والنفاق والتلون باكثر من وجه ونكران الجميل والخضوع لاسراييل وامريكا ولكم في السادات اسوه وقدوه ولكن هل البرادعي لو وصل الي الحكم سوف يتخلي عن تلك الصفات المذموهه,,[],0,pending,,
mt_dial_egy_01a342e0,train,12671,DIAL_EGY,بس احنا نستاهل إللى كان بيحصلنا من,بس احنا نستاهل اللي كان بيحصلنا من,,[],0,pending,,
mt_dial_glf_5fd1f92a,train,26696,DIAL_GLF,ياناس . والله . الهلال . فريق . عادي . بس . اعلامه . الضال . مصورة .,ياناس والله الهلال فريق عادي بس اعلامه الضال مصوره,,[],0,pending,,
mt_dial_lev_7047550b,train,24517,DIAL_LEV,ما حد راح يسرق لا الموظف الكبير و الا الصغير لانو عارف انو الفلوس الي معو بتكفي يطعمي ولادو,ما حد راح يسرق لا الموظف الكبير و الا الصغير لانو عارف انو الفلوس الي معو بتكفي يطعمي ولادو,,[],0,pending,,
mt_msa_30821215,train,84098,MSA,رغم اني سعودي ولكن لو لم يكن حسام حسن والزمالك عملاقين لما تقدم حسام بالزمالك من مراكز متاخرة الى المركز الثاني وهذا ما ازعج كل الفرق وبتاكيد النادي المتصدر عندما يكون لك منافسين وتاخذ الدوري فانتي قوي ولكن عندما تكون وحيدن فاكيد انك الاضعف لانك لن ترا,رغم اني سعودي ولكن لو لم يكن حسام حسن والزمالك عملاقين لما تقدم حسام بالزمالك من مراكز متاخره الي المركز الثاني وهذا ما ازعج كل الفرق وبتاكيد النادي المتصدر عندما يكون لك منافسين وتاخذ الدوري فانتي قوي ولكن عندما تكون وحيدن فاكيد انك الاضعف لانك لن ترا,,[],0,pending,,
mt_dial_egy_3e9f0c37,train,19621,DIAL_EGY,"ليتها اراء شخصية وصادرة عنك انت ومن نتاج عقلك انت , لكنا رددنا عليها , لكن مش معقول الانسان هايقعد يرد على مجموعات من الناس بلا فكر او منطق يخالفون منطق الاشياء ويدافعون دائما عن الخطأ وهو مايسمى فى اللغة استنطاع",ليتها اراء شخصيه وصادره عنك انت ومن نتاج عقلك انت لكنا رددنا عليها لكن مش معقول الانسان هايقعد يرد علي مجموعات من الناس بلا فكر او منطق يخالفون منطق الاشياء ويدافعون دايما عن الخطا وهو مايسمي في اللغه استنطاع,,[],0,pending,,
mt_dial_glf_8d5caab8,train,10989,DIAL_GLF,يازين الجدات خاصة الطيبات منهن / هذه هي المرأة دائماً التضحية في دمها رغم القامعين لها منهم,يازين الجدات خاصه الطيبات منهن هذه هي المراه دايما التضحيه في دمها رغم القامعين لها منهم,,[],0,pending,,
mt_dial_lev_c1aa9afe,train,33201,DIAL_LEV,كل العالم عم بساو هذه المسيرة مش بس في عمان ، وكل كان واقف مع السيدة التي تلبس الزي ، بس احنا ما بنحب اي ايش بوعي الناس وبفهمهم ، خليها مثل النعام,كل العالم عم بساو هذه المسيره مش بس في عمان وكل كان واقف مع السيده التي تلبس الزي بس احنا ما بنحب اي ايش بوعي الناس وبفهمهم خليها مثل النعام,,[],0,pending,,
mt_msa_9d3dfb0d,train,67907,MSA,ياأخوان تقدم الهلال على الأندية الأيطالية او الأنجليزية . . . بسبب عدد الفوز محلياً وخارجيا لشهر مارس . . يعني شهر واحد . . . يعني الأندية الأوربية عندها اخفاقات واكثرها مو مشارك بالليجا . . او السوبر الأوروبي .,يااخوان تقدم الهلال علي الانديه الايطاليه او الانجليزيه بسبب عدد الفوز محليا وخارجيا لشهر مارس يعني شهر واحد يعني الانديه الاوربيه عندها اخفاقات واكثرها مو مشارك بالليجا او السوبر الاوروبي,,[],0,pending,,
mt_dial_egy_a233cdde,train,13005,DIAL_EGY,اجنا بنصدق علي طول الكلام حتي اية بنصدق علي طول احنا كدة بتوع التصديق والتصفيق واة دة طبعنا طبعا كلة صح وصحيح واف صح و 100 100 يا ابو فريدة يا 00000000000 غالي,اجنا بنصدق علي طول الكلام حتي ايه بنصدق علي طول احنا كده بتوع التصديق والتصفيق واه ده طبعنا طبعا كله صح وصحيح واف صح و 100 100 يا ابو فريده يا 00000000000 غالي,,[],0,pending,,
mt_dial_glf_15d6d753,train,63287,DIAL_GLF,السؤال . . . وش الجديد اللي ودك توصله لنا كقراء نحبك ؟ ؟ !,السوال وش الجديد اللي ودك توصله لنا كقراء نحبك,,[],0,pending,,
mt_dial_lev_46e6f42a,train,18685,DIAL_LEV,لو سمحتو ممكن اسال المستفيدين من هذه المكرمة هم فقط الطلاب الي حصلو على مكرمة المعلمين او جميع ابناء المعلمين ؟,لو سمحتو ممكن اسال المستفيدين من هذه المكرمه هم فقط الطلاب الي حصلو علي مكرمه المعلمين او جميع ابناء المعلمين,,[],0,pending,,
mt_msa_dfe15930,train,1732,MSA,لا لوجود الحضري في الأهلي ، الأهلي سيخسر أكثر بكثير مما سيكسبه إذا عاد الحضري ، ولا مُصالحة ، ولا اعتذار يُقبل ، عندما نسي الحضري النادي ، انتهى وجوده إلى الأبد,لا لوجود الحضري في الاهلي الاهلي سيخسر اكثر بكثير مما سيكسبه اذا عاد الحضري ولا مصالحه ولا اعتذار يقبل عندما نسي الحضري النادي انتهي وجوده الي الابد,,[],0,pending,,
mt_dial_egy_39f4d7a4,train,37903,DIAL_EGY,الى الاخ المحرر انت غير محايد بالمرة حيث انك تلغى اى تعليق به اساءة للزمالك بينما تنشر سب علنى للمهندس عدلى القيعى من صاحب التعليق رقم 11 علما بان هذا الرجل كل زنبه انه شاطر فى,الي الاخ المحرر انت غير محايد بالمره حيث انك تلغي اي تعليق به اساءه للزمالك بينما تنشر سب علني للمهندس عدلي القيعي من صاحب التعليق رقم 11 علما بان هذا الرجل كل زنبه انه شاطر في,,[],0,pending,,
mt_dial_glf_63ff856c,train,59170,DIAL_GLF,والله صرنا ضايعين مافي احد يسمعلنا غير بعض مافي قوانين ولا,والله صرنا ضايعين مافي احد يسمعلنا غير بعض مافي قوانين ولا,,[],0,pending,,
mt_dial_lev_a9674028,train,15376,DIAL_LEV,يا حبيبي سيبك منهم لانهم عارفين الجواب كفيهم صدمات هذا الموسم من نكسات داخليه وخارجيه من وين بدهم يتلقوها فك عنهم يازلمه كفينا فخر انه نادينا عمره ما استعان بلاعب من خارج النادي والدوري للزعيم وانا متاكد انك مرتاح نفسيا مثلك مثل باقي جمهور الزعيم لانكو حصلتوا على اهم لقب بكل جداره,يا حبيبي سيبك منهم لانهم عارفين الجواب كفيهم صدمات هذا الموسم من نكسات داخليه وخارجيه من وين بدهم يتلقوها فك عنهم يازلمه كفينا فخر انه نادينا عمره ما استعان بلاعب من خارج النادي والدوري للزعيم وانا متاكد انك مرتاح نفسيا مثلك مثل باقي جمهور الزعيم لانكو حصلتوا علي اهم لقب بكل جداره,,[],0,pending,,
mt_msa_e10bc29d,train,1276,MSA,عالمي بحت قبل صدور أنشأء نادي,عالمي بحت قبل صدور انشاء نادي,,[],0,pending,,
