example_id,source_split,source_row_id,dialect,original_text,normalized_text,masked_text,mask_spans_json,mask_count,annotation_status,annotator_model,notes
mt_dial_egy_2e5bcafe,train,10440,DIAL_EGY,نور محامى وعضو برلمانى ناجح لكن لايصلح رئيس جمهورية واسعة اوى,نور محامي وعضو برلماني ناجح لكن لايصلح رييس جمهوريه واسعه اوي,,[],0,pending,,
mt_dial_glf_a6e588ce,train,73768,DIAL_GLF,تتكلمون عن العصر الحجري نتهاء الله لا,تتكلمون عن العصر الحجري نتهاء الله لا,,[],0,pending,,
mt_dial_lev_5aec923e,train,79799,DIAL_LEV,الى اللقاء يا كابتن فيصل والله ما قصرت . .,الي اللقاء يا كابتن فيصل والله ما قصرت,,[],0,pending,,
mt_msa_89987ca9,train,16975,MSA,يضحكون وشرهتك على آلي يركبها خطوط لا تحترم عملائها تعتبر غير محترمة,يضحكون وشرهتك علي الي يركبها خطوط لا تحترم عملايها تعتبر غير محترمه,,[],0,pending,,
mt_dial_egy_ed995663,train,24179,DIAL_EGY,حتى الغريب رقضكوا وموش طايق يسمع اسم النادى ابو,حتي الغريب رقضكوا وموش طايق يسمع اسم النادي ابو,,[],0,pending,,
mt_dial_glf_8338401e,train,64195,DIAL_GLF,يمكن يحتجون بعض الناس يقولون,يمكن يحتجون بعض الناس يقولون,,[],0,pending,,
mt_dial_lev_f5725c86,train,45835,DIAL_LEV,بدكم نستخدم منتجات وطنية خلينا ساكتين مزبوط سعرها رخيص بس ما بضاين عند الشخص غير يومين أو شهر ان كترت فالأفضل أدفع سعر المنتجات الأجنبية الغالية ولا أدفع سعر الوطني الرخيص سريع التلف صح أو,بدكم نستخدم منتجات وطنيه خلينا ساكتين مزبوط سعرها رخيص بس ما بضاين عند الشخص غير يومين او شهر ان كترت فالافضل ادفع سعر المنتجات الاجنبيه الغاليه ولا ادفع سعر الوطني الرخيص سريع التلف صح او,,[],0,pending,,
mt_msa_bb28da55,train,24147,MSA,حسام حسن هو العميد الحقيقى لأنه ببساطة اوصلنا الى كأس العالم و هذا مجد و شرف لم و لن يناله الصغير أحمد حسن . .,حسام حسن هو العميد الحقيقي لانه ببساطه اوصلنا الي كاس العالم و هذا مجد و شرف لم و لن يناله الصغير احمد حسن,,[],0,pending,,
mt_dial_egy_5c43c70b,train,21150,DIAL_EGY,بكرة ح يطلع زى الشعرة من,بكره ح يطلع زي الشعره من,,[],0,pending,,
mt_dial_glf_3e87764b,train,756,DIAL_GLF,توبة ان كنت احبك تاني توبة . . توبة .,توبه ان كنت احبك تاني توبه توبه,,[],0,pending,,
mt_dial_lev_473081ae,train,21796,DIAL_LEV,كيفك معاذ مبروك الفوز الأول وأهدافك كمان وكمان في زيادة انشاء,كيفك معاذ مبروك الفوز الاول واهدافك كمان وكمان في زياده انشاء,,[],0,pending,,
mt_msa_564b9cc0,train,74385,MSA,ومهما تمنعت من الممكن ان لا تستطيع ان تقاومها الا من رحم,ومهما تمنعت من الممكن ان لا تستطيع ان تقاومها الا من رحم,,[],0,pending,,
mt_dial_egy_6e6b820c,train,40438,DIAL_EGY,المشكلة انى مش لاقى ولا تعليق بيمدح فى تصريحات السيد المستشار بل بالعكس جابه لنفسه بمثل هذه التصريحات وقلب على نفسه مواجع كان فى غنى يسمعها او يفتكرها,المشكله اني مش لاقي ولا تعليق بيمدح في تصريحات السيد المستشار بل بالعكس جابه لنفسه بمثل هذه التصريحات وقلب علي نفسه مواجع كان في غني يسمعها او يفتكرها,,[],0,pending,,
mt_dial_glf_f4e6a1b7,train,65004,DIAL_GLF,الحين الحكومه معطيه الكهرباء عشر سنين ماتاخذ من,الحين الحكومه معطيه الكهرباء عشر سنين ماتاخذ من,,[],0,pending,,
mt_dial_lev_ffbe3c3e,train,32026,DIAL_LEV,انا مساهم في الشركة ارجومن العارفين ان يخبروني ماذا بالنسبة لحقوق,انا مساهم في الشركه ارجومن العارفين ان يخبروني ماذا بالنسبه لحقوق,,[],0,pending,,
mt_msa_34cc9aff,train,56387,MSA,اللهم اغثنا غيثآ هنيآ مرئيآ واجعله سقيا خير وبركه,اللهم اغثنا غيثا هنيا مرييا واجعله سقيا خير وبركه,,[],0,pending,,
mt_dial_egy_8efb9354,train,62619,DIAL_EGY,ولا محسور بخمس عيال من,ولا محسور بخمس عيال من,,[],0,pending,,
mt_dial_glf_52933acd,train,65228,DIAL_GLF,بختصار على الكورة السعودية السلام,بختصار علي الكوره السعوديه السلام,,[],0,pending,,
mt_dial_lev_54955601,train,78489,DIAL_LEV,يعني بصراحه حرام عليك يا,يعني بصراحه حرام عليك يا,,[],0,pending,,
mt_msa_0ae0a5e0,train,23863,MSA,مبروك لمصر وفرحتكم هي فرحتنا,مبروك لمصر وفرحتكم هي فرحتنا,,[],0,pending,,
mt_dial_egy_9d44ac1d,train,43083,DIAL_EGY,ايناس النجار لا تبحث عن ادوار ولا بطيخ هي تبحث عن الجنس فقط يمكن حاسه بفراغ او تشعر,ايناس النجار لا تبحث عن ادوار ولا بطيخ هي تبحث عن الجنس فقط يمكن حاسه بفراغ او تشعر,,[],0,pending,,
mt_dial_glf_31a6fe40,train,54033,DIAL_GLF,وتستاهل الساعه الثمينه لانك تستاهلها بتفوق بدراستك ورفعت رؤوس السعوديين وباخلاقك العاليه وهذا اهم,وتستاهل الساعه الثمينه لانك تستاهلها بتفوق بدراستك ورفعت رووس السعوديين وباخلاقك العاليه وهذا اهم,,[],0,pending,,
mt_dial_lev_15e77013,train,67959,DIAL_LEV,صار عنا أكتر من الف وزير متقاعد وأكتر من 6 الاف نائب,صار عنا اكتر من الف وزير متقاعد واكتر من 6 الاف نايب,,[],0,pending,,
mt_msa_b351500c,train,30450,MSA,أرأيت أكثر عجباً من ذلك,ارايت اكثر عجبا من ذلك,,[],0,pending,,
mt_dial_egy_c36fb5b1,train,49687,DIAL_EGY,من فترة كده كان فيه واحده محاميه مصريه مسلمة اسمها,من فتره كده كان فيه واحده محاميه مصريه مسلمه اسمها,,[],0,pending,,
mt_dial_glf_29bad577,train,61604,DIAL_GLF,صح المعامله بتاخذ سنين ودهور طبعا بحكم اليه عمل القضاء بس يعني احسن,صح المعامله بتاخذ سنين ودهور طبعا بحكم اليه عمل القضاء بس يعني احسن,,[],0,pending,,
mt_dial_lev_b345eecc,train,66935,DIAL_LEV,بصراحه انتو شاطرين بهالشلغلات يعني البلد ما فيها موارد غير هيك ولا بد انها تعمل شي تحسن من دخلها والمستوى,بصراحه انتو شاطرين بهالشلغلات يعني البلد ما فيها موارد غير هيك ولا بد انها تعمل شي تحسن من دخلها والمستوي,,[],0,pending,,
mt_msa_7b5fd62a,train,23964,MSA,خطوة موقه انشالله نريد خطوات اخرامماثله لازم نستفيد من الاجهزة الاكترونيه قدر الامكان في خدمتنى ولا تكون وبالا,خطوه موقه انشالله نريد خطوات اخرامماثله لازم نستفيد من الاجهزه الاكترونيه قدر الامكان في خدمتني ولا تكون وبالا,,[],0,pending,,
mt_dial_egy_da15249b,train,6412,DIAL_EGY,ولكن برضة نلرجع ونقول هذا جهل بأمور الدين ويتحمل مسءولية هذا الاسرة ووزارة التربية,ولكن برضه نلرجع ونقول هذا جهل بامور الدين ويتحمل مسءوليه هذا الاسره ووزاره التربيه,,[],0,pending,,
mt_dial_glf_543608e7,train,14786,DIAL_GLF,اصلا انتو متاكدين الظروف الماديه والوضيفيه هي,اصلا انتو متاكدين الظروف الماديه والوضيفيه هي,,[],0,pending,,
mt_dial_lev_943c9892,train,9056,DIAL_LEV,- الجوهري سيبارك للفيصلي بالدوري ( مبروك ) ولكن الطريف ان الجوهري ليس معه هديه لانه الهديه في الاصل وصلت الى النادي الفيصلي من شباب الاردن وهي اغلى من كل هدايا العالم وهي هديه الدوري ( في احلى من هيك هديه,الجوهري سيبارك للفيصلي بالدوري مبروك ولكن الطريف ان الجوهري ليس معه هديه لانه الهديه في الاصل وصلت الي النادي الفيصلي من شباب الاردن وهي اغلي من كل هدايا العالم وهي هديه الدوري في احلي من هيك هديه,,[],0,pending,,
mt_msa_1dc4f5ab,train,69898,MSA,الى كل من يظن انه مظلوم الى كل من يظن انه شهيد الواجب الرياضي,الي كل من يظن انه مظلوم الي كل من يظن انه شهيد الواجب الرياضي,,[],0,pending,,
mt_dial_egy_189c9258,train,33005,DIAL_EGY,أية البواخة دي أية الئي أنا شيفة دة لف وأرجع تاني لف وأرجع تاني . . .,ايه البواخه دي ايه اليي انا شيفه ده لف وارجع تاني لف وارجع تاني,,[],0,pending,,
mt_dial_glf_9ee4e1de,train,12074,DIAL_GLF,مهما تمدحون في آهلي أشقير ما توفونهم,مهما تمدحون في اهلي اشقير ما توفونهم,,[],0,pending,,
mt_dial_lev_2c9049aa,train,46253,DIAL_LEV,الى اكرم سلمان وين القوه الضاربه للفيصلي وين الرومان وين البطولات فريقك ضعيف,الي اكرم سلمان وين القوه الضاربه للفيصلي وين الرومان وين البطولات فريقك ضعيف,,[],0,pending,,
mt_msa_79f4a1a6,train,34454,MSA,قضية بشعه لابد وأن يُحاسب عليها من فعلها بتلك,قضيه بشعه لابد وان يحاسب عليها من فعلها بتلك,,[],0,pending,,
mt_dial_egy_914c21fe,train,14654,DIAL_EGY,الباشا اللي بيقول صوت المراة عورة هقوله صباح التخلف روح اقرا ابسط مبادئ السنة واعرف الصاحبة كانوا بيتعلموا من الصحابيات وده اكبر دليل ان صوت المراة عورة في حالة بوس الواوا والمياعة والمياصة مش في حالة الاحترام وطلب العلم والعمل,الباشا اللي بيقول صوت المراه عوره هقوله صباح التخلف روح اقرا ابسط مبادي السنه واعرف الصاحبه كانوا بيتعلموا من الصحابيات وده اكبر دليل ان صوت المراه عوره في حاله بوس الواوا والمياعه والمياصه مش في حاله الاحترام وطلب العلم والعمل,,[],0,pending,,
mt_dial_glf_3c7d613d,train,20253,DIAL_GLF,هل مهمة المرشد استدعاء ولي الامر ؟ يااخي اولادك في البيت لما يتضاربوا في البيت تضربهم عشان يتركوا بعض في الشارع في المضاربات الجماعيه الشرطه تنهيها بالعصي الكهربائية ورشاشات المويا المرشد مطلوب منه يفرقهم بيده وانا اقولك كمساعد اقولك افرقهم بالعصي صير مرشد يوم واحد في ثانوي وبعدين اتفلسف قال هروب,هل مهمه المرشد استدعاء ولي الامر يااخي اولادك في البيت لما يتضاربوا في البيت تضربهم عشان يتركوا بعض في الشارع في المضاربات الجماعيه الشرطه تنهيها بالعصي الكهرباييه ورشاشات المويا المرشد مطلوب منه يفرقهم بيده وانا اقولك كمساعد اقولك افرقهم بالعصي صير مرشد يوم واحد في ثانوي وبعدين اتفلسف قال هروب,,[],0,pending,,
mt_dial_lev_ec25ed5d,train,83484,DIAL_LEV,لذلط ادعوطن للتريث و عدم ضعط اللاعبين اكثرمن,لذلط ادعوطن للتريث و عدم ضعط اللاعبين اكثرمن,,[],0,pending,,
mt_msa_4d1dbf09,train,78728,MSA,ياليت امانة حائل تهتم مثل امانة,ياليت امانه حايل تهتم مثل امانه,,[],0,pending,,
mt_dial_egy_ddc6449d,train,32595,DIAL_EGY,إن فيه زمن الجهل ليه إيد ورجل أكيد الزمن اللى إحنا عايشيين فيه - الزمن اللى إحنا,ان فيه زمن الجهل ليه ايد ورجل اكيد الزمن اللي احنا عايشيين فيه الزمن اللي احنا,,[],0,pending,,
mt_dial_glf_598ce08d,train,7956,DIAL_GLF,كفو والله يا نمور الاتحاد هزمتموهم في عقر دارهم وأنتزعتوا الصدارة منهم رغم كل المحاباة التي يجدها الهلال من الاتحاد السعودي فتأجيل المباراة عنده مليون علامة إستفهام لكن الله سبحانه وتعالى إرادته أقوى من إرادة من يريدون سلب الصدارة من من يستحقها إلا من لا يستحقها والحمد لله على نصر الله ودمتم سالمين,كفو والله يا نمور الاتحاد هزمتموهم في عقر دارهم وانتزعتوا الصداره منهم رغم كل المحاباه التي يجدها الهلال من الاتحاد السعودي فتاجيل المباراه عنده مليون علامه استفهام لكن الله سبحانه وتعالي ارادته اقوي من اراده من يريدون سلب الصداره من من يستحقها الا من لا يستحقها والحمد لله علي نصر الله ودمتم سالمين,,[],0,pending,,
mt_dial_lev_c6d245bf,train,39293,DIAL_LEV,يا أخي سمعنا عن قانون يمنع التدخين في الأماكن العامة ، وين تطبيقه ؟ مش حرام عليكو تقتلو شجرة مشان تطبعوا قوانين ما حدا عنده نية لتطبيقها ؟,يا اخي سمعنا عن قانون يمنع التدخين في الاماكن العامه وين تطبيقه مش حرام عليكو تقتلو شجره مشان تطبعوا قوانين ما حدا عنده نيه لتطبيقها,,[],0,pending,,
mt_msa_4d7795c0,train,32073,MSA,هناك أناس فوق القانون لا يمكن أن,هناك اناس فوق القانون لا يمكن ان,,[],0,pending,,
mt_dial_egy_4fd8915b,train,10790,DIAL_EGY,بجد لا تعليق بعد ضرتك ولكنى اطمع فى رابط لهذه الحلقه بتمنى بجد اتفرج,بجد لا تعليق بعد ضرتك ولكني اطمع في رابط لهذه الحلقه بتمني بجد اتفرج,,[],0,pending,,
mt_dial_glf_357a7663,train,32740,DIAL_GLF,والبعض ما يحلوا له نشر الغسيل إلا على بلكون الشارع واللي ماعنده بلكونه يمد حبل وينشر . .,والبعض ما يحلوا له نشر الغسيل الا علي بلكون الشارع واللي ماعنده بلكونه يمد حبل وينشر,,[],0,pending,,
mt_dial_lev_8cd104a4,train,73657,DIAL_LEV,روح جيبلك كيكه واحتفل مع الريان,روح جيبلك كيكه واحتفل مع الريان,,[],0,pending,,
mt_msa_b76dc1f2,train,78278,MSA,عائله وحاضنه وكافله وراعيه الفساد وقلة الناصحين,عايله وحاضنه وكافله وراعيه الفساد وقله الناصحين,,[],0,pending,,
mt_dial_egy_194beb3b,train,77475,DIAL_EGY,اهدى يا دوك وركزي وانتى بتكتبي ويارب تتوترى اكتر انتى وحزبك اللى وتر 80 مليون مصري وكرهنا في مصر باللى,اهدي يا دوك وركزي وانتي بتكتبي ويارب تتوتري اكتر انتي وحزبك اللي وتر 80 مليون مصري وكرهنا في مصر باللي,,[],0,pending,,
mt_dial_glf_e20146b3,train,15231,DIAL_GLF,اللي يدري يدري واللي ما يدري يقول خمشة,اللي يدري يدري واللي ما يدري يقول خمشه,,[],0,pending,,
mt_dial_lev_a3886041,train,57822,DIAL_LEV,انا شب وكل الشباب بتمنو النساء بتنقبو حتى ما يثيرو الشهوة لدينا ! ! الفساد دمر العالم والغزو الفكري والتقليد الأعمى غزا البلاد العربية الاسلامية ! ! دنيا اخر وقت والأشي اللي بقهر التقييمات جيدة جداً ! ! ! حسبي الله ونعم,انا شب وكل الشباب بتمنو النساء بتنقبو حتي ما يثيرو الشهوه لدينا الفساد دمر العالم والغزو الفكري والتقليد الاعمي غزا البلاد العربيه الاسلاميه دنيا اخر وقت والاشي اللي بقهر التقييمات جيده جدا حسبي الله ونعم,,[],0,pending,,
mt_msa_8817e568,train,42408,MSA,نعم هذا هو حالنا هذه الايام فمن يرفض ان يكوس ويخالف القوانين يصبح متعسف لقد رفض رئيس الجامعه ان يشارك فى هذه الموامره والاحتيال على القانون ولم يستجيب لطلب هذه الاستاذه التى ارادت استغلال طلب الوظيفه فى قنا لكى تطلب النقل فيما بعد والذهاب الى الجامعه التى تريدها رئيس جامعه جنوب الوادى هو رجلا عرف بالنذاهه والشرف ولقد ساهم كثيرا فى تطور الجامعه الى الامام فياليت كثيرا,نعم هذا هو حالنا هذه الايام فمن يرفض ان يكوس ويخالف القوانين يصبح متعسف لقد رفض رييس الجامعه ان يشارك في هذه الموامره والاحتيال علي القانون ولم يستجيب لطلب هذه الاستاذه التي ارادت استغلال طلب الوظيفه في قنا لكي تطلب النقل فيما بعد والذهاب الي الجامعه التي تريدها رييس جامعه جنوب الوادي هو رجلا عرف بالنذاهه والشرف ولقد ساهم كثيرا في تطور الجامعه الي الامام فياليت كثيرا,,[],0,pending,,
mt_dial_egy_29da0f8a,train,20353,DIAL_EGY,علي العموم هو اللي لسه ماشي عكس الناس مفيش غير الحزب الوطني,علي العموم هو اللي لسه ماشي عكس الناس مفيش غير الحزب الوطني,,[],0,pending,,
mt_dial_glf_2f5e3fb6,train,28311,DIAL_GLF,أجل بكرة البنت تبي ابوها يحضر حفل,اجل بكره البنت تبي ابوها يحضر حفل,,[],0,pending,,
mt_dial_lev_244f5b1c,train,11601,DIAL_LEV,ما بعرف ايش بدي اعلق اسر الشهداء عايشين ملوك والتعويضات الي بياخدوها بتكفيهم لولد ولدهم وبعدين مشستفى التحرير الفلسطيني مكفل فيهم مو بس انتي يا ام صهيب في كتير اطفال مرضا شوفي اهل غزه شوفي اطفال الي في الشوراع وانتي بدك مساعده لاحول ولا قوةالا بالله بعدين بدهمايش سويلك الناس ما في منو علاج ابنك غير المسكنات على كل حال الله يشفيلك,ما بعرف ايش بدي اعلق اسر الشهداء عايشين ملوك والتعويضات الي بياخدوها بتكفيهم لولد ولدهم وبعدين مشستفي التحرير الفلسطيني مكفل فيهم مو بس انتي يا ام صهيب في كتير اطفال مرضا شوفي اهل غزه شوفي اطفال الي في الشوراع وانتي بدك مساعده لاحول ولا قوهالا بالله بعدين بدهمايش سويلك الناس ما في منو علاج ابنك غير المسكنات علي كل حال الله يشفيلك,,[],0,pending,,
mt_msa_947a59ba,train,65693,MSA,"النقاب أساسا مختلف فيه لدى العلماء على مر العصور فلا تأخذكم العصبيه على لا شيء . . لم يحظروا الحجاب وإنما النقاب وذلك لدواعي أمنية و ليست سياسيه . لديهم وجة نظر ويجب احترامها لا شتمها و التشكيك في نواياها , وهي دولة مسيحيه ماذا تنتظرون منهم ؟ ؟ ! ! هذا ما اسميه الفكر الإرهابي",النقاب اساسا مختلف فيه لدي العلماء علي مر العصور فلا تاخذكم العصبيه علي لا شيء لم يحظروا الحجاب وانما النقاب وذلك لدواعي امنيه و ليست سياسيه لديهم وجه نظر ويجب احترامها لا شتمها و التشكيك في نواياها وهي دوله مسيحيه ماذا تنتظرون منهم هذا ما اسميه الفكر الارهابي,,[],0,pending,,
mt_dial_egy_42e60cb0,train,30608,DIAL_EGY,ياجماعه عيب والله الى بيشوف الصور مصريين مش,ياجماعه عيب والله الي بيشوف الصور مصريين مش,,[],0,pending,,
mt_dial_glf_96494c7d,train,44541,DIAL_GLF,نزل الحديد بعد ما دفعت اللي وراي واللي قدامي ولا انهيت الدور الثاني بعد ! !,نزل الحديد بعد ما دفعت اللي وراي واللي قدامي ولا انهيت الدور الثاني بعد,,[],0,pending,,
mt_dial_lev_5a16a8fc,train,25447,DIAL_LEV,الحمد لله عالسلامة والله شكل السيارة,الحمد لله عالسلامه والله شكل السياره,,[],0,pending,,
mt_msa_96265152,train,69028,MSA,يعتصر الحقد قلوبهم عندما يرو قوة التلاحم بين الا,يعتصر الحقد قلوبهم عندما يرو قوه التلاحم بين الا,,[],0,pending,,
mt_dial_egy_30c3bfad,train,82502,DIAL_EGY,على الاقل يا ست ام حسين احنا وللة الحمد مش بيموت ى ملاعبنا حد زى عندكو كل ماتش يموت 10 و 12 شخص يا ام حسين قولى لحسين اجرى بسرعة يا واد يا حسين هاتلينا منة يجيى باكوين الصلاة ع الزين الصلاة ع,علي الاقل يا ست ام حسين احنا ولله الحمد مش بيموت ي ملاعبنا حد زي عندكو كل ماتش يموت 10 و 12 شخص يا ام حسين قولي لحسين اجري بسرعه يا واد يا حسين هاتلينا منه يجيي باكوين الصلاه ع الزين الصلاه ع,,[],0,pending,,
mt_dial_glf_1b11d11e,train,55827,DIAL_GLF,من شفت نضارت نور وانا غاسل يدي بس ان شاء الله يفوزون,من شفت نضارت نور وانا غاسل يدي بس ان شاء الله يفوزون,,[],0,pending,,
mt_dial_lev_b35b31fd,train,19456,DIAL_LEV,جمهور الفيصلي دائما بيفرحوا وملوا من كتر الفرح الدور والباقي على جمهور الوحدات يفرح خارجيا مساكين طول عمرهم بيستنوا بس مافي نتيجه فريقهم دائما جسر عبور للفرق الاخري وفي الاخر بيبرروا وبيقولوا مجموعتنا قويه الله مع اسود الاردن حتى يكمل مسيرة الفيصلي الزعيم في البطولات,جمهور الفيصلي دايما بيفرحوا وملوا من كتر الفرح الدور والباقي علي جمهور الوحدات يفرح خارجيا مساكين طول عمرهم بيستنوا بس مافي نتيجه فريقهم دايما جسر عبور للفرق الاخري وفي الاخر بيبرروا وبيقولوا مجموعتنا قويه الله مع اسود الاردن حتي يكمل مسيره الفيصلي الزعيم في البطولات,,[],0,pending,,
mt_msa_067f3fb0,train,10136,MSA,اذا اردتم معرفة اهمية اغلاق المحلات وقت الصلاه فانظروا الى الدول الاسلاميه ونسبة من يصلون فيها سواء في المساجد او حتى في,اذا اردتم معرفه اهميه اغلاق المحلات وقت الصلاه فانظروا الي الدول الاسلاميه ونسبه من يصلون فيها سواء في المساجد او حتي في,,[],0,pending,,
mt_dial_egy_8b77b9b5,train,44483,DIAL_EGY,احسن ميزه هتكون في الزوجه الصينيه انها تبوظ بسرعه بعد سنه ولا اتنين بالكتير,احسن ميزه هتكون في الزوجه الصينيه انها تبوظ بسرعه بعد سنه ولا اتنين بالكتير,,[],0,pending,,
