example_id,source_split,source_row_id,dialect,original_text,normalized_text,masked_text,mask_spans_json,mask_count,annotation_status,annotator_model,notes
mt_dial_egy_ecc1487d,train,20021,DIAL_EGY,أنا الحضارة النوميدية الأمازيغية إنت,انا الحضاره النوميديه الامازيغيه انت,,[],0,pending,,
mt_dial_glf_ecbb672d,train,51667,DIAL_GLF,بس العرق مفيد خروجه من الجسم . . واتوقع انه مضر لو نمنع خروج,بس العرق مفيد خروجه من الجسم واتوقع انه مضر لو نمنع خروج,,[],0,pending,,
mt_dial_lev_f0c17551,train,39667,DIAL_LEV,كل الفرق إلها صفر من النقاط . . . كل الفرق عدد اللاعبين فيها 11 . . . كل اللاعبين لعبوا بنفس الكرة . . . كل الفرق بلعبو برجليهم . . . كل اللي بلعبو بشر زينا زيهم . . . بس بدي أعرف ليش مش متفائلين ؟ ؟ ؟ ! معي حق ولا شو ؟ ؟,كل الفرق الها صفر من النقاط كل الفرق عدد اللاعبين فيها 11 كل اللاعبين لعبوا بنفس الكره كل الفرق بلعبو برجليهم كل اللي بلعبو بشر زينا زيهم بس بدي اعرف ليش مش متفايلين معي حق ولا شو,,[],0,pending,,
mt_msa_d561d65c,train,22702,MSA,67 لعنجهيه واستدراك مصر لحرب مع اسرائيل فكانت مصر تدافع عن ارضها وليس عن فلسطين ولم تستطع الدفاع عن مصر او فلسطين واحتلت فلسطين وارض,67 لعنجهيه واستدراك مصر لحرب مع اسراييل فكانت مصر تدافع عن ارضها وليس عن فلسطين ولم تستطع الدفاع عن مصر او فلسطين واحتلت فلسطين وارض,,[],0,pending,,
mt_dial_egy_40dad5b5,train,56260,DIAL_EGY,ولا حيحصل حاجه كله كلام فى كلام واستعراض لعضلات اللسان فى اطلاق صواريخ كلاميه تذهب هباء . وقناه زياده عشان نتفرج على المسلسلات التركى والاغانى,ولا حيحصل حاجه كله كلام في كلام واستعراض لعضلات اللسان في اطلاق صواريخ كلاميه تذهب هباء وقناه زياده عشان نتفرج علي المسلسلات التركي والاغاني,,[],0,pending,,
mt_dial_glf_840c4f89,train,14378,DIAL_GLF,واعجبني انخفاض قيمة نوكيا . . . من جاور الصينيين,واعجبني انخفاض قيمه نوكيا من جاور الصينيين,,[],0,pending,,
mt_dial_lev_772861ba,train,77831,DIAL_LEV,يارب الفرج من عندك ياربي ليمتى ؟ ؟ ؟ والله خايفه اموت وانا مومشتغله واكون درسة على الفاضي ارضينا بالهم والهم مارضي فينا اخريتها تفرج ( ولسوف يعطيك ربك فترضى,يارب الفرج من عندك ياربي ليمتي والله خايفه اموت وانا مومشتغله واكون درسه علي الفاضي ارضينا بالهم والهم مارضي فينا اخريتها تفرج ولسوف يعطيك ربك فترضي,,[],0,pending,,
mt_msa_942d5e7c,train,86332,MSA,الانسان في كيد يعن هو هو نفس الانسان الاجنبي هو,الانسان في كيد يعن هو هو نفس الانسان الاجنبي هو,,[],0,pending,,
mt_dial_egy_aa41deb6,train,52891,DIAL_EGY,أكيد انتى مش دكتورة طبعا لكن انتى أستاذة ورئيسة قسم من أقسام الحزب الوطنى وخايفة حاجة تضيع,اكيد انتي مش دكتوره طبعا لكن انتي استاذه ورييسه قسم من اقسام الحزب الوطني وخايفه حاجه تضيع,,[],0,pending,,
mt_dial_glf_57b47b30,train,9064,DIAL_GLF,لان الهلال دايم لاعبينه يستهبلون ويخسرون مثل ام صلال اللي دفعنا ثمنها غالي .,لان الهلال دايم لاعبينه يستهبلون ويخسرون مثل ام صلال اللي دفعنا ثمنها غالي,,[],0,pending,,
mt_dial_lev_126ab445,train,55965,DIAL_LEV,خروج مشرف لشباب الأردن الله يعطيكم العافيةوخيرها في غيرها . . .,خروج مشرف لشباب الاردن الله يعطيكم العافيهوخيرها في غيرها,,[],0,pending,,
mt_msa_e4f619bd,train,34024,MSA,اللهم ارحمها واعفو عنها واجعل عملها ذلك من حسن الخاتمة بانقاذها,اللهم ارحمها واعفو عنها واجعل عملها ذلك من حسن الخاتمه بانقاذها,,[],0,pending,,
mt_dial_egy_62cc78fd,train,75938,DIAL_EGY,. . . والله لو كنت مكانك ما رظيت ان استبدل انسانيتي,والله لو كنت مكانك ما رظيت ان استبدل انسانيتي,,[],0,pending,,
mt_dial_glf_927f43db,train,57096,DIAL_GLF,روعه جدا بس يتكلم وعن الزحمه الي بار الرياض والي حرام واالله الرياض يصبح بشكل هذا ازداحم خلو الي ماجرب,روعه جدا بس يتكلم وعن الزحمه الي بار الرياض والي حرام واالله الرياض يصبح بشكل هذا ازداحم خلو الي ماجرب,,[],0,pending,,
mt_dial_lev_ec70a891,train,66533,DIAL_LEV,يعني افهم من الحكي انه الكنترول ويلا شفير الباص والتاكسي راح يحترم العالم والناس ( لا اعتقد ) الا ن رحم الله .,يعني افهم من الحكي انه الكنترول ويلا شفير الباص والتاكسي راح يحترم العالم والناس لا اعتقد الا ن رحم الله,,[],0,pending,,
mt_msa_67750cc8,train,46514,MSA,ممكن سؤال نوجهه إلى المسؤلين بالرئاسه العامه لرعاية الشباب هل سيكون منع الازدواجيه بالعمل من بداية الموسم القادم حتى نرى رياضه نزيهه ومحترمه من الجميع وتبعد الناس عن الشكوك مثلا مسؤل فى نادى ويعمل عضوا فى اتحادى وطنى أتمنى أن يرى النور هذا المنع قريبا لان الوطن فيه الكثير من الكوادر المتازه,ممكن سوال نوجهه الي المسولين بالرياسه العامه لرعايه الشباب هل سيكون منع الازدواجيه بالعمل من بدايه الموسم القادم حتي نري رياضه نزيهه ومحترمه من الجميع وتبعد الناس عن الشكوك مثلا مسول في نادي ويعمل عضوا في اتحادي وطني اتمني ان يري النور هذا المنع قريبا لان الوطن فيه الكثير من الكوادر المتازه,,[],0,pending,,
mt_dial_egy_8047540a,train,68401,DIAL_EGY,لى اسم الموضوع صحافة القاهرة اليوم لى مش صحافة مصر,لي اسم الموضوع صحافه القاهره اليوم لي مش صحافه مصر,,[],0,pending,,
mt_dial_glf_1bc224bf,train,86284,DIAL_GLF,الله المستعان . . . كثرة الفتن في هذا الزمن . . . وهذي المشكله واحده من الفتن . . . نسال الله العافية . .,الله المستعان كثره الفتن في هذا الزمن وهذي المشكله واحده من الفتن نسال الله العافيه,,[],0,pending,,
mt_dial_lev_60b8716f,train,31402,DIAL_LEV,و بدل ما تشتري كيلوا اشتروا 100,و بدل ما تشتري كيلوا اشتروا 100,,[],0,pending,,
mt_msa_3ffed59a,train,57551,MSA,قال ( ص ) ان الله لاينزع العلم انتزاعا من صدور الرجال ولكن يقبض العلم بقبض العلماء فاذا لم يبق عالما اتخذ الناس رؤساء جهالا فأفتو بغير علم فضلوا واضلوا ) وهذا من علامات الساعة ان يسند الامر الى غير اهلة فكما قال ( ص ) اذا اسند الامر الى غير اهله فانتظروا الساعة,قال ص ان الله لاينزع العلم انتزاعا من صدور الرجال ولكن يقبض العلم بقبض العلماء فاذا لم يبق عالما اتخذ الناس روساء جهالا فافتو بغير علم فضلوا واضلوا وهذا من علامات الساعه ان يسند الامر الي غير اهله فكما قال ص اذا اسند الامر الي غير اهله فانتظروا الساعه,,[],0,pending,,
mt_dial_egy_f453a4d0,train,31817,DIAL_EGY,من حق كل شخص ان يقول ما يريد وهو حر فالاخوان ليسوا فوق النقد وهم يرحبون بالنقض ولكن بصراحة لقد وجدت أغلب التعليقات المكتوبة ان دلت على شيء تدل على السذاجة والهبل المدقع واللي بيسأل الاخوان عملوا ايه للاسلام فهذا سؤال عجيب لانه يدل على شخص غير متابع للاشياء الدعوية التى يقوم بها الاخوان وهذا ليس ذنب الاخوان فالدروس و المحاضرات والندوات موجودة ولكن لايمكن الافصاح عنها لانه فور الاعلان عن تبعيتها للاخوان سيتم القاء القبض على القائمسن عليها ونمذج الشيخ وجدي غنيم ليس ببعيد,من حق كل شخص ان يقول ما يريد وهو حر فالاخوان ليسوا فوق النقد وهم يرحبون بالنقض ولكن بصراحه لقد وجدت اغلب التعليقات المكتوبه ان دلت علي شيء تدل علي السذاجه والهبل المدقع واللي بيسال الاخوان عملوا ايه للاسلام فهذا سوال عجيب لانه يدل علي شخص غير متابع للاشياء الدعويه التي يقوم بها الاخوان وهذا ليس ذنب الاخوان فالدروس و المحاضرات والندوات موجوده ولكن لايمكن الافصاح عنها لانه فور الاعلان عن تبعيتها للاخوان سيتم القاء القبض علي القايمسن عليها ونمذج الشيخ وجدي غنيم ليس ببعيد,,[],0,pending,,
mt_dial_glf_756efdd4,train,54869,DIAL_GLF,الديون هي الدمار هي السلاح الي يقتل فيك كل بسمة وكل ضحكه وكل نفس طيبة فيك تنساها مع الديون تنسى النوم تنسى الراحه تنسى ابوك وامك تنسى نفسك اللهم اكفنا شر الدين وابعدنا عنه وتفك كربة كل مديون يارب,الديون هي الدمار هي السلاح الي يقتل فيك كل بسمه وكل ضحكه وكل نفس طيبه فيك تنساها مع الديون تنسي النوم تنسي الراحه تنسي ابوك وامك تنسي نفسك اللهم اكفنا شر الدين وابعدنا عنه وتفك كربه كل مديون يارب,,[],0,pending,,
mt_dial_lev_d3bbaea5,train,22334,DIAL_LEV,الرجل العاقل يحترم زوجته وهي يجب ان تعتبر هذا الاحترام لها شغله كويسه وان تضحي من اجل,الرجل العاقل يحترم زوجته وهي يجب ان تعتبر هذا الاحترام لها شغله كويسه وان تضحي من اجل,,[],0,pending,,
mt_msa_aaf36802,train,49665,MSA,ضرب ابوجهل سمية غيظا فقتلها وهذا الضابط,ضرب ابوجهل سميه غيظا فقتلها وهذا الضابط,,[],0,pending,,
mt_dial_egy_58811d20,train,84139,DIAL_EGY,أقترح على الشعب المصري إنه يسيب البلد ديه و يهج منها يمكن ساعتها البوليس و الداخلية يهمدو و,اقترح علي الشعب المصري انه يسيب البلد ديه و يهج منها يمكن ساعتها البوليس و الداخليه يهمدو و,,[],0,pending,,
mt_dial_glf_9a298a9a,train,11892,DIAL_GLF,اذا هذي نظرتكم . . معناه ان الرجال ماله عقل وماعليه شرهة ومرفوع عنه القلم ومايستاهل المكانة اللي انتم حاطينه فيها,اذا هذي نظرتكم معناه ان الرجال ماله عقل وماعليه شرهه ومرفوع عنه القلم ومايستاهل المكانه اللي انتم حاطينه فيها,,[],0,pending,,
mt_dial_lev_1fd5bade,train,53593,DIAL_LEV,فعلن يدل على فجوة كبيرة بين المواطن,فعلن يدل علي فجوه كبيره بين المواطن,,[],0,pending,,
mt_msa_9dbb43ee,train,39205,MSA,جزاك الله خير ووفقك لمافيه,جزاك الله خير ووفقك لمافيه,,[],0,pending,,
mt_dial_egy_0edc5c1f,train,57878,DIAL_EGY,يا ريت كل واحد ناوى يشتم سواء مصرى أو جزائرى يعرف ان أكبر نسبة زواج مختلط بين المصريين و بين اى شعب عربى اخر هى مع الجزائر . . . يعنى اللى ناوى يشتم حيكون بيشتم اهله . . . افهموا من فضلكم . . . و شكرا,يا ريت كل واحد ناوي يشتم سواء مصري او جزايري يعرف ان اكبر نسبه زواج مختلط بين المصريين و بين اي شعب عربي اخر هي مع الجزاير يعني اللي ناوي يشتم حيكون بيشتم اهله افهموا من فضلكم و شكرا,,[],0,pending,,
mt_dial_glf_6dfa322b,train,49374,DIAL_GLF,مشاريع بالمليارات وكان المليار مبلغ صغيروصيانتها وتشغيلها كم بتكلف والميزانيه حاليا مرتفعه بسبب سعر البترول اذا نزل البترول وش بيصير يتكون مشاريع مهجوره زي ماصار في مدينه الملك فهد,مشاريع بالمليارات وكان المليار مبلغ صغيروصيانتها وتشغيلها كم بتكلف والميزانيه حاليا مرتفعه بسبب سعر البترول اذا نزل البترول وش بيصير يتكون مشاريع مهجوره زي ماصار في مدينه الملك فهد,,[],0,pending,,
mt_dial_lev_b10ffcf3,train,80837,DIAL_LEV,وإذا هاي الاعطال في عمان شو السبب إللي بخلي الكهربة تنقطع في مناطق الزرقاء كل يوم منطقة ولمدة,واذا هاي الاعطال في عمان شو السبب اللي بخلي الكهربه تنقطع في مناطق الزرقاء كل يوم منطقه ولمده,,[],0,pending,,
mt_msa_755b21f7,train,1611,MSA,واعلمكم جميعا اني والله لقد كتبت ما كتبت امس من قلبي وليس لاحد على سلطان فى ذلك ولن ارائي احدا من الناس على الاطلاق فانا اعلم جيدا ( ان الرياء من اعظم الامراض بل ويحبط العمل ويذهب الاجر ويترك المرء فريسة للناس ) كما قال الله عز وجل وقال رسوله صلى الله عليه وسلم,واعلمكم جميعا اني والله لقد كتبت ما كتبت امس من قلبي وليس لاحد علي سلطان في ذلك ولن ارايي احدا من الناس علي الاطلاق فانا اعلم جيدا ان الرياء من اعظم الامراض بل ويحبط العمل ويذهب الاجر ويترك المرء فريسه للناس كما قال الله عز وجل وقال رسوله صلي الله عليه وسلم,,[],0,pending,,
mt_dial_egy_d39e2ece,train,29977,DIAL_EGY,على انه شى ميشرفش حد انه يجدب ويقول انا اضربت ولكن الارهاب الى حصل للمصرين واحتجازهم والهجوم عليهم ورميهم بالزجاجات المشتعله وحرق اللممتلكات المصريه والرقص وهتافات بأسم بلادكم بجانب الدمار الذى سببتموه وده كان واضح للجميع على التلفزيون وعلى كلمة مصرائيل شكرا لانكم اطلقتو هذا اللقب علينا لان كلمة ائيل الى بزودوها على كلمة مصر معناها الله مصرائيل معناها مصر الله,علي انه شي ميشرفش حد انه يجدب ويقول انا اضربت ولكن الارهاب الي حصل للمصرين واحتجازهم والهجوم عليهم ورميهم بالزجاجات المشتعله وحرق اللممتلكات المصريه والرقص وهتافات باسم بلادكم بجانب الدمار الذي سببتموه وده كان واضح للجميع علي التلفزيون وعلي كلمه مصراييل شكرا لانكم اطلقتو هذا اللقب علينا لان كلمه اييل الي بزودوها علي كلمه مصر معناها الله مصراييل معناها مصر الله,,[],0,pending,,
mt_dial_glf_8e2f5576,train,56956,DIAL_GLF,باين أنه ( ( روحه بايعة بايعها واليوم يبي يرد يشتريها ),باين انه روحه بايعه بايعها واليوم يبي يرد يشتريها,,[],0,pending,,
mt_dial_lev_5c048b20,train,57040,DIAL_LEV,نسيت اقول اني عايش بأمريكا يا,نسيت اقول اني عايش بامريكا يا,,[],0,pending,,
mt_msa_001b3408,train,27905,MSA,سيخرج الشعب المصرى ولن يستطيع احد ان يوقفه ولن نأخذ اوامرنا منكم ولا من امريكا ونداء الى الشعب,سيخرج الشعب المصري ولن يستطيع احد ان يوقفه ولن ناخذ اوامرنا منكم ولا من امريكا ونداء الي الشعب,,[],0,pending,,
mt_dial_egy_5dfc85fb,train,54755,DIAL_EGY,انا مع البرادعى أنتم مع,انا مع البرادعي انتم مع,,[],0,pending,,
mt_dial_glf_fc20fcde,train,68112,DIAL_GLF,شد حيلك ياحبوبي نبي خماسيه,شد حيلك ياحبوبي نبي خماسيه,,[],0,pending,,
mt_dial_lev_7907b20e,train,52024,DIAL_LEV,مشكور سمو الامير على المكرمة لانه بصراحة كنا محتارين وين بدنا نحضر كاس,مشكور سمو الامير علي المكرمه لانه بصراحه كنا محتارين وين بدنا نحضر كاس,,[],0,pending,,
mt_msa_16c7f7b6,train,36262,MSA,انشاء الله نهايه علي ايدينا انشاء,انشاء الله نهايه علي ايدينا انشاء,,[],0,pending,,
mt_dial_egy_b129a38b,train,44619,DIAL_EGY,دلوقتى دى قاتلة ومغتصبة وعايزين يلصقوا دة طبعا بالنقاب عشان اى منتقبة تقلعة لاحسن يحصل لها زى ماحصل ودة طبعا ضمن الحرب على كل ماهو مسلم علشان يصدوا عن هذا الدين ولكن كل هذة الدعايات المغرضة مصيرها زبالة التاريخ وتاتى مجلات وتذهب وتنسى ولكن يبقى الاسلام لان الذى يرعى هذا هو اللة وليس الصحافة الموجهةالمرتشية وما نسمعة عنها خير دليل على انها لا يعتمد عليها فى قبول او تصديق اى خبر فلا تحزن يا اخى,دلوقتي دي قاتله ومغتصبه وعايزين يلصقوا ده طبعا بالنقاب عشان اي منتقبه تقلعه لاحسن يحصل لها زي ماحصل وده طبعا ضمن الحرب علي كل ماهو مسلم علشان يصدوا عن هذا الدين ولكن كل هذه الدعايات المغرضه مصيرها زباله التاريخ وتاتي مجلات وتذهب وتنسي ولكن يبقي الاسلام لان الذي يرعي هذا هو الله وليس الصحافه الموجههالمرتشيه وما نسمعه عنها خير دليل علي انها لا يعتمد عليها في قبول او تصديق اي خبر فلا تحزن يا اخي,,[],0,pending,,
mt_dial_glf_df598c1f,train,14021,DIAL_GLF,و لما اطالب بالعلاج غالبيه المستشفيات ما عندهم اجهزه رح دور لك مستشفى يستشفي,و لما اطالب بالعلاج غالبيه المستشفيات ما عندهم اجهزه رح دور لك مستشفي يستشفي,,[],0,pending,,
mt_dial_lev_0940e4fe,train,47227,DIAL_LEV,من المفروض اهل البلد المفرق يستفيدو من هالشركه من خلال المهندسين والعاملين . . . اهل المنطقه لازم تستفيد,من المفروض اهل البلد المفرق يستفيدو من هالشركه من خلال المهندسين والعاملين اهل المنطقه لازم تستفيد,,[],0,pending,,
mt_msa_7d5c3dad,train,4198,MSA,كل ورده جميله بيت ودك . .,كل ورده جميله بيت ودك,,[],0,pending,,
mt_dial_egy_9b052ee5,train,7174,DIAL_EGY,خلى ابراهيم الابيض يتشطر على رامى سعيد اللى علم على عيلة حسن وخلاهم يعيطو ويحطوا راسهم فى الطين وقالو يابا شرفنى قالة لما يموت اللى علم عليا انا,خلي ابراهيم الابيض يتشطر علي رامي سعيد اللي علم علي عيله حسن وخلاهم يعيطو ويحطوا راسهم في الطين وقالو يابا شرفني قاله لما يموت اللي علم عليا انا,,[],0,pending,,
mt_dial_glf_63faadc2,train,21751,DIAL_GLF,اريد قرض ب 500 الف ريال لاكمال بناء بيت العائله لات البنك العقاري يعطينا نحن سكان القرى 200 الف ريال فقط ماذا نفعل بها في ظل هذه الاسعار ؟ ؟ ؟ فزعة يا ابومتعب ويا ابوخالد نحن اولادكم,اريد قرض ب 500 الف ريال لاكمال بناء بيت العايله لات البنك العقاري يعطينا نحن سكان القري 200 الف ريال فقط ماذا نفعل بها في ظل هذه الاسعار فزعه يا ابومتعب ويا ابوخالد نحن اولادكم,,[],0,pending,,
mt_dial_lev_4480679b,train,5180,DIAL_LEV,هذاشي متوقع و الجزائر منتخب فعلا ضعيف وحرام يدخل كاس العالم وفي منتخبات عربية كتير احق منه بس الحق على مين . .,هذاشي متوقع و الجزاير منتخب فعلا ضعيف وحرام يدخل كاس العالم وفي منتخبات عربيه كتير احق منه بس الحق علي مين,,[],0,pending,,
mt_msa_5cc54e06,train,60404,MSA,ان الحق ينزع ولايمنح ! . إذا أرادت هذة الأمة البقاء فحتماً أن يكون مصير طغاتها الفناء ! لن يمتطى مبارك ظهرك مالم تبرك له ! ! ! سالم,ان الحق ينزع ولايمنح اذا ارادت هذه الامه البقاء فحتما ان يكون مصير طغاتها الفناء لن يمتطي مبارك ظهرك مالم تبرك له سالم,,[],0,pending,,
mt_dial_egy_78827201,train,82512,DIAL_EGY,استاذى دكتورى عزيزى رئيسى القادم ان شاء اللة اود ان الفت نظر حضرتك الى ان ما حدث اليوم من يوم دامى ملىء بالعتقالات والنتهاكات والبلطجة والترويع اراة من وجعة نظرى المتواضعة رسالة موجهة اليك قبل ان تكون موجهة الينا فهى بمثابة انبوبة اختبار لكى رد فعل حضرتك . . . لذلك اتمنى ان يكون الرد على قدر المصيبة,استاذي دكتوري عزيزي رييسي القادم ان شاء الله اود ان الفت نظر حضرتك الي ان ما حدث اليوم من يوم دامي مليء بالعتقالات والنتهاكات والبلطجه والترويع اراه من وجعه نظري المتواضعه رساله موجهه اليك قبل ان تكون موجهه الينا فهي بمثابه انبوبه اختبار لكي رد فعل حضرتك لذلك اتمني ان يكون الرد علي قدر المصيبه,,[],0,pending,,
mt_dial_glf_aa04cfa3,train,22256,DIAL_GLF,وشكرا للوصلاويين الذين كشفوا عن شرذمة من اصحاب التصاريح الهوجاء واللي شعارهم نفوز ولا نبي نتهم ونشتم على كيفنا لكن قنوات الجزيرة تصدر قرار بمنع هؤلاء من التصاريح واللقاءات والترزز امام,وشكرا للوصلاويين الذين كشفوا عن شرذمه من اصحاب التصاريح الهوجاء واللي شعارهم نفوز ولا نبي نتهم ونشتم علي كيفنا لكن قنوات الجزيره تصدر قرار بمنع هولاء من التصاريح واللقاءات والترزز امام,,[],0,pending,,
