example_id,source_split,source_row_id,dialect,original_text,normalized_text,masked_text,mask_spans_json,mask_count,annotation_status,annotator_model,notes
mt_dial_egy_858789bb,train,17282,DIAL_EGY,لولا ان الموقع بيمنع الكلام البذيئ كنت هقول 10000 كلمه في حق النظام اعتراض ع الخبر,لولا ان الموقع بيمنع الكلام البذيي كنت هقول 10000 كلمه في حق النظام اعتراض ع الخبر,,[],0,pending,,
mt_dial_glf_501a99c7,train,41644,DIAL_GLF,ألا ليت الزمن يرجع ورا والا الليالي,الا ليت الزمن يرجع ورا والا الليالي,,[],0,pending,,
mt_dial_lev_f917b8c9,train,10481,DIAL_LEV,يا سيدي هي الساحة قدام فريقكم وخلينا نشوف شطارتو . . وخليه يمحي الرايح جاي من الريان القطري والخسائر المتتالية والمتوالية من كافة الانواع والاصناف العربية,يا سيدي هي الساحه قدام فريقكم وخلينا نشوف شطارتو وخليه يمحي الرايح جاي من الريان القطري والخساير المتتاليه والمتواليه من كافه الانواع والاصناف العربيه,,[],0,pending,,
mt_msa_175308f5,train,44266,MSA,والله شي جميل جدا وانا اعتقد انها فكره ناجحه ولم يسبق لأحد بفعلها جريدة الرياض متميزه بكل مواضيعها المطروحه وشكرا,والله شي جميل جدا وانا اعتقد انها فكره ناجحه ولم يسبق لاحد بفعلها جريده الرياض متميزه بكل مواضيعها المطروحه وشكرا,,[],0,pending,,
mt_dial_egy_c8e3c44b,train,35632,DIAL_EGY,مباراة ام درمان بالنسبة للجزائريين فعلا ملحمة من رأيهم وهم على حق * وهذا دليل على عقدة النقص اللى عندهم من أى شئ مصرى * والنبى انا جاتنى قرفة من تفاهتهم ياريت بلاش نشر التفاهة بتاعتهم أو ان ينشئ الموقع ركن اسمه التفاهة يضع فيه اخبارهم,مباراه ام درمان بالنسبه للجزايريين فعلا ملحمه من رايهم وهم علي حق وهذا دليل علي عقده النقص اللي عندهم من اي شي مصري والنبي انا جاتني قرفه من تفاهتهم ياريت بلاش نشر التفاهه بتاعتهم او ان ينشي الموقع ركن اسمه التفاهه يضع فيه اخبارهم,,[],0,pending,,
mt_dial_glf_312331f8,train,43194,DIAL_GLF,ابو عبد الله ياجبل مايهزك ريح,ابو عبد الله ياجبل مايهزك ريح,,[],0,pending,,
mt_dial_lev_3e41b85b,train,53594,DIAL_LEV,يا اخ كردي ، الصحفية ديما كلامها مزبوط ، الفنانة امل درست باليرموك ، وانا درست باليرموك وكنت اشوفها بالجامعة ، وكنت اشوفها دايما في عمادة شؤون,يا اخ كردي الصحفيه ديما كلامها مزبوط الفنانه امل درست باليرموك وانا درست باليرموك وكنت اشوفها بالجامعه وكنت اشوفها دايما في عماده شوون,,[],0,pending,,
mt_msa_6f78a0de,train,40086,MSA,اسرة اليوم السابع قامت بحذف التعليقات المسيئة وذلك لما ورد بها من الفاظ خارجة وتعتذر اسرة اليوم السابع عن نشر هذه,اسره اليوم السابع قامت بحذف التعليقات المسييه وذلك لما ورد بها من الفاظ خارجه وتعتذر اسره اليوم السابع عن نشر هذه,,[],0,pending,,
mt_dial_egy_043263be,train,3431,DIAL_EGY,الى صاحب تعليق 2 . انا الهى اللة الذى خلقنى وجعل لى عينين واذنيين وعقل وعرفت ان فية رب واحد خلقنى وخلقك وياريت انت يفتح عينك واذنك وتعرف ان فية معبود واحد وهو اللة الذى لاالة الاهو خالق كل شىء وتحياتى لك يابو نظارة . . . واللة يابو نظارة مافية حقد على احد منكم انا كتبت التعليق لانى اول واحدة تكتب ودى معاكسة منى لكم ولك تحياتى بابو نظارة . . . وانشر,الي صاحب تعليق 2 انا الهي الله الذي خلقني وجعل لي عينين واذنيين وعقل وعرفت ان فيه رب واحد خلقني وخلقك وياريت انت يفتح عينك واذنك وتعرف ان فيه معبود واحد وهو الله الذي لااله الاهو خالق كل شيء وتحياتي لك يابو نظاره والله يابو نظاره مافيه حقد علي احد منكم انا كتبت التعليق لاني اول واحده تكتب ودي معاكسه مني لكم ولك تحياتي بابو نظاره وانشر,,[],0,pending,,
mt_dial_glf_9fca4246,train,27925,DIAL_GLF,و لا تكثرون كلام يا الهلاليين .,و لا تكثرون كلام يا الهلاليين,,[],0,pending,,
mt_dial_lev_a58db6d6,train,3936,DIAL_LEV,الله يعطيك العاقية يا أبوشكيب كفيت و وفيت و كنت و ستبقى على قدر كبير في تحمل المسؤوليات الجسام ، نفتخر بك و يفتخر بك الأردن دوما بأن واحد من أبناءه المخلصين في بناءه و تقدمه في ظل حضرة صاحب الجلالة الملك عبدالله الثاني المعظم,الله يعطيك العاقيه يا ابوشكيب كفيت و وفيت و كنت و ستبقي علي قدر كبير في تحمل المسووليات الجسام نفتخر بك و يفتخر بك الاردن دوما بان واحد من ابناءه المخلصين في بناءه و تقدمه في ظل حضره صاحب الجلاله الملك عبدالله الثاني المعظم,,[],0,pending,,
mt_msa_5ff0b51a,train,83409,MSA,"لافض فوك , , وفعلاً سامي اتعب من قبله ومن بعده .",لافض فوك وفعلا سامي اتعب من قبله ومن بعده,,[],0,pending,,
mt_dial_egy_e7f47d01,train,40399,DIAL_EGY,الى صاحب تعليق رقم 8 - طظ في,الي صاحب تعليق رقم 8 طظ في,,[],0,pending,,
mt_dial_glf_9a252a39,train,21675,DIAL_GLF,مانبي الرياضة مادام وصلت لكذا عقوبة على فريق معين وفريق جميع انواع,مانبي الرياضه مادام وصلت لكذا عقوبه علي فريق معين وفريق جميع انواع,,[],0,pending,,
mt_dial_lev_11f9743d,train,10120,DIAL_LEV,و الله بصراحة الله يعين الناس على بلاويهم و الله يعافينا من هالأمور الصعبة الي بتحل على الناس كلها الحمد لله على نعمه الله عز وجل الحمد لله على كرمه الذي زادنا فكفانا . .,و الله بصراحه الله يعين الناس علي بلاويهم و الله يعافينا من هالامور الصعبه الي بتحل علي الناس كلها الحمد لله علي نعمه الله عز وجل الحمد لله علي كرمه الذي زادنا فكفانا,,[],0,pending,,
mt_msa_02f8c93b,train,10599,MSA,ونتمنى محاسبة سرقة السيارات بالحد الشرعي حتى يأمن الناس على اموالهم وانفسهم,ونتمني محاسبه سرقه السيارات بالحد الشرعي حتي يامن الناس علي اموالهم وانفسهم,,[],0,pending,,
mt_dial_egy_3478436c,train,85454,DIAL_EGY,بصفتى مصرى اعارض الحكومة فى الكثير من سياساتها واطمح الى حياة افضل الا اننى لا اعجب باى كلام يقال خاصة اذا كان كلاما ماسخا لا معنى ولا قيمة له مثل هذه المواثيق التافهة انا رائى انها كلام,بصفتي مصري اعارض الحكومه في الكثير من سياساتها واطمح الي حياه افضل الا انني لا اعجب باي كلام يقال خاصه اذا كان كلاما ماسخا لا معني ولا قيمه له مثل هذه المواثيق التافهه انا رايي انها كلام,,[],0,pending,,
mt_dial_glf_24411291,train,2813,DIAL_GLF,نلبس طاقيه أم ورد والقلب,نلبس طاقيه ام ورد والقلب,,[],0,pending,,
mt_dial_lev_6cbfa676,train,16150,DIAL_LEV,سوال ليش ياال خطاب بتشجع الفيصلي جاوبني على قد سوالي بروح,سوال ليش ياال خطاب بتشجع الفيصلي جاوبني علي قد سوالي بروح,,[],0,pending,,
mt_msa_fe9833b8,train,58863,MSA,"( ( ( أن تخوض قوى المعارضة أيضا انتخابات الرئاسة بمرشح واحد ضد مرشح النظام ، حتى لا تتشتت الجهود ، وتكتمل منظومة التغيير ! ! ! ، ) ) ) . اسمح لى يا استاذ هانى أن أصف هذا الكلام بالمراهقة الفكرية , فكيف يتفق الليبراليين مع فكر الاخوان , كيف يتفق العلمانيون مع الاسلاميون - فالعلمانيون يروا أن الحزب الوطنى برغم مساوءة أرحم مائة مرة من الاخوان . . و الاسلاميون يروا أن الوطنى أفضل مائة مرة من العلمانيون . . فاذا رصدت مطالب الاحزاب الليبرالية وجماعة الاخوان ترى أن كل طرف يريد جذب الحكومة فى اتجاة معاكس تماما عن الاخر . . وهذا واضح وجلى لأى متابع . .",ان تخوض قوي المعارضه ايضا انتخابات الرياسه بمرشح واحد ضد مرشح النظام حتي لا تتشتت الجهود وتكتمل منظومه التغيير اسمح لي يا استاذ هاني ان اصف هذا الكلام بالمراهقه الفكريه فكيف يتفق الليبراليين مع فكر الاخوان كيف يتفق العلمانيون مع الاسلاميون فالعلمانيون يروا ان الحزب الوطني برغم مساوءه ارحم مايه مره من الاخوان و الاسلاميون يروا ان الوطني افضل مايه مره من العلمانيون فاذا رصدت مطالب الاحزاب الليبراليه وجماعه الاخوان تري ان كل طرف يريد جذب الحكومه في اتجاه معاكس تماما عن الاخر وهذا واضح وجلي لاي متابع,,[],0,pending,,
mt_dial_egy_9853a645,train,10181,DIAL_EGY,فين نفين شكرى عشان تقول الكلمتين اللى,فين نفين شكري عشان تقول الكلمتين اللي,,[],0,pending,,
mt_dial_glf_be5593ec,train,85193,DIAL_GLF,في مخرج ? ب السرعة على الكوبري ? ? فأي سيارة سوف تستطيع صعود الكوبري بهذه السرعة ومع التجربه اصبحت السياره تمشي ? ? وكادت ان تقف وسط الكوبري,في مخرج ب السرعه علي الكوبري فاي سياره سوف تستطيع صعود الكوبري بهذه السرعه ومع التجربه اصبحت السياره تمشي وكادت ان تقف وسط الكوبري,,[],0,pending,,
mt_dial_lev_29c4cfdd,train,53018,DIAL_LEV,ركلة جزاء تعاد مرتين وتضيع فألحقها الحكم بثالثة وأجت وطردنالكو حارس المرمى ولعب مدافع كحارس مرمى وطنشنا ضربة جزاء للرمثا وانذارات بالهبل وجابوا عليكوا 3 وما فزتوا شو بدنا نساويلكوا المرة الجاي العبوا لحالكوا بلكي,ركله جزاء تعاد مرتين وتضيع فالحقها الحكم بثالثه واجت وطردنالكو حارس المرمي ولعب مدافع كحارس مرمي وطنشنا ضربه جزاء للرمثا وانذارات بالهبل وجابوا عليكوا 3 وما فزتوا شو بدنا نساويلكوا المره الجاي العبوا لحالكوا بلكي,,[],0,pending,,
mt_msa_d56017ec,train,71475,MSA,أن تحب مصر فلك أن تحبها كما تريد ، ولا تلزم أي أحد أن يحبها على طريقتك الخاصة ، فالنقد أو الاشارة أو التنويه الى ما تعانيه مصر من الفقر والتوريث والمشاكل ليس هو بالعيب ، فهذا ليس ذنب مصر كبلد ، وانما العيب يقع على الذين تولوا زمام الحكم هم المسؤولون على تردى أوضاع مصر وتقهقرها الى الوراء حتى صارت فى الرتب الأخيرة من بين سائر الأمم .,ان تحب مصر فلك ان تحبها كما تريد ولا تلزم اي احد ان يحبها علي طريقتك الخاصه فالنقد او الاشاره او التنويه الي ما تعانيه مصر من الفقر والتوريث والمشاكل ليس هو بالعيب فهذا ليس ذنب مصر كبلد وانما العيب يقع علي الذين تولوا زمام الحكم هم المسوولون علي تردي اوضاع مصر وتقهقرها الي الوراء حتي صارت في الرتب الاخيره من بين ساير الامم,,[],0,pending,,
mt_dial_egy_7d6891e3,train,17390,DIAL_EGY,بص يا استاذ عبداللطيف رجعت قرأت لك تاني ، ، بص و الله ليك صور شعرية حلوة و موضوعاتك نبيلة المعنى ، ، بس محتاج بضرورة تظبيط في العروض و القافية ، ، و لو عايز تكتب شعر نثر من غير وزن و قافية يبقى ركز في الموسيقى و التجانس الداخلي و غير الشكل إلي يشبه الشكل العمودي الغير موزون ، ، و إن شاء الله نقرأ لك حاجات قادمة جميلة و تعجب المعجبات كمان ، ، ربنا,بص يا استاذ عبداللطيف رجعت قرات لك تاني بص و الله ليك صور شعريه حلوه و موضوعاتك نبيله المعني بس محتاج بضروره تظبيط في العروض و القافيه و لو عايز تكتب شعر نثر من غير وزن و قافيه يبقي ركز في الموسيقي و التجانس الداخلي و غير الشكل الي يشبه الشكل العمودي الغير موزون و ان شاء الله نقرا لك حاجات قادمه جميله و تعجب المعجبات كمان ربنا,,[],0,pending,,
mt_dial_glf_6147aa0d,train,63614,DIAL_GLF,ايه بلاه المشاكل الاسرريه هي اساس الضيااع ورفقااء السوء والله يا عالم لو تعلن مباالغ ضخمه مقاابل مروج مفسد مثله مثل الارهاابي يسووي مليوون والمروج يقتل ويرريد الشر ولكن الله بلانا وادعولي بترك,ايه بلاه المشاكل الاسرريه هي اساس الضيااع ورفقااء السوء والله يا عالم لو تعلن مباالغ ضخمه مقاابل مروج مفسد مثله مثل الارهاابي يسووي مليوون والمروج يقتل ويرريد الشر ولكن الله بلانا وادعولي بترك,,[],0,pending,,
mt_dial_lev_dff51883,train,60355,DIAL_LEV,وترى المدخنين واقفين بعز الحر والحرارة قد تبلغ ال 50 م ومع وجود الرطوبة وقاعدين بدخنوا على مختلف جنسياتهم . . . ( ( الله اكبر ) ) . . لو قلنا لواحد صلي ركعتين بهالحر ، ، والله ما راح يوافق . .,وتري المدخنين واقفين بعز الحر والحراره قد تبلغ ال 50 م ومع وجود الرطوبه وقاعدين بدخنوا علي مختلف جنسياتهم الله اكبر لو قلنا لواحد صلي ركعتين بهالحر والله ما راح يوافق,,[],0,pending,,
mt_msa_942b1eed,train,15488,MSA,إن كل من تم ذكرهم لا يصلحون على الإطلاق فممدوح حمزة مثلاً يمتلك قدرة على النقد بينما لا يمتلك الحلول المبدعة وكذلك,ان كل من تم ذكرهم لا يصلحون علي الاطلاق فممدوح حمزه مثلا يمتلك قدره علي النقد بينما لا يمتلك الحلول المبدعه وكذلك,,[],0,pending,,
mt_dial_egy_f2ca16a0,train,64326,DIAL_EGY,وماذا انت فاعل ياعم اردغان ؟ ؟ تقدر تمنع التعاون العسكرى المشترك مع اسرائيل مثلا ؟ ؟ والله لا,وماذا انت فاعل ياعم اردغان تقدر تمنع التعاون العسكري المشترك مع اسراييل مثلا والله لا,,[],0,pending,,
mt_dial_glf_2bc8a952,train,7955,DIAL_GLF,ضعو الرسوم وبعدين سو خصم بنسبة 99,ضعو الرسوم وبعدين سو خصم بنسبه 99,,[],0,pending,,
mt_dial_lev_1eccad59,train,67342,DIAL_LEV,الف مبروك والى الامام واقف هنا لحظة عتاب للبطل بهجت طول عمرك كبير وقائد بس هالمره الله,الف مبروك والي الامام واقف هنا لحظه عتاب للبطل بهجت طول عمرك كبير وقايد بس هالمره الله,,[],0,pending,,
mt_msa_2638a0d5,train,84577,MSA,ماشاء الله الفلوس هي من تبحث عن لاعبي,ماشاء الله الفلوس هي من تبحث عن لاعبي,,[],0,pending,,
mt_dial_egy_97024e46,train,37883,DIAL_EGY,شكلك كدة فعلا فرعون والفلوس معاك مالهاش اخر زى الاخ ياسين بس انا عايزك تراجع نفسك وتقرا الكلام المحترم اللى قاله الاخ رقم ( ( ( 1 ) ) ) لان والله البلد دى فيها ناس بتنام من غير عشا وبعدين انت عارف ال 60000 دول ياكلوا كام عائلة كام شهر وبعدين هو ياسين بيه وانت مش عارفين ان الكورة دى تسلية وفيه يوم القيامة جاى وصدقنى يا اخ فرعون مش هتلاقى عند ربنا لا ياسين بيه ولا نادى اهلى اتمنى من الله انه يهديكم جميعا . .,شكلك كده فعلا فرعون والفلوس معاك مالهاش اخر زي الاخ ياسين بس انا عايزك تراجع نفسك وتقرا الكلام المحترم اللي قاله الاخ رقم 1 لان والله البلد دي فيها ناس بتنام من غير عشا وبعدين انت عارف ال 60000 دول ياكلوا كام عايله كام شهر وبعدين هو ياسين بيه وانت مش عارفين ان الكوره دي تسليه وفيه يوم القيامه جاي وصدقني يا اخ فرعون مش هتلاقي عند ربنا لا ياسين بيه ولا نادي اهلي اتمني من الله انه يهديكم جميعا,,[],0,pending,,
mt_dial_glf_c9ababd0,train,46444,DIAL_GLF,كل الجماهير اللي تستغرب استضافة نجيب هلاليين وليس كل جماهير الوطن على,كل الجماهير اللي تستغرب استضافه نجيب هلاليين وليس كل جماهير الوطن علي,,[],0,pending,,
mt_dial_lev_fd0e9d4b,train,25738,DIAL_LEV,"يلا زيدو كمان ضرايب و غلاء اسعار و ارفعوا الدعم عن كل اشي , بكرا بيصير الهوا عليه ضريبه و بيصيروا يحطوه في قناني 1 . 25 و 2 . 25 زي البيبسي",يلا زيدو كمان ضرايب و غلاء اسعار و ارفعوا الدعم عن كل اشي بكرا بيصير الهوا عليه ضريبه و بيصيروا يحطوه في قناني 1 25 و 2 25 زي البيبسي,,[],0,pending,,
mt_msa_dd58f16c,train,47696,MSA,لاحول ولا قوة الاباالله انا للة وانا الية,لاحول ولا قوه الاباالله انا لله وانا اليه,,[],0,pending,,
mt_dial_egy_2378f85a,train,56868,DIAL_EGY,"لا شماتة في المرض وأسال ان يعفيك طهور ان شاء الله , الراجل مريض والاسلام يأمرنا بالدعاء بالشفاء لكل مريض سوى مؤمن كافر عاصي , ونحن لا نعلم ماذا جنت يداه فالله اعلم من هو المحسن فأتركو الخلق لخالق ولا تحاسبوه ادعوله",لا شماته في المرض واسال ان يعفيك طهور ان شاء الله الراجل مريض والاسلام يامرنا بالدعاء بالشفاء لكل مريض سوي مومن كافر عاصي ونحن لا نعلم ماذا جنت يداه فالله اعلم من هو المحسن فاتركو الخلق لخالق ولا تحاسبوه ادعوله,,[],0,pending,,
mt_dial_glf_9323636d,train,9604,DIAL_GLF,ياكثر المصائب وانتكاس الاخلاق وانتشار الرذائل والانفلات,ياكثر المصايب وانتكاس الاخلاق وانتشار الرذايل والانفلات,,[],0,pending,,
mt_dial_lev_c85388c4,train,46686,DIAL_LEV,مبارك لكم الثقة الملكية و تستاهل كل خير ، أتمنى لك دوام التقدم في خدمة الوطن و الملك . .,مبارك لكم الثقه الملكيه و تستاهل كل خير اتمني لك دوام التقدم في خدمه الوطن و الملك,,[],0,pending,,
mt_msa_e60fd560,train,84024,MSA,فعلاً انها من صور الاعجاز العلمي في خلق,فعلا انها من صور الاعجاز العلمي في خلق,,[],0,pending,,
mt_dial_egy_d4191332,train,46875,DIAL_EGY,5 - اطلب لقاء اصغر القيادات التنفذين من مديرى العموم ومديرى الادارات وصولا الى الحقائق ولا اقصد الشكاوى ولا الادعاءات المفتراه على بعضهم,5 اطلب لقاء اصغر القيادات التنفذين من مديري العموم ومديري الادارات وصولا الي الحقايق ولا اقصد الشكاوي ولا الادعاءات المفتراه علي بعضهم,,[],0,pending,,
mt_dial_glf_cde80653,train,64065,DIAL_GLF,تراه ساكن في ديره مو في المزرع تراني عرف,تراه ساكن في ديره مو في المزرع تراني عرف,,[],0,pending,,
mt_dial_lev_20093a31,train,25257,DIAL_LEV,"انا من ناحيتي ما بصدق وانا انزل على عمان لاني بحبهااجوائها بتجنن والحياة حلوه فيها وان شاء اللة نازل ب اخر شهر 6 عشان اتزوج , , اتزوج حبيبت قلبي ونصي الثاني . . . وان شاء اللة عقبالكم يا شباب ويا صبايا . .",انا من ناحيتي ما بصدق وانا انزل علي عمان لاني بحبهااجوايها بتجنن والحياه حلوه فيها وان شاء الله نازل ب اخر شهر 6 عشان اتزوج اتزوج حبيبت قلبي ونصي الثاني وان شاء الله عقبالكم يا شباب ويا صبايا,,[],0,pending,,
mt_msa_9ae9ac03,train,83069,MSA,عظمالله اجركم ياعبدالرحمن و خالد ومحمد النمر في وفاة ابو,عظمالله اجركم ياعبدالرحمن و خالد ومحمد النمر في وفاه ابو,,[],0,pending,,
mt_dial_egy_f5b028a7,train,29584,DIAL_EGY,وزير جدع بصراحة . . . ياريت يفضل كدا على,وزير جدع بصراحه ياريت يفضل كدا علي,,[],0,pending,,
mt_dial_glf_4480e3f8,train,20727,DIAL_GLF,الحين موضوع للنصر وش دخلكم يا **تعلقون عليه لكن ما أقول الإ ان العالمي فقع قلوبهم وجابلكم الجنان وصرتوا تحلمون فيه بالليل,الحين موضوع للنصر وش دخلكم يا تعلقون عليه لكن ما اقول الا ان العالمي فقع قلوبهم وجابلكم الجنان وصرتوا تحلمون فيه بالليل,,[],0,pending,,
mt_dial_lev_e977d8ef,train,45759,DIAL_LEV,الف مبروك للرمثاو جمهوره و هارد لك للفيصيلي . .,الف مبروك للرمثاو جمهوره و هارد لك للفيصيلي,,[],0,pending,,
mt_msa_aad928c5,train,47193,MSA,المستفيد من التدخين الدول المنتجه للتبغ زراعيا والمصانع والمجتمع هو المتضرر الوحيد من هذه العادة,المستفيد من التدخين الدول المنتجه للتبغ زراعيا والمصانع والمجتمع هو المتضرر الوحيد من هذه العاده,,[],0,pending,,
mt_dial_egy_10a96211,train,26428,DIAL_EGY,بلغ الناس نيابه عن جنابى .,بلغ الناس نيابه عن جنابي,,[],0,pending,,
mt_dial_glf_12c39939,train,27332,DIAL_GLF,الله يوفقكم ويرجعكم سالمين ترفعون,الله يوفقكم ويرجعكم سالمين ترفعون,,[],0,pending,,
mt_dial_lev_1b1f1926,train,45568,DIAL_LEV,شو المشكله ولو حددت سبب وفاته شو يعني بدك ترجعو,شو المشكله ولو حددت سبب وفاته شو يعني بدك ترجعو,,[],0,pending,,
