example_id,source_split,source_row_id,dialect,original_text,normalized_text,masked_text,mask_spans_json,mask_count,annotation_status,annotator_model,notes
mt_dial_glf_ae5d547d,train,64253,DIAL_GLF,الله يعنكم ياهل الشمال ومو عندكم بس كمان,الله يعنكم ياهل الشمال ومو عندكم بس كمان,,[],0,pending,,
mt_dial_lev_791a4dbc,train,74832,DIAL_LEV,على هيك الصوت اللي رح تصوته زوجتي رح يدفعني 3 دنانير للاحوال ودينار رايح لتجديد الهوية ودينار راجع للبيت ودينار رايح للتصويت ودينار راجع للبيت يعني بتكلفني العملية كلها 7,علي هيك الصوت اللي رح تصوته زوجتي رح يدفعني 3 دنانير للاحوال ودينار رايح لتجديد الهويه ودينار راجع للبيت ودينار رايح للتصويت ودينار راجع للبيت يعني بتكلفني العمليه كلها 7,,[],0,pending,,
mt_msa_b46638c9,train,45325,MSA,في الحديث أحب أن أوجه سؤال الي أحمد حسن إذا تكلم ابراهيم حسن المنشطات لم يقصد أي لاعب ولا أي نادي وانت الوحيد من جميع الاعبين اللي تكلمت في هذا الموضوع اية السبب في ذلك وبلاش كلام كتير حول هذا الموضوع وفين إدارة النادي التي تسمح لك بكل هذه الاحاديث الكثيرة وإذا كنت قصدت حسام حسن أنه هو المثل الأعلي لكل اللاعبين فأنت لم توضح ذلك بل قلت مثال حسام حسن كان يلعب حتي سن 39 سنه ولم تقل انه مثل لكل اللاعبين ياريت تبطل كلام كتير تلعب كورة افضل إذا كنت بتلعب كورة مش من أجل المال ولديك أعمالك الخاصة اترك الملعب الآن وخليك في اعمالك وانت بعد ما تعتزل اللعب حتقعد في البيت ولا يمكن أن تكون مدرب ناجح,في الحديث احب ان اوجه سوال الي احمد حسن اذا تكلم ابراهيم حسن المنشطات لم يقصد اي لاعب ولا اي نادي وانت الوحيد من جميع الاعبين اللي تكلمت في هذا الموضوع ايه السبب في ذلك وبلاش كلام كتير حول هذا الموضوع وفين اداره النادي التي تسمح لك بكل هذه الاحاديث الكثيره واذا كنت قصدت حسام حسن انه هو المثل الاعلي لكل اللاعبين فانت لم توضح ذلك بل قلت مثال حسام حسن كان يلعب حتي سن 39 سنه ولم تقل انه مثل لكل اللاعبين ياريت تبطل كلام كتير تلعب كوره افضل اذا كنت بتلعب كوره مش من اجل المال ولديك اعمالك الخاصه اترك الملعب الان وخليك في اعمالك وانت بعد ما تعتزل اللعب حتقعد في البيت ولا يمكن ان تكون مدرب ناجح,,[],0,pending,,
mt_dial_egy_92b8217a,train,49028,DIAL_EGY,كده عداهم العيب والله طلاب,كده عداهم العيب والله طلاب,,[],0,pending,,
mt_dial_glf_f0bec5cc,train,50114,DIAL_GLF,الحين عندنا اللي زعلان من شي على طول يفكر في,الحين عندنا اللي زعلان من شي علي طول يفكر في,,[],0,pending,,
