example_id,source_split,source_row_id,dialect,original_text,normalized_text,masked_text,mask_spans_json,mask_count,annotation_status,annotator_model,notes
mt_dial_lev_2d71142e,train,11658,DIAL_LEV,يا عمي ان شاء الله ما كان الا فريق واحد . وكان فيصلي أ ، ب ، ج . هذه هي الاصالة وهذا هو العميد من ادخل الفطبل الى الاردن ومن علم كل اندية الاردن كيف تلعب فطبول ، كل اندية الاردن تعلمت الفطبل على ايد المعلم الزعيم الفيصلاوي هو الكبير والمعلم . له الفضل على كل الاندية ولا فضل عليه من احد . هذه هي العراقة وهذا هو التاريخ والا مالوا تاريخ ما الو مستقبل,يا عمي ان شاء الله ما كان الا فريق واحد وكان فيصلي ا ب ج هذه هي الاصاله وهذا هو العميد من ادخل الفطبل الي الاردن ومن علم كل انديه الاردن كيف تلعب فطبول كل انديه الاردن تعلمت الفطبل علي ايد المعلم الزعيم الفيصلاوي هو الكبير والمعلم له الفضل علي كل الانديه ولا فضل عليه من احد هذه هي العراقه وهذا هو التاريخ والا مالوا تاريخ ما الو مستقبل,,[],0,pending,,
mt_msa_89ed1280,train,9630,MSA,اما اولئك الذين يتشدقون بالوطنية ويتهمون المتوفى بخيانة الوطن فأقول لهم : سود الله وجيهكم . . واعتقد انكم اول من يسيء للوطن ! ! لو انكم محتاجين لتوفير لقمة العيش لما وصفتم ذلك المتوفى بالخيانة وانتم لاتعلمون ظروفه المعيشية . . هؤلاء المتخلفين موجودون داخل المملكة وهو ليس من ادخلهم الى هذه البلاد . . هناك جوازات وحرس حدود وامن طرق وهناك اجهزة حكومية مقصرة كثيرا في مساعدة مواطنيها وانقاذهم من حالة الفقر التي يعانون منها ! ! اليس ذلك افضل من السرقة ونهب اموال الناس ؟ ؟,اما اوليك الذين يتشدقون بالوطنيه ويتهمون المتوفي بخيانه الوطن فاقول لهم سود الله وجيهكم واعتقد انكم اول من يسيء للوطن لو انكم محتاجين لتوفير لقمه العيش لما وصفتم ذلك المتوفي بالخيانه وانتم لاتعلمون ظروفه المعيشيه هولاء المتخلفين موجودون داخل المملكه وهو ليس من ادخلهم الي هذه البلاد هناك جوازات وحرس حدود وامن طرق وهناك اجهزه حكوميه مقصره كثيرا في مساعده مواطنيها وانقاذهم من حاله الفقر التي يعانون منها اليس ذلك افضل من السرقه ونهب اموال الناس,,[],0,pending,,
mt_dial_egy_8bb9201a,train,59911,DIAL_EGY,الناس دية عاوذين اية تانى علشان يملا عنيهم الفرغة مال وسلطة,الناس ديه عاوذين ايه تاني علشان يملا عنيهم الفرغه مال وسلطه,,[],0,pending,,
mt_dial_glf_248eaeff,train,1124,DIAL_GLF,ما ا دافع عن صاحب السياره ولكن العماله وهي تعبر الشارع تنطل نفسها ولا هامها شيء بكل,ما ا دافع عن صاحب السياره ولكن العماله وهي تعبر الشارع تنطل نفسها ولا هامها شيء بكل,,[],0,pending,,
mt_dial_lev_537143c6,train,68454,DIAL_LEV,في واحد بقول البطولة بدون طعم لانه الفرق القوية طلعت من البطولة فسوالي ليش الفرق طلعت ما دامها قوية على حد قوالك . ثانيا & quot ; في بعض مشجعين الفيصلي موجودين فارجو منهم عدم التدخل باشياء لا تعنيهم فالمباراة بين الرمثا والوحدات مش الفيصلي وضلكم احتفلوا بالدوري الي اجاكم هدية من فريق البقعه وليس ش . الاردن . ثالثا & quot ; نادي الرمثا ( غزلان الشمال ) فالله معكم يا شباب وصدقوني انكم قد المسوولية فانتم الرجال الرجال . رابعا & quot ; اتوقع مباراة اليوم راح تصل لضربات الجزاء . خامسا & quot ; سمعنا موخرا & quot ; بان عبدالله عبيدات راح يترك نادي الرمثا فارجو انه تكون اشاعة لانه عبدالله لاعب كبير والرمثا بحاجه للاعب,في واحد بقول البطوله بدون طعم لانه الفرق القويه طلعت من البطوله فسوالي ليش الفرق طلعت ما دامها قويه علي حد قوالك ثانيا quot في بعض مشجعين الفيصلي موجودين فارجو منهم عدم التدخل باشياء لا تعنيهم فالمباراه بين الرمثا والوحدات مش الفيصلي وضلكم احتفلوا بالدوري الي اجاكم هديه من فريق البقعه وليس ش الاردن ثالثا quot نادي الرمثا غزلان الشمال فالله معكم يا شباب وصدقوني انكم قد المسووليه فانتم الرجال الرجال رابعا quot اتوقع مباراه اليوم راح تصل لضربات الجزاء خامسا quot سمعنا موخرا quot بان عبدالله عبيدات راح يترك نادي الرمثا فارجو انه تكون اشاعه لانه عبدالله لاعب كبير والرمثا بحاجه للاعب,,[],0,pending,,
mt_msa_43862d81,train,58821,MSA,اذا كانت محكمة النقض نقضت الحكم بسبب صوره غير واضحه لسكري هل يلغي هذا الادله الاخرى وهي 1 - ملاحقة السكري وهشام لسوزان في لندن والبحث عنها 2 - تهديدات هشام لسوزان تميم والمحاضر التي في الشرطه البريطانيه تتهم هشام بتهديدهابالقتل 3 - المكالمات والاتصالات بين هشام ومحسن 4 - وجود محسن وقت ارتكاب الجريمه في دبي وتقديمه لمكالمات التي يحرضه بها هشام على قتل سوزان تميم وفي احدها يقول محسن لهشام كل حاجه حتم زي مانت طلبت ا اي الذبح 5 - جهاز الكمبيوتر الخاص لسكري في فندق الواحه الذي وجدت الشرطه الامارتيه انه يبحث فيه عن معلومات سوزان تميم وغيره الكثير من الادله ومنها البصمه الوراثيه 6 - تهديدات محامي محسن انه سيغرق المركب بمن فيها اذا حاول هشام النجاه لوحده خطة الدفاع ودفاع محامين هشام عن محسن لخوفهم من ان يفضحهم مما لاشك فيه ان هشام والسكري هم قتلة الفاتنه سوزان تميم وليس لهذا علاقه بي المحاكم والثغرات القانونيه التي ممكن يخرج منها قاتل,اذا كانت محكمه النقض نقضت الحكم بسبب صوره غير واضحه لسكري هل يلغي هذا الادله الاخري وهي 1 ملاحقه السكري وهشام لسوزان في لندن والبحث عنها 2 تهديدات هشام لسوزان تميم والمحاضر التي في الشرطه البريطانيه تتهم هشام بتهديدهابالقتل 3 المكالمات والاتصالات بين هشام ومحسن 4 وجود محسن وقت ارتكاب الجريمه في دبي وتقديمه لمكالمات التي يحرضه بها هشام علي قتل سوزان تميم وفي احدها يقول محسن لهشام كل حاجه حتم زي مانت طلبت ا اي الذبح 5 جهاز الكمبيوتر الخاص لسكري في فندق الواحه الذي وجدت الشرطه الامارتيه انه يبحث فيه عن معلومات سوزان تميم وغيره الكثير من الادله ومنها البصمه الوراثيه 6 تهديدات محامي محسن انه سيغرق المركب بمن فيها اذا حاول هشام النجاه لوحده خطه الدفاع ودفاع محامين هشام عن محسن لخوفهم من ان يفضحهم مما لاشك فيه ان هشام والسكري هم قتله الفاتنه سوزان تميم وليس لهذا علاقه بي المحاكم والثغرات القانونيه التي ممكن يخرج منها قاتل,,[],0,pending,,
mt_dial_egy_2e00d3bb,train,60669,DIAL_EGY,انتم الاتنين . . . ، يارب نظف مصر من العراعير يا,انتم الاتنين يارب نظف مصر من العراعير يا,,[],0,pending,,
mt_dial_glf_be9b2bfb,train,59603,DIAL_GLF,"أه يامال آه يامال يامال أه هيه هيه , ياسلام",اه يامال اه يامال يامال اه هيه هيه ياسلام,,[],0,pending,,
mt_dial_lev_80fd3fe2,train,23884,DIAL_LEV,اهم شيء الحب بخلي العلاقة الجنسية علاقة مفعمة باالاحاسيس بين الطرفين . وبالنسبة للضعف الجنسي يوجد لة علاج وذلك عن طريق تحسين نوعية الاكل او زيارة الطبيب وذلك ليوصف لك الحبوب المناسبة وذلك بعد الفحص وغالبا ما يوصف الفاجرا وهي شيء لة مضارة وايجابياتو كمان وشكرا لكم والشفاء العاجل ان شاء اللة,اهم شيء الحب بخلي العلاقه الجنسيه علاقه مفعمه باالاحاسيس بين الطرفين وبالنسبه للضعف الجنسي يوجد له علاج وذلك عن طريق تحسين نوعيه الاكل او زياره الطبيب وذلك ليوصف لك الحبوب المناسبه وذلك بعد الفحص وغالبا ما يوصف الفاجرا وهي شيء له مضاره وايجابياتو كمان وشكرا لكم والشفاء العاجل ان شاء الله,,[],0,pending,,
mt_msa_2eb7acae,train,81535,MSA,أن برك لأمه أقرب الطرق إلى قلبه !,ان برك لامه اقرب الطرق الي قلبه,,[],0,pending,,
mt_dial_egy_c32d0863,train,58440,DIAL_EGY,ياترى هل تقحم كلمة مصرائيلي ( مصري ) وكلمة بلطجي ( جزائري ) في هذا الموضوع 10 / 10 لليوم السّابع,ياتري هل تقحم كلمه مصراييلي مصري وكلمه بلطجي جزايري في هذا الموضوع 10 10 لليوم السابع,,[],0,pending,,
mt_dial_glf_310a1500,train,78887,DIAL_GLF,لهذي الدرجة وصلنا في حل الامور,لهذي الدرجه وصلنا في حل الامور,,[],0,pending,,
mt_dial_lev_e52c4af7,train,18853,DIAL_LEV,ابوالعبد هو قائد شعب فلسطين غصبن عن كل المناففين وعملاء اليهود,ابوالعبد هو قايد شعب فلسطين غصبن عن كل المناففين وعملاء اليهود,,[],0,pending,,
mt_msa_a851926a,train,50788,MSA,غياب عن العمل سبعة أشهر ؟ . ؟ . ؟ .,غياب عن العمل سبعه اشهر,,[],0,pending,,
mt_dial_egy_50d7a020,train,39335,DIAL_EGY,يعنى انا بتعجب من تعليق رقم 1 وبيقول وليه الزمالك ميكرمش بنى عبيد ؟ على الأقل فريق مصرى وابن,يعني انا بتعجب من تعليق رقم 1 وبيقول وليه الزمالك ميكرمش بني عبيد علي الاقل فريق مصري وابن,,[],0,pending,,
mt_dial_glf_fe644b7c,train,63120,DIAL_GLF,ياسمو الامير هذي لجنه الانحطاط وش تنتظر منها لجنه مسرحه مثل رئيسها واللوبي الفقراوي شاف,ياسمو الامير هذي لجنه الانحطاط وش تنتظر منها لجنه مسرحه مثل رييسها واللوبي الفقراوي شاف,,[],0,pending,,
mt_dial_lev_4cea0690,train,45025,DIAL_LEV,اليوم الجو شايفته لطيف ، ما توقعت ترجعوا تحكوا فيه حر اليومين الجايين . الله يسامحكم بس . زعلتوني,اليوم الجو شايفته لطيف ما توقعت ترجعوا تحكوا فيه حر اليومين الجايين الله يسامحكم بس زعلتوني,,[],0,pending,,
mt_msa_ec7b4630,train,15416,MSA,- وأظن أن هذه الكلمات كانت بمثابة الحجر الذي القي في المياه الراكدة فحركته حتي فارت . . . ووجدت لها صدي لدي باقي الأعضاء القدامى وجميع العاملين . وما أظن أن تهدأ حتي يصبح مشروع هيئة الملكية العقارية والتوثيق واقعا,واظن ان هذه الكلمات كانت بمثابه الحجر الذي القي في المياه الراكده فحركته حتي فارت ووجدت لها صدي لدي باقي الاعضاء القدامي وجميع العاملين وما اظن ان تهدا حتي يصبح مشروع هييه الملكيه العقاريه والتوثيق واقعا,,[],0,pending,,
mt_dial_egy_ea4877d1,train,17103,DIAL_EGY,اللى حصل من جمهور الزمالك دا بلطجة هما عاوزين يكسبوا بالعافيه ودى مش اول مرة هما نسيوا اللى حصل فى ماتش بتروجيت فى لدور الاول هما طول عمرهم بلطجية وانضملهم البلطجى الكبير ابراهيم الابيض والطيور على اشكالها تقع ( انا عاجبنى حسام وشيكا وعبد الحليم فى تهدئة الجمهور ) ( حازم امام وعلاء على انتوا لسة فى اول الطريق ولو هاتبتدو كدا يبقى مش هاتكملوا,اللي حصل من جمهور الزمالك دا بلطجه هما عاوزين يكسبوا بالعافيه ودي مش اول مره هما نسيوا اللي حصل في ماتش بتروجيت في لدور الاول هما طول عمرهم بلطجيه وانضملهم البلطجي الكبير ابراهيم الابيض والطيور علي اشكالها تقع انا عاجبني حسام وشيكا وعبد الحليم في تهديه الجمهور حازم امام وعلاء علي انتوا لسه في اول الطريق ولو هاتبتدو كدا يبقي مش هاتكملوا,,[],0,pending,,
mt_dial_glf_189ba4cd,train,69385,DIAL_GLF,عاد اقول لأمي مدام سويتو بزوجة اخوي الكبير كذا اجل تبون تعاملون زوجتي بعدين زي كذا جلست أمي تضحك تقول أنت برضو جايك أدور لاتخاف ه صدق مهبل الحريم الكبار مع ذالك أموت وأحيى تحت رجول الوالدة بنفس,عاد اقول لامي مدام سويتو بزوجه اخوي الكبير كذا اجل تبون تعاملون زوجتي بعدين زي كذا جلست امي تضحك تقول انت برضو جايك ادور لاتخاف ه صدق مهبل الحريم الكبار مع ذالك اموت واحيي تحت رجول الوالده بنفس,,[],0,pending,,
mt_dial_lev_bd7425ec,train,830,DIAL_LEV,حتى ترخص اسعار السيارات وتخلي الموظفيين الطفرانيين مثلنا يركبو,حتي ترخص اسعار السيارات وتخلي الموظفيين الطفرانيين مثلنا يركبو,,[],0,pending,,
mt_msa_f0d8500a,train,76421,MSA,رأيتك في مباراه الديربي شخصا,رايتك في مباراه الديربي شخصا,,[],0,pending,,
mt_dial_egy_4c37c417,train,10661,DIAL_EGY,هو ده الكلام . . . كل شئ ممكن . . مافيش مستحيل . . . طبعاً هم دول أهل الخبرة للي,هو ده الكلام كل شي ممكن مافيش مستحيل طبعا هم دول اهل الخبره للي,,[],0,pending,,
mt_dial_glf_b7532793,train,21179,DIAL_GLF,لاحول ولاقوه الا بالله . . . تحيااتي لك اخوي,لاحول ولاقوه الا بالله تحيااتي لك اخوي,,[],0,pending,,
mt_dial_lev_e1bc7889,train,82692,DIAL_LEV,"الله المستعان . . . بس احنا في الاردن دائما نساعد أهل غزة . . . وهناك مستشفيات ميدانية في قطاع . . . طيب ليش أهل غزة الي عندنا الحكومة ما تساعدهم . . القران يقول "" الاقربون أولى بالمعروف",الله المستعان بس احنا في الاردن دايما نساعد اهل غزه وهناك مستشفيات ميدانيه في قطاع طيب ليش اهل غزه الي عندنا الحكومه ما تساعدهم القران يقول الاقربون اولي بالمعروف,,[],0,pending,,
mt_msa_323e526c,train,12612,MSA,سوى اخلاء سريع لمدرج الاصفر خلال عشرين دقيقه,سوي اخلاء سريع لمدرج الاصفر خلال عشرين دقيقه,,[],0,pending,,
