example_id,source_split,source_row_id,dialect,original_text,normalized_text,masked_text,mask_spans_json,mask_count,annotation_status,annotator_model,notes
mt_dial_egy_94f5244e,train,86433,DIAL_EGY,انا مش عارف ليه الحكومة مصرة على هذا الوزير للمالية رغم كل التجاوزات والشائعات التى قيلت ضده مفيش نار من غير رماد ارجو تغير هذا الشخص والتحقيق فورا معه للتوضيح للراى العام لان المصر على وجوده يعتبر شريكا له فى هذه الشائعات يارب الحكومة تعود الى رشدها بقى,انا مش عارف ليه الحكومه مصره علي هذا الوزير للماليه رغم كل التجاوزات والشايعات التي قيلت ضده مفيش نار من غير رماد ارجو تغير هذا الشخص والتحقيق فورا معه للتوضيح للراي العام لان المصر علي وجوده يعتبر شريكا له في هذه الشايعات يارب الحكومه تعود الي رشدها بقي,,[],0,pending,,
mt_dial_glf_3b276ac1,train,40005,DIAL_GLF,عسى ماشر كل مرة نسمع أخبار غير مرة بيع ملابس النسائية في الأسواق المختلطة ومرة حضور الأمهات لحفلات تخرج الإبناء وش بقى ورى مانسجل بالكلية العسكرية مب,عسي ماشر كل مره نسمع اخبار غير مره بيع ملابس النساييه في الاسواق المختلطه ومره حضور الامهات لحفلات تخرج الابناء وش بقي وري مانسجل بالكليه العسكريه مب,,[],0,pending,,
mt_dial_lev_11feb05a,train,58310,DIAL_LEV,والله بالنسبة للعقوبات على بيع الأصوات أقترح عدم اتخاذها لأن الفائدة الوحيدة للمواطن من مجلس النواب هي النقود والمناسف ايام الانتخابات وغير هيك انسى يا وديع,والله بالنسبه للعقوبات علي بيع الاصوات اقترح عدم اتخاذها لان الفايده الوحيده للمواطن من مجلس النواب هي النقود والمناسف ايام الانتخابات وغير هيك انسي يا وديع,,[],0,pending,,
mt_msa_3eb477c7,train,29910,MSA,يجب اشهار اسم الشركة لمقاطعتها او طردها من السعودية اذا كانت,يجب اشهار اسم الشركه لمقاطعتها او طردها من السعوديه اذا كانت,,[],0,pending,,
mt_dial_egy_c870b1b6,train,26994,DIAL_EGY,وبعدين أنا محايد ومابشجعش اي فريق في مصر بس أحيانا بتفرج,وبعدين انا محايد ومابشجعش اي فريق في مصر بس احيانا بتفرج,,[],0,pending,,
mt_dial_glf_b20820f9,train,41123,DIAL_GLF,انا اخر مره دخلت حلاق عام 2003 الافضل والانظف ان كل شخص يشتري مكينه ويحلق لنفسه . . ممكن تجيب العيد اول مره بس مع الممارسة راح تتعلم وتصير,انا اخر مره دخلت حلاق عام 2003 الافضل والانظف ان كل شخص يشتري مكينه ويحلق لنفسه ممكن تجيب العيد اول مره بس مع الممارسه راح تتعلم وتصير,,[],0,pending,,
mt_dial_lev_caba5c22,train,22788,DIAL_LEV,انا بصفتي ناقد للاعبين بأقول انه راح يصير تغيرات كبيره جدا بعد هذه المباراه وانا بشجع اللعب الحلو والروح الرياضيه والف مبروك,انا بصفتي ناقد للاعبين باقول انه راح يصير تغيرات كبيره جدا بعد هذه المباراه وانا بشجع اللعب الحلو والروح الرياضيه والف مبروك,,[],0,pending,,
mt_msa_bf2eb88d,train,22950,MSA,شكرنا وتقديرنا للفضل ولأبنه الخلوق الاستاذ سليمان ولرجال القصيم الاوفياء . . وبالتوفيق للاصيفر . .,شكرنا وتقديرنا للفضل ولابنه الخلوق الاستاذ سليمان ولرجال القصيم الاوفياء وبالتوفيق للاصيفر,,[],0,pending,,
mt_dial_egy_30033157,train,51548,DIAL_EGY,انا ما اقدر اعلق واقول الا هى دى مصر يا جماعة الفقير فيها بيداس تحت الرجلين . . . ربنا على,انا ما اقدر اعلق واقول الا هي دي مصر يا جماعه الفقير فيها بيداس تحت الرجلين ربنا علي,,[],0,pending,,
mt_dial_glf_61f557c6,train,9732,DIAL_GLF,والدنا توفي وأرسلنا أخونا لمالية جدة بالأوراق قبل سنتين وقالوا له بعدين نتصل بك وللحين ماورد أسم أبونا ! !,والدنا توفي وارسلنا اخونا لماليه جده بالاوراق قبل سنتين وقالوا له بعدين نتصل بك وللحين ماورد اسم ابونا,,[],0,pending,,
mt_dial_lev_a94c8000,train,28710,DIAL_LEV,الموقع ما في حماية لانة وندوز مش لينكس والزلمة لو انه ناوي الشر كان شطب كل الداتا . .,الموقع ما في حمايه لانه وندوز مش لينكس والزلمه لو انه ناوي الشر كان شطب كل الداتا,,[],0,pending,,
mt_msa_aee29a30,train,29522,MSA,انتقلت العدوي بالبيانات من الجار,انتقلت العدوي بالبيانات من الجار,,[],0,pending,,
mt_dial_egy_1866a740,train,65111,DIAL_EGY,بالله عليكم ده شكل رئيس نادى يا جماعة انا اهلاوى بس بجد حزين للأسماعيلى مش متخيل انه يجى يوم يمسك رياسته حته عيل مش فاهم الدنبا ماشية ازاى بس هو ده حال مصر كلها دلوقتى money talk اللى معاه فلوس هو اللى بيحكم و يتريس يا,بالله عليكم ده شكل رييس نادي يا جماعه انا اهلاوي بس بجد حزين للاسماعيلي مش متخيل انه يجي يوم يمسك رياسته حته عيل مش فاهم الدنبا ماشيه ازاي بس هو ده حال مصر كلها دلوقتي money talk اللي معاه فلوس هو اللي بيحكم و يتريس يا,,[],0,pending,,
mt_dial_glf_d210bd2e,train,10860,DIAL_GLF,ان الرجل الي يعدد يساعد من الدوله ويدعم وابو وحده نقص حتي علي,ان الرجل الي يعدد يساعد من الدوله ويدعم وابو وحده نقص حتي علي,,[],0,pending,,
mt_dial_lev_bc041ce9,train,46934,DIAL_LEV,يوم ما يدخل كلب ازعر بين مجموعةاسود سكرانه . . ما بتقدر الاسود تحكي . . ممكن تقدر,يوم ما يدخل كلب ازعر بين مجموعهاسود سكرانه ما بتقدر الاسود تحكي ممكن تقدر,,[],0,pending,,
mt_msa_6c769f4b,train,77146,MSA,وانا من المتابعين لهذه الزاويه ( صوت الصوره,وانا من المتابعين لهذه الزاويه صوت الصوره,,[],0,pending,,
mt_dial_egy_9710520f,train,65807,DIAL_EGY,متزعلش نفسك كدة قوى يا أ /,متزعلش نفسك كده قوي يا ا,,[],0,pending,,
mt_dial_glf_d3e0ae42,train,20490,DIAL_GLF,حتى STC عارفين ماعندك احد وجابو لهم بلاي ستيشن وتشققو من الوناسة بعد ماسجلو وصار الهداف السهلاوي والوصيف,حتي STC عارفين ماعندك احد وجابو لهم بلاي ستيشن وتشققو من الوناسه بعد ماسجلو وصار الهداف السهلاوي والوصيف,,[],0,pending,,
mt_dial_lev_f327ecb2,train,75752,DIAL_LEV,يسعد رب الكرك واهلها لانهم زلم ولاد,يسعد رب الكرك واهلها لانهم زلم ولاد,,[],0,pending,,
mt_msa_7322e4ac,train,80869,MSA,الحق يقال خالد جاسم احسن مذيع بسبب بسيط وهو انه استفاد من الانتقاد الموجه له سابقا !,الحق يقال خالد جاسم احسن مذيع بسبب بسيط وهو انه استفاد من الانتقاد الموجه له سابقا,,[],0,pending,,
mt_dial_egy_7ebaed3a,train,47024,DIAL_EGY,انا نفسى ممكن لو المعارضه مش عاجبانى انضم للحزب الوطنى وده مش عيب,انا نفسي ممكن لو المعارضه مش عاجباني انضم للحزب الوطني وده مش عيب,,[],0,pending,,
mt_dial_glf_0d692653,train,23109,DIAL_GLF,الي تثارو بالاعلام الفاسد من مجلات وقنوات نقول الله,الي تثارو بالاعلام الفاسد من مجلات وقنوات نقول الله,,[],0,pending,,
mt_dial_lev_58e13ce2,train,7994,DIAL_LEV,هاي هي تشكيلة منتخبنا الوطني إلي راح تشارك في كأس العالم ولا شو ؟,هاي هي تشكيله منتخبنا الوطني الي راح تشارك في كاس العالم ولا شو,,[],0,pending,,
mt_msa_7c0b6e89,train,54634,MSA,الموضوع يحتاج إلى من يستطيع أن,الموضوع يحتاج الي من يستطيع ان,,[],0,pending,,
mt_dial_egy_9d6baeb5,train,28233,DIAL_EGY,الست الئي عندها 60 عام دي مش تتقي ربنا دي رجيلها والقبر أمال خالت أية للبنات الئي عندها 18 عام حسبي الله ونهم الوكيل فيهم والبلوي الئي بيعملوها دي دمرتم الوطن أنتم والحكومة الشعب هيلقيها منين ولا منين . .,الست اليي عندها 60 عام دي مش تتقي ربنا دي رجيلها والقبر امال خالت ايه للبنات اليي عندها 18 عام حسبي الله ونهم الوكيل فيهم والبلوي اليي بيعملوها دي دمرتم الوطن انتم والحكومه الشعب هيلقيها منين ولا منين,,[],0,pending,,
mt_dial_glf_b3bf642b,train,45371,DIAL_GLF,كل نقطة تحتاج تفصيل بس ما,كل نقطه تحتاج تفصيل بس ما,,[],0,pending,,
mt_dial_lev_5c85c5d9,train,22930,DIAL_LEV,للأسف إحنا ما عندنا أفيال . . . بس فيه حمير كتير . ممكن حتى نشتغل في مجال تصدير الحمير واستيراد الكفاءات الأردنية التي في الخارج,للاسف احنا ما عندنا افيال بس فيه حمير كتير ممكن حتي نشتغل في مجال تصدير الحمير واستيراد الكفاءات الاردنيه التي في الخارج,,[],0,pending,,
mt_msa_1e53a388,train,16495,MSA,رحمة الله عليها شهيدة إن شاء,رحمه الله عليها شهيده ان شاء,,[],0,pending,,
mt_dial_egy_b383ca14,train,24076,DIAL_EGY,لو كان محمود عثمان بيتشرى كان ممدوح عباس اشترى مليون منه وكان الزمالك خد كل البطولات لانه اكثر نادىى فى مصر يقدر يشترى,لو كان محمود عثمان بيتشري كان ممدوح عباس اشتري مليون منه وكان الزمالك خد كل البطولات لانه اكثر ناديي في مصر يقدر يشتري,,[],0,pending,,
mt_dial_glf_efe01fd7,train,23840,DIAL_GLF,ملاحظه ترا ماهمني شكله همني,ملاحظه ترا ماهمني شكله همني,,[],0,pending,,
mt_dial_lev_4eb42489,train,72811,DIAL_LEV,و الاردن اولا و بحبك يا,و الاردن اولا و بحبك يا,,[],0,pending,,
mt_msa_db8c5014,train,29906,MSA,لا جديد عند الصندوق مثل كل مره الأغلبية من الرياض كأن لا يوجد متوفين إلا عندهم ؟,لا جديد عند الصندوق مثل كل مره الاغلبيه من الرياض كان لا يوجد متوفين الا عندهم,,[],0,pending,,
mt_dial_egy_f6b9c9f1,train,675,DIAL_EGY,اشمعنى الكلام ده ماحصلش مع محافظ الوادى الجديد اللواء احمد مختار اللى بقاله 3 سنين رافض ينفذ حكم قضائى بتسليم 200 فدان لشباب الخريجين فى القريتين 5 و 6 بدرب الاربعين وصدر حكم محكمه بالغاء قرار المحافظ بطرد الشباب ورغم ذلك قال على جثتى لو اخدوا الارض ولا علشان اللواء مختار منوفى وكان قائد جيش ياريت القضاء ينصف الشباب ضد المحافظ,اشمعني الكلام ده ماحصلش مع محافظ الوادي الجديد اللواء احمد مختار اللي بقاله 3 سنين رافض ينفذ حكم قضايي بتسليم 200 فدان لشباب الخريجين في القريتين 5 و 6 بدرب الاربعين وصدر حكم محكمه بالغاء قرار المحافظ بطرد الشباب ورغم ذلك قال علي جثتي لو اخدوا الارض ولا علشان اللواء مختار منوفي وكان قايد جيش ياريت القضاء ينصف الشباب ضد المحافظ,,[],0,pending,,
mt_dial_glf_3fce3a1b,train,80962,DIAL_GLF,هذي من وين جايبينها من اي مزرعة,هذي من وين جايبينها من اي مزرعه,,[],0,pending,,
mt_dial_lev_219b4d6f,train,21605,DIAL_LEV,اذا بهيك ضريبة رح تحصلوا 150 مليون دينار بقيمة 212 مليون دولار تقريبا ! طيب كم بتربحوا فوق 150 مليون اكيد رح يتعدى 450 ثلاثة اضعاف يا سلام بقيمة 634 مليون دولار يعني اكثر من نصف مليار دولار,اذا بهيك ضريبه رح تحصلوا 150 مليون دينار بقيمه 212 مليون دولار تقريبا طيب كم بتربحوا فوق 150 مليون اكيد رح يتعدي 450 ثلاثه اضعاف يا سلام بقيمه 634 مليون دولار يعني اكثر من نصف مليار دولار,,[],0,pending,,
mt_msa_6022d8f3,train,45030,MSA,كل أم عظيمه . . وصلك وبرك . .,كل ام عظيمه وصلك وبرك,,[],0,pending,,
mt_dial_egy_d6bcaa85,train,12745,DIAL_EGY,بلاش ضحك على الدقون وفوقوا و لو عايزين فعلا عمال و فلاحين اوك اختار بنفسكم مش نسبة اجبارية محدش منع ترشيح العمال و الفلاحين و الشعب يختار الاصلح,بلاش ضحك علي الدقون وفوقوا و لو عايزين فعلا عمال و فلاحين اوك اختار بنفسكم مش نسبه اجباريه محدش منع ترشيح العمال و الفلاحين و الشعب يختار الاصلح,,[],0,pending,,
mt_dial_glf_b2f6377e,train,36632,DIAL_GLF,انا ما عندي مانع ان الحرمة تعمل و بكيفها . . . لكن هل حق علي اني اامن لها سيارة و سواق و شغالة في هالحالة . .,انا ما عندي مانع ان الحرمه تعمل و بكيفها لكن هل حق علي اني اامن لها سياره و سواق و شغاله في هالحاله,,[],0,pending,,
mt_dial_lev_c62612b9,train,66270,DIAL_LEV,شكرا الكم . . والله يعطيكم العافية,شكرا الكم والله يعطيكم العافيه,,[],0,pending,,
mt_msa_4a47c63b,train,15973,MSA,الله يغفر للمتوفي ويشفي المريض ويهدي الفاعل ويصلح شباب المسلمين اجمعين . هذا البعد عن الدين ؟ ؟,الله يغفر للمتوفي ويشفي المريض ويهدي الفاعل ويصلح شباب المسلمين اجمعين هذا البعد عن الدين,,[],0,pending,,
mt_dial_egy_1e352d0b,train,7662,DIAL_EGY,هو أى خناقة بين أى حد في أى مكان نعملها خبر ؟ ! !,هو اي خناقه بين اي حد في اي مكان نعملها خبر,,[],0,pending,,
mt_dial_glf_386d6dc7,train,47999,DIAL_GLF,بصراحه النظام جدآ ممتاز علي الاقل يفكونا من ذا المتهورين الي جايك ماشي طبلونه ولو تلحقه تبي تشوف وش عنده تلقاه رايح مقهي ولا رايح الاستراحه ومزعج الخلق خلهم يوقفون عند حدهم والحين يعرفون ان وراهم مخالفه وما بيسرع فاهلا بك ياساهر وشكرآ للعقيد المقبل,بصراحه النظام جدا ممتاز علي الاقل يفكونا من ذا المتهورين الي جايك ماشي طبلونه ولو تلحقه تبي تشوف وش عنده تلقاه رايح مقهي ولا رايح الاستراحه ومزعج الخلق خلهم يوقفون عند حدهم والحين يعرفون ان وراهم مخالفه وما بيسرع فاهلا بك ياساهر وشكرا للعقيد المقبل,,[],0,pending,,
mt_dial_lev_ea613874,train,42436,DIAL_LEV,هيفا عادي هيفا ايزي هيفا دونت ووري :,هيفا عادي هيفا ايزي هيفا دونت ووري,,[],0,pending,,
mt_msa_a0664312,train,78713,MSA,وهل الأحاديث النبوية وتفسيراتها سر من الأسرار ! !,وهل الاحاديث النبويه وتفسيراتها سر من الاسرار,,[],0,pending,,
mt_dial_egy_4b146b14,train,2990,DIAL_EGY,"صدق باللة القذلفى عاوز يتضرب تانى وانا من اللى ضربوة اول مرة ولو الامور باءيدى لكنت ضربتكزا تانى علشان الصيادين , وهو انت لما يجى وتساهم ب 50 طيارة ميراج تبقى ادينى حاجة مان خدهم تانى والطلمبات مالكوش فيها خالص احنا اللى مشترينها من المانيا للدفاع الدنى واطفاء الحرايق اما المليار بتاعك القذافى كان بيلف بية علشان يشترى كبارى من اوروبا وكل مايعرض حاجة نقول لة ماتنفعش علشان احنا كان عندنا كل حاجة خلاص شكرا ومانقدرش ناخد منة شىء خطير زى دة كان هايجرنا ويقول لطوب الارض",صدق بالله القذلفي عاوز يتضرب تاني وانا من اللي ضربوه اول مره ولو الامور باءيدي لكنت ضربتكزا تاني علشان الصيادين وهو انت لما يجي وتساهم ب 50 طياره ميراج تبقي اديني حاجه مان خدهم تاني والطلمبات مالكوش فيها خالص احنا اللي مشترينها من المانيا للدفاع الدني واطفاء الحرايق اما المليار بتاعك القذافي كان بيلف بيه علشان يشتري كباري من اوروبا وكل مايعرض حاجه نقول له ماتنفعش علشان احنا كان عندنا كل حاجه خلاص شكرا ومانقدرش ناخد منه شيء خطير زي ده كان هايجرنا ويقول لطوب الارض,,[],0,pending,,
mt_dial_glf_fd0c6193,train,78666,DIAL_GLF,ركزو مظبوط على السطر التالي : شغل السفير جيمس سميث مناصب تنفيذية عدة في شركة ريثيون وشمل مهامه هنالك التخطيط الاستراتيجي ، تصنيع الطائرات وتنمية الأعمال التجارية الدولية,ركزو مظبوط علي السطر التالي شغل السفير جيمس سميث مناصب تنفيذيه عده في شركه ريثيون وشمل مهامه هنالك التخطيط الاستراتيجي تصنيع الطايرات وتنميه الاعمال التجاريه الدوليه,,[],0,pending,,
mt_dial_lev_2c7e2dd6,train,22241,DIAL_LEV,وبعدين شكلك نسيت انه الاي أر تي عملت نفس الشي بالبطولة الماضية حيث بثت مباراة الافتتاح والدور قبل النهائي والنهائي على القناة المفتوحة ! ! على الاقل الجزيرة أسعارها اقل بحوالي 80 & amp ; # 1642 ; من الاي أر تي !,وبعدين شكلك نسيت انه الاي ار تي عملت نفس الشي بالبطوله الماضيه حيث بثت مباراه الافتتاح والدور قبل النهايي والنهايي علي القناه المفتوحه علي الاقل الجزيره اسعارها اقل بحوالي 80 amp 1642 من الاي ار تي,,[],0,pending,,
mt_msa_1174463c,train,3354,MSA,أي شخص يستخدم العقل ولو قليلا وبعيد عن المظاهر الكدابة سيقوم أولا ببحث اسباب غياب الطلاب عن المدارس والاسباب هي مساوئ من الوزير الى مدير المدرسة مرورا بتنظيم العملية التعليمية ومن ثم دراسة المشكلة على مستوى الخبراء للوزارة مع بعض الممارسين للعملية التعليمية ووضع حلول للمشكلة لعدم تكرارها العام القادم وطبعا اكبر دليل على فشل نظام التعليم فى مصر وفشل الوزير فى ادارة الوزارة هو غياب الطلاب عن,اي شخص يستخدم العقل ولو قليلا وبعيد عن المظاهر الكدابه سيقوم اولا ببحث اسباب غياب الطلاب عن المدارس والاسباب هي مساوي من الوزير الي مدير المدرسه مرورا بتنظيم العمليه التعليميه ومن ثم دراسه المشكله علي مستوي الخبراء للوزاره مع بعض الممارسين للعمليه التعليميه ووضع حلول للمشكله لعدم تكرارها العام القادم وطبعا اكبر دليل علي فشل نظام التعليم في مصر وفشل الوزير في اداره الوزاره هو غياب الطلاب عن,,[],0,pending,,
mt_dial_egy_8ce0d447,train,449,DIAL_EGY,ايهاب توفيق وبس الفن توقف,ايهاب توفيق وبس الفن توقف,,[],0,pending,,
mt_dial_glf_079d9bcf,train,83251,DIAL_GLF,وين يجي السيل وهذي تصرفات,وين يجي السيل وهذي تصرفات,,[],0,pending,,
