example_id,source_split,source_row_id,dialect,original_text,normalized_text,masked_text,mask_spans_json,mask_count,annotation_status,annotator_model,notes
mt_msa_b0749cdc,train,55662,MSA,سمو الامير كل اهالي الا سياح يتمنون من سموكم تغيير الطرف الثاني بقضية المحافظ السابق الذي لم يغير اي ساكن بالمحا فظه سوى تعيين ابناء ( ) وهم معلمون ومتخرجين من المعهد الصحي والبعض الاخر يدرس,سمو الامير كل اهالي الا سياح يتمنون من سموكم تغيير الطرف الثاني بقضيه المحافظ السابق الذي لم يغير اي ساكن بالمحا فظه سوي تعيين ابناء وهم معلمون ومتخرجين من المعهد الصحي والبعض الاخر يدرس,,[],0,pending,,
mt_dial_egy_d74d70af,train,79907,DIAL_EGY,والنتيجه ان مصر حتعاقب على احداث القاهره والجزائر فى كاس,والنتيجه ان مصر حتعاقب علي احداث القاهره والجزاير في كاس,,[],0,pending,,
mt_dial_glf_04c65acd,train,9031,DIAL_GLF,والله انك تستاهل أي ميداليه وأي كاس يتعلق,والله انك تستاهل اي ميداليه واي كاس يتعلق,,[],0,pending,,
mt_dial_lev_95ecbfb2,train,4812,DIAL_LEV,أحلى شي سلمى لو يلغوا الخلوي ما عاد ننفقس من صوت الباردة وهي عم تقول عذرا لن تستيطع اكمال المكالمة لان رصيدك من الدقائق لا يكفي,احلي شي سلمي لو يلغوا الخلوي ما عاد ننفقس من صوت البارده وهي عم تقول عذرا لن تستيطع اكمال المكالمه لان رصيدك من الدقايق لا يكفي,,[],0,pending,,
mt_msa_17c25cfa,train,53233,MSA,فيقاروا من ضربه خرج رادوي من الملعب في فرق بين الحماس الزايد وبين,فيقاروا من ضربه خرج رادوي من الملعب في فرق بين الحماس الزايد وبين,,[],0,pending,,
mt_dial_egy_d5f3302a,train,12081,DIAL_EGY,نفسى اعرف مين بيحكم البد دى سؤال ديما اساله لنسى ومش لقيله اجابه معقول ياسى عز اللى انت بتعمله ده يااخى خليك ابن عز واجه بكرى بكل شرف واخلاق الفرسان لكن حقول ايه مش عايز اى معرضه شريفه على العموم نفسى تشوف نفسك فى موتمر الحزب واللهشكلك يكسف وانت عامل ارجوز لجمال يا سى عز خليك ابن,نفسي اعرف مين بيحكم البد دي سوال ديما اساله لنسي ومش لقيله اجابه معقول ياسي عز اللي انت بتعمله ده يااخي خليك ابن عز واجه بكري بكل شرف واخلاق الفرسان لكن حقول ايه مش عايز اي معرضه شريفه علي العموم نفسي تشوف نفسك في موتمر الحزب واللهشكلك يكسف وانت عامل ارجوز لجمال يا سي عز خليك ابن,,[],0,pending,,
mt_dial_glf_535d3b08,train,46307,DIAL_GLF,واذا حكم وطني يظلمني ويأخذ حقي واصفق,واذا حكم وطني يظلمني وياخذ حقي واصفق,,[],0,pending,,
mt_dial_lev_c2aaa9ba,train,74013,DIAL_LEV,انا بحكي انها ماتت ورب العالمين اللي,انا بحكي انها ماتت ورب العالمين اللي,,[],0,pending,,
mt_msa_5a5c7ea0,train,50636,MSA,ولكنك كمحافظ اعتدت على هذا الخطاب لمراجعينك من متوسطي التعليم والطامعين بختم الدولة الذي وضعوه,ولكنك كمحافظ اعتدت علي هذا الخطاب لمراجعينك من متوسطي التعليم والطامعين بختم الدوله الذي وضعوه,,[],0,pending,,
mt_dial_egy_82641d20,train,76285,DIAL_EGY,وياابراهيم ياحسن حسبي الله ونعم الوكيل فيك لانك بتثير الفتنه تاني بين ماهير الاهلي والزمالك الي يارب تبطل تخلف شويه وتشجع فريقها بدون تعصب لكن أعتقد ده في الاحلام,وياابراهيم ياحسن حسبي الله ونعم الوكيل فيك لانك بتثير الفتنه تاني بين ماهير الاهلي والزمالك الي يارب تبطل تخلف شويه وتشجع فريقها بدون تعصب لكن اعتقد ده في الاحلام,,[],0,pending,,
mt_dial_glf_7adcbd95,train,84348,DIAL_GLF,قال نبي نطور الرياضة السعودية يبأ قابلني على كبري,قال نبي نطور الرياضه السعوديه يبا قابلني علي كبري,,[],0,pending,,
mt_dial_lev_4f1d9ce1,train,35265,DIAL_LEV,اذا ثبت النفط في العالم . . . في الاردن,اذا ثبت النفط في العالم في الاردن,,[],0,pending,,
mt_msa_51a53f49,train,70116,MSA,"حسبي الله و نعم الوكيل والله ودي الحكومة تجرجرهم في المحاكم و تحكم عليهم بالتآمر على المواطن , ثم يعاقبون بأن يتم سحب أموالهم من البنوك و صرفها على منشآت حكومية قيد",حسبي الله و نعم الوكيل والله ودي الحكومه تجرجرهم في المحاكم و تحكم عليهم بالتامر علي المواطن ثم يعاقبون بان يتم سحب اموالهم من البنوك و صرفها علي منشات حكوميه قيد,,[],0,pending,,
mt_dial_egy_409e0244,train,78138,DIAL_EGY,هو الشيخ الجندى ما يعرفش بأن الحلف بغير الله شرك وكان عليه الوقف المهزلة بالأستهتار بالمصحف للدرجة دية وهو انتم شوفتم عمركه حد من الأخوة الأقباط بيحلف بالأنجيل بالمنظر دة وبعدين ازاى انا اعاقب ابنى على الحلفان بالمصحف وهو شايف الناس ئلى المفروض القدوة بتعتنا بيحلفوا على المصحف بهذا المنظر السخيف والله هو الأعلم اذا كان ئلى ماسك المصحف اصلا صادق ولا لأوالله عيب على الأعلامى محمود سعد انه يوضع نفسه فى هذا الموقف وربنا يهدينا ويهيهم,هو الشيخ الجندي ما يعرفش بان الحلف بغير الله شرك وكان عليه الوقف المهزله بالاستهتار بالمصحف للدرجه ديه وهو انتم شوفتم عمركه حد من الاخوه الاقباط بيحلف بالانجيل بالمنظر ده وبعدين ازاي انا اعاقب ابني علي الحلفان بالمصحف وهو شايف الناس يلي المفروض القدوه بتعتنا بيحلفوا علي المصحف بهذا المنظر السخيف والله هو الاعلم اذا كان يلي ماسك المصحف اصلا صادق ولا لاوالله عيب علي الاعلامي محمود سعد انه يوضع نفسه في هذا الموقف وربنا يهدينا ويهيهم,,[],0,pending,,
mt_dial_glf_6c6b6a85,train,33093,DIAL_GLF,المفروض البنات تحتشم وبعدين تحاسب,المفروض البنات تحتشم وبعدين تحاسب,,[],0,pending,,
mt_dial_lev_73248813,train,81285,DIAL_LEV,وليه حضرته بده يعمل هيك ؟ ؟ ؟ اصلا الاردن هلأ معترف فيه على مستوى اكاديمي وصحي واستثماري اكثر من اي وقت مضى,وليه حضرته بده يعمل هيك اصلا الاردن هلا معترف فيه علي مستوي اكاديمي وصحي واستثماري اكثر من اي وقت مضي,,[],0,pending,,
mt_msa_87f8328e,train,6498,MSA,"و أنت يا خالد متميز . ,",و انت يا خالد متميز,,[],0,pending,,
mt_dial_egy_5c066751,train,84306,DIAL_EGY,"الشئ الوحيد الذى يعمل النظام له حساب الان هو البرادعى , لو اهالى كذا مدينة قالوا نفس الكلام ده , فيه حاجات كتير",الشي الوحيد الذي يعمل النظام له حساب الان هو البرادعي لو اهالي كذا مدينه قالوا نفس الكلام ده فيه حاجات كتير,,[],0,pending,,
mt_dial_glf_c3eedce9,train,46691,DIAL_GLF,من كثر صدماتي بناس عزيزين .,من كثر صدماتي بناس عزيزين,,[],0,pending,,
mt_dial_lev_b97e7f36,train,38383,DIAL_LEV,يعني هالحكومه مش قادرة تتشاطر و تتفلسف غير على الشعب الغلبان الكحيان التعبان و الطفران ال . . . يعني وينها و وين بتكون نايمة على جرائم الفساد الي شغاله في كل مكان في الوزارات و الشركات الكبيرة و المؤسسات الله,يعني هالحكومه مش قادره تتشاطر و تتفلسف غير علي الشعب الغلبان الكحيان التعبان و الطفران ال يعني وينها و وين بتكون نايمه علي جرايم الفساد الي شغاله في كل مكان في الوزارات و الشركات الكبيره و الموسسات الله,,[],0,pending,,
mt_msa_3bb7c524,train,73202,MSA,اريد ان اقول للجميع بان لا زعيم الا شباب,اريد ان اقول للجميع بان لا زعيم الا شباب,,[],0,pending,,
mt_dial_egy_a7e39719,train,6106,DIAL_EGY,ربناسبحانه وتعالي بيغفرالزنوب ازاتاب العبدواناب واحناالبشرمش عايزين نسامحه الراجل اقدم اعتزارات كتير وياماأقدم للاهلي كتيرولمصر مش كتيران احنا نسامحه ونكرمه في اخرمشواره واناعن نفسي كاهلاوي مش شايف فيها حاجه لورجع وربنابيسامح يبقي احنا مش,ربناسبحانه وتعالي بيغفرالزنوب ازاتاب العبدواناب واحناالبشرمش عايزين نسامحه الراجل اقدم اعتزارات كتير ويامااقدم للاهلي كتيرولمصر مش كتيران احنا نسامحه ونكرمه في اخرمشواره واناعن نفسي كاهلاوي مش شايف فيها حاجه لورجع وربنابيسامح يبقي احنا مش,,[],0,pending,,
mt_dial_glf_51465cc9,train,23820,DIAL_GLF,بيرجع قيمة الكميرات في اسبوع والناس ياغافلين لكم,بيرجع قيمه الكميرات في اسبوع والناس ياغافلين لكم,,[],0,pending,,
mt_dial_lev_bd395b28,train,28487,DIAL_LEV,شو نوع البترول اللي بنستورده ؟ برنت ولا عربي خفيف,شو نوع البترول اللي بنستورده برنت ولا عربي خفيف,,[],0,pending,,
mt_msa_8a0e0717,train,79442,MSA,"نحن دائماً ما نذكر المشكلة واسبابها ونغفل او نتغافل او نجهل الحل فهذا هو الحل الانسب وليس العرض لان المشكلة قائمة ولكن نريد الحل الامثل والوسائل التي تبعد الناس عن تلك السموم وايجاد الوضائف وفضح الروؤس الكبيرة التي تحاول المساس بعقول الشباب المساكين , والله من وراء القصد .",نحن دايما ما نذكر المشكله واسبابها ونغفل او نتغافل او نجهل الحل فهذا هو الحل الانسب وليس العرض لان المشكله قايمه ولكن نريد الحل الامثل والوسايل التي تبعد الناس عن تلك السموم وايجاد الوضايف وفضح الرووس الكبيره التي تحاول المساس بعقول الشباب المساكين والله من وراء القصد,,[],0,pending,,
mt_dial_egy_6da52232,train,73280,DIAL_EGY,حسام حسن عنده انجازات انت عايز 100 سنه علي شان تعمله ومش هتعمله حسام يعني تاريخ كبير ادعي لحسن شحاته بيلعبك مجمله وسلامي للمنشطات انت لسه مش عميد لاعبي متخفش في متشات ودي كتير نام يابني مش عايز كلام,حسام حسن عنده انجازات انت عايز 100 سنه علي شان تعمله ومش هتعمله حسام يعني تاريخ كبير ادعي لحسن شحاته بيلعبك مجمله وسلامي للمنشطات انت لسه مش عميد لاعبي متخفش في متشات ودي كتير نام يابني مش عايز كلام,,[],0,pending,,
mt_dial_glf_1d1de161,train,206,DIAL_GLF,فى القرون الوسطى متسلطين على البلد واحد يقول الارض ماتدور وواحد يقول الانترنت والدش حرام وبعدين يسوى له,في القرون الوسطي متسلطين علي البلد واحد يقول الارض ماتدور وواحد يقول الانترنت والدش حرام وبعدين يسوي له,,[],0,pending,,
mt_dial_lev_307589da,train,43141,DIAL_LEV,ها ها ها و الله ضحكتيني و و الله بستاهل ينضرب كل يوم هادا جوزك ، احسن شي انها طلبت الطلاق و ان شاء الله برزقك باللي احسن منه . .,ها ها ها و الله ضحكتيني و و الله بستاهل ينضرب كل يوم هادا جوزك احسن شي انها طلبت الطلاق و ان شاء الله برزقك باللي احسن منه,,[],0,pending,,
mt_msa_fc40af60,train,5976,MSA,يمهل ولا يهمل هانت باذن,يمهل ولا يهمل هانت باذن,,[],0,pending,,
mt_dial_egy_4abb54be,train,82414,DIAL_EGY,السلام عليكم ورحمة الله وبركاتة انا شايف ان دى اول مرة يتقال كلام معقول احنا كشعب نبتدى فعلا نهتم بالمشاركة فى السياسة واننا ابتدينا نسمع كلام جديد وواضح ان الكلام دة لازم يعجب ناس وميعجبش ناس والحل اننا نتكلم مع بعض اكتر مش نطلع تصريحات نشتم فيها بعض,السلام عليكم ورحمه الله وبركاته انا شايف ان دي اول مره يتقال كلام معقول احنا كشعب نبتدي فعلا نهتم بالمشاركه في السياسه واننا ابتدينا نسمع كلام جديد وواضح ان الكلام ده لازم يعجب ناس وميعجبش ناس والحل اننا نتكلم مع بعض اكتر مش نطلع تصريحات نشتم فيها بعض,,[],0,pending,,
mt_dial_glf_4fc363b5,train,40675,DIAL_GLF,ما تبي تلعب الله لا يردك الزعيم فايز ومتاهل ورافع الكاس ان شاء,ما تبي تلعب الله لا يردك الزعيم فايز ومتاهل ورافع الكاس ان شاء,,[],0,pending,,
mt_dial_lev_5ca108f6,train,49185,DIAL_LEV,بما انك كنت جالس بين جمهور الرمثا لتشجع الرمثا في مباراته مع الفيصلي يسرني ايلاغك بأنني مع الوحدات في مباراته المقبله مع الرمثا لا لشيء سوى لجبر خاطرك كون كأس الأردن هو كأس جبر الخواطر و لتعويض ما فاتكم عندما انتزع الزعيم منكم بطولة الدوري و,بما انك كنت جالس بين جمهور الرمثا لتشجع الرمثا في مباراته مع الفيصلي يسرني ايلاغك بانني مع الوحدات في مباراته المقبله مع الرمثا لا لشيء سوي لجبر خاطرك كون كاس الاردن هو كاس جبر الخواطر و لتعويض ما فاتكم عندما انتزع الزعيم منكم بطوله الدوري و,,[],0,pending,,
mt_msa_afb049a1,train,921,MSA,شباب الاردن 3 مشاركات بطل,شباب الاردن 3 مشاركات بطل,,[],0,pending,,
