example_id,source_split,source_row_id,dialect,original_text,normalized_text,masked_text,mask_spans_json,mask_count,annotation_status,annotator_model,notes
mt_dial_lev_ab6e5695,train,61907,DIAL_LEV,مفكر حالو بفلم وهو البطل يعني بيوم واحد بيقتل 6 لا اله الا الله انا مش عارفة ليش جارته ما حكت لزوجها انه في حد بيدايقها وعمل فيها هيك وهي بتعرفه يعني ليش ما حكت للشرطه المصيبه هون بالنسوان اللي ما الهم تم يحكي عشان هيك الزلام صارت بتعمل هيك كلوا منك يا,مفكر حالو بفلم وهو البطل يعني بيوم واحد بيقتل 6 لا اله الا الله انا مش عارفه ليش جارته ما حكت لزوجها انه في حد بيدايقها وعمل فيها هيك وهي بتعرفه يعني ليش ما حكت للشرطه المصيبه هون بالنسوان اللي ما الهم تم يحكي عشان هيك الزلام صارت بتعمل هيك كلوا منك يا,,[],0,pending,,
mt_msa_a77a663d,train,34835,MSA,لم أرَ مجتمعاً يسيء موازنة الأمور ولايعرف للتسديد والمقاربة طريقاً كمجتمعنا,لم ار مجتمعا يسيء موازنه الامور ولايعرف للتسديد والمقاربه طريقا كمجتمعنا,,[],0,pending,,
mt_dial_egy_d69b7864,train,56456,DIAL_EGY,ياريت يطبق عاليها هذا القرار شطبه من سجلات اتحاد الكرة نهائيا لانه كثير الشغب والكوارث ما رحش فى اى مكان الا وأتى بالشغب والكوارث هاتوا تاريخ ابراهيم حسن وشوفوا وانتوا تعرفوا وأيضا هو السبب فى اشتعال الفتنة فى الفترة الاخيرة ده تصريحات عنجهيه عن المنشطات وعن سوء التحكيم وعن اتفاق مع لاعبين الفرق قبل اى مبارة للزمالك ده انسان ليس انسان ده حقود وغيور ويتمنى ان يفعل اى شىء ليكيد الاهلى للاسف هو الرباه وعلمة الحمد الله ان الاهلى نبذه,ياريت يطبق عاليها هذا القرار شطبه من سجلات اتحاد الكره نهاييا لانه كثير الشغب والكوارث ما رحش في اي مكان الا واتي بالشغب والكوارث هاتوا تاريخ ابراهيم حسن وشوفوا وانتوا تعرفوا وايضا هو السبب في اشتعال الفتنه في الفتره الاخيره ده تصريحات عنجهيه عن المنشطات وعن سوء التحكيم وعن اتفاق مع لاعبين الفرق قبل اي مباره للزمالك ده انسان ليس انسان ده حقود وغيور ويتمني ان يفعل اي شيء ليكيد الاهلي للاسف هو الرباه وعلمه الحمد الله ان الاهلي نبذه,,[],0,pending,,
mt_dial_glf_053fb7a0,train,5360,DIAL_GLF,خليكم في التجارة والمشاريع وبس الله,خليكم في التجاره والمشاريع وبس الله,,[],0,pending,,
mt_dial_lev_e8dd83ec,train,3928,DIAL_LEV,سر الى الامام يا اخضر و الاخضر كبير بمن حضر ولا يهمنا احتراف اكثرمنلاعب فالكبير كبير و هده من صفات,سر الي الامام يا اخضر و الاخضر كبير بمن حضر ولا يهمنا احتراف اكثرمنلاعب فالكبير كبير و هده من صفات,,[],0,pending,,
mt_msa_49ddcc03,train,33415,MSA,متطلبات البنات في هذة الايام لها بداية ولكن ليس لها نهايةاصبحنا نسمي الانحلال انفتاحاوالحرية العشوائية حقا لهاالى اين سنتجة بهذا السلوك الخاطئ البعيد عن القيم,متطلبات البنات في هذه الايام لها بدايه ولكن ليس لها نهايهاصبحنا نسمي الانحلال انفتاحاوالحريه العشواييه حقا لهاالي اين سنتجه بهذا السلوك الخاطي البعيد عن القيم,,[],0,pending,,
mt_dial_egy_9a051fe7,train,5546,DIAL_EGY,ليل اسكندرية ورأس الدمياطية والشال والمشربية بلدى,ليل اسكندريه وراس الدمياطيه والشال والمشربيه بلدي,,[],0,pending,,
mt_dial_glf_0b10609b,train,73595,DIAL_GLF,اهم شى الهلال والشباب لانهم من الرياض وحبايب ولدليل مباراة الشباب,اهم شي الهلال والشباب لانهم من الرياض وحبايب ولدليل مباراه الشباب,,[],0,pending,,
mt_dial_lev_3b98022b,train,44486,DIAL_LEV,انا اخدت في الجامعة الفصل الماضي مادة تاريخ الاردن وفلسطين وحسيت كام في روح الاخوة بيناتنا من,انا اخدت في الجامعه الفصل الماضي ماده تاريخ الاردن وفلسطين وحسيت كام في روح الاخوه بيناتنا من,,[],0,pending,,
mt_msa_9b6e66c4,train,22203,MSA,الحل الثالث تظاف المخالفات لشركات,الحل الثالث تظاف المخالفات لشركات,,[],0,pending,,
mt_dial_egy_b448bbab,train,2750,DIAL_EGY,هما يحبوا بعض هما يبوسوا,هما يحبوا بعض هما يبوسوا,,[],0,pending,,
mt_dial_glf_8d9ecf07,train,18894,DIAL_GLF,و بعدين مع وحوش الاطفال هذول ! !,و بعدين مع وحوش الاطفال هذول,,[],0,pending,,
mt_dial_lev_eb38ee63,train,75590,DIAL_LEV,اولا الف مبروك للملكية الاردنية و ثانيا اخ محمود ايرباص A 380 طائرة عملاقة كلف تشغيلها عالية وصعبة من حيث الصيانة و جمع عدد الركاب اللي هوي 500 او اكثر حسب تقسيم الطائرة و الملكية الاردنية سوف تستبدل طائرات A 340 - 200 اللي بتخدم حاليا على رحلات امريكا الشمالية بطائرات 787 اللي اثبتت تفوقها و حتكون ثاني اكثر طائرة مبيعا في العالم بعد 737 اما بخصوص مين الاحسن و فكل محبي عالم الطيران يتمنون وجود طائرات مثل 777 و a 340 - 600 في الخط الرسمي الناقل لبدانهم و لكن عندما نتحدث عن الكفاءة و الافضلية فبلا منازع طائرات 787 ستكون الافضل للملكية الاردنية لرحلات امريكا لكثير من الاسباب اهمها توفير الوقود و الكلف التشغيلية و ان شاء الله بكرا بنشوف انتونوف عنا كمان مش بس,اولا الف مبروك للملكيه الاردنيه و ثانيا اخ محمود ايرباص A 380 طايره عملاقه كلف تشغيلها عاليه وصعبه من حيث الصيانه و جمع عدد الركاب اللي هوي 500 او اكثر حسب تقسيم الطايره و الملكيه الاردنيه سوف تستبدل طايرات A 340 200 اللي بتخدم حاليا علي رحلات امريكا الشماليه بطايرات 787 اللي اثبتت تفوقها و حتكون ثاني اكثر طايره مبيعا في العالم بعد 737 اما بخصوص مين الاحسن و فكل محبي عالم الطيران يتمنون وجود طايرات مثل 777 و a 340 600 في الخط الرسمي الناقل لبدانهم و لكن عندما نتحدث عن الكفاءه و الافضليه فبلا منازع طايرات 787 ستكون الافضل للملكيه الاردنيه لرحلات امريكا لكثير من الاسباب اهمها توفير الوقود و الكلف التشغيليه و ان شاء الله بكرا بنشوف انتونوف عنا كمان مش بس,,[],0,pending,,
mt_msa_a3175e24,train,21554,MSA,هو السبب الأول والأهم والأخطر,هو السبب الاول والاهم والاخطر,,[],0,pending,,
mt_dial_egy_018b1e52,train,43482,DIAL_EGY,زى القرع نمد لبرره وياريت بره كان يستاهل بلا,زي القرع نمد لبرره وياريت بره كان يستاهل بلا,,[],0,pending,,
mt_dial_glf_d8d12efe,train,4948,DIAL_GLF,و الله زين يوم سموها غزلان مو,و الله زين يوم سموها غزلان مو,,[],0,pending,,
mt_dial_lev_acb32228,train,14931,DIAL_LEV,بس النتيجة فقدان ثقة الناس بالبلد !,بس النتيجه فقدان ثقه الناس بالبلد,,[],0,pending,,
mt_msa_e2311b6b,train,4981,MSA,"تقديرى الفائز الأول فى هذه الإنتخابات هو الشعب السودانى الذى اثبتت هذه التجربه انه شعب استفاد من التجارب السابقة وانه قاد على يحدد اختياره نتيجة النقلة الكبيرة التى احدثتها ثورة الانقاذ , , , نسال الله الإعانة للمجاهد عمر",تقديري الفايز الاول في هذه الانتخابات هو الشعب السوداني الذي اثبتت هذه التجربه انه شعب استفاد من التجارب السابقه وانه قاد علي يحدد اختياره نتيجه النقله الكبيره التي احدثتها ثوره الانقاذ نسال الله الاعانه للمجاهد عمر,,[],0,pending,,
mt_dial_egy_7bc6f727,train,19554,DIAL_EGY,يبقى يستحق يدخل موسوعة جينيس بصراحة :,يبقي يستحق يدخل موسوعه جينيس بصراحه,,[],0,pending,,
mt_dial_glf_f9bd047c,train,3128,DIAL_GLF,اولا . . . مستحيل احد يرفض يزوج بنتة اذا كان الرجل من جماعتة ومعروف الاصل والنسب . . . اما انة يرفض يزوج بنتة الا من,اولا مستحيل احد يرفض يزوج بنته اذا كان الرجل من جماعته ومعروف الاصل والنسب اما انه يرفض يزوج بنته الا من,,[],0,pending,,
mt_dial_lev_ef4a63c8,train,3811,DIAL_LEV,1 - اتروح وترجع في السلامه يا استاذ طارق خوري وياريت يرجع حسن مع المونديال وثانين احمد كشكش اهم لعب يوقعغ مع الوحدات لا عماني ولا اسباني وثانين وسيم لبزور كويس وخير انشاء الله شو مالو الحوت عامر شفيع وعمان عبدالله ذيب لعب ممتاز كتير واخران الف صحه وعافيه على الكيكهيا رافت ويا عامر ومحمد جمال وبتوفيق الوحدات في الموسم الوقبل ونحن ورائك يا الزعيم الاخضر يا المارد يا المبارطور سلام سلا مات كل الرنتيسيه بحبو,1 اتروح وترجع في السلامه يا استاذ طارق خوري وياريت يرجع حسن مع المونديال وثانين احمد كشكش اهم لعب يوقعغ مع الوحدات لا عماني ولا اسباني وثانين وسيم لبزور كويس وخير انشاء الله شو مالو الحوت عامر شفيع وعمان عبدالله ذيب لعب ممتاز كتير واخران الف صحه وعافيه علي الكيكهيا رافت ويا عامر ومحمد جمال وبتوفيق الوحدات في الموسم الوقبل ونحن ورايك يا الزعيم الاخضر يا المارد يا المبارطور سلام سلا مات كل الرنتيسيه بحبو,,[],0,pending,,
mt_msa_1b2ffe10,train,72667,MSA,هو نصيحة سيدنا يوسف : تزرعون سبع سنين دابا فما حصدتم فذروه فى سنبله الا قليلا مما تاكلون,هو نصيحه سيدنا يوسف تزرعون سبع سنين دابا فما حصدتم فذروه في سنبله الا قليلا مما تاكلون,,[],0,pending,,
mt_dial_egy_e254ea3b,train,66622,DIAL_EGY,يا ريت ماكنت قابلتو . . . كملوا انتو بقا انا,يا ريت ماكنت قابلتو كملوا انتو بقا انا,,[],0,pending,,
mt_dial_glf_63dd6d9a,train,13378,DIAL_GLF,والمواطن ياغافل لك الله مايدري وش الصح اهم شي يفك,والمواطن ياغافل لك الله مايدري وش الصح اهم شي يفك,,[],0,pending,,
mt_dial_lev_48dbf379,train,72978,DIAL_LEV,القاتل يقتل ولا عم نستنى بالغرب يطبقو القصاص عشان,القاتل يقتل ولا عم نستني بالغرب يطبقو القصاص عشان,,[],0,pending,,
mt_msa_3a399c57,train,5092,MSA,هل يعتقد المتقدمون بقضية ضد مصلحة السجون وفي المحاكم الاسرائيلية أنهم منتصرون لدم الشهيد ؟ ربما روحه تعدها جريمةأخرى وإهانة لما نذرت له إن كان لها أن تقول,هل يعتقد المتقدمون بقضيه ضد مصلحه السجون وفي المحاكم الاسراييليه انهم منتصرون لدم الشهيد ربما روحه تعدها جريمهاخري واهانه لما نذرت له ان كان لها ان تقول,,[],0,pending,,
mt_dial_egy_9c61fb3f,train,79914,DIAL_EGY,اتمنة فوز برشلونة علي ريا ل مدريد يوم السبت سبعة صفر ومسي يسجل سوبر هترك في شبلك,اتمنه فوز برشلونه علي ريا ل مدريد يوم السبت سبعه صفر ومسي يسجل سوبر هترك في شبلك,,[],0,pending,,
mt_dial_glf_d77acc5f,train,27228,DIAL_GLF,كذب في كذب يالبنوك . . . لم ارى في حياتي بنك يقدم الخدمة لأجل العميل بتاتا . . . يعني البنك ماراح يتنازل ببند لعيون العميل و لو البنك ربحان . . . يعني النسبة شفتها عندكم يا بنك البلاد خمسة في المية على العقار . . . الحقيقة النسبة عالية جدا جدا . .,كذب في كذب يالبنوك لم اري في حياتي بنك يقدم الخدمه لاجل العميل بتاتا يعني البنك ماراح يتنازل ببند لعيون العميل و لو البنك ربحان يعني النسبه شفتها عندكم يا بنك البلاد خمسه في الميه علي العقار الحقيقه النسبه عاليه جدا جدا,,[],0,pending,,
mt_dial_lev_8731cb30,train,38507,DIAL_LEV,مع احترامي للكل بس هي للأسف الحقيقة المرة,مع احترامي للكل بس هي للاسف الحقيقه المره,,[],0,pending,,
mt_msa_9bee7406,train,17998,MSA,نريد نظام مع المراقبه واعطاء رجال المرور,نريد نظام مع المراقبه واعطاء رجال المرور,,[],0,pending,,
mt_dial_egy_f3a587c1,train,45599,DIAL_EGY,النظام دة هش جدا يا اخواننا ضارب لخمة وخايف رغم انه اقوي م البرادعي 20000,النظام ده هش جدا يا اخواننا ضارب لخمه وخايف رغم انه اقوي م البرادعي 20000,,[],0,pending,,
mt_dial_glf_bdead6c2,train,601,DIAL_GLF,اتذكر زمانك عبر حيا الله ذاك,اتذكر زمانك عبر حيا الله ذاك,,[],0,pending,,
mt_dial_lev_b63a0661,train,61962,DIAL_LEV,مستوى كرة القدم في الاردن زي مستوى,مستوي كره القدم في الاردن زي مستوي,,[],0,pending,,
mt_msa_67c09821,train,9232,MSA,* اجواء المباره : - نار لهب حريقه بركان زلزال وخاصه في الشوط,اجواء المباره نار لهب حريقه بركان زلزال وخاصه في الشوط,,[],0,pending,,
mt_dial_egy_e4189029,train,33158,DIAL_EGY,الناس اللى بتضحك النهاردة بكرة,الناس اللي بتضحك النهارده بكره,,[],0,pending,,
mt_dial_glf_237d65c3,train,23277,DIAL_GLF,والله غزلان رايحه وطي شوفوا عيونها,والله غزلان رايحه وطي شوفوا عيونها,,[],0,pending,,
mt_dial_lev_82ac2d16,train,24988,DIAL_LEV,مين كان يتوقع انه هذا الثمر البسيط اله الفوائد الكبيره هاي اذا لازم نكثر من شرب عصير التمر هندي البيتي مش المصنع عند اصحاب المحلات لانه بيوضعوا فيه مواد تقوي,مين كان يتوقع انه هذا الثمر البسيط اله الفوايد الكبيره هاي اذا لازم نكثر من شرب عصير التمر هندي البيتي مش المصنع عند اصحاب المحلات لانه بيوضعوا فيه مواد تقوي,,[],0,pending,,
mt_msa_30edc65f,train,81499,MSA,ولكن نتأمل في ابن همام كل خير فهو رجل قيادي وقوي,ولكن نتامل في ابن همام كل خير فهو رجل قيادي وقوي,,[],0,pending,,
mt_dial_egy_3ba4df3b,train,21618,DIAL_EGY,أنا واللهى لا بحب شوبير ولا مرتضى بس كل الى عايز أقوله شكلك بقى وحش أوى,انا واللهي لا بحب شوبير ولا مرتضي بس كل الي عايز اقوله شكلك بقي وحش اوي,,[],0,pending,,
mt_dial_glf_34255e9e,train,16153,DIAL_GLF,اتمنى انك تهتموا بالشباب العاطلين وتتركوا توظيف البنات سنتين عشان الشباب وراهم مسؤلييات البنات ماورهم الا الاسواق,اتمني انك تهتموا بالشباب العاطلين وتتركوا توظيف البنات سنتين عشان الشباب وراهم مسولييات البنات ماورهم الا الاسواق,,[],0,pending,,
mt_dial_lev_25029cb1,train,82523,DIAL_LEV,اهم شي ان المانيا خارج,اهم شي ان المانيا خارج,,[],0,pending,,
mt_msa_9bcb7ef9,train,58824,MSA,يجب الغاء اتفاقية وادي عربه اولا ودعوا الشعب ان يقرر اذا ادعيتم الديمقراطيه و عودة التجنيدالاجباري ثانيالتهذيب الاجبال المايعه الا ترون تفشي الجرائم والاقتتال,يجب الغاء اتفاقيه وادي عربه اولا ودعوا الشعب ان يقرر اذا ادعيتم الديمقراطيه و عوده التجنيدالاجباري ثانيالتهذيب الاجبال المايعه الا ترون تفشي الجرايم والاقتتال,,[],0,pending,,
mt_dial_egy_a77728dd,train,24263,DIAL_EGY,بصرحه انتو مسبتوليش حاجه اقولها عين العقل حماقي حببنا وحيفضل كده على,بصرحه انتو مسبتوليش حاجه اقولها عين العقل حماقي حببنا وحيفضل كده علي,,[],0,pending,,
mt_dial_glf_37e72857,train,27882,DIAL_GLF,اي رعب ياعمي هذا وهو فايز عليكم بالخمسه مانقول الاحسبي الله على لجنة,اي رعب ياعمي هذا وهو فايز عليكم بالخمسه مانقول الاحسبي الله علي لجنه,,[],0,pending,,
mt_dial_lev_6396779e,train,36855,DIAL_LEV,لماذا يا سيف ال خطاب هذا التحامل الكبير على المارد الاخضر بتفكر الموضوع سهل عندك بس والله ( زدتها ) اهتم بامور الاداره عندكم التي لم تظهر الا يوم التتويج اهتم بامور حاتم عقل اللي مولعه معاه اهتم بامور ضياع الالقاب والامجاد منذ ( 5 ) سنوات وانتم محرمون من,لماذا يا سيف ال خطاب هذا التحامل الكبير علي المارد الاخضر بتفكر الموضوع سهل عندك بس والله زدتها اهتم بامور الاداره عندكم التي لم تظهر الا يوم التتويج اهتم بامور حاتم عقل اللي مولعه معاه اهتم بامور ضياع الالقاب والامجاد منذ 5 سنوات وانتم محرمون من,,[],0,pending,,
mt_msa_a46c49c2,train,77165,MSA,القاسم هو اجادة التصفيق والنفاق,القاسم هو اجاده التصفيق والنفاق,,[],0,pending,,
mt_dial_egy_bf2bc825,train,29422,DIAL_EGY,"أصحوا بقى وكلمونا على الإيجابيات وإزاى نقدر نطور من نفسنا وإزاى ننهض ,",اصحوا بقي وكلمونا علي الايجابيات وازاي نقدر نطور من نفسنا وازاي ننهض,,[],0,pending,,
mt_dial_glf_663a1551,train,20118,DIAL_GLF,واثر البيض عندهم بعد خابر ورعانا يتخاذفون بالبيض,واثر البيض عندهم بعد خابر ورعانا يتخاذفون بالبيض,,[],0,pending,,
mt_dial_lev_3aead030,train,68165,DIAL_LEV,لما يكون المديونية 12 مليار يعني كل مواطن مديون الفين دينار وكل طفل هلا ينولد نفس شي مديون بالفين دينار,لما يكون المديونيه 12 مليار يعني كل مواطن مديون الفين دينار وكل طفل هلا ينولد نفس شي مديون بالفين دينار,,[],0,pending,,
mt_msa_e23f7678,train,71824,MSA,""" ولا تحسبن الله غافلا عما يعمل الظالمون انما يؤخرهم ليوم تشخص فيه الابصار مهطعين مقنعي رؤؤسهم لا يرتد اليهم طرفهم وافئدتهم هواء",ولا تحسبن الله غافلا عما يعمل الظالمون انما يوخرهم ليوم تشخص فيه الابصار مهطعين مقنعي رووسهم لا يرتد اليهم طرفهم وافيدتهم هواء,,[],0,pending,,
