example_id,source_split,source_row_id,dialect,original_text,normalized_text,masked_text,mask_spans_json,mask_count,annotation_status,annotator_model,notes
mt_dial_egy_f80038c7,train,67093,DIAL_EGY,الناس اللى مسميين نفسهم اسامى مسيحيين و بيقولوا انهم معجبين بالاخوان المسلمين و مبسوطين انهم منضمين للبرادعى و انهم بيشجعوا فريق البرادعى . . . دول مش مسيحيين و مش مسموح يقولوا انهم مسيحيين عشان يوقعوا ما بيننا و ما بين الرئيس مبارك . . . و لو افترضنا جدلا انه مسيحى فعلا . . . يبقى يقول على نفسه بس انه هو بيشجع البرادعى . . . انا و كل اللى اعرفهم من المسيحيين مش داخل البرادعى ده فى دماغنا بصلة . . . و لا الحركات اللى بيعملها خايلة علينا . .,الناس اللي مسميين نفسهم اسامي مسيحيين و بيقولوا انهم معجبين بالاخوان المسلمين و مبسوطين انهم منضمين للبرادعي و انهم بيشجعوا فريق البرادعي دول مش مسيحيين و مش مسموح يقولوا انهم مسيحيين عشان يوقعوا ما بيننا و ما بين الرييس مبارك و لو افترضنا جدلا انه مسيحي فعلا يبقي يقول علي نفسه بس انه هو بيشجع البرادعي انا و كل اللي اعرفهم من المسيحيين مش داخل البرادعي ده في دماغنا بصله و لا الحركات اللي بيعملها خايله علينا,,[],0,pending,,
mt_dial_glf_9288d9bf,train,30766,DIAL_GLF,ذلا وازيدكم من الشعر بيت الرساله قيمتها 3 ريال والله حراميه ** قال ايه قال ساهر اي ساهر قل نظام حراميه عشاناحدث معلوماتي ارسل رساله وادفع قيمه الرساله 3 ريال حراميه ويقولون انتما للوطن والله الواحد صار يكره شي اسمه وطن لانه كل شي فيه بفلوس,ذلا وازيدكم من الشعر بيت الرساله قيمتها 3 ريال والله حراميه قال ايه قال ساهر اي ساهر قل نظام حراميه عشاناحدث معلوماتي ارسل رساله وادفع قيمه الرساله 3 ريال حراميه ويقولون انتما للوطن والله الواحد صار يكره شي اسمه وطن لانه كل شي فيه بفلوس,,[],0,pending,,
mt_dial_lev_0ada7403,train,12139,DIAL_LEV,يا ريت مرتي تسمع منك وترد على ها الحكي . . . صدقيني انها قوية وما حد بقدرلها . . وانا بصراحة خايف من الفظيحة . . . بس ربنا على,يا ريت مرتي تسمع منك وترد علي ها الحكي صدقيني انها قويه وما حد بقدرلها وانا بصراحه خايف من الفظيحه بس ربنا علي,,[],0,pending,,
mt_msa_10f65a39,train,8216,MSA,الله يرحمه ويرحم ابي وموت المسلمين أجمعين ويرحمنا اذا صارنا الى ماصاروا اليه ويبدله دار خير من داره واهل خير من اهله انا الى الله وانا اليه,الله يرحمه ويرحم ابي وموت المسلمين اجمعين ويرحمنا اذا صارنا الي ماصاروا اليه ويبدله دار خير من داره واهل خير من اهله انا الي الله وانا اليه,,[],0,pending,,
mt_dial_egy_72705863,train,53411,DIAL_EGY,هذا انسان مهبول ياكل كاشييات . . .,هذا انسان مهبول ياكل كاشييات,,[],0,pending,,
mt_dial_glf_3bd2c8d2,train,17260,DIAL_GLF,ولا دخل عليهم سكران او مواصل ترا تعبت من الحواذث,ولا دخل عليهم سكران او مواصل ترا تعبت من الحواذث,,[],0,pending,,
mt_dial_lev_be62cdd7,train,61095,DIAL_LEV,طيب يا اخوان هذا كلام رئيس المستثمرين في المنطقة الحرة ؟ ؟ ؟ شو كلام الجمارك ؟ ؟ شو موقفها من هالكلام لانه كله كلام في كلام وبصراحة شبعنا كلام بدنا فعل بدنا حل لمشكلة السيارات الشمس حرقتنا في الحرة كل يوم وعلى,طيب يا اخوان هذا كلام رييس المستثمرين في المنطقه الحره شو كلام الجمارك شو موقفها من هالكلام لانه كله كلام في كلام وبصراحه شبعنا كلام بدنا فعل بدنا حل لمشكله السيارات الشمس حرقتنا في الحره كل يوم وعلي,,[],0,pending,,
mt_msa_46b673eb,train,84070,MSA,ونتطلع نحن أبناء المحافظة إلى مزيد من هذا التعاون البناء,ونتطلع نحن ابناء المحافظه الي مزيد من هذا التعاون البناء,,[],0,pending,,
mt_dial_egy_60cdefe4,train,6581,DIAL_EGY,بس الموضوع ده هيفيده لو رفيع لانه هيتخن بعد ماينزل ( هيتنفخ,بس الموضوع ده هيفيده لو رفيع لانه هيتخن بعد ماينزل هيتنفخ,,[],0,pending,,
mt_dial_glf_9eb462a7,train,45964,DIAL_GLF,شكلة فرح بالمنصب و راح بسبات عميق,شكله فرح بالمنصب و راح بسبات عميق,,[],0,pending,,
mt_dial_lev_3a771ad6,train,67453,DIAL_LEV,ارواحنا فداك وحكمتك كلماتك تدل على قربك منا وحبك النا واحنا بنبادلك هذي المحبة والروح رخيصة,ارواحنا فداك وحكمتك كلماتك تدل علي قربك منا وحبك النا واحنا بنبادلك هذي المحبه والروح رخيصه,,[],0,pending,,
mt_msa_4f1c6860,train,17837,MSA,"كم كنت اكره المصريون إلا انه وبعد هذه المواقف أدركت مدى غباء وتخلف الأمة الإسلامية وكيف أصبح الأعداء يتلاعبون بنا إنا لا اقبل أن يهان لاعب عربي و مسلم , نشتم بعضنا البعض ما في مشكل . .",كم كنت اكره المصريون الا انه وبعد هذه المواقف ادركت مدي غباء وتخلف الامه الاسلاميه وكيف اصبح الاعداء يتلاعبون بنا انا لا اقبل ان يهان لاعب عربي و مسلم نشتم بعضنا البعض ما في مشكل,,[],0,pending,,
mt_dial_egy_cc2072cc,train,7341,DIAL_EGY,انا عايز اتكلم بس خايف من قانون,انا عايز اتكلم بس خايف من قانون,,[],0,pending,,
mt_dial_glf_b515c350,train,52506,DIAL_GLF,المشكله يامرزوقي اذا مافي احد حضر من جمهورك واذا حضرو من جمهور الليث قالو جمهور الاتي ولاالهلال ونسبو كل اللي يحضرون لفرقهم وان الليث ماله جمهور مثل مباراة العين لمن الباصات من كل المناطق تحركت لعيون الليث ونسبوها لهم اتمنى ماحد يحضر منهم ابرك واتمنى باصات المناطق تتحرك ولايحضر الاجمهورنا,المشكله يامرزوقي اذا مافي احد حضر من جمهورك واذا حضرو من جمهور الليث قالو جمهور الاتي ولاالهلال ونسبو كل اللي يحضرون لفرقهم وان الليث ماله جمهور مثل مباراه العين لمن الباصات من كل المناطق تحركت لعيون الليث ونسبوها لهم اتمني ماحد يحضر منهم ابرك واتمني باصات المناطق تتحرك ولايحضر الاجمهورنا,,[],0,pending,,
mt_dial_lev_e40a8f4b,train,51016,DIAL_LEV,هوو مزبوط يعني الرجال عليه حئ لازم يروح ويشتغل بس ما لازم تكون هيك ردّة الفعل . . مسكين دبحتو . .,هوو مزبوط يعني الرجال عليه حي لازم يروح ويشتغل بس ما لازم تكون هيك رده الفعل مسكين دبحتو,,[],0,pending,,
mt_msa_94480c49,train,74266,MSA,من زمن ماضي إلى هذا الزمان,من زمن ماضي الي هذا الزمان,,[],0,pending,,
mt_dial_egy_e030bb0d,train,23799,DIAL_EGY,ولوكان الموضوع سبوبه او تجاره مربحه لرضيت حماس ووقعت واصبحت هي صاحبة الكلمه لكن قادة حماس يدفعون ثمن صمودهم بأرواحهم وقائمة الشهداء من قادة حماس لاتنتهي ومن لايعرفهم يستطيع ان يبحث بالانترنت ليرى بعينه كم من قادة حماس استشهدوا ولم يتنازلوا .,ولوكان الموضوع سبوبه او تجاره مربحه لرضيت حماس ووقعت واصبحت هي صاحبه الكلمه لكن قاده حماس يدفعون ثمن صمودهم بارواحهم وقايمه الشهداء من قاده حماس لاتنتهي ومن لايعرفهم يستطيع ان يبحث بالانترنت ليري بعينه كم من قاده حماس استشهدوا ولم يتنازلوا,,[],0,pending,,
mt_dial_glf_99ce237f,train,66299,DIAL_GLF,الحمدالله على كل حال احنا بصحه وعافيه وديننا الاسلام يحثنا على النظافه . . . وعليكم,الحمدالله علي كل حال احنا بصحه وعافيه وديننا الاسلام يحثنا علي النظافه وعليكم,,[],0,pending,,
mt_dial_lev_2a077428,train,65222,DIAL_LEV,موضوع مسلي بالنسبه الي انا لسا ما تزوجت و بعدني بدرس وان شاء الله ما اواجه هالمشاكل . . . عجبني تعليق الاخ مصطفى هي و امها و ستها الله يكون معك منيح الي خلصت,موضوع مسلي بالنسبه الي انا لسا ما تزوجت و بعدني بدرس وان شاء الله ما اواجه هالمشاكل عجبني تعليق الاخ مصطفي هي و امها و ستها الله يكون معك منيح الي خلصت,,[],0,pending,,
mt_msa_45c9ef97,train,54064,MSA,باع الكليه او انه ما باع وبكم ؟ ؟ هذا شئ ليس من شأننا,باع الكليه او انه ما باع وبكم هذا شي ليس من شاننا,,[],0,pending,,
mt_dial_egy_3459f0ed,train,75068,DIAL_EGY,حتى ( هنلبس ايه ! ! ) وللاسف اغلب الناس ما بتهتم بالطقس وبعدين نلاقى ادوار,حتي هنلبس ايه وللاسف اغلب الناس ما بتهتم بالطقس وبعدين نلاقي ادوار,,[],0,pending,,
mt_dial_glf_73679a8c,train,37424,DIAL_GLF,ارتقو بفكركم يا جماعه ، والي يبي الفساد يلقاه مارح يستناكم,ارتقو بفكركم يا جماعه والي يبي الفساد يلقاه مارح يستناكم,,[],0,pending,,
mt_dial_lev_2e0604e7,train,55035,DIAL_LEV,يا اخي الشعب مضغوط خليه,يا اخي الشعب مضغوط خليه,,[],0,pending,,
mt_msa_c8a697c8,train,53896,MSA,ا طلعتى على نية الشيخ,ا طلعتي علي نيه الشيخ,,[],0,pending,,
