example_id,source_split,source_row_id,dialect,original_text,normalized_text,masked_text,mask_spans_json,mask_count,annotation_status,annotator_model,notes
mt_dial_lev_8a3c06d1,train,34008,DIAL_LEV,بعدين شو هو الي هامش تحوط ؟ ؟,بعدين شو هو الي هامش تحوط,,[],0,pending,,
mt_msa_c0588755,train,34350,MSA,الأفلام الهنديّه لعبت بعقول الناس . .,الافلام الهنديه لعبت بعقول الناس,,[],0,pending,,
mt_dial_egy_b9084f99,train,29693,DIAL_EGY,الاهلى هيكسب 2 \ 0 على,الاهلي هيكسب 2 0 علي,,[],0,pending,,
mt_dial_glf_30b06462,train,36182,DIAL_GLF,انتم تحسبونه سنة ولا جائزة . . ؟,انتم تحسبونه سنه ولا جايزه,,[],0,pending,,
mt_dial_lev_cc43f5b5,train,544,DIAL_LEV,رافت علي بخبرتو وبوزنو ومهارتو فريق الوحدات ما حطلو راتب ولا عقد مثل,رافت علي بخبرتو وبوزنو ومهارتو فريق الوحدات ما حطلو راتب ولا عقد مثل,,[],0,pending,,
mt_msa_97d89615,train,46804,MSA,كيف استطاع الراوي رؤية خديها ووصفه هذا الوصف الدقيق الذي يستدعي وضعه في سياق الرواية ؟ .,كيف استطاع الراوي رويه خديها ووصفه هذا الوصف الدقيق الذي يستدعي وضعه في سياق الروايه,,[],0,pending,,
mt_dial_egy_6089a5f1,train,81033,DIAL_EGY,برافو دكتور بدر ياريت يحدث ذلك دائما وطوال العام الدراسى ولكن لى تحفظ على ذلك عدم المساس بكرامة المقصر او اصدار اى تعليق غير لائق فذلك يؤثر تاثير سلبى على نفسية التلميذوايضا لايصلح المقصر والمطلوب العقاب فقط ولامانع لمكافأة المدرسة النظيفة الملتزمة,برافو دكتور بدر ياريت يحدث ذلك دايما وطوال العام الدراسي ولكن لي تحفظ علي ذلك عدم المساس بكرامه المقصر او اصدار اي تعليق غير لايق فذلك يوثر تاثير سلبي علي نفسيه التلميذوايضا لايصلح المقصر والمطلوب العقاب فقط ولامانع لمكافاه المدرسه النظيفه الملتزمه,,[],0,pending,,
mt_dial_glf_142f619d,train,75293,DIAL_GLF,وبعدين وش هالتوقيت الغبي للمدير يوم,وبعدين وش هالتوقيت الغبي للمدير يوم,,[],0,pending,,
mt_dial_lev_785feb36,train,76405,DIAL_LEV,حسبي الله ونعم الوكيل كل واحد بيجيه يومه وكما تدين,حسبي الله ونعم الوكيل كل واحد بيجيه يومه وكما تدين,,[],0,pending,,
mt_msa_dddf5198,train,39974,MSA,100 الف اقل من 10,100 الف اقل من 10,,[],0,pending,,
mt_dial_egy_c579853b,train,14760,DIAL_EGY,اللهم لاشماتة فلا شماتة فى المرض بس ربنا كبير,اللهم لاشماته فلا شماته في المرض بس ربنا كبير,,[],0,pending,,
mt_dial_glf_5bc6565b,train,72230,DIAL_GLF,نقدر حماسك لفريقك في الملعب اما الجريده فهي مكان لجميع القراء بمختلف ميولهم و ارائهم وخل عنك التقييم للجنة الانضباط اكيد هم افضل منك خبره,نقدر حماسك لفريقك في الملعب اما الجريده فهي مكان لجميع القراء بمختلف ميولهم و ارايهم وخل عنك التقييم للجنه الانضباط اكيد هم افضل منك خبره,,[],0,pending,,
mt_dial_lev_516d7144,train,38546,DIAL_LEV,ان شالله الله الفيصلي زعيم برا وجوا,ان شالله الله الفيصلي زعيم برا وجوا,,[],0,pending,,
mt_msa_9b277cd2,train,37295,MSA,لكن الخوف الأعظم عندما يتعب الشاب ويرى أن ثمرة جهده تذهب أدراج الرياح ويضم لقافلة العاطلين بسبب المحسوبية المستشريه في مجتمعنا مع الأسف الشديد,لكن الخوف الاعظم عندما يتعب الشاب ويري ان ثمره جهده تذهب ادراج الرياح ويضم لقافله العاطلين بسبب المحسوبيه المستشريه في مجتمعنا مع الاسف الشديد,,[],0,pending,,
mt_dial_egy_eba2a218,train,55918,DIAL_EGY,إنتوا عارفين العيل لما ياخد الموبايل من أبوه و يقوله أنا هقدر أشغله وبعدك يزهق من,انتوا عارفين العيل لما ياخد الموبايل من ابوه و يقوله انا هقدر اشغله وبعدك يزهق من,,[],0,pending,,
mt_dial_glf_48193d16,train,76609,DIAL_GLF,باذن الله المباراة وصلاوية مستوى,باذن الله المباراه وصلاويه مستوي,,[],0,pending,,
mt_dial_lev_947467b0,train,86540,DIAL_LEV,عامر ذيب : شد حيلك يا عامر هناك بعض التراجع في مستواك و حركتك اصبحت ثقيلة نريدك ذيبا مفترسا,عامر ذيب شد حيلك يا عامر هناك بعض التراجع في مستواك و حركتك اصبحت ثقيله نريدك ذيبا مفترسا,,[],0,pending,,
mt_msa_b2696244,train,57453,MSA,وثالثاً : كثيراً ما أحس بالبعوضة بمجرد ما تبدأ الوخر أو بعد أن تنتصف فأين مخدرها القوي ؟,وثالثا كثيرا ما احس بالبعوضه بمجرد ما تبدا الوخر او بعد ان تنتصف فاين مخدرها القوي,,[],0,pending,,
mt_dial_egy_3f3b088b,train,26346,DIAL_EGY,جماهير الاسماعيلي الي عايزة حسني يعلب في الاسماعيلي تاني مش عارفة ان عقد حسني 5 مليون في السنة طب يجبوهم منين ولا حسني يعلب في الفريق لوحده وبلاش باقي الاعبين الاسماعيلي من الاخر كدة فريق فقران علي الاخر وبيشحت ولو انا منهم يقفلوا النادي دة ويفتحوا مكانه سوبر ماركت يكسب اكتر ولا بوتيك ملابس وهي المحتاجة تعمل اي,جماهير الاسماعيلي الي عايزه حسني يعلب في الاسماعيلي تاني مش عارفه ان عقد حسني 5 مليون في السنه طب يجبوهم منين ولا حسني يعلب في الفريق لوحده وبلاش باقي الاعبين الاسماعيلي من الاخر كده فريق فقران علي الاخر وبيشحت ولو انا منهم يقفلوا النادي ده ويفتحوا مكانه سوبر ماركت يكسب اكتر ولا بوتيك ملابس وهي المحتاجه تعمل اي,,[],0,pending,,
mt_dial_glf_27d96079,train,62825,DIAL_GLF,هذي فرصة اي لاعب من لاعبين النصر انه يطلب مستحقاته قدام مبارتهم مع الزعيم ومتأكد ان اغلب اللعيبه يدعون للزعيم الي يخلي ادارتهم تدفع غصب عنها صدق من سماكم نادي,هذي فرصه اي لاعب من لاعبين النصر انه يطلب مستحقاته قدام مبارتهم مع الزعيم ومتاكد ان اغلب اللعيبه يدعون للزعيم الي يخلي ادارتهم تدفع غصب عنها صدق من سماكم نادي,,[],0,pending,,
mt_dial_lev_7af497d8,train,44006,DIAL_LEV,لأنه اللي هيك لازم الناس تعرفه وتحطه عالبلاك,لانه اللي هيك لازم الناس تعرفه وتحطه عالبلاك,,[],0,pending,,
mt_msa_cfe846d3,train,4442,MSA,اقسم بالله العلي العظيم الة الكل ورب الكل ان جنازة والدي ووالدتي حضرها من اخواننا المسلمون اكثر من,اقسم بالله العلي العظيم اله الكل ورب الكل ان جنازه والدي ووالدتي حضرها من اخواننا المسلمون اكثر من,,[],0,pending,,
mt_dial_egy_c5359b90,train,58417,DIAL_EGY,على ايه ده كله هو ايه اللي كان حصل ؟ ؟ ؟ حرام عليكم تظلمو حماقي بالشكل ده هو واحد متفق مع الجامعه على ميعاد حفله وعملها وخلاص ماله هو بالاضراب ؟ ؟ ! ! ! وبعدين اللي عايز يعمل اضراب يروح هو يعني حفلة حماقي هي اللي هتمنعه ماتحملوش حماقي زنب حاجه هو ماعملهاش ولا ليه دعوه بيها من الاساس مالكم بتهاجهموه كده ؟ ؟ ! ! ! ولا يهمك ياحماقي من حد خليك في طريق الغنا دول ناس متغاظه منك ومن نجاحك والهجوم ده اكبر دليل على نجاح الحفله ونجاحك . . . ان شا ءالله ربنا هينصرك عليهم لاننا عارفين قد ايه انت انسان محترم وبتحب بلدك اوي ولايمكن تعمل حاجه تضرها . . . ربنا يوفقك ويسعدك ويكفيك شر الناس احنا كلنا بندعيلك من كل,علي ايه ده كله هو ايه اللي كان حصل حرام عليكم تظلمو حماقي بالشكل ده هو واحد متفق مع الجامعه علي ميعاد حفله وعملها وخلاص ماله هو بالاضراب وبعدين اللي عايز يعمل اضراب يروح هو يعني حفله حماقي هي اللي هتمنعه ماتحملوش حماقي زنب حاجه هو ماعملهاش ولا ليه دعوه بيها من الاساس مالكم بتهاجهموه كده ولا يهمك ياحماقي من حد خليك في طريق الغنا دول ناس متغاظه منك ومن نجاحك والهجوم ده اكبر دليل علي نجاح الحفله ونجاحك ان شا ءالله ربنا هينصرك عليهم لاننا عارفين قد ايه انت انسان محترم وبتحب بلدك اوي ولايمكن تعمل حاجه تضرها ربنا يوفقك ويسعدك ويكفيك شر الناس احنا كلنا بندعيلك من كل,,[],0,pending,,
mt_dial_glf_65f9b99c,train,59060,DIAL_GLF,لانها نفس الحاله صارت معاي بس انا كنت,لانها نفس الحاله صارت معاي بس انا كنت,,[],0,pending,,
mt_dial_lev_3737eeaa,train,63989,DIAL_LEV,"أطالب معاليكم بخصم 20 % من راتب كل وزير دعم للإ قتصاد الوطني , وإلغا علاواة السفر التي تشابه كذبة نيسان بالقيمة ولهيب اب في الواقع , وليش الحكومة ما تقلل عداد والوزرة down sizing يعني في الف قصصة وقصصة عشان تدعموا الإقتصاد مش على حساب وطهر العبد الفقير لله , وبلاش لعب على الكلام بدكم تحسنو وضع الطبقة الفقيرة والآمتوسطة , اي شليتوا أمل , وبعدين بدي انوه لمعاليكم انه المجتمع الأردني قائم على الطبقة المتوسطة والغنية ولا يوجد ما يعى بالطبقة الفقيرة . . . اي قبال ما تتفلسفوا على المساكين أعرقوا شو بتعملوأ . . . أشكي همي وحزني الى الله عسى أن يستجيب لي . .",اطالب معاليكم بخصم 20 من راتب كل وزير دعم للا قتصاد الوطني والغا علاواه السفر التي تشابه كذبه نيسان بالقيمه ولهيب اب في الواقع وليش الحكومه ما تقلل عداد والوزره down sizing يعني في الف قصصه وقصصه عشان تدعموا الاقتصاد مش علي حساب وطهر العبد الفقير لله وبلاش لعب علي الكلام بدكم تحسنو وضع الطبقه الفقيره والامتوسطه اي شليتوا امل وبعدين بدي انوه لمعاليكم انه المجتمع الاردني قايم علي الطبقه المتوسطه والغنيه ولا يوجد ما يعي بالطبقه الفقيره اي قبال ما تتفلسفوا علي المساكين اعرقوا شو بتعملوا اشكي همي وحزني الي الله عسي ان يستجيب لي,,[],0,pending,,
mt_msa_b13962e6,train,60557,MSA,نعم ، كل شعوب العالم على خطأ ، أما الصح فنحن . والدليل ، أننا استطعنا أن نخترع نظام,نعم كل شعوب العالم علي خطا اما الصح فنحن والدليل اننا استطعنا ان نخترع نظام,,[],0,pending,,
mt_dial_egy_d59512ef,train,55427,DIAL_EGY,لية كلكم مصرين على عدم فتح هذا الموضوع لية الخوف يملىء قلوبكم هوة دة مش خير يخص الشعب المصرى حتى رئيس الجمهورية التزم الصمت ولم يرد وعمر اديب كلكم حتى مصطفى بكرى مفجر قضية القمح الفاسد حتى احمد عبد الهادى فى شباب مصر هرب من السؤال ولم يرد زراعة الحبوب بالماء المالح لاتستحق تحقيق صحفى ازالة الغام الصحراء الغربية خلال ايام لاتخص شعب مصر ادخلوا على النت تعليق مصرى بيحب مصر عن الالغام وعن القمح الفاسد وعن زراعة الحبوب بالماء المالح=وبعدين رفضت نشر تعليقى فى مقال مرفت التلاوى لية هى دى حرية,ليه كلكم مصرين علي عدم فتح هذا الموضوع ليه الخوف يمليء قلوبكم هوه ده مش خير يخص الشعب المصري حتي رييس الجمهوريه التزم الصمت ولم يرد وعمر اديب كلكم حتي مصطفي بكري مفجر قضيه القمح الفاسد حتي احمد عبد الهادي في شباب مصر هرب من السوال ولم يرد زراعه الحبوب بالماء المالح لاتستحق تحقيق صحفي ازاله الغام الصحراء الغربيه خلال ايام لاتخص شعب مصر ادخلوا علي النت تعليق مصري بيحب مصر عن الالغام وعن القمح الفاسد وعن زراعه الحبوب بالماء المالح وبعدين رفضت نشر تعليقي في مقال مرفت التلاوي ليه هي دي حريه,,[],0,pending,,
mt_dial_glf_93c55a10,train,10394,DIAL_GLF,ايام السلوم الموظف يترقا ماياخذ علوه تشجيعيه الموظف لم يتطور بالذات,ايام السلوم الموظف يترقا ماياخذ علوه تشجيعيه الموظف لم يتطور بالذات,,[],0,pending,,
mt_dial_lev_1bb53d03,train,57197,DIAL_LEV,ما بتصدق تيجي الاجازه من اجل النزول الى العاصمة عمان لكن بعد دخول الحدود ودفع المخلفات المترتبه على السيارات وبعد عدة ايام من الاجازه والمصاريف من بنزين او استئجار شقه الخ . . . ما بتصدق ترجع على البلد اللي بتشتغل,ما بتصدق تيجي الاجازه من اجل النزول الي العاصمه عمان لكن بعد دخول الحدود ودفع المخلفات المترتبه علي السيارات وبعد عده ايام من الاجازه والمصاريف من بنزين او استيجار شقه الخ ما بتصدق ترجع علي البلد اللي بتشتغل,,[],0,pending,,
mt_msa_728995b3,train,67106,MSA,والله مصيبة لو كان كلامك,والله مصيبه لو كان كلامك,,[],0,pending,,
mt_dial_egy_c6c50e62,train,86380,DIAL_EGY,طب ما انا كمان والناشطين رافضين تدخل,طب ما انا كمان والناشطين رافضين تدخل,,[],0,pending,,
mt_dial_glf_952b458a,train,46914,DIAL_GLF,حتى فوزه على مس كرمان في الرياض كان,حتي فوزه علي مس كرمان في الرياض كان,,[],0,pending,,
mt_dial_lev_89427569,train,78123,DIAL_LEV,مبروك للرمثا فريق مكافح وشاب بس بحب اقول انه جميع الاندية الاردنية بكل درجاتها من المحترفين للاولى للثانية وحتى العاشرة مجتمعة بدهم 150 سنة حتى ينجزوا ربع اللي انجزه الفيصلي وخسارة مباراة مش نهاية المطاف ونتمنى على ادراتنا تعيد النظر بالمدرب وضخ دماء جديدة بالفريق لانه بصراحة في بعض اللاعبين عبء عالنادي وجمهوره وتحية كبيرة للحناحنه وزعتره والشيخ خصوصا ويا زعيم بتظلك,مبروك للرمثا فريق مكافح وشاب بس بحب اقول انه جميع الانديه الاردنيه بكل درجاتها من المحترفين للاولي للثانيه وحتي العاشره مجتمعه بدهم 150 سنه حتي ينجزوا ربع اللي انجزه الفيصلي وخساره مباراه مش نهايه المطاف ونتمني علي ادراتنا تعيد النظر بالمدرب وضخ دماء جديده بالفريق لانه بصراحه في بعض اللاعبين عبء عالنادي وجمهوره وتحيه كبيره للحناحنه وزعتره والشيخ خصوصا ويا زعيم بتظلك,,[],0,pending,,
mt_msa_08197a1f,train,1711,MSA,وأقرأ إذا كذبتني . . . أخر سوره,واقرا اذا كذبتني اخر سوره,,[],0,pending,,
mt_dial_egy_8adafd65,train,35801,DIAL_EGY,سبحان من ليه الدوام يا اسد يا ابو,سبحان من ليه الدوام يا اسد يا ابو,,[],0,pending,,
mt_dial_glf_bd53f40b,train,23588,DIAL_GLF,انا مايقهرني الى المثاليه المزيفه في الهلال يتهجمون بشده وينتقدون بشده ويغضون الطرف عن مشاكل لاعبينهم واذا احد تكلم وهاجم بدو يتكلمون عن مثاليات شبيه الريح وانا استشهد بتصريح شبيه الريح امس قال جماهيرنا تفرح بلبطولات وهم بلا بيانات خوش,انا مايقهرني الي المثاليه المزيفه في الهلال يتهجمون بشده وينتقدون بشده ويغضون الطرف عن مشاكل لاعبينهم واذا احد تكلم وهاجم بدو يتكلمون عن مثاليات شبيه الريح وانا استشهد بتصريح شبيه الريح امس قال جماهيرنا تفرح بلبطولات وهم بلا بيانات خوش,,[],0,pending,,
mt_dial_lev_7064e910,train,7841,DIAL_LEV,الف مبروك العندليب وكمان لباسم العب الخلوق وشو صارمن شان رافت الرجاء من يعرف عن الخبر وكمان,الف مبروك العندليب وكمان لباسم العب الخلوق وشو صارمن شان رافت الرجاء من يعرف عن الخبر وكمان,,[],0,pending,,
mt_msa_af1f8901,train,33632,MSA,يومها ساشهد الله على كل من سبها ليقتص منه على مراى ومسمع,يومها ساشهد الله علي كل من سبها ليقتص منه علي مراي ومسمع,,[],0,pending,,
mt_dial_egy_7ce9726d,train,11164,DIAL_EGY,مين الاخ الفاشل احمد حلمى اللى من الممكن انه يفكر يمثل مع كاميرون دياز ومش يمثل ده اخره يشفها ف السينما زى باقى الناس وميحلمش باكتر من كدة وياريت يبطل يستظرف ف الافلام,مين الاخ الفاشل احمد حلمي اللي من الممكن انه يفكر يمثل مع كاميرون دياز ومش يمثل ده اخره يشفها ف السينما زي باقي الناس وميحلمش باكتر من كده وياريت يبطل يستظرف ف الافلام,,[],0,pending,,
mt_dial_glf_5f4ccc67,train,46445,DIAL_GLF,لو تجي بنت متسترة عاقله في حالها محد بيناظرها ولا جاي,لو تجي بنت متستره عاقله في حالها محد بيناظرها ولا جاي,,[],0,pending,,
mt_dial_lev_c9f478dd,train,36439,DIAL_LEV,( صحيفه امارتيه ) الوحدات مولعها وسمور وبقناته,صحيفه امارتيه الوحدات مولعها وسمور وبقناته,,[],0,pending,,
mt_msa_0e8ae454,train,29380,MSA,"*برشلونه لم يجعل خطةالتسديد من خارج خط الثمانيات بشكل مستمر , خاصه من بداية المباراة , ايضا إبراهيموفيتش من شدة الغرور يلعب وهو متعالي على الكرة , واصبح ( ثقيل دم )",برشلونه لم يجعل خطهالتسديد من خارج خط الثمانيات بشكل مستمر خاصه من بدايه المباراه ايضا ابراهيموفيتش من شده الغرور يلعب وهو متعالي علي الكره واصبح ثقيل دم,,[],0,pending,,
mt_dial_egy_0144a849,train,9254,DIAL_EGY,وتقابل ربك ويحاسبك . . . واللى عملته يبان على,وتقابل ربك ويحاسبك واللي عملته يبان علي,,[],0,pending,,
mt_dial_glf_cbc1ceaf,train,65457,DIAL_GLF,بالعكس لو سمعنا منهم تصريحات عاقلة بنقولهم سلامات عسى,بالعكس لو سمعنا منهم تصريحات عاقله بنقولهم سلامات عسي,,[],0,pending,,
mt_dial_lev_ca158314,train,15501,DIAL_LEV,او في amman texas city زي ما بدكم مهيه سايبه هون زي,او في amman texas city زي ما بدكم مهيه سايبه هون زي,,[],0,pending,,
mt_msa_daa5f187,train,10673,MSA,ما يطالب به أهالى طوسون هو مساعدتهم على الخروج من هذا الكابوس وهم على أتم إستعداد لشراء الاراضى مرة أخرى بالسعر الذى تحدده وزارة الزراعة ! فهل من معين,ما يطالب به اهالي طوسون هو مساعدتهم علي الخروج من هذا الكابوس وهم علي اتم استعداد لشراء الاراضي مره اخري بالسعر الذي تحدده وزاره الزراعه فهل من معين,,[],0,pending,,
mt_dial_egy_fe26d1d2,train,25829,DIAL_EGY,انت اللى وديت مصر فى داهيه لقد تواطأت مع النظام ضدنا واخيرا بتغير قانون الاجراءات الجائية علشان طلعت مصطفى الم يكفك القوانين سئة السمعه التى فصلتها ضد اراده لشعب اتق الله واللهم لاشماته انظر الى اخالك كمال الشاذلى الان,انت اللي وديت مصر في داهيه لقد تواطات مع النظام ضدنا واخيرا بتغير قانون الاجراءات الجاييه علشان طلعت مصطفي الم يكفك القوانين سيه السمعه التي فصلتها ضد اراده لشعب اتق الله واللهم لاشماته انظر الي اخالك كمال الشاذلي الان,,[],0,pending,,
mt_dial_glf_9ae3ad84,train,81260,DIAL_GLF,تقبل ولا ما تقبل القرار المهم انك سوف تتعلم تحترم نفسك قبل,تقبل ولا ما تقبل القرار المهم انك سوف تتعلم تحترم نفسك قبل,,[],0,pending,,
mt_dial_lev_1f196f02,train,51261,DIAL_LEV,أولاً الخبر خالي من الأخضر على غير العادة ، الغد عودتنا على كمشة أخبار وحداتية تفتح النفس عالصبح,اولا الخبر خالي من الاخضر علي غير العاده الغد عودتنا علي كمشه اخبار وحداتيه تفتح النفس عالصبح,,[],0,pending,,
mt_msa_2a26c719,train,35466,MSA,أكثر من رائع الاستاذ يسري فوده وقراره بلإستقاله قرار جريئ وصائب لأنه إستقال من قناه تسئ لمهنة الصحافه وأصبحت غير حياديه في عرض المواضيع ومناقشتها وأصبحت أداه تعمل على تفرق العرب بدلا من,اكثر من رايع الاستاذ يسري فوده وقراره بلاستقاله قرار جريي وصايب لانه استقال من قناه تسي لمهنه الصحافه واصبحت غير حياديه في عرض المواضيع ومناقشتها واصبحت اداه تعمل علي تفرق العرب بدلا من,,[],0,pending,,
