example_id,source_split,source_row_id,dialect,original_text,normalized_text,masked_text,mask_spans_json,mask_count,annotation_status,annotator_model,notes
mt_dial_egy_24c67eae,train,46544,DIAL_EGY,يا دكتور خلى بالك من القرشين اللى معاك اهى بدات بقناة تلفزيونيه مش قلتلك,يا دكتور خلي بالك من القرشين اللي معاك اهي بدات بقناه تلفزيونيه مش قلتلك,,[],0,pending,,
mt_dial_glf_fde0dda2,train,10414,DIAL_GLF,وش الله حادهم في احوال مدنية وفي دوائر حكومية وفي تقنيات ترصد العدد السكاني ومازلنا متنحين الى الان ! !,وش الله حادهم في احوال مدنيه وفي دواير حكوميه وفي تقنيات ترصد العدد السكاني ومازلنا متنحين الي الان,,[],0,pending,,
mt_dial_lev_8aff8014,train,74810,DIAL_LEV,ما توقعت يكون عندك روح,ما توقعت يكون عندك روح,,[],0,pending,,
mt_msa_56989f00,train,65363,MSA,"فتحى غريب ابو غريب ( ) يوم الإثنين , 2010 - 04 - 05 14 : 40",فتحي غريب ابو غريب يوم الاثنين 2010 04 05 14 40,,[],0,pending,,
mt_dial_egy_38b35a18,train,21652,DIAL_EGY,لن يحدث اى جديد والله الدنيا سوداء وبلاش احلام علشان حتتقلب الى كاب ! ! ! وس وممكن اللى تحسبه موسى يطلع فرعون,لن يحدث اي جديد والله الدنيا سوداء وبلاش احلام علشان حتتقلب الي كاب وس وممكن اللي تحسبه موسي يطلع فرعون,,[],0,pending,,
mt_dial_glf_27d107fb,train,19991,DIAL_GLF,ابوك يالدلال المحلي . . الوعد يوم الاحد يمسح بك العالمي ان شاء الله ويخليك مثل ما انت ازيرق محلي دلالي . .,ابوك يالدلال المحلي الوعد يوم الاحد يمسح بك العالمي ان شاء الله ويخليك مثل ما انت ازيرق محلي دلالي,,[],0,pending,,
mt_dial_lev_fadd1e9d,train,31090,DIAL_LEV,سلم سلامات فش احلى من,سلم سلامات فش احلي من,,[],0,pending,,
mt_msa_357e5ee2,train,62477,MSA,ما أقول الا لا حول ولا قوة الا بالله . .,ما اقول الا لا حول ولا قوه الا بالله,,[],0,pending,,
mt_dial_egy_1f044ce9,train,68881,DIAL_EGY,ليست الزيارات المفاجأة هى اللى هتصلح التعليم وكل من اشاد بهذا الاسلوب غبى واهبل,ليست الزيارات المفاجاه هي اللي هتصلح التعليم وكل من اشاد بهذا الاسلوب غبي واهبل,,[],0,pending,,
mt_dial_glf_37b21e21,train,17721,DIAL_GLF,ودي اشوف مناظر طبيعيه وخلابه مثل بلاد,ودي اشوف مناظر طبيعيه وخلابه مثل بلاد,,[],0,pending,,
mt_dial_lev_a1d7637c,train,20263,DIAL_LEV,الكل مولعه معاه كيف الوحدات سيحصل على كأس,الكل مولعه معاه كيف الوحدات سيحصل علي كاس,,[],0,pending,,
mt_msa_99065c6f,train,48905,MSA,نريد لعب خالي من التعصب,نريد لعب خالي من التعصب,,[],0,pending,,
mt_dial_egy_d9cb453d,train,2268,DIAL_EGY,أما عن الأتحاد السوفيتى البائد ، فهذا كان زمنا خاليا ، فقد تعملقت روسيا الآن ، وإن كانت قد استوعبت الدرس ، فلم تعد إلى ظهور مسرف ، وصدام مع القوى المناوئة ، بل هى الآن تحاول أن تهادن وتحتوى الغرب ، رغبة فى استمرار سيطرتها على أراضيها ، ومنعا من معارضة المعسكر الغربى لطموحاتها فى أراضى الشيشان وغيرها ، فالقاعدة هى ( شيللنى وأشيلك ) ولقد أنتهي زمن العنتريات والمبادىء . ربما على مستوى العالم أجمع,اما عن الاتحاد السوفيتي البايد فهذا كان زمنا خاليا فقد تعملقت روسيا الان وان كانت قد استوعبت الدرس فلم تعد الي ظهور مسرف وصدام مع القوي المناويه بل هي الان تحاول ان تهادن وتحتوي الغرب رغبه في استمرار سيطرتها علي اراضيها ومنعا من معارضه المعسكر الغربي لطموحاتها في اراضي الشيشان وغيرها فالقاعده هي شيللني واشيلك ولقد انتهي زمن العنتريات والمباديء ربما علي مستوي العالم اجمع,,[],0,pending,,
mt_dial_glf_a0b05d33,train,40518,DIAL_GLF,لا وغزلان هذي من وين,لا وغزلان هذي من وين,,[],0,pending,,
mt_dial_lev_2a9b7523,train,45305,DIAL_LEV,كيف هالمنطق الغريب العجيب ؟ يعني بنلاحق الوافد في الاردن على شغل الاردني يتكبر عليه وحاسدينه على هالخمس ليرات اللي مغترب عن بلده وعياله عشان يوفر الهم لقمة خبز وبننسى انه فيه ما يقارب مليون اردني يعمل في الخارج خصوصا الخليج وبنزعل لما يرفضوا تجديد اقامتهم او يطردوهم من عملهم ! ! ! على اي اساس هالحكي ؟ ؟,كيف هالمنطق الغريب العجيب يعني بنلاحق الوافد في الاردن علي شغل الاردني يتكبر عليه وحاسدينه علي هالخمس ليرات اللي مغترب عن بلده وعياله عشان يوفر الهم لقمه خبز وبننسي انه فيه ما يقارب مليون اردني يعمل في الخارج خصوصا الخليج وبنزعل لما يرفضوا تجديد اقامتهم او يطردوهم من عملهم علي اي اساس هالحكي,,[],0,pending,,
mt_msa_f1e3fd7f,train,67759,MSA,وأسأل الله أن لا يحيجني إلا لوجهه الكريم,واسال الله ان لا يحيجني الا لوجهه الكريم,,[],0,pending,,
mt_dial_egy_971fcf61,train,34343,DIAL_EGY,يا تري ساعتها أحمد حسن اتوقف كام ماتش واتغرم كام ألف جنيه ؟ ؟,يا تري ساعتها احمد حسن اتوقف كام ماتش واتغرم كام الف جنيه,,[],0,pending,,
mt_dial_glf_a08939a9,train,16891,DIAL_GLF,والتفحيط بكثره وقطع الأشاره حلا . .,والتفحيط بكثره وقطع الاشاره حلا,,[],0,pending,,
mt_dial_lev_733770ba,train,25994,DIAL_LEV,واضح إنه الحكي راح يرجع يغلى من الجديد كنا دائما نقول ما في ارخص من الحكي خلينا نوفر معناته شوية حكي ونريح الحبال الصوتية ونريح اسماعنا اصلا ما في شي مهم,واضح انه الحكي راح يرجع يغلي من الجديد كنا دايما نقول ما في ارخص من الحكي خلينا نوفر معناته شويه حكي ونريح الحبال الصوتيه ونريح اسماعنا اصلا ما في شي مهم,,[],0,pending,,
mt_msa_75497c59,train,50981,MSA,صورة لكل من يخشى أن يغير الله علينا نعمه ويسلبنا فضله .,صوره لكل من يخشي ان يغير الله علينا نعمه ويسلبنا فضله,,[],0,pending,,
mt_dial_egy_a70a75cc,train,81431,DIAL_EGY,روح شوفلك فريق على ادك,روح شوفلك فريق علي ادك,,[],0,pending,,
mt_dial_glf_09a34715,train,53469,DIAL_GLF,والله والله والله نصيحه من محب . . يا معالي الوزير . . انت مبدع في هذا المجال . . اما الوزاره والله انها كبيره جدا وتحتاج الى شخص متميز ادارياً ومتفرغ تماماً لها . . والله لو ترجع للعمليات راح تكون فخر كبير للسعوديه وراح تجلب تميز لنا في هذا المجال . . ودع الوزاره فموجود من يستطيع ادارتها . . الله يوفقك . . وصدقني مافيها شي تطلب من الملك انك ترجع للحرس وفصل التوائم بالعكس راح تخدم نفسك وتخدم الوطن,والله والله والله نصيحه من محب يا معالي الوزير انت مبدع في هذا المجال اما الوزاره والله انها كبيره جدا وتحتاج الي شخص متميز اداريا ومتفرغ تماما لها والله لو ترجع للعمليات راح تكون فخر كبير للسعوديه وراح تجلب تميز لنا في هذا المجال ودع الوزاره فموجود من يستطيع ادارتها الله يوفقك وصدقني مافيها شي تطلب من الملك انك ترجع للحرس وفصل التوايم بالعكس راح تخدم نفسك وتخدم الوطن,,[],0,pending,,
mt_dial_lev_14e839f6,train,82577,DIAL_LEV,الاستاذ المشاغب علي الشريف والانيق مقالتلك ملغومه وانت تقصد اشخاص معيننين وانا لاني اكثر شخص ربما اتابعك اعرف من تقصد لكن فعلا يا استاذ علي الكرسي اصبغ مبلغ هم البعض بعيدا عن المصلحه العامه للانديه وفعلا اللي بكونوا يحكوا على الجوهري من وراه نفسهم بكونوا يمدحوا فيه قدامه يعني انفصام شخصيه,الاستاذ المشاغب علي الشريف والانيق مقالتلك ملغومه وانت تقصد اشخاص معيننين وانا لاني اكثر شخص ربما اتابعك اعرف من تقصد لكن فعلا يا استاذ علي الكرسي اصبغ مبلغ هم البعض بعيدا عن المصلحه العامه للانديه وفعلا اللي بكونوا يحكوا علي الجوهري من وراه نفسهم بكونوا يمدحوا فيه قدامه يعني انفصام شخصيه,,[],0,pending,,
mt_msa_48f1ecfa,train,9409,MSA,"ه مع أنّني لَم ألحَق بي هَذا النِظام المُسمى ب "" ساهر "" لكنني لاأستطيع الا أن أقول ( جزاك الله خيراً ) . . فنحنُ حقاُ شعبٌ ** وبِالأخص اذا كان الموضوع مُتعلقاً بِ شيءٍ اسمهُ س ي ا ر ة . .",ه مع انني لم الحق بي هذا النظام المسمي ب ساهر لكنني لااستطيع الا ان اقول جزاك الله خيرا فنحن حقا شعب وبالاخص اذا كان الموضوع متعلقا ب شيء اسمه س ي ا ر ه,,[],0,pending,,
mt_dial_egy_d6c521c4,train,39378,DIAL_EGY,علقت من قبل على هذا الموضوع وربنا,علقت من قبل علي هذا الموضوع وربنا,,[],0,pending,,
mt_dial_glf_7da2391e,train,4191,DIAL_GLF,اندية الرياض / الله يستر من الي,انديه الرياض الله يستر من الي,,[],0,pending,,
mt_dial_lev_105e79cb,train,77840,DIAL_LEV,حسبنا الله ونعم الوكيل اتساءل لايوجد قانون في الاردن يلاحق الخطاء الطبية وانا ايظا الخطاء الطبية افقدتنى ثلاثة اصابع من يدي شو ذنب هذا الشاب وهوا في عمر الورود خطاء طبي يفقده عينه وماذنب اهله حتى يتجرعوه مرارة ابنهم من اجل طبيب يقف في غرفة العمليات وماعنده نفس ان يقوم في عمله الانساني الحمد والشكرالى الله سبحانة وتعالى الي جاءة على هيك ومافقد الشاب,حسبنا الله ونعم الوكيل اتساءل لايوجد قانون في الاردن يلاحق الخطاء الطبيه وانا ايظا الخطاء الطبيه افقدتني ثلاثه اصابع من يدي شو ذنب هذا الشاب وهوا في عمر الورود خطاء طبي يفقده عينه وماذنب اهله حتي يتجرعوه مراره ابنهم من اجل طبيب يقف في غرفه العمليات وماعنده نفس ان يقوم في عمله الانساني الحمد والشكرالي الله سبحانه وتعالي الي جاءه علي هيك ومافقد الشاب,,[],0,pending,,
mt_msa_c028860f,train,1831,MSA,ان شاء الله ان يعيده الي اهله بعد غيابه كل هذه الفترة سالما,ان شاء الله ان يعيده الي اهله بعد غيابه كل هذه الفتره سالما,,[],0,pending,,
mt_dial_egy_10dd1794,train,52046,DIAL_EGY,مين الى اساء لسمعةمصر المخرج ولا البلطجى ؟ بلادفاع عن الغلط وتبرير الحماقة البلطجى لن يرجعى طالما امثالك يدافعون عنه انت وامثالك الذين تسيئون لسمعة مصر انشرومحدش,مين الي اساء لسمعهمصر المخرج ولا البلطجي بلادفاع عن الغلط وتبرير الحماقه البلطجي لن يرجعي طالما امثالك يدافعون عنه انت وامثالك الذين تسييون لسمعه مصر انشرومحدش,,[],0,pending,,
mt_dial_glf_3e9afbd0,train,57270,DIAL_GLF,اذا بغيتو تتكلمون عن الممثلات تنقيتوا احلى وحده وجبتو عنها اي,اذا بغيتو تتكلمون عن الممثلات تنقيتوا احلي وحده وجبتو عنها اي,,[],0,pending,,
mt_dial_lev_fa9a2915,train,14660,DIAL_LEV,بالعكس طول المباراه معتمدين ع مهارات فرديه رافت وعامر واحمد وسباح,بالعكس طول المباراه معتمدين ع مهارات فرديه رافت وعامر واحمد وسباح,,[],0,pending,,
mt_msa_a9db6cd9,train,75442,MSA,بقدوم الرئيس وزيارة سمو الأمير ودعم أعضاء الشرف ومحبي الزعيم التأهل هلالي بإذن,بقدوم الرييس وزياره سمو الامير ودعم اعضاء الشرف ومحبي الزعيم التاهل هلالي باذن,,[],0,pending,,
mt_dial_egy_10c18dbd,train,7705,DIAL_EGY,خلص الكلام . . . اتكلمتوا واستغربتوا وانتقدتوا واشتيكتوا . .,خلص الكلام اتكلمتوا واستغربتوا وانتقدتوا واشتيكتوا,,[],0,pending,,
mt_dial_glf_1fc730bc,train,73554,DIAL_GLF,الله يوفق الي راح يتوظفون,الله يوفق الي راح يتوظفون,,[],0,pending,,
mt_dial_lev_8cf3ae29,train,59901,DIAL_LEV,نفسي اشوف مستوى زي العالم بره,نفسي اشوف مستوي زي العالم بره,,[],0,pending,,
mt_msa_18c49033,train,66041,MSA,هلال كان افضل وضاع جمله,هلال كان افضل وضاع جمله,,[],0,pending,,
mt_dial_egy_6c128f21,train,48344,DIAL_EGY,احنا شاب عادى نفسنا بلدنا تتغير وتبقى,احنا شاب عادي نفسنا بلدنا تتغير وتبقي,,[],0,pending,,
mt_dial_glf_14b661c3,train,16547,DIAL_GLF,من الممكن مَعرفة عدد الإجآنب تشوفون سجلآت الجوآزآإت وآرشيفاتها - - والموآطنين عن طريق الأحوآل المدنيه .,من الممكن معرفه عدد الاجانب تشوفون سجلات الجوازاات وارشيفاتها والمواطنين عن طريق الاحوال المدنيه,,[],0,pending,,
mt_dial_lev_8e43647e,train,43274,DIAL_LEV,وحداتي وراح اضل وحداتي ولو حتى التغى نادي الوحدات لا قدر الله !,وحداتي وراح اضل وحداتي ولو حتي التغي نادي الوحدات لا قدر الله,,[],0,pending,,
mt_msa_952b0ede,train,39905,MSA,لا يوجد دليل واحد علئ احداث السودان المزعومة . انتم تتكلمون في فنجان مغلق فارغ نتن مثلكم يا من ارضهم من دهب و نساؤهم مع من طلب و رجالهم مع من غلب . العربية نعرفها احسن منكم بالرغم اننا لسنا عرب,لا يوجد دليل واحد علي احداث السودان المزعومه انتم تتكلمون في فنجان مغلق فارغ نتن مثلكم يا من ارضهم من دهب و نساوهم مع من طلب و رجالهم مع من غلب العربيه نعرفها احسن منكم بالرغم اننا لسنا عرب,,[],0,pending,,
mt_dial_egy_517abd20,train,43275,DIAL_EGY,جامدة بجد كركاتير يحمل اكتر من معنه الاول انسان منافق والثاني بيتريق على الاهبل او,جامده بجد كركاتير يحمل اكتر من معنه الاول انسان منافق والثاني بيتريق علي الاهبل او,,[],0,pending,,
mt_dial_glf_a50797a3,train,56910,DIAL_GLF,الواحد هنا ما يدخل المستشفى الا بالواسطات وحب الخشوم,الواحد هنا ما يدخل المستشفي الا بالواسطات وحب الخشوم,,[],0,pending,,
mt_dial_lev_efe16b74,train,23900,DIAL_LEV,يا اخوان زمان كانت السيارت هجنة وبالهات يابو الهات كل 3 ساعات تا تمر سيارة 190 او روفر مهو اصلا يا اخوان شوارعنا صارت فاردات مستمرة بمعنى اخر انه السير حتى بالقرى النائية ما بنقطع نهائيا وبتحدى اذا بتمشي فاردة ورا بعضها البعض اكثر من دقيقتين ثلاث انص كل عاقل ما يمشي مع فاردة لانه صار فيها مضرة وازعاج وتعطيل حركة سير و,يا اخوان زمان كانت السيارت هجنه وبالهات يابو الهات كل 3 ساعات تا تمر سياره 190 او روفر مهو اصلا يا اخوان شوارعنا صارت فاردات مستمره بمعني اخر انه السير حتي بالقري الناييه ما بنقطع نهاييا وبتحدي اذا بتمشي فارده ورا بعضها البعض اكثر من دقيقتين ثلاث انص كل عاقل ما يمشي مع فارده لانه صار فيها مضره وازعاج وتعطيل حركه سير و,,[],0,pending,,
mt_msa_131ec31f,train,2624,MSA,صدق من قال لجنة انحطاط والله .,صدق من قال لجنه انحطاط والله,,[],0,pending,,
mt_dial_egy_bc641121,train,25480,DIAL_EGY,الى كل الاخوة المسلمين المحترمين كفاية غلط و حرام الاهانة من غير سبب و هناك نقاط كثيرة ارجو الا تنسوها 1 - ان ربنا موجود و هو الوحيد اللى من حقه محاسبة كل انسان 2 - محدش من النصارى الكفرة المشركين طلب منكم الاحتفال معهم باعيدهم 3 - ربنا شرع الاديان السماوية ال 3 ومنها اليهودية والا لماذا تعترفون بسيدنا ابراهيم وسيدنا موسى عليهم السلام ؟ 4 من اين اتى لكم عيد الاضحى المبارك يا عالمون ببواطن الامور ؟ 5 - امثالكم هم مثيروا الفتنة و الايدى الخفية فى ايقادها فارجوكم خليكم فى عبادتكم و بلاش كل واحد يتحول لمفتى او واعظ و,الي كل الاخوه المسلمين المحترمين كفايه غلط و حرام الاهانه من غير سبب و هناك نقاط كثيره ارجو الا تنسوها 1 ان ربنا موجود و هو الوحيد اللي من حقه محاسبه كل انسان 2 محدش من النصاري الكفره المشركين طلب منكم الاحتفال معهم باعيدهم 3 ربنا شرع الاديان السماويه ال 3 ومنها اليهوديه والا لماذا تعترفون بسيدنا ابراهيم وسيدنا موسي عليهم السلام 4 من اين اتي لكم عيد الاضحي المبارك يا عالمون ببواطن الامور 5 امثالكم هم مثيروا الفتنه و الايدي الخفيه في ايقادها فارجوكم خليكم في عبادتكم و بلاش كل واحد يتحول لمفتي او واعظ و,,[],0,pending,,
mt_dial_glf_114c9b3d,train,56144,DIAL_GLF,اذكركم بتعليق الدغيثر عندما قال كيف يمر النصر بأزمة مالية ورئيسها فيصل بن تركي بن ناصر هذه مصيبة عظمى ، ما اؤلتش حاقه من,اذكركم بتعليق الدغيثر عندما قال كيف يمر النصر بازمه ماليه ورييسها فيصل بن تركي بن ناصر هذه مصيبه عظمي ما اولتش حاقه من,,[],0,pending,,
mt_dial_lev_d588ed98,train,36744,DIAL_LEV,مالو دراجان ولا مالو اكرم سلمان ابو الرباعيه,مالو دراجان ولا مالو اكرم سلمان ابو الرباعيه,,[],0,pending,,
mt_msa_55da3847,train,7115,MSA,"موقفي من فريقي لاني مشجع منتمي اظهر الايجابيات و السلبيات و اشجع فريقي دائما و لست من جمهور الافراح فقط و كان واضح تخليكم عن ناديكم بعد الموسم الماضي الذي خرجتم منه صفر اليدين وضح من مدرجاتكم الخاوية طوال الموسم , و لا تنسى ان الزعيم الاخضر التهم جميع البطولات وقتها",موقفي من فريقي لاني مشجع منتمي اظهر الايجابيات و السلبيات و اشجع فريقي دايما و لست من جمهور الافراح فقط و كان واضح تخليكم عن ناديكم بعد الموسم الماضي الذي خرجتم منه صفر اليدين وضح من مدرجاتكم الخاويه طوال الموسم و لا تنسي ان الزعيم الاخضر التهم جميع البطولات وقتها,,[],0,pending,,
mt_dial_egy_da8286f3,train,10274,DIAL_EGY,علي فكرة انا كلها كامشهر وهاستقيل من وزارة الصحة واسيب البلد لاي دولة ايا كانت بلا,علي فكره انا كلها كامشهر وهاستقيل من وزاره الصحه واسيب البلد لاي دوله ايا كانت بلا,,[],0,pending,,
mt_dial_glf_647936eb,train,19063,DIAL_GLF,*م مدام انك مو رجال ليش تتزوج من,م مدام انك مو رجال ليش تتزوج من,,[],0,pending,,
