example_id,source_split,source_row_id,dialect,original_text,normalized_text,masked_text,mask_spans_json,mask_count,annotation_status,annotator_model,notes
mt_dial_lev_a97fe432,train,38966,DIAL_LEV,يا سيدي الاحتمالات انه يمكن انفوز على سوريا ونتعادل مع,يا سيدي الاحتمالات انه يمكن انفوز علي سوريا ونتعادل مع,,[],0,pending,,
mt_msa_56d199af,train,32678,MSA,"يمتعك بالصحه والعافيه , ويبقى الود مابقى العتاب",يمتعك بالصحه والعافيه ويبقي الود مابقي العتاب,,[],0,pending,,
mt_dial_egy_99e890fb,train,80358,DIAL_EGY,نار ايه وجنة ايه لعنة الله على النساء وعلى من اوصلكم لمزاحمة,نار ايه وجنه ايه لعنه الله علي النساء وعلي من اوصلكم لمزاحمه,,[],0,pending,,
mt_dial_glf_01b27328,train,43443,DIAL_GLF,ماشاء الله تبارك الله . . إبداع متجدد . . منورة الجريدة يامرام أنت وصديقاتك . . عقبال ما أشوفكم دكتورات .,ماشاء الله تبارك الله ابداع متجدد منوره الجريده يامرام انت وصديقاتك عقبال ما اشوفكم دكتورات,,[],0,pending,,
mt_dial_lev_774514e1,train,37815,DIAL_LEV,للزعامه عنوان ان شاء الله كان يلعب مع حاله شو دخلنا يعني الفيصلي عريق من زمان شو دخلنا بالباقي يعني الناس وصلت القمر وانتو بعدكو تتعلمو اساسيات كرة,للزعامه عنوان ان شاء الله كان يلعب مع حاله شو دخلنا يعني الفيصلي عريق من زمان شو دخلنا بالباقي يعني الناس وصلت القمر وانتو بعدكو تتعلمو اساسيات كره,,[],0,pending,,
mt_msa_563fc468,train,33985,MSA,الله ياشيخ احمد يوفقك الى مايحب ويرضى لقدوضحت للجميع ان الدين يسروليس عسروتضييق ولكن هناك مشكله اجتماعيه وهي تربيت جيلين على الكره والتنقص من المراه الى درجة ان الشخص اصبح يرى من اكبرالعيوب ان تذكراسم امه او زوجته امام الناس وكانه جاءمن المريخ بدون ام وهذه ثقافه فكريه ظلاميه مورست لمده 50 سنه,الله ياشيخ احمد يوفقك الي مايحب ويرضي لقدوضحت للجميع ان الدين يسروليس عسروتضييق ولكن هناك مشكله اجتماعيه وهي تربيت جيلين علي الكره والتنقص من المراه الي درجه ان الشخص اصبح يري من اكبرالعيوب ان تذكراسم امه او زوجته امام الناس وكانه جاءمن المريخ بدون ام وهذه ثقافه فكريه ظلاميه مورست لمده 50 سنه,,[],0,pending,,
mt_dial_egy_8418cfbf,train,41517,DIAL_EGY,طيب حد يوضحلى اكتر هو العنوان العمارة فين بالظبط لانى بدور على شقة فى 6 اكتوبر ومش لاقى يمكن الاقى شقة فاضية فى نفس العمارة اللى حصل فيها,طيب حد يوضحلي اكتر هو العنوان العماره فين بالظبط لاني بدور علي شقه في 6 اكتوبر ومش لاقي يمكن الاقي شقه فاضيه في نفس العماره اللي حصل فيها,,[],0,pending,,
mt_dial_glf_1424defa,train,36672,DIAL_GLF,اتمنى تستفيد من الطرد للاعب,اتمني تستفيد من الطرد للاعب,,[],0,pending,,
mt_dial_lev_ba0a992c,train,48041,DIAL_LEV,الاتحاد كان من الواجب ان يكون مثالا للعمل الخيري وان يبتغى منه الاجر من رب العالمين ولكن ما بني على باطل فهو باطل قاعده شرعيه فاساسه اليانصيب الشري ان جاز التعبير فماذا نرجو منه الا كما ذكر وكذلك بعض الاعضاء ممن حل الاتحاد بسببهم في الثمانينات نتيجة اختلاسات ماليه وتذاكر سفر مزوره ووتولوا . . . وعادوا الى الاتحاد لمصالح شخصيه وعدائيه لبعض الجمعيات وها هو الاتحاد حل بسببهم وقد شوهوا العمل الاجتماعي ولانستبعد ان يعودوا الى ترشيح انفسهم لحاجات في انفسهم لقد وصل العمل الاجتماعي الى الحضيض وللاسف ولاننسى فضل المخلصين والمحبين للعمل الاجتماعي التطوعي املا ان تبقى عيون السلطه بالمرصاد مع العلم بان القضاء قد تعاطف معهم او مع بعضهم وان ربك لبلمرصاد,الاتحاد كان من الواجب ان يكون مثالا للعمل الخيري وان يبتغي منه الاجر من رب العالمين ولكن ما بني علي باطل فهو باطل قاعده شرعيه فاساسه اليانصيب الشري ان جاز التعبير فماذا نرجو منه الا كما ذكر وكذلك بعض الاعضاء ممن حل الاتحاد بسببهم في الثمانينات نتيجه اختلاسات ماليه وتذاكر سفر مزوره ووتولوا وعادوا الي الاتحاد لمصالح شخصيه وعداييه لبعض الجمعيات وها هو الاتحاد حل بسببهم وقد شوهوا العمل الاجتماعي ولانستبعد ان يعودوا الي ترشيح انفسهم لحاجات في انفسهم لقد وصل العمل الاجتماعي الي الحضيض وللاسف ولاننسي فضل المخلصين والمحبين للعمل الاجتماعي التطوعي املا ان تبقي عيون السلطه بالمرصاد مع العلم بان القضاء قد تعاطف معهم او مع بعضهم وان ربك لبلمرصاد,,[],0,pending,,
mt_msa_2febeb26,train,81340,MSA,"مرحبا اباايمن , بعض التجارب لايمكن تعميمها حيث أن الكثير من الأخيار وأهل الخلق والفضل تجدهم ينخدعون مرات عديدة حينما ترق مشاعرهم مرة أخرى ويصدقون الأفلام التي تمر أمامهم وتتكرر الأخطاء , ولكن يبقى صاحب الفضل وصاحب الفضيلة رمزا واضحا للجمع المشهود , ويوما سعيدا يادكتور والجميع . . . ! !",مرحبا اباايمن بعض التجارب لايمكن تعميمها حيث ان الكثير من الاخيار واهل الخلق والفضل تجدهم ينخدعون مرات عديده حينما ترق مشاعرهم مره اخري ويصدقون الافلام التي تمر امامهم وتتكرر الاخطاء ولكن يبقي صاحب الفضل وصاحب الفضيله رمزا واضحا للجمع المشهود ويوما سعيدا يادكتور والجميع,,[],0,pending,,
mt_dial_egy_fe0cd19a,train,34197,DIAL_EGY,حبة أستفسر بخصوص بنتي لو سمحتم,حبه استفسر بخصوص بنتي لو سمحتم,,[],0,pending,,
mt_dial_glf_5a704b11,train,48131,DIAL_GLF,وياء اخوان انتبهو من ترك سياراتكم شغاله ؛ ؛,وياء اخوان انتبهو من ترك سياراتكم شغاله,,[],0,pending,,
mt_dial_lev_4f83b0cd,train,57412,DIAL_LEV,شو بدي اقلك يعني ، عادي طالب شركة الطيران بتعويض ولا اسهل,شو بدي اقلك يعني عادي طالب شركه الطيران بتعويض ولا اسهل,,[],0,pending,,
mt_msa_03007ee2,train,23532,MSA,خاتمة حسنة إن شاء الله .,خاتمه حسنه ان شاء الله,,[],0,pending,,
mt_dial_egy_fc66ab65,train,73849,DIAL_EGY,بيرشح نفسه للرئاسة واول شئ يعمله انه بيأكد من البداية انه راجل عشوائى وغير منظم وغاوى قفل الطرق وانتشار الامن المركزى فى الشوارع وتعطل حركة المرور يعنى من قبل ما تبقى رئيس ناوى تذود اللخبطه اللى فى حياتنا اكتر ماهى متلخبطه . . . ارحمنا ببوزك الناشف ده . . هو كل واحد مسك رغيف عيش فى مجلس الشعب عايز يبقى رئيس جمهورية . . . ومن الاخر انت وجمال لا تصلحوا للرئاسة ولا حتى البرادعى اللى مش عارف مين احمد عز ! ! ! جاى يحل مشاكل مصر ويركب علينا ويبقى رئيس جمهورية وهو مش عارف مين احمد عز ! طيب انت جاى ليه ؟ انت كنت رايح تجيب جاز ايه اللى قعدك على البوتجاز ؟ ؟ ؟ ! !,بيرشح نفسه للرياسه واول شي يعمله انه بياكد من البدايه انه راجل عشوايي وغير منظم وغاوي قفل الطرق وانتشار الامن المركزي في الشوارع وتعطل حركه المرور يعني من قبل ما تبقي رييس ناوي تذود اللخبطه اللي في حياتنا اكتر ماهي متلخبطه ارحمنا ببوزك الناشف ده هو كل واحد مسك رغيف عيش في مجلس الشعب عايز يبقي رييس جمهوريه ومن الاخر انت وجمال لا تصلحوا للرياسه ولا حتي البرادعي اللي مش عارف مين احمد عز جاي يحل مشاكل مصر ويركب علينا ويبقي رييس جمهوريه وهو مش عارف مين احمد عز طيب انت جاي ليه انت كنت رايح تجيب جاز ايه اللي قعدك علي البوتجاز,,[],0,pending,,
mt_dial_glf_0a63058f,train,16599,DIAL_GLF,ولا من جده يحسب للنصر حساب لو انا مكانه كان اقول للاعبين الوعد الاستاد يوم الاحد بدون خطه او,ولا من جده يحسب للنصر حساب لو انا مكانه كان اقول للاعبين الوعد الاستاد يوم الاحد بدون خطه او,,[],0,pending,,
mt_dial_lev_5cda1c3e,train,16790,DIAL_LEV,اصلا في هذه الحاله نحكي سبحان الله ربك الملهم وربك عالم الغيب وليس حيوان مخلوق كيف للمخلوق ان يتنبا بوضع امه بكاملها والاخوه العراقيين بدكم تتنبأو بسمتقبل بلدكم عن طريق,اصلا في هذه الحاله نحكي سبحان الله ربك الملهم وربك عالم الغيب وليس حيوان مخلوق كيف للمخلوق ان يتنبا بوضع امه بكاملها والاخوه العراقيين بدكم تتنباو بسمتقبل بلدكم عن طريق,,[],0,pending,,
mt_msa_bfcf0c15,train,22430,MSA,الحمد لله انا بعيد جدا عن هذا السوق,الحمد لله انا بعيد جدا عن هذا السوق,,[],0,pending,,
mt_dial_egy_e4fa5372,train,15084,DIAL_EGY,"يا ابناء العمومة ولا يهمكم انتم مرحب بكم في بلدكم الثاني جزائر العزة والكرامة في ملعب 5 جويلية مع الفريق الوطني "" الخضرة "" وبحضور 200 الف متفرج بما فيهم روراوة و كل لاعبي ومناصري دول اتحاد شمال افريقيا وستكتشفون ان الجزائريين سيشجعونكم ويكونون معكم حتلى ولو على حساب الخضرة واكيد ستندهشون من اصالة وجمال وعروبة وبربرية وضيافة البلد اللدي كان متنفس و محبوب لدى الراحل ياسر عرفات والشاعر درويش . . . اهلا وسهلا بالاحباء ان لم يشلكم ترابالشهداء حنشلكم على رموش عيوننا . .",يا ابناء العمومه ولا يهمكم انتم مرحب بكم في بلدكم الثاني جزاير العزه والكرامه في ملعب 5 جويليه مع الفريق الوطني الخضره وبحضور 200 الف متفرج بما فيهم روراوه و كل لاعبي ومناصري دول اتحاد شمال افريقيا وستكتشفون ان الجزايريين سيشجعونكم ويكونون معكم حتلي ولو علي حساب الخضره واكيد ستندهشون من اصاله وجمال وعروبه وبربريه وضيافه البلد اللدي كان متنفس و محبوب لدي الراحل ياسر عرفات والشاعر درويش اهلا وسهلا بالاحباء ان لم يشلكم ترابالشهداء حنشلكم علي رموش عيوننا,,[],0,pending,,
mt_dial_glf_d63ab464,train,10330,DIAL_GLF,بصراحه دمك خفيف واستمتعت بسواليفك بس في نقطه مهمه . .,بصراحه دمك خفيف واستمتعت بسواليفك بس في نقطه مهمه,,[],0,pending,,
mt_dial_lev_a8a7a4b9,train,67405,DIAL_LEV,يعنى ياجماعة حلو المشاكل الى سايرة امعانا بعدين جيبو الى بدكم ياة لانو فى المستقبل ما راح تلاقوة حدا يسجل لانو الناس بتكون روحت على,يعني ياجماعه حلو المشاكل الي سايره امعانا بعدين جيبو الي بدكم ياه لانو في المستقبل ما راح تلاقوه حدا يسجل لانو الناس بتكون روحت علي,,[],0,pending,,
mt_msa_e624ade9,train,35972,MSA,2 - عندما يقوم شخص بتقديم إجابة معينة يتراجع عنها فيما بعد ،,2 عندما يقوم شخص بتقديم اجابه معينه يتراجع عنها فيما بعد,,[],0,pending,,
mt_dial_egy_b1538455,train,70599,DIAL_EGY,وإلى جماهير النادى الجهلى تعودنا منكم البلطجة والهمجية وقلة الأدب وتاريخكم سجل اسود فيه كل الموبقات من حرق ملاعب وحرق مواطن بالبنزين وضرب مشجع بالمطواة وتحطيم سيارات وتدخين بانجو داخل النادى والمتاجرة فى المخدرات فبلاش تعملوا فيها خضرة,والي جماهير النادي الجهلي تعودنا منكم البلطجه والهمجيه وقله الادب وتاريخكم سجل اسود فيه كل الموبقات من حرق ملاعب وحرق مواطن بالبنزين وضرب مشجع بالمطواه وتحطيم سيارات وتدخين بانجو داخل النادي والمتاجره في المخدرات فبلاش تعملوا فيها خضره,,[],0,pending,,
mt_dial_glf_06d79d3b,train,1883,DIAL_GLF,تصدق صاروا يعرفون عن الهلال اكثر من مايعرفون عن فريقهم المخجل ! من كثر مايبحثون بتاريخ الهلال,تصدق صاروا يعرفون عن الهلال اكثر من مايعرفون عن فريقهم المخجل من كثر مايبحثون بتاريخ الهلال,,[],0,pending,,
mt_dial_lev_16e54816,train,30412,DIAL_LEV,شو بدهم يجيبوا ال 2000 دينار ! ! ! يعني الاخت بدها تتزوج ذهب مش زلمه ! ! ! اي منيح أنه لسه في ناس بتتزوج هاالايام انا برأي الناس مش راحمه حالهاو همهم المظاهر بس مش الفكره الرئيسيه من الزواج . ويسالونك عن العنوسه ! !,شو بدهم يجيبوا ال 2000 دينار يعني الاخت بدها تتزوج ذهب مش زلمه اي منيح انه لسه في ناس بتتزوج هاالايام انا براي الناس مش راحمه حالهاو همهم المظاهر بس مش الفكره الرييسيه من الزواج ويسالونك عن العنوسه,,[],0,pending,,
mt_msa_8bdf5281,train,13579,MSA,هل هذه غصة بسبب قدرة شباب وناشئين النصر على احراز 3,هل هذه غصه بسبب قدره شباب وناشيين النصر علي احراز 3,,[],0,pending,,
mt_dial_egy_a6411f24,train,39801,DIAL_EGY,طيب ما الشعب المصري كله المفروض يدخل موسوعه جينس لانه 9000 سنه وهو مظلوم,طيب ما الشعب المصري كله المفروض يدخل موسوعه جينس لانه 9000 سنه وهو مظلوم,,[],0,pending,,
mt_dial_glf_8b36a682,train,84799,DIAL_GLF,قد صرت اتلام واسكت واحسب حساب كل,قد صرت اتلام واسكت واحسب حساب كل,,[],0,pending,,
mt_dial_lev_4ec8712e,train,50760,DIAL_LEV,وتحياتي ل كاسياس انقذ الفريق من اهداف محققه بفضل خبرته وتركيزه العالي يستاهلو الاسبان كلهم نجوم بدون منازع حتى اصغرهم نجم مبروك النجمه الاولى وعقبال الثانيه,وتحياتي ل كاسياس انقذ الفريق من اهداف محققه بفضل خبرته وتركيزه العالي يستاهلو الاسبان كلهم نجوم بدون منازع حتي اصغرهم نجم مبروك النجمه الاولي وعقبال الثانيه,,[],0,pending,,
mt_msa_bac7048a,train,34745,MSA,يلعب الزعيم في مباراته اليوم امام شقيقه فريق الرمثا في تحديد الفريق الذي سيتاهل الى الدور الثاني من بطولة كاس الاردن واتوقعها ان تكون مباراة حامية الوطيس وستنتهي لصالح الفيصلي 2 \,يلعب الزعيم في مباراته اليوم امام شقيقه فريق الرمثا في تحديد الفريق الذي سيتاهل الي الدور الثاني من بطوله كاس الاردن واتوقعها ان تكون مباراه حاميه الوطيس وستنتهي لصالح الفيصلي 2,,[],0,pending,,
mt_dial_egy_d18ed9fc,train,18296,DIAL_EGY,خلاص انتهى كل شيئ ممكن نتمسك بيه حتى الحياء,خلاص انتهي كل شيي ممكن نتمسك بيه حتي الحياء,,[],0,pending,,
mt_dial_glf_42f749b6,train,16327,DIAL_GLF,اول شي انت لست من هيئة كبار العلماء حتى تصرح وتفتي ولا انت من المشايخ الثقات حتى يوخذ بكلامك *وع طاري قينان وطقته ما بينكم اختلاف الفكر واحد والهدف الخبيث واحد ولكن تحلمون . .,اول شي انت لست من هييه كبار العلماء حتي تصرح وتفتي ولا انت من المشايخ الثقات حتي يوخذ بكلامك وع طاري قينان وطقته ما بينكم اختلاف الفكر واحد والهدف الخبيث واحد ولكن تحلمون,,[],0,pending,,
mt_dial_lev_67e1c9c8,train,29924,DIAL_LEV,مسا الورد عالورد يا سيف ال,مسا الورد عالورد يا سيف ال,,[],0,pending,,
mt_msa_c121145e,train,46310,MSA,لا يمكنك الا ان تعجب بالوزير الطبيب . . الاحساس بمتعة الانجاز و العطاء تراه في عينيه . . جزاك الله خيرا عن امة,لا يمكنك الا ان تعجب بالوزير الطبيب الاحساس بمتعه الانجاز و العطاء تراه في عينيه جزاك الله خيرا عن امه,,[],0,pending,,
mt_dial_egy_2dc6e166,train,78745,DIAL_EGY,الى اخواني الاهلويه احب ااكدلكم انه مفيش منافسه للاهلي طول ما الاهلي بيكسب . . . ياريت تتجاهلو متعمدي اثارة الفتن والمستفزين ومفتعلي الزيطه والزمبليطه بالاونطه لان متوجدش منافس حتى الان للاهلي . . . واقصى مانتمناه من الزمالك مباراه محترمه امام بطل مصر وثالث العالم تثبت للعالم قوة الدوري المصري الذي انتج اعظم منتخب في تاريخ افريقيا وكذلك نود كمصريون اهلويه زمالك قوي من اجل تشريف الكره المصريه في المعترك الافريقي للعام القادم وشكرا . .,الي اخواني الاهلويه احب ااكدلكم انه مفيش منافسه للاهلي طول ما الاهلي بيكسب ياريت تتجاهلو متعمدي اثاره الفتن والمستفزين ومفتعلي الزيطه والزمبليطه بالاونطه لان متوجدش منافس حتي الان للاهلي واقصي مانتمناه من الزمالك مباراه محترمه امام بطل مصر وثالث العالم تثبت للعالم قوه الدوري المصري الذي انتج اعظم منتخب في تاريخ افريقيا وكذلك نود كمصريون اهلويه زمالك قوي من اجل تشريف الكره المصريه في المعترك الافريقي للعام القادم وشكرا,,[],0,pending,,
mt_dial_glf_f0c46209,train,85172,DIAL_GLF,عطوني أبن همام - يابن همام والله أنك ترفع الرأس وتستاهل رئاسة الاتحاد الدولي لكرة القدم وأن حصل هذا الشيئ فأنه فخر لكل عربي أصيل - واثق الخطوة يمشي ملكا -,عطوني ابن همام يابن همام والله انك ترفع الراس وتستاهل رياسه الاتحاد الدولي لكره القدم وان حصل هذا الشيي فانه فخر لكل عربي اصيل واثق الخطوه يمشي ملكا,,[],0,pending,,
mt_dial_lev_d076f5ee,train,44592,DIAL_LEV,انا بنصح في السن هاد او,انا بنصح في السن هاد او,,[],0,pending,,
mt_msa_2a1a7c5e,train,59756,MSA,ولهذ النوع من الاعتداء معناه وهو عمل كما افهم انا مخابراتى من نوع قد يكون فى اطار شبه شرعى,ولهذ النوع من الاعتداء معناه وهو عمل كما افهم انا مخابراتي من نوع قد يكون في اطار شبه شرعي,,[],0,pending,,
mt_dial_egy_e0c5568c,train,62776,DIAL_EGY,والسؤال الأهم هل مصر حقاً دولة مؤسسات وديمقراطية . . انتم مصدقين التمثلية وعايشين فيها,والسوال الاهم هل مصر حقا دوله موسسات وديمقراطيه انتم مصدقين التمثليه وعايشين فيها,,[],0,pending,,
mt_dial_glf_d2cacb6d,train,47169,DIAL_GLF,على العموم الله يعينكم معد فيه امل,علي العموم الله يعينكم معد فيه امل,,[],0,pending,,
mt_dial_lev_f0acd63a,train,25382,DIAL_LEV,في ناس مشتهين الاطفال و انتي نازلة ذبح,في ناس مشتهين الاطفال و انتي نازله ذبح,,[],0,pending,,
mt_msa_136d940a,train,65896,MSA,• للقطط أكثر من مائة صوت بينما للكلاب عشرة أصوات ، والعربي بلا صوت,للقطط اكثر من مايه صوت بينما للكلاب عشره اصوات والعربي بلا صوت,,[],0,pending,,
mt_dial_egy_522a4586,train,36518,DIAL_EGY,حسام حسن هو وأخوه دول شويه صيع وبلطجيه . . إنت مين إنت يا ذلومه يا أقرع علشان تعاقب أنضف باك في مصر . . بس العيب مش فيك العيب في الحمار إلي عينك مدير فني لنادي الزمالك . . وبقول الهاني سعيد أنا لو منك أسيبهم وأروح الأهلي السنه الجايه . . والله أنا زملكاوي بس كرهت الزمالك من ساعه الجاموستين الأخوه حسن ما,حسام حسن هو واخوه دول شويه صيع وبلطجيه انت مين انت يا ذلومه يا اقرع علشان تعاقب انضف باك في مصر بس العيب مش فيك العيب في الحمار الي عينك مدير فني لنادي الزمالك وبقول الهاني سعيد انا لو منك اسيبهم واروح الاهلي السنه الجايه والله انا زملكاوي بس كرهت الزمالك من ساعه الجاموستين الاخوه حسن ما,,[],0,pending,,
mt_dial_glf_97c72e90,train,85584,DIAL_GLF,باتوفيق يااحلا فريق عقابل الهلال والشباب يكونو,باتوفيق يااحلا فريق عقابل الهلال والشباب يكونو,,[],0,pending,,
mt_dial_lev_d24779d7,train,40344,DIAL_LEV,على كل حال . . من زمان ما تجادلنا وتبالشنا مع بعض . . وتحياتي لكل الاخوة الوحداتيين المحترمين مثلك يا صديقي,علي كل حال من زمان ما تجادلنا وتبالشنا مع بعض وتحياتي لكل الاخوه الوحداتيين المحترمين مثلك يا صديقي,,[],0,pending,,
