example_id,source_split,source_row_id,dialect,original_text,normalized_text,masked_text,mask_spans_json,mask_count,annotation_status,annotator_model,notes
mt_dial_lev_8e38b5b7,train,79975,DIAL_LEV,محمد رمضان شاب طموح بيغني اغاني طربية زي ام كلوم اللي عشقها العرب وقدسوها ولما كانوا يسمعولها ما كانو يذكروا حرب ال 67 وغيروا من,محمد رمضان شاب طموح بيغني اغاني طربيه زي ام كلوم اللي عشقها العرب وقدسوها ولما كانوا يسمعولها ما كانو يذكروا حرب ال 67 وغيروا من,,[],0,pending,,
mt_msa_8577ed57,train,51126,MSA,قبل ان اتكلم بما اريد اوجه التحيه الى الاعب عامر ذيب على روحه الرياضيه العاليه التي امتاز بها وذلك عندما كان لاعب الحسين مصاب وهو على الارض قام بارسال الكره خارج الملعب علما انه كان في وضع مناسب لتسديد الكره على مرمى فريق الحسين فله ما جمهور الحسين كل,قبل ان اتكلم بما اريد اوجه التحيه الي الاعب عامر ذيب علي روحه الرياضيه العاليه التي امتاز بها وذلك عندما كان لاعب الحسين مصاب وهو علي الارض قام بارسال الكره خارج الملعب علما انه كان في وضع مناسب لتسديد الكره علي مرمي فريق الحسين فله ما جمهور الحسين كل,,[],0,pending,,
mt_dial_egy_cad734d6,train,18612,DIAL_EGY,الناس الجهلة اللى بدتعى علية لايفقهون ولا يعرفنة هذا الرجل خدم بجد اهل البلد وخدمات عامة وخدمات شخصية وسيبك من اخذ حق الناس لو معملش كدة مع اهل بلدة غيرة هيعملة وبلاش اللنغمة دى علشان النظام كلة فاشل ولا يقدر قيمة كمال الشاذلى الا اهلة وبلدة فقط ولا عزاء للحاقدين مع تحياتى ا بو مازن محمد شعراوى,الناس الجهله اللي بدتعي عليه لايفقهون ولا يعرفنه هذا الرجل خدم بجد اهل البلد وخدمات عامه وخدمات شخصيه وسيبك من اخذ حق الناس لو معملش كده مع اهل بلده غيره هيعمله وبلاش اللنغمه دي علشان النظام كله فاشل ولا يقدر قيمه كمال الشاذلي الا اهله وبلده فقط ولا عزاء للحاقدين مع تحياتي ا بو مازن محمد شعراوي,,[],0,pending,,
mt_dial_glf_7c6809f6,train,1613,DIAL_GLF,يوه وش هالمكياج فضو العلبه كلها,يوه وش هالمكياج فضو العلبه كلها,,[],0,pending,,
mt_dial_lev_c9f8c5b3,train,12346,DIAL_LEV,وبتحكوا ليش زادت الجرائم . السبب واضح . المجرم يكافىء بالسجن لانه يحصل على مسكن ومأكل ببلاش احسن من غيره . .,وبتحكوا ليش زادت الجرايم السبب واضح المجرم يكافيء بالسجن لانه يحصل علي مسكن وماكل ببلاش احسن من غيره,,[],0,pending,,
mt_msa_7e43aac2,train,47929,MSA,اتمنى ان نشاهد مباراة تليق,اتمني ان نشاهد مباراه تليق,,[],0,pending,,
mt_dial_egy_ab531bd0,train,75937,DIAL_EGY,الزمالك الزمالك الزمالك الزمالك هتفضل كبير مهما عملوا هنفضل نشجع اما نتموت نبطل نشجعك الزمالك معاك ضدعصابات,الزمالك الزمالك الزمالك الزمالك هتفضل كبير مهما عملوا هنفضل نشجع اما نتموت نبطل نشجعك الزمالك معاك ضدعصابات,,[],0,pending,,
mt_dial_glf_7c1b05e1,train,41258,DIAL_GLF,ولو تسال الي رفض المقترح تقوله كم عندك من عامل يمكن عشره غير المؤسسات,ولو تسال الي رفض المقترح تقوله كم عندك من عامل يمكن عشره غير الموسسات,,[],0,pending,,
